,content,mark
983484,市场走出探底针，散户庆祝把歌唱,-99
5189576,到了该远离股市的时候了！ 现实板的风险教育课,-99
1152339,天空飘来五个字：去尼。,-99
113072,这是哪位兄弟，天天再砸个跌停，然后撤单，我佩,-99
2517780,下跌才刚刚开始，你们以为这是底，其实这里连山,-99
2593662,套马的，我好像买了个假股票。还双黄金旅游，我,-99
3581065,辣鸡到不能直视！,-99
4863011,19元左右补点可以,-99
796921,生意失败巨额外债 单亲,-99
4099615,央企整合重点板块之一 首艘国产001A航母巨龙下,-99
3042443,万亿规模“国”字头基金助力国企改革 上海国企,-99
1330704,时不我待，军工板块，一个唯一可以再次凝聚人气,-99
4110650,未来六年全中国挖掘好公司是个主流,-99
2647859,真是有良心的好庄，天天砸出低点让你低位抢反弹,-99
3873714,三季度业绩几号公布？,-99
2166003,接下来就是见证奇迹的时刻了,-99
2768701,死气沉沉何时了？,-99
114929,涨停！涨停！下周涨停,-99
1313824,销售利润增长所致。今年以来维生素价格上涨幅度,-99
1186030,铅锌大涨对公司多少有点利好吧,-99
3941373,k线好西劲,-99
1337180,金地集团，你有病，指数涨17点啊，你没涨,-99
340111,这才是芯片大哥啊，有几人识的？,-99
3209464,刚刚上市，就这么多问题，怎么回事,-99
1170010,不要幻想了，好不好啊！今天就一分钱的玩了，上,-99
2897488,上次也是市长到百联调研，二月份时候的事，反正,-99
30893,早盘竞价明显就是诱多。\t,-99
5445629,我卖了，尾盘或明早再来接，做个差价，太怂了,-99
1648878,立马封板。哈哈哈哈,-99
4713999,你奶奶,-99
2103630,嘉宝再现大宗交易，明显光大在打压增持，过几天,-99
3495986,妈的，28.8进了5000股，这下完了,-99
2577689,什么情况。,-99
4073416,主力真是穷逼,-99
5419609,破位股冲高是出来的好机会,-99
1771552,走势上面不是很流畅！而一些八部分的小票中,-99
5164234,依然有大单砸盘，没完没了，到底是谁呢,-99
5207497,小散不死，空头不止，上方还有死捂筹码,-99
963879,确认顶背离，短期顶出现,-99
3863072,概念不少，就是不涨啊\t,-99
4615475,求中签,-99
4512533,没庄 涨一点就要出,-99
4294003,股票一般分为成长股、价值股、周期股三类，能给,-99
4108813,还没有跌死跌透，套多了的关机睡觉，微套的随时,-99
2205875,大盘就算涨到3500点城投也不会涨的，为啥呢？,-99
5287561,庄家大哥，今天冲关日，基建领头，你倒是动动啊,-99
1141209,并且该预测需经公司董事会审议的规定。,-99
635507,大家，大胆的，优选个股进行建仓，加仓，决不要,-99
1187143,抄底逃顶术，波段绝杀技,-99
5045465,跌深才有故事，不然]戏。,-99
1000376,此外，中央汇金资产管理有限责任公司在二季度持,-99
5284001,侦察一下,-99
3646386,调整充分，接下来就看他得了,-99
221227,今天买的深中华A现在还是绿的，期待下周能拉升,-99
3744904,看这熊样，又到顶了,-99
2174039,[鼓掌][满仓][满仓][满仓][满仓][抄底][抄底][,-99
5250539,今年，其实本可以做到高抛。今年4月，大盘到330,-99
1112089,快讯：明天秦皇岛港网上发行将带动港口板块暴涨,-99
1663336,涨停价我已,-99
3703336,摩通增持中国中铁1178万股 每股6.009元,-99
564362,〈警报！超过1100家上市公司在抛售房产,-99
2132255,你这是准备把你妈了个老逼跌出来吗,-99
2920634,老板很惋惜,-99
4942137,复牌，除权后14块钱的筹码，如果补跌就加仓。我,-99
4719414,杀掉空狗 就会有一片蔚蓝的天空,-99
1121835,上海自由贸易港概念股集体大涨 港口股好了，振,-99
3700708,我在7元等你,-99
2378318,不跟涨 只跟爹 大商缺爹[赞][赞][赞],-99
4401636,二哈快来，卖20手的,-99
4758129,太阳从西边升起了,-99
2512283,新华保险不,-99
2210455,5年产值将达千亿 上海的数据港 北高新600604:上,-99
3751292,2017年，10月，11月，12 月，合计2000万股解禁,-99
672762,小心下午翻绿跳水~,-99
3959479,快买，要拉涨停了,-99
326326,股权分散的优质上市公司相当于落到了狼嘴里,-99
3183130,晨鸣应该慢慢地涨股价，等等长电？,-99
5552811,603998:方盛制药2017年第二次临时股东大会会议,-99
1749305,长园反弹在即,-99
1964247,关于公司募,-99
4317989,嘛比穷庄吸半年货了还不干压什么呢？,-99
2854936,行业中的奇葩,-99
264907,补充公司流动资金,-99
4753537,就这垃圾能跟谁比,-99
3203009,节后涨升五百点属于小涨!!,-99
215625,北京城建,-99
338434,同方的市值与企业规模是不匹配的，价值低估是肯,-99
985433,之前让大家介入的南钢股份也是不错，后续还有热,-99
3467331,和宝色股份一样,-99
2360801,散户不要抄底了不然会更低，现在格力散户抄底太,-99
4228454,江化微：你不鸣则已，一鸣惊人！因为你有这种潜,-99
3500781,下午暴跌6个点 大盘连续上涨获利盘太多后面讲是,-99
4627004,此股无庄，对于走势也根本没有任何技术可言，,-99
1305581,跌我就补，坚持破5元,-99
949133,华测百元股市盈才50，北导650，,-99
1473129,三元股份主营农副食品，近期以来股价一路回调，,-99
3792674,魏建军你就是个怂人，就让那些流氓这样随便砸你,-99
3043709,不要在这里穷几把折腾，打压要买的，不拉不卖的,-99
1174582,国机汽车(600335)融资融券信息(08-17),-99
2274454,卖了也后悔,-99
4219587,已经到了跌无可跌的境地了,-99
1131282,600133.600758.600067.600123今后牛股,-99
1592199,不不不v发低调低调我去,-99
4127234,如果最近权,-99
2596679,江中药业(600750)融资融券信息(12-11),-99
2902375,主力不发力，股价顺量下。,-99
4101042,尾盘直线涨停,-99
5533944,明天星期四！接着就是端午劫！周五跳水买！,-99
764940,主力今天再压一天，哥今天信用卡账单日，等周一,-99
1981389,另一方面k,-99
1750697,工信部能大,-99
912163,表22－1 三个组合策略的重要比率（以美元为单位,-99
2384203,2018年600696去星摘冒！定增海银财富整体借壳上,-99
2652201,玩大了一鹏起万里应该是和广通未来的业务有交集,-99
678310,决方信雅达(600571)传统业务保持领先，金融科技,-99
2889892,公司还在吗,-99
2096017,难怪说发动机师爷的时候一帮二货没点反应。干西,-99
3646499,一季报无需审计，看起来很靓丽。,-99
2650095,减仓？增仓？建仓？,-99
3890861,对标中石油，看洲际的核心竞争力,-99
904852,我觉得稀土股是错杀，国家努力了那么多年想把稀,-99
2686390,已经回到起点了，还有什么可以恐慌的！,-99
5548416,谁X葱跌停拉到涨停，我在涨停版等你,-99
2075943,中基协成立资产证券化专业委员会 备案规模破万,-99
976376,中央商场刚刚突破一整年调整的箱顶,-99
4381093,但也让绝大多数人不讨厌,-99
3879679,广州花都集中推出4宗地块，总用地面积约8,-99
4678452,"444,888",-99
4155776,等主力砸出空间再买不迟，抄就抄老底，不可凭一,-99
2969761,共同发财重仓；岱勒新材我有，360天业股份我有,-99
1231749,实盘公开：今天抄底了，抄底了。,-99
4440446,2017山东富豪榜洗牌：百亿富豪8位 张士平首富王,-99
4540977,中国股市跟跌不跟涨今天收关战完了,-99
1425395,傻鸟 你全家在天有灵  保佑你能活下去,-99
3983286,吹牛第一,-99
4380078,狗庄你天天吃屎都吃不饱吗？,-99
2004762,亏的好惨啊,-99
4591025,希望你在跌停2天[鼓掌],-99
3432787,360如果接客！最少十倍！。,-99
2861735,利好下周纷至沓来，中路股份8月14日大概率涨停,-99
2009137,下跌的速度还是很快的嘛,-99
1186253,蓝狐君对于中国“新白马股”的思考之三,-99
1497277,大单出手了，完蛋了，后市堪舆！！！,-99
3048093,金股布局来了！ju,-99
3151491,大盘这样涨，你不涨，'走我，等大盘跳水我,-99
4002317,601968这样的庄很容易看透，当天上午急拉，下午,-99
4382130,坚守了一个月还是这个鸟样，换不换呢？,-99
3119010,这就是你们的报应。哈哈。。。,-99
648553,托儿！没有,-99
1386069,垃圾，看看人家宝泰[大笑],-99
2082276,金枫有题材吗？（除上海国资概念外）,-99
5424840,明天还有一二个点的调整,-99
845768,600241,-99
4757412,哥。差不了吧,-99
3671182,1.5个点跑了，这货今天没搞头,-99
5134437,散户打闹，就这样了。,-99
168009,没想到早盘3.7跑到最高点[大笑],-99
1665038,而是集中精力谋求公司的发展凭借,-99
5288803,一根穿云箭，千军万马来相见。老乡别跑……嘻嘻,-99
3164744,我还在持有你，到七元，不离不弃。,-99
960878,金叉。,-99
931237,西水为什么资金流出多，反而不断慢牛向上，成交,-99
1873043,国家队二季度新进持股曝光 偏爱中小创 来源：证,-99
3251504,为啥在6.3元处横刀立马？,-99
3110143,股票被缩股很久为何至今没开盘？u,-99
5337360,托单必死无疑跑,-99
2565499,上周就已经抛空一起富维和敖东 就等尖峰集团了[,-99
4082778,主力该拉涨停板了？,-99
4755926,阎王一走，吉吉因该过300元,-99
1055724,我想问问黑狗：每次否决每次大跌，这次否决后股,-99
2710516,水井坊（600779）下跌，中线趋势走好,-99
479694,公司还没出公告啊，情况也不说明一下,-99
5429156,金鸿舜，又烂又垃圾,-99
1902736,一个季度0.42元全年业绩1.68元,-99
4282690,横久必跌，闪人,-99
2321063,根据《中央企业公司制改革工作实施方案》，到今,-99
1974168,证券时报：金融工作会议为IPO正名 或将持之以恒,-99
3623426,出山第一败,-99
3396500,指数齐头并进是好事达成一致上涨需求,-99
3041310,下周一还有好看伺候,-99
1044855,借利润增长高位减持，昨天买入的这辈子难解套。,-99
4886359,只要业绩符合预期，暂时跌到哪里又何妨。,-99
2847573,杭州结拜[大笑]持仓价11.50,-99
1600706,我是要买炮仗挂横幅嘛？,-99
3886186,中国银行实现了历史上对光大银行股价的跨越。不,-99
1357777,2017年上江山股份（600389）：半年报增长1487%,-99
3219773,那位说说为什么东方证券跌的这样厉害？,-99
3580545,接点货，免得掉队了,-99
2180506,个股的五种见底特征,-99
4692156,无险可守形态的股最为险恶，自由落体如无资金介,-99
3720073,敢买吗,-99
1384862,傻逼玩意,-99
136303,大盘涨这么多，你个杂碎跌的这么狠，,-99
4652014,603355:莱克电气关于公司及其子公司开展远期结,-99
1116088,估计是拉高出货，前期套利的没有出完。,-99
216126,还好昨天卖出一些，还是下来了，继续买买买,-99
4433473,沪指涨0.43%日K线三连阳，上证50指数创两年新高,-99
1156321,卖了吧现在在做头部,-99
815644,我给-你才,-99
1768686,感觉尾盘要发射l,-99
