,content,mark
2771989,你跟电力没有关系吗废物,-99
2980089,下午跳水[不赞][不赞][不赞][不赞][不赞][不赞],-99
4574658,不涨就请继续跌，跌到32我再加,-99
3976919,今天就不做t了,-99
3693009,兴业先行赔付，未来总有一部分讨回来吧！,-99
3776885,遵义推介农业产业项目,-99
1430473,死水一潭，什么时走，多是对的。。,-99
3161163,则体系，加强反垄断和反不。,-99
5308226,8.8大盘走势预测  个人见解不符勿喷,-99
228627,揭露不为人知的二八分化规律！牛人这样来把握超,-99
4590408,你妈死了，傻逼庄,-99
1654907,致非经常 信雅达(600571)传统业务保持领先，金,-99
2281436,[微笑][微笑][微笑]不要犹豫，今天已经很明显可,-99
4458854,[心碎][心碎][心碎][心碎][心碎][心碎],-99
583686,大垃圾,-99
1012849,唉买亿阳算倒一百辈子霉了，现要再割肉就要倒二,-99
3895180,草泥马,-99
783158,小心，狗托又开始在画饼！。,-99
1439628,这么强势的板块都带不动你！服了,-99
1520373,深地铁不大可能出足真金白银,-99
4042149,明确标的公司！,-99
5230256,603808:歌力思:新时代证券股份有限公司关于深圳,-99
5485164,调整才开始   只会一浪比一浪低   拿好钱   等,-99
2567184,重温3.23行情\\,-99
910957,畜生股，畜生庄，畜生企业！,-99
2319335,nmb还真是垃圾，连均线都收不住。瞎了眼买了你,-99
4723500,庄家快点砸吧，给电机会加仓嘛,-99
2393676,军工。抢,-99
3244576,综上，分钟的反弹机会，至于高度还要看热点，,-99
5534443,三分钟0成交,-99
4316627,这个股的股吧真奇葩，里面不是骗子就是疯子，再,-99
3256005,啃的累啊，纪晓岚呢？,-99
984482,"我守你也不是两三天啦,拉哟。。",-99
1849097,几个意思,-99
2937094,在过半年就值7元,-99
752744,600217的主力手法佩服，买，大胆买！,-99
3473469,永远的垃圾,-99
3840652,绿帽子上头了，真不容易，在绿点。,-99
2739078,【爽辣啤酒鸭】,-99
443159,套了一波，走了一波，主力继续慢慢干，没一个月,-99
5315813,主力简直就是狂轰滥炸啊！怎么了得啊！,-99
3127571,甚至可以放眼世界寻找更好的机会,-99
5473330,要卖要走的赶紧卖了滚蛋。,-99
3812036,见钟，呢吗继续涨啊，涨2000我看你行不行,-99
4221645,负责九亿上市，谁的责任？？？,-99
2991151,据悉，特斯拉的第一家超级工厂的建造成本估算为,-99
2218000,做600652这样的每个月的最后一天买进就可以了，,-99
1113156,银监会清理网贷平台，对新力是不是利好呀？,-99
3832262,忧伤里参杂着欢喜,-99
2783532,死股如死水一潭。谁买套谁，专治各种不服....[,-99
5303765,希望明天你的股价能跟你的新药一样，治疗你的阳,-99
717156,有些人要把脸打疼了才会悔改,-99
2249175,旅游市场再迎高峰 节后瞄准三大投资主线,-99
3498867,K线都是砖家臆想出来的，靠看K线炒股会死的很惨,-99
4239501,看谁跑得快,-99
1850686,必死无疑[献花][献花][献花][献花][献花][献花],-99
1902325,不要给机构,-99
3858042,宁波建工(601789)融资融券信息(09-27),-99
1639306,直接到10元以下吧，等半天也没有人来买，一到10,-99
3197789,每天默念十遍管住手，管住手。。。,-99
17148,什么价值投,-99
3955879,国家队：我真的尽力了！,-99
744461,消费金融成角逐热点，目前全国有多少消费金融公,-99
4223144,坚定信心，请勿竞价阶段挂卖单，后面当然也不能,-99
4177906,同兴达三个一字说明了朗玛信息的巨大空间！ 羞,-99
3674233,最棒的交易往往是那些自己知道是低风险，但又害,-99
3311919,害的我今天追涨进去的雄安股损失惨重,-99
5053788,股价两年暴跌84% 467元股王如何跌落神坛 2017年,-99
34455,什么鸟股,-99
780802,废物啥时候到5.5 今天出了合肥 等你呢,-99
1438820,江淮大众，江淮蔚来，股权激励，业绩下滑，新能,-99
5401964,周一会继续跌,-99
1371840,马上开跳，17见哦,-99
4381894,更不值得提倡t,-99
5039790,操,-99
3422105,又没有获利盘，哪来的那么多抛单,-99
2727761,每跌一元补一些，留你五年当存款,-99
1451153,主力这样打压，是否要停盘了！,-99
4596819,卖了狗日的,-99
3522486,最起码是为数不多,-99
823951,哎，真是僵尸股,-99
4007151,业内预计，雄安新区远期地下管廊投资可达千亿级,-99
3871275,这么多资金买入却走成这样[好困惑][好困惑][好,-99
4117413,看不到希望,-99
3632322,垃圾,-99
1809546,布林线上轨的压力，今天调整是必然，不调整就是,-99
3961408,我最怕它发公告，一发就大跌。,-99
5493078,每天低开四个点然后往上爬我想问你是不是有病,-99
879463,再玩中国人寿。,-99
1104840,地卖完了，业绩也就彻底完了。,-99
3065685,皓整理为什么雄安新区成不了经济重镇？行情到,-99
5000404,为什么中国的企业一文,-99
995945,二次探底来了 破10元，然后3次  4次   5次,-99
88933,对华能水电的客观分析。,-99
4849614,现在所有一切不过是为了降低增发价罢了，挺住，,-99
4043347,死贱股，天天跌,-99
4955263,一个卖塑料盆的，看样没啥前途,-99
2192753,荣之联要涨停了，中源协和继续趴着吧,-99
4173019,弱庄看看红墙庄家，对你真的无语了,-99
484765,33.5的成本什么时候能回本？高手解答下。。,-99
2943692,sb九百，还不分红,-99
2476520,开始拉了！抓紧上车！,-99
3898015,601866:中远海发对外担保公告,-99
4338327,说句心里话，股价太高了，感觉并不会有多好的趋,-99
2665110,今天大盘还不错呢！,-99
3739541,什么阿物,-99
3334051,突破700元后依然大幅走强,-99
3570397,险资加强监管丝毫都不影响格力电器的基本面,-99
4014519,所有成员听我口今买涨,-99
272960,难以决定是否追多或追空,-99
629213,13元多重仓生益一路持有，现在报道多了如果未来,-99
4545724,算了散户太多,-99
5545582,砸得好，砸死一批,-99
3001021,春兰不是不好，都是被你们做差价给做烂了[想一,-99
3843184,今天再玩 也就是  一两分钱的事,-99
4585521,3000点，装模作样个啥[不赞],-99
255164,澄星走私坚挺，持股待涨,-99
1083260,对于近期万华千亿市值的股票不断出现闪崩，恶意,-99
5221918,昨天收最高点，今天收最低点。怎的了\t,-99
4510800,不管结果如何，以目前局面，开盘两个补跌是板上,-99
3059713,国庆节了，我来你这里避险了,-99
225219,没用的都不够他跌的。,-99
3312094,年华暗换,-99
676770,这头猪在雄安有个饲料厂吧,-99
2710402,多关注一些刚开板的次新与有业绩支撑的次新，不,-99
5456423,三孚股份；仓位改如何把握？,-99
1111558,涨停模式被各种狙杀，这是肿么了？,-99
1431518,阿里与义乌政府签战合9个月合作些啥],-99
3637642,你吗的，是不是针对我的，那么多银行我选你来跌,-99
4240980,没胆量。只T+0了两个点,-99
5304318,加强换手，在11.2之前没有做空的筹码！,-99
5217933,新股4个板开了，期待一个板开的，现在市场钱还,-99
1603271,相信主力，下来还会上去的,-99
3131692,用伊利的市值中了水星和恒林。可这几天伊利亏了,-99
304386,cnm真垃圾。,-99
1976620,继续，9块以后再拉板，续板,-99
2796509,T得3毛5分,-99
3335990,这完全是一种多余,-99
2963249,没得救了，十天，有九天低开，搞毛毛了,-99
4726876,皖天然气从跌停拉到涨停才有意思,-99
4987626,百善孝为先,-99
2830335,周一拉升。准备好子弹。,-99
5416331,新股提示：合力科技、乐歌股份、奥士康今日申购,-99
2539658,你们说这庄家神奇不，筹码抛几个月一点没见少，,-99
700645,呵呵，呵呵，呵呵。,-99
4601355,耐心等待下降通道的完结,-99
701781,大单挂着预计今天9.80收，明天低开继续加仓,-99
4795703,估值相对合理,-99
3830663,今天总成交量不超过5000万！为什么不放量拉升?,-99
2423873,只出不进，短暂反抽解套出逃的机会越来越难得，,-99
61264,明天开盘就跑，明天还会继续回落，今天被套了半,-99
1268070,天天都是前半小时锰一下就泄了,-99
2148283,最好的防守是进攻j,-99
1967246,股票的流通盘是固定的。,-99
5303863,你是我的爱人 像百合花一样的清纯 用你那淡淡的,-99
3288006,广安爱众2013-2017年连续四年9-10月都有20%以上,-99
2854537,无人零售爆发靠的是智能支付w,-99
3502546,没反应的,-99
2965214,此股已死，有事烧纸。。。。,-99
5264108,资金争先恐后的跑，弱股啊我也走了,-99
295608,双底[大笑][大笑],-99
1065173,不做叶檀东,-99
4086679,跌破1O，52元立即清仓逃跑!,-99
2670087,23.31割的好爽,-99
44198,业绩出来没有？有8分没有？,-99
3815349,现在点位上方做单很尴尬…,-99
1467773,12.11强势概念之BDI概念,-99
2868436,恭喜发包你除了天天发过期利好消息来意褡云燮,-99
3806795,7.50卖了!庄冢就差我这点股,-99
4446107,此股真正的主力是中户吗,-99
487789,哥，跟上大盘的节奏啊，别盘着,-99
2896706,**指出，百联集团要在前期转型探索的基础上，进,-99
4456556,芝麻开花节节高,-99
1015986,最无聊的办法就是停牌,-99
3780327,哈萨克斯坦能源综述：储备、开采和投资一、 碳,-99
2678051,深成指下跌6.65点,-99
3263439,白忙活了一天，看着指数干瞪眼，托重组的福了。,-99
1549931,一是基于但由于业绩下滑,-99
3303344,公告公告公安。,-99
5130592,不跑就跌停,-99
559296,还是看好创业板,-99
176035,五矿旗下---锂电池是--五矿资本600390,-99
4538214,明天即使涨停也就是29.41元，昨天开板进去的大,-99
1992064,不要跳楼，都好好的活着。已经见低了。此时此刻,-99
5340390,此股被操纵了，操盘的太坏了,-99
2021609,养老金业务部全面负责养老金投资业务的客户服务,-99
383805,北方稀土(600111)融资融券信息(10-17),-99
690619,这股做t太容易了，昨天9.44跑了4000股，今天9.2,-99
1770310,．短线资金分成六份（A，B，C，D，E，F，分段出,-99
1812612,什么意思,-99
5395277,估计马上出重大利空,-99
1903440,明天跌回47块,-99
2504198,上市资格都保不住,-99
4912721,明天上证指数能到2950点吗？,-99
654337,时间是绩优股的多头，是题材股的空头！如果你买,-99
414850,天弘基金三季报规模1.66万亿，打败招行+中信+浦,-99
232810,不破不立,-99
4897991,前几天高盛减持完毕，12月29日出公告,-99
2974633,保底工资i,-99
2812308,国企股总是挣 一次亏个够，骗子，不然净资产高,-99
