,content,mark
1948966,新华社：中国经济稳中向好势头没有改变 发展潜,-99
2256224,这衰货，烂到骨子里了，日你妈的有这么大的利空,-99
350000,二个涨停才回本[滴汗][滴汗][滴汗][滴汗][滴汗],-99
538775,市场只说它还没资金光顾过。没涨到应有的价格。,-99
3570654,今天对看多唱多的是个考验啊。,-99
2166842,把所有的股票都跌到一分钱，就符合投机赌博的预,-99
539834,真垃圾，亏的上午大概看了一眼，3块97好不犹豫,-99
3831353,造了一种传奇生生不息,-99
5259855,震荡向上趋势已形成，回踩可逐步建仓。\t,-99
4365352,主力跑了一千多万，没有戏了,-99
1120610,开盘拉升，恭喜,-99
2250803,"投资者传闻求证7月中旬前后, 华媒控股旗下。",-99
4833420,这3000万的盘又是食品次新股20元不到？,-99
5271646,惹不起,-99
2670933,5G 特斯拉供应商 军民融合！股价超跌，即将腾飞,-99
335564,区块链创新金融 数字货币龙头 恒宝股份002104必,-99
3835481,外资抄底进行时？ 今日5股望持续爆发,-99
2874036,现在开始买，买，买[拜神][拜神],-99
5353680,被人家偷鸡了顺道还送了一把米,-99
79455,丢人现眼，工资都发不出，赶紧退市！。,-99
5552643,603998:方盛制药2016年年度报告摘要,-99
2848539,易提示,-99
1669656,一觉醒来小样还在折腾。,-99
775099,风格偏转延续 上证综指,-99
3717613,得到的只是短暂的欢愉；目标高远,-99
1931547,能有效判断股票的行情性质与趋势。,-99
4878897,死庄没能力早点滚出荣泰,-99
2478560,中东地区对建材需求倍增，国内控能限产，水泥价,-99
17475,修改密码a,-99
4858826,603566:普莱柯:平安证券股份有限公司关于普莱柯,-99
4445634,2017年10年25日，“快克杯”全国高技能电子装配,-99
368432,散户必须对自己的权益负责，不要任人宰割！,-99
1100232,奇葩的市场,-99
5374587,全仓杀入[大笑],-99
1619912,明晚发公告，重组事项内容多，没有完成，后天继,-99
5446662,还没开始下跌了，提前出减少损失,-99
1983038,东旭光电走势持续偏弱 短期风险继续释放中 游资,-99
3054785,如果赢了,-99
4859600,八荒四海 为你而来,-99
1940992,大家坐好，系好安全带，准备飞升,-99
3785299,操加仓早了,-99
621087,猜一下:今晚5家，不超过22亿。,-99
3707631,坚决等尾盘再选择走还是留,-99
3517682,要闻：中国有色金属协会再生分会确认明年底废7,-99
3704637,美日关键水平112？,-99
3509645,资金收评：主力11亿净流入5板块,-99
186436,空头成本在那15.01元，18.6元，还能收多少？,-99
4820730,我的梦想就靠你了哦,-99
1896372,都在高开，这货1分钱，草,-99
2452115,规范了住房公积金异地转移接续业务,-99
4412316,破发了,-99
775761,市场对公司的关注度很高，请公司尽快发布业绩预,-99
630842,理论升幅达到，突破后回抽,-99
2370993,尾盘砸盘的出来了。,-99
3200512,充值打新,-99
2114751,慢慢熬吧，发中报前就是拉升之时。,-99
1341997,007777 你懂的，明日拉升 勿追高,-99
2864757,说啥也没用，只有这句话是真的,-99
5062856,上天给你一次扭亏盈利的机会，每天送你这么多银,-99
4436427,这庄在用编写的程序炒股，震荡箱体中。,-99
3829603,朋友 早上有木有被洗出去了。,-99
4747773,002839将带动次新股反弹,-99
4649489,",短期自然大概率是保",-99
3941035,坚决清仓换股吃进京东方,-99
4802516,今天坚守36就过关，等着这大浪上升!,-99
3829372,狗托，还喜欢骂人哦。,-99
1016007,我在茅台里舍己救人，满足有的人的茅台梦,-99
516755,业绩亏的其他票涨得厉害。业绩非常好的其他票也,-99
5476700,昨天见到37没卖，今天是不是见不到了,-99
3033264,你这鸟股现在怎么这么熊的呢？！,-99
1299099,中航电子庄家很不厚道，股价再涨30%很多散户都,-99
4041203,今天大放量,-99
1978234,呵呵。得瑟！,-99
4882762,老股民：涨跌任你表演，40元下持股不动。,-99
4293553,603108:润达医疗关于公司向关联方提供担保暨关,-99
4594300,王八羔子操的，圈完钱就跑人了,-99
793747,谢谢主力打下来，昨天发的奖金今天又可以用上了,-99
1431522,第二第四股东占4.86%成本8块上面。,-99
3977867,房租贷惹争议：及时雨or隐藏坑？,-99
1612023,信威小股东,-99
2786895,PPP第三批示范项目清单公布在即,-99
5245685,换股了，等我回来,-99
2691698,再次肯定的告诉那些毫无改变思想，顽固不化者，,-99
3284603,“中国能建好 ”羡慕嫉妒恨没用。n。,-99
2093792,今天跌停rI入五f股，明天再跌停就^m加五f,-99
2248331,小散不要购福耀玻璃、死定、托太多、亏太多,-99
4857238,此股能连收7个月阴线实仍是少见，河南的股坑爹,-99
5206167,车用润滑油前景良好，高端化成发展趋势,-99
3384,这股炒滴，真垃圾o,-99
2592233,融资盘惨了[亏大了],-99
4814527,管理层尽管出了利好，但市场不买帐。,-99
5500077,这股做t太困难了，挂个2分的单子，一天到晚都没,-99
1681932,申购新股票要慎重选择，股吃亏上当的事已屡见不,-99
4305920,如果买了他的票，他就套住你，还想让你买他的鞋,-99
151578,大盘短期见顶主力应顺势洗盘砸到8元以下l,-99
2035716,没量，还得下点,-99
4036603,跌了几天了，啥时候表现下？,-99
3385951,目前业绩预测情况更多地反映了中小板公司业绩态,-99
2627934,天山股份为什么停牌 中国建材集团上市公司有哪,-99
131742,太弱了，不买了，跌破发行价再来抄底,-99
2135430,这次好像不一样!,-99
4554497,茶花股份，巨量拉升，速度上车,-99
663692,一哥：市场最真实的指数破了新低?谨慎为主,-99
2710372,上周卖了棕榈买了这垃圾，我的心在滴血啊[失望],-99
552416,A类疫苗是微利资产，这从天坛生物历年的业绩可,-99
2920955,要是国际黄金涨，我们,-99
5166376,07月18日(周二)大盘前瞻:创业板置之死地而后生,-99
3173228,吗了隔壁，,-99
1244482,D大于80时，行情呈,-99
2021632,“资管新规”之后，还有哪些监管细则会出台？,-99
1917506,全是诱多套牢又是30%亏损活该！,-99
1864188,就是因为茅台涨才买的你，37.82本啊，满仓了，,-99
2539425,今天是利空，三个月以后必定是利好。l,-99
1893585,任由山鹰上下颠簸，来回折腾，就等33过大年！,-99
3741150,从你8月14号下来，指数涨了200点了，你跌了。,-99
4384662,这地雷炸了一个坑,-99
4677013,公司说谁炒套谁必须跌半年！,-99
4645976,603339:四方冷链:广发证券股份有限公司关于四方,-99
2372996,算帐的过程还在持续,-99
5315060,需要留意的是,-99
1775874,昨夜黄金大涨。,-99
5043735,卧槽，该上市公司是否破产倒闭了?诡异加邪门啊!,-99
2404108,航天信息(600271)融资融券信息(09-07)。,-99
2386500,因为学无止境不能性急e,-99
1997701,明天大涨吗？[想一下],-99
5213251,明天涨停,-99
4179993,不要追买，还会继续压盘,-99
298466,老贾挖人的潜质不减当,-99
3474861,今天拿其它票的惨了 大盘跳水,-99
3307123,建设机械是干什么的？工程机械涨，它跌，建筑类,-99
2951330,3000只古票，3000点,-99
1802955,“国资划拨社保”已经启动，有望进一步盘活国有,-99
1629732,小双头已经确立,-99
2483520,东旭光电上车已吹响集结号，蜗牛也是牛：慢牛！,-99
5266578,我等18.9再进,-99
42326,即钢非钢，即色非色!不伦不类,-99
4392095,今天大涨几乎半个涨停板的德创环保，与中国危废,-99
3508962,关注中船科技,-99
5059734,IPO遭举报涉嫌财务造假 今创集团公开回应不属实,-99
4562059,把雷神留在高位，等逆天长阳！,-99
2974041,社保基金后增加至20亿左右规模；,-99
237472,模塑科技绝庄，太阴了，赚到钱都无命用的。,-99
3693203,马上到7.5了现在准备入点,-99
5418079,吐了吐舌头,-99
827163,次新及高送仿佛第三次股灾？,-99
5487665,谢家就是一群道貌岸然的伪君子,-99
378679,不知真假 大家议论一次,-99
1167295,大家能不能一起骂那个姓李，知道没啥用，就是心,-99
3406689,先卖出！,-99
2773247,国电电力惊天大阴谋能否出现大行情 ，这个坎只,-99
5070314,买石英股份，注定穷一辈子,-99
106239,我抱团取暖你买单,-99
4703518,涨一天跌了三天，明天再跌一天这周就不跌了,-99
1438027,江蔚早已分手，为何不公告，,-99
3666754,更正明天出中报c,-99
3119432,22.01谁敢吃，我就不信了，他妈的，亏那么多，,-99
1253128,短期下探压力不大。 或可迎来几天反弹。 早上低,-99
2030216,目前就有色板块来说已经得到去充分调整，买不买,-99
235394,阿里巴巴集团公司与上海梅林已经签署战略合作伙,-99
5052324,今天高开我肯定撤，低开的话我做做t,-99
4652323,永远的跟班小弟别的不说看了就恶心,-99
3139026,"艹,尾盘抢筹,我却走了.",-99
401868,垃圾货，涨如蜗牛，跌似瀑布。。,-99
2337136,摸底珠江实业广州项目：核心区项目开发周期较长,-99
535232,洗洗得了，不要骗小散了，闭着眼睛买都赚钱，趋,-99
2783600,宁波海运真是烂泥扶不上墙。,-99
5027710,比照欧派，这个骨架差不多了。,-99
4697879,连上到30应没问题，游资大老今天下午已进入是我,-99
4992687,中国新四大,-99
3530751,茅台是不是用水酿造的？,-99
1507784,今天跌5%，明天跌停，重大利空！,-99
4946070,利用市场人气低迷,-99
941564,上面压单怎么那么大？,-99
2207363,今年以后持有龙净环保的体会。,-99
601123,俺哥04呢？飘雪寻你咧，做美都美油代理人了呀，,-99
4821127,昨天12.75元卖了，希望明天低开再进,-99
2075731,跌到15元,-99
3072605,明天注意大盘的这个动作！,-99
352460,600103:青山纸业八届十次董事会决议公告,-99
5537697,下周横盘，再探右肩2，不得而知。,-99
3493658,厉害了我的哥，刚发的帖不见了，说实话的帖不能,-99
4901958,603595:东尼电子关于变更注册资本、修订公司章,-99
613444,炒股如何更容易赚钱,-99
3011167,哎！上周没有卖，真后悔！,-99
874625,8.08，888手看来今天能收红盘了。,-99
1387721,下跌缩量，狗庄吃屎狗,-99
2739738,川北凉粉的做法,-99
3414774,陈折生：恒生指数期货九月份行情总结及十月份走,-99
4498372,被电魂整得烦死了！减四成仓剩三成仓随它折腾吧,-99
4715238,看庄家的筹码一直用来打压用的，真心有目的的,-99
793915,今晚应该有公告,-99
3461225,呼叫万手哥出来吃烧烤,-99
847243,同志们有动作 快看,-99
2745811,"岂敢定居,―― 一月三捷.",-99
4451172,今天挂63.48清仓,-99
2569783,海油工程可以进了。。,-99
5529577,一体化,-99
2037404,鲁西化工在崛起 上半年PC收入5.7亿，利润1个多,-99
2737902,6、孤独；这是人生的必然部分。,-99
4057289,大盘想周五涨比登天还难，主力是不会让大盘周五,-99
