,content,mark
223734,)。根据《通知》中关于,-99
2808131,解禁股砸盘，怎么办？？？,-99
961270,恒瑞医药业绩增速连续5年低于华东医药，也低于,-99
3264490,我问,-99
2918137,妈的天天拉银行股有意,-99
442700,y恶庄……恶庄反弹出货……上方压力位……机构,-99
4511725,重点是大小非,-99
2965725,跌到8圆庄家自己，找死。懂的自然懂。,-99
1720538,空谈误企，实干兴企！,-99
4580507,通知：周一买进，将向20进军,-99
5535479,慢慢磨吧，下跌空间10%，上涨空间50%.只要你有,-99
4762785,做短线的想走就走，愿意留的都会心惊肉跳！,-99
4730882,政审批的核准制和退市制在A股,-99
2679693,钢铁煤炭彻底闷杀，什,-99
671109,没有绝望的爆仓 ！ 哪里有疯狂的进场！,-99
4662294,今天算是到头了,-99
3894294,盈利下行周期和利率上,-99
2901947,双十一有一个涨停板，你们现在买点肯定不吃亏。,-99
3117914,11月29日晚间重要行业研究汇总(附股),-99
2316676,&quot;920&quot;兵临城下湘电价跌放量,-99
4886601,股票是用来炒的，不是用来住的,-99
3660448,大家谁想吃曹子玉的肉，喝曹子玉的血，寝他的狗,-99
40657,包钢钢铁股涨最差？,-99
2647313,守住啊庄家,-99
3260503,中材国际(600970)大宗交易数据一览(12-01),-99
5219695,胡马依北风,-99
512531,74亿转让有多少利润，谁能说清楚。,-99
4878310,自五月以来，平均每天的成交量在两三千手，请不,-99
2792065,还在意淫一群白痴还顶360的贴服你。,-99
4208270,才一个点，继续下杀呀，最好跌停，我在等着,-99
1301122,阳光总在风雨后!,-99
23908,5块8毛5走都他妈是正确的！假东风太可怕了！这,-99
4798669,下半年展望,-99
2452183,其次,-99
3138358,今天还是很硬的,-99
3579136,（棺材）科技化工类最低股价,-99
1786197,中国网财经:院士爆丹参滴丸三期临床失败，业内,-99
2580554,中茵股份：股东“东海基金计划”已累计减持1%股,-99
2621542,002019，年,-99
926614,雄安津膜,-99
3568272,进入5元不是梦,-99
3677878,傻X国芳集团都超你了。,-99
424504,清明时节雨纷纷，炒新股民欲断魂；借问亿联走多,-99
3405151,深度挖掘！隆基的基本面,-99
2153731,广汇能源：业绩3倍增长，一带一路，机构强推,-99
4222282,此股必成妖,-99
4510588,603268:松发股份独立董事关于第二届董事会第二,-99
1272598,尹兵傻逼不跌不买，涨了就不动，平仓是迟早的事,-99
4732859,不要买邦宝、远离邦宝,-99
2177054,可以豪赌万业收购细分芯片龙头中概股澜起科技吗,-99
2038122,今天收盘一阳穿6线，明日收阳不破任何均线则强,-99
3184684,下周三家新股，次新股能咸鱼翻身么,-99
4810490,（1） 低价购买 ,-99
4625612,但股市总是熊长牛短,-99
1745010,贵航股份12月5日盘中跌幅达5%,-99
4428006,gggg,-99
1361273,每股被套1一元,-99
3198811,600917:重庆燃气2016年度业绩快报公告,-99
788610,麦香[大笑][大笑][大笑],-99
2998953,散户一天增加八百人,-99
5037397,600241（时代万恒）牛股归来 时代万恒拟定增募,-99
1911153,一步一个脚印，踏踏实实的下跌,-99
4404407,重要的事   603978是机会,-99
4869816,603577,-99
1431532,今日大盘下档第一支撑位在3220点,-99
2481867,成交量在打点滴，股票成僵死,-99
69601,宝钢也真是，给高管每股3块多。我们小散买入就,-99
742901,中通是龙头，龙头已经跌了,-99
823124,船一直在行进,-99
711173,调整有可能随时结束,-99
5053186,能跌停就好了,-99
3619540,601231:环旭电子第四届监事会第二次会议决议公,-99
3182606,注1. 1895年5月最初所列的12种股票 ,-99
4745044,还在出货，也是醉了，板块都涨成什么样了，[想,-99
1509078,根据上交所去年9月30日发布的《上市公司变更证,-99
2983514,城市新建商,-99
5454721,买买买，调整结束了，可以买了！,-99
2154104,长期看好,-99
2500159,股市小傻最傻B！十万元钱当千万！大尾巴狼装得,-99
2980806,这股没治了A股拖着H股走再见永不回头[微笑],-99
1961627,题材股时代一去不复返，业绩将是四季度主线，关,-99
2545080,9.49满上，今天下午必板，明天高开。,-99
4258230,这是什么妖,-99
2259052,陆家嘴(600663)融资融券信息(07-07),-99
5400752,没主力拉，横盘了。没意思,-99
5518498,不怀好意的人请自动离开，能不能长点心。不要跟,-99
66010,上午能涨回来,-99
3237953,走了大半年了，这货居然从21跌到了13，恭喜[鼓,-99
2476351,其实主力并没有在这段时间出多少货，不过也没进,-99
2878310,继续持有,-99
4850106,大盘涨300点，它都不涨，服了,-99
4272577,1957～1961年平均＋32％＋32％＋30％,-99
4134791,垃圾中的垃圾股，早点退市,-99
1812495,今天的走势比我预期的要强。明天估计再有个高点,-99
4294355,趋势走坏  撤离,-99
1186766,大股东还有3个亿准备继续增持呢,-99
3183853,进行利益输送,-99
474357,真是利好，会跌成这样吗？,-99
3023762,现在比价高了！！,-99
3314872,别闲慢来别闲少，一天就涨一大毛。随然每天涨不,-99
3203446,京东方那才叫抢筹。牛股，死江苏银行是熊股，要,-99
4296861,谁买到的？报道一下[微笑],-99
2133032,市场短期调整尚未结束，鉴于目前市场流动性并不,-99
3081395,现在买还来的急，预计今天环保涨停潮,-99
1076644,疯狂追进酒钢宏兴今晚一夜暴富,-99
476467,全球股市一片恐慌啊,-99
5017345,今天能够放量吗,-99
4483351,A股每天分时图都在上演着---老头劈叉---扯即吧,-99
22182,突发中国股市传来大利空,-99
5339334,从今天开始，我天天发贴，提醒大家,-99
5297690,昨天已明显止跌，看今天能守住15不？守住就有戏,-99
1884534,不堪回首苦难尽,-99
1859772,债券持有人会议该开了吧,-99
681302,伊力特没有领涨到来了个领跌,-99
5446933,周一壹阳吃三阴，师母已呆,-99
388632,今天最佳走势阳办阴,-99
1554575,最高10.83，今天最低9.83？太巧了吧，我有个大,-99
742607,一只股票当然离不开散户的支持，但如果狗屁不通,-99
5299703,想抢反弹的看看秦港股份，中国出版,-99
3094168,如何识别见底和见顶的,-99
5140533,鸣志电器养老金概念[微笑],-99
989879,阿里重启网商大会 新零售重构网商新蓝图(受益股,-99
2135034,重组大幕拉开，还签了保密协议[为什么][为什么],-99
5117484,昨天出了买了皇马赚5个点，再来陪你玩，上次碳,-99
509679,据小道消息，恒大弃深深房，借st坊展了。,-99
385061,炒股成功的基本要领,-99
1393439,皇氏集团002329 万达私有化概念股龙头 广西400,-99
5824,等待右手交易,-99
3865045,东方财富网。,-99
4058962,股份过户回家了,-99
4065842,天天跌20个点，10天跌200点，撑不住天天跌呀，,-99
5204382,持有联泰环保不是单单是被套这么简单而是错过了,-99
2155820,计划采用国产显示面板!。,-99
2350797,布契拉提股东早已成为全股吧的公敌，人见人骂，,-99
792184,快点暴涨吧，暴涨我就卖给你，我不等文投注资,-99
5259482,核心价值观难道这就是讲故事，坑蒙拐骗？,-99
1539671,而没有指出问题的实质。,-99
1197377,我怀疑，2股东减持的数量，早就超出公告减持的,-99
1674916,NND 中国宝安已经翻红了,-99
2222396,今天的最低价，就是明天的最高价,-99
1007696,跌得太少，应该跌停才好,-99
4567316,跳车了。。。。,-99
2144323,季线级别的上升已经拉开序幕，十五个季度的上涨,-99
1882134,跌停股近期持续不断,-99
5151381,603737这只烂股太害人了跌得不成样子了，还有这,-99
3875282,文化传媒没救了,-99
5207346,玻璃1185做短多立马止盈,-99
4370788,科华控股:股票发行方案,-99
2346438,这种垃圾赶紧卖，垃圾中的战斗机，大盘涨他不涨,-99
4870296,今天换手率这大,-99
4225035,估计到收盘0手哥看大家可怜收个2.17也有可能,-99
1042250,周一有建仓，抓紧跟上啦,-99
4770598,这只股涨一点就跌下去  太差劲,-99
2126260,如果大跌，买入,-99
3745137,大浪1/3/5上升浪中各自还有小的1/2/3/4/5，小浪,-99
2664273,A股先抑后扬 量能制约多方。,-99
2741846,价，我想买,-99
3176724,谁在新股上市首日卖出？众人直指承销商,-99
3242456,一边不顾一切地砸，一边不计成本地买，死叉转为,-99
2118150,闪崩 啊,-99
3099548,大A放假，全球欢腾。,-99
1203325,我在出头加了部分，敢跌下来我就继续加,-99
3484756,360筹划借壳上市的消息引发市场关注。。,-99
5202624,大盘断头铡,-99
1496668,你好，请问公司控股股东后期会否继续注入资产，,-99
3444913,好股好股，可惜买少了，这是今年抄底最准的一个,-99
4263365,"明天要爆发了,新高可见",-99
4536521,还是拉高出货,-99
1206552,恒力今日要创新高,-99
2868208,不负众望提振股民心重磅来袭操作一字干！,-99
3711406,突然一飙为啥啊,-99
3348909,哎，古语说的对呀，穷山恶水出刁古啊。[不赞] [,-99
1382210,最后还不忘砸一把，死性到家了。,-99
4455530,抛,-99
4202146,爆跌了，赶快卖,-99
4672470,这个价格不来建仓的是傻子！[大笑],-99
1669499,直接一个板，堵住大家的嘴,-99
5343441,必将大涨,-99
3147542,风雨天1用心险恶，天天做空骗股民,-99
4085706,柯镇恶与阿法狗大战，今天人工智能、智能机器领,-99
4730969,刚才51谁买了200手！有点实力嘛！哈哈,-99
2790072,今天江南只要开板，磁卡就会涨停，跷跷板……拭,-99
3036729,摩根大通分析师Katherine,-99
24367,这个庄其实就是个二逼，他是利用汽车退补在做空,-99
796207,为了出货也真是拼了，加油，继续拉,-99
2860445,顶在顶上，底在底下，垃圾股永不言底，跑路为上,-99
3816346,可是爬的人那么多，而路只有一条，十分拥挤。老,-99
3643003,看看百事通!今天中车跌停!复牌跌停,-99
5441631,亚翔还有三涨停方价值回归!,-99
2988300,国产航母今日开始注水，看腾讯新闻，为什么股价,-99
3496920,化学慢慢长路阴跌走势走向何方？,-99
1146653,死德创，34的本，咋办,-99
352096,散户制胜法宝-持筹比例,-99
1097930,下午开盘一路下跌,-99
1097533,昨晚欧美股市大跌，A股收官之战很关键 隔夜欧美,-99
5470102,还是质量重要的原则问题,-99
456710,涨停模式被各种狙杀这是肿么了？,-99
3838903,这股不是煤炭吗？怎么不涨啊u,-99
2246982,5天线强支撑，明天后又会大阳线,-99
3714292,假冒伪劣产品问题,-99
