,content,mark
5368565,卖出是现在唯一选择。,-99
1206646,高高的山上很风凉，当心不要站在山岗上,-99
517045,垃圾桶，垃圾堆,-99
1364674,重要的是静态市盈率小于300了，2016年0.13的业,-99
2484923,这股看着要笑死了，被一个200手的单直接砸蒙了,-99
1992396,其累计量必然仍旧等于流通盘,-99
452040,公司前三季度的业绩还算不错笔者不敢苟同,-99
5492365,司马股，没马只能跟爹，辣鸡,-99
3288513,我想问一下 公司是否已经回复了上交所的问询函 ,-99
228155,大盘上周以三阴两阳的走势，在周K线图上收出了,-99
4910147,CCC军民融合龙头股002413雷科防务布局雷达产业,-99
2009824,3300 或破一下 立马重拾升势,-99
1989696,此时不入，更待何时！！！,-99
2498394,解套微赚跑了，套了好几天。,-99
4612087,据《财经》记者获悉，证监会研究中心主任李继尊,-99
3281622,这吃屎的往死里砸,-99
707287,同志们，何必纠结什么时候复盘呢,-99
4194780,38.43出局,-99
4754121,只有下跌才能体现价值投资,-99
1794072,美元反弹随时展开！大宗商品将出现短期普跌现象,-99
2721354,一定会跌到5.70，快逃吧,-99
2654140,个人感觉今天有可能低开低走,-99
2356886,下午跳水的节奏呀,-99
4306435,认清形势……机器人都出来了……散户抄股己一去,-99
3643585,周一能买吗？,-99
4674669,既然能够中签上海水星，那么留着继续配个打新市,-99
1683129,散户不走，不涨。这才是本质。,-99
3826692,步步为营。加油！[献花],-99
2717287,这股亏损有点严重，还能继续拿吗,-99
774946,商业城大涨,-99
510527,6EOSM军民融合龙头股002413雷科防务布局雷达产,-99
3267804,不是说大股东不满6个月不能减持吗？怎么还有不,-99
4748087,603421:鼎信通讯2016年度利润分配预案公告,-99
2155853,在出货，横盘,-99
290892,偶开一贴 由于盈利转板与借壳转板条件难度差距,-99
1008533,先不要拉，我好慢慢吃。,-99
4813907,回调下来可以轻仓介入中小创，，轻仓。,-99
2311220,不要在意短期涨跌 长期军工还是有机会 只要有美,-99
4848248,这股就好像乞丐似的，两三天没饭吃了，今天施舍,-99
4878838,K线图走势和弘亚数控相同，补跌了！,-99
2448617,2008年全球金融危机之后,-99
1074997,大神呢,-99
534846,中国率先推出四代反隐雷达 破隐形战机神话,-99
2281594,一打开这个吧就看到这个狗友天天，时刻在不停的,-99
2024112,这样的走势，可以考虑做空小方,-99
4268478,太空二代要出现了[鼓掌],-99
5336500,【龙虎榜】乔帮主逆势介入 老铁们怎么看？,-99
2474444,改名叫常绿股份[大笑][大笑][大笑],-99
5305321,兴业投资黄金周评：耶伦将携重磅数据轮番轰炸,-99
2349141,工行小散不要惧怕，6.33 不是压力，明天开始连,-99
1919208,没有最低，只有更低，奇葩股，赞你一个吧！,-99
3459728,中南传媒(601098)融资融券信息(07-27),-99
53425,上车的一个都不能下！受折磨！,-99
871791,南纺股份：控股权转让已有5家意向受让方,-99
1895986,再来个利好消息，那该多好,-99
4797288,新股本来就难中，这回可好了，发审基本不通过，,-99
2007361,更有利于助人成功,-99
1377478,下行调整继续中,-99
1969304,A股如此下去，增量无期。变态的行情，离开股市,-99
4896264,个股依然是未能走出太好的局势,-99
5057337,华体科技8月9日打开跌停,-99
4086004,我只想对合锻智能说。 草。 你个垃圾,-99
196900,哈哈，散户还是比较多，难走行情。,-99
4355316,还能说啥，同样同样已经无量了，,-99
2743970,这显然是抓住了问题的要害s,-99
4289478,深蹲起跳，空间巨大！,-99
2635270,中国黎明,-99
2949080,慧网通达:关于重新召开2016年年度股东大会的通,-99
577959,股道天丰今日推荐黑马股票“雄安概念股”表现强,-99
1054937,明天坚决全否！让南化在A股上市公司中出尽风头,-99
3164921,领教了，主力拉涨的时候不要随便在中间挡道，拉,-99
3833170,温馨提示：7.5元以上的河南的郑煤机(601717)千,-99
4180371,我清仓了，难道你要大涨不成！！,-99
5534818,不要抱怨，一切靠自己！,-99
3450316,此股越跌，散户越-抄底。弄得散户把庄都挤跑了,-99
1207236,半年报不错，属于重大利好。,-99
1557929,百分之五十的股票还要下跌百分之五十以上。,-99
565041,当空狗出来一顿乱叫，默默一笑：是时候赚钱了,-99
5059171,今创集团曾卷入受贿案 被指带罪上市,-99
4869129,拉抬股价并,-99
906873,怎么了,-99
1952528,市场在等待时间窗口，大家小心为妙,-99
2544009,坐等分红了,-99
1703303,这股估计很久没戏了,-99
710236,募基金且行且观察,-99
2422204,600706:曲江文旅关于华侨城西部投资有限公司要,-99
4338698,股市，专注才能赢天下,-99
603130,假石墨概念吧，还什么专利，,-99
4291770,好在11.31减了一部分\t,-99
182346,海信的这个股票我是很看好的，上涨是没有问题的,-99
847404,这类行情下,-99
3597959,开盘集合竟价抛出3笔！。,-99
4618205,干了42.28冲上42.50[不屑][不屑][不屑],-99
3322165,航民股份融资融券信息(3/21),-99
1963521,现在还是2016年2月的价位，大盘大长和海油没关,-99
2388240,这个股的周线月线太吓人了，大盘要是砸下来。自,-99
2436236,强势涨停机构游资敢死队疯狂抢筹高送转暴涨飙升,-99
425689,跳的漂亮，大a也就这水平了,-99
5354657,吉祥航空操盘手怎么了,-99
2625457,放量上涨收复昨日回调，宣告调整结束。,-99
1833133,有高人吗，问一下是不是主跌浪来了？,-99
1313171,证监会出台新规 规范上市公司股东减持,-99
2854462,看到一重业,-99
4775221,收盘前扫货!,-99
2232279,"《上海大富翁1940》创世纪,创战纪,纪元.。",-99
3773001,东方红太阳升,-99
4680416,这尼玛的垃圾，简直服气了，没见过这么垃圾的股,-99
1780592,你不是很历害吗？对600727不看的，股票谁也判断,-99
742478,各位同胞，我乐家居熄火的时候，就是操底菲林格,-99
3789499,下周四要注意仓位了。,-99
1390131,受新规的影,-99
5472553,基金股 果然不能碰... 走人 来追大蓝筹啊,-99
4866237,深深刺痛我的心窝！没有这样坑人的！,-99
3624197,调控，去年为去库存，今年为,-99
1203060,容易失去理智善于思考,-99
1824733,11，光棍。,-99
3611439,放量滞涨，后市必跌,-99
367502,别闹！许家印争第一可能是想割韭菜了……,-99
3961034,又要像昨天下午一样破位下来。,-99
3553054,在任何市场环境下都获取正收益。,-99
3031197,最安静的股吧，死水一潭,-99
3876957,600360 我又回来啦。[微笑]。,-99
1568173,六国化工(600470)融资融券信息(09-27),-99
1028454,此票要吃点伟哥还能起来p,-99
4358317,没人喷啦吧,-99
4522872,45元左右是个合理的定价！！,-99
690931,那个大鲨鱼就是个白痴，一个人自说自话,-99
322500,今日云天化涨势不错，还是比较满意的,-99
4114713,业内预计地方调控将持续加码 二季度房价增幅料,-99
3362831,唐山港就像铜陵有色，板块涨，也不涨，回本就卖,-99
4781010,大家千万不能撤单买其它股，其它股票指数是仙人,-99
5106672,还有中签未走的吗,-99
4464503,生意社：9月15日绍兴远东涤纶POY价格上涨 9月15,-99
638841,两部委发文开展电力现货市场建设 8地区将成首批,-99
3053486,上下震荡 逢调整可低吸u,-99
4716110,为什么会买这呢？,-99
1457513,庆桃如过街老鼠,-99
882546,600658下午直线上升e,-99
5135497,任你怎么跌都不卖，爱跌就跌，最好跌停！,-99
4105861,我陪大家很久了，三年整吧。大家看我的历史贴，,-99
931299,股民致证监会问询函：海正药业亏损 高管高薪照,-99
3881716,一阴两阳，两阴一阳，再来三阴，九九归一， 五,-99
2255088,买一点保证发财庄家没跑马上要涨停啊,-99
1603551,明天高开5个点,-99
2958136,呵呵哒 压单呢 刚刚不是上蹿下跳这个压那个压么,-99
2409540,沱牌舍得(600702)融资融券信息(06-19),-99
3817604,准备明日大举做空的杂种，今天一定要拿点筹码的,-99
4554693,得邦照明为什么是节能环保股？,-99
5090232,为什么那么多喊拉高出货的。 很搞笑，现在的价,-99
388781,庄家对倒在逐步吸引散户排队买票，到3个点时下,-99
1745329,东北股票就是操蛋，尤其是黑龙江更操蛋！l,-99
3220606,日线MACD金叉，如果明天高开，正式启动，下周有,-99
3308494,现价7.20收盘价7.24,-99
1022130,中一个吧[鼓掌][鼓掌][鼓掌][鼓掌][鼓掌][鼓掌],-99
2880585,世茂也是不错滴，价值898天天喊买入，3年了，有,-99
3335981,好戏在后头,-99
3620494,000683,-99
4002463,超级垃圾场,-99
200685,记录，四卖，99，,-99
1298204,*ST普林：终止重组 12日起复牌。,-99
2499684,装逼雇水军.不如去公关或退出.,-99
2324307,这货是不是在期货市场上押错方向了？,-99
1676740,能卖就卖吧  套套来了,-99
3121135,"宏发股份 ,今天压力位 41.86 ,支撑位 40.59 ",-99
1853946,继续创造新低，我竟然买到了全中国跌的最狠的股,-99
4160301,吧里好多拖，这票不能买,-99
2082601,大家猜猜看：今天是缩量微涨还是放量大跌？,-99
5182278,锂电池技术实现重大突破 受益股一览,-99
320430,量缩小了股指走不高的，会掉下来的。,-99
2694252,反正这个价位有人在买,-99
2021111,东方财富好,-99
1969374,创业板不过是超跌反弹！,-99
1957213,请再一次回补17块多那缺口，谢谢！,-99
3460084,昨天的那个盘中拉高就,-99
2867037,上市公司应该增持一点自家股票，不能受什么 监,-99
2910454,我要上车 等等,-99
1706411,大家讲个故事：5月31日，奥维通信宣告易主并复,-99
2788987,周期股投资机会转向需求端,-99
210160,冠城大通的庄在自娱自乐！,-99
5284028,强烈呼唤万兽哥砸砸砸,-99
2234814,说15个跌停板的狗东西终于吃到一根骨头不来博吧,-99
3413378,某人出来就开始流产，都憋着。。。,-99
3165819,油价一入熊市深似海 OPEC似已黔驴技穷,-99
5263634,快跑变绿我就下手了。,-99
4368547,汇顶连续大爆涨,-99
1118137,破坏环境!早改关门!,-99
4848391,跌到22左右可建少量仓位,-99
3485753,中国国航中国国航中国国航,-99
999321,期金……1260上方再度,-99
5521783,难道下午真有奇迹？,-99
815999,看我名字，看我名字！！！！！！！开小号的犬儿,-99
2529609,买了吴中的就不要卖了，会涨的，没有只跌不涨的,-99
2908211,蚂蚁,-99
1427528,KDJ金叉加仓很安全,-99
2390346,坚定持有,-99
2723920,娘的，买错了，这股太弱，没涨停的啊,-99
5551234,603998:方盛制药关于子公司药品获得《药品注册,-99
3935759,最恶心人的股，没有之一,-99
3182611,长电厉害了,-99
1810980,巴铁,-99
