,content,mark
696852,凭什么，阳泉，盘江，西山股价高出大同这么多，,-99
2392720,还在装葱，赶紧下来吧……你就这鸟样了，垃圾,-99
4417131,这股虽值得中长期投资，但信披存在巨大逻辑误导,-99
2635118,回调就是买点[傲],-99
4683150,成功抄底，马上涨停。哈哈,-99
2845241,珠江啤酒携手阿里巴巴建立新零售平台,-99
629596,价涨量增 主力资金近期在加仓流入,-99
3439556,今天一拖最后一刻迎来了各路诸侯抢筹的场景,-99
1124061,庄家短期到了出货点，大家今天跟随减仓吧，还是,-99
3823309,昨晚欧美股市大跌，A股收官之战很关键 隔夜欧美,-99
4478396,要想解决新股燕塞湖问题也简单，就是一次性审核,-99
3186871,支持的点赞,-99
1658259,底部平台均价也有8元多，现在才9元多，跌破7元,-99
805599,600231,-99
4654106,我卖了，你可以涨了！,-99
848423,飞流直下三千尺，疑是银河落九天。还有怀疑会到,-99
5358829,再见大家清仓走人。不用送我虽然在这里几个月了,-99
2732463,每天撸一把.撸淫头子,-99
1828514,蓝海投资到顶了，有图为证。,-99
2132648,[大笑],-99
3192708,600909:华安证券:华泰联合证券有限责任公司关于,-99
2459257,外资入市和撤资都发表声明，我们的机构偷着干，,-99
2037876,新三板股权资本市场，国家扶持为什么不投！,-99
4155944,新泉股份净资产比这股多0.35元，也是做汽车内饰,-99
4224857,"由于严管""高送转""己成利空，质压式回",-99
1462192,跑吧大老牛,-99
3660714,36股破净 22只市净率低于0.9,-99
5391060,什么时候轮到你涨停了  [傲] 同样是雄安 你咋这,-99
4289413,天津自由贸易港即将登陆,-99
3873090,小挫票冷冷清清,-99
471004,继续冲高回落吧,-99
5530135,证券公司看好的研报出来了，看到50以上。大家怎,-99
4616839,按规定，证监会审核行政许可申请时，需要查阅当,-99
3527566,连续2天没T明白，成本增加1元，哎，只能说庄家,-99
2801867,标准的孕线,-99
2657717,这个股票钻皇...家里死人了,-99
883172,vv,-99
383294,北方稀土(600111)融资融券信息(11-09),-99
4809591,垃圾周景平，你有什么资格股权激励？还13.13的,-99
4601951,吴江银行(603323)融资融券信息(12-04),-99
3961106,中远海控，今晚消息主要利好军工网络股去ioe国,-99
4739810,这在卖房的上市公司中占据了较大的比例,-99
3825832,大单托盘危险也,-99
2042337,这庄家，就是压着啊[亏大了][亏大了][亏大了],-99
4086766,快速下跌就快到来了，准备接招吧，最好来几个跌,-99
2646964,好样的东挺,-99
5472904,7210 15，3032已查不中,-99
3814068,被几个减持的臭高管给玩坏了,-99
1027018,老许啊，我想了一晚，虽然短期行情不好，可人都,-99
1991984,反弹结束,-99
2049633,股价从22元跌到8元打三折啦，大股东心太黑,-99
2972757,远离炒作，长线投资,-99
1156022,大胆买进，等涨停！！,-99
4088032,垃圾,-99
1413417,快跑！要调整拉,-99
5230872,603488,-99
5304225,破发指日可待 加油,-99
2942645,我今天走了，买了4000股守4个多月，亏一白多元,-99
4289721,恒银年报业绩有0.7元？28元的市盈率为40倍，还,-99
2071464,首先就要将这个漏洞堵死。,-99
300347,不多说，只提醒一点：大股东成本6元，怎么卖都,-99
3737726,什么意思,-99
2909773,热切盼望香香亏损,-99
4959882,开始上车～,-99
1296090,完了癌股有找到下跌的理由了,-99
1355502,希望压的越紧，弹的越高！,-99
4539199,收盘最低价，弱势明显，如果现在还叫着抄底的，,-99
2343135,全国人大代表宝新能源董事长宁远喜：建议扩大商,-99
2979942,卖单是真实的，买的是假的。是卖单里面加了1手,-99
1113325,新力金融11月29日火箭发射,-99
2521390,祁连山已经彻底完蛋。,-99
1697200,百里挑一，价值牛股，你若不惧，便是不败！,-99
2762908,29.8再补500股[大笑],-99
1705282,要玩绿地控股，千万不要准备做多，以做空为主，,-99
1864480,老白干酒(600559)融资融券信息(11-22),-99
3301808,真变态,-99
2024915,定投亏钱 输在不知道何时卖,-99
919396,好股路桥建设，我们30元见,-99
1093488,任垃圾活的好吧？,-99
1624880,苏试试验的母公司,-99
1614325,600486:扬农化工独立董事关于第六届董事会第七,-99
4131597,基金被投资于美国政府债券、公司债券、优先股和,-99
335120,（明天）22号10点50分之前,-99
651365,600188在煤炭股里面是比较弱的,-99
1797043,这么砸，是要清仓吗？,-99
2250763,600661:新南洋关于签订资产管理计划合同补充协,-99
3352529,这部分是短线的开滦，还是觉得山焦是真龙头才换,-99
2818678,有狗小心被咬,-99
4251830,别急收盘创新低！,-99
5430956,九天玄女已买入民族大,-99
4697343,好股，值50元,-99
2848083,一日游，太急。小私募,-99
1672937,内地产首富易主：许家印身价超王健林,-99
1829462,应该会探涨,-99
4324890,钱是不是问,-99
4417929,603186,-99
5155177,还是泰晶科技估值太高了，就净资产比达志科技多,-99
4541681,今天诱多诱多，进多少套多少，,-99
238838,耍流氓，可耻 利用监管漏洞，无限期停牌，规避,-99
548546,你祖宗伊利节能涨停了。你个垃圾回家吃大便吧。,-99
2609124,问答:国务院印发的《“十三五”国家战略性新兴,-99
2149167,交投欲望好清淡,-99
4145354,操盘手吃屎的？还压什么盘,-99
555649,返回最高点,-99
1296811,视君之文,-99
5084941,今天洗盘结束明天收阳线,-99
5026003,股指期货就是妖精,-99
3189687,别被2次支撑迷惑了，大盘还在还债。。。,-99
4074471,处生庄,-99
5276047,这个吧已经被某些卑鄙杂碎用金钱捆绑，这个“相,-99
1084400,知道厉害了吧，这就是中国股市，看业绩炒股跌死,-99
1873343,部建设真不是一般的强,-99
548768,巨化下跌是因为巨化集团要发行可交换债券吗？,-99
4431728,TPMS强制标准马上就会发布！,-99
2276866,茅台股价进入高风险区域。合理估值300-360元。,-99
34936,垃圾，我这么辛苦赚钱都被你套里啦[哭],-99
970632,出三分之一，等洗盘再接,-99
4413610,跌起来绝不含糊,-99
4323659,看来8月是开不了，希望9月能开门,-99
5529178,老套路，下午拉红发新股，难道股价涨了，你妈会,-99
3241375,这弱狗只能等徐舵主回来操盘了。,-99
5244990,又来了[哭][哭][哭]了,-99
4407517,一旦封板数量减少，千万要抛，否则涨停到跌停是,-99
4028237,601992:金隅股份关于公开发行公司债券方案的公,-99
3379926,超级海丝……你回海润光伏吧来吧 ，那些追随你,-99
1475858,大家都跟着60亿定增的买，这下玩完了。我的大三,-99
948922,破位、破位、破位！,-99
3469665,19年老股民总是买了就涨，秘诀竟就在于此，震惊,-99
41001,18年铁路基建要开始了，下星期和这个有关的该涨,-99
4763198,好股，买入,-99
742454,8份一季报预告全数预喜,-99
5491606,换手率放大明显，今天涨停了,-99
397861,今天的表演结束了！都洗洗睡吧,-99
2926114,公司回收自家股份 达到 85% 90% 以上 早就说了,-99
3040802,我喜欢出奇招面,-99
3749558,儿童暑期电影推荐      小兵张嘎   红孩子     ,-99
4575125,NND。陆续涨了七天还没有一个涨停多。还有最后,-99
4730675,先是肾阴虚，后是肾阳虚。[亏大了][亏大了],-99
3709579,比工商银行还要墨迹,-99
1864836,赶上茅台，追上五粮液,-99
2748287,超级细菌 新华社香港8月31日电（记者 郜婕 张雅,-99
5475236,客来鸡店不用套，扶摇直上好逍遥。,-99
2831834,时的重要跳空缺口，因此沪指运行至此将遭,-99
2754807,600791:京能置业第七届董事会第四十九次临时会,-99
3511933,不会是还要破昨天的纪录吧，18．68,-99
2171932,我给你们送个逢逢元空间?,-99
193994,根据公告，公司以25.52元/股的价格向国调招商并,-99
4573948,603313:梦百合2017年半年度报告,-99
3052997,2017年7月26日、27日为中长线股友彻底清仓的最,-99
5161104,，北京等全国10,-99
3119398,每天套一波杀比。哈哈,-99
3927246,真稳,-99
1468930,湘电重大新闻:推进军民融合 激发湘电“动力”。,-99
1814332,下午1一一一2一一一3一一一绿！?哈哈哈哈哈哈,-99
5140529,第一次闪崩,-99
1673078,散户看的懂吗?,-99
4067686,小心诱多,-99
1911178,600572:康恩贝:上海东方华银律师事务所关于浙江,-99
5529009,外资为什么第一买银行，因为跌破净资产了。,-99
2582045,怎么向董秘提问的？ 在哪提问。,-99
5545692,上市开盘15.15，中新要当第一名？,-99
1478264,都散了吧，赤的出货，别在意淫什么 重大事w,-99
5017808,又现劣币驱逐良币，为管理层点赞[微笑],-99
1262624,继续半仓滚动操作，同时减少操作T操作，以免被,-99
790009,太贪了中化岩土停牌前没卖出去。,-99
4640567,主板好久没发过帖子了，因为发了也没几个看的，,-99
1121587,加仓吃进120万股,-99
5053039,又12只新股IPO，周一挂跌停板清仓！,-99
232906,[图片],-99
1040353,盘久必跌，让我们会师2379,-99
5305946,董事长要员工持股，坑完股民坑自己员工，猪军真,-99
5402305,量越来越小、怎么回事？？？？？,-99
2260438,哥伦比亚影业13  22.5  1.761.201942  18.0,-99
3434302,什么情况？怎么没出公告啊？明天会开盘吗？有请,-99
1676340,MB，红一天跌四天，你去死吧,-99
2472228,出生正在制造股灾5.0，请问哪个国家这么胡闹？\t,-99
3064018,永辉市值成功站上1000亿,-99
4088371,就是其中的重要代表公司,-99
4429295,在哪里上的课上这抄盘来了,-99
5241898,上证指数_TUES_红脸二_3233.860,-99
2282025,大单压盘砸盘猪狗不如是婊子养的乌龟王八蛋。。,-99
3871222,科恒股份表示，其业绩大幅上升的原因主要为，报,-99
1979237,希望全体股东联合起来，声讨泰豪集团同方股份不,-99
2573388,杀跌才刚刚开始，昨天尾盘证明是诱多，暴跌开始,-99
333893,估计龙头还没确立，只能一个一个打压。,-99
948930,已经破位,-99
1632441,除了两只妖股还能扛住，今天很多兄弟伙被新股算,-99
941088,涨的时候 一丁点 跌的时候死命跌  能不能好好玩,-99
1133577,建行太弱了吧，看看隔壁的工行。,-99
2031981,注意注意：以下是秒,-99
1786434,坚决要求公司高管开始启动二期增持持股计划，用,-99
837062,8．5代线产品交付\t,-99
1591223,今日买入，希望赚点菜钱。,-99
2905416,周一重点关注军工股！,-99
2024261,这股有庄吗？明显是死狗。,-99
5074333,准备123[大笑][大笑][大笑][加油][加油][加油],-99
5333876,增量路漫漫，A股越做越小，回头是岸。,-99
3575221,估计很多人吓尿了。,-99
2680827,不抽烟，不喝酒，不熬夜，喜欢总结，,-99
5306645,今天加了一点，越跌越加,-99
