,content,mark
3789155,不会这么怂吧，洗牌？,-99
286899,拉涨停吧，反正卖了，昨天进的四个点知足了，不,-99
205247,11月产销回暖持续，看好12月份销量表现,-99
471807,18.88要发发发,-99
1542154,究竟是,-99
4232607,大家看他的日k阴线都是以跌收盘,-99
2731514,国家加大了对房地产的调控力度,-99
1444520,哭的，喊的，骂的，疯了的;补仓的，割肉的，做T,-99
1293808,上午低开 缩量 筹码稳定 资金未见流出 有吸筹痕,-99
5152264,股市跌是由于被央行刷了,-99
3773776,走了，还需探底。不等了再见,-99
358354,孟加拉项目是否已经开工？,-99
1486373,证监会发审委员80名候选人公示：80后1人 8人来,-99
1294762,升了,-99
3496110,其实现在浙江才开两三家盒马生鲜，五年内应该开,-99
1429980,主力在偷偷地建仓，散户别再割肉了。再跌可能要,-99
2825989,奶粉注册制倒计时影响,-99
4395002,请高手指点下603218！,-99
746245,极致缩量……,-99
1652830,驰宏锌锗这吊毛董事，陈青不是2B就是脑子进水。,-99
5505813,这黑四对于深圳烂股来说真准啊！,-99
3716316,那个猪头成交3个亿无论涨跌都卖，就你天天一手,-99
2646623,再等4天,-99
2670414,市值不做到50亿，重组就要失败,-99
2147377,2016  年公司剥离中技桩业，收购宏投网络51%股,-99
4844213,死不涨,-99
3794263,旗滨集团为什么每次股价一拉起一点，超大资金不,-99
329409,哈哈―！准备”,-99
4055096,其实我们发现主流资金的方向很简单,-99
1751099,通润装备盘小绩优价低,-99
285926,这股估计是主力没啥现金，被另一方庄压着打，估,-99
465722,没法玩了，大盘涨它大跌，大盘回调它暴跌，没指,-99
2412653,安抚姚老板，变相的认错！,-99
2488157,2017年大牛股，，明天开始数板，大家有多少钱都,-99
2348093,止股还在持有吗？两年都没一个涨停板！远离这个,-99
4755869,这半年买进吉吉的人可能都有胃病啦吧,-99
5533720,我真的扛不住了，我就是一名普通的打工仔，每个,-99
254428,兴发集团启动，速买澄星股份,-99
3780900,分享到 中交、保利、中冶等至少10家央企启动内,-99
62346,者在这个问题上有明显相同的观点,-99
3134205,以为你是条龙，原来是条虫！j,-99
1643806,2分钱又可以上下日几天了,-99
1949705,#袖珍盘高成长中设股份必成中小板最高价股王,-99
2469788,东软集团与普洱市签署智慧城市战略合作框架协议,-99
4151758,`尼妈，垃圾,-99
5529796,这支股散户太多了,-99
3938695,主力兄弟。我进1500股怎么样？,-99
1721210,这样的炒作手段还比黑社会更黑更绝！a股没得救,-99
4477931,爆炒过的继续下跌。没爆炒过的横盘寻底,-99
2924442,主力你这是想往地狱走吗？我想拉你一把，你总得,-99
4265618,你这王霸庄千万别拉，我就八千股，跌一块买一千,-99
5321571,人的生命和精力是有限的，应该给最喜欢的人和事,-99
3753066,申通快递员因遭投诉被罚,-99
4858113,庄超级控盘，上面压着下面不挂买单，涨跌都难出,-99
3262885,废材股份真是废物,-99
226677,华北高速主力施压，三方资金开启护盘模式，抓到,-99
4631798,本人22.31买了点，会套吗？,-99
5309505,[图片],-99
549782,"巨化股份 ,下个交易日,压力位 12.11 ,支撑位 11",-99
5340338,同志们该进了！再洗都脱皮了[买入],-99
1868774,典型接货呢！,-99
3638913,日线支撑4.92，周线支撑4.96，放心持有，现在最,-99
2097249,你们队 有需要 点化的吗 有的话 我可以让人事,-99
5421166,下一周至少涨5个点(一周),-99
4623678,这是一只被主力遗弃的股票，是个鸡肋，昨天下午,-99
4787607,明天低开……等死吧……洗洗更健康……,-99
2951691,本周有大阳,-99
4997041,割了五万块，再看到它接着跌却有点开心,-99
5209867,明天寒锐钴业只要涨2.7%，股价就站上十日均线，,-99
3205593,涨的概率1000%,-99
2123085,中国最大的地产行业福建高速也是垄断行业公路收,-99
4603683,吴江今天下午应该会发送一个小火箭弹。抓住逃命,-99
68951,坏了，我刚走68000股，他就拉呀，我可亏死了。,-99
2650976,600764:中电广通第八届董事会第二十二次会议决,-99
2445346,天齐吧，著名的死多头,-99
2827556,诱多，还是诱多,-99
2480740,包括住宅房产22套、商业办公房产23套a,-99
4447868,机器人制造，今年必过百元！,-99
5261547,市盈率只有35倍，严重低估，打压股价,-99
2627619,子弹已准备好了，好发矿难财[拜神][拜神],-99
82766,看好山东钢铁600022股票、看好上市公司菜钢分所,-99
4252961,47卖了个放心，创新高还是要高抛低吸，,-99
1244005,抱最大的希望，为最大的努力，做最坏的打算。,-99
84980,现在都变成了心里没底、。,-99
729587,便知,-99
2101636,券商指数8的不行，涨没涨多少，跌起来还挺快的,-99
3928861,如果9.7元不能大幅反弹，那么这股会连续阴跌跌,-99
3598088,主升浪开始啦,-99
4491980,铁树开花，奇迹！！！！！！！！！！,-99
4003533,速度买进，下午涨停！,-99
3163399,今天收盘必必跌，跌幅能控制在1.5%内算不错了，,-99
4449246,再说一遍东,-99
416894,长江投资(600119)融资融券信息(09-12),-99
1133682,成都的老乡些，你们在,-99
4039101,很多人拿净资产说事，其实净资产和股价没多大的,-99
2679948,无教导他人之意，谩骂！爽了您的嘴皮,-99
1120610,开盘拉升，恭喜,-99
93113,我早就说了这股垃圾 ！你们偏偏不相信。,-99
3777311,保险股的排名,-99
3959849,4.92的三万多手，是谁的？？,-99
1733049,快跌停我好买！,-99
2108944,我不等他了，我买华菱星马了，盈利再回老抄底,-99
3453218,现在不买你只能尾盘去追高,-99
4845561,还没买的兄弟们千万别买了，这股要到12元左右，,-99
553833,天坛生物 品牌+成长+混改+并购 (11股),-99
4240021,小散的兄弟姐妹们别买呀！都是些托在洗筹，大丰,-99
1701088,股市盈亏情况以及,-99
514134,为什么走得这么累，天天这么累,-99
3792123,外资减持后一直阴跌。这是为什么？,-99
1408305,走了，主力太弱。没希望了。,-99
406214,学会孤独，没有谁会把你当宝护着。,-99
2467218,雄安四月还有大量小散做套牢，主力拉高拉高就全,-99
635253,圆柱三元电池开启21700新时代,-99
3846393,拉拉拉飞吧满仓,-99
3583099,清仓买入中国银河  券商爆发,-99
33055,这个祸害公司坑了不少人，遭雷劈,-99
4749616,多日黄昏之星小心。,-99
1915699,机构跑光光！,-99
3990130,认命，保险类别股票很多都走出新高了，金钼却只,-99
2250925,储加息开绿,-99
5281630,我宣布：四通今天跌-2%以下收盘！,-99
3842296,瘪三赶紧破8吧,-99
3090220,数据港虽然,-99
774254,到底是跌不动还是涨不起请唱多的搞清楚,-99
994460,上市二十年，复权价二十元左右，连CT都不如，查,-99
3101499,逗逼，主力你赢了，我撤退,-99
1950767,天地科技他妈的好坚挺啊，吃伟哥了吧,-99
3430160,市场弱势特征可谓一览无遗,-99
4994684,这是清源和如通的走法,-99
3331206,603223 恒通股份 002778 高科石化，下周一早盘,-99
4890159,常青股份半年净利润为5416.15万元，同比下降28%,-99
3379084,证金持有申能股份.亿股，你懂的！,-99
1693444,搞不清这辣鸡股跟那个指数？,-99
2533047,下班了下班了。明天再看。拜拜,-99
2448072,服务效率低,-99
5230128,速度卖出还有低点,-99
550646,600160:巨化股份2017年半年度权益分派实施公告,-99
4351762,真恶心，大盘都三千三了个股普涨，你还绿？,-99
2110521,送点干货，T+0的特点,-99
4649323,知足了反弹4元了!,-99
2677748,吓死人！,-99
701734,哈空调 东北企业的垃圾企业 以后你空调都没人买,-99
4628875,爽歪歪[卖出][卖出][卖出][卖出][卖出][卖出][,-99
2024587,确实垃圾好退市了,-99
2930150,上海机电(600835)融资融券信息(09-14),-99
2691114,600774:汉商集团2016年年度报告摘要,-99
1262973,江西铜业股价如此低迷，是有重组等大动作，主,-99
1207237,草甘膦涨价概念股3日走势活跃，截至目前中旗股,-99
5143214,主力套路如下所示,-99
1927688,不像原,-99
732981,从中国证监会通报的情况来看,-99
1883170,一个中心两个重点下的简单交易法则,-99
2222828,毫不犹豫卖卖卖！,-99
2427374,吧里很多人说收到短信？这样看来这是个老鼠仓啊,-99
363267,捂紧筹码！,-99
4794809,今天回来看了一下，妈丫这是什么股？我63.5全,-99
5386490,今天砸盘狗没上班呀,-99
2356212,跌停开盘的今天很多，三毛其中一个,-99
3149783,块卖了这个垃圾，买大智慧，涨停,-99
3299736,怎么有点方大炭素起爆前的感觉？ 这么大的资金,-99
1056189,一年没涨，嘉华能源的高管董秘们，你们有何脸面,-99
2210567,完全判断基本正确虽然没到3087但已经不重要了，,-99
5390433,定增价出来了是10.47元，要的赶紧,-99
4628319,请看空的高手解惑，今早盘为什么股价只在14.01,-99
1965538,坐拥美好温暖的记忆,-99
106675,中小创里被错杀的绩优好股遍地都是！翻倍都嫌低,-99
3456950,仅就技术面，对中南传媒做一个简单的分析。 1、,-99
5264628,是走还是留,-99
1238009,这个二逼股，连个做差价的机会都没有，,-99
1757032,天天阴跌 强烈要求停牌自查,-99
1317817,因此在空头手中仍众多王牌下,-99
4122820,603025,-99
836895,2017-5-22周压3104下支撑3080不跌破自救，区间3,-99
479792,今天跌停 我就去证J会举报 有人恶意操控股市,-99
4029576,康耐特:独立董事2016年度述职报告(郑琦)z,-99
499133,亿纬锂能:关于控股股东可交换公司债券换股的进,-99
3344006,混改走起，助力过3300点。,-99
930941,海正药业(600267)融资融券信息(07-28),-99
389909,早上蛇口吞大象，哈哈，要把多少笨蛋折腾成疯子,-99
1622326,磨B，终于从黑色磨成红色，但个股还是不举。,-99
4735411,银行系统有奸细，而且,-99
2693422,南京熊猫(600775)融资融券信息(12-14),-99
967432,居然跌停了，害人啊,-99
4115916,资源股重新出现领涨股[摊手],-99
3709342,这轮必暴 最少35%,-99
2816034,朗玛信息：,-99
5204811,昨天在601669中国电建推荐603798康普顿，2000人,-99
212899,垃圾至极 无耻之至,-99
138567,吧里的空狗太多，害得我卖了,-99
1462464,明天涨板[大笑],-99
1708931,方展博快点扫60万股，速度涨停！,-99
1935140,A股已进入二维投资时代,-99
64695,收盘在8.06下方，我就减仓，甚至会清仓[傲],-99
618248,实在忍不住了10.95第一次抄了狗庄的底呵呵,-99
4534468,尿性,-99
2960719,接下来就是阴跌再阴跌 连续阴跌 一口气也不让狗,-99
878848,喝酒后要吃药! 喝酒后要吃药! 喝酒后要吃药!,-99
760882,今天跌停，立帖为证！,-99
3699864,卖出.停几几天不玩,-99
1274239,600209:罗顿发展独立董事关于董事会换届选举的d,-99
