,content,mark
606815,中国巨石(600176)融资融券信息(07-26),-99
3591574,5.56出8000股。,-99
789478,任何股市在某一个特定阶段,-99
5395490,尼玛出了你就红,-99
3242037,国企改革股没办法，养的饭桶跟废物太多！要是私,-99
2756064,完犊子了,-99
1704377,已死,-99
1500815,上市十几年连研报都没有。董秘也没有。这个公司,-99
1200927,大家再不要相信唱多的，说什么长飞光纤上涨，人,-99
5277057,这垃圾看看尚品。,-99
229302,600072:中船科技关于公司全资子公司下属公司向,-99
297773,大盘再洗，散户的有杀手本性。加仓,-99
1136321,追高了，明天割肉，都是游资，概念不强劲,-99
513663,证监会应该规定，中国股市不得停牌。,-99
4176812,这河边一个小厂房也能上市？?,-99
1639197,业绩差的估计以后会遭到股民的抛弃,-99
1289387,集体诉讼赔破产，三房巷彻底完蛋。10一4现金都,-99
2347511,第一创业更名公告,-99
3278062,金融硕鼠汪立成，操纵股价，侵吞国企。,-99
4077355,今天这是关门打狗！,-99
3762346,反击战打响。,-99
4977902,明天星期4开光伏大会了，明天大涨了,-99
794968,所以才让我们在这里有信息看、有博文瞧、有股票,-99
1210691,优质股，良心帖，实在话，机会大,-99
2636336,就是这么走,-99
1982985,买入。目标35。,-99
2861003,山东海化:2017年度前三季度业绩预告,-99
2047551,大盘虚晃一枪，把同济堂刺于马下！u,-99
4268689,“白酒鸡尾酒”海外走俏 老外：喝了这杯，再来,-99
3287922,你怎么跌，我也不卖，不割。,-99
2744224,今天的盘面指数没有跌多少u,-99
3023447,车牌什么意思,-99
4747110,你妈的，我回老家就这样傻跌？,-99
3141455,预计3220是本次反抽的高点。e,-99
5516009,2元拿到8元以上可以,-99
4793764,603507:振江股份关于股东部分股权质押的公告,-99
4931706,闭着眼睛随便买一只都比你好，买你真是瞎了眼，,-99
3440764,不要同意东,-99
5462210,“望闻问切”大盘  猥琐的成交量是根本症结,-99
2055035,今天这个图形感觉很强劲的样子，来个涨停吧，又,-99
2480980,要跌停了,-99
2275362,相信我，赶快杀入抢钱啊，明天开始暴力拉升，不,-99
3526731,新城控股(601155)融资融券信息(08-25),-99
1795263,亿晶光电(600537)融资融券信息(09-07),-99
3323409,散户好多，主力惨了！。,-99
1813665,借壳借到下水沟里去了[摊手][摊手],-99
4152041,今天可以买，不创新低,-99
3561525,今天洗掉几个小庄。,-99
1577888,猪海就是狗养 换个马甲叫虎B 言而无信不要,-99
4711350,蠢蠢欲动的庄准备拉升了,-99
1957866,什么意思…,-99
505493,又是走走停停。,-99
2790563,所以目前磁卡积极注销被曝光的隐形公司，也就是,-99
1131692,底部出现了吗、二次探底结束了吗？答案在此,-99
3927387,雄安又开始了,-99
3130853,咯咯咯 年年业绩翻今年4倍 今年净资增55亿25% ,-99
13595,现在加上业绩好,-99
4289886,就是一个生产ATM机厂子,-99
568873,国三货车淘汰进入倒计时 谁能率先守护“北京蓝,-99
2183791,你都年公司,-99
329956,电力板块再涨，你在跌？有你的，跌破7块我再加,-99
2097721,这种古式国人都难相信,-99
5304893,骗子公司上市害散民,-99
368788,已举报,-99
2087521,一路下杀，目前仍持仓的，个人觉得也没必要割了,-99
3143723,600890:中房股份关于回复上海证券交易所二次问,-99
4444262,收盘42.18,-99
2496011,你这垃圾，看看成交了多少[不赞][不赞][不赞][,-99
4798715,5年内我国3万多台轨道车辆运行监控装置将换装 0,-99
4146002,美银暂停一切交易 海航遭华尔街冷冻,-99
471313,不回到大股东增发价20以上誓不交枪,-99
235318,我已经买入,-99
2308796,闻泰科技,-99
3234776,吃的津津有味！,-99
5013619,这个就是小S们的筹码,-99
4803360,而这一模式早已遭到监管层禁止。,-99
2052344,过去没成，现在这个熊,-99
1417118,别打暗号了，傻逼猪头三，谁都知道你要卖,-99
1093060,中国汽研12月19日火箭发射,-99
3742990,中石化系,-99
4830414,看龙虎榜，实力资金都走了，开始小散踩踏了,-99
1811966,穆迪下调国家主权信用评级，未来一周是最 难熬,-99
3247001,看好福成股份下周强劲表现,-99
2395585,不会吧 均胜电子 都涨就你跌,-99
3887581,国企改革可能是最大受益______________________,-99
2764874,ST宜纸称半年内无重组 但不排除非公开发行可能,-99
4580573,好多神经病说跌停，上升通道这么明显，吓得散户,-99
64757,上港集团(600018)融资融券信息(11-13),-99
829841,尼玛，这样就被砸下来了，好牛逼！,-99
2489235,2017买什么？呵呵呵！。,-99
5314955,这些债券按面值发行（100％） ,-99
5233305,此股将会跌破30，就在不久的未来,-99
69144,"以后叫宝钢""""小钢炮""",-99
3527337,601155:新城控股竞得土地使用权的公告(2017/8/4,-99
4634476,坚持，坚持，打气,-99
4426327,603189:网达软件第二届董事会第九次会议决议公,-99
5503677,江苏中理网络科技打破行业潜规则，被骗局，发布,-99
991677,股价由大股东说了算，看看000157，庄家长期不计,-99
4315926,今天好像又被骗进来了好,-99
4827308,补跌开始  跌停,-99
1216277,我只想说，这个消息，对山东高速来说，是个小利,-99
3453281,150多万元满仓被套好几天了，你敢跌你再跌我就,-99
4856,邯郸钢铁  最近 涨停  有 依据,-99
3240407,这一板块隐。,-99
3925791,闽东集强势于一身，这个价位，老天爷都会看不下,-99
1793728,傻逼“底部唱多的托”，以为一直唱多股价就一直,-99
2768625,看这表演，周未得发14只新。,-99
4729887,股价的短期变动与经济变化及公司业绩毫无关联。,-99
3187382,筹码全到散户手里了,-99
3365583,预言同煤和浙能合并,-99
3307155,"庄啊好久没涨停了,早泄一次吧[拜神][拜神][拜神",-99
5195343,操，创业板这么涨法，高发这么死了，真有点烦躁,-99
4245996,辣鸡，继续往下砸！,-99
1373121,好久没有n看到吹风了，唉，估计被抨击地遍体鳞,-99
2101559,宁波热电已经启动自动买卖程式，有红马上卖出，,-99
636887,两根K线实体越长，反转越显著,-99
5030719,康隆达你么的阴跌不停，我就不卖耗到底,-99
614610,重大新闻,-99
2134051,这么大量能，位置不高，不应该是出货呀？,-99
1880119,法拉电子8月14日盘中涨幅达5%,-99
71776,坚持就是胜利！！！千万别倒在黎明前的黑暗边缘,-99
5360840,压力重重！下周突破，全靠它了！,-99
4947959,房子是用来住的、不是用来炒的,-99
2485587,那些没上车的，胆子又小的，怎么办？我来告诉你,-99
3449705,明天反转，抢筹码,-99
5058903,求中一签吧 赔好多了,-99
5555732,卖啊，你继续卖啊。,-99
4532326,什么样的人炒股会输钱,-99
3618994,同时p,-99
4364654,给点活路吧，跌不见底,-99
3641690,从东方明珠重组的4个公告看，南北车T日一目了然,-99
1231320,卖一有1万手压盘,-99
2911458,又一波勒索病毒来袭：始,-99
2568962,两市公告精选汇总：河北宣工拟收购四联香港%。,-99
1693598,资产注入预期,-99
1773355,铅隔夜暴涨[胜利],-99
1241559,早盘策略：加大积极财政政策实施力度,-99
1840476,估计明天再添一兵。,-99
5418131,金桥信息(603918)大宗交易数据一览(08-09),-99
4137449,要带帽赶紧带，打死都不卖,-99
681561,买进~,-99
777074,这个公司真是年年亏损吗？,-99
4766150,4万元亏的只剩下2万五了,-99
3679621,垃圾[不赞]抬不起的阿斗。[不赞][不赞],-99
1347717,打在僵尸股上终于有点反应了,-99
3146591,傻逼越来越少，聪明人越来越多，傻逼庄骗人的伎,-99
1022204,西水股份！净利润增长6341%！中财网报道！,-99
4252123,先达现在留下的的散户，散户和散户直接的较量,-99
3131280,高位整理即将结束,-99
2794549,你还要莫几，一脚油门老早到站了,-99
1184292,你还真是万红中的一抹绿，还没减持完？,-99
3034758,明天会不会又板?,-99
5495713,正川股份网上发行最终中签率0.0277%,-99
2724787,如果会买你就做T，不会最好不要动筹码不要白白,-99
746182,跌到7元不是梦,-99
2177968,动手了。,-99
2564198,现在坐庄很爽,-99
2650942,挂卖单的朋友，你们神经了吗？。,-99
3144824,600891:秋林集团关于签署通用航空产业基金框架,-99
3883492,果断加仓五手哇哈哈,-99
3523781,看60分钟，MACD死叉赶紧跑。越前低。肯定的,-99
4977521,买吧买吧，保你一买就被套,-99
900112,如果能搞到钱，或者是还没有惨到这一步，还好。,-99
2464942,乌鸡最大的特点是与世无争！任凭风雨阳光与乌鸡,-99
2179927,6元上方坚决卖出 5元下方放心买入 让大机狗去死,-99
4689993,又在逃命逛奔！,-99
4989426,你们这是要把主力甩下车,-99
2164837,为什么不能实现自己的梦想呢,-99
2739693,招聘会上的9个笑话,-99
508973,今天都跑了，我也拜拜了,-99
5089098,大盘想周五涨比登天还难，主力是不会让大盘周五,-99
201874,看你磨到什么时候。,-99
4389299,资金流向贫困地区企业   亏4块了,-99
74180,走了，十分讨厌的票。清仓。,-99
45968,现在又面对600家企业排队的“堰塞湖”,-99
2713343,跳水队出场,-99
5302244,是否还记得曾经讨论过大小非解禁的问题以及准备,-99
1020709,27收了1100手；明天集合竞价派发,-99
3328408,周一突破76,-99
3877558,金砖国家合作，海洋资源和平开发，共享海洋已经,-99
1582909,收盘价12附近,-99
650292,再次强调：。,-99
3411084,垃圾，光知道跌，赶紧跑,-99
63563,6.21元卖出的，TMD欲哭无泪，死庄猪庄。。,-99
1645024,这股票要冲过7.5元才会起来，冲不过7.5元是起不,-99
3719782,娃哈哈 吹牛不上税风景1990就是老垃圾老骗子小,-99
5376944,追高了 麻麻的,-99
870902,此吧已被水军占领。,-99
4605013,无江能做领头羊，带领银行吸引人气,-99
172710,华泰2017中期策略会：下,-99
1345163,002835看表演,-99
93893,西南证券,-99
4756064,今天有多少人速度快追进的？,-99
1043516,上面写着，当你在国外遇到困难的时候，不要恐惧,-99
290681,南下资金把港股当成A股炒！港股通“双雄”镇住,-99
2195875,同达就是中国股市中的股票僵尸样本，公司主营处,-99
3477861,说一下这股的过去现在和将来.,-99
1244548,本周迄今央行已在公开市场通过逆回购累计净投放,-99
153478,广厦最大的问题是楼家的人品与二代的能力。在浙,-99
4488640,看到有唱空的，哥也就不急了,-99
