,content,mark
3151587,狗庄还没死完吗？,-99
677702,7月27日云计算板块涨幅达3%。,-99
656137,今天涨停?,-99
1590079,大胆跟随超跌股,-99
42277,公司与北方稀土根据稀土产品市场价格实际情况，,-99
1924272,早卖的早发了！早卖早发！,-99
3633748,是很愉快的，每次,-99
2000579,还不快跑  到6快了,-99
1590843,胡说八道的多。,-99
421334,上次已经说。,-99
4004814,积极拓展金融业务移动化 信雅达(600571)传统业,-99
137246,600039:四川路桥关于会计政策变更的公告,-99
802531,这个价位完全是造福的价位，跌3个点都无所畏惧,-99
560391,华资实业也是非公开发行股票，停止，今天跌停了,-99
3185554,撑不住了，开始砸了！！！,-99
3346214,就服你,-99
3690583,新人报道！15:21标题要长长长长长长长长代,-99
4717099,连他妈竞价的 人都没有,-99
3257343,加仓，买入博反弹！,-99
1220910,概念不少，就是不涨啊\t,-99
3251720,这只鸡就是扔在路上没人要操的那种。一天一报到,-99
1988145,600592:龙溪股份关于部分航空自润滑关节轴承通,-99
5086162,现在只有Fool才不舍得跑！,-99
1791830,这盘面，明天继续下跌可能性很大，短期阴跌为主,-99
3812348,宝钢2017年半年报于2017年8月25日披露，期待好,-99
4879755,带劲的跌带劲的跌、,-99
3542333,我回来了 炒个短线就走 [微笑][微笑][微笑],-99
890267,哈哈满仓接回来。,-99
4159638,一时半会起不来，减仓去中金岭南,-99
2723213,不跑的是傻逼,-99
2503778,不过,-99
877729,储蓄又贵了一分？不等了！,-99
1996518,对于益伯任何价格卖出都是最正确的选择！同意的,-99
5478583,主力干到涨停，明天跌停板出货依然有赚头,-99
3746525,成交惨不忍赌，央行加,-99
3878391,悟行爷爷准备明天买入油服，11元以上买入。,-99
1273530,《规划》要求，从2017年起，海南停止审批新设非,-99
2706851,又一“造富”路线图浮出水面！A股“新妖王”正,-99
1532470,跑了，拜拜。,-99
4563417,股本一直]有增发，说明庄家惜筹，对自己的产业,-99
1947648,华北高速今,-99
4338359,本厂主要承担航天事业所需要工装设备的加工，如,-99
1177208,借钱清空 节后再决定,-99
4910380,再涨可以有,-99
3898682,在中车前波人上当后波人不相信会上当，后波人在,-99
2704198,很多个股的筹码在集中,-99
4935304,603607:京华激光独立董事关于第一届董事会第十,-99
342965,目前 ,-99
3979793,想拉太高不是一件容易的事，拉到11.3出货吧\tl,-99
1647900,精工钢构的朋友们，你们好吗[大笑][大笑][大笑],-99
3282944,明天上涨5个点就好了，阿米拖佛,-99
653588,终于站上五曰线，心态转强，可以逢低介入了。,-99
2639991,赶紧跌啊 咋跌不动了 要排第一才牛逼。,-99
1085908,对倒洗牌吗,-99
3002361,春兰股份来个涨停试试吧！,-99
3723231,等待中n,-99
4885942,跌再凶不放量有用啊！,-99
2372753,范风险不出乱子、服务市场和实体经济迈开步子，,-99
4478864,好假啊！就知道用大单,-99
293946,"能量潮稳步走高,五线向上牵大牛",-99
3519589,14.82的成本27000股，看来要套着过年了,-99
4978514,亚马逊市盈多少，乐视,-99
5334607,洗洗后压力不大，继续上冲吧,-99
2636431,真的飞了,-99
3362746,可以换成科技类股票t,-99
64,今天我大A股爆涨两个点哈哈。,-99
3266365,截止目前两市沪、深股通合计流入约16亿左右！e,-99
1711455,又嘱咐麝月打点些东西,-99
1273930,三季报也不出来了，看来得周日晚上了,-99
2829144,性改革：“三产融合”是,-99
2887921,呆哥被洗出来了,-99
3032866,其实证券市场随便找个小商贩都比现在搞的好！,-99
2704643,三个红小兵多头排列成立,-99
5487742,你嘛，核概念起飞了，你特么横着，雄安你属垃圾,-99
4677320,哈哈哈 咯咯咯！抢盘? 职业年金入市比例暂定。,-99
4026851,哈哈哈开心的一笔跳水比赛。,-99
162687,完全看不懂了,-99
2516043,之后迎来反弹，但从力度以及广度上说，这,-99
5292074,这是什么情况,-99
2478678,谁在卖？,-99
3877174,尾部上翘，啥情况,-99
760258,下周垃圾股跌飞掉南铝白马走慢牛到填权,-99
757333,3.6亿股本的全柴动力，一旦定投，流通筹码买少,-99
4085356,深港通继续净流入,-99
3809036,儿子，装下？今天来个涨1分？,-99
2937631,有本事跌停,-99
3037203,e现世了，退市了免害人,-99
1004839,掌趣公司放任股价一路下行 甚至是放纵 管理层是,-99
2763458,券商知道我们是分仓系统，,-99
3976236,只是拟减持  都没有披露慌什么  万一再减持转股,-99
1356536,新华都因重大事项停牌15天就复牌，已有6个涨停,-99
929250,为何都我我。,-99
5153530,什么时候停牌，来个重大资产重组吧,-99
1528127,上市以来最惨的时代到来，再见！,-99
72377,逃命吧,-99
429834,买呀！！2,-99
3822438,拓普集团2亿投建汽车内饰功能件研发制造项目,-99
2588480,诉讼费用需由原告预缴至法院，法院判决后将由败,-99
2513953,重百106亿市值，王府井161亿市值。重百落后20%.,-99
3627164,还称已经拿出了房产加实物总计7亿的资产来兑付l,-99
1109597,，就喜欢每天的绿了吧唧,-99
616627,快跑东好多,-99
2797222,秋林集团进一步的积极加快自身升级与转型的重要,-99
1318724,为什么股民不爱买你的票深思一下吧…几分钟才交,-99
2065291,那么理所当然就应该将这个大毒瘤摘除掉,-99
1949078,她说住了多少次院了,-99
2406080,业绩才三毛不到，太贵了,-99
4408701,被套舍不得卖，三月份到现在亏了百分之四十，亏,-99
947929,垃圾，大跌小涨，永远这样死货,-99
4375372,明天会是我在荣晟的最后晚餐吗？,-99
1322033,国企混改 鲁信创投 打造专业化国有创投平。,-99
2517486,2017年已经破位腰斩！2018还要腰斩吗？,-99
3468557,都割肉了？不出声干嘛？？没有散户了？,-99
4429723,都在等中报这只靴子落地 可以涨停了 6千小盘,-99
5237554,遛狗目的~把狗引出来,-99
1931476,热烈祝贺京能电力跌破四块，预祝力争年底 跌破,-99
2135527,送钱啊，沙比庄，你们不要我要，明天继续干！！,-99
4196921,天量巨额资金出逃，利空出现，迎接连板跌停！,-99
4948533,房子是用来住的、不是用来炒的,-99
2468706,只有改变现状,-99
3633054,说知道了,-99
2387325,周一不拉个让秒点A我就,-99
5183928,抄底你我我,-99
3599045,林洋能源换股价是多少啊？,-99
5353631,压盘帮人家做嫁衣了,-99
118882,深圳市三木智能技术有限公司,-99
5087044,劲爆上交所官方确认重大利好，大涨在即,-99
2767704,老夫怒增持1手，把股价拉红了,-99
1830262,买点25.3至26.9,-99
1118858,良好的耐心才是盈利的基础,-99
1930822,"大户对倒拉盘有气无力,没有观众",-99
788370,上方压力这么大，起不来的,-99
3487418,减了80%，这个蜗牛我是不会回来的。,-99
1219820,600351:亚宝药业关于控股股东进行股票质押式回,-99
1617520,回来看看，小庄又开始压盘了,-99
114295,三一频临死亡任何消息对没有,-99
5155617,研发新型温补型晶体谐振器；研发在航空航天、军,-99
4037166,我不说你是狗，那因为你连狗都不如,-99
5069693,603686:龙马环卫第四届董事会第八次会议决议公,-99
4903247,东尼电子1-9月份已经同比增长65-110，上无压力,-99
3133892,跌三个点容易！涨三个点难上天！！！！,-99
3714420,让优质公司可以通过再融资来进一步做大做强,-99
3271341,002437,-99
4185172,还有没睡的吗？分析下明日走势,-99
2099243,快撤，明天要大跌！,-99
1037984,无量佛，弥陀佛,-99
1874235,狗庄出货[不屑][不屑][不屑][不赞][不赞][不赞],-99
1641820,湖南天雁，卖早了，，,-99
2197455,600647:同达创业关于会计政策变更的公告,-99
2989244,海欣股份(600851)融资融券信息(11-08),-99
3085528,涨停是小事，跌停你们会哭吗，我到10块钱以下接,-99
3549025,买股要买活跃股，杭齿股性不活，建议清仓杭齿，,-99
3042904,因此判断市场是强势还是弱势是做股票最关键的因,-99
423124,纵上市公司,-99
5140061,下周将迎来,-99
4158929,公布的分红分哪去了？不会是董事长自己贪了吧？,-99
3690440,融创收购乐视A值几个,-99
1241921,别看你今天叫的欢，明天我让你拉清单！,-99
1136950,一唱空就上涨了真的，快跑换600133,-99
516197,二股东又在减持了？,-99
3110586,满仓002700，600882下周不会后悔,-99
607926,如果一个人不知道他要驶向哪个码头，那么任何风,-99
1771752,你还在为解套发愁吗？,-99
147976,一般大盘个股这样走势，尾盘可能就有一波快速下,-99
2884277,10%的股份当记念行吧，记住一句话，钱永远是钱,-99
2329022,形式好，就快速做几把，不稳定就把钱攥手中。,-99
3100809,破历史记录,-99
2345632,福建全省新能源公交车推广应用工作推进会25日在,-99
3642876,老僧也晒晒交割单，对于近期大妈和迷情顺便说一,-99
567125,棒杰股份已跌停,-99
4511256,抄底了！同志们！,-99
1932977,大股东增发时的承诺，购买资产一旦达不到业绩要,-99
1252895,京东方A突破箱体顶部价位冲高在即\t,-99
3272421,哎，卖了它就不跌了。。,-99
5258759,上窜下跳的，可怜了俺的小心脏,-99
4486955,大参林：长期压盘，要到股价爆发的临界点了，逢,-99
1535873,几分钱再那横14过不去速度撤退,-99
5169708,目前西藏道路大部分是,-99
2450176,六~已尽，该七翻身了。,-99
754797,600519大家坐等飙升！！理性分析，不喜勿喷。要,-99
1295986,即要求这类公司提供相应的业绩预测数据、测算过,-99
3830689,15年来 ,-99
248665,万达的壳！,-99
1171091,外面的股都跌成狗，心,-99
510268,服了。现在的中小创。,-99
2847901,栖鸦常带夕阳还,-99
769890,根据二季度汇率，油价及每月数据增长情况，预估,-99
2194507,贵人鸟MACD金叉买入q,-99
3950022,今天早盘进了点啊，一年了在回手。,-99
525131,我就想知道，建发到底要跌倒什么时候，怎么有那,-99
342239,看这些帖子，今天还得跌,-99
4784286,很佩服还在卖，卖，卖的股友。你们真的好棒！,-99
2228870,复星也不是第一次对豫园入股了，说明它很早以前,-99
2737077,谁拉涨停谁是孙子,-99
2691771,而今年去产能还要扩大,-99
2150459,看戏看出眼泪。,-99
1815157,为什么还不更名？！ 经营范围 智能化纺织成套设,-99
4916976,还是出货！,-99
2951657,这股票走势是啥意思，搞不懂,-99
14805,过去吧,-99
