,content,mark
803427,期货暴跌啊，明天低开跌停！,-99
261191,经常磨快自己的锯子,-99
3159723,天汽模：一步错步步错，小心驶得万年船，众散想,-99
1518960,没忍住，回盘价走了，下周不知会怎么样,-99
434896,太没技术含量了！,-99
3476260,所谓的砖家就是这个后果,-99
127449,天天它妈的十字星！死了吗？！,-99
2612627,还有四个交易日，大伙有点耐心吧,-99
3611455,别抱太大希望，然后每多涨一个板就成了惊喜了…,-99
1110144,你越骂老子越要揭穿你,-99
1452252,我现在是4万股，就有4万匹呼和浩特。,-99
1307310,还有很多人抱有幻想 此时 是最该卖出的时候 跑,-99
2333140,要有一波行情了，拿好筹码,-99
2263573,哈药啊哈药，别急着涨，能再拖几天我把资金调过,-99
3276076,哪位兄台问,-99
1758260,详解股市之新的篇章第八章板块轮换开始,-99
1308209,主力有没有感觉到一股买力突然来了？ 我招来的,-99
1802251,600539:狮头股份简式权益变动报告书(陈海昌),-99
605237,样介绍*ST烯,-99
2632626,炒股就象谈恋爱。,-99
2919313,有种你下来，18元建仓,-99
3358313,曹，19.7卖了，居然拉上来了,-99
1371470,不会是有代表提案控制稀土廉价出口吧？？？,-99
2279704,天房发展 苏州高新 津滨发展 南国置业 广宇发展,-99
1220453,想出来的尽快，别在里面犹豫，等开始拉涨的时候,-99
163099,还好换股了。。这死垃圾,-99
1957390,今流出天量了,-99
4242248,奶茶那么大盘子有什么科技含量，消费前面加了的,-99
58949,巴菲特1991跑去另外一只股去造谣了 谁知我早些,-99
5212750,坚定持股不到30以上绝不出手,-99
3805891,真恶心,-99
258425,今天难道要涨吗？i,-99
2023205,预测明天还是跌。,-99
1540217,每一次疯狂过后必有一批人为之买单！――致狂热,-99
4740137,10.5等你～,-99
1599429,1999好玩吗,-99
4168823,华丽股份超级龙头大王惊天大阴谋必翻3倍,-99
1736893,营业部最青睐个股曝光 5股净买入超5000万。。,-99
442160,巨力索具最近涨停，抓住是机会,-99
5132887,但是也应注意劳逸结合,-99
4181173,今天下午跌停，明天上午惯性下探可买点。,-99
1090543,有实力，有能力，有前景，规范，透明，按法定程,-99
3241097,原来我们的爱情曾经靠得那么近,-99
598204,指数今天涨明天拉，明晚新股一啪啦,-99
1937818,蓝筹崩盘开始了，大逃难,-99
3962779,短线炒股心法。,-99
1616366,如何割肉有学问,-99
1331386,狗 庄洗得越狠，后面涨幅越大！稍安勿躁！除非,-99
5294391,既然涨不上去，那就往下砸，,-99
4234618,圣达暴露股王气质！,-99
3613746,买入,-99
1104554,回调到30元,-99
4802330,给我冲呀,-99
1465039,举报东兴证券，发研报砸盘出货,-99
4025901,太赫兹一引力波一雄安一超跌一高校龙尾成龙头。,-99
4761546,中石化厉害,-99
982006,今天放量涨，明天放量跌,-99
4183430,慈母手中线，游子身上衣。,-99
1996444,只要大盘一涨立刻大量大单砸出！,-99
3068937,六个涨停板也不多，油价上涨，欧佩克在背后公开,-99
2652870,坐等飙升！一路持有,-99
462903,沪指微涨2点,-99
2194259,余消遣的话，这本,-99
1454797,看到这些g,-99
3570554,我们逢高就必须出局,-99
4455851,分时图已说明散户不仅不卖而且满仓了,-99
4819567,还是那句老话，就多伦这业绩，给他40倍估值都站,-99
2805174,TMD，证监会批准了？乱发公告，是不是违规！,-99
3938688,从6.25到20月线  就是5.71   不到10个点  不买,-99
5514101,好多新股涨停，吉华也表现一下,-99
1542628,理性“投机”，把各种炒高的概念拐交回给庄家,-99
2874793,短期调整方向确立，向下调整无法避免！,-99
5194840,精神错乱。睡觉了。混淆视听？,-99
3711052,利空袭来A股走向何方？,-99
4682261,个人看法，要横多几天，那天突然猛跌破23．68后,-99
5464273,一毛多,-99
5137948,今天大涨[牛][牛][牛]，大家快买啊[胜利][胜利],-99
1237317,低位横盘创新低的节奏,-99
5356423,别的股都是向上吹牛逼,-99
3910805,买入券商下周数钱,-99
46870,次新要起来了，这股已成垃圾股，庄太丑陋了,-99
5539028,艹你爹 一分钱玩一天,-99
4254078,午盘拉升，出货,-99
4111946,因为第一批明确进行混改的行业并没有油气行业,-99
156864,但中期调整仍持续,-99
3634012,投资的最高境界是等待,-99
399613,跌停!快回来，。,-99
2326640,美元未来还会继续上涨,-99
5142581,拉高出货，哈哈，幸亏跑得快,-99
2522152,世界首张AI谱曲流行专辑出世：听起来像人类写的,-99
4171709,谈奇虎安全IPO或借壳?,-99
729728,600210:紫江企业2017年半年度业绩预告修正公告,-99
1462700,半年报续亏，哎！又有新低,-99
4936451,涨停,-99
1250731,不涨不跌，早点洗洗睡吧！,-99
2745113,后宫漫画,-99
1788348,股缘梦炒股悟语（67）炒股，得有思想,-99
787762,如果资产重组，那是利好，但停牌久就是利空，希,-99
3622354,601233:桐昆股份关于公司控股股东完成可交换公,-99
3014485,大户都快跑完了，小散马上就要当家做主了,-99
2107332,高换手率，放量滞涨，一个字:跑！,-99
89201,事实次新中签率高是件好事啊，因为大多的股票都,-99
4243300,明天不出意外还是个跌停板，次新环境太恐怖了！,-99
985619,螺纹钢主流报价实际成交价格创下年度新高 今天,-99
4197121,手游“王者,-99
4053058,〔这两熊越涨个股越跌。〕,-99
1167318,恍然大悟原来有圈套，认错走人，前段时间走势说,-99
396097,看到外围暴跌，心里不免有点兴奋[大笑][大笑],-99
1665060,进行这种预测并非难事,-99
1787606,天屎力，涨一个点，都能让我向过年一样开心了。,-99
3909732,进了上证50就属于国家队管控，不容许暴涨暴跌，,-99
3786325,中国人寿(601628)融资融券信息(11-24),-99
4032665,买贵阳银行套住的人不要有怨言，更不要骂娘，在,-99
3665724,只留下二票，剩者为王，科大讯飞丶广深,-99
217810,大家注意了，银鸽是明牌的，是绝对没人接的烂壳,-99
2220747,整天抱怨，天天赔钱，耽误买其他股票挣钱的机会,-99
3940607,中煤能源(601898)融资融券信息(08-22),-99
1420371,自从上次换入鲁西化工后感觉完全不一样哈哈~欧~,-99
2351443,野种看多，必绿,-99
2393612,纪录片『辉煌中国』，看后令人非常激动，欣慰…,-99
1850168,死拖的旧帖说，下午有可能涨停,-99
2559963,SB们！这个位置还有几个是赚钱卖的？割肉吧！痛,-99
3105574,今天五块六毛五走了，能5.45接回来吗？,-99
2409844,这才是行业陷于周期的主要原因，行业景气就扩张,-99
2435196,逢低可布局高送转概念及挖坑缩量庄股！开年必有,-99
425007,谁买苦谁，想赚钱出去，没门，搅肉机公司。,-99
3163866,"呼吁政府尽快出台促进第四次产业革命政策,支持",-99
5313892,你别装了，今天肯定要下来,-99
1156402,天通股份(600330)融资融券信息(12-18),-99
1519101,茶要喝浓的，直到,-99
820855,希望6，4早点到来[拜神],-99
4204192,今日洗哭你们！,-99
3786083,今晚估计有重大利空消息，保险股没跌人寿那么凶,-99
4846812,起不来的，小单拉拉，夹着大单跑,-99
1361077,五矿资本，是个非常妖的股票!!!,-99
516278,明：中海油服选择向上突破，海油工程迎强势反弹,-99
2056885,明天会涨停开盘吗，,-99
590789,辣鸡股，指数回升，它不动，狗庄CNM,-99
3399273,垃圾中的战斗力,-99
1420994,缴枪不杀[鼓掌][鼓掌][鼓掌],-99
2680268,块下挫，沪深大盘双双小幅低开。开盘后，,-99
297718,基本面特变成长性一般技术面特变到年底都会走横,-99
277764,到12月10日就是6个月了。,-99
3292737,歪球,-99
2965544,券商里的垃圾，千万别买这支券商。。,-99
3910060,浙商证券这个位置，错过后悔！,-99
1972673,高位强拉出逃之相！当心套在珠峰顶！,-99
3546085,强力反弹回来是必须的q,-99
555173,天坛生物8月30日盘中涨幅达5%,-99
3691294,中原证券吧,-99
5004310,603648:畅联股份公司章程,-99
588707,明天反包,-99
3034289,只等大军工篇章到来，加上三季报可能有惊喜，双,-99
3049823,一天才这么点成交量，都没流动性了，明天谁跟谁,-99
4688492,国缘是政府招待酒，估值至少500亿,-99
713705,公司领导真是傻逼没远见！剥离了最有前景的半导,-99
2366847,看看别的化工厂，哪家不是10几个点净利润率，不,-99
5229272,603808:歌力思:新时代证券股份有限公司关于深圳,-99
5248053,我去你妈的!你不如不分红!,-99
3473794,中国一重吴生富自杀身亡 澎湃：吴生富为什么自,-99
3172258,厦门空港600897 26.60元,-99
1182209,调低增发价,-99
3037379,内蒙华电(600863)融资融券信息(09-26),-99
807553,不指望了，这种走势图还涨个P！。,-99
4906300,无法理解庄家为何这样砸！,-99
1924694,三个8吸引了好多垫背的,-99
4820202,这种垃圾公司股价长期会慢慢越走越低,-99
1286955,拜拜。,-99
3376911,别磨叽赶紧把桥子抬起来,-99
1730227,#本散推荐晨丰科技滴缘由:1市盈率同茅台.2业绩,-99
512380,三季报业绩1家公司预计净利润同比增长幅度在10,-99
5206107,如何看待上市公司扎堆卖房以及卖房保壳？目前市,-99
4821962,感觉全是散户在交易，没有庄家，全是小单。,-99
5402488,继续坚持好自己的操作计划和操作纪律脚步不能乱,-99
3409482,自选全红就你绿[大笑][大笑],-99
3922765,刚卖掉你就拉，狗庄我操你大爷,-99
2601130,哎，太郁闷了,-99
4322849,央企办事效率低，手续反锁。。。半年以后了。。,-99
4801855,"↓芒葛:中股跟极其昂贵的美股比稍微便宜,那么中",-99
677226,耻骨自己承,-99
599707,机构普遍看好板块年底的估值切换行情,-99
3735550,太弱势了，这么小的盘子也没人搞，走了。。,-99
5170267,越低越跟你抢筹，指望散户割肉？庄想的太美了，,-99
1014784,今天还能翻红吗？,-99
1391035,还装死？,-99
4164992,为什么没有业绩预告,-99
2883494,三优质股:估值洼地、破发破净、物美价廉、超跌,-99
3550703,前几页我们提到“长期被忽视、误解或受冷落”是,-99
1287232,辛辛苦苦炒妙股，全部亏给闪崩股，股灾也]这么,-99
4068002,反正我是被逼锁仓。随便你怎么跌。13以下补，10,-99
4256869,38.2的成本，除了我，还有谁 3600股，买进去连,-99
4030219,谈股说债：国内经济保持稳中向好,-99
3822642,卖单全是4，看来有人受不了[牛],-99
6551,中国动力（600482）身兼雄安、军工概念双重身份,-99
2065782,九点一十五分钟跌停，什么情况,-99
5112763,国家队玩接力，银行托累了，改一带一路了！,-99
4131772,~~送你一只还在底部潜伏的牛股,-99
5007147,朗博科技、光弘科技12月19日申购指南,-99
1048834,都板了一上午了中午停牌有啥效果吗？你不会晚上,-99
4275173,垃圾，垃圾。,-99
