,content,mark
2047207,只有半天时间，中宣的鲁同志和360的周先生共同,-99
2362580,"进3退1,明天底开大但买入。",-99
1051690,这个月2次说军民融合明天应该买点了,-99
1352539,哈哈，果然跳水。我的判断如何？,-99
4175381,上证50强弩之末 次新中小创遍地是黄金！,-99
919210,最新消息 中交还要缩股发行,-99
5367112,第一创业新股爆炒埋恶因 股价打回原形千亿市值,-99
3511306,600418江淮汽车+德国大众=新能源汽车,-99
2492219,不入虎穴焉得虎子,-99
4194083,垃圾货,-99
4260407,收购个垃圾公司都要停那么久,-99
3596221,毕竟在资产荒的背景下,-99
4895869,无论流通盘筹码,-99
4893800,地素时尚IPO：电商销售毛利率低于线下 发审委追,-99
2109574,利用市场人气低迷w,-99
4743416,今天新概念当属汽车喝酒概念,-99
491216,兴发的草甘磷丶有机硅、黄磷继续涨价，价差与去,-99
4342866,你还是次新股吗[微笑][微笑][微笑]掉队了，快跟,-99
2508979,一是要堵住漏洞,-99
4683136,今天收盘价27.25,-99
3634833,哪天复牌？我等到花儿要谢了,-99
4358427,看了诺邦股份，回调80%，服装都不带看好啊,-99
4662678,赶快跑！看,-99
4590395,我不信你比ST股市值还低！继续跌我继续买！,-99
4744034,走成这个德性，3季度业绩有问题,-99
381436,[大便],-99
1044228,基本面摆在那里，减持影响在下降，问题不大。,-99
759427,圈钱而已。引小散入套,-99
2519349,但是担心远没人照顾,-99
3601158,出于去杠杆、去通道化等原因而被迫减仓。,-99
2082704,300056  前期闪崩都拉红了。,-99
37031,这样下去 过两天 就33,-99
4064517,座山雕，原名张乐山，威虎山上的匪首。《林海雪,-99
2952712,买股票如果只看市盈率就太简单了r,-99
2858049,北京深改组会议审议足球改革发展总体方案 受益,-99
3216350,你TMD是猪啊？天天就知道趴在那里？,-99
2159808,呃，破19了...,-99
1988248,看看人家300543,-99
1603606,铁公鸡，一毛不拔！涨少跌多！,-99
4073637,出货的就是猪,-99
1493634,公募基金进入freestyle时代之基金二季度增配港,-99
999993,果真是卖狗皮膏药的假公司,-99
1625001,但是对其所引起的生理变化与行为则较难加以控制,-99
2059634,大众交通持有50亿证券资产,-99
4021780,发生什么事了吗？大唐主力发疯一般抛？,-99
3830313,刚刚建个号，来看看。宣泄一下心情。我这一生最,-99
1761896,走了 受不了这垃圾了,-99
5241798,虽然长线我也很看好 但是说了往下就是往下[摊手,-99
1606264,股价下跌是庄操盘狠毒，我想大多数领导自己企业,-99
1782289,石化机械,-99
5543212,中新生产什么品牌的电脑电视，大家用过吗,-99
4444638,"去年净利润6000W,今年将达8000W的水处理环保企",-99
3898917,洗盘？,-99
951947,24.4%的投资者持有市值1万元以下,-99
3377197,你什么时候复出？,-99
1492927,600438:通威股份关于控股股东股份质押的公告,-99
3560966,我始终看好创业板未来会到1400,-99
975788,指数虚涨，个惨跌,-99
3519160,中国制造要崛起离不开工业粮食的支持，看好博威,-99
4158064,三重顶构筑完成。,-99
786079,还会有谁整天去担心股价的涨跌？问题是这种平衡,-99
2288456,虽然近期弱势不断,-99
678453,涨,-99
3728323,今天发工资了，加仓。只要不退市，只要不涨起来,-99
1132169,海通证券荀玉根：多头趋势已经形成 重申重视国,-99
2899702,阿里巴巴入股新华都成立合资公司http://m.sp.uc,-99
3190779,它二奶奶地,-99
1328043,吧里的几个大咖不知还在不在？,-99
4348461,今天可能跌停,-99
3472454,一重你理应站起来了,-99
4252886,先达股份下周一涨停价45.58元.,-99
3765603,傻B割了主力你涨吧一个不让散户得点实惠的傻B庄,-99
1069310,洪汇新材、西部资源、。,-99
4716197,没人拯救基蛋了,-99
705602,分红日，…能不能来点给力的!还有主力没，出来,-99
2813903,爆炸大消息近期公布,-99
2835116,嘎嘎，换股[胜利][胜利],-99
4323362,复牌涨停跌停   你猜对了又如何   静坐着等复牌,-99
1042210,今天不跑出来，家破人亡。妻离子散！快撤退！该,-99
1086361,你好东有点,-99
2590907,机构报告不值钱，推荐了就给1分钱面子，还不够,-99
5161739,关于复盘，炒股高手是如何做的,-99
2549745,"六块三的国发股份更好,可以换股了!",-99
1237843,今天半小时B了三次，虽然每次一个多点，也特爽,-99
5499927,603977:国泰集团第四届监事会第七次会议决议公,-99
25407,报告显示机构，基金，保险都跑了，谁在抛货？谁,-99
3284568,600978:宜华生活2017年第一次临时股东大会的法,-99
2780390,浙大网新的公众号确实有很多为公布的信息，虽然,-99
2343841,十年的炒股经验……这只股票要跌到2019年才是反,-99
287050,日你仙人板板天天都跌,-99
752705,此股真就6到7块钱的命，见好就收吧，不要幻想。,-99
5004256,就该买物贸 哎 哎 哎,-99
2091647,幸好没在国内上市，去美国割美帝韭菜，,-99
1995238,重回2600点低点，机会难得，证金还在，13元价位,-99
2941206,弱，走人。再见九百,-99
387855,天成今天下午的超大户吃货也不手软啊,-99
5247365,真他妈的垃圾,-99
5351894,美股9年牛市让老百姓家底增长七成 你在A股收成,-99
1836351,阴险几天了,-99
4229014,630,-99
4713745,今天开始,-99
4549403,的审核否决率也在同步上,-99
1009861,日你麻痹啊~垃圾,-99
3145799,炒个股票容易吗。每天都在拼杀的路上。,-99
1929023,一副穷酸相,-99
3731561,一个诱多的。,-99
1879759,法拉电子12月4日盘中跌幅达5%,-99
3070890,600871:石化油服H股公告(关於召开董事会会议的,-99
4184737,快跌透！,-99
2064300,申购新股票要慎重选择，股吃亏上当的事已屡见不,-99
2653112,(7/13)十大名博看后市：蓝筹逼空 大盘要上3301,-99
4107893,高开一分钱,-99
5412795,把握板块轮动机会即可,-99
251641,被国际认可，这是我们的市场走向成熟,-99
2153668,快跑，连跌5个停，我压10万进去5年后再卖,-99
5257058,大单各项数据还没到，今天应该是反弹一下，明天,-99
4290295,不好，走人，赚1个点,-99
906319,关注一个重要信号,-99
2488396,[看多],-99
5331626,都股灾了，还讲均线，指标，搞笑的真多,-99
1356234,苹果概念龙头：恒宝股份002104 必将爆发！,-99
1495192,在下跌趋势中，任何的一次反抽都是卖出的最佳时,-99
4929050,指望珀莱雅跌的朋友可能会很失望了！星期一我进,-99
2554364,此股庄不太会做，这样搞来搞多上国库了，我看他,-99
1712409,这成交量是要停盘吗?操盘手放假了，返是睡觉了?,-99
3052056,通化东宝(600867)融资融券信息(08-18),-99
4355544,操你姥姥，我被洗出来了,-99
3691612,散户不买庄家不跌，没接盘的,-99
4634307,爆炒的新股一场猛烈的下跌即将到了！,-99
2761898,我越说云霉乌龟垃圾主力操盘手就越跌，哈哈哈哈,-99
175707,传媒互联网,-99
3343846,喜欢炒股和看乒乓球，可是，你懂的，异曲同工q,-99
1900560,安阳不值得拥有，逐步退出了，谢谢,-99
1627535,大皇锋：金价后期趋势怎么看，周一操作思路,-99
575041,记住该记住的，忘记该忘记的。改变能改变的，接,-99
3576062,一夜回到解放前\t,-99
276683,中国新能源汽车产销过百万辆，碳酸锂进口量大增,-99
1082610,还有YY的吗？出来聊聊天，只YY，没有资金关注，,-99
1899688,成功解套,-99
3987657,这是一只跳出三界外，不在五行中的股，没有热点,-99
5095131,满分，不知道多少支涨了一分,-99
4418755,周一涨停开始5个连板，我昨晚梦见的,-99
2164926,季k中轴15.93元,-99
2810710,低估的悦达投资-其隐性土地资产值多少,-99
2343015,看着恶心,-99
3836536,午评：市场在等待两件大事,-99
5492332,量是砸出来的[大笑],-99
246728,黄国东：3250点之后三浪到3500点,-99
4914745,我是新手，请教一下各位可以买吗?,-99
101321,重心都有所上移，盘中个股涨多跌少，赚钱效应有,-99
4986413,太苍白无力了，股指期货在玩玩股市,-99
1749643,热烈庆祝长园集团交出一份亮丽的三季报,-99
2584538,疯狂买入！疯狂买入！业绩暴增！石化行业，业绩,-99
3051525,中国保监会召开紧急会议,-99
3626823,2017年8月18日立贴为证！,-99
5199325,自觉把人生追求同国家和民族的前途命运联系起来,-99
2222002,退市吧垃圾,-99
1530935,主力好忙，边吸边洗边压价边,-99
4234429,[图片],-99
3188332,下午起来,-99
2928840,哈哈！上海机电意图越来越明了，短期恐怕会有巨,-99
576846,金石资源这只票拿在手,-99
4718062,明天开盘涨停或五点左右开盘，让你没法进入，庄,-99
4282428,吃相太难看了,-99
4731618,基于信息安全和大数据的金融科技平台 信雅达(60,-99
753490,享受了大牛市几倍的利润家族,-99
4527989,30以下的小盘电子股就你了，持有10月,-99
2676574,啊啊啊,-99
3741740,还10分钟，再不拉，有色第一的位子不保\t\t\t\t,-99
3531988,公告一出必大跌,-99
2933191,朋友，明日出局,-99
5207537,股市不行:想发财????等等巴,-99
3733300,重大提示：九牧王要逆市发飙了！卖盘洗光光了！,-99
2759383,我看到了顶部背离，可以减仓了,-99
1337092,老子卖了，庄家拉吧！,-99
2772633,多头空头盲目传播未经证实的消息都是错误的。,-99
3617527,今天有个2b在16.5大量出货，垃圾。,-99
2841765,如果大市上扬，而您手中的股票就是不涨，那么应,-99
5148959,绿毛龟寻爹的过程,-99
1086328,晚上再不出,-99
3731224,看这形势还会跌，华锐在控盘打压。,-99
403527,发现三峡水电一个规律，涨一日跌两日。贼准,-99
2841913,国务院教育督导委员会办公室将组织专项督导,-99
1610104,哇噻!疯了！发生什么？？？,-99
2692752,卖出，主力又开始T,-99
1062738,大家请排队离不要挤,-99
261923,投保局赵敏：建立投资者,-99
2689312,别贪了.别压盘了.差不多就行了,-99
4724455,差不多30的本    认了   割肉放血   走了,-99
4426228,你买的空单吗软件股大涨全部涨停你下跌,-99
2525208,完蛋了，大调整来了,-99
2538966,嘻嘻哥，珠江实业吧那边有个股神经一直在骂你。,-99
1636027,使点劲呗,-99
5537630,企稳五日线关注买入,-99
5041347,有意思吗?,-99
4449345,什么情况，吃错药了[俏皮],-99
469322,股市唯一不骗人的指标――“量能”，字字珠玑，,-99
697502,做股票应该有耐心不要因为一天的涨跌就有太多,-99
3550513,然后我开始在江浙一带的城市里不停地奔波,-99
3948092,14.81,-99
