,content,mark
100793,今天怎么不拉了[大便][大便][心碎][心碎],-99
5473834,屎,-99
145997,破7 ，爽跳水，跌停,-99
17340,在总体上 ,-99
1530267,闲钱炒股要有耐心。没有只跌，不涨的股，时间换,-99
4604806,603323:吴江银行关于会计政策变更的公告,-99
1414737,南瑞,-99
709457,洗清烦忧更干净,-99
2223363,申华亏了30万元，已准备持有30年，除非它退市！,-99
2541875,双针探底纯粹是个大忽悠，跟这个股市讲技术无异,-99
3598311,煤飞色舞的年头，四方股份巨牛回头吃草喝水等腾,-99
1596907,把名字改成凌云志？,-99
4245982,都别马后炮了，坚定点。,-99
3074840,晒晒晒，姚老板坚定晒出好味道,-99
4892660,最近完成最后补跌后已经企稳,-99
1376686,还敢砸吗？,-99
1576350,蓝天环保:关于控股子公司签署特许经营协议的,-99
1036380,命运掌握在自己手中。要么你驾驭生命，要么生命,-99
952389,鬼托！你爹真会玩！,-99
2676155,没量，风险随时会有。,-99
1850563,脑壳好昏：古猿 深蓝Glamour和紫鳅都是毒蟑螂,-99
22475,现象就会得到控制,-99
24288,拜拜了！就这个价格还压着盘子吸筹？全给你了！,-99
2166508,昨个股暴跌的重大启示录：快闪！。,-99
981092,跌破上次大股东增持价格了，大股东可以再次增持,-99
1590769,再次提醒，是逢低买入，而不是追着价格往上买入,-99
2792525,把交易经验记录在交易日志中，随时翻阅,-99
4197786,b a,-99
3442354,2017年8月30日，中华人民共和国商务部发布2017,-99
1573376,那就是现在，然而，许多人却在悔恨过去和担忧未,-99
493985,600143:金发科技关于子公司对外转让股权暨关联,-99
5431573,快到24.48了，等于中新股,-99
1920715,还不错的生活并没有把我洗脑4连续几次冠军5对接,-99
678444,600196:复星医药关于控股子公司获美国FDA药品临,-99
1588773,如果可以这么混乱，请问东方财富，你就这么个公,-99
1047440,明天大涨开始，今天出来的明天准备追高吧,-99
974279,最新石墨电极概念股一览 2017最全石墨电极概念\t,-99
1643512,成为高手从复盘开始,-99
1203367,A股没有价值投资论i,-99
1928349,什么业鸡，都没人买了,-99
4807432,不管你信不信，明天跌停板。,-99
2164998,我的观点也是:638主力全天吃货,-99
3584451,如果正股不涨，不降低转股价。 可转债80块钱都,-99
979689,西水：惨烈筑底 第一波看3300点[鉴彪股],-99
3003861,多头不死，跌势不止；空头不死，涨势不止；,-99
1386405,大多数散户都是臆想安源能重组而买进的，实际上,-99
725440,挂11.62补仓,-99
616798,我对今日跌停的看法,-99
1410158,下午开始拉伸，不涨停我吃屎，立帖为证。,-99
5053196,奇精收盘价58.71,-99
1115210,昌南人 过节也不休息。冒充大尾巴狼，没安好心,-99
3529237,砸穿6.94就要逃：,-99
2838729,有傻子卖华药的么？,-99
4907517,根小阳线,-99
524722,没见你怎么涨，跌尼玛厉害，孙子命,-99
2120437,昨天换手率那么多 小散几乎都走了吧s,-99
1019314,这一天,-99
3681669,走先，这垃圾明又要大跌,-99
2968826,雄安资金在流入几个月出现这次,-99
4265557,上海彭老股被洗出局了，他不被洗出去是不会涨的,-99
3307399,死g,-99
5382887,你说你有什么用！,-99
486282,涨幅最少，跌起来TMD比兔子还快，西部资源纯粹,-99
3222324,东方证券马上起飞大家拿稳别听空狗叫唤,-99
3615516,伪市盈率，真吓人！,-99
1967835,一小时前看了我全文帖子的人为什么不出来声讨他,-99
5250053,603818:曲美家居2016年年度报告,-99
4556051,看到一重业,-99
290849,长油2017.5.22日重新上市大局已定，首日收盘价8,-99
844501,盘整多久就多久,-99
1865785,让韭菜们也中一签大笑大笑大笑大笑m,-99
2300306,加仓买入,-99
4503762,今天跌2点买了2000手，没跌停，跌停在买1万手，,-99
4150174,开盘竞价买入，亏了8分，厌哦,-99
1740233,我就喜欢这只股票，走势稳健,-99
4595073,一分钱你就玩吧,-99
505495,*ST爱富8月15日打开跌停。,-99
5102711,慎发行的监管逻辑，依旧是IP,-99
372744,应该是每天跌2分的节奏，今天收4.48,-99
1130186,先达股份能,-99
2464617,谁是2015年股市“领头羊”≈就是我“奥斑马”d,-99
3903295,哈哈  估计得一分钱玩几天了  穷游黄金周,-99
2738588,小菜酸菜鱼 ,-99
4733007,603398近期走势弱于大盘和行业，注意风险。,-99
2614178,25.3。等你,-99
1071132,怎么会有这样的公司，无语q,-99
4721108,进，马上,-99
1925544,赵薇空手套白狼已经赚了34亿，罚几十万元相当于,-99
4655292,你爸教科院,-99
5218676,纯正的大白马！！！,-99
4155354,怎么没反应了,-99
175355,无量拉升，没戏,-99
4825500,跌停是你的命，快下来吧[鼓掌][鼓掌][鼓掌],-99
136233,盘子太大，理性一点,-99
4107338,不要怕：中国科学院控股上市公司！888888888888,-99
5275027,对上市公司高送转行为,-99
4404300,柜房贵州    财大,-99
4247195,不能让这个大毒瘤继续毒害中国股市、毒害广大投,-99
3567579,速度卖，行情不好，今天会是长上引！,-99
3210478,600933:爱柯迪关于使用募集资金对控股子公司进,-99
467328,割肉大军和抄底大军擦肩而过，相互瞪了对方一眼,-99
5506239,是看昨天跌的太多了，今天才涨这么一点,-99
4561221,就是说：调低了非公开发行的价格呗,-99
4053631,垃圾,-99
139878,明天26元要抢的人一定不会少[俏皮]。,-99
841657,五粮液上涨0.34元人民币,-99
4945269,《重点推荐雄安新区：巨力索具 002342 周一涨停,-99
3368423,看了露天煤业，不得不说，露天的庄好善良，四个,-99
634450,st中安太危险了，2018年1月22日还有次41%的大解,-99
3926509,我发的贴都被禁了,-99
814000,凯瑞德董事长增持金额达3亿元,-99
2578536,真实的女孩不完美，完美的女孩不真实。l,-99
5400360,资本奉势：三均会师，看好后市,-99
5277744,确认主力被套！没有接盘侠！,-99
1909796,九安医疗见,-99
3606729,再锁仓坚持五个交易，就出三季度赢利报，现在不,-99
5239659,逃命吧，各位中签的，让赶死队的玩这股了！,-99
3524687,我来做王老吉红罐的红娘,-99
3584259,券商是直接融资的主体，金融会议最大的收益者，,-99
3486461,飞机太大了慢慢腾腾的没活力。,-99
217319,离破平台不远跌吧,-99
2049107,当新星股遇到垃圾粉 新星股遇到垃圾粉，就是京\t,-99
4719792,场外资金那,-99
2770252,还让人活不？,-99
1686442,三钢是你爸爸,-99
4908179,这样下去，这公司估计要被别的公司重组或借壳。,-99
3304187,自己把自己玩死了，做假帐的公司,-99
3724934,撕逼,-99
3003085,压好了吗,-99
3650586,喜报，判官又来本吧装逼了，请大家做好笔记，奖,-99
3436905,河南人，底子薄，快过年，股票再不涨，咋办呢,-99
743479,方可是个发给好,-99
2793350,360,-99
3389971,不急，慢慢磨,-99
1148977,庄家今天低开低走，让亏惨的散户希望再度落空,-99
4292097,庄家！建议你们趁目前散户不多拉返十个八个涨停,-99
829024,5.8以下玩命卖 比到五块,-99
4706802,上周卖掉大丰实业，建仓惠达卫浴，我错了吗？,-99
4312392,我准备买点行不？,-99
2154212,奇葩，开盘近20分钟了，主力资金没有买入的艹你,-99
4801104,典型的解禁前拉高出货，散户千万别当接盘侠，50,-99
4415853,买买买,-99
4499362,电魂网络下午判断,-99
360382,资产重组和再融资来实现的,-99
4594556,确实是让号外财经报道给黑了！永不翻身！,-99
2864071,感觉差不多了,-99
9959,工信部力推动新材料发展 石墨烯应用前景广阔,-99
4890237,NMB真垃圾，次新行情这么好，你确是这样的烂货,-99
1053271,南化股份全方位估值研判及中长期操作策略。,-99
2693090,大股东出逃，我昨晚就说了，昨天已经走了。暂时,-99
4607471,这个熊样有钱也不敢进,-99
1965345,买入 002336 人人乐,-99
2203109,尤其是在中国股市生存发展一二十年的投资者,-99
2155203,重组顺利,-99
1397882,7块卖到6.5再买，乐此不疲！,-99
333683,高。,-99
1569071,给我一个无需担心学费生活费的环境,-99
5415080,5919[拜神][拜神][拜神][拜神][拜神][拜神],-99
4322007,生亦何哀死亦何苦大家快跑啊,-99
316204,>>>>11. 应用股票分析技术发现贬值,-99
1227565,中国石油预计上半年净利超100亿 多家公司发布,-99
2691936,而格力电器却下跌了1.67元人民币,-99
4642489,公司点评：一季报高增长，高空作业平台龙头地位,-99
4142330,流感爆发，关注医药生物股！,-99
3239427,重组？[大笑][大笑][大笑],-99
4086680,原油产量,-99
4379047,被查了，大利空啊,-99
192897,空仓，别上当，周线出于下跌中,-99
4678451,日NM，狗庄。一坨屎。,-99
3637259,类似安凯客车套路。洗盘了就涨停板。,-99
1208016,搞事情。,-99
791847,庄已经出逃 打压低价增发 无退市风险 利好出尽,-99
4780637,这样走势明天跌停概率大了。,-99
2948602,上百只跌停，漂亮还是红的？,-99
3748118,收官周一板块有望爆发,-99
523463,时间又过了3～4个月,-99
4123666,603025:大豪科技:北京安新律师事务所关于北京大,-99
1983451,均线在股价上，就是阻力；反之是支撑,-99
1447664,大盘站上3096看我怎么收拾你,-99
4619664,你说这种傻庄，你也压的太明显了~~,-99
4720557,元成股份8月29日打开涨停,-99
1331074,以前说自己为什没买到双马，如今唉。,-99
2422505,就知道会掉下来的，砍不住,-99
3302313,赞比亚政府商务代表团到访中矿资源 2017年06月1,-99
1740871,12元相见。,-99
4612558,明白了，开的关门大会，跌这很,-99
2945985,哈利拜博和佛山操盘手绝对不是同一个人，他更不,-99
2992806,据怀新资讯报道，据媒体报道，由我国科学家自主,-99
1397407,我要杀光你们这些德福基金卖国贼[大笑]我让你坑,-99
4148854,牛逼啊，太牛逼了,-99
5055672,风吹雨打人不惊，悠然漫步胜闲庭―――今天27.2,-99
4150871,从36跌到29，仅需5min！,-99
1061532,今年还有12天了，今年必须完成华泰汽车重组了，,-99
3016313,会回补缺口吗？？？,-99
3797757,扬眉吐气2018！,-99
4328183,警醒：中环环保遭特停 次新遭遇历史罕见特停潮,-99
2216928,这股彻底完了，卖出不犹豫,-99
2699111,九天又开始叫了，接下去会发生啥大家都有数了吧,-99
4302930,一圈：你好Q……看看吧……水军[傲][傲][傲],-99
445504,寻找放“天量”的超级大牛股,-99
