,content,mark
4945808,这SB是怎么了？,-99
628977,淡定，不要慌,-99
1597053,快报！全球股市飘红！美三大股指创收盘纪录新高,-99
3222131,标致养的有留下个缺口，明日逢高减仓,-99
3028179,一场超市革命轰轰烈烈开始了。,-99
4356014,shihong888(cao ni )(ma),-99
924492,东风汽车是重庆小康的大股东，重庆小康是景谷林,-99
5541917,不开心，券商啊,-99
292186,万达万达。,-99
4972400,几个傻逼就知道瞎逼逼中曼公司，中国几个上市公,-99
2773685,3.33 豹子号，！,-99
1590518,千金我操你祖宗,-99
4082152,看好你！,-99
4584691,期待周一大涨,-99
5141689,其它次新股都几个涨板，这垃圾还绿盘，真想大骂,-99
2295613,300511烂蘑菇股价天价,-99
2403854,今天继续！,-99
1853208,看月K线，就应该明白了。,-99
266804,就是新一批的IP,-99
514219,明显控盘了，看来混改停牌之前别指望他大起大落,-99
1277787,看看盐湖钾肥，就知道它的走势了,-99
5273350,换手率过40才能涨停。,-99
5147706,板块暴涨尼玛币暴跌也是醉了,-99
2960889,董婷婷，快点砸盘，等你的高潮,-99
2262568,大家有谁知道还要停多久吗？请老师预测下，复牌,-99
241584,卖出前期涨幅大的、爆涨的、不分红的铁公鸡股票,-99
2283385,AR产业发展迅速 贴近生活“钱景”广2016-08-27,-99
3213329,[胜利][胜利],-99
4672903,水星家纺你能再上龙虎榜吗？,-99
4201060,缺德傻逼庄有种你跌。老孑就是不走,-99
1674759,华丽八月，九月操作，只看图，不说话。,-99
3317791,600986:科达股份2017年第四次临时股东大会决议,-99
2013593,内部信息，短线股收到,-99
4224789,同志们不买，我全要了哈,-99
2524238,保监会加强对险资的监管,-99
3979910,把建行拉到7元就想用你的垃圾股与我换股吗？,-99
946393,每次看看这里贴都对第二天的行情信心满满，然而,-99
3162293,王漫晓：确定适当的黄金投资期限让你先走一步,-99
4937814,浙江省京华激光防伪材料研究院升级为省级企业研,-99
1924143,今天回拉升，现在是底部，别怕,-99
2836886,痒老畜言：“奴家痒氏，小字老畜。父亡母在，占,-99
1453203,还有比昆药更垃圾的票吗.瞎了.买这垃圾,-99
4382003,不要接盘，这个主力好像在出货,-99
1560204,都割肉不看好 主力拉给你看 反向思维 满仓,-99
929101,艹尼玛一个问询，停你妈一个多星期。赶紧给老子,-99
2427501,哪一天不低开？撒比庄,-99
1594982,真完蛋了，又创了新低,-99
4969661,认怂，走了,-99
526805,顶部下跌做反弹,-99
4810482,量能的突然放大有点不适应，收盘前果断清仓，还,-99
4036095,贵阳银行由于上市以来阳少阴多，正式改名鬼样阴,-99
1143850,拉了 好激动,-99
507924,这垃圾股，下午停盘估计跌倒7个点多，想赚明天,-99
18925,603716:塞力斯关于受让武汉汇信科技发展有限责,-99
2425915,连续涨了三天该回调了 [胜利],-99
4509617,603268:松发股份股票交易异常波动公告,-99
3773896,很高兴看到罗曼馒头加入家穿小东狗托队,-99
4313139,以时间换空间，继续坚持,-99
4167229,又再挖坑低吸,-99
3739739,会稽山：中国黄酒顶尖品牌 市值低估！,-99
1996760,佰制药客观分析。。。。1，公司的账和收购或多,-99
5030819,三大股指收红 沪指涨0.14%,-99
4723831,亚振一天一个做法、看来此庄也是没能力拉升，因,-99
4475415,对于个股高抛底细，震荡行情，,-99
2773226,希望大家禁言不操作,-99
3331432,快点把箱体,-99
4121557,直接把单子往跌停板按啊，100手求套死,-99
828419,骗子公司，又开始忽悠人了，今天涨一点，明天就,-99
4646209,看是不是董事长死了,-99
1624797,新闻上没讲外国的股票有这有哪问题的,-99
2372877,公司1953年的每股盈利为4.13美元 ,-99
3332842,路桥建设股友发来贺电,-99
3928448,江河日上~,-99
2542567,600736:关于苏州新区高新技术产业股份有限公司,-99
1725185,多头行情，多方慢慢来。（9帖）。,-99
4132793,垃圾要跌停吗,-99
3985042,现在发审干净且严格，新股质量是历史最好的！,-99
1067052,成交量很大。,-99
5048583,2个板不贪婪，卖出     22.8元买入金石资源,-99
5183335,边拉边洗，涨痛快点行不行,-99
3801852,中国建筑：1-10月新签合同额1.78万亿 同比增长3,-99
4541669,无良杭叉集团配合机构操纵股价,-99
2827458,今天表现太差了,-99
4320174,使劲,-99
4239638,凶悍涨停板，强悍涨停板，强势涨停板,-99
3775814,不要瞎跑了,-99
1261299,明天大涨,-99
2018871,横盘8年，退市退市。没收朝日股权,-99
1966228,破3000是大概率事件,-99
235563,垃圾股！,-99
928635,完蛋了托单太多了。,-99
2993079,天天唱多，弄得我失去了理智。没有割出，搞的亏,-99
4062008,超合网络科技：颠覆传统洗车的新风口,-99
4135765,三年内不得再融资,-99
994170,学学市北高新,-99
4479265,跟疯狗,-99
5517277,反弹也是卖货[微笑][微笑][微笑]破3000更要卖货,-99
3472779,说别害怕的，去尼玛戈大壁,-99
1230238,延长三年，IP,-99
1148561,三季报扭亏且大增，是实质性转好。,-99
2445945,这样的换手不正常,-99
4662104,这个傻逼亏损了吧？拉一下也会死吗？,-99
3952442,短期高点，高抛,-99
2125009,对投资各方持仓成本分析。,-99
2132014,好好说话不要跌停,-99
1649862,抽死你,-99
1532051,新兴市场会被动的收紧。,-99
476872,市盈率还有96倍，太可怕了,-99
614307,周五9.73建了底仓1万股,-99
738752,明天有机会T，但最好不要建仓,-99
2466207,雄安新区概念相关产业板块5支优势个股资料（D6-,-99
3205276,又是哪个老总跑路了？,-99
2568775,股市分析及热点复盘12月14日,-99
1907528,我把话给你们说的这么明白，这么直接，对不对？,-99
2704763,新潮能源海外油气资产再扩张 低成本收购或受益,-99
4926464,我可以说一,-99
3345804,全球牛市狂欢，我们在苦苦盼着要饭行情。,-99
1956802,中小创成交量再次缩小资金面也紧张,-99
5371218,空狗们，明天打脸吧,-99
1959694,今天洗盘骗筹迹象明显！明天大涨可期！加仓买进,-99
4990454,恐慌沸腾加剧，暴跌开启，比谁跑得快,-99
3478951,梦里的飞花,-99
3856648,跳水,-99
3509417,应该是见顶了.....,-99
4636721,公司太有钱了,-99
4735301,其动机其实并不单纯,-99
2421203,老六，我已卖掉，你的自己看着办,-99
4337272,看看人家老白干酒，和你一样重组，人家6个涨停,-99
842296,千千万万个脏阿三 涌在心头,-99
584525,“十三五”地热能重点工程落户京津冀 地热资源,-99
1523596,底部以成大涨即将开始。,-99
4996209,来个涨停,-99
2096930,第二批混改试点酝酿中 央企改革望加速落地,-99
2470241,投资逻辑要理清这个老牌儿狗托还健在吗？,-99
1741197,长沙战舰一头驴，唱多被套不知错！,-99
4423484,股吧好清静呀，估计也没有多少散户了。,-99
3056212,最不要脸的大股东,-99
2539235,还是那句话我有信心陪你玩几年你每跌一块我就加,-99
3573662,良心庄业绩高增长还放筹码出来,-99
3431609,原油继续大跌，利好航空,-99
1364602,20元竞价,-99
653012,看看陕西煤业，再看看你，庄还要不要脸！！,-99
4746114,左手倒右手！！,-99
4943442,MSCI中国A股指数大调整：新增广汽集团等39只成l,-99
3217969,我们重庆的股票，还是争气一点，好吧？[鼓掌],-99
1076532,财务总监该你上场了拉起来别让股民伤心,-99
4436730,近期大盘有调整要求和风险，迎驾贡酒是避风良港,-99
181075,盘面观察,-99
4103241,绿色设计，绿帽股东，必须的,-99
1571109,快卖出用资金进入好企业发展，。,-99
1668519,指数拉的太有技术含量了~~,-99
570577,湘酒鬼股价1.99元法院拍卖机构没人接，股价迅速,-99
629010,这些狗托们输了就输了，又开始在这挑拨离间。一,-99
101085,紫光股份(000938)融资融券信息(07-19)。,-99
3429577,金融业以实体经济发展为目标,-99
5190497,603779:威龙股份独立董事关于公司第四届董事会,-99
2836527,垃圾货，没用的东西,-99
5520234,600550,-99
3515428,快换董事，宋董事你在常熟常输，丢人,-99
3462493,到底了，太平洋4块钱一下都是白菜价，买了放个,-99
1644633,是点燃个股上涨是点燃个股上涨t,-99
2702346,像猫捉到老鼠就是幸福呗。,-99
1327014,你这是闹哪样…,-99
2940599,妈的人家上龙虎榜的今日基本涨停你就几分钱就别,-99
1280993,13.76,-99
456839,今天大盘不好，但涨停的可能性很大。,-99
869957,南纺股份2017年报前要是不出结果，明年四月要被,-99
5341263,重仓的头疼，开始轻仓介入的乐了！,-99
3498678,顺我者昌，逆我者亡！嗬嗬嗬嗬嗬嗬！,-99
3603688,垃圾股走坏了[不赞][不赞][不赞],-99
3937246,要闻。,-99
1219274,有脸跌,-99
3947348,这点成交量也该休市了，不是限制散户炒股，请都,-99
2364647,上午涨停价出的货，真爽！,-99
4574013,梦百合必将是8月底的超级大黑马，逢低可建仓,-99
4534941,真的是一毛钱玩一天,-99
4545547,赚点小钱有意思吗，亏的是大钱，还T毛,-99
3293553,大家快抢东,-99
87876,靠水就能高毛利赚钱的只有白酒和水电,-99
593238,这出货不是散户的行为,-99
4910980,这支股已被庄家自己玩死了，天天发文也没用,-99
72235,兄弟们 这价格 可以上车吗  犹豫彷徨  我就怕三,-99
4210498,买，等,-99
1929108,"大跌之时，重仓之日,小心鬼托",-99
280285,跌的这么完美，谁要是不跑真是呆子！,-99
2396814,不把韭菜赶出“小、新、差”，谁去接盘大白马呢,-99
30736,回到10日线上面去收盘,-99
3124867,此股，应该是有强庄在控盘,-99
508789,该停牌了,-99
4140196,600753 东方银星；002803 吉宏股份，周一关注，,-99
4529127,大胆买入东,-99
3024743,严管下唯有自律方是出,-99
4947733,漂亮 和智能挂钩的个股 钱途无量！！！,-99
2333528,无成交量，二田解释一下,-99
1507563,一元复始的时候,-99
5474633,鸡店有激情，硬起来[大笑],-99
3646941,市场A股大底曙光在今年8月18日？！,-99
5097383,耐心,-99
3666136,主力，给点力，等拉起来在卖,-99
3292736,同花顺上边W涨啊涨W的帖子被狗吃了,-99
