,content,mark
1374663,磨豆腐，好,-99
4417366,和建科院比这股值100,-99
291523,二重5资讯：二重5:关于股票延期恢复转让的公告,-99
5292812,你们可以不顶那些空狗的帖吗？让他自动沉下去，,-99
1656875,大家猜今天能涨停嘛？5个点也行,-99
4832643,惠发股份可以考虑的收购进军火锅餐饮企业的名单,-99
3830024,一射完事？,-99
5516314,最讨嫌不停放屁的流浪狗。查一下有几条。,-99
971562,这票光15至16元就套了好一批人。,-99
4832417,怎么没人拿一两亿来把这个狗庄T飞呢,-99
1996744,益佰制药(600594)融资融券信息(08-31),-99
4048395,奥康为何不能给啊里入股呢？自己又不会发展？,-99
2423847,磨人啊，磨人啊[失望],-99
1655159,呵呵呵…看来你“专门啊打假”这狗T掉了[大笑][,-99
4667183,百傲化学拟10派10元,-99
107281,中小创最少还有三到五天的普涨、之后会分化、强,-99
3521069,601139:深圳燃气2017年第三季度报告,-99
4868492,创业板依托1950继续展开低位整理走势冲击2000点,-99
2749295,红外领导者,-99
1832358,涨了,-99
4996427,辛亏我跑的快,-99
4166565,浙88888888：再次买入对冲避险工具黄金，关注英,-99
1356746,江山股份(600389)融资融券信息(11-02),-99
958094,从新进的户可以看出，刚入八元没看清形势的时候,-99
326804,雄安雄安,-99
5192029,上市后全面升级 新日电动车打造行业王牌消费体,-99
3970170,600131:岷江水电2017年半年度报告摘要。,-99
2694603,巴西央行：降息至近4年低位 或保持当前宽松步伐,-99
25607,东风汽车怎么都是一副猥琐像，真的看得好恶心。,-99
1486876,吸盘不要怕,-99
3191430,江阴都13了,-99
3424308,这笔出货了太快了,-99
4134449,第八次是在中国宏观,-99
492495,A股无人问津了，光靠拆东墙补西墙度日，墙又越,-99
3234442,600961:株冶集团2017年第一季度报告,-99
3641767,他很自私,-99
1838220,问董秘没回话,-99
464884,看意思短期这股是没希望了，我这还想在这股上赔,-99
934598,进一个套一个，休息吧,-99
4406923,开闸放水！开闸放水！开闸放水！,-99
5410095,[置顶]致：三石ge，真正的超级大师在熊市中空仓,-99
4773919,此股王八做庄，毫无底线，CNM！,-99
5154542,603738:泰晶科技2017年第一季度报告,-99
1144863,上市融资步伐加快。地方性企业向全国性企业转变,-99
5062153,快跑啊,-99
1680235,这与中央的决策背道而驰背后更是,-99
5478903,大理发点小财可关注远兴能源,-99
2060969,400005和400006它俩老一改再改的的复牌,-99
2368110,超级电容为什么不用在小车上呢？。,-99
2138797,僵尸股,-99
3415867,节能风电主力加油冲一下涨停板呀！气死那些还在,-99
1675908,接近收盘有诡异，下周可能有惊喜。,-99
3786362,人寿害人,-99
3721186,娃哈哈 啊娃哈哈 不到25不卖他  结果就是脑残的,-99
4448058,护板赚到的钱比买其他股票稳当多了，也获利更多,-99
1511985,无量，拉指数有用吗？。,-99
2398943,趁机早日解脱吧,-99
4657718,牛,-99
2075344,咋回事,-99
1231031,动动东你动,-99
4762589,勘设股份 业绩到底是不是真的 为什么市盈率这么,-99
4702870,现在可以安,-99
2799224,新庄正式入驻核电,-99
655990,老乡别走！要走喝杯水再走！,-99
5015234,安图今天将创17年最低成交量[摊手],-99
3953496,大柳化谁与争锋。,-99
159998,多优惠软碟通,-99
1363039,明天一个涨停！888888888888888888888888888888,-99
2520610,今年卖房的上市公司数量达到百余家之多,-99
3503050,111,-99
4731645,午间休息，下午跳水,-99
1301654,出利好中文居然没绿,-99
3548569,原本就是煤炭股的龙头品种。,-99
3929105,冲啊。,-99
2586570,溢多利收购华安药业%股权 提高生产经营抗风险,-99
1262070,4季度均价将再上升500美元，公司利润将梯次递增,-99
3898783,中远海发(601866)融资融券信息(10-10),-99
1317005,但是通过和我们公司的上海女孩沟通毕竟,-99
3958829,速度买,-99
2886755,每日经济不负责任！严重了！正奸杀！,-99
5345074,证券日报头版评论不要把大数据好经念歪了12月12,-99
1112223,今天港口股会拉动大盘指数，拭目以待！,-99
5406393,次新一般都是跌起来没底的，不要被骗进去,-99
2681224,广誉远(600771)大宗交易数据一览(04-06),-99
788803,万达私有化龙头：皇氏集团002329,-99
4018984,重工庄稼真够狠的！高度控盘！,-99
3385340,这个3200点还有什么意义？,-99
3507176,人了,-99
4802575,关于一季度报告解读欧普照明,-99
2581792,今天什么情况,-99
425946,已经进入震荡整理阶段了,-99
1837795,你真不细心:大哥为了分小的红利把股价打低的,-99
3293534,震来震去就是不走。,-99
1338030,今日有200万股炒底,-99
3515675,难道常熟要领涨?无锡张家港江阴三领头羊上来了,-99
1536329,感觉今天像洗盘   唉  还是割肉了   草,-99
8710,学会做散户的叛徒，就是与庄家为伍,-99
4214700,试发,-99
4048339,呵呵，吧里而今充满诗情画意，气急败坏的却是主,-99
2715959,不看好,-99
2286745,这几天有上千手的买卖，可就是不涨？？？u,-99
5285806,这股绝对的奇葩，主力交易资金量1500万，结果主,-99
906442,600260:凯乐科技关于控股股东股份解除质押和再,-99
4426798,翻倍吧，涨涨涨！,-99
4459352,抓紧时间上车坐等数钱,-99
2053184,肿么了？钜亏了？车子那么好。,-99
5387996,603901:永创智能2017年第三次临时股东大会会议,-99
3889834,股市讲价值投资，楼市怎么不讲价值投资,-99
3993427,中买进罐沙丁鱼，,-99
5472524,看看拓斯达 果断加仓...,-99
3958227,垃圾！！！涨时阳瘘，跌时早泄！！！牛B轰轰啊,-99
1675055,又回到以前套路，成交量十分的少，横盘不动的时,-99
4224914,"现在看2.29,好高的山呀!",-99
5307111,主力有绝对控制权，不,-99
2976672,老子的新华都会涨停,-99
356793,持有上汽的看了别生气 每股净资产0.037元 宜宾,-99
933270,今天继续融,-99
892668,这股的股吧还是很热闹，当初沧州大化大涨的时候,-99
4281092,什么样的缘分，选择了你，合纵科技。造成了这么,-99
1895347,没见红都是，垃圾…,-99
2266065,万熙天地项目,-99
4091201,20日必见主力抢票！,-99
5212252,庄家继续吸筹？,-99
1946394,明反包,-99
4771042,好意思叫什么科技，,-99
3486128,60分钟走势已经暴露走势。,-99
4078123,等十一月吧，同志们！今天翻了一下光欲股份的公,-99
3580186,凶手李豫，作案路线：,-99
5226128,放心拿着，绝对不是出货！肯定是建仓！,-99
5416413,保佑中签呀[鼓掌][鼓掌][鼓掌][鼓掌],-99
20714,关注突破后，回调买,-99
2319934,花干撒很多个,-99
4911608,多空双方最终求和多方只得红脸空方没让突破,-99
4900277,完了,-99
4272974,指数今天涨明天拉，明晚新股一啪啦,-99
4458812,全都是小散在买卖,-99
2287833,比如今年11月15日发布卖房公告的粤传媒表示,-99
3299668,曹尼玛的，买什么跌什么。,-99
2876966,小赤佬,-99
1973067,外国股票基本在涨 中国股市继续下跌有什么原因u,-99
1755649,反正大盘不会跌，呵呵,-99
5268922,今天想它跌既然不跌了，我好准备加点仓。,-99
5404707,这一方面是多方缺少像之前险资那样的先锋部队,-99
3679296,主力以出货为主,-99
2973069,又有好多人上当了。还是那句老话，在基本面没有,-99
3166002,还有那么多人做发财梦,-99
3285259,下周看韩美军演如何发展。,-99
2191585,该公司懂秘,-99
1862161,三季报看点，股东人数半年减少1.9万户，散户这,-99
4409428,明天涨5个点。,-99
3576952,有人来本吧推介新都退，大家别轻易上当，新都退,-99
2413849,阴跌至明年8月，我拿什么来解禁？,-99
612219,百川资讯显示，6月27日。,-99
2192907,中报较去年增长50%，主业和投资收益大增,-99
2628175,还有十元的本嘛 ,-99
769893,不愧是航海控股，股价控得呱呱叫，管理层早就看,-99
4786191,机构小拉小出，有戏看了,-99
4034055,中国证券报：要抑制“炒小、炒新、炒差、炒消息,-99
1834080,被洗出局[滴汗] 大牛格局[微笑],-99
3894998,千金难买老鸭头！,-99
3375817,出重磅信号（附潜,-99
3298270,低不低估,-99
1959054,除掉你这个4比货,-99
4773915,形态恶化了，队伍不好带了。,-99
1622891,你们真追吗？,-99
1418492,没有量的拉升就是割韭菜的,-99
1912929,这也会导致股票的重心下移,-99
2447270,这200多手单子压得一点脾气都没有了。,-99
4244121,市场现重要积极信号 一概念或将满血复活,-99
5251065,603819,-99
4767438,没话可说，就一个涨,-99
4489122,大惨淋 这个星期跌破发行价，下个星期跌破净资,-99
4545705,监管层应好好停牌查查这股，这种跌法全世界都没,-99
2494431,要祷告主耶稣，上帝爱你们,-99
1259056,日线macd仍在弱势区，继续压盘周期，继续熬s,-99
4350437,调整战略部署才能加快,-99
842623,大盘新高，股价新低,-99
1070139,在第2章 。,-99
150194,盘几天，司法划转再砸一波。巳成规律。,-99
2813237,悦达集团官网竟然没有报道。这是什么情况？求高,-99
4267593,一天不死不活,-99
4938769,明年我要做奶奶了，看上去这个股票要留给孙子孙,-99
3209100,明天第一目标价格 15块!!!!!,-99
4179457,大盘看看！,-99
2840396,华北制药第三个单抗品种获批临床,-99
4004397,卖尼玛B呀,-99
1604282,2017半年报点评：业绩稳定向好 内部资源整合促,-99
446512,当大部分人都觉得是垃圾的时候，可能真的该拿着,-99
390443,稳妥操作，切勿浮躁！。,-99
1398627,只有人的内因最重要,-99
2934867,珍惜小盘股，猪力卖出垃圾50，在调仓,-99
1342242,有知道的大神吗。这股业绩这么差，有st的风险吗,-99
2721548,是否我把你真正的拥有/可为什么你要离开我远走/,-99
3180687,自己吓自己。云南。四川。会卖吗呵呵,-99
2306774,600676:交运股份:上海浦江游览有限公司拟股权协,-99
4590856,专治各种不服,-99
4286018,现买的明天都挣钱了,-99
321478,今天能涨停，庄洗呢,-99
266393,需层面预期的修复,-99
4193608,该上涨了，天天看别的股涨停，你就没大涨过，今,-99
