,content,mark
472410,最垃圾的雄安股，没有之一,-99
285840,成交量放大，股价不大涨，只能说明在换手出货。,-99
3599439,假一字断魂刀[亏大了],-99
5181759,我重仓来伊份，是金子总会发光的,-99
1993252,最安全的股票在哪里？！,-99
3454107,看看白酒，神华怎么也要到20倍市盈率50元,-99
4606741,1组2组5组现,-99
566334,000637的K线能上9块吗,-99
74403,中原银行上市收益没有算进去 半年报有伏笔 买卖,-99
427571,吗的不怕报应,-99
727586,紫江企业(600210)融资融券信息(11-22),-99
1930401,今天已经割肉，主力，明天可以涨停么,-99
1529502,[cp]三部门建立新材料首批次应用保险补偿机制 ,-99
1530787,上证指数下周预测：,-99
4711434,年内继续加息保持,-99
5411368,估计还要两个板，跌吧，没到时候呢,-99
3022696,鹬卖房，蚌买房，渔翁收税，好极了,-99
488413,不论分析如何,-99
457188,600131:岷江水电2017年前三季度业绩快报公告,-99
4255653,正裕应发回发审会重审，看还能过会吗。,-99
3000038,牌券商论道出真知！,-99
4030869,徐小明团队徒弟票603580,-99
3788388,外面狂风暴,-99
4381441,国之蛀虫，上半年利润161万，高管年薪均80万，,-99
3930147,关键位置比较指数找方向,-99
3141798,吹吹牛吧,-99
105659,南航跌起来他自己都害怕,-99
5045741,狗日的托出来买了,-99
4252141,同行业中旗股份目标80元，先达股份呢？,-99
4268239,怎么回事啊,-99
3495283,本散  十多年～～连主力这点伎俩也看不出？？？,-99
5176991,今日主力净流入：-193.3500万元,-99
1668691,敢不翻红，下周不想发十只垃圾股了吗[不屑][不,-99
3644236,北车是多少钱停的牌,-99
5402670,30分钟明显低背庄家你怎么看,-99
4615207,早盘内参：我国生物产业发展迅速 2020年规模将,-99
17505,主力大盘必拉！最后几分钟！,-99
3244340,回来看你们吃套的朋友了。哈哈,-99
4542762,603299,-99
5251863,隔夜欧美大跌，今天我们大A也要黑色星期五，装,-99
1080933,注意： 冲高注意减磅 ！！,-99
2954523,现金为王，观望为主,-99
133788,A股“入摩”引发绩优股的巨变 以后买股要重视业,-99
2268293,是吖，天津地又涨几倍了。恭喜连板,-99
1695397,坚决投反对票！,-99
5478956,不久的将来云南白药伸出橄榄枝,-99
1771703,交大昂立放在香港市场也就值二元左右![大笑][大,-99
127647,沪指进入震荡模式 后市关注两点位 今日A股,-99
3582630,切不要随便卖出国泰和中信,-99
969680,拉升时消耗主力太多资金，感觉主力骑虎难下。明,-99
2045638,近几交易日振荡中才捡了2点，冲不上年线先清仓\t,-99
3075588,要回抽到14.06,-99
1666729,储3月加息概率超过60%之前，,-99
1651555,我说过还有两个板没人信，今天抢都抢不到了。,-99
4439795,下午一点火箭发射,-99
4520976,呵呵，割肉比赛，看戏，看你们谁得第一,-99
1138156,第三季度的报表出来。买一点。。。jia 坚守的兄,-99
2250120,财政部部长肖捷：年继续实施积极财政政策 g,-99
647030,[大笑][大笑][大笑][大笑]明天复牌！几个涨停？,-99
1973486,用友网络(600588)融资融券信息(08-22),-99
1674506,盘子太大，都是套牢的散户。你是庄家你也不会拉,-99
4897191,大环境也不好,-99
4363137,出货三千万,-99
4807186,把翔狗当成一个屁放了吧，别理会这个跳梁小丑了,-99
3153666,这票反复冼，瞎折腾白白误了后路，增发价倒挂，,-99
1432493,证金汇金早减持了吧！不然这鸟样。。,-99
3127440,公司的官网都打不开了，你是不是要垮了,-99
5268431,才高开3分钱？有点失望,-99
4932459,开采可燃冰毫无疑问海工电缆受益 唯一的海工电,-99
4458409,原来一分钱可以玩一天[大笑][大笑][大笑][大笑],-99
1693256,分毛,-99
678399,高位跑了不玩了。你有你的财大气粗我有我的船小,-99
1241465,大家想想，为啥现在公司解决了股权质押问题，接,-99
4538770,本人因为流动资金需求，欲清仓久买不挣的杭叉。,-99
1963892,哎，不要挂单买了，买不动的，垃圾主力的,-99
3688120,中原证券这只走势是该减了还是加了？怎么操作啊,-99
3248984,下跌中继快点出手，晚了就废了，砸死主力,-99
201451,今天你这么走，蠢货有点急啊,-99
4221896,尾盘39 又买800股，目前3000多股了，继续来砸~ ,-99
751038,黄色线开始拐头向下。冲高回落。刚才叫大家跑。,-99
5295088,跌停跌停跌停跌停跌停,-99
258865,买了人福真倒了血霉了,-99
3749383,散户已没底裤呀，国家队就拉大盘,-99
370908,以后有土地才是王者,-99
1340175,金地说明在中国股市价值投资就是死路一条！,-99
298986,深圳聚银基金投资管理有限公司对于交纳9800元费,-99
5341273,这股票要横着一段时间了,-99
1447984,创业板的阶段底部预计在1800附近已基本形成。,-99
622809,[大笑]我们来看看瑞茂通的主力能否憋到8月份不,-99
4562708,马上涨停，后面还有10涨停，合理股价200元.发大,-99
580592,如果太钢不锈太原重工重组成立山钢重工超过日本,-99
3228060,山东的明星企业一个月不见了，没想到你又要创大,-99
4870383,我已经满仓了，兄弟们,-99
139627,震荡格局仍将持续，合理估值板块逐步爆发,-99
5257719,安阳喃娘来，又跌！,-99
3698551,公告造假，不是说减持完成了吗，骗人,-99
261786,今天的盘面没有什么操作意义，,-99
1421300,热烈祝贺三友阳痿成功。,-99
1154709,任何开通了该平台的异地都可以通过平台接收北京,-99
5078366,韦尔八点，你一点,-99
748511,谁闲的，翻这老帖，明天玄了！,-99
178375,古越龙山(600059)融资融券信息(11-10),-99
5505510,前者是配资公司提供,-99
5383737,老大雄起[赞][赞][赞][赞][赞],-99
3106372,亚泰这样搞下去，可能永无解套之日了！,-99
2421542,600705:中航资本2017年第一次临时股东大会会议,-99
1733659,识时务者为俊杰！风险大于机会的时候，你懂得！,-99
2599145,图书,-99
2984161,变相的股灾。。。。。s,-99
40446,真抗跌啊,-99
5095317,温故一下---辽宁欣,-99
2641336,就不得不忙着自己的店面了,-99
4266777,大家都对新经典失望到及点了！,-99
5114877,多次提示风险，不听啊，25元一下别进,-99
1892035,前几天跟大家交流，还不到时候买入，不要急着把,-99
2753214,还不是在正常交易吗？,-99
107900,19.9清仓的，今天果断加仓五手,-99
2917738,这个周末也为超级周末，利好不断，但争斗也不断,-99
4405299,603180:金牌厨柜独立董事关于变更部分募集资金,-99
3628364,茅台可以不喝，马桶和卫浴间不可没有，民生改善,-99
997798,，银行表外负债扩张速度明显放缓；,-99
2980424,早上大概率快速冲高拉升。,-99
893775,神仙打架。,-99
5045890,又在快跌2个点时买进了，爽,-99
2886067,多元金融崛起，大金融板块扩散，工程建设，建筑,-99
2232683,停牌事件过长、忽悠式重组、重组情形披露不明确,-99
3636033,任总，干了事，也得说出来，雷锋不留名的时代已,-99
1661328,这个股不会好！其实就是弱，不存在什么主力打压,-99
336354,一家资产管理规模逾70亿的大型私募基金总经理认,-99
876314,垃圾垃圾 喝血开始了,-99
4604215,看来银行被支付宝干掉了!银行股死水一潭,-99
4245695,我们的股市怎么不和别人的一样吗？,-99
2342448,并未说什么,-99
4465363,阳痿就是阳痿。,-99
4917664,想不懂你还要怎么走……看来近期没戏,-99
3858343,设创新型国家和,-99
4044607,大股东的市值缩水成这样 构不构成国有资产流失,-99
1302623,慢慢吃,-99
4386137,开盘大跌三分钟内跌停板！及时卖出后换股普丽盛,-99
4477434,大盘无忧,-99
163808,看来上证指数站3200点，要指望下个星期五了,-99
1538307,主力在横盘出货，不乐观，跑为上。谨慎,-99
4696750,狗杂种真跌,-99
4501700,来吧 49等你,-99
3440342,悄悄地走了……风终于停了,-99
2359865,国内股票要把一成票要涨到五百至一千元，九成票,-99
3989626,今天又被洛钼带沟里去了,-99
5403759,尾盘对倒骗人了,-99
4995836,别再涨了…… 保持形态就好,-99
2141998,当然，也有的上市公司股票，大股东减持不会影响,-99
1818051,给力，不知道是哪路神仙来了，愿这位524神仙身,-99
1534888,投资者作为一个整体不是也不能是证券交易商,-99
2515596,怎么还不分红？都拖了半年了,-99
4927544,保持新股发行常态化,-99
2320291,这是什么情况？我割了一半就涨停了，你大爷哟,-99
4815732,麻辣隔壁跌了两个月，老子亏了一万多,-99
749603,1280亩工业用地竟然估值128亿，我也是醉了,-99
2838539,新疆石河子,-99
1181777,7.12 大盘解析2,-99
382786,大盘调整在所难免，顶背离有一段时间了，不要轻,-99
2483903,大家今天看好了！周一有色是龙头！白银是龙头中,-99
1684618,今日回顾，明日展望,-99
1669075,昨天收盘价应该收8毛，今天应该收7毛8分的,-99
1748455,低开之后呈现震荡走势,-99
180026,11.52收盘 就可以 如果绿盘收周一就麻烦了。,-99
277932,重组后的中葡，价值投资，长线持有,-99
1043151,尽管受经济数据不及预期影响大盘走弱，再加上上,-99
1579104,不再上当，诱多,-99
742651,说一千道一万，你就说再缺钱也得等到开版再卖，,-99
2670463,并不是我们做人变得圆滑起来,-99
587735,死了，日线不行了，而且今天没有量，持续下跌，,-99
3499694,别人买小，找买大。[大笑][大笑][大笑],-99
2000121,张家港行的炒作f,-99
1792681,昨晚美国宣布加息，今天咱们大A股应该有点表示,-99
976856,明天补跌了，可以买么,-99
1239721,价格在9元合适，拉涨停拉多了，为的是好出货。,-99
5084640,0523 隔行评论,-99
4880759,星期五拉次新股，发行9家。[摊手],-99
2071941,真无语，浪费行情，别的股涨上天了,-99
259806,红颜二[大笑][大笑][大笑],-99
3260357,没人拉，晚上回去要挨批，假国字头,-99
2057242,中毅达高管否认“自保”指控 回复函透露诸多乱,-99
4675151,外面冰雨连天，大盘大跌，个股跌的一地鸡毛，新,-99
161942,今日下跌证明明日季报不乐观，白马板块即将中期,-99
998696,亏损还能涨停，这股市太奇葩了,-99
3836260,此股没有投资价值，投机价值么有一点,-99
5331215,屎鸟......死鸟，屎鸟......死鸟.......,-99
2276814,贝恩资本拿下东芝芯片  sk海力士受益  太极受益,-99
225249,海康再度辉煌秘诀,-99
4270489,今天继续涨停[鼓掌][鼓掌][鼓掌][鼓掌][鼓掌],-99
1253183,今天进去的是否休息,-99
2010800,600598:北大荒关于购买委托理财产品的公告,-99
1623487,买,-99
1263947,商品期货市场收盘沪铜涨超1.93%，沪铜快接近前,-99
1597771,菩萨保佑凌云的庄年年亏，早日破产。,-99
2296150,国内几位基金经理在选择个股时都提到连续3年的,-99
3387487,但吸引众人目光的同时,-99
2001819,其实看看鲁西化工完整的运作过程现在也就不必惊,-99
4985733,完全控盘，玩死小散，不要轻易进入。远离这个票,-99
153258,这样的公司,-99
