,content,mark
5531763,艾华集团来个涨停板吧,-99
3588034,大家都别吵吵，安心安心，好好的过节，等十月底,-99
680088,下昼涨停,-99
4249329,有谁比我的价高。看来叫别炒新，小。高送转，我,-99
3675762,全球股市可能面临中期调整，唯我弱A处于洼地，,-99
5130166,禁不住主力折腾你就别碰次新股！？总之，我认为,-99
4455409,4100万流通股 全天换手4%不到 这样的股票直接日,-99
1270531,我们逢高就必须出局,-99
3684210,涨停吧,-99
4556479,我操，什么情况,-99
2576698,傻逼操盘手，你洗盘洗了1年多都没把老子洗出来,-99
1759339,今日大盘收红概率100%。,-99
4503735,公司互动答复：工业硅属冶炼行业，分管行业机构,-99
2647895,否极泰来……。,-99
501350,体积和距离，所以股债都在谨慎克制的,-99
2645248,根本停不下来的节奏,-99
1594045,咱有什么说什么[想一下]老乡，你打到16.7块我可,-99
4279690,如何举报这货？,-99
3137508,跳空四连阴，短线有机会，但风险仍存在,-99
5224192,占美国产量比例（%）25.6 30.4,-99
2579265,既然傻逼操盘手不断给我们散户买进的好机会，那,-99
709865,生当买股票 死亦有跌停！问君能有几多愁,-99
209548,饮屎饮屎，疯狂吃屎,-99
4231184,今天集合竞价布依又买回603078,-99
319591,从住的地方要打车去公司那里,-99
613104,喔，环境一,-99
936059,常问自己，谁对我有恩还没加倍报答。,-99
1957292,胜利大逃亡，感谢主力[鼓掌],-99
3522222,寻找机会,-99
4283267,不会跌停，但此恨绵绵无期,-99
4201761,坚定看多！,-99
4397031,股灾来了吗？只有新股涨停板其它个股都跌开,-99
2055249,拿稳坐好，坐等飙升。,-99
1237195,我不是雷锋，是不是天上掉馅饼你自己看我啥也不,-99
2768714,大多数个股主力配合来了一个高抛,-99
2618049,福建股真是不能碰,-99
1370335,静等穿云箭，没有大单买入，是涨不上去的。,-99
2371784,当年我的确错了。,-99
2688717,又洗掉一批250,-99
2413788,7.5入场了，，，，,-99
3854661,dfwe向5G和军品核心技术深度布局，静待水下防御,-99
5066664,今日早读,-99
925387,只要你买，狗畜就会立马卖给你，从而把你套住。,-99
938212,上证指数 滑铁卢马上开始。,-99
2745278,把那朵天清云淡之思祷,-99
5081381,看新股这么弱就知道发行都是骗钱的，A股又开始,-99
127418,逆势,-99
2470408,如此跌法，情况危矣。,-99
3106302,资金小流入股价下跌，这是暴跌前的信号！。,-99
5446534,哈哈，看我东尼，10分钟就顶无能涨一辈子了,-99
1503474,破位了，明天还要跌。狗猪力。22元的本。,-99
541135,前几家为什么不合格呢？,-99
2742904,而上一次更名就发生在今年3月29日,-99
768817,市场行业指数涨幅相一致。,-99
4633160,26.30给我洗跑了，害得我10000一股赔了2块你往,-99
1171417,笑死我啦，都没人去买，哈哈,-99
4235520,21左右开板， 洗盘再冲高 若三季配合预喜 可摸,-99
5048272,快跑,-99
831924,一船科技票,-99
1101282,跑,-99
3140484,南京化纤盘中出现闪崩 祸首资产管理计划 祸首,-99
3109875,明天领涨的次新股：华正、同兴达、新泉,-99
5046286,吧里一片涨声，后果难料,-99
2325906,我真的扛不住了，我就是一名普通的打工仔，每个,-99
2682618,比特币的加密算法一旦被黑客破解，所有比特币都,-99
1157869,抓了5个月没理它，回来一看还是有点意思。周级,-99
441669,这股也基本边缘化了： 国有股划转不炒， 新能源,-99
1980147,平煤股份东,-99
3454995,守住筹码！,-99
216226,如果茅台三十倍市盈率是标准参照物的话，那么，,-99
1381470,主力、也就是空头在加仓。,-99
3651078,会打到20附近,-99
5374776,对这种超小盘股，大资金是不会进一来的，只适合,-99
3949059,流通市值577亿，上午成交3000万不到，情何以堪,-99
2013271,这么唱多 看来有大利空,-99
2256897,坠落一地的哀怨,-99
3737035,神龙翘尾 明天应该能稳住,-99
3713699,隔夜外盘：道指周跌幅0.49% 油价创13周新低,-99
4649690,来伊份盐津铺子都发飙，这股呵呵,-99
4821075,清仓 清仓,-99
3917120,过了大概一年,-99
1528040,怎么就跌了。,-99
2272968,标的合肥瑞成！,-99
964430,肃然起敬，为国人争光的企业！,-99
895434,买涨不买跌，买股票也就是赌博！个人认为,-99
347016,幸好留,-99
4610084,002439 长期横盘，缩量下跌，无人理睬，减仓出,-99
850756,特朗普或被弹劾美股遭血洗 A股今天将这样走！,-99
3100376,8.74盘中跌破，尾盘收回，还未开启新的下跌通道,-99
1541204,现在开始到周四收盘，买入都是有收益的,-99
2209856,独立客观研究的专注,-99
166415,指数既然严重失真，何必在意年线得失?,-99
493139,这样才好，曾少你的，你已在别处都得到j,-99
3369836,说好了下午涨！！！！,-99
1523341,300551,-99
1260835,今天一早出局了。对错天定。,-99
5074193,待到山花烂漫时，它在从中笑,-99
1715600,钱不多，那敢和机构比,-99
379753,今年主流是专挑行业龙头，买赢的概率大,-99
2836059,东方集团(600811)融资融券信息(09-27),-99
4271668,前海倒闭，亮亮喝咖啡去了，这股真玩完了，赶紧,-99
3264259,大象无形千,-99
4937991,603607:京华激光首次公开发行股票招股意向书,-99
5251236,都是小朋友在买，胡买。如果收到25.08以上可能,-99
1463426,同是新疆水泥企业，同样亏损，天山股份十四。青,-99
4267294,乌云盖顶，上有大手抛单压盘，收盘预计跌5个点,-99
4121681,小威！来吧！等你到10元.大爷好好享受你身体！,-99
4414246,都是哪些股在涨[不赞][不赞][不赞],-99
4188639,明天该破26了，下午25.25进了七成仓。大家怎么,-99
1025273,周一就是大中阳期待8888,-99
2997013,一青一黄又一年，没人赚钱,-99
622774,而未来离我们也不再遥远,-99
110231,大盘资金流入把握龙头机会！,-99
3587807,天天杀尾盘，已如惊弓之鸟，谁都不确定明天会发,-99
3091946,证监会：对忽悠式重组、操纵市场等违规行为露头,-99
639269,十月直到九快，你别中途下车。。[牛][牛][牛][,-99
4896767,出了减持公告没单进，让他天天空。,-99
728315,这辈子倒大霉了！买了紫江企业和他妈002070[哭],-99
1504343,杜宣你妈黑逼,-99
3436576,m磨磨唧唧，跌吧，哼,-99
1904478,早盘以为抄在地板上，结果地板下面还有地狱！,-99
2478410,说涨停的是不是都被打脸了，不要今天稍微涨一点,-99
2420897,今日收盘5.93元,-99
159892,600054:黄山旅游关于协议转让全资子公司100%股,-99
2318001,今天会暴涨。,-99
3221973,警告：小心变盘!,-99
3530784,呵呵，联系几乎停滞，主力无聊的上下挂单，偶尔,-99
3282307,在此股身上亏的太多了怎么办呀[哭],-99
254553,大C浪也许会来，但绝不是在今年！本人认为5178,-99
5110355,这小子是走到哪赔到哪的赔钱货！,-99
5059379,求中一签吧 赔好多了,-99
5217860,t跌停……跌停……跌停……跌停……,-99
2158787,增持公告,-99
1049365,危险,-99
1009313,域央企重组整,-99
1345387,继续保持稳定建仓,-99
3965435,神棍何在，出来分析下,-99
3055552,600867:通化东宝关于《关于对通化东宝药业股份,-99
3163363,一卖就直线拉升，明天谁复牌了？,-99
5521379,哈哈涨停,-99
178802,中国工程院院士刘中民： 让“煤代油”“煤代粮,-99
1040791,看见都在叫跑，我果断又加仓了，,-99
750265,这是第一篇正式地来谈谈此事,-99
927708,跌多了，怨声大了，就拉一拉，然后继续跌,-99
962144,人工智能+芯片概念新龙头高成长次新黑马补涨目,-99
5113417,端午过完 开工第一天,-99
315520,加油！加油！,-99
5551769,抄底 雄安第二梯队:河北智慧城市+电子政务+航天,-99
4397088,到十六块以内再买回来[胜利],-99
338006,同方玩利益输送，贱卖优质资产高价收购垃圾公司,-99
1235775,底部三只假乌鸦。难道是真乌鸦？难道还跌得不够,-99
5060384,603683先到16元再反弹,-99
1294585,利率决定和政策声,-99
4351740,真垃圾板块倒数第一了，,-99
4288381,还有人抄底，完蛋，没底了！,-99
388404,明天涨停！。,-99
902738,"被上名叫短线联盟的机构骗进来的，56.6进的,现",-99
1302938,同是“王的女人”同是游戏类股票 昆仑万维为何,-99
2395877,此股买点放着就不要去看了，每天看看收盘就好，,-99
3654011,601318中国平安周五收盘短评（下周涨停可期）！,-99
4194135,本季度大盘和A般指数涨幅将会是世界第一,-99
227566,行情性质与趋势,-99
3014414,钢铁侠你收了宁波中百杂碎，我实在是看不上他了,-99
2380204,庄家诱多，明天必跌，砸死庄家！,-99
3220037,600958:东方证券关于公司董事辞职的公告,-99
892134,有没有不怕死的和我一起抢华资实业反弹,-99
4672162,中签的都赶紧跑吧，不然一毛都没有,-99
4575903,破所有均线了，要割肉了，这市场不是在跟你开玩,-99
4744332,大风险来了你还不知道,-99
4619008,越补越跌。狗日的。割肉货,-99
3019317,今天收盘预计会走出三只乌鸦的技术形态，K线都,-99
630774,整个人的身体都是在跟着抽搐一般的抖动，那个学,-99
4227025,这是千年乌龟庄[毛估估],-99
4899664,世界每年有一千万人死于癌症，中国每年将近一百,-99
4285990,清仓的人真多,-99
2017215,这个领跌股，快跑,-99
1657025,今天我会择机进场,-99
2288505,高位跑了，不想着回本了。老子不玩行不行？大家,-99
2869441,庄家是个老阴蛋，知道今晚要出消息，故意打压！,-99
3729842,这似乎有野蛮人来了，差不多干掉十万手了哦。,-99
750577,缩量没戏,-99
868418,股市里买进机会多，卖出机会少,-99
5175648,不开不出货，开板就送人,-99
2606910,[稀缺钢材垄断]002110三钢闽光全流通可炒市值4,-99
1943469,八钢主力完不过！牛逼  走了,-99
1115386,别怪南京人，18号开会，19号涨,-99
496091,衡盘?难道又有大单交易?,-99
1572843,首先要看大盘当时的运行情况,-99
1902899,我到股市亏钱就是价值投资思想造成的,-99
4376299,请继续质押！,-99
1576492,聚财生金：黄金震荡徘回，原油回落继续多,-99
3826321,大家买进，股东一直在减，还r让高位套的股民活,-99
3935966,两市量能较前期有所放大，合计成交额为5845.40,-99
3784931,这个票绝对绝对是要发力的了，有仓拿稳，没仓开,-99
4210098,这么好的机会，既有故事又有大盘的拉升，你却吐,-99
3424546,15.9来点货。主力。我成本10.6,-99
1719604,甘肃省委召开专题研讨会：方大炭素总经理锡江作,-99
2442671,8.2下单一万股，主力能砸下来不。,-99
5350375,郝总您好！最近金域跌成狗了，请关心一下投资者,-99
2844216,能接,-99
