,content,mark
3166,不知道美股有没有纽约50[亏大了],-99
5454461,好,-99
2869745,据这几天观察，这股每天都是大单早盘假装拉一下,-99
3468202,这盘子今天危险,-99
5548947,是不可能懂得加速IPO对股市有怎样的杀伤力的,-99
1427399,华胜天成并购泰凌微电子交割仪式圆满完成,-99
4270074,跌停价买点，看能买到不？,-99
1755467,完蛋鸟，不翻红了,-99
3326008,早盘已提醒散户要谨慎，看清看明白庄在决定操作,-99
3528539,坚决记住，不放量就不会上：,-99
2279914,18.80附近可以买回来,-99
2003159,重要事说三遍，现在可以三成仓抄底了，现在可以,-99
1540605,投资者重红利，投机者重消息,-99
338156,吧里一片抵毁唱空同方之声，实则空即是多，无非,-99
2148344,现在恶庄已经赤裸裸的跑路了。,-99
4469970,晒号11726，76575[鼓掌][献花],-99
1362073,投了反对票，大家一定不要忘记投票,-99
2232105,不披露信息罪，为什么没有诈骗罪贪污罪。,-99
2440087,老鼠，蟑螂不死，苏美达也得死，,-99
4892788,一肩担尽股金愁：今天投反对票,-99
2734705,十二条买卖法则,-99
3054902,垃圾通化东宝！片仔癀、康美药业大涨4个点，你,-99
2749107,好一个诱多，害老子接了1手，醉了，太冲动了，,-99
3794087,南玻已经到了9元多！旗滨集团应该8元左右！,-99
2313816, 其实，我也是亏了很多钱，才知道的这些,-99
2103606,昨天相对集中的资源系列题材今天马上反压,-99
2243366,这庄好穷啊，,-99
4657863,此股散户踩散户，没有庄照应,-99
2057297,那些唱多的狗托出来走一圈，这比啦机股今天明显,-99
2166013,浦东金桥(600639)融资融券信息(12-14),-99
3544812,只要到8元，我一定清空北行，从此不再关注它。,-99
4467973,603226:菲林格尔关于会计政策变更的公告,-99
2746234,必须清除融资盘！,-99
2003673,再来看[想一下]。,-99
4685519,从48到57这才是第一步。下周发喜糖。,-99
3500795,8月份氨纶涨了不少，是不是该出个业绩修正公告,-99
4860988,概念不少，就是不涨啊,-99
1928907,"不看好还留在这里分分秒秒唱空目的很明显嘛,专",-99
1884271,融资盘都要破产了,-99
2583641,很快就会到14元以上j,-99
4758087,要发飙了，呵呵,-99
1839294,枫：新三板这两年就是预备,-99
92658,完了又跌了,-99
1983096,鲁商置业(600223)融资融券信息(07-31)。,-99
2438440,暴风雨就要来了，明天放量大跌创新低，11月跌破,-99
5050647,卖掉退市垃圾奇景，买入超频三，等着数钱！买奇,-99
4331067,10月31日上海国际航运中心转型升级新闻发布：,-99
583959,送股送成垃圾股了,-99
3161301,主力玩吧，破了17.14元我看错,-99
2442562,完蛋！下面的还有大的托单！还得大跌,-99
1865062,马上吃饭了了！晚上谁请客啊！停停吗？,-99
2114149,感觉现在的股市跟十年前已经有很大的不同。,-99
4290079,下跌中继状态,-99
3955493,我认为这股近期会拉升，前提是大盘不崩，现在转,-99
1330011,退市吉鑫！！！退市吉鑫！退市吉鑫！！！退市吉,-99
189165,成交量同比昨日小幅萎缩,-99
2072841,中金网信:2016年年度股东大会决议公告,-99
1788259,贝贝不涨市场肯定还有大跌,-99
4279306,社科院研究员：很多房,-99
218301,等主力9亿多块出完，这个就彻底要在6块附近走心,-99
383578,主力资金将大举出逃“北方稀土”三大迹象表明将,-99
5376805,垃圾火猩不配拥有牛股，他去了普通股吧了；请看,-99
1830861,1、人民币上涨，股市下跌，人民币下跌，股市上,-99
2346750,中国保监会召开紧急会议,-99
2766399,丢人,-99
2342179,石墨板块涨了这么多还能追高吗？,-99
1301409,避免因进项抵扣减少而增加税负。,-99
2315374,呵呵   貌似我被屏蔽不能发言了,-99
1765080,灯下黑，山西人是不会看好大秦铁路的……。,-99
3340406,陈平大老板你是不是想看到我们的明天是这样子！,-99
3942930,紫金从上市以来就是套人无数,-99
4258611,论流通市值市盈股价在次新股中算是很有吸引力，,-99
699523,市场经过三天反弹离均线有些远,-99
1552088,敬告3D血管打印的追求者，公司近期股价一路下行,-99
4139187,这是个什么股啊？还不是人为的?,-99
2628354,继续往下砸，把缺德顺砸爆仓！。,-99
278913,有人说1600股要15元转让我，大家说说我要买下来,-99
560089,今天是本周最后的最佳买点，没有买的，要么追高,-99
1563593,太意外了，刚打开电脑，一大堆公告,-99
1212940,流值100亿以下再动手,-99
3518958,我已经撤了,-99
407923,18.68亿用于投资公司子公司肃北博伦矿业公司拥,-99
4995545,杀进去两手，45，嘎嘎嘎[大笑],-99
7916,关注后期走势,-99
1104852,2017年洪都航空盈利4700万,-99
4830401,草泥马的湘才证券傻逼,-99
1795532,贺电:开关天胶今夜再创新高！1500手多单现利润3,-99
61355,买进,-99
1483229,老子不割你不涨,-99
1683935,八年前，老子开始3千点保卫战，八年后，老子又,-99
2519082,同济大学疯了,-99
4879110,散户不跟，只有硬着头皮拉，应该不是吧，毕竟价,-99
2263734,这走势没法操作啊，要么下来我补仓，要么上去我,-99
4781558,祥和专治各种不服，有种你买进来试试。,-99
4139282,603029,-99
2418636,今天收盘价6.28元，,-99
2872631,股票是用来炒的，不是用来投资的：投资请存银行,-99
5207896,2018年钴理龙头短期趋势分析.,-99
3171476,24.4%的投资者持有市值1万元以下,-99
790831,你直接跌停好不好，丢人现眼,-99
1602637,风险中伴随这机会来了,-99
4518870,昨天29块七毛八清仓了。看来卖赔了买不回来了,-99
4080024,垃圾公司高管脸皮真厚。太无耻。,-99
2750198,有收红盘了,-99
2863653,在多的利好也没有用，因为它就没想着要涨,-99
1036311,看好你哟,-99
1938049,3.67已撤，亏了几百，等着砸盘,-99
1002332,在线家居或成资本市场下一个爆发点,-99
5098362,华新水泥市,-99
416085,和公司法》登记的有限责任公司或,-99
2518974,狗改不了吃屎，纯正的狗屎股,-99
992062,明天一字板,-99
4327393,昭衍没能扛起次新股大旗,-99
3939596,归根到底是筹码问题    通过独家筹码分析   所,-99
5356083,麦香[大笑][大笑][大笑],-99
1284708,航母+核武 美国要动手了！军工股咋炒？,-99
5423885,[大便][大便][大便][大便],-99
397406,别急啊，明天见底5.08！就可以抄底了！。,-99
2621169,两地上市银行股AH比价失衡,-99
4451313,都是割肉盘啊！~呵呵！！！痛不痛啊！,-99
2778725,浙大网新投资的人工智能领域的鸟瞰智能经过激烈,-99
5337790,这个时候一切压盘都是纸老虎，所以，小散们不要,-99
4699347,哈哈，闷杀,-99
1207128,呵呵，终于看懂了，懂的人懂，不懂的人还在看。,-99
4263215,等死吧……,-99
129479,畏的,-99
4141309,今天开始T了,-99
1065496,"3300点马上要破,千股下跌的壮观场面再现.",-99
5449637,笑而不语,-99
2084879,场建筑这里曾是古丝绸之路上闻名遐迩的集,-99
3730600,创业板大跌,-99
302218,疗中心签署合作协议,-99
371288,600108:亚盛集团2017年第一次临时股东大会决议,-99
1900806,迎合市场炒作。,-99
3392219,大盘明天还有一跌,-99
3135739,快去追雄安，保证套不死你,-99
3117225,杉杉股份从今日起，纳入MSCI China All Shares,-99
270993,就是维护市场的稳定,-99
4570551,抛要毫不犹豫，砸下去就行,-99
2373526,蓝信移动平台创新警务新模式，向科技要战斗力,-99
2170857,嗲声嗲气的叫你一声大老爷啊。,-99
5405753,・1信雅达是中国A股含金量最高的金融壳资源,-99
3987882,"8302 14,能中否？已经3个月没中签了，市值蒸发",-99
1610658,我为何坚定看好A股,-99
1202824,装B,-99
2673256,大家不要买庄家骗人的把戏,-99
400324,看看你大哥 国航都起来干活了。  你还在懒床 。,-99
5202990,股市午评：目前市场就是这样，你涨我退,-99
4770584,要调整几天了，更上一层楼,-99
678415,复星医药拟6300万欧元收购海外资产,-99
1526982,消得斜阳几度,-99
2609353,股票基本面怎么分析？,-99
3259432,能有效地识别主力建仓,-99
4761179,三家同天上会全部被否首创IPO零过会历史记录,-99
1509870,大家要做好心理准备，早做打算了！,-99
431875,全股市最健康的股，公积金加未分配利润就有13.,-99
4489812,二板王[大笑][大笑],-99
3156133,超大单流入增多，适合长期持有,-99
1995790,利空还没出净啊？一开盘又大跌[哭][滴汗]，。,-99
5216457,痔疮股份…,-99
5425101,来一个套一个，缘份啊，割一个走一个，谢谢啊！,-99
5371854,12月18日龙虎榜,-99
1620505,想套老子？,-99
3566643,股吧,-99
3029592,看了多年城乡这个公司，就知道当地国资的当家人,-99
987221,沪市上市公司公告(10月18日),-99
2240856,是实名 贴为啥不让发？c,-99
2614609,600754:锦江股份独立董事关于第八届董事会第三,-99
3509058,今天如果砸下来就买入了，可惜没下来啊，明天砸,-99
722518,这女孩是从浙江来的,-99
687870,即使你慢慢老去。,-99
3178972,总算走了 解脱了,-99
1661461,中化国际月线图,-99
4177937,哈哈，开盘竞价就跑,-99
4740744,"股市记住，“曲突徙薪无恩泽,焦头烂额为上客",-99
3988214,没什么主力狗杂碎而已你砸吧，下来我继续吃进！,-99
4753901,老吉的机构操盘要向光威复材的机构好好学习才是,-99
2664933,垃圾运盛，坑害百姓，我们合拍人决不放过你，不,-99
2815138,怎么搞的，昆机延长36个月的消息竞是从沈机那得,-99
738792,还好早上跑了，股权转让碰不得，跟英力特一样，,-99
2645616,失眠的夜晚，发贴灌水,-99
2604793,资本双向流动时代的投资机遇,-99
5344873,明天低开必须的，尾盘跑的牛逼,-99
2739852,别有风味的土豆丝,-99
5376781,首部国际中医药专病指南发布,-99
3215393,明显是老乡别走的行情,-99
1816680,煤炭板块流出2.10亿，在做空快跑！！！,-99
1433062,缩水了，才赚3毛钱，卖还是不卖？草泥马,-99
423616,别抱太大希望，期望越高，失落越深，能突破6.57,-99
3150155,远离短信票,-99
2954950,看到都了大,-99
113880,真贱！,-99
4014336,韩志国12日怎么没出来走两步，说好的不见不散公,-99
3780933,中国中冶拟参与设立福州中冶管廊建设投资有限公,-99
601291,今天有惊喜！节后留悬念！,-99
2188769,"183,816,000度电就这样抹去了？30座小水电，2亿",-99
250856,交易所不但要提示，对市场中的参与主体要一视同,-99
5145641,603729:龙韵股份2016年年度报告,-99
539267,大阳线不破追跌看涨,-99
4884535,畜生，，早盘利用集合竞价，，3比买单，，90万,-99
