,content,mark
4988813,第一目标在18元附近,-99
4792956,不想看了，睡觉,-99
3999916,什么都涨价，轮胎不涨价吗？,-99
1003473,好股，业绩增长也跌,-99
1499115,"不怕跌,就怕不跌.",-99
4118349,终于又打开了一点下行空间，观点不变16.7元,-99
2933911,下午要起飞，大家坐好喽,-99
4081121,散户被吓尿,-99
3664107,人家香港的股市天天涨,-99
3892842,买了中屎油，一身不用愁。多好听骗子语言，到今,-99
2153760,天天往自己脸上贴金你真有这么牛？,-99
4010198,中巴签署核电机组商务合同 “华龙一号”再次出,-99
1580422,跑，破位下跌,-99
5235909,[拜神]40已经是极限了，跌不动了，可以满仓干了,-99
3762793,买了这股的要哭了。,-99
4768814,盘前信息早知道（12.06）,-99
755859,收藏全柴动力股票！,-99
3950681,创业板跌成狗并不令人奇怪。,-99
839542,9月底之前到11元,-99
2885656,益民不可以融资买入是不是因为股票没有质押阿？,-99
4484751,跌停价等着,-99
3181129,直到遇见你就看到回头金，真不容易，自己单打独,-99
1784107,皇氏集团吧002329:携手360，联合新东方 参与万,-99
5528157,涨停板个股不少,-99
5072121,怎感觉好好的一个政策，到他们手里成了殓财的工,-99
4667820,精彩，今天跌3个点,-99
1077572,钴价暴涨，铜价暴涨，号称有色龙头的洛阳钼业也,-99
2242106,捂盘惜售就能拉动涨价。 大家都别急着卖了,-99
514279,混改就能盈利？骗谁？,-99
5072565,大盘要调整到8月底,-99
5166080,主力正在阶段性高抛，高抛，高抛[大笑][大笑][,-99
4604070,吴江银行明天不大涨5个点我准备吃狗屎和猪粪。,-99
5380230,夜壶 八千里路云追月：割肉 哭坟 日连夜,-99
568421,破局“双十二”：福田奥铃与图雅诺重塑城市物流,-99
3322978,一年一波，年年有波，,-99
1636169,:赖皮臭！,-99
3082643,气死，17.1挂着准备走,-99
3613076,上银死了，亏的钱就算烧纸钱了,-99
5106008,买了3000 股[鼓掌][鼓掌],-99
4507140,挨家巡你太烂，满世界的骂街。你不是五毛你是什,-99
4803509,起码两板迎国庆,-99
3874799,按照36亿流通市值1.8万股东也太少了吧,-99
5345720,马勒戈壁！又是玩一天织布机！最他妈的就是那些,-99
2536794,昨天尾盘没拉，我感觉是时候展现我真正技术的时,-99
3761090,“人地挂钩”落实 一二线热点城市正加快供地节,-99
4106062,创新低，20以下补仓降低成本,-99
1066867,反正那么久了，千万别现在死出来,-99
5117770,秒射三下，闪人。,-99
2990360,20171006 港股有“大时代”，A股难道只有“小时,-99
2094680,。,-99
2220846,又被洗出去了，6.5个点,-99
3007621,明天新天要护盘，涨回\t,-99
4586926,你他吗到底有多少货，直接全部挂41 好了 不要吃,-99
3990629,下跌到5.6元。,-99
264577,减持新规显威力 减持公司数量下降明显,-99
3716361,大概率走妖,-99
5112800,请问高手~该股以后能不能跌到一块钱三股？,-99
1523590,这样的亏损企业与当前市场热点是不挨边的，当前,-99
2874751,撤回资金，回家休息。,-99
3195926,多头狗可以去死了，这股不到9元别碰。,-99
471877,后娘养地货，一把好牌，就是没资金关注。,-99
5067374,欢迎明天到,-99
5125124,[兴奋][围观],-99
2026276,，随便主力怎么折腾都可以。,-99
592265,天天高开低走，是出货还是震荡吸筹？主力资金流,-99
4332294,没人气了 不是一般的烂啊,-99
4572322,梦百合快突破了，持股待涨！,-99
3439858,一拖股份(601038)融资融券信息(05-15),-99
562874,老人们呢，在哪,-99
120540,每天这样很无聊，有魄力打到增发价下面去，算你,-99
2480489,他们都跑了。,-99
3608332,敌人认为对的我们坚决反对，所以A股坚决做空[大,-99
1052685,我让她别胡说她脸色不好,-99
4707734,22块钱买入，26块钱卖出，今天25.2买入，明天25,-99
589183,这个样，下周要看跌了。,-99
5362428,还是中化岩土的桩基扎实，背靠雄安，城地股份是,-99
773029,妖股一个，谁陪着玩谁死,-99
1168366,我就是跟世界丈夫的娘做波断，上上下下真是舒服,-99
2056644,畜牲又开始砸盘,-99
4338264,603131:上海沪工第二届监事会第十一次会议决议,-99
1216064,三成仓位腾挪空间好大，等着主力赶紧到15，争取,-99
4046342,恭喜上车的朋友，深深房明天复牌，十万股整数让,-99
4463060,老子跑了，你就涨，你就那么在意我的362手。,-99
1969445,我在13:30发起了直播，快来看看吧！,-99
5337853,压单太厉害，已到最高了，跑,-99
4154584,期待尾盘能上20天线！,-99
2924545,深不见底,-99
2376097,牛种董事长，你的公司怎么这样垃圾呀,-99
3476312,我告诉你娃儿，现在买入不吃亏,-99
5291600,正如之前所发之贴，封不住板追高者下周一哭晕在,-99
2346477,原本要给大家讲讲为什么会这样，以及以后会怎么,-99
5418513,感觉主力和减持高管在诱多，拉高出货，大家小心,-99
3475303,再次严正声明，本神一直就叫义士暗兰从不用马夹,-99
1934995,这股票最大问题是要别人配股！。,-99
2062258,600611xiongan,-99
2720429,太磨叽了赚4个点走了！祝留下的发财,-99
1030476,明日涨停。,-99
2992566,揭穿价值投资的鬼话，如果真要价值投资，招商银,-99
5002625,大盘窄幅震荡蓄势 热点短炒将成后市主旋律,-99
4341875,T+1昨天挨操，今天赶紧清在高点,-99
648334,来吧，继续等你砸，看谁有耐心。,-99
1610507,在二级市场我有一个判断，这家公司只要他的产品,-99
3310963,600984:建设机械关于召开2017年第三次临时股东,-99
1720497,方大炭素让员工充分享受企业发展成果，很吸引人,-99
2526706,一一一博纳影业“逆市”回归 影视业重新洗牌来,-99
4321617,这垃圾[大便][大便][大便],-99
2309145,我亲哥一出手确实非同凡响。,-99
905845,操，踏空了。。换庄,-99
4597745,今天吓出了不少人。[大笑],-99
4259708,平安+茅台=50增强；平安+茅台+美的+格力=300增,-99
2336867,这傻逼为什么会跳水？,-99
3114674,博闻科技两市最好壳的最终归宿,-99
1807521,诱多即将新赛退了,-99
2541314,位已在乐视大,-99
53639,令人窒息，大脑缺氧，出去透透气,-99
2826151,每一次拉高都是高抛的机会,-99
5179130,我发现吧里有个股神，整天逼逼不停……,-99
572870,就一定能找到,-99
1780665,压压压,-99
1332512,证监会都没批的事，不知道是你意淫还是我们意淫,-99
5034259,好想大喊一声艹你大也的,-99
4160790,请马上买进！,-99
1948500,便宜吗？等,-99
2187746,买别的股票先，等新高再过来看看,-99
613637,大部分板块个股在梦游,-99
2697466,可不可以静在不言中,-99
3045793,不会是杭州信托借壳吧，哥们手头正紧，谢谢噢,-99
3410986,可以试盘,-99
4436675,还会跌的，而且股价会长期低迷状态，毕竟白酒股,-99
1294777,行，像2008年那样也不,-99
990983,花篮花儿香,-99
840198,六毛的中报！怎么没有人买！可能吗？,-99
5508921,金诚信的操盘主力，你是在东施效颦吗？,-99
4011239,低位抢筹！21.48分抢先挂买！,-99
2662298,600766:园城黄金独立董事关于公司对外担保情况,-99
3204733,攻市场4000点之前，可大胆进行低吸的10只潜力个,-99
5542552,哪怕他非常弱小,-99
3396498,wy从重仓南京到现在百分之十仓位，wy一面唱多一,-99
2228358,普天同庆，议案全部顺利成功闯关[鼓掌][鼓掌][,-99
1594417,上面标题栏里写着/大事/新闻/公告/你不去看你的,-99
1124408,主力拼命在抛出资金，而散户越在买入，不是太傻,-99
2220647,就像标子一样，中看不中用，,-99
5058620,今天走势依旧中规中矩，坐等做T介入机会,-99
4696266,乖，跌到27，别天我来接盘,-99
5145347,603729:龙韵股份2016年度内部控制评价报告,-99
4524346,603283:赛腾股份首次公开发行股票发行公告,-99
4054763,我是好人吧 昨天建议大家不要追,-99
5141007, 鸣志电器跳水了，撑不住了，我刚割肉了，主力,-99
2948428,省工投集团脱虚向实做强做优实体经济。,-99
2249368,今天早盘被骗进去的报个到[哭][哭][哭],-99
5105550,"我凑齐了七颗龙珠,许愿,来几个万手单吧,冲上50",-99
5259093,阿尼陀佛，无风无雨心自乱，意乱情迷怒他人。忍,-99
2160719,猪十月一杀，不能留了，害人,-99
3587849,耽误这轮期铜暴涨的跟风行情。,-99
1654597,一把靠背藤椅上,-99
2450093,高位纽成团，卖出股票没商量。,-99
4127668,走了高管们减持就受不了,-99
4670797,[满仓][满仓][满仓][加仓][加仓][加仓][买入][,-99
665872,哈，不动,-99
4552083,得邦照明历年出口退税情况,-99
3677498,人家跳水你就跳崖，人就飞天你就钻地，无语了[,-99
4249641,"此票大资金开始加仓,股价拉升势不可挡!",-99
1839720,601668没戏,-99
277016,既不盲目乐观 也不悲观,-99
2011299,今天不进，下周一就没机会了，周末要出爆炸性公,-99
2943086,美国科技股连续上涨,-99
2111794,庄在对倒[大笑][大笑][大笑],-99
3993204,国家队减持，业绩一般,-99
953989,期待腾讯将持乐逗游戏26.26%的股份注入掌趣科技,-99
2713510,相信一个星期涨停买，赚卖出者的钱。。,-99
5335415,方大炭素\t,-99
1291076,"大股东低位都在增持,小心鬼托",-99
3756007,了，估计双,-99
4403707,低价卖出是谁首先被查,-99
2300611,600675停牌今天啊,-99
5088066,横有多长竖有多高,-99
1862564,无量反抽，下跌中继，今天没跑的，下周又要草尼,-99
4671311,今天博傻散簦周一要跳橇,-99
3612714,10.30拉涨停,-99
1099839,还能跌到哪去呀，快买买买,-99
3960065,大神们呢，大神看来都走了！z,-99
1376795,盘江股份(600395)融资融券信息(11-23),-99
2012430,融宦羰找嫖取,-99
2670814,总让总让逢总个秒。,-99
4714268,牛股何惧调整！,-99
2151721,现在都是机构自己买自己，哪有散户在买，机构就,-99
4169868,603038:华立股份关于修订《公司章程》并授权办,-99
1489239,从公告的内容看，应该是利好，因为股市有先知先,-99
1507846,，就像人生一样，难于,-99
5472533,运盛股东持股被平仓了,-99
173644,片仔癀终止扩产计划,-99
986559,今天卖的不亏我还不相信，……,-99
3662575,交行真弱，是出了啥问题了吗？，这混改一点消息,-99
4629763,这样的庄主不是人养的,-99
3727851,好可惜，st股又现涨停潮，可惜st锐电就是不跟风,-99
1008004,兴业矿业主力持仓77.75%，已经控盘；关注银漫矿,-99
2765763,盘面轮动上涨乏力，拿什么拯救你，我的A股！,-99
2855042,又被反超了。,-99
5553665,放不过机遇，就躲不过风险,-99
2271645,孙子唉，这个公告看清楚了没，黄了，为下一个黄,-99
