,content,mark
5058298,今天进了23000股华体，狠吃庄家肉,-99
4372523,603165:荣晟环保关于全资子公司完成工商变更登,-99
2883992,高抛低吸。那只拉高抛那只,-99
2818868,江南崩盘，天业就是最佳买点出现。,-99
4531937,原来真的是卖了就涨啊，我艹,-99
3177367,亦以情种播至庭园,-99
1205034,对不讲规则，不守信用的人，不仅不要过会，还应,-99
3085808,各位狙击手，各位散户大牛，千万千万不要割肉！,-99
396762,照本宣科 做5浪,-99
5262900,这个点已不适合再卖了，锁仓！！！,-99
3971555,机构撤资力度大 闪崩黑,-99
4785139,抓稳扶好，不到目的地不下车。,-99
3682457,冷静！别动不动几个板,-99
2578117,典型的拉高出货。y,-99
1183779,协同--股价与指标同步；,-99
5016397,4千万的流通盘怎么每天只有十几万股交易量，哪,-99
4293803,深港通正式运营了两周时间,-99
4205569,看看出逃资金，还有韭菜在进,-99
3177485,而上升的个股均可称,-99
194441,有钱一起赚！,-99
1927530,快涨了，这价主力己没可玩性了,-99
4428838,这是北京继今,-99
3791180,潍柴动力：汽车和机械制造业，叠加智能物流行业,-99
3270717,冲刺全球行业冠军的亨通光电,-99
809050,而是内心充斥了自以为是猜疑臆断,-99
2693260,心电图,-99
1832620,又加重些！压仓底！与狗庄斗一斗！,-99
1429390,周线多个指标金叉确立，底部持续放量，表面看出,-99
3896023,买了这个垃圾，就比踩了一坨屎还恶心,-99
3970880,是老股民多少年血与泪总结的铁律,-99
1720013,方大炭素：历史机遇造就炭素行业形势看好,-99
797370,玩解套的人多吗,-99
3776422,柯云罢弈,-99
1897140,爆破大队要来了,-99
2933202,不到五个点不出，哈哈,-99
466013,100股在保护你几十万的资金在升值，这100股是不,-99
1995679,千禾和海天比较一下，原来是海天成交量很小（每,-99
4373763,忘了，我只剩1手了，不t了！,-99
4818610,大家做好准备，我来接盘,-99
5250727,风险正在急剧上升？！其实已经很明了！,-99
5378375,这个差价最舒服  呵呵  赚大了,-99
2354526,这股至少体现了一些投资功能，就不要再说三道四,-99
4967436,每天都是早盘拉一下，一整天都打压[不赞][不赞],-99
2102041,慢牛来了 喊在李大霄前头w,-99
2417078,感觉跌的力道好大,-99
2683981,看到外围暴跌，心里不免有点兴奋[大笑][大笑],-99
5214731,也许只有每个人只有经历苦苦思索和重重磨砺,-99
3044221,牛鬼蛇神太多,-99
4468674,我已经卖完啦，你们可以涨了,-99
2967135,散户的三条自我修养，透彻深刻,-99
4511771,海鸥季报将出。定会大涨。,-99
498307,前者是股价健康发展的正常需要，后者则是股价疲,-99
5058167,官司可以有，关键是上市申报书有没有充分揭示。,-99
59801,哈哈日照港大家都在增持，就是下跌,-99
3924991,wbd，再出货啊,-99
4649992,今天收绿那些追高傻逼吃套了！,-99
395531,最近召开的中央工作会议明确表示,-99
1782360,烂货一个,-99
5063438,603683:晶华新材首次公开发行股票发行公告,-99
2547503,若不是中粮生化暴涨，糖业这两天得跌掉5个点。,-99
313110,房价的下跌是大概率事件,-99
23692,宝武组合上市日中央派谁去上海呢龙抬头那天看吧,-99
970491,别抱幻想了，开版就跑吧,-99
1653533,艹，锌业板了,-99
1678707,西昌狗，一坨屎[大便],-99
3573360,垃吧，我看，只想过节，早不拉，少来了，一进就,-99
4234514,星期一大概走势，高开6到7个点，洗15分钟把胆小,-99
5023032,现在还不断蛊惑大家看\t,-99
1546143,垃圾中的战斗力,-99
3043881,我的孙子上海彭老股出生时脑瘫，说好不靠谱，别,-99
4576380,股基冠军赚超34%,-99
5187749,英联涨停，快抢泰嘉股份！！！！！,-99
142897,不要幻想市场，要敬畏市场，联通短期5.8元箱体,-99
261533,联合创业:第二届董事会第五次会议决议公告,-99
2686741,太墨迹了！什时候到5元呀？真没耐心了！！！不,-99
5369359,6月26日上午，BOE（京东方）合肥第10.5代TFT-LC,-99
2376244,牛：做一个企业家容易吗？,-99
4456571,[胜利][成交],-99
5164458,业绩平稳增长，低速电动车与无人机稳步推进,-99
732632,个人还是觉得这股有点妖，主力好像在极力隐藏自,-99
2128993,今日大盘下档第一支撑位在3220点。,-99
3228381,快跑路吧！北汽亏损,-99
3763442,继续反弹？！,-99
1594368,大盘涨冠福还在叫跌。,-99
3481375,吃屎吃屎吃屎，割肉割肉割肉,-99
2005135,马勒戈壁[不赞][不赞][不赞][不赞],-99
3331464,这股已经死叉。,-99
2906585,一问一答话期权,-99
4822935,多伦科技年报,-99
2676548,GDP增速、人民币汇率、,-99
2381328,大挪移正在进行中,-99
2074421,加息预期继续升温,-99
3665040,要突破了,-99
4692135,603377:东方时尚关于控股子公司完成工商设立登,-99
3839654,这也是近期行情中w,-99
4615631,求中签[拜神][拜神][拜神],-99
5386340,看周末是否有好消息。,-99
4386612,中国房价和国外比 这不扯蛋么 应该用工资和房价,-99
5185045,缩量上行,-99
1435194,002250量比缩到极致，还上涨，好不好呢？,-99
2803328,三碗不过9.5！。,-99
1854668,很好!谢了还是泄了！,-99
959690,真是BM的妖孽,-99
2501334,这个股从09年跌到14年，5年半时间。这次才跌两,-99
5291861,你已经是龙头了，不需要再沉默了！,-99
3364677,利好不断跌不断，该往上走一走了。,-99
1831071,今天下午涨停板,-99
1676469,均线夹层，一般是指20日、120日、250日三条均线,-99
2770174,粗暴的扒一扒神电重组后的每股净资产……初级！,-99
5063995,这位置，哪些杀币在卖？？,-99
5407289,佳士图：你们买不买，不买就涨了。你们卖不卖，,-99
513977,不等缺口了，买买买,-99
3164886,有人就是不让涨，怎么看?,-99
3068888,无语了！心电图都画不好,-99
5496360,收盘一定跌，做T肯定要逃跑,-99
3918516,垃圾烂货天天乌龟一样,-99
3844145,海利又飚了，你个怂货[不赞][不赞][不赞][不赞],-99
2290401,滨州报道i,-99
2599333,仅仅是啤酒杯里投资的啤酒部分，未加入投机的啤,-99
38127,向高位套牢的黑豹 报销清明差旅费,-99
2152492,停朗玛信息.杭州园林.昆仑万维，,-99
4561824,603306:华懋科技第三届监事会第一次会议决议公,-99
1517023,我站在山岗上\t,-99
3211915,这个狗日 的广西广电 真的没救了,-99
2033085,今天散户别买，谁买套谁，,-99
4851505,捅破天的许可证未发不敢造次！,-99
524785,能不能射一次，天天这么憋着好吗,-99
2368570,看看上海物贸 盘子和亚通差不多 股东人数比亚通,-99
5454374,今天第一个小时必须上涨，否则就跑！,-99
229793,它爹在呼喊 它亲爹在呼喊.....,-99
3237700,1. 不要借贷资金用来购买或持有证券,-99
2279833,跳水冠军又要开始表演了。,-99
1407914,大有连续好几天庄资流出，怎么一回事啊,-99
4009071,中国核电，请问公司核电项目的订单为何这么少？,-99
2600425,今日主力出货股：鑫茂科技、利君股份盘中“闪崩,-99
4451146,主力资金持续净流出，对比行业和板块，自开板至,-99
2682457,广誉远(600771)龙虎榜数据(10-25),-99
2215177,这就叫全自动压盘 [大笑],-99
2315091,预示着将继续支持反弹,-99
2519591,今天能站上8.6元 明天太阳不出来,-99
1274278,借利空打.压股价，吸带.血筹.码，洗这么深您吸,-99
5021128,怎么还没公告出来,-99
5453607,短期不会解放上面的套牢盘，等个半个月,-99
2878939,今天百分百涨。,-99
201108,翻多信号！信不信由你[微笑],-99
3324664,速度到3.6元吧，让我开仓,-99
84456,今天收盘价5.28,-99
3645802,赚了15个点后回来看看大恒的散户，同情啊。,-99
4645951,解禁股等于死,-99
3786048,砸盘工具而已，已经没有多少投资价值,-99
4092641,感谢股市。今天让我赚了30元。虽然前两天亏了75,-99
2930678,资本市场供给侧改革：拉升蓝筹股拉指数发新股！,-99
1661331,科达就一傻货，比亚迪是聪明的，让想介入的在价,-99
4711501,昨天追高的都哭了吧！,-99
3850183,还执迷不悟么，两次利好发布小庄早就屁滚尿流的,-99
5547517,我从10.2元开始买入，见过6次加仓今天终于满仓,-99
907545,见好就收！清仓不玩了！跑！崩！,-99
581336,狗屎企业，让人恶心！,-99
4715849,今天买对了603757,-99
3499873,又是一王八蛋公司A阴,-99
5163304,跌吧,-99
1964921,这点量，呵呵，明天法定砸盘日，计划不变,-99
3042977,已经走到这步了。就等下去了。。,-99
602107,今年原油价格都在45美元上方，美都今年中报原油,-99
3011508,sfsdffdg,-99
2817530,哪天360宣布借壳江南嘉捷成功后，资金才会回来,-99
1655543,板块小小跳水，尼玛币却跳水速度吓死人垃圾股,-99
5011411,603656:泰禾光电公司章程,-99
1969237,国家队重仓新华医疗,-99
1182509,600337:美克家居对外担保公告,-99
6698,当股价第一次收盘价站上5日线,-99
3984111,垃圾王,-99
2766551,今天能封住吗？,-99
3715586,我是1手割，吉林最新成本是3.64元，持有1手，继,-99
3434174,600455 博通股份，强势拉升，验证实力，切勿追,-99
1448703,中报如何？懒得去问董秘。好坏也左右不了股价太,-99
3051801,中矿资源(002738)龙虎榜数据(06-16),-99
3182461,被骗出来了,-99
590403,又逢周四，而近期逢周四必跌基本是八九不离十，,-99
3612691,大盘下午两点继续开始准时砸盘，股指期货会助跌,-99
5430382,大提到台企同胞与大陆共享同等待遇,-99
2446642,13.2成本，好久能赚钱，去年12月买的，当时觉得,-99
5307320,快点买啊，低开高走,-99
4397624,这只股票怎么样,-99
2573250,主力！你好好砸吧！我等你砸个大坑出来,-99
3503589,大家一下子炸了锅,-99
1034352,老骗人买这支股的人滚出来撒,-99
330510,大盘上了3仟4，广州发展股价越跌。为什么大家都,-99
4088560,对主力严重控盘股票的尾市拉升，一般可以不理会,-99
3806342,发动了！,-99
5030244,我早盘看盘小了几万股，居然收到短信，明天敢拉,-99
1224272,把大布单扯开，，，，，，其实就是在经历风险！,-99
3136185,你妈逼，垃圾……,-99
1953692,海公公今年年底大家都看到多少，大家论论！,-99
5417393,今日记录，23.72开始建仓。,-99
4186955,感觉涨点就被打下来,-99
3622006,却为我的生命开出缤纷的花朵,-99
5051282,坚决不卖拖垮主力，主力得付租金炒盘手工资银行,-99
3824575,601689:拓普集团第二届监事会第二十次会议决议,-99
1802625,中国的股市根本是不能够投资的,-99
