,content,mark
3144214,不知在此时此价还有谁在抛？除连续涨停之前的股,-99
3900592,中远海控中远海运频出大利好?,-99
902004,大小非马上狂拉，赶紧买,-99
1983749,惨烈筑底反弹 第一波看3300点[鉴彪股],-99
3478297,而这必将对包括A股市场,-99
1762652,散户都不敢补了，买一是95买2 已经是89了，庄家,-99
2049311,要涨停！,-99
3214956,大盘不涨，题才没有，主力打压，还是再看看的好,-99
1846068,金隅股份吸收合并太行水泥A股上市,-99
4766460,看到这么刺激的，没有一个散户发言，都割肉走了,-99
2718985,辅仁股实力可鉴，值得被期待,-99
3839490,"601718换手已过60％,此股走势稳健,加之大盘配合",-99
5267234,一分钟金叉，5个小红兵！,-99
889328,北哥赶紧出来吧,-99
1585964,调整到10元左右吧，调整下来就有机会,-99
4158436,小春此股是和一样,-99
4498326,日了狗了！还走势！,-99
5022862,今天耐操,-99
1754348,实在无力割肉了，更不敢追高上证50w,-99
915701,咯咯咯咯咯咯 瞎子狂笑 连续4年业绩翻倍，三年,-99
3087044,主力好我挂了10.80的买单，快快砸下来吧。,-99
5323367,飞科只会慢牛，不会暴涨，因为没有PE和VC,-99
5125480,阿科力 对阿创石说 我们不一样  丕一样 [大笑][,-99
989853,钱江- 僵尸股啊,-99
4762726,开始缩量，短线无戏，洗洗睡吧。,-99
1667295,中国4月规模以上工业企业利润同比14%，前值23.8,-99
2153004,既然拉高，就拿去公用,-99
4831053,京城的大家伙还没跑，那就放心了,-99
2213934,京东方在SID 2017\t。,-99
947901,看看别的有色再看它，垃圾一个。。,-99
2687811,12年资产增值8.32倍的的公司发行新股上市后值多,-99
4485948,54.56明天见[牛][牛],-99
1270218,全是看多的果断走人b,-99
5420305,坚持就是胜利，据说有人没上车也骂[滴汗][滴汗],-99
1379591,您先看看我的经历,-99
2851190,抛压太大了,-99
1703495,成交量不大，应该不是主力出货，估计是主力打压,-99
464481,离分红的日子越来越近，静静等待[微笑],-99
3890608,一个茅台抵半桶油,-99
505583,念瘦腰。,-99
4473781,姐五个票就差你了 加油啊,-99
5228783,603808:歌力思2016年度内部控制评价报告,-99
1049343,可怜的人,-99
3116469,根本没有资金来做，,-99
4481375,这货又跟着寿仙谷动，寿仙谷今天肯定要回调，奥,-99
2041335,破7指日可待了,-99
5195015,603787:新日股份关于使用闲置募集资金进行现金,-99
202374,Ipo加码A看看周一这?,-99
2011173,可怜的前期。,-99
5216596,志邦今天的这根阳线骗不了我,-99
2670519,选择什么类型的股票，直接决定着你的账户收益！,-99
4044141,再推荐个秘密给不喜欢上海股的伙伴们吧，002284,-99
2923290,呆了一个月，没赚钱，但也要感谢主力没让我亏钱,-99
3883363,爬的好艰难哟,-99
77123,获控股股东注入30亿元电力资产,-99
4337752,黑马，5G、石墨烯只有6亿多市值，就没有见过流,-99
5556521,人跟人真的不能比.,-99
1512011,这畜生道底发生了什么利空,-99
510388,冠农股份农业涨没分，跌倒是稀里哗啦，去掉冠字,-99
1731789,都说要到1000、[滴汗]720买了1000股[亏大了],-99
597935,一是面临着世界技术文化发展的挑战,-99
4836188,出现调整，,-99
1517847,如此强的做空动能。怎么办？,-99
679703,开始跳水,-99
4611489,依顿涉足军工是谁在放消息,-99
999960,两会后哪些板块将成为新风口？,-99
1356694,st锐电底部获利50%，收益可观，扭亏摘帽已经板,-99
4428620,为了给主力营造一个良好的建仓环境 即日起股吧,-99
3009393,四川双马:董事会关于北京和谐恒源科技有限公司,-99
4611726,估值已调整至合理区间的优质白马当前已经具备了,-99
2712363,家里压力大的时候很辛苦,-99
2076333,水中月亮,-99
4561182,众多高成长股已展开反攻了，如胜宏科技，三环股,-99
3487079,中美是否爆发贸易战，决定国航走势，清清仓观望,-99
4590578,这股现在开始不要碰，亏损的立马止损！立言,-99
2378435,明天 低开 我满仓进,-99
1487298,有一些机构也是卖国贼.这不稀奇,-99
1521659,今天收盘不会跌，你懂的,-99
4428124,这个位置满仓  傻庄不但不敢套你  还得马上给你,-99
1481772,买股买庄的人品   人品有股才有,-99
1553585,信息安全、网络优化、移动互联网、政务大数据创,-99
2512959,云从科技：人脸识别最强大脑,-99
4295684,明天低开震荡收跌,-99
3062580,如同迄今所讨论的 ,-99
4288481,此股已死，有事烧纸,-99
4310463,603117:万林股份关于使用部分闲置募集资金进行,-99
3115953,担心上市公司,-99
3401185,宝泰隆--全球顶级抗癌药，中国拥有自主研发产权,-99
3153236,补仓300手。明天卖。,-99
4198450,今天差点翻红啊！过山车,-99
2959050,他妈的，垃圾,-99
212640,奉劝一句散户朋友，葛洲坝完了，亏死了，不要进,-99
2695154,明天直接低开两个点，哈哈,-99
5021267,603660苏州科达,-99
1099370,没救了,-99
5086755,既然抓住了高送转的大毒瘤c,-99
1480510,今天走势不错啊，。微跌[大笑]好兆头，稳住,-99
3008019,内盘与外盘数怎样对比,-99
3589706,"每天1,2分钱，有才",-99
5086126,军民融合，主业航天燃料？,-99
4752154,今天好像真的有一个散户卖了10股！傻傻的！机构,-99
1431413,你们想多了，今日收7.15，明天接着跌,-99
78399,如收购成功并能并表，公司过半利润将来自于电网,-99
2195617,这吧里说的什么啊？怪怪的！,-99
2774922,要死不活的,-99
4099439,主力你大爷 老子刚卖了30手,-99
2369338,昨天加的一会冲高走人，又三个点,-99
1576488,一家企业的未来决定企业创始人的品质,-99
2025025,以前在天路的时候一直关注此股，今天如果一阳穿,-99
3298981,最后的买入机会[微笑][微笑][微笑] 等下直线拉,-99
5178579,大盘明天又要调整了，不知道你什么打算,-99
4980509,我已经举报那个上海布衣，告它天天狂咬，狂犬病,-99
410725,对此垃圾涨了就卖跌了就吃。,-99
5136779,今天打到前低附近，短线很好的买点,-99
1833627,低开，又是缩量整理的一天，MD，一天跌六个点，,-99
2464169,好,-99
3244184,远离此股，一杀生，二赚死人钱[不赞],-99
303898,600091:ST明科关于聘请2017年度年审会计师事务,-99
1527960,今天大盘翻红的可能性比较大！,-99
2186873,主力大哥 差不多就开车吧！,-99
4741532,我给大家说说现在市场，大家可能就心中有数了,-99
970980,慢牛来了 喊在李大霄前头,-99
26352,太恶心了，垃圾股一只,-99
2934249,市盈率才你,-99
2307062,才是上策也于事无补,-99
4304806,除非过了28.4今天的新高 在追 否死的很难看,-99
5047721,他我你才-,-99
1324684,还有一个多亿带接盘,-99
4557401,明天真的涨,-99
3123828,我也发个图，加仓！,-99
1533208,今年这个股,-99
3641965,三大优势引资金追捧 电力板块有望迎来新机遇,-99
3089640,居然有人说今天低开，第一次炒股吗？,-99
712349,满仓买入，不到20不抛,-99
2753778,又到一年一度上市公司高送转信息披露的时候,-99
4592752,向买入此股的股友表示真切同情！[加油][加油][,-99
1497989,诱多了，快跑！,-99
4053536,说了许多话,-99
4703175,每股收益3元，每股净资23，电连技术，三天就开,-99
1192022,28再买，到了33就跑,-99
2121920,发展实体高新科技，下轮投方向。,-99
3250597,拿到双十一。没毛病。,-99
4457560,无情未必真豪杰[不屑][不屑] 我每次发帖，总会,-99
2219478,上船容易下船难！,-99
3585040,击穿6.3准备走起,-99
3650043,钝刀子割肉行情！,-99
4757821,等散户接单，笑死人了,-99
4848903,农等跟风拉升,-99
4399156,请开始你的表演～～搬个小板凳～坐等,-99
3444001,钱随账走,-99
4080831,明日继续涨停，坚定持有,-99
1217003,高速公路分时段收费改革对高速公路股有利吗,-99
4223064,开板了 开板了,-99
233025,这就是垃圾股，不值得留恋了，逢高出货……,-99
2397742,完美[胜利]，继续新高,-99
292581,我今天的布局--发发发发发发发发发发发,-99
4035579,让这垃圾跌收到工资再加仓，成长性好，又小盘，,-99
2951072,没有主力，都跑了，该进来了,-99
2526842,庄家故意乌,-99
5198742,关注300555[抄底]底,-99
2484891,操盘解密：突破的识别与意义,-99
1727960,你再看看人家600276！好意思出来混哇！,-99
1247039,继续买点，三年之内没有解禁股。不知大家怕什么,-99
4463126,扣非 信雅达(600571)传统业务保持领先，金融科,-99
2977279,上海自贸港贸易限制将大松绑 多地启动自由贸易,-99
3621913,上半年净利润同比增长77%，三季度业绩有望环比,-99
3163848,张江高科(600895)融资融券信息(07-12),-99
2415476,就说一日游套不着我,-99
560840,先玩别的票，这垃圾啥时候熬不住了，再来，耐心,-99
1777573,午后大盘继续弱势震荡，目前推动指数上涨的大蓝,-99
3730953,1.73元看看支撑力了,-99
5314617,出钱就不好，注资才有希望，哎,-99
612120,量能萎缩，股价恐高，为何？。,-99
4452715,看看太平鸟，丢不丢脸,-99
1415501,任泽平：A股短期受美国,-99
2093879,11.8买在高位。,-99
1702013,季报，季报，注意公告！会给你一个惊喜！,-99
5198853,不想分析过程细节只判断这一波要往方向走,-99
4949511,妈的垃圾股，操,-99
367200,七连跌怎么办,-99
3929492,内蒙古出口日本稀土价格爆跌近五成,-99
5496365,基金炒股不认真，乱买,-99
5218405,是必须的！甩开犹豫不决的，让他们跟,-99
5362139,实在苍白无力无功而返,-99
1358455,关注；中国中期000996,-99
2017265,筹码被骗了个光溜溜，气死老子了,-99
5079150,603690:至纯科技独立董事候选人声明(施振业),-99
1813964,这也太坑了吧,-99
3626295,广汽集团(601238)融资融券信息(10-18),-99
3093451,恶庄出货中……操……难怪这么垃圾……典型的套,-99
2242094,根据DK，买卖入600658,-99
5259013,短期涨幅过大 冲高回落,-99
4962626,请???大???家???不???要???试?,-99
5492867,卖掉，快,-99
1343218,贪婪真可怕,-99
4605976,看看个股跌成啥样子了,-99
1855057,今天球球很强势哦，外面一片哀嚎遍野,-99
1749119,换庄？,-99
2875555,经济全年“前高后低”节奏预期正在应验,-99
448550,原则上不支持,-99
