,content,mark
2388770,2017/10/13淘股神收评：两市集体现震荡行情 各,-99
1730770,最近大家无不惊诧于贵州茅台价格登上了中国股票,-99
121256,创业板两连跌，惨！,-99
3756923,此番6元开始！,-99
1010559,这个压盘是骗人的 现在可以进,-99
5518643,你小散的筹码毛也不是，被自作多情了!,-99
4022169,奇葩大唐 轮也轮到了,-99
2261117,2600点，脑壳喊：任何上涨都是为了更好的下跌。,-99
1255069,IGBT中文名称缘源删晶闸管/是电力电孑芯片 IGBT,-99
3879263,这么大的出货量，我们必须转战7元旦11元区间,-99
5437033,你我我我点,-99
211797,隐士不像隐士，倒像一只疯狗，整天狂吠,-99
3648689,尾盘拉升不是啥好事，明天危险了，中长期看好，,-99
467983,增发之前，进去都是套,-99
403133,中电方大:2016年年度报告摘要,-99
4365315,什么情况,-99
4401207,创业板本周,-99
4917115,603601:再升科技第三届监事会第四次会议决议公,-99
4394238,小垃圾,-99
4994838,明天涨停板，开始启动.,-99
3409998,黑猫明天又可买入,-99
2844343,西水：不离不弃 老道与你共睹红阳举升,-99
3736393,3000点高！不敢买啊。,-99
2928178,斩获3万！再见 坐等回落。哈哈哈哈,-99
4661120,再减少一半就好,-99
4378896,本周主基调是震荡筑底迎接6月份的大反弹,-99
528355,好久没看这票了跌的够惨，准备炒底,-99
5415919,5915+，期待中签回血！,-99
3634339,应该说中小投资者，所进行的这种的维权行为是值,-99
2674603,综艺股份(600770)融资融券信息(12-19),-99
1960190,基本信雅达(600571)传统业务保持领先，金融科技,-99
3203015,跌到6元，全仓杀入,-99
3946283,MACD指标形成死叉,-99
121049,再次出现权重指数和小盘指数倒挂，明显资金流入,-99
1630549,砸砸砸,-99
2111519,盘三周，又可以出大阳了。,-99
3310630,可怜的前期,-99
4872656,庄家压低股价搞收购事项可以关注不能买,-99
3638332,银行无力，下跌快速，见顶，快跑。永不买银行股,-99
116289,福建高速(600033)融资融券信息(08-18),-99
5336724,牛,-99
2572565,靠死它一年内不卖,-99
4210317,此股每次拉升都是逃跑的机会，玩此股亏了3万，,-99
5380342,今天虽然有所放量，但未形成单阴盖阳，暂当主力,-99
53601,春风夏雨,-99
615440,彼南宁人。,-99
1241604,没有涨停，所有的走势都不要太多关注。,-99
3662352,国贸每天资金成本上百万，肯定有人亏疯了。,-99
4172447,外面是火，这里是冰。,-99
1381221,海南海口手机网友已患癌大半年，时日已不多,-99
1396759,今日必定红旗飘飘！。,-99
669229,要不是中铝稀土有上市的期待，也许不会这么坚守,-99
56884,民生中短线有机会，不是长线标的。,-99
3282269,有多少兄弟像冯小刚一样心情是悲状的!我是,-99
1550590,雄安现在已经布局金融空港是国开行控股少不了空,-99
3331863,中国光大控股：光大集团重组留下的历史性投资机,-99
1118248,是稳健成长,-99
2975381,升级：或禁止代持 统一杠,-99
4689698,再来个大宗交易就好了,-99
2107076,还要跌,-99
3294615,98012年不分红，在证券市场上骗了不少钱，首发0,-99
4605130,加油跌快点，磨磨唧唧的浪费时间啊,-99
3226524,大盘要涨了 连欢瑞世纪这样的垃圾股都翻红了,-99
2409821,千手来了。,-99
3283841,整个管理层增持，大家100个放心躺下睡觉，任由,-99
4201808,冲啊！再不买就踏空了！要封板了。买买买,-99
369363,看看美国股市！！垃圾！,-99
3846003,破车已到选择方向时 在众多唱多吧友的大力喊多,-99
2564618,国企公司制改革有了时间表！上海本地混改第一股,-99
2358715,自动自发地做事,-99
635465,指数拉的太有技术含量了~~,-99
3220362,东方证券(600958)融资融券信息(11-17),-99
648075,三只乌鸦，尼玛,-99
2719319,不以盈亏论英雄,-99
3555782,去尼玛的。这就是国企,-99
2802164,年线，季线，月线，周线日线都是长牛股,-99
1369199,都是好股为嘛成这样[困顿][困顿],-99
2771494,总算开始砸盘啦，并不住啦，哈哈，,-99
2180541,上证五连阳结束！将再现断崖式暴跌？散户：是机,-99
3514536,上个礼拜5跌的都补涨回来了，你个绿种,-99
2954548,进来看看这月最后一天咋走,-99
514177,最好今天来个新高，不然还要摩。,-99
2667340,这股是真的没戏了，不要再以雄安建设不要水泥吗,-99
3849881,力帆股份大级别周线背离2周内写死！,-99
257061,盟亲子垂直领域分享会。,-99
1062567,不能射一下么,-99
5248906,603818:曲美家居关于使用部分闲置募集资金购买,-99
3908876,求解操盘语言55  56,-99
2039356,今晚发多少只垃圾？,-99
2093707,如果涨了，就没人告了,-99
5266003,没有看好此股的嘛？低价国改高分红！[滴汗][滴,-99
2109817,逢低吸纳。,-99
3116510,下个星期一连续涨停,-99
534522,而没有将其完全堵死,-99
1684823,增持股权，股灾特惠！特惠！,-99
2577677,现在吧内比较清净，预示着散户基本洗的差不多，,-99
4955208,尾盘拉升，非奸即盗，明天开盘肯定就跌。,-99
1050981,热烈祝贺 福建水泥 跌破9.88元。,-99
690029,今天下午的反抽居然提前大盘，赞一个,-99
4044108,601999:出版传媒独立董事提名人声明(姜欣),-99
59709,不要有希望，不要对他们抱有幻想！。,-99
5483145,28.98买如成功,-99
1085624,呼叫万手哥。,-99
1219365,四不像，大盘不大盘，小盘不小盘，什么都轮不到,-99
4323364,牛市里股票复牌怎么走,-99
2189676,中源协和：老道闭目静坐于此 心念伴股喷飞,-99
4053771,红衣会翻谁的牌，拭目以待。,-99
3209858,我想骂人啦！这垃圾,-99
3463876,望尽快更名:太平坚,-99
4302014,火箭发射！,-99
2653760,至少对市场人气方面的影响比较大,-99
4443156,该公司的基本要远好于603603.可是庄弱没办法。,-99
3757440,供给偏紧需求提升 国内乙二醇市场走出大涨行情,-99
486166,其实是预增，仔细看,-99
4168551,603038:华立股份第四届董事会第九次会议决议公,-99
1001405,半个爱淘宝,-99
4616451,高送转预期，上升聚势，二天后回调五日线买入,-99
3506768,什么都不是601126,-99
632532,生益科技(600183)融资融券信息(09-18),-99
364599,此股将夭折！,-99
3339488,不知道是不是因为年龄的增长还是因为什么,-99
1954675,而在如此弱势下n,-99
5450850,不能再跌了啊，再跌真的只有跳楼了，27.6本,-99
203498,你们的。,-99
1886234,新农，你到底要搞哪样？？？？。,-99
1929838,这个死逼股谁买谁倒霉,-99
3312317,雷鸣科化重大资产重组继续停牌,-99
14821,走得快，好世界。市势不妙时，应当三十六计走为,-99
2492595,大量的抛盘筹码被谁接了,-99
1689045,沪市上市公司公告(10月24日),-99
1017562,才知道一生很短，人生苦短。,-99
6913,120日线的失而复得，说明该平均线对指数支撑较,-99
200779,网阔信息控股股东质押306万股份 用于贷款cv0,-99
3478394,没人发言了，可以买了。d,-99
5144290,愚恒影业 东山影视基地 海南长影环球影城,-99
1844597,真正让上市公司高送转与业绩成长性相匹配。,-99
3609452,我就6.58买,-99
1642664,七倍市盈率怎么算的。,-99
516410,今天尾盘必须绿，给一个机会呗。,-99
3682233,永远过不去十块了么？,-99
1973346,股东减持，股价大跌。,-99
2673091,翻忆之扉页,-99
1247929,忠告大家持有国旅到2019年杭洲亚运做T最少有5倍,-99
5116471,悠进雄安，让国家队出货！,-99
5508547,还有1块钱的坑在后面，至少1块。,-99
3524473,新城控股(601155)融资融券信息(11-23),-99
2817668,上午不卖 下午跌到9.11 呵呵 看你们卖不卖 哈哈,-99
4357003,10元，等你下来,-99
1518711,市场情况再去决定操作,-99
2082341,李老师说了，上海国资不需要酒类上市公司，616,-99
2290618,自以为芬芳会吸引来自己的爱恋,-99
3012089,高位，砸盘，出货,-99
5272572,今日仍有不少股跌停，说明次新股行情离见底还远,-99
4331468,小超个低，等着数钱,-99
1539282,股价不到10块0.98元业绩次新股仅此1家江苏银行,-99
2374111,600693:东百集团2017年第二次临时股东大会决议,-99
5171712,地量地价 跌无可跌,-99
2500590,"2.27减仓了点重钢,呵呵,2.24接回",-99
3715911,那么锁定期也至少为3年，承诺5年业绩锁定期也至,-99
3843700,有本事就砸到与港股同价。[大笑][大笑][大笑],-99
140615,保宝主力厉害我拿了一点血筹,-99
3557583,gou 庄，真的像只苍蝇把我恶心到了，你继续，我,-99
3598212,明天还得跌,-99
2579867,公司是不会让我只看2个人的,-99
3193097,人家上海银行二股东西班牙闹独立的搞事跌停，你,-99
3657657,马上练成绝世武功，九阴白骨爪,-99
3967248,五穷六绝已经过去，七翻身是否能如期到来？,-99
1619587,翠微股份第二个三江购物,-99
197198,预测今日涨跌,-99
1157814,又在做假了。,-99
640618,你们好啊！,-99
40751,野猫备战第23次高考，争取今年能获得“提壶”资,-99
5162275,上证的股太弱，玩不了,-99
2092939,要套人,-99
348357,有人笑我痴、有人笑我狂，江湖水深哪,-99
3633511,本钢板材，辽宁自贸高端装备制造龙头基础材料供,-99
4097802,精彩速递 京东方在SID 2017 原创 2017-05-27 R\t,-99
2217887,咋个炒起来啦,-99
1196310,三季报速递：航天动力2017年前三季度盈利1060.3,-99
5487280,庄家阳痿了吗？拉涨停板啊，四两拨千斤，猪头,-99
4956185,故意压盘,-99
3610870,特大效益利好买进601228,-99
2902962,卖出的无非就几种，1，觉得大盘要大跌调整了，,-99
4064786,联明股份(603006)解禁股信息(08-22),-99
97572,红尘，六月不破3000，你就顶绿王八帽子吧,-99
1764178,股市闪崩来跳水，辛苦,-99
3868006,看月线是要调整了，跌下来再进吧,-99
4307550,全换成603789星光农机,-99
2766042,破鼓众人捶。,-99
4707962,买，买，买，抢码,-99
3733465,现在唱多的，都是托，拿住股票，继续等待！,-99
153762,没有凤凰股份跌的多,-99
2907719,"老子一下就涨,一进来就洗，不和你玩了清了睡觉",-99
4767418,厦禾路来了，？,-99
1315513,宁沪高速(600377)融资融券信息(05-08),-99
3131655,反弹就跑，主力还在一个劲出货，下午就跌停。[,-99
1109716,满仓买入申万宏源一一一一一一一一一一一一一一,-99
3040077,这股现在二浪下跌还有一浪正在等待下跌得破七元,-99
3237707,次新中科信息将被深交所监控.次新将会集体熄火,-99
1862096,不破不立,-99
