,content,mark
3180934,[献花],-99
4544221,呵呵。居然不买送钱的,-99
2155142,下午必跌停。,-99
1537479,士兰微能制造神经网络芯片吗？,-99
2827764,洋河股份，白酒总市值第三，市盈率最低，别的三,-99
2809608,中韩（盐城）产业园升级为国家层面合作园区,-99
85759,清仓过周末了[大笑][?,-99
468877,乐凯胶片(600135)融资融券信息(12-08),-99
1743219,亨通光电(600487)19日晚公告，公司与中国联通云,-99
1808835,今天可能是真正意义上的最后一跌了，连吹牛的都,-99
4152886,醒醒吧东资,-99
2058206,垃圾玩意，横久必跌,-99
4435886,能不能硬起来看看，像个男人,-99
3721774,难怪你涨0.11，今天钢铁股涨那么多。你还是垫底,-99
2271570,谈谈,-99
3606481,一边像信耶稣一样唱着赞歌，一边巧股戏水。,-99
3440756,跟人吃肉，跟吃！,-99
3956877,买买老娘买入为王,-99
642266,净资产0.03元吗？又一个2元股票,-99
2335932,94％收入来于北京,-99
53064,华夏银行(600015)融资融券信息(10-25),-99
861473,昨天到底是哪个主力爆仓了,-99
950320,开开神仙都救不了,-99
857454,缩量横盘这么久，其实信号已经非常明显了，到现,-99
2371873,你有多努力，就有多幸运。复盘：慢牛要来了吗？,-99
1538991,。预计下周。,-99
3403569,998都都到不了？买不了吃亏买不了上当？,-99
2288197,又跌了，自己拿着做股东拿分红呀！,-99
816428,山水远远落后于指数！无论是大盘指数还是中小盘,-99
4319162,枪已上膛，只待触发,-99
4875515,尾盘你拉涨了，算你有资金强拉，强扭的瓜可不好,-99
3850477,团结起来告力帆假账行为,-99
2251058,大家清醒清,-99
3599625,业绩很好不用怕！,-99
4131650,那些注册仅一天的托儿，你信吗?[大笑][大笑],-99
3055811,短期内难止跌，到增发价18元再见吧！,-99
3250189,不过她也有一点不好,-99
2571724,马克论股阿里无人零售概念--远望谷、神思电子,-99
266172,开始触底反弹,-99
5369865,一切都是假象,-99
655322,死跌停板本栏认为个大资金能看着中小散户,-99
5035067,祝狗日庄一直如此 要涨死你们全家 继续下去 然,-99
1938925,开盘你又猜对了吧？[围观],-99
3823354,闪崩。。。。。,-99
5467468,目前看风格转换即将形,-99
3878521,金融会透露特大信息,-99
2578163,周布林线喇叭口已经打开，中长线最佳买点已到，,-99
4062953,里拽着大半的土地，从另一,-99
5306526,一个减持公告如惊弓之鸟，大批的散户在惊慌中交,-99
2183548,这走势就是爱贱王二控制下的贱,-99
4977029,清源股份12月5日盘中跌幅达5%,-99
4368446,久盘必跌，打主力已出完,-99
74888,多好的庄啊，天天低开让做差价，事不过三。今天,-99
3276074,稀缺资源等板块跌幅靠前；两市涨停板股票超过了,-99
1904126,如果是底庄不会给你那么多的廉价筹码,-99
1056766,360手机浏览器 资讯安全检测 防止网络诈骗 立即,-99
979401,创业板你敢涨，我就敢加速发[不赞],-99
4255449,底部抬高这个技术就是顶底转换，股价就是这样出,-99
3828334,要起飞[大笑],-99
4141332,爆出大利好，持股的周一要吃肉，但不要追高！,-99
2312217,这下，陈秋萍可能要爆仓了也。,-99
199723,就6亿多流通盘，散户能全部把你接掉，没筹码砸,-99
4127950,业绩不好，还想坚持！这些高管只想套现，根本不,-99
3840999,6.85上车2000股，跌啊,-99
934879,今年最后一帖了，谈谈本次调整,-99
4878155,卖完你可以涨了,-99
3946100,节前冒险、盆满锅满、,-99
3394933,从目前形势来讲，本周将何去何从?（附图）,-99
4654695,唉反正我二十八割肉了，亏了二万多不然还一直亏,-99
4264472,7月27日电子信息板块涨幅达3%,-99
822795,强生控股(600662)融资融券信息(07-20)。,-99
1997626,绝地反弹,-99
2233701,我东西细小，造了个一缕青衫出来，都是我的错！,-99
616838,融资盘为什么不走？尼玛，下周等板板吧e,-99
2038638,内参秘密008,-99
4489466,还要砸到什么时候？,-99
892945,涨得没有力气，一看就是主力诱多出货,-99
5247737,"↓这次可以尽情的撕打李打消们的蛋蛋了,再让它",-99
533652,撒尿去，回来一看，一个电梯坐到三楼了,-99
3216983,什么比股，还好只进了一点点，打算割掉,-99
1219106,能执行操作计划的另一原因是“喜新厌旧”。,-99
3588653,想到这突然有一种豁,-99
2133513,以后买票，要买名字好听的[加油][加油],-99
5304698,500亿市值？,-99
2132656,龙头快看看你兄弟起来了,-99
4055998,12月19日晚间最新利空公告：3股明日或将大跌 别,-99
2385007,赶紧买呀，如果真有虚假称述，赔了可以索赔，挣,-99
5206276,为什么这票市盈率那么低？而且分红那么少[好困,-99
250177,冲刺一下不行吗，磨叽,-99
737742,巨灵信息:2017年半年度报告,-99
2562486,中国的股市将复制美国股市，价值和业绩投资，大,-99
1278867,违规减持，等着做牢吧,-99
5398552,创历史新高，向上空间已打开,-99
5553766,603998:方盛制药:非经营性资金占用及其他关联资,-99
1082130,加速抢筹：每股收益4.41元,-99
1193718,看一下新建城际线路，像是华夏公司修的一样，王,-99
2769536,爽啊 十多个点了，肯定不会跌破1%！相信！,-99
377462,联合举报信已经寄往纪检,-99
542177,跌停要，跑吧，不要幻想了，已是弃子，如若体总,-99
5526560,涨多了就卖，跌多了就～？？？？？？？？？？？,-99
676520,旁观者的姓名永远爬不到比赛的计分板上。,-99
1635145,眼尖手快 抓住机会 今,-99
4770422,攻坚战打响！,-99
2144207,A股还是T+1的隔日交易制度，要想做到T+0，需要,-99
158214,所有小散的声音希望下行,-99
3558661,铁建第一季度有基金88家，持股1.645亿股。第二,-99
2370387,下个月变成st亚通，,-99
3514830,问声庄哥今天站稳11可以吗？,-99
871886,一切都与他人无关,-99
159189,选出心仪的股票的？,-99
2893591,最新统计数据显示，上半年社会融资规模“表外转,-99
4890214,真的已经烂到无语了，有货的赶紧走人吧，这个呆,-99
3155693,民生证券-航发动力：业绩表现优异，平台地位明,-99
195420,小刀是那个卖拐的，喊着喊着，63真拐到435[大笑,-99
4741904,KD20以下金叉，选东方市场看看,-99
760277,超越恒大概念股，参与万达私有化，皇氏集团0023,-99
5001933,烂票,-99
1355618,长期持有巨量豆类空单超级暴利定期存款。,-99
4835207,真是垃圾,-99
1686849,东方财富手机版 中国最大股票互动社区 下载APP ,-99
526822,孙子你他妈e涨啊,-99
2945363,明天我要来拉长虹、快速拉伸脱离我的成本区、坐,-99
3093573,还好6.28跑了，等*ST嘉陵跌嘿嘿5.9[买入][满仓],-99
3484998,手里现在还有，接下来该如何作,-99
3719209,薪一轮暴跌开始了，哈哈，快逃,-99
657551,上峰水泥：前三季净利增超4.5倍 养老金组合现身,-99
264441,这是外资持股市值连续第,-99
1727926,热烈祝贺康美五连跌,-99
289335,场不存在因果关系,-99
291731,中视传媒(600088)融资融券信息(11-03),-99
123159,中美达成共识资本市场不表现？,-99
2698423,航天通信一步之遥成为小盘绩优航天军工股,-99
679285,A股市场是一个不成熟的市场,-99
1045223,持仓观望，有望达到53,-99
3267791,原来6000股已经变成10000股了。哈哈哈哈哈哈哈,-99
491278,买入,-99
4238045,最怕你看透的五种下单,-99
3563194,昨天满仓买入，被套了，那个悔呀,-99
799842,这个公告让手里有票的就更中了新股差不多。准备,-99
3514574,2017年中报点评优质农商行：业绩维持高增长，资,-99
5447805,不要被外物影响[微笑],-99
4665834,这个鬼是创业板？？？,-99
2894834,起飞了做好，注意我每次发帖时间，上次说洗这次,-99
1376473,妈的这么好的行情，盘江愣是不拉靠这垃圾庄,-99
3525946,这个时候谁买谁傻,-99
2209461,又想套一批散户，看低一线15元,-99
275587,再唱空有意思吗？,-99
5023766,必须腰斩,-99
788102,[加仓][加仓][加仓][加仓][加仓][加仓][加仓][,-99
3830519,香港人现在也变得很狡猾了。,-99
4552593,还好今天33.71扔了这垃圾,-99
2393350,明天流入资金比流出资金多你们说有上涨的道理吗,-99
1929532,精达股份下周一复牌不要问我为什么下周一见,-99
340580,得民心者得天下，得投资者心者得股价。,-99
4425327,这种只托不拉的股，到下午会死的很难看。,-99
996653,看着别人的茅台，科大讯飞，再一遍一遍看自己的,-99
4670661,感觉搞反了[好困惑][好困惑][好困惑],-99
2160691,一分一分的，耗不起呀,-99
2791939,本吧散户太多，四季度就要来了新的5179即将到了,-99
4596964,对到砸引小散交出筹码！,-99
5069827,最后……,-99
1151790,暴跌前的虚假繁荣,-99
200456,公司工作的,-99
3423801,垃圾,-99
3565066,就是一旦,-99
1632994,鹏欣资源9.22 哪里还有一个小缺口，会不会去补,-99
195021,炒股输给自,-99
3313899,正在出货。,-99
4488022,格力今天有,-99
4285049,题让群众安心租房要求人口净流,-99
482915,中青旅(600138)融资融券信息(08-09),-99
3450404,你个傻逼孙子,-99
5224045,停牌没有公告的嘛,-99
1502232,雄安卷土归来 市场有所回稳,-99
138023,兰花科创集团将并入阳泉 副省长王一新已多次指,-99
4377244,磨人,-99
398491,下星期跌停,-99
605563,我经过牛熊的转换，深知道股市的涨跌是什么，但,-99
2488408,走人了，赔了顿饭钱,-99
1190732,今天拉高出,-99
2952054,我说：我韶华已老j,-99
2198867,这么多股票股票连续涨停证监会是不是要停牌自查,-99
3407898,竟然跑不过板块[为什么]。,-99
5362689,都要查一下！,-99
70577,到7.45就打压，就不让涨！,-99
5486830,[胜利],-99
1754636,11.1在等待[想一下],-99
892346,干,-99
1357147,前几天就已经发贴提醒16左右可建仓15.6可全仓等,-99
994337,理解人生的真谛,-99
1459355,看图,-99
2937900,石墨烯概念股发布中报预告 鲁股龙力生物净利润q,-99
5515430,中国股市喜欢来虚的，喜欢讲故事,-99
5535396,前车之鉴，,-99
4895973,强势涨停机构游资敢死队疯狂抢筹暴涨飙升超级大,-99
585576,1948～1952年16.44.6 9.9w,-99
1083305,今天绝对站稳40,-99
4513738,没有利空就是利好！,-99
5509594,金诚信签订1592.13万美元经营合同,-99
1789327,"中国软件 ,今天压力位 19.60 ,支撑位 19.13 ",-99
