,content,mark
2910168,今天下午大盘不太妙，该股下午可能跌破9元，现,-99
4658074,妹妹你大胆地往前走(往上冲)，新能源汽车的转型,-99
4875751,不好死叉了,-99
3747121,马上跳水表演开始了,-99
1823331,谁都不服 我就服上证中泰加强科技创新深度,-99
4546457,9块应该是底了吧,-99
5443797,善良可怜的小散。,-99
767137,北京新机场都有航空公司入驻了。海航控股入驻么,-99
4354926,好伤心啊，买股票又没钱吃饭了！救救我吧,-99
3484348,中国国航12月19日盘中涨幅达5%,-99
187731,中金拉一个腾讯，你有本事也拉阿里过来,-99
5439964,有人套疯了！！脑子套乱了！！开始发疯狂咬了,-99
3843895,套牢盘太多，一年内没戏，散了吧。谁追谁会s得,-99
5079267,幼稚大白东,-99
1679569,没什么做头了,-99
123873,平安银行涨愈7%。光大银行涨愈1%.,-99
5292911,601199（江南水务），生命的源泉……水！！！股,-99
2289993,今日大盘收红概率100%。,-99
2027834,人工智能的重要部分智能卡龙头：恒宝股份002104,-99
390353,垃圾垃圾。,-99
2144068,传媒系统性下跌，,-99
4476420,景旺电子短线估计还会涨,-99
1202107,但个股就没有那么幸运了t。,-99
5347467,前期获利盘,-99
1133314,《万向帝国》简短分析：11月8号安奈儿暴涨突破,-99
1450028,好在11.31减了一部分\t,-99
1797934,的策略，之前,-99
1986734,有本事跌停挂出不要撤的，每次只敢的20分之前挂,-99
2634895,狗咬狗啊,-99
2890289,这什么意思？谁说说,-99
107862,一泄千里,-99
1880595,像绿地这种一点量的股票短期能扔多远就扔多远f,-99
609513,手拿一手好牌，弄得满盘皆输！,-99
5481849,继续跌,-99
2532589,买这股票本来就一个字，赌，看这吧里有些人心态,-99
5362160,呵呵，看来又要推到重来,-99
168130,因为第一批明确进行混改的行业并没有油气行业,-99
4050476,48是不是死了？怎么没消息了？,-99
708186,600203:福日电子:福建华兴会计师事务所(特殊普,-99
63188,日照港(600017)融资融券信息(07-12),-99
427307,哪个王八蛋卖5000手?,-99
2815899,昆机的吧里，其实各位都是胡乱猜测，哪里有知道,-99
4611228,依顿电子今天休息。,-99
1119910,光耀东方李贵杰内幕交易亚星化学被洗反亏 证监,-99
3752380,这种东西不能请假……,-99
4912388,深港通运营态势总体平稳的位置,-99
4388808,设定价位减持，让散户以为是底来接盘，无良骗子,-99
2545897,大反攻已拉。,-99
4596034,。芦蒿满地,-99
4842574,看准三日行情，即,-99
1668841,中行黑豹军工的龙头开始砸盘，直接低开套死接盘,-99
4743286,信捷电气吧除了钉子户，其他人不要唱多，满屏唱,-99
3445736,明天准备去融资，本金50融50，然后买70万的西金,-99
4424641,网达属于主板还是中小板？,-99
3956754,这显然是抓住了问题的要害,-99
2572937,华银电力混改最新消息,-99
3576980,#菲林格尔1-6月归属于母公司净利润3100万以上,-99
2706948,很好，历史大底筑底完成，现在需要的是巩固向上,-99
2934694,证监会调查几个月了，什么结果啊？,-99
1566304,激动啊，二季度扭亏了!相信风神,-99
3651875,10，个跌停,-99
984383,超级垃圾，股价比安阳钢铁都低了，我cnm,-99
958735,敢玩这票的人都是英雄好汉。,-99
4018107,6012买入601989,-99
4062244,想赢就要等！,-99
2011969,IPO无限供应股票，北大荒12.1元是未来十五年甚,-99
4836150,美诺华、康泰生物接连上市 ，澳银资本迎收获,-99
1574948,刻意对倒控盘打压装逼使坏磨筹,-99
3041531,这股的基本面不该这垃圾呀,-99
4566054,清仓过周五！,-99
1014713,和大盘反其道而行之。大盘涨这垃圾跌，大盘跌这,-99
171651,比如应该做的事情,-99
4864522,本股的分析和走势 必看！可以给你选牛股的思路 ,-99
4187308,我承认这是世界上最垃圾的股票！,-99
4882971,002725我17.3卖掉买艾艾，现在涨到19.75。艾艾,-99
283494,庄哥哥是不想停板，否则明天得停牌一小时,-99
4962884,今日红三兵打响主升浪，上涨概率8成,-99
3864158,这发帖又要被删除！？？？？？？？好几次了！D,-99
503182,畜生在打压，没有意思了，天天打压,-99
4533704,明天大涨出货,-99
4686433,603368:柳州医药关于完成经营范围、公司类型工,-99
4912631,来短的就需要强者恒强者,-99
2409001,挺住。。。马上来解放你们,-99
4528919,调整开始了？等你到27。,-99
4981640,两市次新股2亿以下股本流通4000万的股票一共就2,-99
5557567,赶紧跑，明天又得暴跌了,-99
585982,郁闷无聊,-99
637305,格力地产(600185)融资融券信息(12-15),-99
2569168,"不拉升,都别挣!爱挣不挣!这点量没人卖.没人玩!",-99
1371164,1毛钱利润？还想涨多高,-99
2741072,企业优惠这三大指标最,-99
2855274,明天等第一创业回调，换第一创业,-99
2754360,被套半年，我还不如底价等半年等涨。至少我不被,-99
1526140,阴险的阴险的阴险的阴险的阴险的厉害的操盘手,-99
4443911,没忍住，手贱买了10,-99
4339124,"603389亚振家居,从38元跌到17元14444444444444",-99
3143197,我雅兴！真有雅兴！还投资理财！,-99
1956213,这波炒芯片的比炒新能源汽车和5G的强多了,-99
2266079,狗屎公司快,-99
581044,有效率的股价有限公司不断地使它们的设备、产品,-99
1455314,为什么回购不动，60日线轻拉就站稳了。这股的那,-99
5061947,明天反转！,-99
3039894,典型的,-99
3355426,西逼了！,-99
5206091,脑瘫大脑壳？,-99
1372466,13元见，龙净环保。,-99
1381415,跌下来再进,-99
3166898,金在境外购买内地的债s,-99
2325018,尼码的笔 创业板跌一点股票大跌 创业板红了。,-99
4721710,跌停不要撤单哈 让我跌停价买点,-99
1731599,清仓给小庄家一千亿,-99
2987577,低位吸筹,-99
1008871,雄安概念无可替代！区域牛市适合愈演愈烈！。,-99
4663781,横了第3天了，不上还得下。,-99
4098078,明天涨停！！,-99
5478828,费劲,-99
4145688,什么时候能当一回男人呢,-99
3093363,看到外围暴跌，心里不免有点兴奋[大笑][大笑]。,-99
1214913,呼叫万手哥！,-99
5052161,请别忘了，你没跟着次新涨过，有什么脸跌,-99
4242650,操你大爷的，都不看好那跑来干嘛.,-99
3751140,手，看，还是手。,-99
864587,假委托单，拉高出货，真是无耻,-99
4267924,数远多于增,-99
529296,这熊货天天跌，大盘涨，创业板涨。沧州大化跌。,-99
2731043,准备好钱.最后一跌到6.39元全仓买入,-99
3823157,很少的量就打下来啦！好恐怖！,-99
3265533,公司的煤炭品种多样，产能稳定,-99
664698,不好意思 已经入仓， 谢谢配合,-99
2406504,"抱团取暖的所谓白马蓝筹股筹码果然开始松动,局",-99
2989271,指导我一下呗，现在买买买还是卖卖卖？。,-99
2090718,收12.30白玩,-99
508809,我为什么买ST坊展,-99
5319469,连续二日提醒加仓，如何，真的开飙了吧。,-99
4106756,朱民：中国与世界人工智能的未来,-99
1487225,怪不得涨不动的，这好的机会，都在跑，靠,-99
664128,垃圾中的垃圾 主力已死  转战其他战场走了,-99
4008647,这行情不敢追高呀 谁追谁死。看下午核电能红不[,-99
418182,600120短线扛住了一波空头疯狂的打压。,-99
348805,600102主力已经登场！我等就看表演！,-99
3647090,搭熄区,-99
183345,收一个每年亏5亿资不抵债的公司，意味着明年的,-99
1681420,哪位高人指点下，是不是重大重组并购遭拒，马上,-99
1191600,中油工程,-99
3379151,参照超日，重组后的协鑫集成价格。,-99
4909220,指数涨，它跌！要严查,-99
4110675,全部都亏，，因为你们想反弹，，所以亏,-99
1535170,此股逆市，机构和峒一够嶙龆嘞氯ィ买进,-99
192552,分时线线顶背离,-99
3106355,怎么做。,-99
4307039,有谁弄个大单拉一下，或者砸一下啊！活跃一下！,-99
2135610,混改之风吹得龙头想趴下也趴不住[不屑],-99
4593320,厉害厉害，瞬间涨停，马上跌停,-99
1976417,不管亏损多少周一割了，无诚信的公司,-99
5203785,散户卖去死,-99
3027894,亏损多年的原因就是方向错误,-99
3994507,我操,-99
1322893,抛抛抛，垃圾股还要跌,-99
95899,真不明白这股抛压为什么这么大，内盘总是远远大,-99
4196988,哥啊！你快启动了吧！ 我还想请好兄弟吃饭着了,-99
5325329,盘已上涨近点报收。,-99
4706543,大资金抱团取暖 但大多股票开始向下做,-99
1749085,跟我吃肉,-99
1962698,海螺水泥(600585)融资融券信息(05-27),-99
4769053,中国央行公开市场连续第四天零投放零回笼,-99
1722410,低开高走，升5个点[大笑],-99
691791,二次下探仍是低吸良机k,-99
2735751,拉高出货，不会吧，,-99
3572049,A股大盘中长线波浪式上行的趋势没有改变。,-99
376176,我错了，买了国金。几个月来就没挣钱。,-99
5440055,跑就一个字！！！不用多说！！！那个说要有营养,-99
5326299,穷地方的股票是翻不了身的。,-99
2118981,缺少增量资金入市且又大扩容的市场将难有大行情,-99
1458789,，上证向上震荡阻力不不不不点，,-99
3509809,4000散户的票谁收了?能有人告诉我吗?,-99
3973387,哈哈，赚了,-99
5541904,拉高再低走?,-99
5372574,八千多万股，够把流通盘买两遍还不止，这股要涨,-99
1607395,公告:即日起公司变更启用新名“无能股份” 原名,-99
2093487,拉高出货,-99
3809400,中标七十亿人民币合同是假合同吗？,-99
471328,功！,-99
501272,七匹狼业绩比球球好，股价不到10元。,-99
1204813,猜一猜，恒力能否上10元,-99
4410838,这股就是废物，我选股中只有你是绿的,-99
3580104,猜猜看人均流通股三万股股价是多少？,-99
4136294,"不吓唬吓唬散户怎么能继续往上涨,胆子小的,或者",-99
4190198,庄家是不是睡着了,-99
739599,发一个非常搞笑和好玩的图片，今天的新都退，真,-99
117548,创业板先行调整，如何操作应对(,-99
184851,炒股还是要看自身啊，坚定内心的选择最重要，海,-99
5086199,长阴不止跌，难不成要到25元以下？,-99
2039790,生命的厚重总是与光阴同行,-99
1846489,太行水泥6月24日操盘评点和6月25日操盘展望!,-99
5059899,今创集团曾卷入受贿案 被指带罪上市,-99
5189637,再不涨，这股死，公司倒闭！,-99
1313840,大牛股！绩优股！,-99
2408617,老金专业委员会近日,-99
5263146,我来分析一下603825下周一走势，低开三个点，要,-99
2474825,不断夯实科学文化知识基础,-99
