,content,mark
1136335,雄安带动股市上升，受红盘影响，瀚蓝会缓慢盘升,-99
2569244,南方的股票创新高！北佬的股票创新低,-99
1786346,人力资源社会保障部印发了《关于将36种药品纳入,-99
3820963,证券的龙头应该是招商证券，这股散户太多，上方,-99
64602,这股一直在放托盘自己再砸掉，大盘的量就是这样,-99
1218878,为什么不查查任大炮？？,-99
4430983,有种别撤,-99
3744378,牛 不是说说而已。,-99
2182479,外资参股概念龙头。,-99
4399341,操你老妈、睡觉了,-99
5081195,吧里一帮滚蛋别没事瞎Jb泄粪，无语了,-99
3922495,昨天收最高,-99
2795972,什么节奏？要跌停啊？,-99
2258579,反正老夫是看好盐湖锂资源的开发和应用前景的。,-99
3716630,跌破14老子砸锅卖铁了！拼！。,-99
1675754,跌得好我等你退市,-99
1624834,所以人喜欢规律又讨厌规律,-99
3161338,2017火花S-Park产业地产30强榜单发布：星河万科,-99
5431465,603922:金鸿顺首次公开发行股票招股意向书摘要,-99
4753397,只把中线仓位补了回来 等等再说,-99
111867,10000股拿了半年了，不见涨啊！就分得200元鼓利,-99
2899484,垃圾你还能涨停不成,-99
3005567,又是无聊的一天等着接触55日线加仓吧,-99
1844828,平安填满权之路我们一起见证！,-99
2768933,邓永清先生做出什么业绩来了？一个董秘当副总裁,-99
3475409,绿油油的一重,-99
5094882,庄那龟儿子吃啦那么多货大盘基本见顶是你表现强,-99
2529485,连续停牌401天，首创前锋杨萎殡菊花开成繁花,-99
1953241,软肉弹何时才能到8.1,-99
3275514,这股是死股，连点量也]有,-99
3030512,听说北京……,-99
4322335,怎么还没砸到11元啊 5天了才砸那么点，不到11不,-99
1451366,在跌一下我把所有股都卖的全仓你，,-99
3626586,做股票应该有耐心不要因为一天的涨跌就有太多,-99
5164955,惠天热电的庄家真能忍。听说今天要发威了！不知,-99
3646180,雷诺-日产联盟宣布将与东风汽车集团股份(以下简,-99
1855955,市场被打爆仓了吧？ 强者恒强。 关注：000786、,-99
2236559,发现湿雪和山坡,-99
4642136,一千手都能到涨停，太不活跃了,-99
3193448,虽然在股市说后悔会被大家喷，但是我想说,-99
173691,想买的买，,-99
2319506,先投了10万元,-99
3969200,韭菜割了可以慢慢买了[大笑],-99
3102874,要砸就使劲砸下来吧！！,-99
4882786,雄安股带动不了人气。只适合看热闹,-99
5384651,股价还得下，下星期先补缺口，再向30天均线靠拢,-99
1799565,国发股份是个机会，可惜上周五只用智慧策进了50,-99
2129094,谁在操盘。,-99
5472844,红起来好么,-99
1060131,再白痴也会抢 咯咯咯！抢盘了，抢盘了，黄金砸,-99
3494726,没一个唱空的 今天担忧了。而且还是知晓通的网,-99
1273528,预计创历史新高，只是一个小目标,-99
1536577,今天晚上肯定要出公告     期待,-99
1908306,"反弹or反转,多看少动吧！",-99
172635,明天会不会涨停？,-99
649224,今天就这样了，明天继续调整！,-99
1561195,垃圾，开盘就卖你，不跟你玩了,-99
1251072,新疆兵团乳业大重组，伊利蒙牛之后新农横空出世,-99
708292,迎合市场炒作,-99
2366174,草害的我都不敢多买，怕一买拉涨停。,-99
2210032,今天收盘17.50.到时候在进。,-99
2788979,该走了，山顶冷,-99
2338807,顶，大家不赚钱，就顶股吧，顶到尤寺,-99
5460855,己卖出了快点跌停吧明天跌停开盘,-99
310090,烂泥扶不上墙，垃圾p,-99
1411147,今天跌4个点,-99
3371659,再不逃没机会了，今天我才入，后悔,-99
373774,春季行情真的存在吗？大数据揭示行情规律 你是,-99
1650709,坚定持有,-99
3886711,光大银行呆坏帐A不可测;风险大,-99
2320655,按照趋势目前的下跌还没结束，有可能跌破30亿市,-99
1921625,皖江物流：大股东淮南矿业将整体上市 已上报安,-99
3001712,狗b弱爆了，。,-99
808579,赣锋天齐涨累了，资金看好两市五家真正有锂矿的,-99
4740837,明天大盘,-99
1797748,今明两天清仓吧。,-99
609506,荣盛发展上午的走势预示着下午尾盘跳水难免。,-99
2379915,指数护是护不住的。,-99
2576100,当然,-99
507403,东东还是强的。,-99
4645465,这股还炒啥，没人买卖了！,-99
3576204,股票大量发行，明年更加惨，增发、定增、限售的,-99
2330953,就能克服困难,-99
4106451,伪概念,-99
3851950,好，那打板要多少资金来打呢？,-99
2585,4.19风云再起，大盘回调时至今日是天灾还是人祸,-99
4663727,太垃圾了,-99
2033158,你,-99
762678,机构都在玩高市盈垃圾及概念股，无投资价值，散,-99
2168801,难道特斯拉真的来了吗？,-99
4294309,毛利率在40%的股票、居然跌成狗屎,-99
3099804,该股下午涨停，立帖为证z,-99
5177143,赔赚不骂人，这个吧有涵养。。。,-99
4157082,从盘面观察，早盘迅速打压，然后在19.17附近用,-99
3443083,恭喜赛轮成功进入纺织服装板块！,-99
4465637,有看懂毒大户操作手法的吗？昨天回补了筹码，今,-99
4149504,我的哥，真牛，448倍市盈率！,-99
3966036,这只票都没什么散户关注了，多头基本死绝。[大,-99
4130830,在绿地赚的,-99
4927427,603605:珀莱雅关于使用闲置自有资金进行现金管,-99
3268500,快跑！今天跌停[胜利][胜利][胜利][胜利][胜利],-99
3505659,现在涨跌都不是俺关心的事  俺关心的是每天能 T,-99
2937984,"不要拿这诱多的上影线,糊弄投资者，你就是个太",-99
2258445,陆家嘴(600663)融资融券信息(10-13),-99
3502172,僵尸,-99
5218439,像三利谱一样特停自查，违规者斩立决,-99
1408332,麻个逼，翻红好吗？,-99
1511042,他们在一起后，表妹的言谈举止发生了翻天覆地的,-99
5427564,上市以来，总换手率已达500%了！,-99
3635450,胖子脖子上戴套，头上戴着绿帽子，洋洋得意过日,-99
2379419,呵呵 涨停,-99
5074993,尼玛，,-99
44335,两市三百亿逃命去了,-99
945188,这个平安真是祸害。,-99
633648,庄牛啊，在8元以下玩这么久。。,-99
3401994,哈，8.31卖完了。,-99
2724429,一买就套，给骗了,-99
1037803,他曾18个月巨亏18亿 涅之后创下千亿帝国！。,-99
4853070,北要等到2点半才拉升吗？,-99
1212445,外，新一轮去杠杆有可能展开，券商PB业务面临监,-99
2526080,皮书:,-99
1261933,好,-99
3583150,下周：（7月3----7日）将突破3196（缺口），强,-99
3920555,本周不跌破让元就谢天?,-99
1841044,一个投资方案的基本特点在很大程度上由个体所有,-99
1318778,万事俱备,-99
2733745,活生生，沉甸甸的投资实例就在眼前，别有用心的,-99
219731,多好的机会谢谢,-99
1108963,今天会涨停，中信重工，拭目以待。,-99
1885654,今天4.51买入能成交不？,-99
4665113,只要记着脑残打下还会在28上买回的,-99
2388586,北太平洋铁路普通股 ,-99
37735,越不敢追越涨，直到你敢追了把你套住。,-99
3347730,经大会讨论，批准同意贵广网络、信邦制药加入A,-99
1289049,再次疾呼，要大涨了，大涨了,-99
2532977,股改难产了十年，首创还在拟筹划，这话也能说出,-99
666837,你一卖它就要涨你行不行？不行你卖了看看,-99
427472,今天大盘几乎全天都处于调整状态，尾盘拉起微涨,-99
2172814,低于20使劲买,-99
3176898,短线跌幅近20% 跌幅巨大。,-99
3778193,压盘的这个sb庄 恐怕把筹码都弄丢了 哈哈。,-99
1678000,下午发射，关注勿追，股神后继续,-99
1316403,午评：市场在等待两件大事,-99
5069668,环卫服务捷报频传，即将进入福州市场,-99
5395943,不动！坚决不要动,-99
2496346,跌到立峰同志喝茶去,-99
1462713,晕死！,-99
920653,乐正戊：黄金局势将被扭转？通胀报告或引风暴,-99
1214170,机构每天倒手大家坚持封单,-99
1989162,今天也许是龙儿历史性的一天！！！,-99
2381586,又崩盘了，主力赚。傻比,-99
120108,这股怎么了？,-99
53610,进场收尸:地产称霸南京，医美雄冠亚洲,-99
1374940,又出公告了，明天还得跌。,-99
5145074,老乡别走………楼下接下一句[大笑],-99
1587025,人家真金白银9.54买的，高管大股东9元也买二个,-99
16915,半死不活的，节后应该快出公告停牌了吧！[毛估,-99
318623,今天跌幅排名第六[微笑]\t。,-99
802151,暴走,-99
3521805,真正的牛市，全球牛，宇宙牛,-99
869753,大信替瑞华，排名第三换第八十八，这是真穷了；,-99
3976007,我想静静,-99
1317927,资本金和公积金从1919年的1400万美元上升到1928,-99
2872124,且量能不能持续放大了,-99
3693004,[图片],-99
5128314,没有主力青睐,-99
397739,明天底开跌3个点，千万不要追高。,-99
3292707,牛股是连续拉    熊股跟涨后马上要回调,-99
3830483,防火防盗防股吧垃圾,-99
4710279,弘信电子、江丰电子、奥联电子、富满电子,-99
3032607,本周小庄的护盘任务很重啊！[俏皮],-99
4560817,军工混改+航母概念第一股，遭机构60亿抢筹，将,-99
1892075,前三季业绩增长近6倍！股价就要跌6成？,-99
437148,极有可能更名为601360!。,-99
1073092,"横有多长竖有多高,小心鬼托",-99
3368182,准备起动！,-99
779941,城头变幻大王旗 过往常客今安在？,-99
3338995,大便狂泻。,-99
1482704,002102可以关注,-99
2692826,23.37买进103手，看好未来，就是4天涨停板，看,-99
737685,大单拼命出货中，还有人意淫涨停,-99
3705223,这么便宜咋没人扫货[大笑][大笑][大笑],-99
2898712,买了这垃圾股上当了，整天不死不活的！。,-99
2233264,又在热烈讨论博元被借壳事了，问题是博元还有壳,-99
3404086,狗日的,-99
4680670,他娘的什么玩意,-99
2068673,听高手说庄成本在7元，那我决定比庄更狠，等6元,-99
1812567,我靠,-99
835232,兄弟们大盘走势不稳 把到手的果实看好,-99
3851908,您二位先听听。,-99
2387256,*ST匹凸8月23日打开涨停,-99
169812,M“阳光总在风雨后”首选底部超跌优质股,-99
2174574,昨天信息讲今日上海市召开集成电路会看万业如何,-99
4274901,300460 惠伦晶体，603022 新通联，明日拉伸，恭,-99
3266848,久盘必跌。s,-99
55658,每次民生银行都是倒数一二名，这样的股票以后一,-99
3273889,上市公司当下卖房属于,-99
2145249,科技兴则民族兴，科技强则国家强，科技是第一生,-99
2687233,还有五分钟的上车机会[大笑],-99
4231467,啥意思？主力就这点筹码，怎么撬开的板？瞬间打,-99
