,content,mark
947280,公司最新回复,-99
3077686,牛逼了～我的庄！[滴汗][滴汗]这是要连根拔韭菜,-99
3672486,券商给予该股未来合理市值是200亿，可现在才69,-99
4164964,一只牛股走天下,-99
4500270,庄子中庄子中,-99
4791484,萤石价格坐火车了，,-99
3209188,洗盘而已，今天买入的等着发财了,-99
1057790,舆论啥时候替股民说过。,-99
2259066,庄家压300手，小散就买不动，下周6O周线拐头，1,-99
756778,这种公司主力不想赚钱害的股东都倒霉,-99
4451947,69元又买 5000股[微笑],-99
450245,天量三日见天价，地量三日见地价,-99
3516713,除美元外就属这货币最惨！,-99
5196214,小心被宰一一一一一一一一一一一一一一一一一别,-99
2151222,深创投旗下宁德时代拟启动IPO 840亿元估值或超,-99
3610626,上涨没有速率都是扯淡，看看北部港湾，嗨。怎么,-99
4490946,套牢，套牢！,-99
569853,从港股北京汽车走势可以看出,-99
5063549,10月10日沪深两市最新交易提示,-99
5402298,原来12日浙江杭州真地地震，好在不大，不会造成,-99
1714422,深度被套后应该如何补仓？,-99
2632610,我靠，没看错吧，真是醉了,-99
2225812,已建仓500万股  坐等收钱,-99
5086063,长征七号遥二运载火箭he航天工程没一点点联系，,-99
635818,[滴汗][滴汗][滴汗]明日可能拉起来摔,-99
3705648,尾盘拉起，就是有些晚了。,-99
2044421,涨少跌多,-99
2818963,不和江南嘉捷玩了，xx主力！,-99
3399784,文峰电器有限公司服务态度一塌糊涂股票能好吗，,-99
4612281,军工股必将重新担当起大盘上涨的动力 航天通信,-99
4976203,20天线再次满仓 坐等,-99
5360785,元祖股份中秋节月饼概念股，股东权益11亿，公积,-99
1937224,大盘的调整，应平和应对！,-99
3190268,跌跌不休何时是个头啊,-99
2364037,18日尿素价格继续上涨 贵州尿素报价1950-2000元,-99
3148163,风雨天1没收黑钱，为啥天天发做空言论？,-99
5456992,垃圾！上啊！,-99
3600613,A股现在体现出来了，有数量没质量的市场扰乱全,-99
498027,重整成功，利国利民。[赞],-99
1974667,600589:广东榕泰2018年第一次临时股东大会会议,-99
4027857,得润电子发布与特斯拉有过意向接洽,-99
573307,一是媒体报道,-99
5338184,四毛走了，下午找机会进,-99
2210763,三大数据盘点A股上半年 龙虎榜等存量资金都去哪,-99
1127891,8月3号这个日子全国股民一定瞪大眼睛看着股票.,-99
377777,死几巴,-99
1142583,收盘价10元,-99
717284,郭台铭昨日夜访张近东 敲定三年500亿大单,-99
4292917,按相关规定，润达医疗最晚于哪一天复牌子,-99
4761380,看业绩水平，不用说尚品165，就是欧派家居都114,-99
2709303,一年有两个低迷回落期，也正是逢低买入建仓期,-99
2693838,创三年来的新低,-99
4167522,华立这次在成泉配合下扮演了极不光彩的角色，恶,-99
4220966,业绩下滑，流通市值太大，跌停不要接，可能再次,-99
4530373,面板战争――一部产业阴谋史 20161027 就算大家,-99
3398381,"文峰你有种弄个涨停！证明给大家看看,你不是个",-99
3422808,这是要破发？,-99
2059472,童子鸡的贴快沉下去了，童儿快顶,-99
3394886,投资银行正适时,-99
2601487,艹nmd，还真要炼成九阴真经啊？,-99
376075,十二年资产增值8.32倍的公司股权转让,-99
3623850,幸福是,-99
2463733,逼散户接上证50的股票。这么拉指数就这一个目的,-99
5263375,封单不多，挂上应该能买到，[想一下]，,-99
683818,扶不起来的阿斗,-99
239713,22.62的本 有比我高的吗,-99
5190059,20.5等你，快点,-99
4438481,这指数涨的[大笑][大笑],-99
1291485,"立帖为证,多说了三年内,也许就在今年,中国加入M",-99
1515771,此时无声胜有胜v,-99
4306645,真搞笑，又跌了[大笑][大笑][大笑],-99
1887762,太垃圾了，难怪大股东会全部放弃配售,-99
2979361,复牌之后，23元即可动,-99
1941574,一周年祭，安息吧,-99
1344202,5-22:今天大盘跌幅不大，但个股跌成落汤鸡了，,-99
5519363,这里静悄悄,-99
824036,成熟的投资者最不愿听到的一个字是什么？两个字,-99
4011990,中国核电转债什么时侯发,-99
4836177,股市有点伤 喝酒盛宴刚开席 吃药行情又来凑热闹,-99
365932,每个月1700块钱。,-99
2879800,速度买入抄底[买入][买入][买入][加仓][加仓][,-99
4317225,如果炒股只看PE就可以了，那世界还有穷人吗。,-99
1773101,慢一点儿，别急,-99
1929025,"解套不是理想，目的赚到银两,小心鬼托",-99
4809979,今天特别提醒下:胆小的可以全部喜至耍。。,-99
129778,同样是指数上涨，有的是虚涨，有的是实涨，怎么,-99
5082749,指数涨得时候总是在赔钱，,-99
2598514,江中药业(600750)融资融券信息(09-12),-99
4037023,今天银行板块全部探底一针,-99
2241612,早上好!周四沪深股市表现,-99
3367841,大同煤业明天会这样的,-99
4528374,真是他妈滴个垃圾,-99
568846,福田汽车董秘应回答，为何那么多利好从不公布，,-99
3959899,提前说了，你今天不买，明天让你后悔，凡是盈利,-99
1776571,小板凳做好，就看董事长买不买！,-99
2199972,今天拉高出货,-99
3317538,、完善减持规则为IPO腾挪资源是合理之举。,-99
1395754,航母航母航母，潜艇潜艇潜艇。重要的事情说三遍,-99
5256669,此垃圾股进一个死一个,-99
5100918,抛了，希望15能接回来,-99
4665671,调仓换股好时机！,-99
2978850,软脚蟹！临港,-99
4389994,将其纳入短,-99
2429455,"洗,认真洗",-99
2635217,弱不禁风的样子，纸飞机吗？,-99
2222553,建仓进行时…,-99
1039277,广汇汽车(600297)融资融券信息(09-15),-99
3861930,你他妈吓我啊！你爹我不吃这一套,-99
893709,苦丶苦丶苦，全仓融资买入大湖被套，莫名其妙停,-99
4837471,明日开盘介入002106莱宝高科,-99
4618721,此股要跌到20以下,-99
4096910,呼叫千手哥,-99
3519224,601137:博威合金日常关联交易公告,-99
3586712,这支股票脸都不要了。,-99
2551606,今天零售不错啊，，怎么成这b样,-99
3112778,600882:广泽股份关于全资子公司签署投资协议及,-99
3206073,谁说股市不好,-99
48218,这个周末也为超级周末，利好不断，但争斗也不断,-99
564522,新日恒力,-99
1814001,跌停板到涨停板敢死队上20%,-99
365467,美尔雅(600107)融资融券信息(12-07),-99
1549533,万手哥又来了[哭],-99
3486067,这货竟然可以涨3毛  不是一分一分涨的吗,-99
2984880,我拉稀了，拉稀了哗啦哗啦一下子变成一坨翔,-99
3938514,什么H股会影响A股去看看中国铝业香港股吧，现在,-99
4345332,留着青山在……………………………………………,-99
579075,武汉控股跌向何方？丢武汉人的脸，把武汉两字去,-99
4223417,我半夜零点挂牌买入的一千股怎么没成交呢 今天,-99
605052,这换手不知道主力在墨迹什么,-99
554531,开股东大会谈利润分配是假，密谋怎样坑散户是真,-99
2071187,大狗砸盘，小狗一手一手的卖出，哈哈,-99
4601720,千万别买，破低点可以考虑下买点，套的机会远远,-99
1105176,洪都航空重组前人气低迷，重组后会像盐湖股份人,-99
2981466,等于买1元原始股，有天风证券6.25亿股即将上市,-99
3770684,12.07复盘 大盘有企稳迹象，可小仓位参与,-99
4705792,河南本地中宇卫浴很不错，惠达卫浴牌子根据股票,-99
1257414,天天杰克、杰克的S13，把华微电子闹得今天这个,-99
1922297,五穷六绝七翻身 七月五大投资机会揭秘,-99
4834564,雄起,-99
51755,次新股股价不到10块0.98元业绩仅此1家江苏银行,-99
3956811,刚刚看了一下盘，有一单买入100股，就可以让依,-99
1620256,停牌真的有重大事情,-99
5476410,垃圾大理,-99
5384800,今日必定红旗飘飘！,-99
1082631,基金狗还有多少没出？,-99
664910,前面一波大涨后面出现诱多让散户跟进，此股凶多,-99
3267740,这股没有量突破的话，不要介入，纯属几个散户在,-99
3790597,他还要等待进一步的命令。,-99
4787567,厉害大买单全是卖单诱多看买盘上不上当了,-99
4909474,昨天买进的傻逼了吧,-99
5027834,为什么这样的公司也能上市？,-99
4385302,天天看着被活埋,-99
471093,真是瘟到家，啥事能雄起一回,-99
274038,资产重组,-99
333839,新品发布会未发先热，a。,-99
145500,混合所有制改革国家意志！中国联通混改第一枪必,-99
1371112,一点都不给力，我瞎了，要跑路了,-99
2004718,千年难得好业绩、走势半生不死,-99
3943815,舞非舞同学！ 我暂时去西部黄金一下！！ 都是黄,-99
1984357,你不感动着,-99
4071139,日了鬼了，16.12,-99
775456,鲁商置业(600223)融资融券信息(11-21),-99
2975333,下跌一个台阶必加仓[献花][献花][献花],-99
4421436,亚邦股份(603188)融资融券信息(07-14),-99
3623820,由此也可得出各大技术方法将难施展拳脚,-99
5346848,跌没了？,-99
4821770,中央财经新闻说多伦多么多么好，结果买了，亏了,-99
1869684,创业板三季度业绩增长50% 只有创业板上涨 才是,-99
1699517,从黑周一到黑周五,-99
2612441,连续两天回调了，现在差不多可以买入,-99
4321905,怎么长的怎么跌回去喜闻乐见,-99
3617697,营收200亿，利润才8亿，有问题,-99
2515097,阿里，物美，步步高和谁？,-99
1686214,方大福利政策暖人心,-99
5101330,与其它打新中签股比，一般中一签到开板时赚2万,-99
4167387,资金天天流入的。结果股价天天跌！！！！,-99
2892694,动迁补偿,-99
3114981,期待明天,-99
5436939,想下车的赶紧下车，人多了涨不起来,-99
3960101,庄哥想用时间拖垮我们，离大会没多少天了，大会,-99
5542478,电解钴438000-4480004430006000元/吨涨6000元,-99
5173790,神经病,-99
1443167,股价高开之后第一时间快速下跌且击穿均价线，但,-99
4423183,市场烂透了，个股多数绿油油，什么价值也没有，,-99
176467,从一定程度上削弱了新股的赚钱效应，,-99
961257,三季度业绩环比下降，具体数据如下：,-99
670802,稀土的局只有中铝能够摆平，创兴资源迟早要被收,-99
1336361,2014年以来到现在涨幅超三倍以上的所谓白马，20,-99
1314923,大家算一算：1股五粮液56元红利0.9元用同样价钱,-99
2989723,海欣股份(600851)大宗交易数据一览(11-03),-99
2169637,9.68进入新华龙,-99
4941840,怎么还没公布重组对象？,-99
1868678,大盘个股分析（连载）,-99
4213940,尼玛，主力就差我那几手么？,-99
3057228,已经缩量了，明天开始抢投票权！大家不卖的话，,-99
864352,市场交易造,-99
545999,问懂秘？你企业是否存在重大问题？,-99
3216022,重庆建工联合体中标6.5亿元PPP项目,-99
495394,还是熟悉的A股,-99
1017387,震仓,-99
