,content,mark
1962135,散户成功接盘[大笑],-99
3751697,股市收盘香港恒生指数8月21日（周一）收盘,-99
812664,这成交量也没谁了。,-99
4723380,我去，我周五卖了，你现在给我长？？,-99
1040874,此前因为空头连续杀跌后有所衰竭,-99
308881,天汽模：能加仓吗？还会不会涨了啊？\t,-99
2031291,要下车的明天快跑啊，要上车的明天抓紧哦,-99
173604,上证50则走弱打压沪指，盘势带有八二分化,-99
3303077,清仓已经三个礼拜了,-99
129146,美股三大股指盘中创纪录新高 机器人概念股iRobo,-99
2158666,星光文化早盘涨了6%,-99
4949824,51 20手 谁与争锋,-99
3673066,这次杀的更厉害！,-99
421501,蠢庄，俺用大数据盯你，明吃你,-99
2434653,想做次新股要注意两点：,-99
386728,从十七号到今天，天天跌停，有严重问题了…,-99
2560958,好了今天又有新股民进场站岗了,-99
262060,一剑1973,-99
596703,这股票自生自灭啦？没人炒呀,-99
764825,又回到解放前,-99
2818597,腾讯系再添一家！微医集团计划明年在港上市 网,-99
4265031,纳入MSCI后，大A股会怎么走？-一起炒吧,-99
3656062,北上资金连续两日加仓 金融股异军突起,-99
2497613,一个空壳复什么盘啊，继续停牌重组，再找一个好,-99
690757,000860,-99
944980,看看量价,-99
1996668,现在手持现金，等它低位后入手,-99
115561,核航母像茅台一样稀有龙头，比茅台更猛！哈哈哈,-99
379967,这鸟股的打压已经让一部分人疯了。,-99
98354,华电国际(600027)融资融券信息(06-08),-99
5329877,大盘最后的逃跑机会。看多空趋势，从3295下来到,-99
5294613,今天来说说独立交易单元和快速交易通道那些事儿,-99
4387494,完了，和讯网已经报道了，大家请看。,-99
5250868,来个跌停板吧！！！,-99
775978,撸伤滞野是最丢人的笑柄,-99
3570103,其依然有资金借到深港通不断的买入,-99
1820519,没戏，做T蛮好,-99
3416211,如此不要脸的股票咋不退市！！！,-99
4343392,计划跌停的，怎么没大动静！,-99
903306,鄙视这怂,-99
2108463,他说风雨中这点痛算什么 擦干泪不要怕 至少我们,-99
5253345,我几个星期前就要你们卖，还说我是托,-99
110357,07年放开外资中信证券涨到了100元,-99
5108082,我36元买的1800股，现在一股亏了3元了，草草！,-99
40628,唯有两个为畜的，一味跟随顶帖刷屏，畜就是畜，,-99
2103434,再会考验前期低点14.65元,-99
5282079,停牌了怎么没公告四通股份,-99
620143,庄真恶劣！！！品行差！！看之前的走势也是这吊,-99
3057468,这种垃圾股，真不知道你们怎么想的。这种没业绩,-99
487196,散户能否杀条血路，西部资源上涨必将雄起，买点,-99
987418,深A成交量多沪A约1千亿，都去炒中小盘，创业版,-99
3256173,还不清醒,-99
1410495,歌华有线(,-99
4878999,一只老鼠半仓梁、,-99
1964343,新股次新股泡沫即将被刺破！跑,-99
4336466,真心纳闷，这些卖的能盈利吗,-99
297130,强烈看好,-99
3436300,这是主力主力机构通过大幅低开以探明底部，从而,-99
1039266,共享汽车对广汇影响如何？,-99
3195561,烂泥扶不上墙，气死我,-99
3102125,放量了涨停跑了[大笑],-99
1052594,我把田里的草除干净，大豆就肥了,-99
727415,这么低股价，沈雯老畜生还要减持，你得小心了，,-99
49053,按跑赢大盘的王者的说法，碰到减持股就是踩雷！,-99
1611171,即使没有天骄航空注入，以现在通信设备和4G5G的,-99
5429714,今天买三分之一仓位是必需的。听说小散户买了游,-99
1552178,大单开始砸了,-99
3931248,此股如拿到国庆小长假期股价不会低于35元！,-99
11086,，就一路上行收复了5周线及20日线,-99
193866,063的价值早晚会被认同，这一天不远了,-99
3238179,担心上市公司,-99
4850169,嗯，别人都在创新高，这只股却在下降，看来庄家,-99
3107507,机会不多了，建材行业即将重组，看涨建材板块,-99
2535012,“黑猫股份,-99
2491480,早盘竞价明显就是诱多。\t,-99
2805610,真贱,-99
2056510,主力牛B往下看看,-99
2309161,都大牛市了还往下走,-99
1169279,破庄家洗盘的套路：你不割它就不涨，散户真玩不,-99
3108097,坐等年底赚30%。,-99
721282,据悉，京东方位于中国,-99
5549014,每一次买卖决策都应当尽可能地基于相对准确的数,-99
3864647,明天开始今天彩排,-99
4187150,要死在这支股上了……,-99
763121,我持有这个股两年半了，套了50%了，别听别人忽,-99
431561,分时线走的是真恶心,-99
3986997,这股票哪次上5个点不回落的？还要发新闻呢一上5,-99
1103645,石破天惊荡气回肠 《人民的名义》和它背后的推,-99
4732313,风雨不动安如山，金辰股份最高价应该是多少?性,-99
5452618,11月16日股市必看股市内参（附：热点个股）,-99
2232934,唯有休息才能保障即得之利益，唯有休息才能养足,-99
1869573,一买就涨k,-99
1794656,我追进来了，明天不知是福还是祸。,-99
3413112,下周一开盘涨停。,-99
2644010,河钢特种钢庆祝“八一”建军节！筑我钢铁长城！,-99
461564,有点大的资金想往上拉，奈何在高处没有小散接盘,-99
2392330,是不是要ST了,-99
1523413,156颗卫星。,-99
3848877,狗庄真会压盘，,-99
720010,个人认为联通在7元到8元区间是一个相对安全的区,-99
566456,中国股市才能起死回生,-99
4201978,永吉跟吉比特真干上了。,-99
35925,7月13日收评,-99
4049575,建议保持85%的仓位，胆大的可以满仓后冬眠,-99
5305522,22.66压力巨大,-99
652992,最好能砸跌停[胜利],-99
205523,恭喜今天又中了，开盘就是最高价[大笑][大笑][,-99
1178209,大盘的子，跟步真好,-99
1430763,但是现实很快让我失望,-99
3102418,博瑞传播(600880)融资融券信息(10-16),-99
1624234,涨高了就减持,-99
2355408,市北高新600604 上海国企改革即将铺开 优质资产,-99
4675417,大家不要紧张第一天成交量,-99
2892585,300676股价247市盈率257倍这是价值投资吗也不是,-99
4054111,把话撂这里,-99
2733108,证监会投保局副局长黄明：四个方面推动投资者保,-99
2049555,高潮我要高潮,-99
1888083,想卖出的人是泰山压顶呀，若水载物这个狗逼咋不,-99
4567983,它只是将投资者短线套牢,-99
4405924,进货！,-99
1384944,哪些说为啥,-99
3037338,内蒙华电跌停吧垃圾股，自从买了你就陪钱，老衲,-99
695775,苏粒佳上市，江苏吴中千元不是梦,-99
5113400,今年投资重点看绩优股和成长股 第一个方向是绩,-99
422534,兄弟们   权当存款了,-99
3140161,新思维：去除了杠杆，适当小泡沫难免且有益，股,-99
5547149,该股即将涨停的走势,-99
3919446,一家配资公司的客服人员表示。,-99
3428565,优股赢#赢家策略#炒股想赚钱！那请放弃这4种票,-99
4021246,指数上天，个股入地！。,-99
3884178,大盘收盘应该在3260附近。,-99
2784999,赶快卖啊！,-99
4402269,全球每4部智能手机的面板，就有1部出自京东方，,-99
4856924,国脉业绩只一毛多，全年不过6毛钱，为何股价如,-99
967390,怎么不跌停板？,-99
3972396,吉视已经形成恐慌式抛盘,-99
2773021,遗憾，今天没补到仓,-99
5015523,还在出货那个是傻的吧,-99
1704624,从日本软银跨国并购后的重大亏损危机的慎思！！,-99
2520989,跌得连银行股都不如,-99
5354674,《证券报》，15只个股创5178以来新低，吉祥市盈,-99
1051923,却发现目标忽然消失了,-99
2846312,"#电子值多少钱没法衡量,但宁波江丰值1666元",-99
4089475,603012:创力集团:2016年度审计报告及财务报表,-99
5164095,手里持有150手，继续观望？还是割,-99
2026521,云赛一贯出公告必跌，今天会如此么？,-99
1346828,买入靠信心，持有靠耐心，卖出靠决心,-99
2156569,教育行业利好,-99
5117840,好公司，好股票,-99
1094181,平高电气这艘破船就要沉没了吗，大家在低价位还,-99
812436,强势股趋势好,-99
5322773,最熊的股叫我买上了，真,-99
269107,三季报速递：海泰发展2017年前三季度亏损4339.4,-99
3020389,新三板在资本市场一直属于姥姥不疼、舅舅不爱的,-99
433598,主力不在上面挂单压盘。,-99
1660220,今天如果不涨停 我就出一半,-99
746689,其中很重要的一点就是,-99
3975382,涨停价买的，再跌停搞笑，坑人吗,-99
5255094,被套了，不管了，随便吧！[俏皮][俏皮][俏皮],-99
5335827,先出来，过周未再说。,-99
729036,紫江企业紫江企业,-99
3659182,是不是故意的的啊，就差一分就封住了涨停，是不,-99
1545710,主力光出不进啊,-99
4374041,醉卧沙场君莫笑,-99
1056364,看其它股都涨这衰货死死压住，真它娘不是兹味。,-99
409629,什么状态？。,-99
4453521,日月股份主力怀孕期，以后需要8个月生孩子！耐,-99
3795853,现在伸手必套，等待。。。。,-99
2566868,看来二股东加仓可能不是为了打酱油。,-99
4438688,两桶油,-99
4838199,等二天如回下一点点再加仓,-99
1177577,"[大笑][大笑][大笑]廊坊发展600149,大龙地产600",-99
157969,康德心，也闪了，你快了。,-99
944018,明天还是低开震荡,-99
4806442,尼玛的！一卖你就涨！畜生[哭][哭][哭],-99
3468006,马上改名,-99
3179184,熄火了,-99
1277476,我没本事改,-99
2590499,投资需谨慎投资者对国家队的动向十分关注,-99
5325738,今天又完了,-99
3329072,600990:四创电子独立董事关于公司相关事项的独,-99
3202165,又是有原始股东减持了,-99
220802,每天一分钱,-99
1944929,欲穷千里目，更上一层楼。,-99
2783521,2013年1月31日，浙能集团出具了《关于避免同业,-99
3277501,散户：下跌看空涨进货 获利总想多多多  ,-99
4109819,2017年7月26日、27日为中长线股友彻底清仓的最,-99
447195,则考虑随时要卖出,-99
3050660,1929年29.4  亏损3.278 亏损低10（注a）,-99
2555511,看看它曾经的历史，有妖气,-99
1321486,憋了三个月了，持仓终于飘红了！等待回调加仓！,-99
2375118,600693:东百集团关于公司股东进行股票质押式回,-99
2159372,热烈庆祝明珠破18！！！,-99
4733702,央视财经 房地产市场风云突变 六大原因揭秘内房,-99
3842442,射会主意好，割脂本主意尾巴！,-99
3493217,滚你妈比。大盘涨你龟儿子跌，大盘跌，你跌的更,-99
3791424,@人间四月天77 你如果作为一个散户，发表发表看,-99
1646912,越跌越买，长线持有。哈哈哈哈,-99
3421877,都不说话最好，都亏损，静等主力砸盘，见机行事,-99
3335533,本次交易完成后预计将增加公司2016年度归属于上,-99
