,content,mark
4456075,接下来，业绩原因：如通很快破30，回到25，日月,-99
2989913,为什么A股市场会沦为股神巴菲特眼中的赌场呢,-99
3747518,庄啊 打压砸盘洗盘请随意 等庄拉抬,-99
906810,终于撑不住了,-99
3926124,江河集团(601886)融资融券信息(08-23),-99
5183127,明天进来，你敢吗？,-99
2670520,各地相继开展的智能停车系统建设，拟可采用蓝牙,-99
3462683,来2个亿买太平洋。,-99
4337226,涨停吧，,-99
3664737,庄家就是我的卵子！,-99
5352564,追求真理善于创新,-99
1919373,快买要涨停了,-99
1911639,康恩贝(600572)融资融券信息(11-07),-99
2432243,3.10 00257,-99
5104380,这个股 奉劝一句 不要再买了，没希望了。不希望,-99
5523605,典型杀鸡给猴看！,-99
4374833,机构纷纷看,-99
961843,这个票散户抄底抄了不少，不过庄家资金还是没有,-99
4520005,董秘，请问你们单位是不是有重大事件没有披露，,-99
2446807,很可能是借壳的标！！这个帖子可以验证！[大笑],-99
1741343,一鼓作气，再而衰，三而竭！中天科技还有冲过16,-99
366697,早晚要跌停A早死早超,-99
4629161,现价买入，笑看账户盈利,-99
3491078,金投资增持2.14%股份。二级市场上，该股,-99
3955977,是不是要降印花税了？,-99
3932560,接近今年以来最低点，创业板击穿2015年大调整时,-99
3812791,一群嗓门,-99
3184174,600903 贵州燃气 可以买了！,-99
3710137,真是垃圾。浪费大好行情,-99
2267458,解决选股思路上的重大问题你才会有巨大收益,-99
920167,没跌就是涨，今天出完,-99
698696,风口上的百大集团600865！百大阿里商业的路线图,-99
498543,塔城地区中院副院长张超同志一行4人到深圳中院,-99
1820990,还是那句话  只能等尾盘发飙 这主力总是这样  ,-99
402463,吹牛时间到，大家进来吹吧！。,-99
901090,喝酒吃药行情！！！谁去旅游啊，这么大雨。,-99
2428508,还拉不拉了，死不死活不活的！,-99
4037831,奇虎的壳子是江南嘉捷601313板上定钉  不信去江,-99
3934290,大会龙头股新华网603888今天第三个涨停（跳空涨,-99
4629935,飞到比,-99
1493846,我以为这是通威吃饱了撑了没事发预告,-99
4939301,跳水冠军吗？草泥马,-99
5227493,贫僧掐指一算，思思又该重组了！,-99
2632092,这破股哪有那么多卖单？,-99
5103890,撤单了傻逼了吧。,-99
1639357,周一准备暴跌A因为我,-99
4931656,现在的主力和游资都被鬼控制了，鼠目寸光,-99
2087933,请看氯碱化工的三大阴谋盘剥戕害散户，散户朋友,-99
163792,已经多次高位放量下跌，拉高无量虚拉指数，大家,-99
3957570,多头不死，空头不止,-99
3583780,钱的,-99
5120662,中广天择这次进场资金达到了5个亿以上。,-99
2914902,摩根大通做多黄金！至少看涨至1247美元,-99
1525987,老乡，别走，缺口咱不补了,-99
2881357,看跌的 傻逼出来叫啊 ~~,-99
3001006,那个吃屎的畜生还在吗,-99
2986457,周一回调是买入良机,-99
35621,3.4了，还能跌到哪里去？买,-99
3983923,还真不愧为中字头,-99
1362781,面对五矿资本。我们要有清晰的概念,-99
236873,600074:保千里关于召开2017年第四次临时股东大,-99
3736941,中了3个亿，还不涨，情何以堪？,-99
3431411,明天10.30前有千手哥进场，大家欢迎,-99
2920262,6连阴了，明天小反弹了。。,-99
4104399,我在23块等你,-99
3388028,观棋不语 真君子,-99
1940622,又是拉尾盘，每天这样，都习惯了，就等你长阴下,-99
269773,海泰发展今天晚上半年报如何？大家都来讲一讲,-99
2468107,涨停板雷达：晶瑞股份、海鸥股份等只个股有望,-99
2943757,100亿封板,-99
1481817,冠豪高新(600433)融资融券信息(10-18),-99
3521095,下周解禁压力环比本周增加42% 比亚迪逾百亿市值,-99
1489345,片仔癀20年后股价会反超个茅台,-99
644135,居然秒停，利害,-99
3173377,这种走势，估计黄某某要加型了，一辈子也出不来,-99
3166259,无量，怎么,-99
467002,下午崩盘,-99
5037492,很多股票都在绝地反击了,-99
2856751,上市公司高送转之所以沦为很重要的一点。,-99
1152900,17左右进。你懂的,-99
3362916,涨幅靠前；白酒。,-99
1777464,440手挂着压盘，在方大碳素那里简直小毛毛虫一,-99
2205891,老子那点股票是收藏的，用不着出七元左右我再买,-99
2729119,88888888,-99
4039353,银行股比较安全。,-99
4278875,这垃圾股早点滚出股市吧！,-99
1805224,继续举报缺,-99
1777624,"公司控股股东上海晶茨已累计增持公司股份14,272",-99
3823256,[献花],-99
1371501,稀土市场价格混乱,-99
2877909,怎么上去就怎么下来，这就是上海物贸天天玩的,-99
5290724,敌退我进，众弃我取。,-99
2889697,重新收回了店面的管理权限和财务权限,-99
397119,这是要去大气层吗[亏大了]，减仓了,-99
2651206,开盘卖了，涨停哭了，17.65买回来，现在哭的像,-99
2391098,一季度增持欧亚集团至760万股 上海宝银距离举牌,-99
1444829,此公司究竟出了什么问题，请大股东回应？,-99
3994175,科学技术发展突飞猛进,-99
474338,这只股票肯定会退市的，公司比较倒闭，空壳公司,-99
3944038,港股紫金快涨4个点啦,-99
2111730,还在出货,-99
3421258,看到山东出版的一律销毁。,-99
2630784,今天要是翻红了，你们会怎么想？,-99
1784356,江总，王石是你榜样啊,-99
1925126,原先叫嚷我薇的猪头们，别忘了，互联网有记忆,-99
4469912,2304，今天最后的希望,-99
1100458,一天波动三分钱 耗死你 都不如存活期了,-99
3096423,上证综指，还是创业板指，抑或是上证50、沪深30,-99
2820574,11块都站不稳，一堆卖单出来，趋势不可逆,-99
1867492,雄安关联+白酒河北王+重组+补涨=复牌之后7个板,-99
4262184,现在是不买着急，买了就套，一套就是好长时间,-99
2675568,7.30成本！综艺股份！坐等主力送大钱！,-99
2015285,炮声一响，黄金万两,-99
1812354,我也只能呵呵了，都有在普涨，就你。。。。。,-99
272700,香港交易所关于群星纸业控股有限公司除牌程序发,-99
2170715,号百控股(600640)融资融券信息(11-15),-99
5321423,垃圾,-99
1712806,已经没有多少下跌空间了，缩量反弹应该是主基调,-99
5178331,永安行押注电动汽车 谁来领投10亿融资,-99
1923742,很多比较尖锐问题的帖子都是待审核，这种投资者,-99
1742348,看准了不丢手！,-99
5211954,道森股份走势异常，怀疑公司有问题存在，大家可,-99
3167878,宝信软件签订55亿服务合同 与中国太保进行数据,-99
2318086,这货是没治了,-99
4219528,马云惊诧：应当往下打到8元的，怎么往上走啦！,-99
3773832,核贱大盘大涨你大跌，大盘跌你暴跌！！,-99
2742688,供给侧结构性改革、基础建设需求回暖是支撑其主,-99
789256,@可以买了!,-99
4124069,六月加息靴子还没落地，不要做梦啦,-99
1483275,明天更精彩,-99
4895533,眼下除上证五零外假股指真股价为了流动,-99
1813290,2016年大牛股！今日建仓，必涨,-99
4637710,今天会有突破吗？,-99
5418933,冲高回落立贴为证,-99
4927970,果然，洒家吃肉为了狗粮又出来叫爹啦！,-99
2279482,要投反对票的来报道，我朋友有50万股,-99
4706481,补跌，补跌昨天的,-99
3931603,尼玛谁给拉红的，还要脸不！,-99
4954738,新能源[5股]天齐锂业 多氟多.科达利 圣阳股份,-99
3995259,尼码的笔 创业板跌一点股票大跌 创业板红了,-99
1805452,下午狂泻，赶紧逃命吧。,-99
325055,限你三天，涨到10元,-99
1516582,莲花健康，正处于反弹阶段。r,-99
5378348,指数跳，寿星能不能挺住啊,-99
2849666,日了狗了,-99
3039754,煤价下跌了22日煤矿出厂煤每吨降了16元有可能煤,-99
2669166,转移,-99
2029598,有人跑路了,-99
4665542,量创新低,-99
752304,估计收盘7.41,-99
4921548,倍市盈率同济科,-99
1039447,因此筑底的行情将不会持续太久,-99
2445090,仅供参考！,-99
2650067,央企国有资本运营公司整体上市、并购重组、资产,-99
335987,更好的参与国际竞争,-99
4506924,告诉你啊，再涨我可就卖了[俏皮],-99
2052360,成本价7.08，6.12割肉出局，实在看不下去了，我,-99
3225323,我从小在新疆长大,-99
2834180,难道就只有散户割肉，机构不割肉？?户食机构的,-99
206217,宇通600066：：哈哈哈，立场不坚者，被洗出来了,-99
655068,恢复正常后再重启IPO的,-99
2311058,华南城与京东集团打造B2B综合商贸生态圈l,-99
2656368,真不打算发个补充公告吗？股东人数都不发，上市,-99
3951371,加,-99
2777860,吃也吃不到人屎，吃狗屎王八旦，屎快四吧,-99
816794,什么情况？又有人举牌？,-99
2873939,表15 1905～1963年两种代表性债券的价格波动,-99
4433670,垃圾到家了，想出也拉一下,-99
1036208,收藏品皇帝。第一高价霸王金一文化。秒杀不怎么,-99
1133456,辣鸡沈国甫，。,-99
2790377,天津磁卡底部有待确认，没买到的不急,-99
3967990,午评：创业板低开低走跌逾1% 雄安新区继续领涨,-99
2805845,跌回7元时代。,-99
3736371,601567:三星医疗第四届董事会第六次会议决议公,-99
4662617,成立3家公司,-99
4685819,压盘砸盘的人断子绝孙！,-99
3170341,周一清仓这个垃圾满仓买进证券股，下一波大行情,-99
2537984,这个走势，美女炒股太浪费资源了！,-99
5211168,今天,-99
3708439,总算全割完了 ，一身轻松，亏了 8万买个教训，,-99
3423952,可以一试了,-99
5464429,同志们东你,-99
1396517,请问董秘，st明科原生产区的土地在什么位。,-99
318338,现在的股票真难做，金叉不一定涨，死叉那是百分,-99
4019604,来吧！让暴风雨更猛烈点！全仓！不会交出筹码！,-99
2829145,AAAAAA-今天涨停,-99
860753,退市吧，一了百了……,-99
4125140,赔了两万，不玩了,-99
5486820,真是洗的一手好牌！！,-99
3586296,唱空的狗们滚出去，才能涨！[赞],-99
3184996,ST生化：浙民投天弘要约收购股份过户手续已办理,-99
2803417,泰山石油、安控科技、惠博普油气概念亮了,-99
1217047,阴跌，跌死人。啦及票,-99
3708843,草，绝望自己玩吧。,-99
810474,圆通是垃圾，客服说是双12货多送不过来，慢慢等,-99
765335,阳光主力不拉 不启动 后面我们出别的股吧号召些,-99
2459245,很快切换,-99
5161562,这个价位卖的应该没有人可以挣到钱,-99
2842861,低价题材是永远不败的主题  ,-99
4585264,大爷就知道肯定又得修改了！新规定这垃圾根本不,-99
