,content,mark
2871099,400哥走了,-99
4041592,越跌越买，创业板里脱离板块走势 值得买的股票,-99
5086859,上海贝岭有望更名华大电子。,-99
3641560,度帘幕中间,-99
2865887,中报速递：耀皮玻璃2017年上半年盈利1717.71万,-99
4804886,没有主力，还老删帖,-99
4419715,成为游戏龙头公司 时代出版600551 出版业的龙头,-99
3060164,该抢筹的时候你们却要卖，活该被主力玩,-99
1376426,放着吃分红了。高股息。10年前买入现在成本付6,-99
4194898,[献花][献花][献花]我司马懿马哥总结成败经验是,-99
1796078,广场舞团队集体被套，准备做套降低成本，乡亲们,-99
1750288,还装呢,-99
1983240,请谈谈复星未来发展的优势有哪些？影响和制约公,-99
3022758,涨前卖了，刚买回来就大跌，哎,-99
5493564,今天进来的下周一全都关进来，不然不会收阴,-99
1398519,   注c. 平均为50美元  注d. 平价为25美元,-99
378069,反谈是神话,-99
3977574,看看H股就知道某队某金公司多么无耻,-99
94986,清仓走人。永不入流氓股市。变质了。,-99
5524804,明天游资割肉走人,-99
646499,大小股东们，我们一起要分析一下，为什么停牌,-99
3720197,娃哈哈速度吧你东拼西凑的老帖子顶出来 呵呵,-99
3543443,买入西部矿业，人都要傻三年，走吧!,-99
3583294,一触即发的滞涨绩优地产股――轮涨只剩地产板块,-99
3570813,水务板块全红，就你戴着绿帽子，我笑死了,-99
1855484,散户朋友们，不可自乱阵脚！,-99
5107313,死透了,-99
4227894,明天大盘跌，它上涨，,-99
621775,政处罚 包括登云股份造假,-99
2208384,上午出了[哭][哭][哭][哭]。,-99
1018948,西水这个垃圾嘴脸暴露无遗了！,-99
3762829,垃圾,-99
3166258,情况不妙，快跑v,-99
13428,持才是最珍贵的东西！”,-99
421890,喜欢炒股和看乒乓球，可是，你懂的，异曲同工。,-99
2721296,狗一般的新铁,-99
2137121,继续跌吧，跌到13.1继续加仓，跌到11.8满仓，然,-99
624032,601699同类公司比价最低、建议重点关注,-99
3732077,1936年31高44（1937年）,-99
4940767,为什么不跌停呢？晕,-99
3360176,主力  有本事来个跌停板洗盘法,-99
4895435,该三处房产虽未经评估,-99
4570494,小心一阴穿4线，烂股家常菜。,-99
4869327,有病的股票，,-99
1099033,这个奇葩股，大盘跌你也跌，大盘涨你也跌，坑的,-99
331919,炒股赚钱最有效的“三部曲”,-99
3090013,股吧里有骗子了要电话和姓名大家注意了,-99
3591544,欢迎对倒砸盘、挖坑！,-99
3230516,没有分红，分红不如银行利息的市场，提倡价值投,-99
1738878,静待产品批量上市,-99
5492838,最后的疯狂,-99
1574270,第一波主流热点是科技股，当时的科技股业绩也并,-99
4400217,此股成了弃儿！]娘的孩儿}了！,-99
5270136,你们知道这个世界最可怕的是什么吗？,-99
1091712,深度解密骨灰级一线牛散游资是怎样炼成的？,-99
522230,中线底是实力派的游戏，如何变成实力派u,-99
1600890,妈的，五根阳线,-99
1076288,此股应赶出A股市场,-99
4635483,想不明白30元的宏辉也有人抛售，那些60元买的人,-99
4743009,周一尾盘，第一巨无霸，工商银行大幅拉升,-99
1625340,600488:天药股份2016年年度股东大会决议公告,-99
3365226,洗漱买入，即将起飞了,-99
4817162,37.8跑了、准备明天接回,-99
4178302,快跑吧、次新股板块很差、随时可能暴跌,-99
1566844,最终看到某制药企业在招人,-99
4702266,黑金托尼：走在丝绸之路总结篇,-99
3703,300352可以介入了，低价，盘子不大。基本面还行,-99
3180132,进行了500多个字的回答，我们在此选择最核心的,-99
1531916,请问贵公司的耙材已经量产了，销售已达7亿，正,-99
4221183,我已经给乐惠做好了K图，元旦后60天突破60元，,-99
5019035,主力很狡猾，如果看着KDJ指标操作的话，很容易,-99
3407632,马勒戈壁！好不容易弄。,-99
1520947,600455全网第一时间,-99
4923981,好了，主力，我已经号召大部分散户46以下成功割,-99
5537171,黄金上方受压，但是美元的跌幅将会中和黄金的压,-99
3613545,谁说上海银行跌破发行价了（1116）,-99
651277,又要倒数了。。。。,-99
1814426,名字真好听,-99
1736827,从“一致性评价”和“优先审评”中寻医药股机会,-99
4681288,辰欣药业（603367）：黑暗稍显漫长，但别轻易倒,-99
4129168,[环氧丙烷]：山东石大胜华环氧丙烷价格上调 隆,-99
1832914,华峰氨纶卖裹尸布的。,-99
1391795,海澜之家,-99
4380634,早盘已见全日低位。,-99
5305240,步长制药下跌的最主要原因:1.总股本接近7亿股，,-99
2386398,明天有开庭吗，怎么查不到相关信息？哪位大神给,-99
4526219,今日新股申购重磅消息：次新炒作降温，三只松鼠,-99
1508821,5237护盘？,-99
5424214,机构再逃命了都往出跑,-99
1142790,出问题了,-99
2980103,涨停，明天继续涨停,-99
2720078,散户扯吧，庄家高度控盘，玩不过,-99
3128450,国投没主力玩了，换股操作。[困顿],-99
3436811,快破历史最低点了  这货还能活吗？,-99
2035674,卖出清仓了,-99
4983761,洗盘什么时候能结束？,-99
5068112,头技术创新能力,-99
2499513,现在这行情，云维延期是好事，应该一个月一个月,-99
715214,没出息，就知道跑,-99
5279358,草，明天破12就买,-99
2955183,指数收于10306.92点。,-99
2776412,lih has,-99
3413712,吃肉没赶上。挨刀的时候一刀也没放过 拜拜,-99
1825879,600548烂主力，老子有钱有时间给耗着干！！！,-99
2974042,我也是听了老年78的宣传进的b,-99
2233397,360盈利能力一般，借壳凤凰究竟好不好？,-99
971571,n1420417940...,-99
2946395,卖了卖了，重新换回我的雅化集团了,-99
3649320,今天指数上3300。江南嘉跌停。然后晚上停牌。[,-99
1629802,<高山缠禅:,-99
2037094,《鲁北化工》要这c走吗？。,-99
1202059,如果我在这里说多了，如果造成了影响力，影响了,-99
698924,即要求这类公司提供相应的业绩预测数据、测算过,-99
3041672,不错嘛，竟然比美股还有风范了。希望能走十年，,-99
381885,兜底增持 是抄底还是维稳,-99
5044465,昨天卖了酒鬼酒买了这货，郁闷。,-99
377428,如果中国股市是T十O庄家敢打吗？,-99
1489986,市场观望情绪进一步增强,-99
36283,，有此为证！,-99
3908091,今天的最低点是2010年刚上市的最高点，快八年了,-99
1243016,这种形态看样子要奔向3元h,-99
4539008,玛逼的，真不让人活了,-99
27189,言并不危险。就,-99
2237034,这股真的服了。哎,-99
3186566,撤了，傻逼庄太猥琐,-99
2216677,这股5元左右,-99
3351970,请教大家怎么可以吧这个股吧账户注销了,-99
4527698,29.2抛了，今天应该冲高回落，大家不要追高哦！,-99
4601352,中国概念  概念中国,-99
1751888,哦哦哦，这垃圾又套人了哦。还进来一些莫名其妙,-99
3736650,创业板并没有大涨。为什么？,-99
5072621,603688石英股份短信股明天拉升,-99
3715654,“返回” 只有一个目的：把我骂走,-99
2435006,600303逢低关注600006已经起飞,-99
2496,藐视困难坚持不懈努力以充分发挥人的主观能动作,-99
5030172,002750 龙津药业；300434 金石东方，明日关注，,-99
2255820,这个股有很大问题,-99
2342505,2017中国互联网大会召开,-99
3790365,600671:天目药业第九届监事会第十五次会议决议,-99
3455012,此票切记主力的诡计；就看你能否守得住底线,-99
3960100,，产品和服务灵活多样，创新层出不穷，,-99
218222,共享办公产业高速增长 行业巨头估值飙升(受益股,-99
4046720,花旗续叫买ASM太,-99
3450295,管不住自己的手贱，以后买衣服再不去国芳百盛了,-99
2361476,两个月不放量的目的,-99
799332,现在也不让卖，只好想象明天后天 分仓补，等下,-99
237228,多头空仓狗，快来膜拜尼庄爹，问问尼庄爹为啥不,-99
3154207,说金硕银：7.25所有挖坑调整都是为了后期更好的,-99
1285011,"基于对未来大概预期,我做了针对性的市场交易策",-99
2868895,跌停我可以买五股锁仓了,-99
3489110,今日带客户建仓002878元隆雅图明早盘强势拉升，,-99
5466264,没想到被套了,-99
962254,市场选择了复星而放弃了恒瑞，是价值重估的体现,-99
2519005,美股大多保持区间震荡态势。,-99
781842,笨蛋庄真实用意压盘收集筹码！老鼠拖风箱,-99
3821202,券商板块的垃圾股,-99
1012580,中国虚拟货币的寒冬,-99
4531743,布将维持基准利率在0.000%不变，将存款利,-99
508799,靠臆想、赌徒心理炒股,-99
1804510,"庄家曝光操盘手法, 原来散户们都是这样亏的钱!",-99
1560814,简单地模仿只能使自己陷入困境,-99
3684421,联想控股低位减持，意欲何为？欢迎大神们各舒自,-99
1580229,一路向下,-99
2372772,天量也就是天价了，不走更待何时。,-99
3040825,缓解劳资关系,-99
3269940,基金国家队怎么都跑了,-99
4523835,苏州赛腾精密电子股份有限公司(以下简称：赛腾,-99
4629066,孙当董事长后，一定要,-99
341363,自选你都个,-99
2832692,为什么跌了这么少?求解[献花][献花][献花][献花,-99
3036820,内蒙华电(600863)融资融券信息(11-03),-99
3648933,哈哈，减持就是胜利！！！！,-99
2143532,财务作假,-99
228826,砸死你们,-99
1197126,难怪火箭发射失败,-99
1620055,亨通亨通，又到20日线加仓处,-99
3335711,主板好久没发过帖子了，因为发了也没几个看的，,-99
5284887,次新+高送转风口来临，买,-99
3997894,主力操纵大盘烂臭股，又联动喉舌大力宣传价值投,-99
3933126,曹尼玛的大啦几。不涨耗着,-99
2932787,停产 21亿元,-99
2448445,天汽模投资并不需要做对很多事情，重要的是要能,-99
1531808,多说无益，机构手法，好好拿着就行！,-99
2968232,股东大会17年预计实现营收40亿，怪不得机构都跑,-99
118909,呵呵，个位数多了？,-99
1322620,允许做空做,-99
4484207,5月操作策略,-99
300575,在中国有1亿股民假装在投资,-99
5182600,今天必须绿,-99
580005,每天要养野儿子，王八蛋从来不孝敬你爷爷――我,-99
4159917,主力不强没办法了,-99
2989304,从前两天香港市场个股闪崩之后，业绩差的个股最,-99
5423169,既然退市制度规定连续三年亏损公司要暂停上市,-99
2083976,这股没庄,-99
2259689,庄子你砸点我拣点,-99
627554,谁与佳通共沉浮？,-99
1056488,哈哈，随便买个银行股都比它强，回来看这个垃圾,-99
2710699,从今以后别跟我说分红，这都是坑人骗人的把戏。,-99
4058734,明日早盘强势高开！拭目以待！股动力私募007,-99
5329550,一秒拉跌停 只要400万不到,-99
