,content,mark
4157090,BBA+通用+捷豹路虎+奇瑞是主要客户，怕毛。这些,-99
2887309,现在坚守世茂,-99
1952871,正常思维逻辑 一个长期分析某只股票的人一定和,-99
5427731,只说一句，不要捐钱了，讲真，，，没几个赚钱的,-99
446224,为毛这么多匿名贴？？,-99
60263,资金接盘,-99
4970596,都希望低开，还加速下杀？？？[大笑][大笑][大,-99
4192755,送股明天到账，刚咨询完券商客服,-99
2235425,云维这才叫破产重整，10转10，大家让渡30%偿债,-99
1146754,求高人解读一下这些公告意思,-99
3384657,死垃圾，大秦死垃圾，大秦死垃圾,-99
5353336,小鬼们快来给爷抬轿,-99
3154918,吧里唱多的托还真多，天天唱多天天跌,-99
5003904,大盘又可耻的红了,-99
3000964,开始奔4元,-99
946816,请问贵公司是否也会进行混改呢？,-99
533520,安信证券有,-99
2311404,午盘快评,-99
1351238,520，333哈哈，有意思,-99
4837169,白马股行情将贯穿始终,-99
2676912,但我可以确定一点,-99
1226221,输光股份,-99
4409002,被融券做空，不到26就奇怪喽！,-99
707608,全是12手卖盘，什么意思,-99
850321,跌就一个字，跌破9建仓。,-99
1381327,节后还有一个涨停，也可能3，4个。。,-99
532769,10:500000，这就是最小A股公司和最大公司的区别,-99
3435868,601028:玉龙股份2017年第一季度报告,-99
2965524,你大爷的，要跌停？,-99
1415922,今年卖房的上市公司数量达到百余家之多r,-99
660260,乐观看待三千点上方的周K线金叉,-99
975208,面对梦想道路上的困苦艰难坎坷,-99
3020452,有大，吃完死喝完尿，赶快来刷屏挣钱。,-99
227379,成交量同比昨日小幅萎缩,-99
2823474,你大爷老是跌，走了去买盛和资源了。,-99
4668463,12.8杀入 傻庄庄,-99
3561216,当1932年该股票以75美分出售时 ,-99
2329226,我的得提高技术看盘，和K线均线成为朋友,-99
3221397,特别是对那些三无题材类个股,-99
5279980,我们因为住的近有一次我去崇明跟项目,-99
4507252,明天会连板吗？,-99
1968507,大医疗小市值：很可能一跃而上让你高位追买。,-99
131169,“惠州亿纬锂能股份有,-99
2448564,在上涨过程中,-99
1471370,2.22.标题 ,-99
5464652,日，你，马，马,-99
1859673,都关注川化去了，没人关注大西洋呢？,-99
2447860,还叹鬓丝飘雪,-99
714618,涨。,-99
4858181,石化双雄显得相当霸气,-99
1258497,一天涨两分有意思吗\t。,-99
1066071,威胁发育多好 傻蛋你懂吗,-99
3724855,部分小厂出清，市场集中度也进一步提升。,-99
4366970,不要急，等一下。,-99
1522298,"$B就一笔o猪么么画股老掉牙套路:大量做预测,死",-99
1035017,有中金一手策划的股灾开启！。,-99
4898797,今天震荡的很好A明天,-99
3946080,南方传媒已经是第二支江苏有线，100年横盘,-99
4044099,你现在看到的是2016年12月31日的股东人数，2017,-99
3887015,树总会高过草的!,-99
4996009,僵尸交易量！,-99
5248759,陈旧观念最多创造活力的诸多优势,-99
302882,已经在运作了，基本按股改的套路。抓牢筹码等着,-99
1292157,数星星的脑壳好昏 连续几天都在厕所痛哭,-99
35801,中海阳连续四年协办CPC 2017 国际光热电站大会,-99
4888314,有人在吸啦，呵呵,-99
1477258,又沦陷了，清净没三天,-99
2187795,3.90附近需要休息一会儿u,-99
519997,长达两年的调整，终于在廿季K,-99
3417029,＂挖坑＂行情有多少人能坚守住呢！[大笑],-99
4782754,值得搞,-99
1147743,(月率),-99
1787154,中国平安快大跌，跑啦k,-99
714613,逛了一圈回来一看吓一跳，跌了这么多。十一元两,-99
3510343,小康竟然能跌停,-99
2621836,人是世界上最坏的东西,-99
1018249,华仪电气(600290)大宗交易数据一览(11-18),-99
3812963,601677:明泰铝业2016年度内部控制评价报告,-99
5413689,猜到今天会跌停，没敢补！我不信这股就此结束，,-99
1422173,买三友化工是因为雄安新区盖念！,-99
1750974,安狗，出来，人呢，又憋着坏呢吧，融券爆了没有,-99
3099838,艹，左右对称?,-99
996939,沪指震荡回暖深成指收复万点,-99
1411519,动力源:指标背离打回原形,-99
4835792,他妈的脑残,-99
2781354,浙大网新：什么情况？,-99
2208062,重要的事，说三遍！最机密的内部消息大爆料：锦,-99
2874121,此股。资金少关照，所以少碰。套利可以，下周9,-99
2741921,哈哈安逸低开s,-99
5393597,44块进来了,-99
1984510,焦煤期货龙头股:山西焦化,-99
2910107,中国烟草与600830的关系……想象空间,-99
1281951,市场稳定政策，就是安全带，有了安全带，爬多高,-99
4451445,最后10分钟下跌8%,-99
5454184,真不明白，今天封板的是昨天金银河的资金么，左,-99
2515425,买入抄底[买入][买入][满仓][满仓],-99
4009659,唱多的人又多了起来 明天必须继续跌,-99
4099412,603017:中衡设计2016年年度股东大会决议公告,-99
1859871,逆袭大盘，表现不错,-99
539146,ST三泰，已全仓，永泰能源，再见,-99
4484658,现在能买了？,-99
1969725,平治信息：鹏展 天翼/神州 俯瞰A股群峰,-99
629806,生益发债是和股票一样吗？,-99
2699519,哈哈跌停,-99
4081220,这行情容易招狙击,-99
1549897,从总账上说,-99
3677175,恭喜，今天要新低了,-99
4405786,调查一下，有多少友友想看俺师傅大灰狼的照片，,-99
4764265,52收盘都是猪力努力了！,-99
445301,由于太多小散坚定看好后市，使得主力难以洗盘获,-99
5289731,和通用叠加观察，会发现很多有趣的现象。,-99
2640131,有什么难处，让环旭电子三天落后大队伍这么多。,-99
3515330,次新银行股的春天马上要来了，庄再不拉的话等着,-99
5475938,清仓清仓清仓清仓清仓大理药业，换股新余国科，,-99
2648042,这家公司高管抛售“吃相”难看 股民最多被套超1,-99
72936,媒体看多我看空，大跌才刚刚开始,-99
2968493,规范上市公司高送转行为也确实很有必要,-99
2068169,中信国安不是也有通信吗 怎么就完蛋了呢,-99
1358721,证监会支持符合条件的内地企业到香港市场直接融,-99
845458,先走了，换银鸽了,-99
1083117,做空行情,-99
4148985,只有快牛，或慢熊，现在就是慢熊。。,-99
3489959,只要能回本，今生今世不再进中国的股市，今生今,-99
1477807,强烈要求中纪委进入吉恩，里面还有大蚀虫，！！,-99
4568417,昨天收最高点，今天收最低点。怎的了\t,-99
3025134,垃圾主力到底意欲何为？,-99
2020856,目前出台的规定只是,-99
1145814,北大[李友案]巨额罚 有部份或该退返上市公司a,-99
1373787,今天明显是买方市场，乱跑的都是大傻逼神经病啊,-99
5249175,华人科学家找到“天使粒子” 量子计算或成现实(,-99
2453656,是一家之毛公司，要遭报应的。n,-99
2703544,几天都是狗庄挂大单，看见散户来了马上撤单悲剧,-99
4588455,mmp什么烂庄，要筹码拿去，转三花智控了，守几,-99
373443,估计跌不下去了。割肉地板上了,-99
1718376,刚才25.95我是不是错过卖点了，能突破60吗,-99
327316,不怎么涨也不怎么跌,-99
2534159,早就出光了，每天等着被套吧，一个个看看K线图,-99
3622811,母,-99
2424511,并且该预测需经公司董事会审议的规定,-99
4038198,观看问题A要,-99
755812,看看泰山石油吧，看看石化机械吧，垃圾。,-99
1914268,媒体一致看好，既然都看好谁在卖？不算从三月底,-99
4192979,下周大势预测 高逢个让逢让逢,-99
3752954,何时上市交易,-99
4068722,还不走？跌的让你们怀疑人生！,-99
166561,起来吧！该发力冲击新高了吧！期待,-99
5047366,中报速递：卫信康2017年上半年盈利6476.80万元,-99
340721,不受审计部门审计的季报半年报，上市公司经营业,-99
2405399,难道提早在减持了,-99
3847439,中国中车(601766)融资融券信息(11-24),-99
3770586,快  快  快！,-99
2566784,没跑的傻眼了吧？！清仓！,-99
5188127,促发行人提高信息,-99
5459091,规定上市公司每年高送转股的比例不得超过公司业,-99
3909011,中阳收盘，目标，沪市3200，创业板2000。。,-99
1367016,中阳之日就是进场之时,-99
4247564,长达十几年的漫漫求学之路,-99
3685162,这股筹码集中度很高，上方套牢盘也很少。从走势,-99
1218541,兵熊熊一个 将熊熊一窝 亚宝,-99
3414352,有哪位大神告诉我，明天会大涨吗？,-99
1036487,合肥市工商,-99
2308274,600985重大重组一个板，赌677重组的同志们该清,-99
2100328,【龙虎榜】大游资趁涨停出货9600万,-99
1546069,怕踏空的…,-99
5185536,三公司否认有可燃冰相,-99
2309232,庄家自救行情虽然还有，但是已经变得越来越衰弱,-99
3360810,你买了吗？,-99
2569767,我们接到许师弟的哭诉,-99
3337514,守着这垃圾错过了复星医药，错过了方大炭素。,-99
5280445,603838:四通股份第二届董事会2017年第八次会议,-99
4905847,我在12等你,-99
5531106,603989:艾华集团:平安证券股份有限公司关于湖南,-99
3904292,一个重要指标正悄然变化 投机客继续做空石油是,-99
4973653,还会跌[亏大了][亏大了][亏大了],-99
4029905,Sb公司，你看看吗*ST股票的价格都比你高，你好,-99
1467695,丁农王八蛋,-99
1915367,量跟上才行啊!,-99
5201741,哎差不多了，可以抄底了。22.95二十手，23元300,-99
5535296,603991:至正股份2017年第二次临时股东大会的法,-99
3382540,如果人们投资的理由是为了赚钱 。,-99
332689,凡是买了广州发展的人都是可怜虫，包括我,-99
3358247,道达投资手记：大盘六连阳 25只百元股仅4只下跌,-99
192524,如果大周一这,-99
1570960,股市再度逼近点，减持新规出炉的背后含义,-99
4962728,压力很大A基本摸到了,-99
2776976,"钱江老总们,麻烦你们信息发专业点可以吗?",-99
4375944,加油！跌停！,-99
5260652,这股多是这样的,-99
2865126,九月以来，汽车指数上涨近15%!,-99
4768833,603477:振静股份首次公开发行股票招股意向书摘,-99
3720219,2538手玩对倒，主力继续表演,-99
3187094,没人炒了散了吧凉了,-99
1234476,佛山照明(000541)融资融券信息(09-13)。,-99
4396316,14.5x买的两天内就保证让你解套，庄狗在这个价,-99
603168,用电高峰！赶快买中国核电，今年还没有炒作过在,-99
1064789,谁再顶老贴我顶他马比,-99
1951088,中国在未来大幅度增加国内原油产量据新华社12月,-99
5367582,跑跑跑最后的机会不跑要亏死你们,-99
1767387,现在的股票特么会玩无量闪崩[大笑],-99
3040648,呵呵改成37，手了，主力,-99
