,content,mark
4426526,上车就套，恶性循环，明天周末又该大跌了,-99
2168204,盘中推荐600150中国船舶，拭目以待！,-99
5450194,不要卖了！行吗？,-99
2549221,成交量近几年新低，换手率新低，所谓的气若游丝,-99
1632461,有多少带血的筹码被这些唱空的骗走了,-99
5339356,碰上恶庄了，没办法。,-99
855400,万达商业借壳万通地产，立贴为证,-99
2401382,【ZT】最超值超极本谍照，偷拍联想U310冰晶蓝,-99
1244464,掘金地狱19层、揪出翻倍大黑马,-99
5256784,努力砸跌停,-99
1595784,基金一季报就退了，看清楚再说,-99
2084870,一场缘来,-99
595015,雄安不倒就少不了机会,-99
2749354,22万手瞬间成交完毕,-99
4035039,鼓励垃圾砸盘，谢谢，又买3000股,-99
136597,淘宝有，京,-99
4224739,连续好十多天净流出了！这都净流出好几亿了！差,-99
2727352,山东高新投今天开始卖出龙力生物了！估计晚上就,-99
1387188,安源煤业套牢盘巨大，不砸下去是涨不起来的，主,-99
3834713,郑霉鸡经公司申请，并经火星证券交易所核准，自,-99
2965350,中一签有三百元赚吗？？,-99
2929500,将自己的一切潜意识之中就开始屏蔽,-99
3078644,炒股要有定力,-99
507326,以后中国打战直接带着酒去。把敌人全部喝到。酒,-99
173726,勿买！,-99
5089432,把煎熬留给时间，时间可以化解一切,-99
3000050,无量上升，诱多陷井！,-99
4535883,涨停诱多，注意风险,-99
3300596,上看下看左看右看，这股都可玩o,-99
3602310,国际上煤矿股PE为20倍，现在601225为7倍，入选,-99
3488132,鄙人掐指一算，外运所持的4千万股国航今天抛得,-99
382458,股吧猜想,-99
2719614,没人买！！！！,-99
4580789,我被删帖了！[滴汗][滴汗][滴汗],-99
4180281,24.13在进,-99
1907912,有没有掏空公司资产？得查一下吧？,-99
5367533,前面那么多天见红，一下就回到解放前。,-99
4177273,不要做无畏的牺牲,-99
2333488,消费者信心指数处于历,-99
3564878,对于这样的抄袭行为笔者严厉谴责,-99
4452523,真够贱日月股粪,-99
2471977,每天低开几个点竞价几个意思,-99
1498095,空仓了，等志愿填报完，才能安心炒股，主力加油,-99
4669831,一开板就进来了，哈哈，这感觉酸爽,-99
4614901,12月18日财经早餐：本周美国税改将进行最终投票,-99
5156878,说不定明天,-99
4764180,hao,-99
248606,天天跌，跌死预见午',-99
4150671,603032:德新交运第二届董事会第八次(临时)会议,-99
3768816,明天去古都洛阳，希望中信重工长脸![鼓掌][鼓掌,-99
2469459,个股都涨啦，你也该活动动啊！,-99
659729,芳菲的气息,-99
2796993,火速支援三,-99
493920,有本事别买A尽管跌A,-99
4832322,我操。被洗出去了！你妹的、,-99
1810535,没有任何一个理论每次绝对预测准确}在做出买卖,-99
4346288,跑了15000元到手,-99
2804573,我先撤了，不过我还会回来的,-99
5454388,难到出完货了？,-99
191575,两市绝无仅有的垃圾股，骗子公司l,-99
1708259,徐爽说了今天买腾达的人有福利哟,-99
2337858,6000手6.92补缺口！数据业绩很好看的报告期会随,-99
1908041,今天绝对不会再次突破11块1毛8,-99
1805310,抄底新赛，新农开发都开始拉了,-99
2918583,期待了，下周会怎么走,-99
3141670,"复利的利润增长,连科?",-99
2135497,标准诱多今天进套了.明清仓这票废了,-99
3249101,涨跌比率为1.01，带有二八风格。。,-99
2090855,海立坑爷爷,-99
3701617,中国中铁 主力资金大幅流入，散户资金明显流出,-99
283860,呵呵呵牛逼，这么大的托单都吃掉了，，牛逼,-99
496882,st云维是在重整、st新亿是在抢劫，完全不同的两,-99
1827295,上证终于红了最后一秒红的，我以为要绝经了。,-99
317981,石油大涨，此股能涨吗。,-99
4381597,把余下的也清仓了!买入医药新股!,-99
1646423,跌到3元加仓！快跌！！！！,-99
4341906,不排除还会涨，但是风险大，观望,-99
4631139,嘉泽新能调整一天再次涨停，低价股再受欢迎。,-99
5098290,一会又砸下来，越砸越低！,-99
2656456,今天涨5个点，今年是近5年最好的业绩。,-99
710535,急跌无碍牛上路,-99
551680,明天限售股解禁，问题是解禁的股票为卖么？,-99
5475128,有谁发个公司平台建议公司改名，现在叫客来鸡店,-99
532535,这股肯定是被庄家抛弃了，这么自由落体的跌，别,-99
2560422,此股股东太阴险，恶意配合定增，恶意配合老庄！,-99
4234202,看看三个上海走没有,-99
849454,连续11个月位于荣枯线上,-99
5512698,停牌吧！每次开盘都让人心碎,-99
794144,上车！快买,-99
3266390,再来个跌停我进来,-99
41846,向下跌的织布机,-99
1514927,人民币中间价下调44点,-99
3787201,加油 突破通道,-99
1544247,华健的歌,-99
3661299,抱着存银行的心态买交行，否则要被气死。,-99
947541,沪指小幅收涨 上证50指数劲升逾1%终结四连跌。,-99
2164139,翻倍第一高价股600519贵州茅台主力开始出货 翻,-99
3352594,几把开滦要万达的,-99
3025545,刚发的就没了？,-99
2172271,这王八蛋神经病！,-99
215916,真垃圾！,-99
187820,卖皮的狗庄,-99
718146,明天即使跌停也破不了发，天亮了还赖着有意思吗,-99
5537360,特大利空来袭，大资金疯狂出货。收盘跌停，下周,-99
1736121,发，今天洗太干净,-99
647889,姜照柏和002625的姜照柏是同一个人？,-99
4044186,今年最大的失败就是000725定增上市99亿股定增价,-99
312064,套，越补越,-99
3452989,低估值周期白马重现布局价值,-99
4927980,洒家吃肉，你今天叫爹的任务完成了！,-99
2671212,套牢的人不趁震荡做差价，别指望出来，而且还有,-99
4125728,该公司五年不死不活 没发展 管理层庸才 没大戏 ,-99
1370213,抛压很重！,-99
1044547,新政利在长远,-99
1529173,细分行业龙头即将成为热点:时代新材600458必将,-99
1756017,突破前期高点很难A摸,-99
2574773,放量涨仃,-99
2874869,春去尚来否,-99
447594,说说吧，今晚公告啥?,-99
3869746,规律：交建一出利好就砸盘,-99
2687166,无量佛祖，可以听着故事洗洗睡吧！等两年再来！,-99
5222891,一哥：6月行情走势揭秘+明日止跌反弹点位揭晓！,-99
5449897,为你降半旗,-99
1125888,国栋集团对正原说:兄弟，户口己转让了，你想怎,-99
331556,卖卖卖，不卖的看谁是sb,-99
44742,都是庄家每天刀割散户的游戏,-99
3076133,散户太多，机构不可能拉,-99
282140,什么时候分红,-99
3224147,这么傻逼的股票都有，贱,-99
2026516,600602:云赛智联发行股份及支付现金购买资产报,-99
301094,2017年，牛市酝酿期，应该走N,-99
5168198,呵呵，跌破18有人抄底，大家别担心了。拿好手中,-99
2202753,请怀疑请伤害请相忘于江湖[心碎][心碎] 一夜之,-99
2879364,龙头[拜神],-99
4230418,列车以长鸣 火车就要启动 大家坐好车呀,-99
1509156,落后沪指数二百个点，快来买买买,-99
2729483,不明白鲁银投资早该退市还赖在股市害人,-99
2598906,4.19复盘：明日反击时刻到来 雄安概念第二波炒f,-99
2087549,智者忍耐吃肉，庸者心急割肉！,-99
5210467,大势已去亦。,-99
2010737,河北石家庄网友等一群业务员 历史与现在……,-99
3329197,600990:四创电子独立董事候选人声明(潘立生),-99
2867151,600819:耀皮玻璃募集资金存放与实际使用情况的,-99
272052,",的庄有对倒做大盘成交量可能性吗？",-99
82261,社保和保险在买，谁在卖哩？。,-99
2819529,还是雅克好啊！,-99
3758527,有筹码的现快高抛，收盘前会再探今日低点附近的,-99
3526277,3.88收盘，3.30私有化唯一原因私有化参与者是巴,-99
2795950,卖股还钱，你懂的。,-99
915429,压住，不要涨，等我配资马上到位了，跌最好，打,-99
4841187,贵人鸟，今天涨停，其它不多说,-99
3346318,要骂，才会垃[大便],-99
4669117,傲农是养蜗牛的。。。,-99
3465396,继续,-99
3405152,这可了不得！“5年内，太阳能发电的成本还会再,-99
4764207,此股属于什么板块？,-99
5016881,"药股指数000121大涨,603658还不动?",-99
4616166,6元多公积金 这也太烂了,-99
829631,谁能回答出来,-99
4505115,我的割掉了，53.88，垃圾股票，20元见,-99
3942947,厉害了资金进股价跌,-99
2782855,超配中国核,-99
906800,拿1.7亿说事。,-99
92542,建设银行：上半年净利1383亿元 同比增长3.69%。,-99
3087573,洛阳玻璃12月18日高台跳水,-99
4633834,不管什么股，只要我买必然会跌，所以我准备拿到,-99
2505194,谁填单卖给谁，不怕死的来试试。,-99
2793322,那叫白菜的能不消停一下，每次一见你就会跌[哭],-99
2756836,资金跑去京投发展啦？这是个假龙头？,-99
2528750,姑的帖仅作为交易记录，不构成买卖依据。姑有一,-99
1081091,任何技术与基本面分析其实都离不开概率,-99
2619206,浪潮散去哪能发表言伦？,-99
3015080,徐翔罪有应得  步她后尘的 终究有天会偿还一切,-99
767289,知道海航为什么涨不起来吗！那是因为我还在持有,-99
5267589,今天河钢股份做钢铁行,-99
1974769,跳空那么大的缺口，量也不多，等个回补开始建仓,-99
5052779,都散了吧，明天开始回调了,-99
2686377,所有的打砸就为骗抢小散带血的筹码！对不起，主,-99
3172481,主力还用我给你加油吗，你这样没有自信不敢拉升,-99
732040,医药股中的奇葩，洗洗睡吧！,-99
832386,表33\u3000SP&L的结构（以百万美元为单位）,-99
4248723,前海人寿从格力电器择机退出这是前海人寿的损失,-99
362394,低调持仓东,-99
4636339,会托盘了,-99
615591,成功的关键在于我们对失败的反应。,-99
247888,630,-99
444665,戒贪必胜 大盘每日收盘后跟踪分析总结 2017-04-,-99
5124022,买了。,-99
697102,医药白马股龙头，生物股份，牛逼,-99
5069656,环保PPP项目持续落地，智慧环卫不断升级,-99
5489466,今天买入，尼玛…,-99
5033590,70.3买入500股[微笑],-99
2761004,错过漂亮50的人不要错过600067,-99
2363261,IPO审核趋严 部分上市公司或仍有“病”在身。,-99
33612,提前通知一天:周四又是煤炭板块大跌的日子！！,-99
2650466,通策医疗：再次调整2016年利润分配方案 拟10派1,-99
888174,每次放量都是转折[鼓掌][鼓掌][鼓掌],-99
3393363,全网首发！000882华联股份[买入],-99
4450810,江山大棺,-99
1917054,庄家典型欺骗诱多清仓胜利大逃亡了等待大跌！,-99
