,content,mark
2665521,ST运盛股东挪用合拍贷资金高位套现，坐等退市！,-99
3514432,不长分红东,-99
5087799,快卖，等一下我10000手挂跌停卖,-99
753327,开始打压了，出货开始,-99
1644330,无所谓东继,-99
4329884,中央4?套报道自贸港新闻了，上涨可期！,-99
743862,中国首个商用量子通信网络8月底启用 相关受益股,-99
4934987,两天亏20个点,-99
303157,今天公告的意思看懂了没,-99
4800240,天津河北签署推进雄安新区建设战略合作协议 证,-99
5549869,开盘是涨是跌，关键看停牌的这几天几家主力机构,-99
2802015,你丫比是创业板吗,-99
5161734,低开低走，看3195.明天收阴，今天放量，诱多，,-99
3357627,狂笑 狂笑 瞎子狂笑 连续4年业绩翻倍，三年利润,-99
4595368,这个现世的主力，砸了又怕丢筹码，拉了又怕套牢,-99
1171685,最差股长春然气，,-99
2812154,还有一跌!，关注中小盘。高成长业绩股!,-99
3313131,市场逐步企稳,-99
1051633,顺周期的资源股回落、逆周期品种上涨,-99
2836442,冠农 。光芒绽放！,-99
2715234,大家不要说了，都是我的错，我不该天天唱多,-99
2784080,蓄势待发 upupup,-99
4990486,明天高开冲击涨停[微笑][微笑],-99
4623273,温水煮青蛙，这只垃圾股阴跌不止，俺很想跌到15,-99
2599140,更健康,-99
4305333,庆贺期货现货大涨。,-99
101429,6元都站不上，15元不是忽悠是什么？,-99
3849698,看图说话，看不懂的我也帮不到你了，在股吧里有,-99
810307,好久没有来了，你们还好吗，金鹰真心不能碰，不,-99
4113259,星期一估计会来个加速下跌，希望直接来个跳空低,-99
3381225,十万亿中国铁路资产的一面旗帜=大秦铁路！,-99
4351850,科大智能长线的合理价是50元以上 坚定持有和买,-99
3254110,拼命砸,-99
5025861,.信雅达是中国A股含金量最高的金融壳资源重组股,-99
1977566,谢谢主力，解套走人了[拜神][拜神],-99
2409261,根据公司互动平台公告 九千万买断计提在半年报,-99
1179981,敢上3100点，整死你。,-99
638430,今天为什么涨？。,-99
895347,具体来看，业绩预增约不不不家，业绩预减约,-99
5184565,"一问董事会大股东： 公司目前总股本20,000万股",-99
1451195,小单拉，大单出，太无耻,-99
2552469,午评：A股处在这个时间窗口内,-99
2466946,天津港(600717)融资融券信息(11-02),-99
3182675,每天开盘五分钟，收盘五分钟就完事了，其余时间,-99
3310929,小心崩盘,-99
3383561,轻仓，是对市场的尊重。,-99
5502672,准备好资金 明天21冲吧,-99
5243154,只有傻逼才在现在交出筹码 高抛低吸才是王道,-99
5062410,还剩2万多，买到了8手,-99
1647072,精工股票开县45度角下滑进地狱,-99
835086,你今天买了,-99
661605,市盈率5，6倍，跌破净资的银行股很多，大家随便,-99
4167074,此股散户太多，有利润都没卖，所以这次股人实能,-99
5419750,603918 金桥信息 勿追高 必须止盈！,-99
5045508,卫信康12月1日火箭发射,-99
1962611,高处不胜寒是何等凄凉！珍爱生命，远离此烂股！,-99
1983479,中金所2月共处理82起异常交易行为,-99
3250763,希望该股以后能冲击一把7块多的高点[拜神][拜神,-99
4272667,股市要大涨？,-99
3663114,等半年报，379亿，每股业绩增加1分，果然最垃圾,-99
5276742,笑眯眯的翻倍股 晨鸣 季报隐藏业绩核弹！实际每,-99
2078186,须白皱深的时候,-99
301392,海天酱油《我是未来》原力觉醒,-99
2213600,继续出货，一次卖1股可以不,-99
120020,下星期必定会有惊喜！期待中…………,-99
4498555,散户必知,-99
598738,我说了这垃圾诱多嘛，还好卖了。散户兄弟快跑，,-99
3491030,一个月的神经病又来了,-99
4795574,小散有几个会割肉的，都在虎视眈眈的等着吃肉，,-99
4655602,真霉，一买就遇上抛售，多等一分钟都好。,-99
4320607,38   38  智力开发,-99
3623402,恒逸石化真强,-99
4914047,最少恒盘两个月,-99
2945453,下午我的1.73亿将全面狙击。,-99
3435255,黑牛和华夏怎么了？,-99
188562,趋势已成 国投就是下个西水股份,-99
315964,连续六个月下跌！,-99
4724472,市场对公司的关注度很高，请公司尽快发布业绩预,-99
4935017,倒数第一，这股也是醉了，下杀意愿明显,-99
2120101,反弹开始了,-99
883114,看今天的量十有八九啦涨停[大笑][大笑][大笑],-99
1018331,下跌通道开启，10元以下见！,-99
3991328,换600481,-99
4642536,我讲个笑话。 此等高位高价。（术业有专攻：高,-99
51442,国安后卫李磊中场推人,-99
3255138,超级大傻逼股,-99
5375967,鸡肋行情延续，48元左右回来开仓！,-99
1013424,国务院决定2020年启动5G商用，这个对于亿阳信通,-99
1928028,哪天能涨一毛钱了，走出织布机行情，才有希望！,-99
4132763,一切都是刚刚开始,-99
2874605,家家有本难念的经那都是的不见兔子不撒鹰的,-99
668584,这还没算持有一千万的期货股权,-99
2102904,自己都不珍惜稀土做多环境，难怪美日白菜价就买,-99
4622023,涨停[大笑][大笑][大笑],-99
5308428,不破20 不会涨,-99
4268583,看看青龙管业！霸气威武,-99
3750482,怎么唱空都没用，爷爷就买了半仓，爱咋咋的！,-99
4898676,抬拉股价等,-99
1460720,挑战年线了，借大盘调整一下很正常,-99
45712,抓o时g买！,-99
4137606,今天跌 明天涨,-99
4137699,大盘要3000点这天鹅还不到15,-99
2133905,上海股适合干一下就走，不可久留,-99
992149,沪指创了近一年的新高，浦东建设迎着自由贸易港,-99
3652573,中国平安 国家队借大宗交易跑货1000万股,-99
4379024,想把十二年前茅台换成,-99
910898,这辈子我就喜欢这几件事：一 爱 二 艺术 三 国,-99
2938099,A股新涌举牌潮，该板块何时秀肌肉？,-99
419456,每天大资金流出几千万，持续7天，不想说是出货,-99
3739814,恒指累涨点 银行股获资金介入,-99
136016,见过拉高出货，没见过打压出货，庄到底想干什么,-99
580635,跌一点跌停。四你高管四全家！几无屎眼,-99
3709207,多空方展开捕鱼,-99
4375603,这庄在干嘛,-99
2290152,卖了百股，伤心离开！。,-99
2425306,6月22日,-99
1492252,你家儿子收好尸了啊，通威庄家,-99
2406732,拉停，我的庄,-99
4457992,快要起来了,-99
4633307,龙鸣能才你,-99
2636849, 兵工科技 兵工科技杂志社官方帐号 军事问答专,-99
1270608,慧眼避开僵尸股的44条秘诀！,-99
1098581,国联水产预计上半年 继续拉，你只要别掉头,-99
3377121,主力意思就是跟随大盘指数波动，慢慢磨601003，,-99
4005339,海南矿业9月13日打开涨停,-99
547757,迎接价值成长的春天,-99
2249786,福耀到底是真金白银还是草包一个，只有中报才能,-99
1290312,如果真想上涨不会有上长影线，这是要下跌的信号,-99
2605810,谁知道600846同济科技八连阳了，而且振幅仅仅一,-99
3950691,还得横盘，30k横没做完，谢谢他的帮忙，各股才,-99
5424251,世运电路又再登产业大舞台， 珠江又涌大潮。  1,-99
2638020,投赞成票，早完早好，夜长梦多。大家看看000710,-99
1357313,复牌需要请示批准，停牌时候你咋任性不申请的,-99
5364143,董秘，你好，新华网是否用下跌修复估值，回到30,-99
4977231,不客气的说，现在骂的都是想一日游捞一笔就跑的,-99
611716,本周进入闪崩股、超跌。,-99
47453,其土地供应的进度明显快过去年同期,-99
2109030,600623:华谊集团第九届监事会第十二次会议决议,-99
1095693,炒股有去无,-99
1552151,剩下17分钟，想要破8元就快点。,-99
2459175,刚刚试盘上方抛压根本不大呀怎么就回落了呢,-99
5313839,恶心瘪叽的，觉得没希,-99
717937,老卒子说的不无道理，可理想不等于结果哟！别人,-99
1375479,然而只有爱,-99
4065126,别着急买，还会砸坑下来的,-99
1425670,难受不，呵呵，买股买这个的是脑残,-99
2176994,万业企业快重组了，拿好，高度高不可测,-99
4289190,许是由于方向，,-99
2783097,还有傻逼在卖出，现在是买入的机会。6元以下放,-99
1583766,完蛋了 十月份只有2单。,-99
3900587,3.74我接盘，看懂的跟上来,-99
2245095,所有老退股都已重建股吧，但利好只在三板吧这老,-99
459770,最熊的股叫我买上了，真,-99
1523430,全卖了,-99
2686092,开始冷水煮青蛙模式,-99
418458,跟着000906走[微笑][微笑],-99
3456658,中线炒股有哪些操作法则？,-99
2868252,感觉主力在对倒出货！,-99
3178969,甘肃发现３处罕见大型独立钪矿,-99
2689595,尴尬 高点 无人接盘 继续保持,-99
1734348,关于如何看待现在的文一科技,-99
4168095,"#无需扯淡,乐视网和前",-99
3598495,在哪看配号？,-99
3116372,现在是牛市还是熊市？？？怎么这么奇葩啊，大盘,-99
1696823,惨烈筑底 第一波反弹看上3300点[鉴彪股],-99
1345093,"股市T+1,实际上是单向的，利于机构庄家做空，捡",-99
504370,好垃圾，西仪龙头，还是追龙头去了,-99
930991,洛阳钼业逆市回近4% 穿十天线,-99
1088207,国海证券的分红就2639万！,-99
3299353,一汽夏利:关于重大事项停牌进展公告。,-99
4452007,你咋不学学人家雄塑科技？,-99
5506385,畜生王八蛋,-99
2479509,回撤确认后，本周开启新一轮上涨行情！,-99
3201163,谢谢，卖出小赚。,-99
3007771,今天股票又输了,-99
2491735,支撑大盘沿着年线企稳。,-99
3535660,28成本，睡觉半年！,-99
3318869,~~ 西部军工 股权转让 国企混改,-99
4040430,不要带股友机会是只会留给有准备的人,-99
483403,市场板块的轮动依然过快,-99
832941,皇氏集团吧002329:参与万达私有化龙头 早教第一,-99
1663130,有点想不通,-99
2482534,难道开个发布会也要停牌？,-99
3397283,高送转倒下了，次新股倒下了，下一个倒下的雄安,-99
13545,世间,-99
2420625,减持套现了现在发公告，妈妈的,-99
749411,明年的行情，今年没有业绩支撑，你们绩优股行情,-99
624632,几只不错的中小盘股,-99
1720567,方大集团进一步强化管理 方大集团进一步强化管,-99
4290469,要拉新高了  。立贴为证,-99
1802249,上市国企并购重组热情不减 四大领域或成下半年,-99
4202626,平鸟才6千万,-99
2261003,老老实实呆在华丽吧 不要整天想,-99
2327638,"调整下目标，12.5,才有反弹，呵呵，中线10元。",-99
2420571,国家队，你搞了一天，没涨反而跌了两分钱,-99
803558,吃了泻药继续下跌咯……！[滴汗],-99
332728,这点成交量也该休市了，不是限制散户炒股，请都,-99
2216311,2点 准时砸盘,-99
1291030,风雨过后是彩虹，坚守到底终胜利,-99
3680559,这名字不错，一直戴绿帽子，给你个赞[赞][赞],-99
