,content,mark
1026999,球共同繁荣。,-99
2138440,600350:山东高速:山东高速济南投资建设有限公司,-99
3037064,典型的恶意压盘的股票。其实就为配合公司的发债,-99
2078531,您好东公司,-99
4405923,抢票，公司有利好，我是金牌的经销,-99
1872038,放量9.15就会启动！,-99
2031233,回调10%了，呵呵，短线客追高没走的基本上5%---,-99
4020040,0.01可以玩一天，真牛逼。,-99
3144218,放量冲过10日均线才有反弹，我不希望停牌。这股,-99
2857799,隔夜外盘：欧美股市双双大涨 道指再创新高加元,-99
3850164,看到群里各位大仙的吵闹，我想说,-99
2200965,外高桥好象机会来了,-99
1765718,小庄瞅准机会就甩卖！,-99
1135115,瀚蓝环境 二线蓝筹基本走过一轮 本周站上3200点,-99
1631508,9.92已挂单,-99
410436,*ST云网控制人无奈归来：再不回来公司就被抢走,-99
3047456,昨天10.11元买入了一万股今天坚决卖出去！,-99
4226898,可以买入了，差不多,-99
881922,凹地舌尖品感 [16股],-99
2099027,倒仓,-99
1197049,看看人家航天电子,-99
2188836,挂单 走起,-99
3161622,别上当！别上当！别上当！重要的事说三遍。,-99
1648647,完了，496变盘在即，下月开始,-99
4823214,今天最好3个点左右，明天拉涨停，元芳你怎么看,-99
4122639,ddd,-99
1610323,信威集团(600485)融资融券信息(12-23),-99
216947,使劲跌完了我好接货,-99
3854572,害人之心不可有，防人之心不可无,-99
1016275,暴涨意味着变天？只能先当超跌反弹来看！,-99
4645557,看看天鹅和名家汇你咋不去死,-99
1615928,佩服当年收藏比特币的人，,-99
305895,周一概念板块冰火两重天，作为一名小散该身在何,-99
3361505,机会？陷阱？,-99
3608295,根据任何容许的期限 ,-99
4056158,资金南向流入可以支持市场情绪，关注金融板块。,-99
5243784,太落后了！索菲亚又创新高了！我换股了,-99
1911229,我不看好这个股，诱多嫌疑太大了，一般来说，突,-99
3630643,看好山东钢铁600022: 理由: 一、三年多的建设新,-99
5055077,起飞,-99
4559510,这个月底还有利空，破口30可以少量参与,-99
786804,路过次吧，这里全是小散吧，都意淫这庄有多坏，,-99
2446010,纠结要不要加仓，还是等明天。。,-99
2637656,股神们，吃饱了吗，俺胆小，再等等 这么不要脸,-99
2514715,拉高者昌东,-99
1325570,等增量来，或者说等一个大资金来点火火箭发射 ,-99
4606988,垃圾卖了你就涨,-99
4526030,希望能中一签，否则回去无法跟江东父老交代啊！,-99
2239059,以不变应万变，不可错失良机,-99
624037,郁亮：伸手要钱是可耻,-99
3913911,狗日的大连，升一分现在天天跌，狗日的，整合成,-99
2731651,再放利空.就是不割肉.上10元就卖,-99
5260479,百合花为新航母涂装？,-99
1071686,3.9的市盈率，比银行都低，造假的吧,-99
1531397,指数跌了一个点 引发抛盘了,-99
1167546,白云山还可以，利好又出，可以看看太阳能,-99
1145118,通知,-99
3667355,今天有几多人逃了。,-99
3945428,这走势今天要涨停,-99
4773061,跌停吧！我好补仓！艹,-99
4637696,直接拉高,-99
75297,上海电力的控股装机容量从601万千瓦增长为936万,-99
1123561,垃圾堆企业振华重工必亡,-99
10126,而不是仅仅以人民的名义喊几声口号。,-99
4993201,炒股切勿心浮气躁,-99
1891213,请各位大爷解答（急求答案）,-99
3715152,601515:东风股份关于收购控股子公司广东鑫瑞新,-99
31494,没有庙堂气也没有英雄气,-99
4746369,上证指数连续四阳收涨 再回3100点 贵州茅台又创,-99
1202161,有能耐继续砸…,-99
2635478,这主力心里太阴暗了，估计童年有阴影,-99
5225593,如果雄安大面积分布式光伏，则福斯特可能6涨停,-99
1652385,证券代码：600255,-99
4371888,科华控股:2014年年度报告,-99
1463429,现在看来股东因在十万以内了，从16.8万到十万以,-99
3116416,下周一个低开今天进的全军覆没,-99
1988863,看看这次能托的住不？？？,-99
5118840,为了晚上8家，毛毛们顶住了，收盘见红必须的。,-99
4963615,各位，冷静对待，这个股认为好的，你就拿着，不,-99
3029946,6月收官三大股指月线收阳 次新股板块表现抢眼,-99
2155652,半年报中 中油资本 投资收益 存在严重 隐瞒利润,-99
111004,600793是最无聊的庄 自娱自乐pic=,-99
47329,更不值得提倡,-99
1573759,美股8年牛市 最牛股票涨77倍,-99
3686808,挑战别人的话最好有团伙作案，这样更容易4000个,-99
5528226,强势股回落快速,-99
1891593,收三角要变盘了上下难测,-99
5480013,立昂技术已经回到新高了，唉怎么比,-99
1363763,这是zjh保护散户，一字停都没有几个走     ~掉,-99
5374769,自由卓，龟孙子你今天挣钱了吗.又亏钱了？打死,-99
3434744,京津冀人工智能与机器人产业高端会议在廊坊举行,-99
4673398,这票算不算是第一只跌破当日首发价的票。,-99
346082,未来的坑谁知道有多大呢,-99
1883346,快叫孙悟空搬叫兵,-99
3082610,兄弟们别买了，庄家在偷偷卖，别做接盘侠了。,-99
1057425,尾盘暴跌。,-99
1686985,偶尔调整一下也属于正常，哪有天天涨的股票,-99
2466399,线在价上是阻力，线在价下是支撑。,-99
1274496,这么明目张胆地,-99
3524028,新城控股：前11月累计合同销售金额1053亿元 同,-99
1489958,伴随着三四线地产销售阶段性见顶,-99
3239087,600962明日开拉，哈哈,-99
5298874,机构不会傻逼到低位出来好消息被你们买到的明显,-99
5390391,了一定成效，那么也还是,-99
5028641,没有比这垃圾更垃圾的了 有色涨 次新涨和他一点,-99
3284661,宜华生活(600978)融资融券信息(11-10),-99
2898407,本周破七元！拭目以待！！。,-99
1815366,市场将会围绕工业4.0概念再次雄起。你关注了吗,-99
951466,再等中线调整结束再买 这样虽然会浪费很多所谓,-99
4254062,各位清仓吧，6月再见 我已清仓，只剩莱世，大跌,-99
1520825,中小盘无业绩支撑个股风险会加剧释放,-99
3101112,妖股产生了z,-99
518650,要在一年内获得万元以上的月薪根本是不可能的,-99
1544112,九有能红，天理难容。,-99
1754344,看11.14能否支撑得住？,-99
287247,而周四的石墨,-99
2753131,坐等5.88到来，跌死2B发现价值被草,-99
3931073,压盘啊。不让涨啊,-99
88983,盘子大影响力就大，很可能把中国股市从熊市改变,-99
5308036,跌破你我我,-99
3230271,多头不死空头不止热烈庆祝中国股市破三[怒],-99
3344868,涨停能死吗？,-99
2766351,天台搭好了 跳吧,-99
3311060,「易选股」龙虎榜：众游资承接雷鸣科化，多机构,-99
5443721,吧里全是骗子垃圾人没事竞放屁烂庄股坚决不买,-99
1622057,牛将带领外军剿民,-99
1444887,星期一继续跌。,-99
5281548,小散最好空仓，看热闹，,-99
4912112,低估市值：西水股份 圣阳股份 冠城大通 卫光生,-99
2635117,老涨和仙人打架，把黑狗撕得一根毛也没有了。[,-99
815934,大浪淘沙我只佩服闺蜜,-99
3002120,买盘托单太明显，这是在出货的节奏？,-99
2536399,呵呵，增持已经挡不住下跌的趋势了,-99
3284400,垃圾,-99
384541,呵呵,-99
5095960,看来周五补仓是对的,-99
1197940,失去了理智,-99
3938038,跟随大盘跳水吧[不说了][不说了][不说了][不说,-99
3728085,只要是我卖了，都要追高买进，只要我买了，一定,-99
5291249,换手百分之20以上 又要上龙虎榜了,-99
882312,明天怎么走，预测！开盘涨停！v,-99
1208074,两天挣了16%牛逼吧从阳泉撤了一半出来就吃到肉,-99
1189099,确实可以从数字上给GDP做加法j。,-99
1878334,年报季报成长性高送转公司调整后成反弹急先锋（,-99
3246587,上海自贸,-99
1938908,今日最高点,-99
1208569,不知好运气会到什么时候。今年一直买资源股。跌,-99
4952783,真想割肉。,-99
3337193,"过滤杂音,后市沪指将向3300点挺进",-99
4179675,星期五看答案,-99
2916373,公司公告利好哄骗散户进来接盘，此下三流行为太,-99
551607,追高了啊！庄啊庄，快拉啊！我错了！,-99
661021,跳水了,-99
2609148,出殡了，14。20接涨停，没上灵车的快上车送你娘,-99
1402225,一休你 嘎嘎了 几百次？ 那么喜欢 嘎嘎  鸭子生,-99
1495870,有价无量，看跌。,-99
5296866,荣华科技上市目标价位66.8元,-99
5504705,涨不停，哈哈,-99
4213244,603066:音飞储存第二届董事会第十九次会议决议,-99
2772958,国电还有希望吗，还有救吗,-99
2669650,央企国有资本运营公司整体上市、并购重组、资产,-99
3842992,合特斯拉合作 已成定局   大涨哦,-99
5360083,元祖这狗东西为什么跌呀！谁能告诉我？,-99
358495,澳洲联储主席Lowe：危机并不在全球就业市场，问,-99
276409,20个涨停板是什么概念,-99
5548538,感觉还是有强力不好的预感,-99
3157921,旧梯加装，广州大城市，以租代售迎来房地产转机,-99
1559059,今天低开你敢抄底吗？哈哈,-99
1864371,35还能解套吗？请支招！谢谢！,-99
4658352,风萧萧兮易水寒，壮士一去兮不复返；探虎穴兮入,-99
3070139,A股三季报大数据 上市公司十宗“最”,-99
317552,上午放量突破3097 成交量半天达1786亿全天有400,-99
634048,赶紧上车东,-99
3301660,态度,-99
680906,一百亿的盘子装逼装得比一千亿的走得还恼火！随,-99
4620819,就知道它不是好东西/远离/最低从27一气跌到18元,-99
4739209,去吃零食,-99
928841,181股短期均线出现“死叉” 有你的股吗？,-99
4524152,603283:赛腾股份首次公开发行股票投资风险特别,-99
4419305,许小初，许旭东，替我问候你先人,-99
3851112,烦人又中签了...,-99
1490187,第一垃圾股，买入就没涨过,-99
4002190,行情演变还要依靠主力板块拉升,-99
3750971,一片白色恐怖！,-99
2861352,没有一个散户能从600818身上赚到钱，,-99
1711013,银行的走势,-99
2790181,1,-99
3690587,原等全国十余个,-99
2059442,大众交通正与特斯拉洽谈租车业务 2014-05-09 05,-99
3291481,9月红盘收官暗藏机会，10月这2类股或成主流热点,-99
1387796,虚假指数，看看个股跌的，比股灾还惨！,-99
210208,宁德时代即将上线，纯正的锂电池龙头，同属福建,-99
1716744,做了好几回了，感觉要起动了，这次不走了[大笑],-99
4736013,此股票10元见  啊哈哈哈哈哈[大笑][大笑][大笑],-99
3684585,平煤比山煤。,-99
1761972,大盘涨和你没关系，大盘跌也和你没关系，。,-99
4276324,不管怎么分化按着方法来总不会一直亏的,-99
3483722,苦海无边，回头是岸！,-99
4335140,春风动力的行业领头羊地位，很难被动摇!,-99
2258522,量价齐跌！回天乏术！。,-99
