,content,mark
4900218,技术没用，我让你们知,-99
4739400,英媒：中国成功试验首个量子通信网络 将令窃听,-99
3916312,希望你停牌，与营口港合并,-99
3083456,狗头托大神又来拉，大家列队欢迎。狗头说了该股,-99
5035324,短线可能再度回落整理 中期底部确认还需要时间,-99
5026139,买入买入买入，机会不是天天有的,-99
3668896,干你老师,-99
129528,融资盘继续大买，明天起涨，唱空的亮出卖单来。,-99
1901900,看情况没什么形势，盈利赶紧撤，低位再次买进,-99
2085243,周一发新股 下午怎能不放红,-99
3243132,已经严重破位，这个股已经被扭曲，大幅落后各个,-99
3696615,云铝股份又一个板，它能涨才怪,-99
1145583,:45亿全流通，大股东持46点多，谁来了都要盘着,-99
2039385,快拉呀，看还能搞进去几个散户？哈哈,-99
1923780,俞发翔你9块进来好玩吗，为什么一点不关心股价,-99
1493496,后市猜想及应对,-99
4542745,满仓干,-99
2293318,东阳光科两三个月必有临时股东大会，10月份没开,-99
3925116,墓墙业务萧条，江河每况日下呵,-99
88911,涨到明年一月份,-99
1223388,这差距也太大了！可别忽悠了！,-99
3560936,等新股停发呀A那时再,-99
7954,大盘,-99
2763573,怎么看3180都想是假突破q,-99
3389387,这垃圾还在。,-99
2498062,为啥这垃圾不跌停啊，快快跌停吧。,-99
5268651,养老金概念  石墨烯锂电池概念  不要后知后觉,-99
5183757,不要奢望在股市发家，都醒醒吧,-99
626951,死股了s,-99
4366630,没想想这么大的利好庄家都是以出货为主，为啥?,-99
2109376,看得想睡觉[摊手]好闷,-99
5531495,这股最近打压 估计是o社保金进场 苦了咱小散,-99
5241729,散户同胎们，撤出老顾家，买入皮阿诺,-99
3188582,600908:无锡银行关于股东解除部份股份质押的公,-99
4674569,垃圾中的战斗机，居然还有人在买入,-99
4488506,明天加仓,-99
4426018,603189:网达软件关于修订《公司章程》的公告,-99
5011917,呵呵，假如中报业绩预增，成长率高的话，将开启,-99
5190971,我以亏的骂人的力气都]了、丧尽天良的企业、不,-99
2947516,不象话老是跌的,-99
5423529,明天新天要护盘，涨回,-99
3240894,怎么看也是该涨的啦。,-99
3659603,这是第三天了，还再跌跌跌,-99
2747907,：捂股，挂,-99
2259923,低吸高抛，,-99
1902820,哎，跌倒我已经没脾气了,-99
426272,天天尾盘拉一下 第二天又跌的,-99
449643,庄股，看大连电池。,-99
4653093,狗庄，日你祖宗，你还不拉更待何时,-99
4927942,洒家吃肉，可别忘记让你的庄爹砸盘啊！低价筹码,-99
3932322,大户要出货,-99
1101908,小盘央企超跌：必有报复性反弹,-99
1785813,炒股跌到心痛的那次经历l,-99
292393,明天高开5个点以上。,-99
2158232,此股完全是一死猪，并且还是得了瘟症的死猪,-99
2160650,加速IPO与股市下跌没有直接的关系。,-99
3182122,谁解释下，三峡新能源有限公司与长电同属于三峡,-99
976025,2:30后两波拉升\t,-99
4958797,此股会跌破二十元，等破了在买点玩玩[大笑],-99
847484,全球顶级抗癌药，中国拥有自主研发产权,-99
4522142,今天说长的都是托，次新明显没人气，被打压了，,-99
2758948,上证综指先抑后扬，创业板总体处在调整过程中。,-99
2746830,今日午盘：个股闪崩再现 大盘震荡下跌.%,-99
410976,过节啦，大家都来说说卫星吧,-99
5460775,快跌停快跌停快跌停快跌停快跌停快跌停快跌停快,-99
2961839,深扒券商资产管理“潜规则”！,-99
5107770,今天就说了一手不能买，明天继续暴跌不割肉都是,-99
5199988,阳痿股了,-99
5185809,大盘升，没它事，中小创升，没它事，雄安升，没,-99
4255279,估计明天再添一兵,-99
1139874,看看泰禾你他马的还趴着,-99
1896953,又跌回去了9块下方，回踩确认吗？,-99
4697721,乐视品牌受损，乐视网,-99
3585666,阴干走势,-99
4065428,买了的玩玩，今天应该阳十字星,-99
5065270,有没有哪个大神是八位数中签的啊，出来显一下，,-99
4104744,你的对手是谁，是庄家？是机构？我们最大的敌人,-99
5120419,今天为什么不涨停?,-99
3327473,四创电子已经发生了质的变化,-99
1334735,难道真的带走了，还有30点下跌空间。,-99
1024012,此类股主力资金暗中流入，有望暴涨迎来新轮涨停,-99
5238765,xxx期间没有游资敢操作，所以，投机的股票没戏,-99
1359257,一是基于但由于业绩下滑,-99
2956774,尾盘拉升，惯用伎俩。。,-99
4072709,从未过度使用杠杆融资。,-99
5089858,不要追高，有人让我买了。,-99
2109405,今天氯碱发业绩，业绩大幅增长，明天就是你华谊,-99
4761082,勘设股份被严重错杀目前市盈率偏低打压或卖出的,-99
5368746,13.5可以买点，毕竟不是亏损公司,-99
4063972,天海防务--业绩暴增，股价严重低估创业板军工。,-99
546578,主力出逃跌更猛，只是调整，假摔,-99
2136755,永辉超市，2017半年报营收:287.17亿元。,-99
4103173,今天是三只乌鸦的第一只,-99
2125632,垃圾，跟跌不跟涨，要套到天荒地老了,-99
2627134,黑色系商品期货延续夜盘大涨趋势，铁矿石、焦炭,-99
3597947,瀚蓝环境，环保股 城市污水和固废处理业务，在,-99
5032201,阴跌可怕，难道暴跌不可怕？估计马上要暴跌了,-99
149875,外两个市场、两种资源,-99
4496887,9日前一定跑。,-99
2207362,万通智控(300643)龙虎。,-99
2783563,四季度以中小盘成长股为代表的结构性行情在特殊,-99
5270910,今天清仓，明天跌停接回！\t,-99
1079962,今日收阴已成定局,-99
2100279,华鑫股份所有的涨停最后都会打回原位，周一卖之,-99
3419122,有望进一步有较,-99
4713039,有央视背书,-99
3442861,庄家噢，我草尼玛噢，说好今天要大涨噢，骗我满,-99
746906,祖国江山一片红,-99
21094,才23亿！,-99
1314170,几个店长都很称职,-99
3765294,为什么说上药集团值1300亿，股票还有一倍空间,-99
1604561,大盘不行了，先跑吧,-99
223199,贺宛男：A股“入摩”可能引发三大巨变,-99
1090043,操！,-99
442527,看看 深市  次新股  连续一字涨停  的,-99
3848430,就知道你会上的[大笑],-99
5332225,解禁股不是原始解禁股就好，是机构和个人，能数,-99
4454310,放量上涨，乘大盘下跌刚好吸筹。此股已从最低价,-99
5441889,没量随大盘下周继续跌,-99
2708756,可是谁又考虑过持股投资者的感受,-99
3280076,每下一个台阶抄一次。不赚钱我给,-99
1344706,光是银隆的百分之三的股份就不止这点市值，况且,-99
1398286,看多你就买，真看空你就卖了滚！ 直接点，别拐,-99
2064164,准备为自己的资金管理支付费用的投资者 ,-99
184787,按现在走势海信前景肯定会很好,-99
5041900,以后再不买次新股，都是来讨钱的，没有他马德干,-99
2363894,阳煤化工，到了位置了。,-99
3879946,在这个时候刻意的拉升大盘股打压中小盘,-99
4610108,本周还要跌破前期低点d,-99
2235905,祁连山的目标价位是新高后涨80%即28元。,-99
4009750,七个中国核电也抵不上一个贵州茅台？？？？,-99
368666,数十家公司停牌“躲灾” 中小投资者成为代罪羔,-99
2388928,短期是起不来的明年再看,-99
4581103,浙江东方市政园林工程有限公司（现更名为浙江诚,-99
2146133,明天涨一个点,-99
1806412,底部放量，有大资金进场，先量后价！,-99
3067363,如厦华财务造假可经济索赔,-99
1677163,"华丽家族 ,今天压力位 7.43 ,支撑位 7.25 ",-99
614188,000916 金针探底反弹超预期，此时散户一定进场,-99
2640201,打新,-99
1894256,拼命发研报套人,-99
4303886,我是庄家今天就该高开的，打得小散晕头转向！,-99
830230,三是基于盘活非生产性房产、提高资产运营效率的,-99
331962,畜生广州发展，狗日的,-99
3917725,一些傻逼昨天不卖今天卖[兴奋],-99
5463730,跌破发行价了！[赞],-99
232906,[图片],-99
2882841,盘面目前仍处于弱势不是做股的好时机需要耐,-99
5372784,挂单护盘的朋友把截图晒出来，大家众志成城，没,-99
3711815,其累计量必然仍旧等于流通盘。,-99
3721027,江淮上半年净利大跌4成 3.5亿净利有三成来自补,-99
1980267,庄家已逃路，快跑,-99
3892683,中石油不据备上涨条件，今天还是下来,-99
1811332,[大笑][大笑][大笑],-99
3034348,收盘关注13.18元价位 后市操作要据此展开,-99
3899378,谁TMD这么清闲，一手一手的玩?,-99
1456276,大家不要怕我成本这么高都是很淡定,-99
3735355,九牧王/是一支完全被错的好股票，拭目以待吧！,-99
2349387,垃圾刚泰最低价收盘开始了漫漫熊途，反弹必须出,-99
4256511,你们继续,-99
2230711,今天要7.1。,-99
4477034,哈哈！同一天上市的道恩股份又要涨停了，你怎么,-99
2494944,普涨格局后行情该如何演变？,-99
872132,它至少存在这样三大短板k,-99
5510047,看来庄要在低位补足前期砸盘损失的筹码很艰难啊,-99
1928447,大家预测一下精达三季度的业绩,-99
4589720,今天大单诱多买进，明天跌停,-99
2709134,一带一路国家战略9元股价比ST还便宜。[微笑],-99
411656,午后放卫星了，咬定青山！,-99
4031641,广西人不会真没钱吧……,-99
2720083,出售空闲的或投资性的非生产性房产,-99
137063,盘口语言表达了什么？[微笑],-99
829332,狗B养的，天天就知道压盘砸盘,-99
3556513,跌得你妈都不认得你，不是我要说，是TMD自己在,-99
3525935,卖70亿新城发展，要买回多少新城A股？,-99
847157,我来了，等你慢慢讲故事,-99
4846245,中签的路过.恶,-99
1673733,666 好兆头[鼓掌][鼓掌][鼓掌],-99
695808,还是很热闹,-99
3061822,西部涨停n,-99
1804153,准备将山西股从股票软件里面全部删除,-99
4739871,2600点，脑壳喊：任何上涨都是为了更好的下跌。,-99
2137303,我们悟透股市亏损的真相了吗 ？。,-99
4470711,大家都去看环保了，谁会来接盘一个没有消息没有,-99
2249168,不甘心啊，福耀玻璃30%的利润，不到一个月亏完,-99
3030492,12.39元买了4万股，不到17元不卖,-99
1173100,流通股只有1亿8千多万！15倍市盈率！还是融资融,-99
1913951,喝牛奶比好白酒好，换成伊利或燕京啤酒。,-99
1494015,哈哈哈哈哈哈哈哈哈哈哈哈。。。让你们买。。。,-99
1431874,湘电股份(600416)融资融券信息(12-19),-99
235218,开始自导自演模式,-99
2903407,今天量真大呀!,-99
1190347,拉升下套套[大笑][大笑][大笑][大笑][大笑],-99
3812648,事庭急死人,-99
2786963,新举牌概念股龙头：银座股份600858绩优低价小盘,-99
59164,放宽外资买金融企业，洋人开银行不如买银行。,-99
2118093,9.7，前期预判第一目标价到了，之前喷我的人在,-99
1413270,补跌、哈哈哈,-99
1504304,锁仓。。什么时候回本什么时候再看。,-99
3417646,6块是支撑点了，破了就跑,-99
