,content,mark
4224470,老子服了！,-99
2645703,涨停，消息潜力股,-99
3326341,改名字吧!改了就能飞了(赤峰水泥),-99
2563859,控股权争夺新戏码频上演,-99
2264193,快跑吧！主力再跑。,-99
1440049,套牢了，60的本啊！,-99
1848069,一塌糊涂a,-99
3729408,每天跌点，真要完了,-99
4347645,一只炒作股而已，业绩不行，大势必落，短线机会,-99
2941380,又是七万压单[加油][加油][加油][加油][加油]。,-99
3881212,000,-99
3568684,这股16个月只有二个月涨的,-99
2732268,快点下去吧,-99
2929104,中泰业绩稳定大涨 多年尚未配送 今年有望如愿,-99
5173020,必有猫腻啊 ！,-99
3130881,快跑，不跑没机会了,-99
402900,刘开运放大,-99
943698,美国非农数据表现强劲 美联储本周料将再次加息,-99
5310960,52到41，套死无数人，加上没有任何利好，反而是,-99
4952778,坚持坚信，拿到三季报,-99
174974,这个是癌股中的癌股,-99
1608658,无奈遇到了福（无）能，达到理想不容易呀！！,-99
4203043,明天涨停,-99
232851,放量突破就空翻多了,-99
1626952,事实证明，不是空头快完了，而是空头还掌控着一,-99
4290802,5点以上！,-99
919399,好股路桥建设，我们30元见,-99
3826638,大盘涨这货阴跌，大盘小跌这货大跌，大盘急跌这,-99
4958179,周五埋伏，现在出清，落袋，！周四季报，周五减,-99
1532133,恒生指数涨1.04%，报27955.13点,-99
2380160,600695涨的还可以，但是其B股走势差劲。拖了他,-99
3236724,",的庄有对倒做大盘成交量可能性吗？",-99
4739808,没人了吗 都被洗掉了？,-99
705937,下跌做前锋，上涨就成守门员。垃圾！,-99
1432634,下午前往临潼参观秦始皇兵马俑，看到了威风凛凛,-99
4261018,宏盛必须胜利,-99
2017801,追求所谓的价值投资，就啤酒股不涨我也没哲，但,-99
3048713,星星坠落湖底，小命困在广新！,-99
2530751,600733:S*ST前锋关于涉及证券虚假陈述责任纠纷,-99
4164928,好股要坚守！,-99
457287,染柳烟浓,-99
4475051,下午会大涨吗。大盘新高出来了。有点担心呀,-99
779323,公司担保金以达63亿,-99
5141027,现在是不是大单拉着，小单偷偷的出？,-99
4513243,卧槽，31.99全仓买入，什么情况[大笑][大笑][大,-99
842839,庄家太坏！,-99
941365,根本没抵抗力么,-99
4492125,一张褪色的照片,-99
1798999,你入伙了华大，有个毛用,-99
4957306,狗庄天天做T，真够有耐心的,-99
5323797,51.51卖出 收盘还有最低点头部特征明显,-99
289230,[成交][成交][成交][成交][成交][成交][成交][\t,-99
84278,今年月日累,-99
616223,期待粤港澳大湾区概念绿色环保概念腾空出世！像,-99
3751699,你们这帮高管食饱无事做吗！小心有报应,-99
1181695,管东从今天,-99
3828594,注意潞安利用神华冲五浪大顶,-99
3230872,启明之星看涨,-99
4361620,老外打一巴掌 要跳起来了！,-99
277792,怎么还没有动静？！我都买了国安了准备等着一起,-99
5016126,周线已四连阴了，极度缩量，难道庄家的货还没出,-99
1447820,下午一点要起飞了！,-99
2496008,石油化工行业周报:关注PDH和涤纶盈利改善,-99
4057392,走势稳了东,-99
4630997,这股有个问题。中报下周一就出了，但是中报预披,-99
3596875,有回光返照,-99
3578460,由于自身资金来源少，筹资渠,-99
3906989,请问贵公司，《天乩之白蛇传说》《秋蝉》《天下,-99
767085,接近一倍的市净率，还有一块多的公积金，加上将,-99
2316775,三碗不过9.5！。,-99
4489871,不见千手买单，绝不买入。,-99
2922008,一翘四金叉,-99
4637004,天汽模：这票看这形式，抄底如何？\t,-99
4930457,要跌停板了！走了！,-99
1845359,排排坐 分果果。还有数周 3千多家上市公司的“\t,-99
4360876,什么鬼，,-99
1338001,提醒猪力：股票是用来炒的！不是用来住的！,-99
1128102,今天什么时候一射？,-99
1547527,这是央企吗,-99
3029374,外人对他们的误解只是因为大家做事情的方法不同,-99
2826279,日你妈往死跌,-99
3389675,请问当前股东户数是多少？,-99
5381598,大盘涨，它跌！什么意思？主力出货吗？,-99
2627172,这帮Y呵的精拿没用的说事，老夫保证今天一根大,-99
1062795,感觉华泰放弃曙光了,-99
4398964,什么情况，虫子翻身？抖了一下？,-99
943088,外运发展(600270)融资融券信息(08-02),-99
1244554,剁手节，英擎投资带你看大盘，把手挣回来！,-99
1820529,股指期货做空的。非跳楼不可,-99
3442587,准备翻绿绿绿绿,-99
55209,前期平台才有支！国家队做庄？,-99
4024700,审你MB帖!,-99
683182,频频接罚单 多家上市公,-99
2961239,明天股东大会不会有什么结果的，丹化集团会编故,-99
5038346,我在11.70那儿守猪逮兔,-99
4643057,#敢长持股,-99
3057299,平盘或者上涨1分吗,-99
1921494,尤其喜欢古诗词,-99
864279,多家轮胎企业价格上涨 相关概念股可关注,-99
1879976,高位放量杀跌，破位下行！小散应抢跑道火速离场,-99
4413514,哈哈又来了老样子,-99
606053,国家荣耀，维护祖国尊严，从我做起,-99
3254602,金戈铁马，雄风万里，中国装甲震撼亮相内蒙演兵,-99
146101,联通打回原形了，混改龙头,-99
5047292,下星期新股7家，次新股卫信康有戏唱了。,-99
3964475,套得像条狗！,-99
313106,“适当性”管理 能保护,-99
1344523,今晚大利空，证监会问询函将引爆大跌，直奔10元,-99
5418548,快退市了吗？,-99
3873492,今天保持这交易量，可能会接近历史最低成交,-99
4103196,股性太死，无主力状态。,-99
940408,热烈祝贺跟我做的全部在11.95以上清仓了跌破十,-99
894252,流出翻倍。,-99
3565246,沪指指数站稳3100点,-99
3346011,次新股中还有比贵广网络更好的投资标的吗？请珍,-99
1208032,主力尾盘拉高诱多做图形.注意,-99
1118721,头肩底还是W底？,-99
5111390,烂货去创新低！,-99
697312,筹码完全靠骗，下周只管坐收渔利[大笑]。,-99
254396,澄星股份(600078)融资融券信息(08-15),-99
1962112,海螺,-99
611523,周一继续探底……,-99
5447004,大盘疲软的时候再来,-99
4915274,继续探底，需要回避,-99
1649336,准备好，开拉了。哈哈哈哈,-99
1202129,湖北板块大跌,-99
4022728,挂单都是几千手，实时成交都是几十手，真是大笑,-99
1256487,散留零!感谢奇虎和管理层，还好资金剩零头,-99
1314515,今天跌少了都不是我大唉股性格,-99
1864439,这股跌到31.47元左右止跌,-99
3303748,跌无止境呵呵,-99
3692887,艹你妈的，幸好昨天清仓逃过一劫了啊，不然死得,-99
3957207,新集没人玩了。这股吧的人好少。只有4条相信。,-99
652705,科技误国，钢铁煤炭兴邦,-99
3287210,大盘怎么涨，也和这垃圾没关系。雷打不动。,-99
1436839,北京新能源汽车产业协会网站被取消,-99
434955,海外三大不确定性落地之后看什么？,-99
37411,炒作时称“腾飞之翼”，出逃时砸盘春荩『卫醇,-99
3758015,咯咯咯咯咯 狂笑 瞎子狂笑 市值270亿 利润冲百,-99
3862,大金融转眼流神创,-99
1843443,这给吹嘘漂亮50带来不少的压力,-99
1263850,谁压的盘，这么恶心,-99
3440319,都卖了吧。,-99
1619430,哇，今天不至于跌停吧,-99
3188668,7.21是明天收盘价,-99
1485877,顺风控股股价达到高点时y,-99
913815,一条泥鳅你逃出来关注叁零零陆九玖。这个才是军,-99
1020456,涨冲新高没份，跌停到厉害！,-99
1977827,中国银行间市场7天质押式回购利率下跌6.82个基,-99
4735710,欢迎来两个跌停，欢迎爆仓,-99
1945152,8元，，，，卖,-99
5299958,东宏股份重大利好消息，下面策略已清晰！,-99
170899,期间巴菲特,-99
4291283,最近感觉总是踩错节奏啊，早上进的 润达医疗，,-99
436032,11元准时进场，明天100手进去投石问路！,-99
658330,把资金准备好了，遇到暴杀就入场扫货！,-99
4664898,黑暗前的黎明。八月将,-99
4454529,庄家是老油条,-99
2556187,辽宁成大(600739)融资融券信息(08-09),-99
2897374,原来是个无底洞哦,-99
1231412,横久必跌,-99
1139094,这个心电图看得心烦,-99
2721068,关注,-99
4571454,下周4开始起飞了,-99
2801449,大量出货中，明天堪忧,-99
5317553,股票的流通盘是固定的,-99
86892,低开，横线，20分钟鸡血，3分钱来去。,-99
4036185,今有某b3-3说,-99
4752679,建议:一，继续高送转，每10股送10股，另加现金,-99
2574837,洗的过分了吧！斗智斗勇的我，坐等结果！,-99
2174034,年报二元一股。明年是翻倍节奏了。赶紧上车,-99
706620,想知道此股目标价多少吗，留言发3个1我告诉你。,-99
1749264,49.32万股解禁，按现在的股价才850万都不到，前,-99
3759043,大家千万不要太乐观，一定要把握高抛机会，涨起,-99
3446482,自己玩吧，把散户都弄死,-99
1407728,ST郑煤600121六月份业绩大幅度增长，买进连续涨,-99
2676441,601858如期调整，有进的么？天天喊清源的不知道,-99
1113436,南宁人一走就涨停，我能,-99
2042920,600606:绿地控股2017年10月新增房地产项目情况,-99
2626316,昨天涨幅2000多今天1800多,-99
677951,到山顶了，下,-99
574677,招商银行，如果想稳妥，也只有这样了。,-99
4540174,不出意外，明后两天绝对要涨停,-99
5410194,建材行业启动雄安绿色建设选材工作 11-30 19:40,-99
2412942,科技一同上央视新闻系列报,-99
5392759,尾盘飙！,-99
1395600,你麻痹拉什么尾盘，爱咋咋地，反正都死了,-99
2226974,又不会退市！股价到这个份上，闭眼越低越买！,-99
2257749,我还剩8个月马上要到7月10日了。,-99
2860994,同样是次新股，元成股份鼓励员工拟增持自家股票,-99
33348,明天继续创新低。,-99
2108555,卖了江西铜业买你，不要让我失望啊[鼓掌][鼓掌],-99
772989,三是上市公司业绩的变脸,-99
3634345,瑞莱支持你看好你，拉个板别辜负了支持你的股民,-99
4322639,等雄安全部涨停大家再来抢你吧z,-99
4674072,我以注册公司打算上市，求指教要买通谁？,-99
3430698,资金还是紧张，注意风险,-99
3142104,融资融券账户怎样投票表决,-99
2476368,尼玛的，以为你会冲上去，想不到一直在这里不动,-99
3674526,绝对的拉高出货！大盘反弹结束准备暴跌！典型百,-99
