,content,mark
4162548,IPO已经被解读成了一个常规必要的市场行为，,-99
5289366,玩不过，耗不起..割了[心碎][心碎][哭][哭][哭],-99
3293342,不能灰心而是要奋然前进。e,-99
4335127,情况反转今天主力不休息？,-99
1446561,满仓抄了呆13庄的大底~！~看着局势推着呆13拉升,-99
4904990,【讨论】东尼电子公布中签率仅为0.026% 你能中,-99
1636310,三大原因看好七月份行情,-99
2391822,600698:湖南天雁2017年第一次临时股东大会会议,-99
2760991,依然是存量博弈，依然是A场天下第一庄说了算,-99
5490422,逐步上升,-99
4870206,满仓抄底即将进入拉升期,-99
3212764,各路砸盘即将到场 二次下跌即将到来,-99
2006376,他们竟跟董小姐对着干！白马家电股突遭甩卖为哪,-99
1104268,深万科及中国联通等大盘权重股的上涨,-99
2041774,改名v帽股份可能还有希望,-99
1878810,国睿科技(600562)大宗交易数据一览(06-13),-99
862843,庄说：下半年钱景一片光明。,-99
4373245,这价格 高送了 还卖的人，建议别炒股了，捡钱机,-99
3613417,上证逼近3300点（说的跟向上突破似的！）,-99
3067455,股市无奇不有要做最坏的打算,-99
5286371,问题股,-99
622057,瑞茂通买点来了，我捡漏了10手！希望明天有肉吃,-99
4443868,看看杰恩设计,-99
2812522,600805:悦达投资关于召开2017年第三次临时股东,-99
21779,中国技术科大讯飞飞的更高,-99
615347,看多安通控股年内至32!!,-99
3006668,这小年过的 真郁闷,-99
858653,二点半开始发神经病！,-99
3063848,我身边有1万2千多块钱,-99
3912713,看这个走势，明天继续下跌。,-99
3055155,A股魔咒出研报必跌，今天跌吗？,-99
3489531,怎么感觉这不是在华鼎吧，都在说别的。,-99
4699599,kdj即将高位死叉Amac,-99
4702516,第二个数学方法是“二八定律”。“二八定律”其,-99
546876,600159:大龙地产第七届董事会第九次会议决议公,-99
4059869,未来大盘的运行还能持续,-99
2533533,双底[大笑][大笑]。,-99
1717504,方大炭素建模拟实验高炉，深入研究高炉炭砖性能,-99
4856076,龙头大牛股也！未来两天必将逆市大涨！,-99
1755786,傻逼玩意,-99
4200495,没过均线不要买,-99
476673,还没腰斩 请君入瓮[大笑][大笑][大笑],-99
5390342,"今天这分时图走的，把日K周K月K,全走了一便，",-99
2319817,没量了，快跌吧，极限是跌穿24创新低就坚决止损,-99
3286690,下一步该吧,-99
2528770,翻倍不是问题，问题是翻几倍，虽然我没此股，希,-99
597920,盘口比我还狠说要跌一,-99
4099112,603017:中衡设计关于受让苏州工业园区苏优股权,-99
1299014,干吧，踏空,-99
3823362,动力电池出货量大增 业绩或超预期,-99
82178,狗杂种，今天又是跌一分,-99
3032604,一念之慈，是一切美好的开始；一念之恶，是一切,-99
47142,只买到一笔 竟然不跌了,-99
4199451,拉高出货,-99
4855682,操死你妈,-99
5174927,来点人气吧！看空看多都可以[想一下][好逊][好,-99
2778807,浙大网新三季报点评：业绩符合预期，人工智能业,-99
2585188,这破股就是在等深指跌[不屑],-99
1735153,多好的壳资源，30亿不到，360的榜样在前，文一,-99
3698444,5.69清仓了，拿了一个月进帐2.3万。,-99
2447916,你咋个不去屎,-99
608976,3个季度每股0.77元这样的股票不抱死你去买每股0,-99
5147277,此时选择朝下，就肯定这垃圾年内没戏了,-99
3778855,买买买买中冶601618，涨停十个也不高，踏空风险,-99
1678794,这股怎么与我以前玩的恒泰一样啊，天天利好天天,-99
4248641,创品牌基础工作有序展开,-99
926877,主力太可怕了，尾盘回调，追高毁一生，切记啊，,-99
3733523,黄国东：A股下半年预测 推荐中国重工,-99
4842619,两点表演,-99
2124525,阴阴世界阴世界,-99
2356456,受外围股市下跌影响哀股震荡向下的。,-99
2208693,大唐发电(601991)融资融券信息(08-31)。,-99
2163710,领创估计快有动作了,-99
3597418,已经很强了,-99
151932,种种迹象表明1年多的上涨将在3300点附近结束。,-99
1834939,二次拉升过前高,-99
2476521,这在卖房的上市公司中占据了较大的比例,-99
2018075,抄底！。,-99
3087206,指数跌的好，跌停没一个涨停40个跌5%不到10个,-99
3029701,新股不发？,-99
5451559,没量上涨！是不给认可的,-99
2506442,证券法草案或不会放行证券从业人员炒股 股权激,-99
3562013,令人遗憾的是,-99
577552,利好消息,-99
1315725,常常导致事先制定的操作计划未能严格执行。,-99
543874,中体教大家，什么是融卷，什么是做空。,-99
5430530,挂单护板，有中的都挂上，下次还中,-99
1286163,重磅消息：伊力特 华帝股份 冀东装备 北新路桥,-99
2040907,同是上海股.上海亚虹与汇通怎相差这么远?,-99
2579544,闻太全公司人屎玩,-99
3080969,这么低的换手率，自己玩的是不亦乐乎，呵呵呵,-99
2805406,恭喜，进入两市前十，都散了吧！,-99
2084723,这么好的股票.败成这样,-99
755027,现价不到5万股还没融资不怕与庄共舞[大笑],-99
5261281,看多。开盘给机会直接买入。,-99
950145,为什么不在上海以外的地方开店？,-99
2870854,不要买,-99
1894314,中国的股市业绩好与个股涨跌一毛钱关系都没有真,-99
4385494,关门了,-99
3384525,9.03的本30%仓位每跌0.1元买10%.,-99
3177587,快到6月底了，还未见增持公告。说话算话吗？,-99
1659062,年产10000吨电池级碳酸锂项目科达洁能,-99
2461132,这庄好玩，22.06封涨，22.03封跌,-99
3708766,真是买一个垃圾。,-99
3011115,刚看到涨，就甩跌[哭],-99
1209282,阳泉煤业两年来利润涨813%，股价涨0%,-99
1233516,后市走势同有争议的002899东方嘉盛!关于市盈率,-99
4015425,其实你可以问问全国所有大医院的医生，华大基因,-99
1614335,除草剂成业绩增长主力，麦草畏有望进一步带动下,-99
1120068,如果非要在十元横上的话那得三个月以上的。要是,-99
4744701,跟跌不跟涨说明还有很大的水分存在，真正有价值,-99
1291203,跌吧，痛快些！否极泰来,-99
4847303,哎！！！追高了22。77追入全仓,-99
3853839,大多数个股主力配合来了一个高抛。,-99
2356937,一名离职操盘手的忠告！ 据我所知，主力也会关,-99
2434757,有屁用呢,-99
1921205,哪个砸种死全价的大单卖,-99
4015340,全球资产规模最大的中国银行再度美国扩张 休斯,-99
3365903,601001:大同煤业关于续让同煤漳泽(上海)融资租,-99
4911574,耗了我那么多精力财力，不翻倍就赖你不走,-99
2403764,600278东方创业 明日早盘会拉高  都可以看看。,-99
5126750,请教一下，我在东财另外股吧发现一篇很好的文章,-99
739953,负债率94%，还负业绩。怎么不退市？？？,-99
2538178,16元能止跌就不错了。,-99
2580869,明天索普跌1个点，京东方涨6个点[胜利][胜利][,-99
3771517,垃圾中的战斗机,-99
2698459,上星期五不做t高点卖也解套，今天不做t高点卖也,-99
1854115,反弹只是因为连续下跌之后技术超跌与人心思涨的,-99
3784839,至少破5元[赚大了][牛][不屑],-99
702423,公司之前公告过国金天吉由原董事长姚文彬先生原,-99
1168479,南钢股份这庄葫芦里卖的什么药,-99
1576572,你妈的大单在下面什么意思。差几分钱,-99
1878889,所谓“牛市”，也称多头市场，指证券市场行情普,-99
4803946,进入套牢盘密集区，下跌就要开始了。。。,-99
429326,我只说：底部我知道，顶部我不知道,-99
3342368,最这有一条狗天天叫，真烦,-99
900210,去年玩退市博元，今年玩新都退，小散：我家县城,-99
3677913,都可能会成为你成功的障碍,-99
4458361,一涨涨一分    涨到你发疯 一跌跌一块    跌到,-99
1225283,AMLED手机\t。,-99
2885543,停盘吧，不要在跌了，益民要对得起散户啊！,-99
4014253,只有指数涨！没信心了！,-99
5094516,没熬住，17.8割了，亏了十个点,-99
4083557,连续11天净流出，看空清仓了，此股高成长业绩靓,-99
1398074,我要增持了，大家坐好！今天先增持100股。,-99
3996340,突破新高，回调介入。。。,-99
5522603,乐视高层无法直接联系贾跃亭 讨债者自掏腰包悬,-99
3858162,哪个SB在拼命抛盘？,-99
2133321,跳水咯,-99
3469145,好机会来了，准备进场！,-99
34159,注意了没，唱多的托今天没有顶帖,-99
3702557,已到8.72,-99
1171776,估计没戏，亏点减仓，MB,-99
3040414,没水平做股评，直觉而已，有汤喝就好。。,-99
932620,集团业务以传统百货业为基础，同时涉及金融、航,-99
1860825,国资委通过，意思就是说国家同意重组，你说重组,-99
432628,预计2017-2019 年公司归母净利为10.49/10.63/10,-99
1886546,恶心的一周，一周跌了2个月的，恶心,-99
1855843,商赢的董秘你们懂的，只会躺成个大字，配合董事,-99
4608453,黎明前的黑暗,-99
5239451,刺不刺激？你进来明天就跌停你走了明天就涨停。,-99
4609498,庄家阴险,-99
4763761,这是要涨停的节奏吗？,-99
4675870,早知道：阿里系与雄安新区签约建设“数字雄安”,-99
3510466,又拉尾盘明天不是又要黑周五了,-99
2621016,小心秒板,-99
3762659,上海医药15日早间公告，其下属全资子公司Shangh,-99
3176489,天天阴跌最可怕t,-99
41996,包钢股份（600010）现价：2.60元！目前A股沪深2,-99
3467410,无边的寒潮来袭,-99
1155003,这半年来除了面子上过得去，里子一塌糊涂，一片,-99
3404884,的,-99
3845578,[牛]挂万手撑单 明天还要继续砸。前几天就说了 ,-99
4375700,我先减个仓[俏皮],-99
1701067,构被构被,-99
1482475,这个股票是恶性肿瘤，病根是张强，告诉你是你把,-99
2382479,"今后的仙股(不是妖股)是多少,你知道吗?",-99
5353752,连续5周都是跌，这是要死了吗,-99
1210958,中报没继续亏损！利空出尽！现在的股价提前已显,-99
4189476,搞了那么久，等不了你的月饼上市了，丢……,-99
5524235,小把戏太多,-99
32785,股价受意欲低价定增的影响???,-99
309174,1,-99
2494772,重来没看富达的高管增持自家股票的，每年养这么,-99
1002581,20160829早评：市场依然疲软，上攻动能不足，仍,-99
1409186,山水之间，路路通O。,-99
4040933,融资融券板块，不是散户玩的对象。。。,-99
4593697,快拉狗庄,-99
689377,6.94等,-99
2360828,格力已经翻红，这货自己做死自己，没信任还创什,-99
4674011,水星净资产是多少？,-99
4658688,卖出的全是亏钱的.亏着往外卖，没有赚钱的,-99
1403627,老夫赌一把、今天分批加仓40万股！三个帐户共计,-99
2381015,好歹明天拉一拉啊，狗庄,-99
3696745,易对激进型资金。,-99
4392622,新年第二签，谢谢发红包,-99
2214950,大单买入不涨，中小单卖出则跌，这就是明显的出,-99
1497010,能冲上去吃了那个压盘的[加油][加油][加油][加,-99
1652491,没有000751厉害！换股！,-99
2158065,厦门银行ipo排队怎么样了。,-99
