,content,mark
1436809,阴逼不卖就痒，就会暴毙[大便],-99
4988705,我来告诉你小南的最终目标位,-99
4758128,我想来想去，没利好拉尾盘到底是为啥，不科学,-99
4670353,傲农生物(603363)龙虎榜数据(10-20),-99
2517021,突破26.25上方无压力，抢,-99
2612120,流浪的终点是猜疑和孤独  抱住不放的同情,-99
482648,破位了，你还留着吗？,-99
2267906,同志们，相信我，明天低开可以满仓抄老庄底，拿,-99
728927,明日强势拉升，注意止盈，观望的切勿追高,-99
336476,空调市场延续一季度增长势头,-99
4421653,整体表现也是弱势特征相当明显,-99
3967873,很多人总是埋怨没有成功的机会,-99
2641703,怎么还不分红,-99
3172937,谢谢，我卖出了，。,-99
1007645,9块以上别来接盘[大笑][大笑][大笑],-99
624004,中国中车 上半年订单金额同比倍增。,-99
1998942,一预备：跳！,-99
4884944,看样子大盘没的玩了，风格切换又回到小盘潜力白,-99
2586823,套了一次又一次。,-99
4800415,如何看待上市公司扎堆卖房以及卖房保壳？目前市,-99
5118905,多余的股权转为优先股,-99
1285764,傻逼估计套在11块的。,-99
2822119,妈的就这么任性，跌比人快涨比人慢。,-99
4195286,要破发了,-99
939119,只差一个跌停就爽了,-99
5363626,快讯：由于10.11日主力故意做盘，导致三日内涨,-99
4204635,阳伟了,-99
4735711,分时图显示指数依然没有达到强势做多的局面,-99
1344931,3666在找存在感 你是被老婆半夜赶下床 还是被,-99
980156,600310:桂东电力:内部控制审计报告。,-99
3273365,利好消息叠加q,-99
1465897,马前炮.平治信息 17年股价上260元 18年看450元,-99
4555889,这个股有麻烦，光周线，上周阴包阳放量#这周缩,-99
4550265,还有了,-99
4106639,长期看好的就管好手，多看少动吧！我一直坚定持,-99
212087,今天1,-99
1150136,应该让股市回归价值投资，绝大多数高估了！,-99
963593,恒瑞医药的噩梦，美国批准首个基因疗法 癌症治,-99
1630224,看看华友钴业，寒锐钴业,-99
2696523,今天百分百爆发，已满仓上车抢货,-99
1772156,大家坚持团结挂买单买星帅尔,-99
3630934,付总经理，咱这票什么时候能涨涨,-99
349573,青山明天又要跌了,-99
4492457,等翻,-99
1989402,几乎没有新增资金进场,-99
2486335,该割肉的人,-99
2435651,大数据产业十三五规划年内发布（附概念股）,-99
2680239,想钱想疯了，卖的比劲酒贵一倍,-99
77374,持股待涨的原因,-99
4374416,关键是不能有问题公司,-99
3897881,不服就继续跌。现在不需要啦大盘股。,-99
2207871,砸振华股份！,-99
130441,主力要想做一波红包行情必须将股价推上10月线。,-99
2171170,重大消息河钢马上起飞[牛][牛][牛][牛]。,-99
2066122,今天这走势好坑爹,-99
4259310,次新板块大涨都带不动这垃圾,-99
4056472,哈哈今天1万股上车想看交割随时都能看，资金全,-99
5487913,你妈卖批，啥几把市场，垮求鸡儿得了,-99
1876679,都在逃命吗？,-99
5220281,高抛低吸反复做T  玩死小庄,-99
5321115,71.35会不会是本周最高？还有半小时交易时间，,-99
2822706,庄家扯高出货了，唉,-99
1120281,下挂的都是假买盘不要信,-99
3194633,商股吗,-99
3750372,尾盘继续抬价，弄不好可以破7?,-99
2830935,是地方个地方个,-99
4288702,兄弟们顶起来，气死淮海路。,-99
4656888,寻找主力：关注汽车行业之一：华达汽车,-99
4055327,没想到早盘3.7跑到最高点[大笑],-99
3566562,斗争太复杂，坏人胆太大。只要良心在，强大我中,-99
4094512,敲锣打鼓，两天没买，上天了啊,-99
3216373,人生经历了最烂的一只股票，重庆建工，一个骗局,-99
271127,善班带你了解项目管理转行产品经理的三大优势,-99
4602422,你们就赶紧买，在这个价位你的成本远比庄家低！,-99
1511703,谁卖谁是大傻X，主力快砸不动了,-99
4222929,佳力图板了、盘比你大、加把劲丫,-99
4978688,业绩优秀的：即将成为游戏龙头公司：600551时代,-99
3449856,哎，做这股头疼，约补越深,-99
2596929,死股一只，没人气，垃圾,-99
482613,压力重重！下周突破，全靠它了！,-99
1056875,这种股票遇到大小非减持就完蛋啦,-99
2175058,加油跌,-99
2714401,用图说话，补上当时的图，才能看出事后的结果,-99
4886226,苏利属绩优股，被错杀,-99
1621216,错过了亨通，你不能再错过中兴通讯了！,-99
459534,2017.5.25操盘必读（三只牛）,-99
4878648,请问董秘，荣泰现在的股东人数？,-99
4565871,严重提醒：今天是最后逃命机会！,-99
2361492,最为重要的。,-99
5189334,资金疯狂出逃。砸。农民工大户。,-99
1210743,别追涨杀跌,-99
1309804,潘总你它妈真拉及。1,-99
2316901,这货跟共享单车也没关系了吗,-99
2367842,还会跌的 什么时候放量了 才会止跌向上,-99
5173833,上午全部割肉了，原材料涨这么多，显然压缩了利,-99
4884387,补了开天仓,-99
4720767,硬起来 去进让让.和和[牛],-99
1192565,2028是傻多头，别听他的！散了吧！,-99
3407404,同志：要坚持买彩票，丨打新股+打新债,-99
3157064,广日股份(600894)融资融券信息(11-28),-99
430873,大盘基本小牛市格局已定，大牛市不敢说！,-99
4972452,不管能不能上都应该出来说下，而不是这么不负责,-99
1715417,9.99的1000手太好了。。。不撤就行,-99
3268038,奇谈怪论不少,-99
2992285,公司在松江洞泾，而洞泾要发展成为美国的硅谷,-99
1502868,做管业的其他公司股价已涨上天了，你为何还不发,-99
2462429,这股想做T都难[失望]。,-99
1371454,落袋为安，走了,-99
359254,垃圾一辈子都是垃圾，知道不，买了这个股一辈子,-99
4896610,但盘中几乎难于扑捉到热点,-99
5534154,此股要涨了，大家买买买！,-99
228945,这么便宜的股票怎么没人买？,-99
28253,恒大暴涨五倍后高位又融资600亿，充分顶级地产,-99
23029,涨停的机会有多大,-99
1859091,晚上季报，今天下跌,-99
4318712,洗吧 就是不出o,-99
357667,老乡别走,-99
2712658,粤港澳大湾区迎万亿级基建投资 规划已上报至国,-99
3145,罗马集团涨28%后停牌 暂未悉原因,-99
3028993,5月24日：船长内线收评《两市二次探底回升，反\t,-99
1876095,沧猪，9月给我们这些小散，发发福利吧[鼓掌][赚,-99
2661537,中国实行社会主义市场经济数十年来,-99
1827153,此股必是雄安新贵,-99
4869340,主力出货，在做t散户齐心顶上去,-99
1819247,拿着煤炭的 ～长协价，  煤炭贸易现在是死赚，,-99
717763,卒狗马甲蓑驴！呵呵！,-99
4189539,突破25[鼓掌][鼓掌][鼓掌],-99
3345161,文山电力恶庄作祟！,-99
883250,1994年7月30日,-99
437305,牛市在就不卖绩优股!,-99
4456961,祝贺美国股市，祝福美国股民！！！！,-99
4721053,亚振家居12月5日盘中涨幅达5%,-99
2011226,看到另外一个农业龙头昨天的走势，有点慌。隆平,-99
3031528,炒个股这么神神唠唠，主力累吗？,-99
3198878,辞职的秦刚，曾任明星电力600101的董事长,-99
1772491,交大无低线  一直不让拔毛的驴,-99
4650715,保监会副主席陈文辉表示,-99
4730927,孙子，你说你一直持有韦尔，坚守？脸呢？,-99
1000161,让国家对和机构自己炒吧！那样肯定都是好股了，,-99
4310973,不知不觉从一个小小小小散，变成了一个小小散、,-99
5433669,看不下去了，关机睡觉,-99
2954501,格力电器股价受到一定的影响,-99
1264746,影响心情[失望],-99
107956,创业板离低部还很远,-99
5503359,信雅达(600571)传统业务保持领先，金融科技稳步,-99
2357305,主力看看我发的内天都没人关注。哦,-99
5545662,Oled和家电都不跟，这股牛！,-99
4686168,603368:柳州医药2016年年度权益分派实施公告,-99
2891345,守住7元就是胜利,-99
4638243,著名经济学家沙黾农先生在他的博客中写道：“60,-99
2992378,建议卖海欣股份换股亚通,-99
751186,估计会涨停。但还是不卖，两个涨停！出手！,-99
3305343,你凭什么全天不动啊 ，你以为你是去年的青岛海,-99
861558,底部吸筹使劲敲一天也只能拿20万股！有时被人拿,-99
4327389,这下尴尬了，看主力如何解这个难题？,-99
4604891,废物银行，一点不给力。压盘狗死。,-99
2225032,还有创新资源，600193,-99
3923068,想成妖[想一下][想一下][想一下][想一下],-99
2782609,快过年了，海运资金回笼,-99
272020,风场是千年巨矿，三菱电机，政策助力。。,-99
2107187,只值8元钱一股,-99
4099159,创业板1950点暂时有效,-99
2094396,惨烈筑底 第一波反弹看上3300点[鉴彪股]。,-99
4923243,就不能反弹一下来个涨停,-99
5015426,1-2分钟或者2-3分钟一个买卖单[滴汗],-99
3274258,好酒是陈的香 ，酒香不怕巷子深，新五丰领导辛,-99
1432596,快走，要开始洗筹了,-99
4634031,上半年总回报,-99
3095609,沃尔核材与特斯拉展开业务接洽并几轮沟通。,-99
1510286,华纺说增发通过，证监没下发核准文件,-99
1911323,尤其是小盘股。,-99
2267504,马云在西安建西北分部，持有西安股票的可以数钱,-99
3375981,强化多空淡化傻冒狗庄,-99
107753,中信证券51.4亿涨2分，中信银行6.8个亿涨2%,-99
1763679,~~董明珠 银隆汽车 九鼎佑丰  华夏之星,-99
1870505,炒股其实炒的就是概率,-99
2957399,呵呵哒 来来来本神下面接750的单子已布好 来来,-99
419089,这么多唱多的看来还没见底，应该还有更低。,-99
3388962,恭喜持有金陵饭店的朋友们明天起开始起飞。千万,-99
3217235,一个字跑,-99
1108178,垃圾票！！不用抱幻想了  就是一日游！！祝剩下,-99
1486441,收盘前只要有5%涨幅  下午就会封板[鼓掌],-99
2247887,新能源有反抽机会，一，周期资金流出严重，主力,-99
390817,好股！！  大家不买也都来看看[牛][牛],-99
754378,看了几百个股的走势，像中再这样的极少,-99
841459,尾盘又有人抢货了！,-99
667018,真是乱搞一气，这样的股我也买进去了！主力收集,-99
1182289,3200站不稳的狗,-99
214355,这孙子订单越多，砸的越深！！！,-99
5506668,新星没主力呀,-99
4500348,发现这庄喜欢吃粑粑，挂那么多低单,-99
150671,中国神油是板上钉钉的事了，庄家大哥你就别掩耳,-99
1336595,今天新闻上市公司强制分红政策松动，好了，他分,-99
2171846,高台跳水表演马上开始,-99
2959769,这里有几条狗老叫，要不是天气太热，宰了给人下,-99
899324,而是我不知道怎样回答,-99
4175669,震荡市中安全追涨四技巧,-99
2514179,下摸24元附近,-99
1991925,这显然是抓住了问题的要害,-99
2453332,同样是卖药的华东医药为什么经营那么好呢？,-99
