,content,mark
345179,向王东升领导的京东方人致敬!!!\t,-99
2754858,操,-99
3211231,又有空狗说不用挂单护盘，小心了，空狗一招不灵,-99
4119886,并没有得到中小创的合力支持,-99
2720132,本周主基调是震荡筑底迎接6月份的大反弹,-99
3899912,垃圾中的垃圾,-99
5178323,关于促进小微型客车租赁健康发展的指导意见  交,-99
5383679,我佛慈悲，救救多灾多难的众生吧!,-99
5093472,次新股才这么一点点换手率，资金去了哪里了？,-99
3028789,中国国贸(600007)融资融券信息(05-31)。,-99
519935,4100点到5200点就看机电怎么补涨了,-99
1854387,88888,-99
4032548,贵阳银行已成A股市场的吸血瘤！,-99
4497234,跳,-99
5523910,不是盈利，股价这样，造假吗,-99
840233,5日线已上来，明天上10元,-99
733519,41.01割肉8000股，昨晚喝多了差点跳楼了，哭晕,-99
1320672,加仓 2层,-99
3407095,这盘洗的，赞,-99
2559990,"对600357复牌,我认为20个涨停不成问题!同意的顶",-99
243191,笫一高点3305点，笫二高点:3298点。,-99
726200,明牌怎么打？主力和散户心理都清楚的很！罗顿就,-99
4421215,周一冲高后高抛，今天低接回来，躺着也可以长线,-99
1838931,可转债中签率是多少,-99
1259802,麻痹的，我就不信全国100多家门店，阿里京东会,-99
1973251,用友是一只纸老虎呀,-99
4619462,今天就封着不打开了？,-99
4491604,603238诺邦股份明日起爆，补涨5涨停，最后机会,-99
4725911,半年度没高送转明天必定大跌,-99
3184639,一闷棍。昨天进的，全部再见,-99
1555707,好当家(600467)融资融券信息(10-31),-99
2255608,解读中美经济百日计划，钢铁是关键！！！,-99
1217643,缴存余额45627.85亿元,-99
346361,做到有机平衡。下一,-99
2185476,这么多人问候你妈均金你引众怒伤天理,-99
5264234,尾盘拉升，游盗抢筹。鱼尾行情，小心为妙!,-99
2778146,麻痹幸好停牌了，不然又是跌两天,-99
1864821,赶紧跑吧,-99
5267805,神奇两点半 是哪个巫跳水比赛现在开始，冠,-99
2171146,此股半年报不会送股，因证监会查得严它不敢，，,-99
4014545,奇葩的思维，奇葩的方式，奇葩的市场。扭曲的想,-99
2290100,绿地控股(600606)融资融券信息(10-27)。,-99
777190,宛,-99
3344455,这个股票市盈率怎么这么低？居然还没有庄家关注,-99
1844624,并不是不要险资进行投资。,-99
256405,昨日你我你。,-99
5545018,在2017年6月22日之前不宜补仓中新科技！,-99
5405340,靠，搞事情啊开始,-99
4606180,明天不涨起来很危险。macd开始往下滑。[不屑][,-99
1323263,呵呵,-99
2135009,发几个假重组的忽悠了几亿资金买进。。。又要套,-99
4778762,翔港科技 先卖了换成券商明天卖了券商再买回来,-99
221142,林中不死、富润不兴！,-99
850015,人们热切地盼着春天的到来,-99
89694,越是低价，越会爆炒,-99
5058263,再见 。傻     逼    们,-99
4931869,持币休息,-99
924195,小康可是有好东西，这次来了就不走了，死了都不,-99
4113448,维稳行,-99
3548427,今天面对杭齿？恒宝？哦选择买入002104资金四维,-99
1792129,一赢，二平，七亏的本质原因之一,-99
2893842,百股跌停都小心点[不屑][不屑][不屑][不屑],-99
4043760,疯了都，套了快15个点了,-99
845666,这股吧怎么都是托？？？？？？？,-99
2747912,没主力的股票就是不行，散户必定满仓踏空,-99
562917,当前证券板块市净率为1.87倍左右,-99
3153994,600420干,-99
3462406,明天财通证券商上市，今天尾盘买点券商股票可以,-99
1196865,部分内生成长性较好、PEG具备优势,-99
2566865,人寿和二股东，你以为是专干短线的？,-99
2756354,快讯能机构,-99
3170530,投资风向明确转变,-99
4675423,停牌什么意思？,-99
2419988,对照中国联通的股东股本，中航资本应该会有作为,-99
3599766,许冲之：8.21黄金原油操作建议加解套！,-99
2461618,对凤凰目前之看法,-99
5531633,通过处置房产扭亏或者实现利润的增加这种现象不,-99
1149926,学学辰安科技在“公司声音”栏目主动每隔15天通,-99
5492240,总是喜欢逆世做盘,-99
5415729,拜财神，求中签,-99
4444786,伤害洗吧伤害洗吧伤害洗吧洗吧洗吧洗吧洗吧就洗,-99
4250456,连次新股指也创了近期新高，先达看你怎样跌，越,-99
3521445,向华大基因看齐，盘子比他小,-99
3587724,怎么不披露重组主题项目？,-99
662487,证监会拖住不批华夏人寿25%就卖了300亿,-99
4075245,主怎么不允许发言呢,-99
2619979,此股5年后有望涨到21元，大家别浪费时间，赶紧,-99
2343099,牛仔网：让你周末不看盘、不看资讯！今天傻眼了,-99
2830267,建议纯电动汽车，车顶加装太阳能基板，白天阳光,-99
1715197,碍。因此，在涨势,-99
1674689,大家知道华丽家族为什么一直涨不上去吗？大恒科,-99
4263891,今天还会走老路吗,-99
1621664,有票的赶紧上车！！！！！！！,-99
1169358,放量了还能涨那还真是有鬼了！p,-99
756954,驴日的垃圾股,-99
5554943,结合大盘、板块捋一捋思路,-99
465990,东风吹战鼓擂。武汉出牛股必须追。买100股涨停,-99
5448589,走了，傻逼\t\t\t\t,-99
2315489,真正下跌才刚刚开始呢朋友，四川金顶已经彻底玩,-99
51236,吧里人这麽少，股价波动大，有大动作？高手请指,-99
4791749,明天方大炭素带动资源股反弹！,-99
2276981,先知先觉者？,-99
1607368,福能股份(600483)融资融券信息(09-19),-99
5364204,3300应该破布了，就这德行，破了3300连3200都不,-99
2619623,600756:浪潮软件关于全资子公司与关联方开展融,-99
2298838,锦屏一级水电站成功蓄水至正常蓄水位 2014-09-1,-99
2187143,中环与关联人基金控股百分之三十触发要约收购举,-99
1612755,信威,-99
2765135,月浸葡萄十里,-99
4534032,603288:海天味业关于更换保荐代表人的公告,-99
2800233,别的水泥涨你们跌，别的水泥跌你们更跌，牛哇,-99
1975763,这只股就是一垃圾,-99
4421137,603188:亚邦股份募集资金年度存放与使用情况鉴,-99
4941104,有本事砸到两块把公司砸退市，没那脾气少丢人现,-99
4563876,强势股调整当日不会超5％,-99
2664751,2017年8月16日牛股送福利，一起见证预言：,-99
1082972,希望跌到39以下，最好38以下,-99
5095829,603703盛洋科技到了选择方向的时候了,-99
3603047,601985中国核电牵手比尔盖茨！,-99
2136630,秋林芜湖基金担负轻型动力飞机教练机的研发任务,-99
2147542,跑了会后悔的。。,-99
3672552,真不要脸 东方小白龙[大笑],-99
127366,从周线来看如果再破前期低点就往10元一带而去，,-99
4639243,赔了7500，认栽,-99
3902503,601872:招商轮船:上海长航国际海运有限公司审计,-99
3699506,来一波,-99
1854666,600654*ST中安000755*ST三维000953*ST河化60055,-99
5432892,今天会不会红,-99
5129009,明天大跌我是跑了,-99
1773900,原生铅的生产成本13000元/吨不到，高手算下利润,-99
5453314,多说不易,-99
82211,山钢的股价不土豆。,-99
2912561,B的庄家，壮士断腕!宁可自己身先士卒也要继续挖,-99
4868065,今天又抄大便主力底了，明天高抛[胜利],-99
2357475,到11再说 不急,-99
1553873,跑不赢上证，跑不赢房地产，跑不赢3d，跑不赢它,-99
3000099,鸡别，业绩不好,-99
4165973,这个股的大户每天都在做T,-99
3329530,今天发威,-99
364983,根本没有渝开发庄家那么善良，我们继续跟踪渝开,-99
2353181,飞天鳄鱼000不死，上石化不升！,-99
2017739,庄家你慢慢搓，习惯了，等着你搓累了。,-99
4362150,603158:腾龙股份股权激励计划限制性股票解锁暨,-99
4375755,今天跌停,-99
5543763,这里发帖大都是老股民，感觉埋伏太旱了。,-99
2814953,抢夺信仰！抢夺新娘！,-99
4107985,今天的T 做得太烂，休息了。,-99
2435147,利好频传助推OLED板块走强 6只概念股获机构集体,-99
1702875,出点成交量,-99
4947775,“诺力”搬运车：引入无人驾驶技术,-99
2352394,最后一个还在底部的蓝筹股啊,-99
2234826,肥土挺能演戏，演了坑我的惨剧，然后用多个惨剧,-99
2884296,你不睡觉吗 2点多还在聊 6点就接着在股吧里说 ,-99
3136825,来来来逼芯子，卖完烤地瓜粗来吹牛嘿哩,-99
4742039,必须认识到小盘股的风险,-99
2989635,但又无法准确判断灰犀牛的体积和距离。,-99
927712,瞎了,-99
1366205,坐好了，开始有动作了，别甩下去了，呵呵,-99
4469642,000778/603728,-99
1953262,闽江水电好好解,-99
5147370,哪里有卖后悔药～的。三选一中奖，买了一个假次,-99
4949037,就是一垃圾,-99
2383382,跌起来飞快,-99
2999321,得到快乐,-99
3734621,大股东减持，前前后后，这买进的一个同一个营业,-99
1601425,大阴线来了,-99
2041368,明天应该大涨，下周狂涨。。,-99
3829009,大跌不停,-99
2847647,热点扩散惜售严重中线良好之二,-99
3032617,跟不跟？不跟我就再拉升！,-99
793776,最后都悬念了，大家说说注入的会是什么呢？,-99
3255826,披着一张好皮的死股,-99
4982901,山沟沟里总算等来了涨停板！！！,-99
4395082,要不要跑,-99
1088672,耐心是致胜的关键，信心是成功的保障,-99
4597234,庄家5000万 搞起来呀 这特么多窝火,-99
1283762,五洲交通与周边东盟国家共同打造跨境电商综合服,-99
3173425,对于这样的抄袭行为笔者严厉谴责。,-99
4589837,一直徘徊吗,-99
4071406,彻底把    钟爱中报高增长股   跌成茄子喽。哈,-99
2975047,放量滞涨有危险 要是下跌赶快逃  ,-99
2153013,CSB老巫婆,-99
1330905,英雄互娱完成17亿元Pre-IPO系列融资,-99
1391240,险资加强监管丝毫都不影响格力电器的基本面,-99
2294353,几时复牌？,-99
2613823,国家队：我真的尽力了！,-99
2430470,主力:老子就是震震震，把你们韭菜甩下车[大便],-99
1404027,日日夜夜都向下行趋势发展下去！,-99
1998095,大家都长点记性，河南人的股不要玩,-99
1788956,感谢主力，18出了，赚了每股5毛，知足了,-99
3874879,即将被Msci除名,-99
4297093,神功护板,-99
2933088,放了五个多月亏了7个点，放掉了，垃圾。,-99
2717359,看好辅仁下一步行情,-99
2394027,跌停股不断a,-99
523556,维科骗子上指已涨过你停牌定收购价足额增发价时,-99
4282324,潘绿帽，带好,-99
3636762,农行优化机构布局服务“中国制造2025” 来源：,-99
4009343,这个吧里人太有意思了,-99
2240989,心态第一，策略第二，技术只有屈居第三了,-99
