,content,mark
1503612,你爹硬十次你一次也硬不起来,-99
2456643,广州万隆认为,-99
79343,恶庄地干活,-99
4110637,为什么开始出现有人疯狂唱多？,-99
4719567,加拿大房地,-99
2513066,《龙族世界》简介a,-99
645832,中体产业一幕在国中吧又上演,-99
690016,怒放的生命---金种子酒,-99
2753463,须白皱深的时候,-99
1483329,吧里疯了的那几个，我知道你们怎么疯的，我要是,-99
3108448,建议纯电动汽车，车顶加装太阳能基板，白天阳光,-99
4374956,为什么说的,-99
1329447,9.9元的历史新低的大宗交易 意味着什么，垃圾春,-99
374326,国金证券主力暗中涌动，这股却被严重低估，后面,-99
5091271,早评：沪深两市双双低开 360概念股领涨,-99
4885690,哎 洗出去了 明天跌再买,-99
5453055,好样的，翻红了,-99
3383518,为什么这么少人发言？都被洗出去了吗？为什么这,-99
863534,签！[大笑],-99
4616483,45.88入手，到月底看结果，请大神们看看庄的手,-99
630398,中兴40元突破，生益加速上攻20,-99
2665752,股吧本身就是个自娱自乐的地方，当着玩麻将斗地,-99
5230517,星期一低开高走,-99
852710,股东提问宝能为何董事会,-99
5330209,个人认为主力意存高远！所以才有这样的折磨，一,-99
3871618,15.5补到5成仓。坐等收钱,-99
1067767,这几天让我们见识了什么叫做穷凶极恶！,-99
3865400,大暴跌，大暴跌，哈哈哈哈,-99
904652,牵牛织女渡河桥。,-99
5284854,大盘跌你跌，大盘涨你还跌，尼玛落后大盘多少个,-99
821966,被骗了我去,-99
5344273,和海量差25个点。垃圾堆,-99
1065520,你海公公总算涨了。。,-99
3851158,尹明善 这个看具体的情况吧，现在我们的家族，,-99
589288,回调到15.1左右在来,-99
1416676,c  n  n  的  ，连个公告都没有，是si是活 ，吱,-99
3861512,能否发个红包,-99
1671043,600502在装死呢，庄家在装b啊没办法,-99
2042228,大盘要飞，买入做个差价也不错！,-99
4734905,和庄家耗耗时间玩吧,-99
2285007,死跌停板本栏认为个大资金能看着中小散户,-99
460766,600311抢购筹码 连续涨停起飞最低价黄金矿业股,-99
4384590,假药还有人买，真搞笑,-99
2033321,骂！！！,-99
1558313,任何利好都比不上将造假上市的企业和保荐券商罚,-99
5016547,消费股600519和000651在创新高!,-99
1210977,我的万华化学啊有的时候骑着牛股找牛股。心不定,-99
3106400,股权的一部分出卖。,-99
820492,招商局港口逾85亿出清中集集团股权 同系公司接,-99
2289283,卖不完的，哈哈,-99
2796243,两融余额两连跌。,-99
4971661,为什么会有卖一手的,-99
3225150,明天涨吗？,-99
550304,看看主力增减持仓，天天在出货！,-99
5475746,新股开板次日再来接点才是王道！,-99
1404456,发改委要求煤炭企业全年中长期合同履约率应不低,-99
3818830,继续跌尼玛币啊！,-99
978815,可以T了,-99
5050070,环保部约谈七地负责人 污水处理迎来产业大年,-99
2451741,中国资本市场被伤害得连连熊市,-99
5276186,“三马一车”共筑王者之师,-99
4053805,周五会如何 竞猜娱乐下！,-99
1831585,人在江湖，身不由己!,-99
647001,看看我以前在同花顺的论股,-99
4317931,一定要拿起翠微，一股都不能卖，拿起必有厚报。,-99
1168735,操作机会 1、个股有利好高开，一般在10点前会有,-99
3504095,是你还有人可以依赖的时候才说得,-99
1352483,请主力再砸几个点，让哥好进，最好跌破11,-99
3243359,7.16那6000手难过去啊，哪个杀千刀的挂那么多。,-99
2634884,开始拉了,-99
4134454,14.09进了半仓，不知道是祸是福,-99
4333608,待得来年花开时，此君亦是常绿时。,-99
289544,怎么这么多神经病呢，发表一些语无伦次的标题。,-99
436526,混改龙头 洛阳玻璃,-99
4389604,复牌后股价下跌趋势已经出现能见度下降趋势……,-99
2030177,社融与M2增速背离看金融去杠杆,-99
2127987,20元举牌   现在定增价大甩卖,-99
5430228,等你砸；,-99
659472,[不屑][不屑][不屑],-99
416592,龚岩松能才,-99
4065276,了。他也是,-99
3235940,又装B了,-99
2078258,一旦股价放量突破前期小K线组合区域时,-99
3439878,一拖再拖，托还在拖!,-99
2864545,耀皮20年的平均价6.21元，低了不能再低。而耀皮,-99
605027,散户亏钱了心里难受,-99
5050218,半年结算期：,-99
2872870,-- 《不思议迷宫》由吉比特和电魂网络代理,-99
4882324,星期一挂几手三十六试试有希望没[大笑],-99
4950727,血淋淋的筹码，血淋淋的肉啊。,-99
2097150,此时心事良苦,-99
5340762,抬升的震荡市,-99
4080693,发现一家,-99
701970,这货怎么回事？转让出问题了,-99
144206,5鸡概念又涨停潮,-99
1495488,该股基本面什么都好 就是关注度太低了点 如果来,-99
2527725,驾照扣满12分，就要重新考驾照，有时候遇到特殊,-99
3192105,布林线中线支撑没有,-99
2699564,不要掉以轻心 泸州老? 财神菩萨保佑我中签[? 去,-99
825128,退市博元：已经坏得要,-99
5341520,我也试图改变,-99
255521,澄星股份(600078)融资融券信息(07-19),-99
1543591,赚钱了 昨天买入了,-99
2769689,利差会继续存在，并压低美债收益率，,-99
1285198,000978.600712.600368,-99
616747,能涨到20不,-99
1524899,今天应该上不去了，先出了，小赚4%,-99
3140750,潮起时浪涌，下周一直涨,-99
3929788,下周股市五大猜想：主力选择进攻方向（节选掘超,-99
2250166,许老头别再贪婪了快签合同，难道还想抱着金鑫锂,-99
385528,投票大股东回避这是常识，有人兴奋了哈哈哈,-99
1736150,老板说了，昨天尾盘涨得太多，让别人赚了他很不,-99
2703988,一杯浓茶8,-99
3630577,锂矿俨然成为了近期的超级热点,-99
5340946,我来砸盘哈哈，砸盘目标价是多少自己猜。[大笑],-99
2513867,断崖瀑布式暴跌创20新低也正常，悲观图形。,-99
1836842,神仙明灯忽悠卖出，却赖在这里，不是傻逼吗？,-99
4189380,广州辣鸡酒家！辣鸡月饼！买你股票的人以后注定,-99
4938402,赶紧跑,-99
2094919,伪概念，名字不错，实则猥琐龌龊，留一手，到百,-99
1648921,007就是个傻逼，天天唱多，每天就只会喊拉，从,-99
2633515,大单砸，小单拉有意思吗？,-99
4565943,连开盘价都没有，全是散户，根本没有庄,-99
2312313,今晚出三季报，有没有亮点？,-99
4768023,珍惜手中的一千股！[微笑],-99
1819424,煤超疯归来：煤炭价格每吨涨270元 货车排队连夜,-99
3865114,这样的分红回报远远超过了银行存款利率保壳,-99
4749016,大家看仔细了才买！重要的我来说！都进来看！,-99
4315598,大家看烽火也是公告减持 为了和大唐合并前不至,-99
326498,金联创7月7日原油变化率。,-99
3137779,也许一些人会认为 ,-99
3397425,又下一个台阶,-99
3758839,50倍杠杆押宝金融护盘,-99
1673037,这控盘，多一点都上不去,-99
778559,贵广网络 最低价小盘次新股 国企改革 低估元,-99
4578898,今天大面积反弹，别的股票都至少5%以上的反弹，,-99
3779113,中冶～打压吃货阶段，积极买入潜伏都来买啊，白,-99
5118750,603718:海利生物2017年第三次临时股东大会决议,-99
95871,拉高一定要出。,-99
2618834,期货贸易有全球顶级精英团队，投入基数大，年赚,-99
2068345,次新股迎来转势曙光,-99
650009,今天下午还能不能红了啊。,-99
4646588,不看肯定后,-99
3879283,停牌公司应按同期贷款利率双倍支付停牌期间股民,-99
5381023,垃圾,-99
4102479,一个口气好大的绩优上市公司，闲散资金就有7500,-99
2201018,外高桥将建世界上最大最臭的公共厕所！,-99
999756,政策性风险不能小视,-99
1744327,竞猜一下，亨通到45中天能到15吗？,-99
2843951,跟着主力操作肯定可以赚钱,-99
3295692,就这个换手，还要在底部盘整三个月！,-99
962704,恒瑞这走势，那几个穿着不同马甲的空狗出来走几,-99
292803,股市走势预警：慎防大盘周线级别回调。。,-99
1693218,主力早盘快速拉升诱多坑人啊，庆幸早盘卖掉了,-99
1781218,明天开始建仓。,-99
320602,更体现了管理层对市场的多头思维,-99
1182205,呵呵呵,-99
371069,昨天买的北大荒手续费出来了，不知下午能否再拉,-99
891320,冲过5.05，有效站稳，后市才能有戏！,-99
5352319,国改、混改主线继续发酵,-99
922847,这样的分红回报远远超过了银行存款利率保壳,-99
3681199,证监会9月15日核发9家IPO批文 筹资不超过44亿元,-99
188319,有能力给阿芸将来的生活带来幸福,-99
3782495,今日皖能电力涨停买进6.22元必出现5个涨停潜力,-99
1907143,真特么是魔咒啊，东方即红一发言立马绿了,-99
3749549,因为效益不好，你看分红多少啊，所以原来是虚高,-99
4396821,还想再重来,-99
3334399,贵绳股份(600992)龙虎榜数据(11-30),-99
1980983,傻逼，跌停,-99
2767010,[图片],-99
2081874,如火的青春里,-99
3422853,这是第一次中奖新股送你一条小章鱼,-99
4401004,受欧美大幅下跌影响防恐慌性踩踏出逃或许今,-99
1845425,主力又将作何打算,-99
3609095,加仓，马上起飞,-99
5122003,论今日涨停概率,-99
2987634,为什么中国经济一枝独秀,-99
5461670,BOE（京东方）与北,-99
2111480,你们傻B了吧!,-99
3575922,17.03.24：路过,-99
5286662,卖肉啦，这里有新鲜便宜的猪肉卖！,-99
704329,这不是股灾是什么,-99
3148530,东北经济振兴政策对股票还是有一定影响的,-99
1953157,2017-08-18--精解,-99
3224059,夕阳产业，等待破发。仅有点壳价值。但是还是国,-99
5203230,远离此股，业绩差得很，此股要大跌了,-99
3182920,如果香港平民港资现在买内地优质股票，就像二零,-99
4275132,中国股市散户玩不起，还是早离开为好！,-99
916776,常熟银行601128季报显示增速在五小行里拨得头筹,-99
4240401,我是遇到史上最垃圾次新股了么[亏大了][亏大了],-99
3018691,主动买套,-99
2536834,你妈的少有的操纵股价,-99
4047924,此股最高点96呢，都放心拿着吧,-99
4746753,这是什么狗屁股,-99
4991955,八部门联合印发,-99
2951547,"14.50庄家""狂奔""",-99
794806,000065,-99
1393476,你们上市公司怎么一个接电话的人都没有吗?为什,-99
630853,蓝筹股不仅仅估值低，而且业绩好，蕴藏的风险比,-99
346289,终于明白,-99
