,content,mark
5169795,庄家要你们出去买煤炭股，周一中马又涨，煤炭又,-99
3110412,我操你妈逼 天天跌 什么意思,-99
5256799,一帮傻逼，动不动就看空,-99
3965159,阿里教育入股凤凰 好未来也想入股,-99
5030832,"人民币升值,预示财政紧缩开始,防跌!!!",-99
1731312,目前市场最危险的就是茅台等高高在上的大盘蓝筹,-99
247356,马上绿,-99
1838211,停止重组了，公司迫于压力彻底放弃了，29号等公,-99
4460302,[大便],-99
2169782,错过30元，错过了27元，,-99
1334217,13:35军工板块直线拉升，多股大幅上扬,-99
3333530,坚决不买绩差股，问题股17年的一九行情，在2018,-99
497029,宁可退市，也不让骗子得呈,-99
1259675,大盘上涨没它份，大盘下跌跑第！,-99
4447917,现在市场专杀高送转，为什么会这么多人希望年报,-99
1315839,安全边际是一样的，都是为了应对不确定性。,-99
1949177,而没有指出问题的实质,-99
1534094,继续加仓，胆小的快跑！,-99
3324219,基金，社保全跑了，一群傻散接盘,-99
1792655,中国已控制全球4/5的光伏制造！说明技术研发能,-99
4835467,美诺华药业计划通过内在发展、兼并重组、资本上,-99
3796398,今天水泥股大涨，玻璃也不远了,-99
4842919,26. 不要斤斤计较,-99
4728433,满仓死的早 吃饭还讲八分饱 现在可以讲仓位提升,-99
3869769,出来混迟早是要还的，一下窜那么快还不得吐出来,-99
1165752,600106重庆路桥0.176业绩，9亿的盘子，股价不到,-99
3778735,南无阿弥陀佛买入能发家致富一场全面收购601618,-99
4836656,垃圾股！,-99
53923,波动大点啊！每天都没成交不好吧！,-99
3184020,今天0719日，已经再次买入三笔长电！,-99
3756752,四娃叫鸟散伙上去一路,-99
3380583,甚至是压根就不可能的事情,-99
3054953,他太大教琴养家,-99
98819,湖畔啊[鼓掌],-99
657921,赶紧拉吧。,-99
3775651,111,-99
1653882,新兴铸管5.6元至5.8元。,-99
3920879,龙头地位能保住吗,-99
3273341,神华的停产应该能带动煤价大涨b,-99
4105952,K可输光603019！ 荣之联持华大基因94万原始股,-99
3944385,垃圾[不赞]c。,-99
3462149,员工持股是要回收股票，而债转股是要发行股票。,-99
4970523,破发的节奏  无语,-99
3712150,10连跌，牛,-99
265949,国外股市跌，中国股市机构庄家脚发软。,-99
4971532,挂单200来报道，不会发图，求指教,-99
5182375,重磅消息，大商所下调煤炭期货交易手续费，煤炭,-99
3313202,想做次新股要注意两点：,-99
3614670,29.6亿解禁股，一元不到的成本！还有人买！不跌,-99
68430,用8.8亿配购债转股就是一利空，上市一定破发。,-99
2464539,如果T+0，那些清仓减持的根本发不了财！,-99
3778315,77777故意压盘给穷人买给有福报的人买入.,-99
3937185,下午看你怎么跟大盘一起跌[俏皮],-99
3641276,只要依靠自己的力量去做事情。,-99
1833210,很快就回到7元，,-99
4641247,潜伏成功，甘蔗吃中间甜，逐步锁定盈利！,-99
5181525,进场机会慢慢临近，你懂的……,-99
2830553,咋这么多1444呢,-99
5180359,套的不用谎张，调查,-99
2250206,新南洋(600661)融资融券信息(10-13),-99
1414453,操你妈的国电庄,-99
4986709,狗日的烂股一支![亏大了][亏大了][亏大了][亏大,-99
5158202,过5日线，就进！,-99
1594340,真他玛垃圾一堆垃圾公告,-99
4722298,底部,-99
1111817,黄金,-99
3725371,发帖就为了怼华哥那个2B。可惜之前他有些关于东,-99
155332,百度百科 目录 声明：百科词条人人可编辑，创建,-99
253713,骂了个比，不骂不解气，大盘涨20点，你跌2分，g,-99
4418789,华正，攻击形态！买！,-99
2139334,陈楚生，我爱你。,-99
49290,兴业投资：美元屋漏偏逢连夜雨 澳元遭遇当头棒,-99
5372368,春秋电子计算机板块细分龙头，大家一起来护盘,-99
2035829,两点半正式启动韭菜收割机，,-99
5015855,反弹已经开始，次新中小盘股率先,-99
5036661,庄和主力不想赚钱，宁可23元出货，也不愿意32元,-99
297931,新特能源净利润9个多亿，不知道特变电工如何啊,-99
3371734,龙头,-99
1633089,可怜的丰年啊，你让上海瘪三的当了，我们怕什么,-99
1890562,是取得长期的保障,-99
3165998,大盘今天不会杀跌，会保持高点震荡。,-99
601125,感觉龙族世界会成为爆款!a。,-99
5430475,贝因美都上,-99
1874035,一带一路会对此股产生如何影响,-99
3388869,唉，,-99
5015859,消费股600519和000651在创新高!,-99
5549811,早就说过，这是一恶庄。之前高位横盘对倒，如今,-99
3187203,下午你不拉七八个点,-99
19357,可以等回踩了,-99
2634937,梁候，全价四觉了喔,-99
2984607,每天开盘买一手。,-99
2999504,龙建下午涨停，验证实力,-99
4687378,资金转向防御，调整趋势已成,-99
4605304,吴江出美女的地方，出网红吗？,-99
4735012,但两市大小非减持却似乎不手软,-99
4078679,不要啊，老,-99
3467746,持有这个股票的兄弟，有么有满仓踏空的感觉啊,-99
5046059,每个板块跌他都会跌，每个板块涨他都不涨,-99
3009494,600856:中天能源:北京市中伦律师事务所关于中天,-99
4749335,出货失败顶部82,-99
2836078,再次提示：民生银行第10大股东，锦州港第2大股,-99
2893989,把赚钱的公司卖掉，装进一些垃圾，业绩将一去不,-99
1414324,做完你，本巫就打算退出股市，从此江湖永不相望,-99
55478,尾盘银行保险券商齐发力 拉回指数,-99
786019,关门了哈..........！各位看着办啊！,-99
4955638,茶花总有一天会出头的！,-99
4631793,这个利好被淹没在信息的海洋,-99
5109129,29.9下个,-99
598396,被错杀中期业绩暴增，10倍黑马股300194福安药业,-99
4391523,垃圾,-99
841268,华业资本：这三股有望再起攻势，今日买入是否一,-99
1289213,当心点，等会玩个乌龙出来了,-99
5131237,继续挂单，创造更多收益，努力！,-99
4345902,跑吧，下午要跳,-99
787251,这点量，肯定涨不起，现在投资者看穿这市场，不,-99
4383142,这个时候大盘变红，估计今天又会凶多吉少了,-99
1074252,发布很快，多发几个，股票跌了好事啊，我来搞点,-99
5555500,大盘涨上天，你还是这个价钱，想要在读者股票上,-99
5182143,弱莶桓模逢低I入!,-99
4692591,高送转的大毒瘤也将因此而摘除,-99
330076,主力护盘没决心，8.95三千多手不到5分钟就被砸,-99
4133741,#晚间利好消息汇总# 600400 红豆股份 ：集四大,-99
167575,中国医药是价值股！,-99
573792,比个税起征点设为1万元更大胆的想法,-99
1729886,53度飞天茅台和茅台镇小酒厂生产的酒，口感差不,-99
844720,时代万恨 生病了 生病了 生病了 而且还病的很严,-99
2910550,为了下周发新股，今天次新股要活跃一下！高兴你,-99
2642651,讨论，每周发十个新股，股市会涨吗？,-99
3996024,"做期货成功的关键和秘诀,只选一个品种做是期货",-99
2419874,行业数据持续回暖 交通运输子行业分化将持续w,-99
2381404,杭州园林又,-99
1729313,中国股市的振兴靠茅台！中国国力提升靠茅台！,-99
2350736,真的可怜，这点量，看的心慌,-99
1915968,股指三连阴破3200点 白酒板块逆市逞强（后市看,-99
303395,同祭堂厉害了！,-99
1126396,继续跌吧，凌钢跌了20个点我都没走，会怕你？,-99
1249861,大盘位置危险，注意防守,-99
400721,华微电子是下一个横店东磁。,-99
897489,都是国家的经济发展的方向 本人从来不买,-99
3350917,到现在还不起来就是因为娘希匹的渣庄在捣鬼,-99
3849330,解密主力资金出逃股 连续5日净流出444股,-99
2054587,9日，证监会对上交所上市公司万家文化（目前已,-99
4886231,上联:拳打次新猛虎，下联:脚踢雄安蛟龙，求横批,-99
775500,保险第一龙头从92惨跌成十元股，今利润增500%，,-99
10012,傻缺！换成我是庄家，,-99
5422248,又被骗进去了,-99
5087752,每天自摸一次很过瘾,-99
4276371,这个大傻钉子，小嫩庄是要你发帖的点击量看看还,-99
3585364,买进就跌。,-99
1917955,大盘想周五涨比登天还难，主力是不会让大盘周五,-99
4629833,但是基于买股票大概率是亏的，,-99
5477307,主力资金一直在流出是真的,-99
5297517,上海国企混改即将引领大盘大幅上涨:市北高新600,-99
2461730,每天有三分之一的融资盘买卖。,-99
103917,上周赎回的债券周一、周二、周三分批次到位！快,-99
3418603,空仓了 观望一下[微笑],-99
130755,让狗庄瞎砸盘，自己把自己砸出去,-99
905606,因此白马蓝筹股。,-99
4856312,快跑，跌停,-99
3653191,#上证50显漂亮本色#粉饰指数,-99
4374060,荣晟环保：2017年“双11”的领头雁！下周突破88,-99
749996,有股友说:还有一大浪回杀，按五五三结构应该属A,-99
801485,哎！拿它是浪费时间！哥今天切换入新和成浮盈4,-99
512592,满仓300610晨化,-99
915043,从索罗斯和巴菲特星盘看，你是否具有股神特质？,-99
841513,一切都与他人无关,-99
5551178,6.8早评前一段时间市场整体非常低迷，恐惧已经,-99
625430,"。中债美债,有大麻烦了。",-99
88696,掌阅科技发行价4.05元，连续25个涨停！,-99
5451525,谁在割肉出 麻痹,-99
1010336,5000手大哥不要来啊,-99
1057538,线报：近期某互联网巨头秘密调研标准股份,-99
4068842,今年买股票我就没有赚过，我就是灾星,-99
2442961,主力求求你干到八块[鼓掌],-99
1604814,垃圾,-99
1961190,观海螺股价走势，难道海螺大股东为套现虚增了业,-99
3104587,要连续大单才有人气,-99
554304,一季度和二季度收益相差很多，是主营收益吗？求,-99
3825420,垃圾,-99
1155247,第三届中国西藏旅游（600749）文化国际博览会将,-99
2435090,坏事也是好事,-99
4856962,中通国脉12月2日4000多万解禁股上市，大家小心,-99
5497865,庄家也不用脑子想想，现在次新股怎么可能亏着割,-99
4197259,国总统大选,-99
1840489,黑手。,-99
199496,海信这样的白马股我持有是很放心的。,-99
3672402,基金重仓果然牛，这么大盘子拉涨停，我服,-99
4839713,有效的领跌大盘，而且非常善于下跌，10元估计到,-99
5440140,又有一群傻乎乎的小散被洗出去了,-99
4688037,惊世缘飘起来,-99
5442080,在跌2元就可以买了一路持有到送股,-99
2631385,还没st？,-99
723159,谁买谁S、不买也S，忽悠现在买的S的更快，整天,-99
2535622,实达这次最少涨到 30元，看涨势图非常漂亮的拉,-99
1346386,等板块涨幅靠前,-99
831525,垃圾,-99
530937,草  13.30没成交,-99
4789566,金石资源股价:3.14元？,-99
3498946,国家鼓励化工领域央企重组,-99
1626038,如歌预测：我周五说了3255-60点，撤！。,-99
