,content,mark
4709495,14.31补仓20手！,-99
478019,全是大资金在出，一点反弹都没有   怎么玩,-99
3125915,倒闭了,-99
1765170,貌似8月15日中报后走势重演[大笑],-99
212331,此股又在拉稀,-99
807937,金鹰股份9月11日盘中涨幅达5%,-99
4185415,速度买进锂电低位股暴涨,-99
1866131,周五已提前介入( 300277 海联讯 )600882广泽股,-99
2492669,给对方,-99
260849,南方城市哪里有卖金花的什么药呢？,-99
2646905,银上半年全球银产量下跌或将提振银价 \u3000\u3000白银,-99
4929073,严查高送转，严查铁公鸡！今日首次在新闻联播播,-99
3912999,5日线上穿10日线,-99
2748707,跑了大盘不行了,-99
1968613,时间不多了，加油！,-99
4296125,"[赚大了]漂亮50,",-99
2222226,申华控股(600653)融资融券信息(09-04),-99
2079390,金枫酒业(600616)融资融券信息(09-01),-99
4073994,狗庄，哥玩不过你，哥站一辈子岗行了吧，哥就是,-99
2860326,我来了给战友们抬轿,-99
3098765,大唐也属于雄安。,-99
2850410,亏了2.5毛了！靠,-99
682515,"↓中美市场对比:本国即将步入大衰退,而美国疲软",-99
3353070,等到下半年，很多人会发现资源股市盈率超低，等,-99
1570934,买吧,-99
2165633,前几天大宗交易19.95卖的，现在可以从二级市场,-99
2066583,钢铁价格继续大幅上涨 四股龙头重点关注 钢铁价,-99
743249,此吧被垃圾堆满垃圾,-99
2509339,佳都垃圾，,-99
4052199,最后半小时才发现县大队还在，老百姓终于放心了,-99
216408,安凯涨的时候你不涨，人家跌你跟个毛线啊！。,-99
5238219,快跌停，我买100股,-99
399133,国产大飞机C919第三次试飞 C919客机产业链/订单,-99
3956221,正式申请香港上市,-99
3835552,持有煤机的雄起！！！！,-99
3962272,如果大家都投反对票12月18日造成大跌主力才能被,-99
660575,看看锦州港这次多少连阴，今天第5个了，继续，,-99
2480312,迎较佳投资,-99
5252358,王石走了、万科没辉煌了！不看好深铁！走了大家,-99
4139240,千万不要买 赶紧卖,-99
1489875,600436,-99
264114,大盘是会说话的，他会用各种方法告诉你他要干什,-99
606786,中材股份：中材科技上半年净利润增长37%至3.74,-99
3247565,指数2次驻底成功，明天买买买,-99
5557313,该三处房产虽未经评估,-99
4876684,荣泰今天温，但因业绩好，明天主力可随时让它起,-99
2419857,码开完户之后，绑定账户才算签约完成！大家开户,-99
2669680,市场板块的轮动依然过快,-99
4558806,特斯拉+次新,-99
4779032,那里来的筹码,-99
1553084,现在云旅的股吧里俩傻逼了疯子了！一个华侨城一,-99
1034709,一股不卖！放3年。,-99
3520559,深圳燃气(601139)融资融券信息(07-12),-99
1063459,我看补9000亿你也这死b样,-99
3518403,真真假假虚虚实实太尼玛牛逼咧拜神,-99
626444,……周末就要来，消息灵通人士透露可能停牌筹划,-99
2184700,买了假股票,-99
5314346,就怕10月1期间发布解禁公告，那就关门了,-99
5137401,基本都是线下签约合作，,-99
712666,怎么会如此着急，傻子不明白了,-99
1190341,厮杀太激烈了，我想看看精彩的暴跌,-99
261890,在股市投资要过这五关,-99
817197,一直讨论的盛大游戏借壳山水终于平息了，盛大游,-99
209661,，删贴啦！晨鸣三年利润之和超现公司市值。 今,-99
4689011,过了4.36坚决不买。。。v,-99
4698307,早卖早安心！,-99
4773594,今天就是跌停板买进的和跌停板补仓的，明日照样,-99
1348806,快把你的韭菜贡献出来。,-99
992734,走光[献花][献花][献花]。,-99
574736,这孙子是怎么回事呢,-99
3183544,长江电力如果站上14.5，会改变很多看空者，会推,-99
2468796,告诉大家一个秘密，，，，，，，，只有这个是资,-99
3377167,观望中。。。,-99
1242303,跌停活该！！！整天在这,-99
3539003,光看到沪股通资金净流出还不能盲目下结论说外资,-99
3768833,黎明前的黑暗,-99
2153421,金贵银业，和晶科技,-99
624422,每日更新牛股供股友参考,-99
574782,喷子，多多,-99
2529196,弱弱弱弱地问一句：前锋什么时候复牌？,-99
2974924,下周9家新股融资65亿；管理层明显控制本周次新,-99
3289573,散户被吓尿,-99
759624,有人恐慌抛盘，又要跌了。,-99
500939,复牌又是几个跌停,-99
3907234,哈哈哈哈哈,-99
2389681,该股必定大涨 因为我卖出了，我很无奈，我是反,-99
4519710,这公司绝对有问题，刚上市就破发，现实中这公司,-99
2443552,不到寒锐的零头的三分之一,-99
388571,A股为何跌出系统性风险 来源：证券市场红周刊,-99
2064975,明天，闷杀！等着,-99
5169960,牛,-99
2668750,MD把握骗进来了。,-99
1800709,到目前才释放了那么点做多的量能，前途可观啊。,-99
4974385,白马涨的都特别好，股,-99
3125855,大盘重心下移，企稳和反弹共存,-99
4172092,现金奖励领不停,-99
4817686,板块炸裂 -7进的有种打下来啊[想一下],-99
996698,我是卖菜的，我有内幕消息～这只股票今天要涨停,-99
232156,明天停牌吗？我想知道。我是散户,-99
4712251,庄家不敢造次，大神威。,-99
4118147,603022:新通联第二届监事会第十二次会议决议公,-99
566763,哪一次不是因为严重的供大于求导致股市出现危机,-99
538817,连涨三日卖出，连跌三日买进,-99
2674144,抓紧重组是正道！,-99
3068058,H股合0.9元人民币了，A股3倍价格，同股同权，还,-99
872019,这样的“义举”解放了不少被“埋”在里面的资金,-99
2554432,果然是辽宁成大公司领导吃C概念股来的,-99
331471,无良臭公司必定会得到市场的抛弃,-99
1971338,谁听天子堂忽悠谁心里苦，埋葬天子堂吧！,-99
1917471,"上市公司股权质押风险""警报响起"" 8股",-99
3804948,目前走5F离开段，见新低反抽无力，继续1F级别下,-99
4947438,诺力比浙江鼎力差在哪里？,-99
1162170,散户在问苍天中国A股牛市在哪里？！,-99
28385,哈哈哈哈删贴啦！晨鸣三年利润之和超现公司市值,-99
4996862,有哪个离公司比较近的，到公司查下7月底或8月15,-99
3429089,庄家疯狂敲单79是什么意思？,-99
482278,北顷？你的二十万手呢？快拿出来。来一个天地板,-99
4355792,不要过于担心，再跌停几个板，会有反抽或反弹出,-99
2309878,沪指不能翻红，不能让散户高价卖了,-99
4612885,热烈祝贺天舟一号货运飞船发射圆满成功！,-99
1928678,鬼托！……,-99
5320456,面包，是不是主力出逃，今天这什么意思啊,-99
4615907,求中签[拜神][拜神][拜神],-99
473911,这些结论与传统的投资理论很难吻合 ,-99
1176995,股权变动,-99
5267878,未公布启动时间表,-99
2170434,明日开盘介入002106莱宝高科,-99
5492334,中农开起估值回归，第一目标22。,-99
2463710,今日短线小反弹，受益于房屋租赁板块！………总,-99
2903816,中国未来的经济增长较少依赖于传统的制造业，较,-99
2336807,被套几个点，小意思！！[傲][傲][傲]疯狂拉升乐,-99
10321,盈STOP,-99
4745633,专心做企业技术发展，不炒作概念 。,-99
912032,一部关于孩子,-99
1733608,满仓咬住主力，不发财不走！,-99
4251782,37.50元全仓买入先达39200股，发财就全靠你了！,-99
3572716,加仓1000股,-99
682041,卖了！各位股友有机会再见,-99
5215287,成本多少？感觉回本无望，哥22.65买的,-99
5070719,情况不妙 可能要变盘,-99
3365519,实话实说，,-99
4164440,但仍有一些券商在暗自操作；,-99
2419440,连跌5天。。。。证  金是在做波段割菲菜吗,-99
2667343,002218拓日新能，现在重仓，微利，我想等下星期,-99
3993184,前段此股跌得象股灾A,-99
3859778,大盘这时候来个雪上加霜~日了狗,-99
5396403,这股该发个业绩预报了，每股三块多的公积金还不,-99
1830817,真它妈的钨业,-99
4090599,准备抄底这两只票了（,-99
2163239,憋半天动一分，这个股已经没人玩了,-99
4514793,踉隋大盘创新低，，该涨不涨，理应看跌,-99
84790,值得关注的5只牛股,-99
13824,到昨天才彻底一阳扭转颓势，今天是想旗形突破,-99
1529905,这是在比谁跑得快吗？,-99
2789347,遵义推介农业产业项目,-99
1738607,买入1手不算少，卖出1千手不算多，看空卖出的你,-99
3730545,我今天上茅厕，发现粪坑里有块写着华锐风电科技,-99
2295162,近日两市继续保持震荡上行的趋势，而港股众多垃,-99
1101530,我站在中国实体经济发展的层面。,-99
2601538,今天坚决清仓，特此公告。,-99
676137,18.88,-99
4060210,沟通,-99
243139,期货使劲涨,-99
1836106,7月27日免疫治疗板块涨幅达2%,-99
295938,这就是我们的特变电工  跌的时候很快 涨的时候,-99
4009758,年底八块无望，解套之路漫漫，只希望来年三月能,-99
4736277,大家都撤单啊，别卖吧！！！不然5个跌停板都少,-99
4431591,京东方开市前雾茫茫，,-99
2236151,年内首拿地 信达土地策略逆转？,-99
518610,000413拿着等数钱，周一压力11.33.支撑11.10和1,-99
2077820,股民不知道地怎么代表？,-99
813200,圆通又完了……快撤吧,-99
2506546,鲁北化工，这两个涨停不简单,-99
4125219,，工行资管部近期确实有大额赎回委外资金,-99
52076,对投资者来说。,-99
5448319,忒差,-99
1753396,为什么不通过？。,-99
1907833,我给你明确的说一下，只要你挂单的话，今天肯定,-99
1328349,丽珠的转战健康元了,-99
3267058,换000001平安银行中报0.7元,-99
5448835,SB小散，大震动还在后面,-99
5044298,刚才的跌停咋回事？,-99
3354913,勇于,-99
1844766,但今年11月26日l,-99
3866510,也可以用三个字总结,-99
3639025,我的平安要顶破60了，这才叫价值投资，农行什么,-99
858209,朱敏的港股没人玩，慢慢的a股也会跟港股看齐，3,-99
892031,跌一毛都不行,-99
4213801,正裕工业发来贺电祝福音飞储存天天拉涨停股价冲,-99
3405938,跌停的节奏,-99
5170337,还要跌[胜利][胜利][胜利],-99
4228464,全仓干  满仓过节,-99
4588033,谁买谁套出货,-99
5146872,汽车 上海 二大版块，今天全涨，这垃圾是什么东,-99
4035253,金融类上市公司成为无主公司的主要聚集地之一：,-99
4609127,狗南昌,-99
4691895,半年报业绩尚可，基本持平。属利空出尽，下周窗,-99
2092848,前车之鉴，,-99
2675287,这个时候来个穿头破脚，才半天时间。九亿多融资,-99
1730323,北上资金周内净流入近50亿元 20只潜力股受关注,-99
