,content,mark
5546196,股市并不会生钱，进入股市就是赌博，奉劝各位远,-99
3882391,今天做了个T，成本低了9分钱。。。。。这个价没,-99
4688147,新股指数不多并入大盘指数，大盘指数永远都不会,-99
2145532,浙数文化大股东可转债发行成功，不排除有机构资,-99
4105967,月底最后一天 中科曙光可以满仓买入了,-99
380881,补在了今天最高点[哭][哭][哭],-99
3654768,100亿就可以控制中国整个航空制造产业，什么歼2,-99
710707,200元涨停板霸王金莱特金轮股份002722秒杀一切,-99
2591830,因为从监管的角度来说,-99
617272,收评,-99
4762037,继续坚持补缺口，62元全仓强力做多,-99
4799546,别扭扭捏捏了，下跌是你的归路,-99
4729948,准备，快跌停了。,-99
5020415,喊涨的多都不见了啊跌停啊,-99
2314893,收盘减7成仓 今年又开始盈利了万五,-99
3758172,中国太保(601601)融资融券信息(12-14),-99
5036291,兴业投资：欧镑重启雄风 晚间关注非农,-99
3608722,歌华有线，突发利好，利润大增,-99
3788285,想好了！调整最少半个月！.左右！,-99
3581107,周未天降利好消息，周一券商概念涨停潮再现!,-99
4038296,你好请问公司2017中报预告什么时候披露。,-99
5451582,出货的节凑，冲进来就等死。,-99
5054940,最好五个跌停洗盘，,-99
2604301,这就是海航旗下的股票，这就是天海，特点很突出,-99
915419,这个股吧不喧嚣，好！,-99
2141386,是时候明白,-99
881884,什么指数都要跑输了 B够牛a,-99
4874439,半年报有什么消息吗,-99
2973355,越跌股吧人气越高！[买入][买入][买入][买入][,-99
2012311,证监会副主席方星海22日在“金融服务农业现代化,-99
3152046,用拔海化的鸡毛博来二三四五和华资两个鸡腿，尾,-99
1262395,今天套了不少,-99
3638265,启动护盘模式,-99
397053,唉，被套了我三毛，表示压力大。。。。。,-99
4828083,在上海自贸区有个物流子公司，沾上概念而已,-99
4162844,狗日的,-99
3219881,准备回你娘X里吗？,-99
1502254,中国债券通有限公司网站北向通交易日历显示7月3,-99
3908591,专利内容节选,-99
1881052,这个问题的答案,-99
2327972,雄安概念多股涨停了！百川能源加油！冲啊！,-99
3727818,明天1.65,-99
747250,浙江医药(600216)融资融券信息(12-01),-99
3559670,来个急拉.不要给做T的机会。,-99
296924,快准狠WwW 影响力  吧龄 2.3年  发表于 2017-11,-99
3538840,建议加大对于次新股和创业板的配置,-99
1339842,失去信誉的代价,-99
3977998,总算从深市遴选出来几家合适的长线布局标的，请,-99
4004433,未来可能会有更多上市公司加入到卖房队伍中来,-99
1251228,今天放量滞胀，明天跌停,-99
4622284,获利的可以出了 拓斯达刚刚启动[大笑][大笑][大,-99
5530282,持有艾华的股友真是幸福满满啊！,-99
2177685,好大的量[为什么],-99
221790,必须坚守这一底线不,-99
217105,即将逆袭！注意买入机会,-99
3689481,市场为何对端午利好不买账呢？,-99
325290,很快雄安新区概念股票资金将大量转入军工板块。,-99
1558389,小散洗的差不多了！[不屑][不屑],-99
4226062,2.31就解脱了！快涨点,-99
560444,四块以上才卖,-99
1681463,垃圾，卖梨，买个几把最多一个梨子2毛钱，直接,-99
1793762,600537:亿晶光电关于2017年第三季度光伏电站经,-99
2176548,根据万业中报，算一算万业下半年及明后二年的可,-99
1041435,"002001从低于600297三元,现已经追平超越,换0020",-99
356458,散气搞不赢byd，明天大跌,-99
3428509,2017-5-24（星期三）收评：,-99
1607906,无所谓，扯淡的市场,-99
1585312,底应该差不多了底应该差不多了,-99
3029203,呵呵，还可以在水里憋一段时间,-99
191149,华润双鹤遭遇转型阵痛：因价格垄断遭罚 屡陷质,-99
3613541,这股什么时候涨？我来告诉大家准确时间：待2020,-99
5376168,我不是早说此股庄是游资吗?谢各位的提醒我准备,-99
1065494,拉高出货了,-99
5156487,火箭发射,-99
1795457,一追就跌，时运不济气死人啊！伤心！破鼓,-99
773698,IPO常态化了，加速股票退市。市场修复指数，分,-99
465346,狗庄，庄狗，乱叫成团，难以分辩。,-99
1180231,机构庄家不大买帐，小编勿删！,-99
234098,故意压盘！故意压盘！故意压盘！,-99
2687233,还有五分钟的上车机会[大笑],-99
3704101,"现价5.82元交易的是5.68的资产,每年能增加0.80",-99
3581321,好牛骨，支持国泰破产清算。,-99
507751,前一章讨论了在上市证券中如何选择普通股,-99
5243830,股价高了，小散不敢跟了，主力自己_倒(:∠)_吧,-99
1008990,000709.sza,-99
2514742,600729:重庆百货第六届六十次董事会会议决议公,-99
3149771,香明实战口诀案例探讨（）,-99
3988532,防风氏就是个五毛,-99
5075255,19股发重大利好公告，1股发出加特利见底信号,-99
2432250,促使一批短线筹码割肉后，光明就拉起来吸引他们,-99
1546366,[胜利],-99
4270496,跑路开始了,-99
5289899,涨的和蜗牛屎一样，跌比他祖宗下地狱还快，请问,-99
3972360,五元的本已经被套了两年了，我这辈子能解套吗？,-99
5280522,垃圾就是垃圾,-99
2328042,告诉我一只复权6-600元历史高位站三年的股，南,-99
102989,今天都是小游资在买 大主力在压盘 谁都赚不了,-99
3500562,增发不结束，这股永远没出头之日,-99
1370065,盛和资源600392短线关注，主力资金还在，随时都,-99
1858725,0423价值投资，下一个茅台，股价创新高！300059,-99
2230436,已洗干净了，拉升在即[大笑],-99
356367,明天低开低,-99
3065264,红盘发新股,-99
756794,大家有没有觉得今年看逢,-99
429245,兰花应跌停洗,-99
2616263,在要求股市稳定的背景下，每次下跌都是入场机会,-99
1927992,今天这成交量算.....太少了,-99
2577063,资金流向足以证明主力正在大口吃货，买买买买买,-99
769948,看好海航,-99
3029570,大盘如果见红说明晦气来了想来坑散户了！千万别,-99
1866228,君在外 6月末7月初 别指望大跌 但之后 呵呵 你,-99
4491344,诺帮主力大换手出货！,-99
1578395,这些庄家的套路要学会识破,-99
3303420,9.14砸给我的筹码我还怕个鸟啊?。,-99
3661563,涤纶长丝去库存周期将结束 关注行业龙头公司。,-99
214583,真厉害，今天尾盘进来的资金都被砸得爹娘不认了,-99
720331,黄伟，你爹阳痿，该补伟哥了,-99
981764,这垃圾，再不割，更待何时，难道你一定要跟钱过,-99
3122594,41块，就看谁买，呵呵,-99
4114422,603021:山东华鹏关于股东减持股份计划的公告,-99
3889437,A股上市银行又将添丁,-99
5261732,开拓金融创新  信雅达(600571)传统业务保持领先,-99
4373951,幸好昨天走了。就知道不可能高点。等破70慢慢建,-99
5273306,这股怎么了，昨天涨得少，今天比别的股跌得多？,-99
2398072,均胜电子，你这个挨千刀的，怎么涨这么快。吃个,-99
1341636,粗暴去杠杆机构大户爆仓中国股市还有希望吗,-99
3961334,H没跟上来，跟上来A才敢大整，H大部份时拖后腿,-99
1254125,扫货的出来了，明天9块站好了,-99
694692,哈哈 回来再看看 今天我走的价是最高价 谢谢,-99
3961107,败在大盘，服！,-99
329018,开创国际：小间科技拟继续增持1.99%,-99
2719247,太吓人了吧。只跌不涨！,-99
3838052,耐心等待！。,-99
3676151,纺织指数正在逆势拉升,-99
3127418,600886:国投电力关于代偿东源曲靖融资租赁款项,-99
2979992,天汽模又上总手榜前20名了 这个概念危险了,-99
2394909,一分钱磨一个小时；,-99
5068842,你最想对龙马环卫主力说的一个词语是什么？,-99
3961477,中远海控(601919)融资融券信息(11-30),-99
5166599,继续死着,-99
5250791,看看你能砸到哪里去！下周继续加仓！,-99
3088435,垃圾股,-99
2843067,的一,-99
2858199,郭总你的决定给我们带来巨大损失，是否可以发起,-99
1415106,周五大盘将为周线而战！,-99
2357205,不担心了20.77的成本了。,-99
5117492,股友们董事长我]钱呀，对不住。,-99
3014702,构极度优化，利润率上升一万倍,-99
170298,减持新规显威力 减持公司数量下降明显,-99
2095457,说说看 持有这个股最久有多久,-99
2980052,离这支股票远一点！它开始玩人了！,-99
2370989,来看看亚通这个娘炮！哈哈。都几个月了，所谓的,-99
4009608,控盘真的是没得话说了,-99
3887284,抛单大大滴[滴汗],-99
5061699,兄弟们坐稳了,-99
4059295,寻找超跌小盘黑马，关注:日上集团，准[献花][献,-99
538217,看一看酒类,-99
5148116,岱美股份下周股价上40元主力资金把散户折磨坏了,-99
1772983,跌不动了A可以买了！。,-99
4151175,搞毛线又冼盘,-99
1302167,砸呀，庄，涨时装怂，跌时装狂,-99
2155593,除了上海国改，还有年底摘帽翻倍行情，一定拿好,-99
1160463,混改第一股的下场：预计2017年1月至6月累计净利,-99
2311251,货币政策保持稳定,-99
2737118,"私人时代,控股少于15%银行股容易被收购99999999",-99
4015987,4.7日大盘短线冲高空间有限，再次出现技术性障s,-99
592253,每天几分我也陪主力一直磨、就不信主力的钱不要,-99
4130452,离宽街减待计划止还有十多天，最近应该还有下杀,-99
3780425,走自主创新特色的央企发展之道 2017-11-29 08:5,-99
1612120,快下来。,-99
4685861,撤底洗盘 ？还是庄溃逃 ？,-99
287472,冬奥会张家口赛区规划,-99
1096837,最近不涨原因。,-99
1778160,到了临走的前几天天啊,-99
1962927,太垃圾了吧，这都跌成什么样了，还不涨点。,-99
1392990,没有重大利空，出现非正常大抛单，明显操纵股价,-99
764165,这得套多少人？加仓？。,-99
1385419,沪深两市第一断子绝孙的狗逼杂种企业…安源煤业,-99
3583477,大胆关注券商B 发财 [傲][好困惑][俏皮],-99
3097521,蜗牛背着重重的壳......,-99
429139,哈哈，领教国企怎么骗钱了吧,-99
512704,航运融资租赁之工银样本： 探索联合租赁模式共,-99
2468364,三是要引导良性创新。在管控,-99
2589860,对了错了希望一笑而过,-99
4519096,这股有问题,-99
78254,还有更低,-99
3930583,加油加油！做个龙头[牛],-99
503891,缩量，说明惜售。[大笑][好困惑],-99
5442452,浙88888888：次新股关注海量数据、华立股份，昨,-99
4483318,这票挂单如果在100块以下买到，那真是运气了。,-99
2786916,申万宏源：A股纳入MSCI,-99
1037783,等等看，还有一跌！,-99
5393116,日，为了补仓其他股一个多点卖了,-99
464964,什么叫？财产性收入，知道吗？你个傻货,-99
3292046,在上涨过程中,-99
1664482,瘪三，没治了。,-99
5476358,次新股：我就是只服“大理药业”,-99
857114,黄线走得不妙,-99
2458383,嘛呢？装死呢。。快点…,-99
2475782,素弦尘扑,-99
