,content,mark
1164397,还是港股牛逼，老子就是不停牌。大A看不懂。,-99
1295856,B股筹码少，无增发，无IPO，更没大小非，股价是,-99
1700853,流入版块稍多但流出更多，,-99
1626840,还不如买三一重工，死黄金就是一坨屎！,-99
4460172,害的我今天追涨进去的雄安股损失惨重,-99
3917120,过了大概一年,-99
451677,白胖萎了,-99
4422775,与其...不如,-99
5085922,要有信心，无论怎样，都是向好的方向发展。我爱,-99
5477251,弱爆了，不能碰。,-99
1455430,给我继续砸！,-99
3626393,这垃圾,-99
4091283,我这么做到底有什么意义,-99
1933172,快跑吧，不跑后中悔。别看现在闹的欢,-99
630724,看来是诱多！！…………,-99
4369000,朋友们，这股还能补仓吗？,-99
1722175,为这些知识并没有,-99
2389082,600697:欧亚集团第八届董事会2017年第三次临时,-99
2762454,看样子还要跌，刹不住车呢,-99
1709700,其他股同样跌出了机会，对比下南京医药，只有盘,-99
3791458,现在买长城汽车如同十年前买格力电器!,-99
2484795,好久没涨停了。今天拉涨停？,-99
5404265,合成股份要跌到14.90，大家都在14元左右接盘，,-99
3759436,中国太保(601601)融资融券信息(10-20),-99
1569796,不涨  不跌 必须涨  继续看好,-99
1765962,已经死叉了，明天看谁跑得快,-99
1568447,这么傻！,-99
2605940,打分,-99
4686651,骗我74出来了的马吊。,-99
391782,没时间了，呼叫主力，拉涨,-99
3008171,航天长峰(600855)融资融券信息(07-03),-99
3743988,问，下周发几只新股呀？,-99
4948875,大盘涨了，它到是跌下来了。狗庄,-99
1756708,600527:江南高纤关于使用部分闲置募集资金进行,-99
1103929,也依旧只是在悄然的独自欢喜着,-99
2581600,你们这些啥笔，当时在12元，哥就提醒你们要出来,-99
4168870,603038:华立股份第四届董事会第七次会议决议公,-99
5170191,机会就现在,-99
1224418,你从那里，回到那里去！哈哈哈哈哈哈大笑。,-99
1672024,周五已提前介入( 300277 海联讯 )600882广泽股,-99
963594,动脑子想一想，分红率仅0.25%，大资金不卖股票,-99
594393,600172对待上海明匠，类似华润对待万科。,-99
4963285,畜庄，你继续压吧,-99
5126564,去看了其他新股股吧，都没有阿科力签友团结，朋,-99
5389407,沪指做到3061,-99
2715461,砸。猛烈的砸,-99
2428084,人工智能规划落地：2030年产业规模将达10万亿。,-99
5021850,怕个鸟，又不是亏损,-99
4417056,压着收货吧,-99
3161997,完蛋了。我要去抓锂电池的尾巴去。说不定还能把,-99
4431098,开始吧！,-99
4890040,没人要的垃圾，跑,-99
1060559,又到一年一度上市公司高送转信息披露的时候,-99
2699197,今天收小阳线明天拉大阳至少有个长上影,-99
3076184,韩国希杰沈阳工厂5万吨赖氨酸产能于10月下旬停,-99
1257884,减持新规为何没能提振股市？,-99
4348501,主力出货！早盘8个点收到消息,-99
1643049,太弱了,-99
5337243,人理所当然的忘记,-99
3268261,方大化工000818：重磅利好来袭，短期股价持续飙,-99
353612,由读写经济学文章所想到的,-99
4642132,纯正一带一路概念股 公司的高空作业平台远销海,-99
4315589,今天已经过了13.77图形好看了！下午如果大涨，,-99
1078371,所以把视野放宽点，将,-99
4580482,房价天天涨，股价天天,-99
868108,二面针既然把好的公司卖了，不好的公司留着，按,-99
3775070,跌无止境啊！s,-99
4811473,它只是将投资者短线套牢,-99
4363670,单位新能源汽车项目怎么样了,-99
4805408,庄家去死吧,-99
4525206,苏州赛腾精密电子股份有限公司首次公开发行股票,-99
2327127,看看还有再低的园林绿化股吗！,-99
1635100,评论下，没有庄，所以没有资金拉，冷门股！,-99
749395,备案制最新动态！汤臣倍健旗下23款产品获准批准,-99
2808639,涨起来吧，在来一个小高潮o,-99
4471441,套它们！不能涨！,-99
4992509,哇2000手好怕？？,-99
2565115,任你长篇大论忽悠！都知道进入漫漫长跌路！,-99
3110263,一两分钱蹦哒好几天了 八戒你能不能成熟点,-99
3051417,哇，牛啊，今天又可以看深V啊！,-99
4989549,南威软件9月7日盘中涨幅达5%,-99
3493781,三江今日不翻红，接下来还会再跌,-99
3547621,这个大象自从2015年11月6日开始就一直瘟病缠身,-99
5485787,或是从高点大幅重挫而投资价值浮现时,-99
5372514,现在就怕机构手上的筹码如果大于我们挂单的筹码,-99
3898438,从近跌停到涨停又一浙江次新股成妖了!发掘下一,-99
359092,永鼎股份拟收购北京合力55%股权,-99
5169747,庄托不死阴跌不止,-99
4489639,我想知道为什么发行价的市净率就达到了5倍，证,-99
1453525,我刚输了血塞通液体属医保用药,-99
307004,上交所投诉邮箱，大家一起发举报信啊,-99
2584528,业绩暴增！股价暴涨！是硬道理！,-99
4245104,机构就卖1手吧，就1手得了。哈哈,-99
2653770,少年的不知愁滋味却强言愁的光阴里,-99
1548176,一只臭苍蝇！,-99
5471721,两市最垃圾的股就是你个垃圾了！,-99
1059492,不死不活n,-99
821896,n未来的海洋军事龙头股票真实价值100元金信诺民,-99
1589910,"急跌不抛、急涨不追,不跌不买",-99
4484443,还有下跌空间，等待破前期底点52.08元,-99
769902,"老牛周4收盘单,继续满仓",-99
5069798,高送转不再是,-99
5331677,第一波赚钱的不少  能拿出来利润的却不多   幸,-99
1420719,雄起！,-99
857489,你不会带上你们家的狗！去雄安先刨个坑种颗树！,-99
3427317,沪深・两市2000多个股吧，唯有此吧 冷清。,-99
5013089,看好就别看盘，这股跌不到那里去的，越砸越买，,-99
2590348,上实就是恶庄啊，玩不起了，我先走！,-99
3408517,短线的走了中线的慢慢也会走还有和我一起的吗,-99
4844611,603556:海兴电力第二届监事会第十一次会议决议,-99
3376402,不跌停你就去死,-99
4302024,要死不活的还洗个毛？,-99
2113197,对该股不要存有幻想，经过两次10送3股的红利，,-99
2529977,不负众望，终于垫底。,-99
3338534,双十一  老干妈  马应龙 能否走向世界,-99
2285237,庄子曰：亡身不真，非役人也，，胖胖用最通俗的,-99
293600,[图片],-99
1960983,不破24不立,-99
2110474,收货了[献花][献花][献花][献花][献花][献花],-99
3614534,幸好，迅游是越解禁越高走哈哈！,-99
291716,中视传媒(600088)融资融券信息(12-18),-99
112859,有人说茅台要到600元，我确认为是逐步清仓时间,-99
2200105,哇庄托说要跌破15元、吓得我17.66马上再加仓6万,-99
423600,核心内参泄露（002599盛通股份）要大涨,-99
2470001,我说你是个垃圾股真没错.,-99
2059017,难道要和大众公用整合？二合一？,-99
2232114,只剩下苦熬许狗了，杀了给土狗江南老贼下酒。,-99
3870613,今晚十二点决定A股命运，入不入MSCI 明天大跌，,-99
1049357,哈哈 终于走了。,-99
3833154,郑煤机提醒你注意：千万别涨！,-99
2857463,嘻嘻嘻嘻，港股3.94了，这里还在想办法逃x,-99
2002877,老是停牌，真晕。。,-99
4718088,定22.66下方在进,-99
4898357,要跌快跑！[亏大了][亏大了][亏大了],-99
4012218,还挨住扇，自己脸肿的还不够大吗？,-99
2423276,操盘手水平不行，还雇了这么多托在这里。哈哈,-99
1752410,关注公告,-99
514176,下周铁定破24，随着大盘稀里华拉。七里卡察，别,-99
1152140,下跌到3100之下时存在一定的阻力,-99
3281568,今天能大涨吗,-99
4666999,主力意见不一致，后市震荡为主。,-99
4894554,A股市场从不缺概念,-99
783873,阿斯顿马丁两新车8月亮相 全球限量28台,-99
1454985,莫要怀疑人生，人生如果不被别人忽悠，也许也很,-99
2944138,今日必涨停如不涨停吃屎66666斤。,-99
2576818,这是要跌停吗,-99
1608778,福能股份(600483)融资融券信息(07-13),-99
465665,[拜神]不急不躁  不温不火，时机到了，自然有收,-99
1155150,现在就去投票表决,-99
5060420,迭，加速迭。,-99
5026332,中签+买入,-99
3874925,9.1限售解禁,-99
1906798,kdj高位，怎么操作？,-99
2245576,薄膜水处理技术连获中国环保企业采用,-99
5455033,我是新来的,-99
3145977,股票市场变化是挺大的 但是我最近都在做黄金股,-99
4162157,今天不走，明天跌停。立帖为证,-99
5539685,可惜错过了6.40元，慢慢等你哈！,-99
5089811,大盘牛市初期反复无常，三千点,-99
4837535,看来止跌了，29.9半仓进来，明天板一个,-99
5027995,恒林 啊恒林,-99
4529281,烂庄，有行情不拉升快赚，没行情你干亏。,-99
51641,流动性严重不足,-99
855573,在来几个大单卖啊继续,-99
3902181,目前总市值位于两市后40%,-99
924380,G,-99
4475035,今天把3200给收了,-99
4017408,真乃狗屎不如的孙子股！,-99
2892832,冲击3200的节奏？,-99
1492036,远离炒高股票随时闪崩今天是开始,-99
2713978,典型的庄家吸筹手法，看来行情要来了。。,-99
2551530,又要大跌,-99
1396631,你麻痹，就差老子这3000股，2点40左右10.29卖出,-99
2762079,没想到这是我买的最垃圾的股票!,-99
737205,购房者一周接了五个贷款推销电话,-99
3177115,你离梦想便更近,-99
1062571,都说是衰股了，输光逆势而下，牛逼不,-99
3202153,华西持有的股份都是禁售股怎样买出，只所以没有,-99
3061216,[微笑][微笑][微笑]和哎米里预计的一样 次新,-99
5114098,两个坟头，不知埋了多少死人骨。,-99
2564641,尾盘又要跳水了,-99
466232,三季度1.158加上四季度到帐的两个多亿全年业绩1,-99
5012226,明天开盘，有机会就做T。拉低成本，坚定持有优,-99
579735,今天进了5000手,-99
1940887,中国品牌电机国际化潜力巨大！世界质量一流！正,-99
3683794,我在7.4以后等着你！,-99
2853239,操你妈主力,-99
420371,603041懂行的看看~,-99
2278493,《尖峰集团近15年全部重要资料》未来趋势 2个抗,-99
4123887,美元指数要反弹了，国际石油空头又要后来了！,-99
3376884,逢低买入，恭喜发财。,-99
844566,特斯拉所有车型可能会全部替换为 2170 号电池!,-99
1050622,通过短期投资类保险品种进入股实体企业第二2000,-99
4807457,翔狗家的祖坟已经冒青烟了，它已经成了孤魂野鬼,-99
3329582,卖完了，心里踏实了,-99
1156251,收盘18.84，一发发死,-99
4918282,就个股的情况而言,-99
5079074,诱多东没力,-99
3149779,「易选股」创业板大涨背后：证金亏本清仓两龙头,-99
5504962,看你怎么吹逼,-99
