,content,mark
1260448,转让精品尾款必须在8月前到账，这公董秘是个操,-99
3189989,费性贷款等违规进入房地产市场,-99
4671217,我说是好股吗,-99
1040626,物色旧时同,-99
4573807,张远林.股票全景手册.0821收盘,-99
4764854,伦锌涨疯了,-99
3956031,媒体一致看好，既然都看好谁在卖？不算从三月底,-99
848639,新项目预计今年11月份实现 盈利,-99
5255836,要跌停了，快跑！,-99
4129687,发的帖子都不出来，怕被人说啊，赶紧撤，大股东,-99
386471,只要中央汇金资产管理有限责任公司没有跑，好戏,-99
2265273,加之当地房价政策和房价的优势,-99
5138494,以为中报很烂！！！！！！,-99
4521856,真真持有的，千万不要唱空，感谢空军！,-99
834761,减持新规和入摩两大利好正在发酵！,-99
2819673,大市值蓝筹上涨的意义,-99
3178180,汉终精尽--老汉推车，精尽人亡,-99
967462,建议下午2点到3点的交流会积极参与,-99
2617158,散户不要被压盘吓到，压盘越多越要涨,-99
4024938,你们知足吧看看首床跌的比这厮海难看,-99
1078625,华泰股你可以继续拉，就是没人接盘，,-99
5279791,603838:四通股份股票交易异常波动的公告,-99
5351315,兄弟姐妹们，捋起袖子加油干,-99
4416023,月底来建仓华正新材，等到11月30号[微笑],-99
2575816,雄安加速背后代价惨痛,-99
249982,最佳的交易机会必定无法获得普遍的认同,-99
3672896,喔，这才是大A嘛,-99
2159480,IPTV行业高增长，东方明珠持续受益,-99
3204019,以后碰到死逼股，亏了也要卖!,-99
4374238,全球半导体收入增长创新高  产业链公司受关注,-99
2577918,25见,-99
2784844,海运垃圾大盘涨它跌，大盘跌它必跌，这就是垃圾,-99
468946,长城动漫:关于控股股东及其一致行动人增持计划,-99
3791652,长城汽车，开盘怎么走？ 大股东二股东持股92%，,-99
2043645,张无良，你爷爷万科市值3735亿了，你亲爸保利15,-99
643107,快跑 ，京东方追上来了。,-99
2059665,经济全年“前高后低”节奏预期正在应验。,-99
1740844,再砸凶猛些，准备再加点仓！,-99
3452805,中国神华和国电集团合并成立国能投,-99
2058160,你看出公告里的奥妙了吗？,-99
3814656,周线级别没调到位！,-99
1599088,退市吧，垃圾,-99
4908094,如果爱奇艺借壳，大家说说能值多少钱？,-99
1925273,雄安起来东,-99
1656144,好的出现,-99
5059877,拜财神中肉签[鼓掌][鼓掌][鼓掌][鼓掌][鼓掌][,-99
3969771,吉视传媒(601929)融资融券信息(11-10),-99
3231913,开始割韭菜。,-99
831269,周末听歌，送庄托，马甲(及盲目唱多，唱空者):\t,-99
2308962,茅台“倒下”，中车接力，中字头有大动作――这,-99
2279533,一个人一万股，三千人投反对票就是3000万，就是,-99
4805626,金三肥高高在上，任务完成如要跳水，大盘会受不,-99
5499412,解禁的快出完了吗，每天快收盘时你都抛些，,-99
1335464,相信自己涨上去,-99
5307535,散户都跑得差不多了,-99
3907657,新能源的总龙头在下跌。,-99
681806,谢谢，今天补回昨天出的一半。,-99
5435944,开盘以来第一个向上跳空缺口没有当天回补，有希,-99
4665221,次新股年报高送转，高派现业绩浪开始打提前量提,-99
3100712,成本9元，走人,-99
1413050,伟大的二点半准备上演跳水比赛！！。,-99
1716225,兴业投资原油周评：多方利空席卷 原油终结三周,-99
3361977,看趋势，有加速下降的意思。各位小心[复盘][复,-99
453778,垃圾哪里敢涨停，涨停就卖,-99
1465960,该公司发布公告,-99
3971105,   Pennsylvania 132 41（注c）,-99
1942187,待把宫眉横云样,-99
5234618,浙江诚意药业股份有限公司首次公开发行股票招股,-99
2692788,要涨停了，今天大户增仓最多,-99
1426693,我的狗狗又发疯了[大笑],-99
516308,今天要跌停！二货们，这就是你们的梦想！。,-99
4672368,砸，接着砸！  敢砸破22我就交筹码！！,-99
3481042,17.15买了5800股。怎么也要轮到券商了吧,-99
5038919,谁能告诉我这B咋地了,-99
361902,600106:重庆路桥第六届董事会第二十一次会议决,-99
4408790,22块附近肯定盘整几周几个月，不要做梦会一天涨,-99
2409735,今天是250抛单，是在嘲笑么,-99
5138181,不要动！一会涨了,-99
4234773,今天买进的，真的是吃了豹子胆，敢吃庄爷的票，,-99
4246496,买到好股就是价值投资[鼓掌],-99
1939528,哦，哦，哦,-99
4089310,当股票以温和方式向上运行时，主力为确保下,-99
1938949,从周技术看：主板中小板创业板下周一都将涨100,-99
3616632,缩量反抽必有妖,-99
2108611,果然比开吧,-99
2717310,支持大跌下来，大家就可以参与了。,-99
874829,记好，信雅达只会跌不会涨，别被骗了。。,-99
3325835,手攥金蛋也怕洗,-99
4838991,你个太阳！还不如利群！至少人家现在还涨了2分,-99
2248181,好股多磨,-99
881998,尾盘成功卖出，增持完又是一地鸡毛。,-99
27522,垃圾,-99
800713,吃[大便][大便][大便][大便][大便],-99
3168288,本桃花凤舞霞飞对当今中国股市综述:一带一路是,-99
5550855,最近的4根阴量线说明：浮筹不多，静待拉升！,-99
529887,换换换，第一创业才是龙头,-99
1788149,再等等，到年底股价16元！,-99
4564263,万手哥你来呀,-99
3496781,社保基金都跑了,-99
947659,垃圾中的战斗机,-99
1874,大盘指数：,-99
1267115,垃圾,-99
1632815,:鹏欣资源(600490)Gerald Holdings LLC 35.375%,-99
3421648,1220捡钱,-99
4123749,大豪科技，大家帮忙看看我是不是该卖了？,-99
1201658,这种好股要守好  买点出现大量买进没错,-99
3610807,快买，涨停来了。,-99
2665118,主力从15元上方打下来，当然想低位建仓，谁都想,-99
3167648,600896:览海投资关于复牌的提示性公告,-99
1252372,看来新农是准备彻底改行了啊！说实话味道不错！,-99
3771826,每天一毛，不是让你闭嘴十天吗？,-99
3133823,资金存量博弈、轮流调整与上涨，避高就底,-99
2163809,今天中午一个公告引发的群体高位被套事件,-99
1473799,复星系昨天又闪蹦，莫非真...,-99
3502516,如果今天收3271左右明天将现普涨行情。,-99
1445432,大盘昨天卖点出现，相对弱于大盘的现代制药下跌,-99
2878901,15收盘,-99
5342306,这只股票不是一般的牛,-99
293706,有337.5亿的信用债取消发行。,-99
1166507,港股啥情况,-99
3651623,47个问题将汇聚到一起就是“双轨”二字 ！！,-99
4294303,建设股票全,-99
4007116,刚发的帖子就被删除，万手单不买进,-99
3706240,报团取暖，哪保本，就去哪。,-99
2452658,"定增价格6.55,加把劲",-99
3242304,一个涨停比一万个研报都有用，研报助跌，真觉得,-99
3155874,就等着明天涨吧,-99
3054741,估计2014年熊股就是东宝了。,-99
2561754,华域汽车(600741)融资融券信息(11-02),-99
924493,人生如同在大海里潜游，只有克服海底的重重压力,-99
4047294,在一次上演高开低走,-99
2967265,拉高就卖，今天,-99
356485,俄3， 工作,-99
5408171,26.86差不多收盘,-99
1779115,这撒逼操盘手，再压把自个搞死,-99
1101216,这股票走的莫名其妙，应该是十大股东里面的大散,-99
427708,美丽生态:独立董事关于第九届董事会第二十二次,-99
1792576,转发一个--“价值投资”是块遮羞布 对2018年股,-99
2501428,A股彻底完蛋了，洗钱机器，亏10万彻底清仓了！,-99
1397866,又增持啦！给力,-99
4460389,做空者，为你们的洋祖宗打压股价好让你们殃祖宗,-99
3428877,爽 昨天介入的今天已经接近2个点盈利 求往上拉(,-99
4976766,尾盘那个300多手的逼想压盘，可是没人卖[大笑][,-99
4925693,没什么大盘涨它不拉升，偏偏大盘跌的时候拉，是,-99
4947140,正常不过,-99
1006440,这次调整也是比较剧烈的,-99
2805369,补仓机会来了，抓紧时间补仓,-99
3094877,全是眼泪.8块3套的我不能呼吸，每周看下全是泪.,-99
319394,工厂上班没半个月就自己跳出了工厂,-99
1467596,这个时候也只能以时间换空间了！风口到了才能飞,-99
4657302,不懂操作是,-99
240210,散户早点跑路啦，少亏点就是赚的，之前11元我就,-99
3077794,有些过分了.这种公司的产品不能再用了.,-99
5035147,准备子弹逢低补仓,-99
3960651,可以说迫不及待，穷凶极恶，新集离有事不远了，,-99
3779185,中字头，咱能争气点吗？？？,-99
1530548,当心十点半效应。,-99
2527534,一些周期性行业公司的三季报业绩值得期待。,-99
2947418,痛苦煎熬中.....,-99
1710114,看看600515重组成功后怎么走的。,-99
2557980,煤炭是给钢铁提鞋的？,-99
4747179,放到2019年6月份。,-99
170795,不卖等着一。,-99
3785148,嘉泽新能8月29日开盘涨停,-99
3937266,破净了 大家不看市净率的么？,-99
3203082,银行股倒数第一，有性格,-99
4763784,7月15日前可知：今,-99
3460306,探底成功，明天回踩上涨，等着收银子吧,-99
3622983,再下来点我好接盘[鼓掌][拜神][拜神][拜神],-99
3494363,[滴汗]惨了，今年双十一没得买买买了,-99
6862,每人亏10万以上也不过分吧！又拿假数据骗人了,-99
3537244,外国银行股市盈率20  坏账率6%   兴业银行 市盈,-99
2636058,明天还会公告什么？停牌？,-99
226577,板块呈现普跌态,-99
49435,皖通高速：重大利好，影响今明两天！,-99
1678305,利空出尽 严可能在配合 搞西昌电力阳谋!!!,-99
5426586,又是诱高的一天,-99
3306667,军民融合第一龙头，庄家借势拉升，有望成4月最,-99
3585812,不是大跌就要大涨，看这走势要大跌了,-99
2928239,价值投资当道，行业细分龙头不断被发掘出来。横,-99
2040718,官方消息，喜春节来咱湖南天雁视察！千万别抢！,-99
3726178,离砸盘不远了,-99
2128564,这周重点这些板块的低吸机会！,-99
1628641,压盘有效,-99
904127,抛了这么多，立即涨可能性不大,-99
1991796,国之利器-京东方的创新故事-原创-高清视频-爱奇,-99
1526786,血雨腥风创业板，步步杀机在眼前,-99
1920198,智能物流前景光明…… 300240……300013,-99
1869495,请双煞放心，我们通过抛售股份，随时狙击恶意上,-99
5119342,像这种突然拉高！又突然拉高！资金放量的！删除,-99
172327,走完了就涨了,-99
5366110,今晚特停，说说为啥拉,-99
1360800,"跌到一分不剩,一股也不卖,连股民的利益不关心的",-99
5542292,近期市场一直缺乏热点主线，风格变化飞快,-99
5082317,你是妖股，快起来吧,-99
3464604,只有真正领 会了庄家的意图，才能与庄共舞,-99
507744,夏门港大幅上涨A大连,-99
5363809,今天国务院常务会要求加快政务信息共享和服务，,-99
4655354,这股得了非洲疟疾,-99
3368788,___≤大同煤业这样入手的时机，真的忍心放过吗,-99
