,content,mark
2659716,哪家强？先来看,-99
4602636,千锤百炼造就大底，反复狂轰滥炸造就铁底，11月,-99
918653,方便北上广深的住房公积金划转到其他地区,-99
4148017,[图片],-99
3493986,劣势翻红，结果呢vvbbbnnnn,-99
3316306,600986:科达股份2017年第六次临时股东大会会议,-99
2613693,追求什么东西？生来该做什么？,-99
188485,却是乱山尤远,-99
3222409,呵呵，这货做不了龙头老大！,-99
39095,靠几个大盘股拉指数。丢人。,-99
3849398,很多朋友问我后市如何，我说要死一起死。,-99
1757709,每次都是尾盘一拉,-99
4514801,阴跌之后就是加速下杀,-99
314064,自选股全部飘红，今天是个普涨i,-99
4856202,哈哈哈哈哈哈,-99
3808082,建筑涨,-99
3432722,"还是跌的少,明天希望再下跌一个点,我就加仓了.",-99
561364,傻逼才会在这里一分钱玩一天呢。他的没有手续费,-99
5247124,拿着吧，这个主力成本不知道多少,-99
5501073,明天涨停,-99
1152012,数字截图都不能发？为什么？,-99
3717643,（原创）20170526又见3120，还能反弹多远,-99
5489992,对此股我一直都不抱什么希望，懒看的，知道它就,-99
32091,600008:首创股份:关于《北京首创股份有限公司非,-99
1835048,垃圾,-99
5538823,跌吧,-99
811428,11过后，18元以下，,-99
5232063,豪能股份11月29日开盘涨停,-99
2353509,深蹲之后见分晓，石油比矿泉水便宜多了，正常吗,-99
1581355,90倍。三、保监会：禁止险企为类ABS业务,-99
111243,不如一只st公司。,-99
2752279,"这个价位,越是打压越暴露其动机",-99
1192324,昨天买的今天见抛压太重亏一个多点卖了，该股可,-99
1596122,狗逼股.清仓,-99
728017,紫江绝对有问题。彻查,-99
3977495,庄家洗盘300369快抢吧,-99
3662925,最近事多繁忙！持股金额小的达到一定数额后解禁,-99
800900,%9%9估计要盘整几天了中长线看好。,-99
2626837,佛家开光即可，股市也开光,-99
129947,最高法：“徐翔案”最新进展 各分案已陆续开庭,-99
4943475,我从年月买入大智慧一直抱到年月亏损卖出有权利,-99
3626112,感谢您时时把我们挂牵。,-99
4450850,看空的贴 都删了 大家要小心了 想高送转填全破,-99
3301804,料新技术，等等,-99
2604781,从趋势时点上来说,-99
4443474,现在散户的成本比弱庄低多了。哈哈,-99
5272802,可能是大盘跳水导致的结果,-99
5094077,受不了 卖了 明明都走坏了 一群不知道是不是股,-99
160060,香港恒生指数开盘涨0.1%,-99
4158308,国内手机厂下半年新机，几乎清一色使用用京东方,-99
4021870,给炒股的人,-99
3747614,小盘股的机会 近期市场出现较大幅度调整，沪综,-99
4553838,买入或补仓原则，5日线放量上轨，回调不破前低,-99
3710864,资金都去玩玲玲了，你们还在这儿麽阿[亏大了],-99
2635594,大家来帮忙！年底了，我们单位要评比。对于我这,-99
4975426,主力出货进行中，闪崩不远了,-99
1159922,天通股份和太阳能现在都在历史低位，现在买到就,-99
1050261,倒T型K线，是不是要跌破4.7,-99
3558769,国家队淘金: 日线锅状，周线背离，月线低九,-99
1950782,再来看看[大笑]调仓好机会,-99
2854741,一直在砸,-99
4466775,明起开启新低之路,-99
1463237,哈哈哈哈哈哈今天又跌停。,-99
4205402,卧槽，开始硬起来了[胜利],-99
3350099,煤炭价格现反弹 四股或受益腾飞 2017-11-27 证,-99
14801,防守对方,-99
452135,真几垃圾，银行股倒一,-99
1681852,顺势而为，人弃我取，人取我弃。,-99
4169335,东旭吧内的广告、老帖了、多如牛毛，看来没少给,-99
2080180,600616:金枫酒业关于公司2017年半年度募集资金,-99
3886244,等小散都磨光了，光大就会拉升！,-99
1308619,暴跌开始 哈哈,-99
3151290,能不能换种套路?这也太不要脸了!,-99
1620613,机构调仓换股，别买了,-99
3822199,我全抛了，应该涨了吧,-99
2908396,把网络游戏玩成单机自撸，主力了不起,-99
4099573,为公司从整体上的扭亏作出贡献,-99
3954835,下午有没有万手哥？[牛],-99
988668,今日20只股长线走稳 站上年线,-99
328499,呈现小幅上涨,-99
961747,恒瑞医药(600276)融资融券信息(11-13),-99
2516264,都卖吧,-99
2571221,鳖孙氏垃圾桶越滑越远！,-99
833441,底部出现了吗、二次探底结束了吗？答案在此,-99
267450,无,-99
1666068,换了一套班子，未来想象空间巨大,-99
3624240,增量资金不足的同时IPO大扩容却仍持续不断,-99
5334999,路过看看这个孬种。,-99
125289,什么是垃圾,-99
34433,大盘下跌已成定局“首创股份”只要跌破此支撑位,-99
2291335,华圣重建主板吧，老退股利好频频现三板吧。,-99
775155,三票赚钱很简单。,-99
710767,死叉向下，命好苦,-99
1481477,"连发个议论都管,股市违规的多管管好！才是正事!",-99
4152534,婊子养的东,-99
5370956,今日继续增持、受美国暴风雪天气气候！,-99
864594,为公司从整体上的扭亏作出贡献,-99
2252147,三季报：外延内生双轮驱动教育业务快速发展，股,-99
5317078,谁买这只股票倒了大霉,-99
4612904,603328:依顿电子独立董事关于第四届董事会第三,-99
5503966,[拜神][拜神][拜神][拜神][拜神][拜神][拜神][,-99
4446471,你家死人了,-99
4775957,能拉吗,-99
1503971,砸吧砸吧砸穿不是罪，再强的散户也会流泪！[胜,-99
5334960,这垃圾就这样，钢铁涨它跌，钢铁小跌它大跌，次,-99
2230699,我相信郭总，郭总加油！复兴加油！,-99
5493601,都还给你可以的,-99
4147503,什么意思？？最后一把279000股谁买的？315000股,-99
4860140,坚持自己坚持原则，不看股不手贱，耐心持股做等,-99
5086471,军民融合，主业航天燃料？,-99
4534375,哈哈！ 上午买，下午卖，不错！,-99
2001189,加把劲跌停 看一下会特停不,-99
5149984,有人不想出现在半年报！今天6.30最后一天了！,-99
5532170,安然过了这,-99
1511529,水泥价格指数暴涨四周了,-99
911648,600400 红豆股份 ：集四大利好于一身，主力洗盘,-99
798254,靠 多久没有竞价了 今天竟然竞价了 不得了,-99
5543596,昨日回顾：七月收官战沪指新高,-99
2794479,赶紧跑14.36的压力位几天都无法有效突破，看看,-99
2654103,估计很快应该还会出消息吧，收紧的拳头突然打出,-99
4576152,603315:福鞍股份第三届监事会五次会议决议公告,-99
2433518,明天拉个板的可能性很大！,-99
660520,想动,-99
473661,发几张官网图片都不让发嗦？爱人同志收视冠军怎,-99
1669968,公司改名st氨水得了。,-99
2776669,试他二人有何主见,-99
4793691,都是割肉盘了吧？,-99
2453804,明日金股（安德利 603031)。,-99
3461429,今天做个梦，收4.22就好了,-99
182475,杜蕾斯,-99
4368949,透过现象看本质，苹果X不是因为指纹识别过时了,-99
2794883,华新水泥买入点适合吗？后期还有多大机率拉升？,-99
2874394,QFII一季度加码新兴产业 传统产业惨遭抛弃,-99
2546814,中秋来临之际，祝兄弟们节日快乐，阖家幸福。,-99
1653914,尊敬的董秘你好，公司的业绩预告大概什么时候出,-99
1633786,永别了，无良中铁。永不再进，立帖为证…。,-99
4841577,最新股市投资日历一览（附重磅经济数据预告）,-99
1501170,中国人天天清仓抛弃所有人民币资产天天抄底美元,-99
1100859,千淘万漉虽辛苦，吹尽狂沙始到金。,-99
3330231,今天至少跌3个点以上。,-99
2355387,飞天鳄鱼宣布，要涨早涨了，不会补涨的,-99
162556,艹，有大压盘，明显不上涨。去死吧。\t。,-99
2927117,江苏南京网友 你唱空这股无非两点，一点要我滚,-99
1734759,看把小散高兴的，紫光增持承诺已经完成，不仅不,-99
2809042,看明天谁接佛山的盘!拭目以待!,-99
4921119,明天热点接棒到5G概念，大胆预测涨停开盘[微笑],-99
1571771, 均线变动的角度反映了股价变动的速度，成交量,-99
2585101, 新股想要多封板，唯有中签户团结一致，每人几,-99
3776127,嗨个股惨呀、指数飞涨,-99
1047989,只相当于1300亿人民币也屡遭调查,-99
2590764,洗，沟昂！,-99
4348028,天目湖两天主力吸收流通股筹码75%，小散基本已,-99
4939042,快逃,-99
4416855,还有抛压吗？34之上？呵呵,-99
2188406,600644:乐山电力:中天运会计师事务所(特殊普通,-99
2355474,2.22.标题 ,-99
3856062,素娥未识,-99
4468818,36.32杀呀,-99
4316315,放量长阳突破，就在眼前。 看好共进的机构更多,-99
5518101,什么护板，什么100多，一切都是浮云！,-99
3721821,大盘:你的红了，正如我的依旧绿。我总是绿得比,-99
521371,每天竟价，尽是虚招，有意思吗。s,-99
3428619,！！300222英雄是时代,-99
3687101,继续往下砸才能夯实基础，超大单快来呀,-99
5457643,聊~结构牛市有[度] 百十只蓝筹繁荣 难受用,-99
3428663,短线别掉在诱空的坑里面,-99
1974203,面对碧水元，跌有丢人吧？还和人家成立银行，人,-99
2135985,当看到欧美股市大跌，是否好多人毛骨悚然？吓傻,-99
4713616,603387:基蛋生物关于对外投资设立全资子公司的,-99
311779,今天是两忍的生日，鬼节,-99
2117667,不成功你懂得,-99
1108247,明天请瞪大眼睛，欣赏洪都主力放天量的表演！,-99
731042,在山东莱芜日本企业朝日绿源公司租地1500多亩。,-99
3449285,西北的百货公司能有15倍市盈率不错了，早晚大股,-99
352335,沪深股指小幅回落 多头大旗毅力不倒,-99
3003276,1.2.3狗庄雄起。,-99
1829215,明天再给你们一个大阴线，叫你们去接，找死,-99
4685942,美军完成集结，大A尚未跌到低位…坐看云起时,-99
4018357,砸肿,-99
3180489,方大碳素和北方稀土可以重点关注,-99
2063145,看到老凤祥就是第一铅笔。立刻没有了信心,-99
2643950,回补缺口上新台阶需夯实基础充分蓄势，本周是重,-99
459243,吃不完的九毛五，垃圾,-99
4408888,皇马科技:本周加速上涨概率大，散户重点关注一,-99
2381179,贴吧乱七八糟g,-99
2457889, 文投控股听说筹码在这个位置，我要不要开始进,-99
1705289,垃瑟,-99
987728,小心，基本面强于ABC，股价弱与ABC,-99
4044993,今天感觉这股票吃了泻药，清仓离场，这股没有好,-99
3104263,垃圾,-99
5109358,对倒子弹已经打完，等会还会用撤单吓人，最终收,-99
5274940,证监会去查查,-99
4326145,尾盘还是把你卖了，等明天60接回来！,-99
346826,弹有腰斩的可能性,-99
1141965,海螺水泥怎么样？,-99
1687602,连八一的车尾灯都看不到咯,-99
806963,市场重大空来袭股权被质押上市公司突然停平仓？,-99
3868196,天天出货，亏点走人,-99
4049222,吉林卖了算了赌不过这个市场,-99
3487894,关注；中国中期000996,-99
