,content,mark
2422994,尾盘大跳水是什么意思？,-99
2834021,做股票有时亏损在所难免的，关键是如何做好波段,-99
4652981,设计总院坚持持有！近期会超五十元大关！,-99
4417522,你娘的，一会儿砸，一会儿拉！,-99
17787,才能在竞争中立于不败之地,-99
4504913,合盛硅业最大的利空就在眼前！,-99
835747,云南城投(600239)融资融券信息(09-28),-99
731436,新：新三板是新生事物 还,-99
3383712,配股最后都,-99
2150826,历史新低,-99
4464500,没量，继续阴跌,-99
3198287,苦苦坚守・,-99
1807071,蔓草沾衣多露,-99
1577443,还未开始上涨的真雄环,-99
4795403,看看日月股份马上破发,-99
158266,从该股走势和网友们发的图片来看，国际医学似乎,-99
2909375,香溢融通(600830)融资融券信息(10-10),-99
3048932,没连续性，不强势！,-99
2391336,千手哥不要跑，跑了就变鬼孙子啦！,-99
4142033,真垃圾,-99
4329453,此股别幻想了已经死了,-99
3120863,果然跌排第一位，能矜持点？,-99
3998696,比风神股份还差，我还是特地从风神换过来的。,-99
498786,离开真的残酷吗，或者温柔才是可耻的，或者孤独,-99
2660399,自选你都个,-99
4928581,股价大涨就是最好的广告相信善于营销的侯老板绝,-99
4791044,三季报周末披露 会不会高送转。,-99
3285981,此股震荡了20个月，交易时间超500日，如果狗B庄,-99
3832434,放量突破6.25再说了，摸鸡个啥[困顿][困顿][困,-99
4496492,涨停吗,-99
47827,安微华安证券即将挂牌上市一一一一时代出版和其,-99
4704529,烂了,-99
1097290,这股都在7元以下等着买呢！不破7还真不敢买。,-99
3066710,9元呆不住准备呆8元慢慢下吧呵呵,-99
3538599,那些要筹码的接啊37批发一批给你们！,-99
1504809,今天沪指一度失守20天线，但尾盘又顽强的收回来,-99
817160,“国改+新业态”驱动商,-99
5456185,又涨价，看你涨不涨,-99
3336658,换600128,-99
2123558,涨停潜力股,-99
3545323,金融工作会议强调防风险 AMC政策利好可期(受益,-99
5396847,还好之前跑了，难怪每次涨都不跟涨，每次跌都跟,-99
2527683,希望大家加把劲 让股价跌至6元下方！危机才有机,-99
1057218,大盘指数已经毫无参考意义d,-99
4917475,下午可能狂泻！做好准备！,-99
2946990,今年年底上10元,-99
3532654,投票通过，实实在在的好事。明天拉升幅度不够的,-99
2566815,股价半年不涨，喝茅台醉的,-99
2934168,趁高开快跑,-99
4406902,更多机构进来了！明天看机构表演了！,-99
2869777,上海死瘪三,-99
3296043,几千万就能控盘一个基本面不错的国企，砸盘的怎,-99
2716600,老鼠屎都跑完了。。。。。,-99
4901440,口子窖:假酒假业绩，请有关人员查查[滴汗],-99
1340282,我仅看看不说话,-99
4423799,小庄，怕死，高开低走又套多少小散,-99
3833645,中美能源合,-99
4209661,主力骗筹码 明天打开扫货,-99
1716092,公司为什么就不在雄安新区搞个ppp项目提振人气,-99
565153,1、经济增速：,-99
153926,客尚淹留,-99
316133,大名城是大死马,-99
3737867,你活着浪费空气 死了浪费土地 半死不活浪费人民,-99
4542220,自认倒霉！,-99
4425712,国际化的A股。不要忽略了外资的力量，国内机构,-99
2760349,涨的最少跌得最快的垃圾股,-99
799533,广州一强咋不BB了呢？！,-99
2978142,昨天进飞乐音响必须先拉他，才能把板块搞活,-99
4143765,有多少是被上个星期五忽悠买进这票的,-99
2204064,天猫上舍得酒坊买2瓶加上300-60购物券只要266啊,-99
184340,三季度股东户数减少16%，十大股东没有减持还增,-99
243268,确保市场安全稳健运行,-99
551579,有百分之三十的下挫…你们记住了。 巨卵股份,-99
3208095,可以加仓！ 冲！,-99
3722353,房东来收过几个月租后,-99
5115786,天域等三家联合体预中标金额也就4000万左右,-99
829463,MSCI就是做空中国的机构，每当一提MSCI，A股就,-99
3621229,从1点56开始，庄家就开始套人了，买单全部是散,-99
1810219,多头现在已没有退路u,-99
4110318,大盘连涨，次股连跌7天，垃圾,-99
449419,今天进来，明天出，必须的,-99
1000965,漫天大雪，,-99
1624683,韩都优品全球购休闲百货展现成功门店6大销售技,-99
4827158,掌阅科技 主力拉高诱多出货 买入者必被套历史最,-99
3371924,沪深大盘开盘涨跌互现,-99
2472091,今天又软了[傲],-99
1508651,有惊现达托单，必破，本月必到9元l,-99
1871928,原因之所在个从现实需求出发对于有固定收f,-99
3723089,诱空的真是出色啊,-99
2743410,尼马，死股,-99
3883444,刚看到一个002780周线13连阴的，呵呵,-99
4425007,准备抄底这两只票了（,-99
2203165,.10转30孤品绝版标业绩高增长重组随时启动除权,-99
1128359,买这股票特别痛苦 看着外面一片大涨  煎熬,-99
5011442,看来创业环,-99
3472936,还是哪句话，不到10块，十年都不卖。10万股，目,-99
290690,谁才是本吧的托？,-99
3922123,看看政策有哪些,-99
661333,这些新闻影响哪些投资机会,-99
1183690,提高资产运营效率的,-99
3920355,狗庄，把老子洗出来了！现在的大手笔都是谁买的,-99
553962,本周有板,-99
1431658,国金套死补仓了！你们补吗？,-99
2944454,波导股份600130舜间跌停？天啊,-99
4458754,10万块能拉5个点,-99
1218274,美的集团上涨0.81元人民币,-99
1727493,中国央行今日公开市场零投放零回笼,-99
4086161,今天尾盘还会拉吗？[大笑],-99
2976764,600795国电电力600795国电电力600795沪港通融资,-99
5011706,洛阳今天雾霾严重，天气预报却说轻度污染，为什,-99
5214504,我今天全卖了，垃圾股道森,-99
1579483,时隔一年高层二次空降，级别貌似比第一次高。听,-99
802701,垃圾股票,-99
2866310,贫僧说次新股有一波行情，大家认同吗？,-99
1101223,上海家化今天复牌了！！,-99
757940,600218:全柴动力关于对闲置募集资金进行现金管,-99
531466,2017.4.10下午18点多，接下来关于宝硕股份的走,-99
3691079,这傻比庄，天天在这压盘！,-99
3139170,50快扛不住了，若砸盘2400指日可待。,-99
2411975,10送转20以上,-99
3741156,近年来，中国复合材料市场的发展愈发受到了国际,-99
5221105,今天资金流出太多了,-99
4541335,世界500强企业，是金子总会发光的！,-99
2488017,线上金叉，10.65必过,-99
4282408,有本事天天跌停板，杂种,-99
217257,涨停，涨停，涨停，涨停，不会再跌了，现在是地,-99
2395549,希望在绝望中诞生,-99
927409,大哥，能给机会解套吗,-99
3277939,个人观点,-99
3943960,紫金矿业吧,-99
394661,7月1日起，《,-99
1394859,垃圾股，不跟涨，跌的还比别人快,-99
4506407,天龙股份，超级亮丽次新股，小盘极品，指标背离,-99
2461752,此股今年没指望了，明年是个大牛股！,-99
834636,云南城投(600239)融资融券信息(10-16),-99
150134,现在就算是割肉也会觉得疼了吧,-99
5347008,筹码都在谁手上？？？太过分了吧，一会阿里巴巴,-99
3979680,国家队还在，国家队在炒作银行股，大家要抓住机,-99
1360676,上证已经创29个月新高了，贵公司干什么去了！董,-99
64209,明日股市三大猜想及应对策略,-99
2598405,加入普通股资产净值163 ,-99
2643005,跌两个月了。。,-99
2723637,调整一步到位,-99
766260,开始出货了！大家注意！,-99
5354559,调进msci指数了 建仓吧 外资要买买买了,-99
2033756,挂着8的10万股买入,-99
3559848,最终大盘在3400点附近回落调。,-99
565326,告诉你什么是好股，新日就是！[赞],-99
4165887,东旭光电 操作一定不要盲目！强势拉升赚钱的机\t,-99
2783181,够垃圾。,-99
3147330,股吧里做空的都是什么人,-99
3089324,特立涨停半天了你还在墨迹什么,-99
3441737,跌停601018宁波港祝苏泊尔大涨,-99
501619,虽然买了还是不看好，我感觉近期回调的可能加大,-99
2857128,#晚间利好消息汇总# 600400 红豆股份：集四大利,-99
4159110,sdf,-99
4350853,至收盘不但收回全,-99
2603125,一堆利好也激不起浪,-99
5441290,何必苦苦支撑，尊重市,-99
2302203,个个都涨，就你不争气c,-99
4558714,是次新股吗,-99
2340520,主力都走完了。,-99
4304234,垃圾就是垃圾，其他二个焦化股都在大涨，这个股,-99
2773701,退市退市退市退市退市退市退市退市强烈要求长期,-99
565021,后来公司做了股份改造,-99
2571359,放心，减持公告显示十几天前拉升到4点38元那天,-99
1096958,平高电气(600312)融资融券信息(04-28),-99
3736959,维持指数翻红，看似繁荣实则虚弱多病。m,-99
2646717,没人发贴，自弹自唱,-99
1020219,弱地一笔,-99
5359539,短线交流贴。大盘下跌途中短线交流贴。,-99
1955225,都快跑，高位5分钟背离，上一次背离是26出现的,-99
198028,下跌不言底啊,-99
1533871,涨停板出货，哈哈,-99
1338488,垃圾股，凡是动心脏图的坚决不买,-99
3187654,哈哈，,-99
4512565,Gogogo,-99
581653,日前，国务院印发了《关于支持山西省进一步深化,-99
3327749,我当然看好荣盛发展，但就是看不起那些持股的庄,-99
3471832,昊华集煤炭，国改，雄安于一身，即将成为第二个,-99
2410850,又把我骗了！昨天28买的，早上27卖的！结果27.2,-99
2250681,封板！。,-99
2594183,"今天这走势会造成错觉,看似v,实质是诱多成分巨",-99
3500189,行情快来了。。,-99
2414476,感觉这两天有次涨停的机会[微笑]，就是感觉,-99
995919,如诗般瑰丽,-99
2283085,上海银行间同业拆放利率,-99
3470259,昊华能源(601101)融资融券信息(09-22),-99
3115525,(国家D)抬拉 雄安垃圾 杀跌中小创太恶劣！,-99
3845729,趋势为王，修边为主。,-99
2782176,冲高赚靠2个点没走，这趋势盈利又要跌没了[滴汗,-99
4659464,像上楼梯一样 走势[牛],-99
2652994,要在第一时间卖出立即卖出,-99
4137009,12.3元买入，要不这股退市，或者本年盈利出现重,-99
158688,星期一再来个大跌，马勒戈壁的,-99
3804323,国内第一家掌握聚醚胺 ，阿科力 603722明天涨六,-99
95650,你妈见红了，你在这干啥呢？,-99
5368556,相信有过类似经历的朋友会有同感,-99
4800152,成为深股通名符其实的第一股跌幅为6.26%,-99
4354944,王延领出来聊聊股票呀？,-99
