,content,mark
4998652,2:30你懂，懂！,-99
2601880,实事求是说把三年前5.98元定增的机构套牢是不道,-99
5537467,废活少讲，排队割肉。,-99
4537798,说百分百跌停居然有人不相信,-99
4934746,绿色环保包装这题材还没挖掘，京华激光业绩好跌,-99
876532,食品加工龙头，短期目标价11.9元,-99
4295266,东方材料还没有跌透，观望为夷！,-99
5355869,怎么拉都很少人完，看看只有那点成交量。,-99
3121097,直奔他而来,-99
3113379,巨力索具最近大涨。,-99
492304,12,-99
1029827,说这股价没有人恶意控制，你信吗？,-99
1653751,主力进这么多就涨点点？继续啊,-99
1697915,来个抢筹的实力庄，让那些老庄丢失筹码！。,-99
4060317,真看不懂这破管子。,-99
5093490,40以下进。,-99
622018,块以上没业绩支撑,-99
443564,拉起来拿拉起来鲁抗医药都涨停了,-99
2116599,哦哦哦哦哦哦哦哦哦哦噢啦啦啦啦啦,-99
1875519,今天跑了的真幸运,-99
5185770,赶紧跑！,-99
4474372,五穷至极的五月底市场极度悲观时我们喊出了“,-99
1837613,一年只跌不涨，烂股。,-99
32493,首创股份跌成求，春风绿了永正头！,-99
5530330,这显然是抓住了问题的要害,-99
2241260,金世留芳投资市场常用做单法则,-99
3041586,这家伙死活不,-99
2310922,军工发展了这么多年，为什么军工业绩这么差？,-99
4138452,603029:天鹅股份重大资产重组停牌公告,-99
3016587,这盘给你控的，真牛。,-99
366130,小美是龙头！,-99
3319827,直接启动祭台,-99
4101977,天天大宗啊，看不懂,-99
2850931,该公司并无保壳之忧,-99
1393331,引领大盘上涨突破的只有国企改革， 而上海国企,-99
1186390,兵熊熊一个，将熊熊一窝。,-99
785861,尼马比上窜下跳,-99
3196937,燃气股今天集体嗝屁！,-99
2069065,股中国股市慢涨急跌式的“美国范”细腻,-99
4212364,大神啊，奋起吧[拜神],-99
5231287,我也希望下午涨停板，那肯定不现实的,-99
3062373,破逼股，只定有问题，远离z,-99
4166063,杀跌，继续杀，一股都不会给你，狗庄,-99
3716862,看看海南高速再看看猪头的股知道东北为什么穷了,-99
118069,我去，利害了！,-99
5503676,注意：周二跌五收涨十。不可互传，收阅是福！,-99
1747766,呵呵！诸位有木有踩大便的感觉？反正我觉得很恶,-99
5002691,股东大会开完了吗？,-99
2013118,东北的上市公司真不能碰，太差了,-99
4586222,提前公布!！拉升内幕！！,-99
4882861,不破35坚决不拿长线,-99
4784128,看着鸟样封不住了[哭][哭][哭],-99
5016680,现在安图生物这个可能还会下跌但是空间已经不大,-99
1569115,劳资割肉后的感言。,-99
4876706,转贴. A股市场需要良好生态环境 禁行[倒退路],-99
3505545,MACD低位水下金叉买入法b,-99
4403681,别墨迹了,-99
3767887,此地无银三百两，隔壁老王不曾偷。此股乃掩耳盗,-99
5060403,个股都跌50%了，大盘都没破3300，哈哈，股市3千,-99
503051,疯狂的抛。呵呵,-99
5433515,风轻惟响佩，日薄不嫣花。,-99
3910092,你直线拉一下试试,-99
4281812,破发，没人赚钱，又开始变态了,-99
2410229,即将爆发的创业板白马股研究之第一弹 今年绩优,-99
1777747,确实很垃圾的股东，钢铁股这么拉，增持还一直借,-99
4320925,跑了,-99
3153947,5G主题已进入升温阶段，重点标的一览 2016年11,-99
4626838,603333:明星电缆关于召开2016年年度股东大会的,-99
2408332,c平量突破、存量博弈、轮流调整与上涨，避高就,-99
3087464,速度出货！晚了就来不及了，快跑！,-99
2513924,大盘3500的时候，你还是26,-99
4598982,看到吧，搞来搞去就是,-99
3597744,除非接盘者能得到万科管理层或深圳地铁方面的认,-99
1786718,天士力大股|挪威y行跑了，C金斫颖P@c人,-99
3080201,主力真会玩,-99
2695119,南京熊猫和华东科技什么关系，,-99
3823614,今天下午破30块,-99
2865360,突发风险反映出信贷基础不牢,-99
2098563,管它涨不涨，凑个人气。,-99
1179597,"不仅铁公鸡,未分配利润负数,个人看3.3元!",-99
5550170,0远离天花板，关注永恒热点：重组，尤其低价国,-99
2847442,"进场: “双重改革”受益股,社保养老金标的股",-99
1752404,大盘波浪划分,-99
4480544,快跑，有拖盘,-99
180347,墨迹个啥呢？,-99
5448631,今天我大A股爆涨两个点哈哈,-99
3535560,此股票里面十大股东多数是个人投资者，都做好轿,-99
5555734,我就准备放个10年8年的不管,-99
2094435,将军额头能赛马,-99
998602,周线年内首现“两连阴” 震荡市自下而上选择优,-99
3033283,已经冲高减仓了!这票总不会涨!让主力自己玩吧!,-99
4734595,快跑！,-99
4368933,据说汇顶已成功切入三星手机产业链，有懂得进来,-99
3714679,截止12月16日,-99
1293238,证券最近经,-99
2876644,"上海市政府与中国电子达成战略合作,将联合投资1",-99
3072894,不少公司也沐浴了供给侧改革的东风。。,-99
5420291,不看都吃亏,-99
1126228,近家个股绿盘下跌,-99
5486547,中午放了，亏大了[哭][哭][哭],-99
993491,高能关注：股转又挑出了三个IPO集邮股的地雷,-99
4154508,都在出货，不要买了大家,-99
3503379,周期股回调如何选,-99
1869761,多看看雄安，港口等牛股，人家主力是怎么干活的,-99
2500817,好事多磨，慢着点悠着点,-99
500226,虚假债务是新亿硬伤，必须清查！,-99
5083109,明天沪指上方压力在3150点附近,-99
343152,行情是不是逆转了,-99
737524,托儿！没有,-99
3615806,来看看，走势真稳,-99
920169,看了中视传媒，返身再做路桥建设,-99
2108348,有种你e拉指数,-99
2665330,7月27日网红直播板块涨幅达3%,-99
2824999,不好搞，快弃庄而逃吧，钉子户太多[微笑],-99
1661319,领跌龙头吗？,-99
4293546,振芯科技等3家公司前十,-99
3237873,中鲁可以有重大资产重组不用披露了也不用公告了,-99
558860,香江控股 现在是买入的好时机？,-99
215045,9.15买的1万股，下个星期要不要出,-99
2906866,这样跌到什么时候才到头…,-99
106097,8月股票池总结：补上这点，你也能成为炒股高手,-99
4915744,再升科技变成软蛋了,-99
5179966,庄家努力表演，散户心如止水[微笑],-99
1068423,他妈的垃圾选手,-99
5123568,今天换手超过20%，涨跌幅偏离7%，怎么没有龙虎,-99
1980260,解禁股还没走呢,-99
905697,上午涨一点.下午跌一下.天天老样子.这庄笨死了,-99
1259155,2017/9/26淘股神收评：两市集体现震荡行情 各板,-99
1017969,这是要有多恐怖啊，,-99
2968832,今天木消息，明天再木消息，周一至少跌5个点,-99
5045278,当钉子户。s庄今天不砸了。,-99
3998914,终于 哈哈 请握紧筹码,-99
3003671,你们会不会炒股，草你妈。还搏拿出货。我现在赚,-99
3775745,市场关于指数“失真”的声音多次出现。,-99
2885001,会涨你妈咪股票。。,-99
223900,看日线图 级别大点的 就可以忽略盘中的震荡  ,-99
3875519,必须红盘！您知道的,-99
5200501,603789  今天买进  明天拉升出货,-99
5526554,各大指数近期表现弱势，不少股票表现不佳，有些,-99
3112461,尽管格力电器占据了,-99
268253,待到山花烂漫时A她在,-99
3054709,通化东宝[600867]“2月效应”内部消息，今日涨,-99
4319530,天汽模：这票看这形式，抄底如何？\t,-99
3653641,明天74是稳的,-99
1143196,两点半我的两个亿资金到位  马上拉,-99
2674541,769还值得持有吗？,-99
3986856,那么多人看好，我先走一步！,-99
3758285,平安和新华保险都拉起来了！快买中国太保！尾盘,-99
289819,八月最后一周股市分析：等一个信号（附股）,-99
3271432,为什么600975从不公布数据？？？,-99
4152152,3角，3角5的，买棺材用不了卖100手，不会是人多,-99
5116137,今天再低开几个点 好吗,-99
4586885,走了，谢谢,-99
3423062,辛亏周六卖了，过两天就要破发了。,-99
788198,且IPO加速仍常态化，这,-99
3298081,600981\xa0汇鸿集团明日拉高，验证实力,-99
4127024,山登绝顶我为峰一一贵州茅台每股股价数年内将和,-99
3548768,、百折。,-99
2056200,只卖不买,-99
2375566,你说买这个股的我们都很穷啊！,-99
4015086,主力逃离银行股，散户站岗套牢，,-99
101855,持有中石化的股民只要坚定不移地和庄家死磕死耗,-99
5134720,买这样的股票是刀口舔血，跌停买也不一定会赚钱,-99
4526356,做T赚了走人了,-99
3446361,乖孙子，连跌停都干不到，你能日球,-99
220706,下跌还有量，长不了，还得等，等到一天的量等于,-99
972601,为什么港九报的业绩这么好可股票却几乎天天跌？,-99
3559610,跌幅这样大，证交所发公司问询函了吗。,-99
578294,有大资金进场了，不然此股早就下去了,-99
96467,不入虎穴焉得虎子,-99
5350569,今天会不会绿盘？次新股指数都涨了2点多！,-99
1376154,今天突破8块,-99
3488818,破位，考验5.4支撑力度。。,-99
100312,现我已满仓中国石化，并持股不动摇，现进口的石,-99
522334,君子不立于危墙之下,-99
1221464,你17来我18 哈哈哈,-99
1737853,坐稳!!!即将升浪,-99
5061726,感觉这股比万隆光电差好多,-99
3621610,洗盘的，借壳的都出来说说。,-99
4729288,今天缩量了。这个股不行啊,-99
1534010,贵研铂业不要妄动，大动作来了,-99
5136663,今年有高送转吗,-99
899940,不要太乐观，今天集合竞价将会低开,-99
534351,连续跌停到1元,-99
64504,十万股挂到7.8,-99
4486223,又买回来啦,-99
680732,愿意帮我多做点事,-99
484918,天天发新股新股一上市炒上天二级市接盘者谁,-99
1569748,》《圆周率》《,-99
3596561,新能车抄完就抄新能源了,-99
3816635,这一万的封单真是莫名其妙的,-99
2262707,今天午后新华保险放量涨停，带动银行齐护盘,-99
1307965,我刚才想做个t，抛了1100股，现在后悔了，买不,-99
4085922,合锻可以飞了，你还等什么！,-99
132180,调整充分，辉煌中国概念必将崛起！,-99
2472212,华邦健康(002004):控股股东增持逾2300万股,-99
1009199,跌跌不休、,-99
1692912,抠门,-99
5196604,"宁波高发,发图给咨询股友无关涨跌据此操作后果",-99
710932,见智见仁,-99
