,content,mark
366546,今天与昨天K线上下巅倒！,-99
4206581,大涨,-99
5453770,最后一跌吗,-99
3799275,跌破14.5考虑建仓。。。期待中。,-99
3120535,无量诱多，马上跳水,-99
2021502,真心劝告一句，散户不要再玩股票了，玩死你真的,-99
2464205,拿了半个多月没涨，一放就涨,-99
2696122,既然退市制度规定连续三年亏损公司要暂停上市,-99
4359492,先让昨天抄底的走,-99
2290235,中装已经跌到底部，可以放量大涨了[鼓掌][鼓掌],-99
514398,吧里有空狗，这票就有戏，大家一起持股，让狗吃,-99
2426428,主力是5元以下才不减持！现在实际他也减不了！,-99
1023877,茅台喝多了，醉牛。,-99
107645,整天不死不活的,-99
1967567,谁买这傻逼股真的要吐血,-99
2496430,僵尸企业,-99
1956078,20倍市盈率高成长芯片王者！力源信息严重低估,-99
2630855,收盘时买10手玩玩,-99
619937,这票还要破一次今天低点,-99
4629781,300563良心企业,-99
4688936,今天这走势是特么有人喝今世缘喝S I了吗,-99
4925800,没啥人气了回避,-99
1157058,今天抄底明天可能还会被套，大家小心！,-99
1588370,四大银行军工[摊手],-99
2039233,东财来解析下,-99
2745964,中国船舶200610-0710从23买到300元，中华会更快,-99
374188,大家其实我叫李东升，对于上面我很失望，其实做,-99
3505847,深圳、上海国企改革全面爆发d,-99
881821,大盘崩了。,-99
1624180,散户股民不知道被谁骗了！我靠,-99
2788333,遵义推介农业产业项目,-99
2272078,600666:奥瑞德独立董事关于相关事项的事前认可,-99
4980458,这些位置闭到眼睛也要吃,-99
233775,三季报点评：银蕨淡季亏损影响公司利润，亏损清,-99
2278491,水泥高歌猛进[大笑][大笑][大笑][大笑],-99
891500,大盘不给力，股价受压力……,-99
5516235,加油砸，丑陋的人们,-99
164315,星火环境:董事及独立董事任命公告,-99
26065,万手压盘，吓谁？跌也不怕了，因为我还没打算接,-99
1563939,能跑就跑，又创低点，无可救要，,-99
1376760,中小单都在跑，聪明，以前都是大跑小背，今天来,-99
1183775,飙升!,-99
1715445,证监会再核准两家CEPA框,-99
704335,愤愤然就只是在自己的空间里发泄一下,-99
1068413,双重利空下跌，买啊买,-99
1477089,财政改革国企改革配套进行。,-99
4922505,你妈废物,-99
3668555,草大盘这么好拉呀。,-99
642184,中国将于2018年迈出5G商用第一步 5G有多快、..,-99
5205518,关键     量能   量能,-99
5189473,不仅需要充实自己掌握机遇的能力,-99
640368,操纵股价证据，收集好，,-99
4100495,中科招商子公司及一致行动人计划减持中装建设36,-99
2865911,32.7的成本有比我高的吗c,-99
3280706,大盘不断冲高，中国电影继续死猪本色,-99
2236666,请问董秘公,-99
4760777,这股票很少，连续涨3天，今天大家都散了吧！没,-99
1596378,这指数涨的[大笑][大笑],-99
2791217,李峰淡淡地点点头,-99
5199752,我这个民房周围有几个新盖成的小区,-99
833650,收红盘我去死,-99
3844766,又做了个B，安逸,-99
93788,铜陵有色：暴跌后将快,-99
4963003,603617:君禾股份第二届监事会第十一次会议决议,-99
3729410,垃圾，被垃圾害死了,-99
4542066,20进场,-99
2308459,大盘涨这么多你为什么不涨,-99
4238235,空构的发贴，请大家不要理会，让其自然下降。,-99
3540972,下午上不了船咯,-99
1027694,大跌开始了,-99
4458861,你并不知道他们这次建仓是不是醉翁之意不在酒,-99
1583335,前期涨的高的股票都在大跌，那你跌久了是不是要,-99
4973935,快出，明天还有5个点的下跌！,-99
2563770,不是说要买低市赢率的吗？10倍也闪崩？,-99
1038096,广汇汽车(600297)融资融券信息(10-31),-99
4995582,我靠,-99
5213142,烂泥扶不上墙,-99
3253521,标普下调我国主权评级 专家：中国不必削足适履,-99
2858585,快到清仓线了,-99
1167013,还是那句话：越涨越卖,-99
2421327,只要执著地去寻找,-99
460644,顺鑫就好象２０元时的茅台，更是有巨大的成长潜,-99
1768587,下午可能会反弹,-99
2134562,超大单流出！大单流出！中单流出！小单流出！为,-99
4615546,603329:上海雅仕首次公开发行股票网上路演公告,-99
5125921,今天收盘涨5个点，立贴为证,-99
4697736,电子供应链兼营PCBA电子制造，两市概念独特，但,-99
1451532,如果到十五六块机会就来了,-99
399147,东航不仅是上海的空港，更是中国走向世界的一个,-99
5034845,所有控股股东祖宗断子绝孙走势,-99
5030933,垃圾股，猪力一直在出货出完了，又是一地鸡毛，,-99
1748524,12元今年或许不得到，15元很快就能见。,-99
785885,每次横着，然后跳水,-99
2058555,611 每股未分配利润是13.83 是不是搞错了呀？,-99
1261863,从沪指大盘破位144天线看时间重要性。,-99
654124,套牢后如何扭亏为盈,-99
1188302,哈哈哈、哈哈哈哈！,-99
4043236,出版传媒(601999)融资融券信息(06-09),-99
991690,跌到成本价时必须卖出，,-99
3624244,主力拉高出货了？，艹,-99
2720718,哈哈哈哈哈哈,-99
5257490,先买点[拜神],-99
341582,明星后面涨跌如何，看60分钟k线图，自己领悟。,-99
1526088,联络互动，我来啦,-99
560049,绝杀门虫调仓换科技股为主！,-99
710197,澳门主动到珠三角调研，参与粤港澳大湾区规划,-99
542790,你涨我持股，你跌我加仓，看你还能坚持多久？,-99
2837561,有本事今天来个涨停。,-99
2848931,600815:*ST厦工涉及诉讼进展的公告,-99
1596516,炼狱股份，17.3元，我们等着吧,-99
5401021,垃圾主力，暴跌。,-99
4742447,35.02，买入,-99
3019133,特大利好，赶紧买进！,-99
3429428,中裕合信(北京)投资管理有限公司 如何让钱“活,-99
3566632,天灵灵 地灵灵 保佑东兴能变红,-99
5003918,跌一点就有资金抢筹，主力的阴谋是不会得逞的,-99
4297073,中签的朋友千万别卖出自己来之不易的筹码，离开,-99
1816021,晒这些有意思吗？土瘪[大笑],-99
1903978,"恒生不肯下跌,为什么?",-99
5491384,这股概念比较多。什么一带一路，高铁，雄安，天,-99
3603735,"400,一吨的煤出售，是否是贱卖国有矿产资源?",-99
5024753,跌破发行价指日可待,-99
3521877,增值额可达2142.88万元,-99
2305143,不放量一切都是扯蛋，,-99
2146420,股友rUNcWM,-99
165455,看看人家美年健康，哎,-99
1770979,能弹多高？能弹多久？,-99
1424037,下方缺口不可能回补,-99
540815,这股也算牛逼的了，跌了几个月无论大盘个股怎么,-99
1895537,板块方面,-99
2168443,厂到年销1400亿 成为董明,-99
1686759,方大特钢助梦想成真 方大特钢助梦想成真,-99
2909521,大盘下午会大红，至少涨10个点,-99
3269842,地雷终于暴炸了,-99
287850,明春季休渔结束，起航q,-99
4323403,看大势，赚大钱,-99
4805511,不乐观，周K线收盘价创新低了,-99
1882106,个人观点,-99
1337895,太稀缺：低估值+高股息+滞涨的白马股。ST也有价,-99
1551832,600466走势，预想下午开盘马上打掉8.41，8.42，,-99
2897098,从价值投资来看，这股最多值8元,-99
3419782,6元以上出尽，静等下跌买回,-99
4215105,谈点中报看法：振华走势说明有主力提前获知，从,-99
130751,跌的一动也,-99
5162917,快跑，无底洞了,-99
1173542,区区3万股小钱不够它几天吃喝的，这种所谓增持,-99
672348,创兴资源重要事项未公告,-99
3286801,方大炭素，高位放量，机会还是陷阱？（还有）,-99
3860274,风不止l,-99
2596121,奥运“网红”刺激大健康板块,-99
3214838,广西广电600936阿里概念股,-99
4471042,巨额坚持，难怪上周五两点半涨停的情况下突然出,-99
5104394,近几交易日振荡中才捡了2点，冲不上年线先清仓\t,-99
2416664,接不住，发行主体,-99
620312,解析这次000662的停盘。,-99
3710868,这种压盘跟以前红豆股份一模一样。垃圾，为圈钱,-99
3949295,破位斩仓出局[不说了][不说了][不说了][不说了],-99
5369156,这个股票是自买自卖,-99
4682944,反弹滞涨，抛压较多，获利盘可逢高做T，明日低,-99
4406358,跟寿仙股差太远了，，，,-99
1924146,看此股业绩不错，怎么就跌成这破样了呢,-99
1361986,基本上剩下大股东了，难怪控盘那么强888888,-99
775884,口喷鲜血 嗷嗷嗷嗷,-99
1240918,剁狗鞭，吃狗肉，哈哈哈哈哈哈,-99
986207,槭颤Nr值投Y都不说了，今年分红吗？,-99
2157844,不到21坚决不出，庄家就洗不了你！,-99
1488461,狗东西,-99
1506411,看高开低走。,-99
2082293,金枫酒业(600616)融资融券信息(01-18),-99
3586055,封不了还是会下来,-99
1838603,最好的救市,-99
5487271,买了三支票，三支票都是绿的，突然我都有点崇拜,-99
2018207,明年世界杯,-99
1798156,大学培养目标所要求的德智体美方面的素质是相互,-99
482544,环保督查等促动力煤上涨,-99
1202095,关注6+1中的1=浙江国企改革，还没动,-99
4301394,没有悬念   跌停,-99
2506266,无题材无成交量无股民参与无庄家的四无股票，你,-99
3316988,蓝色光标涨停了。差远了！,-99
2537557,周线级别即将启动主升浪，切记,-99
8317,尼玛币的老子15元以下又买了m,-99
2586783,这种股票不到时候不会大涨也不会大跌跌10个点以,-99
1757471,即将停牌。,-99
243004,别看，和其他化工没得比的，随便一个都4-5点,-99
3179002,股市绝望吗还有机会,-99
184079,海信创新技术的涌现以及电视智能化的发展，让群,-99
5428605,半年报有预,-99
4047196,针对外界关注的放开网络销售彩票，是否会对其发,-99
2751931,轻纺城(600790)融资融券信息(07-28),-99
4425995,此庄已死，有事烧纸,-99
2929445,证监会：要重拳治理市场乱象 该罚的罚，该退市,-99
496603,散户每10股让渡1O0股。黄豁勉全部债务还宴请散,-99
2819008,惯性下杀后这类超跌股反弹在即,-99
4467776,试拉吸货业绩好盘不大短中长都可以买五百股试下,-99
479077,明天继续跌停,-99
642492,烂股一枚！,-99
2508169,我要是有他那种吹逼的技术，还来吧里混？？偷偷,-99
91084,油价创10年新高[大笑],-99
3007492,温继续上行，但介入,-99
1084337,万华涨跌皆淡然面对,-99
