,content,mark
4467505,眉飞色舞举,-99
149944,600051:宁波联合第八届监事会第四次会议决议公,-99
1270427,我搬到的一个民居是个私房搬过来以后,-99
1125249,跳空十字星。赶快跑。。。,-99
3894873,明天拉升吧,-99
3460369,中国债券通有限公司网站北向通交易日历显示7月3,-99
1888775,环境税对中小企业的影响较大,-99
4664439,你不打了猪,-99
3008102,军工混改 科研院所将率先启动怎么办？,-99
2574371,什么时候到4.50啊,-99
3141772,1920年低  69.00  49.50,-99
588640,箭在弦上 不得不发，只能拉升才能出货。主力介,-99
3161724,老子最低点附近满仓稳赚发财了稳赚发财了。,-99
518060,像航天这类企业，决策很慢，程序很多，真的开始,-99
2199004,市场常常将其归结为,-99
1900410,太能吸筹够了吧,-99
1312422,周五，上证收盘3219之下,-99
3028250,来看望一下烈日炎炎抗守在大恒一线的火鸡们。,-99
5170184,能不能解套就看你了主力,-99
1780371,善班的产品经理培训课程五大工作主要内容，“你,-99
3071594,3元的票，还用担心下跌空间？,-99
3036704,今天下午2点，小米发布会将要发布MIX2了 全面屏,-99
3739223,主力在市场突变的情况下难以抽身而出，因此这些,-99
4533013,如果酒不回头航空就会补涨,-99
1195596,看好黄山胶囊。,-99
2519224,我卖力忍不住了草草草草草的,-99
4976566,新股上市市盈率80打开涨停板，而亿联网络市盈率,-99
1846633,我来了看553演戏！,-99
5393079,今天被博天害死了！认栽了！,-99
5284022,刚加仓了，下午再来看看,-99
2581776,明天再来个跌停我就把子弹打完,-99
4478539,你有自己的立场,-99
841188,快进000591飞涨行情开始！雄安。国企改革。高送,-99
4416233,好过瘾，卖的早比买的早强多了。亏死一帮韭菜,-99
218538,死鸽子[哭][哭][哭],-99
548347,都卖给了傻庄，,-99
3190769,关于无锡银行临近50%以上的股份解禁的三个关键,-99
5379863,特别是对那些三无题材类个股,-99
2101596,我己经给恶庄势力洗了二年了！无语！,-99
5180679,看来机构不甘心啊！得想办法自己救啊！,-99
2147777,富控互动的实力,-99
3351168,十一长假资讯分析集合,-99
4685188,300233\t,-99
5008501,00636+10求中签[大笑][大笑][大笑]来一个过个肥,-99
4240040,半年度资金压力面落地,-99
2318722,明天再不走可能就晚了。[大笑][大笑]o,-99
2940183,上海九百(600838)融资融券信息(12-07),-99
2017116,12.8的本，不能回本就要跳河了,-99
175009,撩不起的阿斗，下去就上不来,-99
1383952,本周上海综合指数承接上周3016的反击势头，一度,-99
1792286,矮油....啦啦啦啦,-99
2661592,“234只基金：9月29日30日借钱满仓过节”,-99
4335994,六月二号就减持到现高高,-99
4759348,主力使劲压着啊  坚持到 9月1号  我 就全仓进啊,-99
1398066,会有哪些傻子在买？,-99
928277,扶不起的阿斗,-99
233095,今日成交,-99
3641966,科比约他早上4点15做力量调节,-99
3780524,土壤污染防治专项资金累计达150亿 土壤修复万亿,-99
3664292,明知跌停不走，中市稣娑嗌当,-99
4985813,[好困惑],-99
2192741,意志坚定，无情绪化机械式炒股是制胜法宝,-99
735821,接下来该做的事项！,-99
3801964,丨上帝派你来砸盘,-99
3827760,国企改革十资产注入=忽悠，……只是在应付上层,-99
1282004,大盘都反抽了……反而主力再出货,-99
3129013,今天必须大阳线，此股创长历史新高，没上车的快,-99
3802107,使劲砸，到9元融资的吸血鬼就得跑一半！,-99
801649,好消息，该涨了,-99
2624351,给我一个不买长江传媒的理由,-99
1460993,4.30元走了，是不是卖亏了，看到吧这两天热闹我,-99
1216005,这种鸟公司有啥资格发行可转债。,-99
4828945,两阳夹三阴，冲天炮。,-99
5374550,重大利空！国际知名科学杂志《细胞》子刊《化学,-99
1239948,过去许多年 ,-99
4705164,明天48.5买,-99
2631177,多多益善，给你机会能把握住吗？,-99
1065462,想出货，来个10跌停，想进货，来个巨量涨停。不,-99
4226686,今天涨停。,-99
5551416,603998:方盛制药第三届监事会第十次会议决议公,-99
948494,思想如钻子，必须集中在一点钻下去才有力量。,-99
2430166,“江苏有线大股东”是个瘫子，穷困潦倒，精神异,-99
5035744,大盘涨小跌 大盘跌继续跟跌 牛逼,-99
4310245,宇峰看盘：大涨中一些,-99
3528398,请深跌    呼叫主力,-99
1488546,公司概况。,-99
1363940,这是利好，跌停入货3万股！！！,-99
4544159,证监会应该调查井神股份了，因为它恶意停牌,-99
5509394,连做个拉升出货的假象都没有，死死的压着价格，,-99
4732138,捂股到底，水滴石穿不是因为力量而是因为坚持…,-99
1659374,"科达洁能 ,今天压力位 13.72 ,支撑位 13.31 ",-99
3072294,创业板底部或在下周出现。,-99
2142531,《快成新股IPO了》,-99
1285883,西南难道11月报亏损2亿多？？？,-99
1804165,陈海昌会带着我们发财的,-99
1948830,就一垃圾,-99
3494112,卖了2500.买回1800.来回倒腾！,-99
3678863,这支票我己经决定做长期股东了，就当市值打新，,-99
4079727,早盘高点都冲不过 下午还要跌,-99
5083639,业绩亏损或业绩大幅下滑公司高送转的问题,-99
657608,从发电耗煤、高炉开工、汽车半钢胎开工等高频数,-99
53688,20周均线二次到了,-99
4513499,科大讯飞两根天线，此股开始套人了,-99
1094608,中国中期狗庄现在拉升都是为了出货，鉴定完毕。,-99
3908185,对倒一下午，也没砸出个毛，有意思吗？,-99
3196965,卧槽,-99
273288,这种股，我第一次见，300万不到的资金可拉升2个,-99
2501634,360借壳夏利了,-99
3480382,[满仓],-99
338218,尊老爱幼善待父母是中华民族传统美德！清华同方,-99
4284972,老铁别走我还能涨,-99
2431337,回天新材:2017年第一次临时股东大会决议公告。,-99
5300458,山东无牛股,-99
3635187,二重好人，胖子，我已经停止发言了，你非得这样,-99
3663669,交通银行因此，大盘不好时应该学会休息,-99
3546981,吗的，止盈了，他上来了。7.88卖了，就差我这50,-99
1816235,明天停牌公司拟试和360重组事项[鼓掌][鼓掌],-99
303095,沪指连续5个交易日在120日线和上方缺口之间横盘,-99
4171989,大利好，高于预期，明天涨停！,-99
2429602,不破七老子就看着！ 破七老子又相当于三个点的t,-99
855631,筹码分配接近尾声，当心万通突然停牌重组，或突,-99
63820,12月10日，12月10日，12月10日，拭目以待！！！,-99
151042,看看浙商大佬，沈爱琴，冯根生，鲁冠球。朱重庆,-99
3928184,哈哈上涨无力必跌,-99
3530134,还是乐视靠谱――跌到,-99
4900683,在憋大招呢,-99
4188310,这么多利好，还跌,-99
1055428,天要下雨我不嫁人，是佛山老板的家中老妇，韭菜,-99
2211809,解禁[哭][哭][哭][哭]，呵呵呵呵呵呵呵呵,-99
4935813,估计散户在这股里被吓死的一大堆！玩的不就是心,-99
3207005,板块个股涨 杭州银行不跌 板块调整 继续跌 为什,-99
3035442,上央视一套加油向未来了估计有戏，航空复合材料,-99
4263284,就知道吸筹，鄙视庄。,-99
3254179,后MSCI时代 A股买大不买小,-99
2102126,10点上不去没戏了国盛金控的跟班都不如,-99
216805,银鸽，全球顶级抗癌药，中国拥有自主研发产权,-99
805412,声明。,-99
3326039,荣华实业要爆发了。赤峰还不跟上？,-99
1019504,本来看好保险，他们怎么瞎了眼搞到这烂公司，草,-99
5473720,今天加仓，坐看主力拉升，一定要长脸！,-99
3467049,作为投资必修课，分析,-99
430553,[大笑][大笑][大笑][俏皮][俏皮][俏皮][亏大了],-99
2913894,哦哦 指数慢牛时代开启了。我要喊在李大霄的前,-99
3161929,张江高科(600895)融资融券信息(08-18),-99
3121344,那么石化双雄就明显是借机炒作,-99
4426987,恶庄，你怎么能证明自己是个人而不是畜牲呢,-99
2293904,这几天有人打电话咨询公司了么,-99
288348,沪指围绕我们前期重点提到的3180点阻力位展开争,-99
5506784,连100手都拿不出来,-99
12260,还是比较喜欢温和放量的股,-99
2659876,真好看，奥斯卡奖！。,-99
640469,快抢,-99
2746509,这股里托到不少,-99
3795495,价低绩优就是好股！,-99
1524497,一日游。,-99
2611437,走了，谢谢，尾盘在看。,-99
425939,短线调整就调整，个股坚挺住就行,-99
585412,上证指数3301点的191交易日即9月6日见顶，然后,-99
14082,sdf,-99
2507015,这是什么股？就是不是涨！,-99
1270691,股市中的“整容术”,-99
4300601,外延收购涉足3C产业，多元化助力潜在发展,-99
1642992,大家看周线，这是跌的第一周，至少下跌几周，甚,-99
2575251,辣鸡股,-99
3495154,股民们醒醒吧 别带幻想了 珍爱生命 远离垃圾股 ,-99
3744418,又一头向下，狗庄,-99
1063059,怎么买了这支瘟股？倒霉运了,-99
4942305,一汽夏利股权如何出让才是正途。,-99
2347033,希望星期一别跌太狠,-99
774214,调整不到位！需要再次,-99
5228571,目前的情况来看“伊利,-99
1692082,陕西煤业两年两次重组，洗精煤成本“狂降百元”,-99
3867667,注意点 飞亚达智能腕表被阿里马云看中有它的道,-99
4759479,别说这是洗盘,-99
1923418,祁连山(600720)融资融券信息(10-30)。,-99
1753964,钢裂拉红,-99
1675642,那些坚决看空华丽的人，才是股市真英雄[大笑],-99
1954080,神奇的两点半！,-99
89742,7527+75中了,-99
228025,在严格执行差别化住房信贷政策同时,-99
3432674,601028:玉龙股份关于注销已回购股权激励股票的,-99
4444990,准备闪崩，甩卖了甩卖了，1700万股20元一股打包,-99
3726004,明天冲上3300，这厮还要给力呢,-99
570710,11万8千8.你买宝沃还是长城？,-99
744193,方大特钢：践行环保理念 淘汰落后产能 发展循,-99
2145885,要开会,-99
2857305,十倍杠杆买格力，阿弥陀佛，千万别跌啊。,-99
3464685,日本 他月,-99
2065418,你要引民愤了,-99
2641200,上月底召开的全国证券期货监管系统年中监管工作,-99
2918072,创5178点以来新低，恭喜明珠上榜,-99
3626824,加仓,-99
4426070,哎！小散一路向下割肉，恶庄,-99
1477824,插股友m3czSz祖上,-99
2122022,这个股票怎么样啊！,-99
2384762,今天暴跌，小毒师功不可没，晒什么晒，小毒师不,-99
3670198,剥离资产当然是为了注入资产！会再停盘的。,-99
4551814,赚5个点卖了。哈哈多谢主力[鼓掌][鼓掌][鼓掌][,-99
4824447,删尼,-99
3239163,主力不作为,-99
