,content,mark
4339882,主力是个娘们吧,-99
1629614,这下降的速度太慢了……不跌不涨，痛快点不行,-99
569935,以前吧说我跟红楼一伙的。我说我要是跟红楼一伙,-99
5550872,日线收十字星,-99
770211,已交出4百手，可以涨了[亏大了][亏大了][亏大了,-99
4764221,砸下来 砸下来,-99
5294209,买,-99
587796,卖了就涨,-99
4732624,叩谢财神爷!中了1000股金辰股份.,-99
5162934,明天大盘会放量突破,-99
5037592,37.5元买了3000股[胜利],-99
1015709,大盘这样他为什么拉红呢，利空出尽了？,-99
3432344,一是油价暴跌，运营成本大幅降低。二是C919试飞,-99
2744723,看了其几只,-99
4890125,次深股成交量己超创业板，高位次新行情将向低位,-99
3501710,只看，不说话[拜神],-99
4508919,603268:松发股份独立董事关于第三届董事会第四,-99
5546054,快跑了 这大盘是扶不起的阿斗又和上次大跌的感,-99
4079252,我又出现了 嘿嘿,-99
4239405,明显没跌够,-99
703913,果然红了，控制的真好,-99
4653219,明日打板,-99
1691729,看不到头部迹象,-99
2946434,真是牛股  绿了,-99
3753585,的特点，连接东西南北快速到达，而在城,-99
4309688,方大炭素（600516）! 从6月22日的耐心潜伏到7月,-99
4478860,作为一名蓝,-99
987879,哥们 就不能做回龙头吗，,-99
548505,还是没有一点活跃度，严重落后于大盘，还是睡觉,-99
3993430,股权转让,-99
5333562,傻冒,-99
220604,600611:大众交通:大众融资租赁审计报告。,-99
1231692,快拉上去，涨5点，按就卖出。,-99
718669,证监会发布新命令5天内不准大盘大幅涨跌！个股,-99
2859914,做宏盛科技股东这么多年只投了一次反对票,-99
3525411,该股下周放量拉升概率较大,-99
3785452,都是我这样的小散户，谁会拉，啥时候能涨到13哦,-99
5085770,一一美国道琼斯指数崩盘了,-99
1652109,昨天没涨停此股已无戏下午快点跑[大笑],-99
2873935,信任的战友t秒回。不丢了票票。,-99
3138481,赶紧抛吧！别输的身家,-99
330727,死股。,-99
4761950,赶紧逃命吧很快就暴跌砸盘套人了,-99
1255776,狗屎行情，下跌了这么多，成交量还这么多，天天,-99
3439171,两天白忙活了,-99
641413,st一成定局，公司已经资不抵债了,-99
2297308,2016年上半年亏损达到2110.91万元m,-99
2712152,能不能今天稳坐第一,-99
3541236,继续跌，突然停牌,-99
119035,老是把以前发的帖子翻出来什么意思？,-99
3844490,[不赞][不赞][不赞][不赞][不赞][不赞][不赞][,-99
3414886,逼庄，刚撤掉了八千多手的单子，明显是看着往上,-99
404522,或是为参与定向增发的特定对象所持股份的上市流,-99
3147876,风雨天1天天做空，幕后指使者是谁？,-99
1007339,哈哈哈！爷今天霸占主贴,-99
2622281,就是有那种傻比货，自已不长眼亏了，总想着把责,-99
4010227,7.60摸不到?废柴 1100是狗屁[胜利][胜利][胜利],-99
2248138,福耀玻璃去死吧，早点关门回家种田,-99
5496710,38.7成本， 如果跌到34我就出， 涨不到50我tm不,-99
3261488,拿在手里的，是不是觉得很不舍得卖，还能继续冲,-99
844777,狗屎票，天天跌,-99
4658040,那个新股只做个股的大神呢？板块跌了你看它涨了,-99
4197428,买入，快点！,-99
3448848,明天大盘一死，这货就死,-99
5497750,今天大哥柯利尔乏力了？小正川硬了一下？,-99
4693095,注 粤港澳大湾区来了 南方环保龙头－－广州迪森,-99
354798,汽车销量或迎一小波高峰 水泥仍有上涨空间(附股,-99
3773187,阳萎得想不通,-99
3354886,给股民留点尊严吧。,-99
1426919,区域龙头企业。资产负债率较低的公司同样值得关,-99
3303770,今天是最后上车的机会,-99
3078887,默默的的再补一点仓，期待节后反弹一点,-99
1081502,万华复牌将来迎来100倍上涨，明年涨1000倍，市,-99
2200425,下跌就算到,-99
3601862,继续继续跌,-99
463145,这垃圾\t,-99
344241,明星8.3日500手以上大单成交，庄跑了。,-99
4007739,发了一堆公告都是什么玩意啊,-99
1101205,是否投资者应该试图买低卖高 ,-99
1603051,成本27.3,-99
1329333,曙光股份600303. 深度定制的新一代“市车” 87,-99
4293251,振芯科技等3家公司前十,-99
5449523,此股就是垃圾股，做铝合金的小作坊罢了,-99
324902,7.18再现？！,-99
2738805,冬瓜牛肉丸粉丝汤,-99
2423711,继续等，做死庄家，要建仓少量的建仓，到位了才,-99
3937578,净资产以下的票你们去找找看有几个,-99
3148722,三季报速递：大晟文化2017年前三季度盈利9373.1,-99
5466309,尾盘没戏了,-99
5337031,这个股几个月都没有涨停过！,-99
3431995,此股危U！跑,-99
3726782,大家开动脑筋说说，为啥最近两年市场这么低迷，,-99
1550584,坚定看好空港买定离手！大盘是没问题的因为权重,-99
875588,时间换空间，目前连续大涨已不现实,-99
4079141,也不知道这只骚股，何去何从啊。[鼓掌][鼓掌][,-99
2890724,中国的股市根本是不能够投资的,-99
3298311,[微笑][微笑][微笑]可以放心买入了，哥保证每天,-99
3220688,东方证券(600958)融资融券信息(11-01),-99
1972056,600845盈利多年不涨，588亏损严重，天理在哪？,-99
1452040,5块5的股权激励，确实不如在二级市场买。 第一,-99
4623405,苦其心志 饿其体肤[大笑][大笑][大笑],-99
1666705,近些年 ,-99
3571649,乖乖下来吧！无量上涨就是耍流氓！！,-99
2048998,《个股关注》,-99
227814,瞄准镜有没有生产基地。,-99
3902780,大后中央第一个查办的领导会不会是招商的？,-99
2886913,比方最受益的基建股冀东水泥 第6个涨停后,-99
2466134,资本公积金2017年10送30股票 ，市场开会，提上,-99
1994454,看看三季报散户数量，想想就怕。这票还有人叫呢,-99
2299125,其他都是辅助  ,-99
5372147,看来江苏的股票都不咋滴啊！[摊手],-99
4640720,说多少也赶不上时间和事实的证明，每次到了这种,-99
596574,别贪…,-99
2771869,京东方大股东减持为什么提前公告，国电的股东减,-99
1007077,太弱了・今天软件股都大涨，它都不跟，小反,-99
5136653,明白人一看就知道，哪有营收为负的业绩！,-99
4097785,草拟妈，复牌啊,-99
359130,2017年7月24日 星期一早 在这里，读懂世界,-99
4185234,真他妈比恶心股彻底废了,-99
239857,不管说再多，我还是想要台打令vr手机,-99
3716404,吉林高速2017年第三季度报告,-99
676323,洗盘型。股价处于中位，有了一定的上涨幅度,-99
447202,中期有点动静了，你还是跟一跟嘛。,-99
3354983,BOE生产的车用仪表，牛吧\t,-99
1530154,简直就是垃圾中垃圾,-99
101626,证监会真的出手了 十箭齐发护A股 最关键这一点,-99
5533841,27那是妥妥的！买到就是赚到,-99
3035397,一群鼠辈！鼠目寸光者！,-99
945697,短期顶部无疑 小心跌中涨诱多,-99
2657456,越跌越买,-99
973788,正在崛起的高科技企业京东方是未来中国唯一希望,-99
1468324,大股东增持,-99
3469983,人应该活到老学到老,-99
3462251,弱势股压力大，难上涨。换调整到位的股去,-99
4837351,当新星股遇到垃圾粉 新星股遇到垃圾粉，就是京\t,-99
716483,字母逼这亏货好可怜啊 嘎哈哈,-99
2428435,京东方，安彩大涨,-99
3969199,哈哈哈哈哈哈哈哈婊子庄屁谷已经洗干净了哈哈哈,-99
907599,不再炒了东,-99
2276034,国庆期间欧美及香港股市大涨，节后科技股会怎样,-99
823273,但愿这次突破年线有效,-99
105394,涨停板不好说，9.20还是有希望的！,-99
2408796,去年以来，保险投资成为监管从严的重要领域。,-99
3831015,钛白粉龙头002601龙蟒佰利启动突破关注,-99
585788,比起任何一只股、这建工属于杂木,-99
1843535,今日大盘走出了震荡调整的行情,-99
3164788,江西铜业(600362)融资融券信息(09-21)。,-99
3550001,杭齿是；酒香不怕巷子深！更何况金银财宝那就更,-99
5105071,沪指退守3050点 百股? 明开盘不突9。06分即? 宋,-99
2895824,如果走个圆弧底就爽了，样子是圆弧底了,-99
4099620,不信走着瞧,-99
4629475,一种可追溯的反,-99
5505775,目前股票配资主要有两种形式，,-99
3674045,"这几天吃了一肚子货八月份额加仓基本完成,现金",-99
3516153,表49道.琼斯和标准.普尔工业指数。,-99
884039,对投了赞成票的股民不公平！,-99
5147364,状况异常、会计核算的,-99
2525624,万科都可以涨停，你在装孙子,-99
5296168,涨啊！极品垃圾，我已清了你可以涨，不是我看扁,-99
3372054,拉一下,-99
4223018,接了个电话，板就开了。。。。感谢各位这几天一,-99
2500547,我们的钱肯定要不回来了,-99
2599319,英国经济也传来了“噩耗,-99
387067,典型的穷庄股，看k线涨停日子几乎没有,-99
3661261,真是扶不起的阿斗,-99
221457,已经跌倒今年3月23日启动时的价位，还想怎样？,-99
2401957,都是谁在卖，天天这么玩,-99
4494739,次新股里最弱的了。闪,-99
5317025,什么股票，不知道为什么跌，也不知道为什么涨，,-99
5478760,【龙虎榜】科华北路主封涨停，湖滨南路等买入助,-99
2113363,日K线形态不错\t,-99
3703283,半死不活，不要脸至极,-99
39626,2017开篇：,-99
3773994,更是难以估量。,-99
3087819,真是够烂的,-99
156625,后市仍看多，有强烈反弹要求不排除直接上冲,-99
309875,会不会是庄请来大股东邦忙的,-99
2463919,"刚才打了凤凰股份的公司电话，025-83566283,",-99
2501358,盘面看应该是大股东减持引发别的股东不满大幅出,-99
2334963,节走高。但是，地产股面临着销售大幅下降,-99
3954035,我们需要注意什么。,-99
5550249,不管你红盘不红盘，,-99
854465,600246:万通地产关于公司股东进行股票质押式回,-99
940659,天天跌，涨一天要跌半个月，什么玩意。,-99
3147569,秋林加大改革力度 不断从消费者的角度出发,-99
495366,"暴跌了,该买了!",-99
4709138,跌如闪电侠，升如乌龟爬。,-99
5244245,摩托。,-99
2332836,次新股，确,-99
1938163,快跑！空仓[空仓][空仓][空仓],-99
1683353,我在6.5附近等你，呵呵\t,-99
5173519,次新大涨，这垃圾被强行拉了一把，盘尾估计要跳,-99
1146070,哈哈哈哈哈,-99
4168688,603038:华立股份独立董事公开征集投票权公告,-99
3628219,大家见证了24/25的指定下跌日了吧！[胜利][胜利,-99
5441606,告中两次提及。一次是,-99
2754683,越跌约加 看庄家怎么玩,-99
1881221,钢材里面只有河钢是最弱的 天天玩几分钱,-99
3897600,今天不用看了 弱于指数弱于板块 不用看了 估计,-99
3581309,狂跌不止的打蜡机,-99
