,content,mark
952004,、如果所买入的价格处在低位，则不必急于止损,-99
4190028,一只软蛋不见起色，新股热闹独这冷清，国科出局,-99
3151894,中期协会会长：完善投资咨询监管制度 整治“黑,-99
1987344,冲高回落，很好；洗洗更健康！,-99
951684,东借西借凑了十几万，明天全部买开开，但愿开开,-99
2362135,海尔连续六年双11大家电销售榜首,-99
600719,指数下跌50点，指标股其实跌的不多，主要还是来,-99
4029760,磨矶什么，该涨就涨,-99
940893,只能按长线拿了,-99
3916454,吸金港，来多少，死多少，2年以后解套。,-99
1102352,一字板抢到了上海家化？3分钟看懂要约收购（附,-99
773679,这么多买单，涨停？,-99
3979856,建设银行：张立林就任副行长已获中国银监会批复,-99
383992,悲催了哦。,-99
4094125,我从54坐车下来的，涨停板打开我选择加仓！,-99
5111071,高开低走！,-99
1623053,速看，银座股份多家社保持仓股死量横盘何看？,-99
1975609,弱弱问一下，咋增持的，用嘴就能增持吗,-99
2137483,砍斧伺候！14。40元。赶尽杀绝不客气喽！,-99
5379366,M  D，一年多每次都踩雷，能不能不这样坑我啊,-99
289696,海信电视的这款激光电视,-99
2580927,这索普是索钱啊，此跌绵绵无绝期的，看我换的60,-99
3984309,就不要脸了,-99
2988031,如果华东电脑3月6日大宗交易的成交量计入当天的,-99
1673837,大盘风调雨顺，华丽颗粒无收[大笑],-99
4766235,狗庄天天下午往下杀，是什么意思啊,-99
2028221,新股发这么少，周一新股集体涨停,-99
2161411,底部十字星，明儿开涨。,-99
1313635,一放量就不是好事 兄弟我先撤了 你们顶住,-99
1445639,数据显示，年月,-99
3426251,陕煤的庄家,-99
4536646,领套套的来,-99
2072212,鹏起主力目标高远，操盘稳健，这波缓跌下来目标,-99
4551852,303,-99
54539,华夏银行(600015)融资融券信息(08-25),-99
940012,跌了盘，盘了跌。慢慢就把你们搞进去喽！,-99
583490,这种公司永远不会盈利！无投资价值！,-99
560857,小散：这傻庄还不涨！ 庄家：你们不给我筹码我,-99
1654342,烽火星空的估值200亿高吗？在怎么样也不比卫士,-99
2176419,170的华大基因，机构拼命“抢”，亏损的“炼石,-99
5008565,晒0980+10 2095+9 9985+10大家说说我中了吗？,-99
5336683,公司正式改名绝望股,-99
1036760,国际首创车用甲醇泵即将在南京投产,-99
5229022,603808:歌力思关于对部分闲置募集资金进行现金,-99
3668478,一切事情都做了,-99
2116477,无疑是一只值得投资者中长期持有的股票,-99
11486,打扫打扫打扫,-99
1424854,600410:华胜天成2017年限制性股票激励计划授予,-99
4189410,快点出货吧弱庄！你太辣鸡了,-99
3863151,想如今,-99
188113,主力已上车，请带我装逼带我飞,-99
4508851,自觉把人生追求同国家和民族的前途命运联系起来,-99
1811379,不要得意忘形！,-99
2034892,8.5以下可以买 哪里起来跌回哪里  哎,-99
4523883,盘前信息早知道（12.13）,-99
1804042,目前两市:市值30亿以下的优质壳已经不多了,-99
1576549,就是不年换手不倍，,-99
3343710,十个炒股九个亏。就是贪。今天周末止盈。赚钱了,-99
3354883,总算给人点曙光,-99
1475505,心里只有两个字,-99
886988,如果庄家这样为所欲为，大家应该站出来维护股东,-99
3990494,翰宇药业:关于召集召开2016年年度股东大会的通,-99
2337812,600684:珠江实业关于召开2017年第二次临时股东,-99
237631,多狗去哪里了？,-99
4406076,603180目标50下周见,-99
1392616,意料之中  这些冬市都是混日子的 吃拿卡要 没啥,-99
2482954,昨天13.8买的，刚刚14.4卖了，换股300165,-99
138747,跌了将近一年这种企业早就该退市了。。,-99
4502426,“八连阳”不及一根阴线。你意见如何？,-99
2305812,就一个字啊 周一不涨停我就吃屎一瓶。,-99
785359,2017-05-18.下周大盘预测。大盘运行于慢牛2-3区,-99
3798967,别高兴太早，明天补跌，再重申一遍这个消息是利,-99
2458795,才发现体,-99
2541614,我的看法，只要不创新低就行。。,-99
4987687,大盘可能下跌到了2000点，本次震荡不同以往，国,-99
4756185,603456:九洲药业第六届监事会第一次会议决议公,-99
1657557,此股还会反弹吗？该咋办，我拿100手，慌啊！,-99
5196876,估计是还想拉，哈哈,-99
289017,管道时代这票总有一天飞到天上！,-99
1125011,闪崩后跌势难止 星期六一字跌停,-99
3780845,自主创新让我国多晶硅产业熠熠生辉 多晶硅，在,-99
5286172,望安正时尚同样增持公司股票、维护公司的形象! ,-99
1433130,今天看到00051公告，最后说有一百多人起诉。,-99
4160759,28.2全出了,-99
1511478,第一季度宁夏水泥业绩要冰冻!可以撤了!,-99
530733,你们认为昨天布依真卖出600155了吗！,-99
3198684,重庆燃气=重庆瘟气，重庆死气！TMD半年来下跌近,-99
3474977,消息出其不意，要踏空的节奏吗？,-99
5261699,华扬联众11月20日火箭发射,-99
2363107,我们到股市是投资，不是亏钱。,-99
5104545,婊子开店卖！开超市卖？,-99
1771544,我在耐心的等公司一切公告,-99
1587252,深套的不卖！没买的别买！请远离股市第一垃圾股,-99
2944779,长虹还有希望吗？,-99
1922868,下周向3200发起进攻！！,-99
5274695,应该说在20个板板左右,-99
3152540,这走势太牛逼了 今天这架势 吸了不少筹码 明天,-99
1267145,个股依然是未能走出太好的局势,-99
3747186,买入成交后，我就挂了卖出,-99
192482,中国保监会召开紧急会议,-99
3439894,这股跟死了一样,-99
3268500,快跑！今天跌停[胜利][胜利][胜利][胜利][胜利],-99
875929,可以买点,-99
1253900,其实薇薇挺好的，这一波股灾没跟。补一下跌，哈,-99
711526,1170挂单，估计今天要跌停,-99
3355788,九州通：控股股东及其他关联方占用资金情况的专,-99
3095020,下周暴跌绞杀华夏基金,-99
1960892,不论分析如何。,-99
574402,研究筹码分布，才能找到好股,-99
5147253,大资金再给个机会再砸一次啦,-99
689950,一声吼啊！,-99
1448003,强烈呼吁：圣明的版主把团结紧张严肃活泼和秋风,-99
5070382,人怎么这么少，太静了,-99
4589573,终于知道十买九亏的道理了。曲曲这么几天十来万,-99
2568525,业绩亏损或业绩大幅下滑公司高送转的问题,-99
1157484,买吧，继续买吧，看亏不死你们这帮追风狗,-99
3025793,飞天鳄鱼000,-99
3329034,快跑兄弟主力准备挖坑了,-99
5395066,不会真要回,-99
4894835,我今天进了些，希望涨,-99
3406865,这个公司真是传奇，能把太阳能行业的利润做到这,-99
1990214,腾讯股价触及300港元，阿里未来会低头吗？,-99
4164257,激进者做ST中安都可能比现在603037赚钱,-99
4385627,现在居然还有人买，厉害啊，至少还有三个跌停，,-99
1035298,今日价涨量增，庄家买入坚决,-99
1660318,为什么东旭光电股价长年横盘不思进取？。,-99
2613243,7.90元我买秦川机床，准准谁[献花][献花][献花],-99
125722,财经新闻:王健林卖掉万达文旅和酒店，1500亿砸,-99
3547992,目标20元,-99
2631584,对投资者来说。,-99
4572936,均价29.3左右减持600股，看来是对了，后悔没多,-99
4745717,涨就行,-99
1786965,天士力的价值分析讨论,-99
1775154,买了就套，也不知道此股什么概念，有色涨它不涨,-99
4855460,变了很垃圾,-99
948681,万红丛中一点绿，开开今天变成绿叶。,-99
3438426,昨天有点感觉，今日又下去了，本来想买，看在线,-99
2128298,三爱富重大资产重组成功，明天上工申贝直接开始,-99
3126737,市场和我一样，认为三季报不行，昨天7.6卖的太,-99
209243,收盘6.5,-99
1492668,又到调仓换股时，最近的收获很是满意，太感谢了,-99
3969400,十大股东没变而且还大幅减持，股东户反而p少7,-99
3503352,新华社消息：大批海外资金和机构资金正纷纷涌入,-99
2732846,有人敢把3000手吃了没,-99
2448397,压的那3000多手是给你们家买棺材的吗？回头帮你,-99
1553242,常山药业高管减持，快跌停，蓝光发发展12月限售,-99
2157793,昨天挂单没买到，不知道今天有没有机会跌停板买,-99
788784,东方霸金：黄金原油在线更新策略,-99
1444869,跌吧，跌破14，我在13.3等你。,-99
4193514,张成锁，你妈和你老婆昨天召见你，没去吗？,-99
1278212,山东国资委控股的股票不要买，亚星客车也是他控,-99
3671142,KDJ严重超卖，且有金叉迹象。买,-99
3589878,年关前鸡精离场，资金紧，谁来抬，都是套牢盘，,-99
1689161,用户让逢呢逢个个呢呢。,-99
1128429,心电图,-99
1851959,明天肯定要涨停了,-99
1826171,这股多空博弈新老主力绞杀堪称惨烈，可惜苦了散,-99
4296407,中签的朋友，还有多少没走，我还在，坚信东方材,-99
4518232,那个把内裤当掉买进的人呢？你补不补，我这还有,-99
4219293,11点25分，又一波砸盘开始了,-99
5269988,上午走的人 太明智了,-99
940564,次新都涨疯了，赶紧压一压。,-99
88892,新股鑫广绿环(603302)13日公告称，因发行人出现,-99
3546760,不在乎一时的得失，请相信北银5年内会到20元，,-99
2939495,刚看了下海通，一个字跑，跑，跑，，，，，，都,-99
499329,上交所两度发函询问 *ST新亿转增股份作价存疑,-99
3461264,色都舞了，煤怎么还不飞,-99
4696316,人家都反弹大涨了，就你个垃圾,-99
318856,600095:哈高科独立董事关于与新湖中宝签署《股,-99
3207333,真垃圾，以为会创新高，失望失望,-99
4144523,陈学高如果不行就下来吧！占着茅坑不拉屎！,-99
4855001,流动性缺失[哭],-99
29176,股市风云变幻，易经在显神奇。阳历四月股市大盘,-99
2352064,飞天鳄鱼，这个牛市真好啊,-99
1956733,大盘恐慌的时候长电给人解套，什么用意。至少上,-99
4361128,尽快来买上证50股票”。,-99
3270407,今晚消息汇总:深交所：推进多层次资本市场建设,-99
3442415,市场暂无系统性风险，各大指数也问题都不大，继,-99
4809606,6月19日到18,-99
2215413,牙全掉了.小脚老太,-99
1900212,早在我预料之中，涨不停。。,-99
1554756,可是也快到年底了,-99
5412608,剑桥科技股友发来贺电。。。苏博te特加油，剑桥,-99
3218309,600939:重庆建工监事会议事规则(2017年修订),-99
24986,灾1车有sha跌出1货的苗头各位当心！！！！！,-99
5288266,不要去天桥看卖大力丸，小心买个大力丸回家。连,-99
5330796,老哥走了，亏得最惨的一只股，太平骚鸡，退市吧,-99
4090637,大股东董监高减持新规还没有对业绩和分红进行,-99
5174635,又补了十五万，现在只亏四个点了，你在跌我卖房,-99
1148647,大小非是近亲的产物！,-99
4989165,不看好的赶快卖吧,-99
5340206,哀鸿一片,-99
1359679,面对6.26%的跌幅,-99
1556675,输12个点，特么无语，放了N久…o,-99
373039,哈哈，4.7不跑.4.4跑的欢,-99
656232,记住一句话，今天吓死的，又不了半月就会悔死！,-99
4078860,这垃圾公司看来不到一个月是不会给个准信的，估,-99
2089776,A股离牛市到底有多远？六大机构指明后市方向,-99
1227282,"中国手游称霸全球,2016年中国手游市场增长64% !",-99
490864,兴发集团拥有20000亩土地 不包括正在规划的宜度,-99
