,content,mark
1286518,西南证券(600369)融资融券信息(11-03),-99
2070197,真是折腾，老是护什么盘，又回3100了，又要骗我,-99
3304144,效益优，价位低，开盘跌，笑话。,-99
5247010,越来越垃圾,-99
1857432,创业板两连跌，惨！,-99
2858286,有那么几个傻子，一天到晚在吧里自弹自唱，自我,-99
911433,股道天丰今日推荐黑马股票雄安概念提升风险偏好,-99
298192,机构看好变频器多用途，带动业绩增长。。,-99
1430591,连阴，恭喜主力家里又死一儿！,-99
5284574,老板你好坏哦,-99
3761498,跳水吧，还剩二十分钟！,-99
1424979,华胜天成亮相世界互联网大会,-99
1953146,主力压单砸价出货，放量下跌，空仓，17.5再来e,-99
5297719,走了，留下的兄弟挣钱！ [大笑][胜利],-99
4282012,明天挑战3044,-99
1815573,老夫掐指一算新疆城建明天大阳最少2个点。喜欢,-99
5331098,没看到双顶吗？快跑！,-99
4382480,庄家可能是得到什么消息了，跑的那么快，散户永,-99
4267842,多氟多“定,-99
4799508,取消激励，代表着中报已经不好了。,-99
724588,10.45介入的堪称高手！,-99
2009653,要调整一段时间了。,-99
221899,覆铜板等电子基材市场行情持续良好，公司收入稳,-99
3480654,[看多],-99
3072900,600872是不折不扣的大便,-99
4984346,好，太爽了[大笑][大笑][大笑],-99
1608681,股市长期与基本面高度相关,-99
2157664,600636:*ST爱富:关于上海三爱富新材料股份有限,-99
5182553,还是那句话，赶紧跑,-99
2238750,强强联合,-99
477161,报警声又响起来了 二股东直接掏钱分红算咯,-99
1442158,证券、基金等机构、其实没有什么招、除了对敲利,-99
80184,天天大单压盘压死你,-99
4169143,皇氏集团002329 国内最大的水牛奶技术研究和产,-99
4198005,冲上去一片蓝天！三年内必上五百！,-99
453632,看好5G通讯,-99
1239774,快了,-99
4291056,"网行业已经连续下跌了二年,很多个股跌幅",-99
851968,小胖妞 叔叔我想上去看看。。[大笑],-99
1244340,掘金地狱19层、揪出翻倍大黑马,-99
1595115,要求彻查内幕交易，要他们左脑,-99
4363470,特斯拉落户上海临港，离亚虹最近！我就不信不用,-99
930182,为了低价增发压价,-99
4823294,上午1285的大单是谁的，谁给解释下。。。。。,-99
2677382,卖盘怎么卖的那么凶呢 也没有多少融券啊,-99
2050455,如不坚持到底，,-99
5521782,拉起来啊，让我们看看什么叫龙头啊,-99
4634534,50万50万A压单几个意思？,-99
5193437,新日快涨快涨快涨快涨快涨快涨,-99
2760231,昆钢集团是云南省最大的工业企业，2017整体上市,-99
3570344,沪指退守3050点 百股? 明开盘不突9。06分即? 宋,-99
3224142,与其一直下跌到最后退市，为什么不现在就退市呢,-99
3838185,这是破7的节奏啊,-99
5254949,此股现在进都是稳当的，因为股东要减持,-99
1486338,跑吧,-99
3529007,十日广州港大激进飞一,-99
1319777,且雄安新区，,-99
1168977,两市未被爆炒过的少数品种，集港资 公共事业 重,-99
2166013,浦东金桥(600639)融资融券信息(12-14),-99
2293688,坚守就是胜利，中签不动已经赚万了[大笑],-99
1040203,多家公司重要股东发布增,-99
2965764,平的走廊。支持趋,-99
1961465,中拉一把了！。,-99
221536,进早了。[滴汗]。,-99
1022022,明天低开再买!,-99
2225469,今天又是哪个大股东减持股份，几千手几千手的卖,-99
5547174,此股或见底， 上行等不起。 另强力推荐大牛股！,-99
1472491,谁主导了庄园牧场（港股）半小时内暴涨291%的大,-99
4692389,东旭光电上车已吹响集结号，蜗牛也是牛：慢牛！,-99
769417,爆头了爆头了，BOOM,-99
5310251,这个庄，良心大大的坏了。庄在做T，还得向下打,-99
1506817,怎么会这样,-99
3308079,佛山照明“现金奶牛”乃实至名归。,-99
2728110,[国家D]抬拉[雄安]垃圾 杀跌中小创太恶劣！,-99
5556954,读者传媒股吧三只空狗狂吠，请它们对号入座,-99
1264078,LME铜刷近3年新高 江西铜业同步涨4%,-99
62417,好啦，拉板啦，加仓成功,-99
5556146,干的漂亮，买买买,-99
4815357,一首凉凉送给我自己。再也不追高了,-99
3075556,中炬发红包了！,-99
5224810,主力一样要慢慢适应“国际通用估价体系”，逐步,-99
3033429,减持还有三分之二，国管和基金剪还要剪羊毛，还,-99
4919635,不管你红盘不红盘，,-99
3889689,买盘好样的！,-99
1688253,"方大特钢净利增长233% ,",-99
5294312,央行缺少独,-99
4685677,股市众生相，股价越上涨越是更多人看好，不怕套,-99
2591400,道指午盘小幅上涨 耐克,-99
28396,下车了，可惜，死大盘吓的。,-99
4368207,明天又要坐过山车了[不屑][不屑][不屑],-99
5053453,证监会真的出手了 十箭齐发护A股 最关键这一点,-99
5201295,全换成雄安概念互联网金融002657中科金财,-99
1924471,1万手大单厚黑的,-99
2324593,大盘马上跳水，百川向11块钱挺进，加油，烂货，,-99
2127099,上市公司业绩预报玩“儿戏”,-99
1187275,原以为真的是业绩暴涨股，才知道是个垃圾股！,-99
1882735,高送转几近是不可能事件了！,-99
4937441,大家在9:25分前买竞价挂涨停价,-99
4777230,上40啊！,-99
4284415,要创新低。,-99
1922699,预测本波反抽的高点为32120左右。,-99
4430380,没有看到多头发力  只见空头不断进攻  但是空头,-99
1982880,散户都愿意等到年底赌一下特斯拉！所以盘中对倒,-99
3330063,无量莫搞头,-99
4657982,停止抱怨，积极做多股价自然张,-99
3610191,又跳水了没出息,-99
2246676,最冷调控与最热“成绩单”：部分房企年目标已达,-99
949798,该出手时必出手,-99
4766065,日,-99
2781742,360会不会来举牌浙大网新,-99
1810550,都要经过尽心修改，往往报喜,-99
4882107,7.12 大盘解析2,-99
3684883,明天跌的你饭都不想吃了，你信吗。,-99
3693527,近一个月天天下跌，涨幅没有一天超过1.5%的，皮,-99
1274773,新能源汽车助稀土永滋暴涨：西方国家陆续出台20,-99
3391142,中国外汇交易中心批准土耳其中央银行27日起成为,-99
945291,好吧！把昨日尾盘抢进的也洗没了可以拉升了！,-99
4019115,今天军工股怎么回事？说说,-99
3022797,小时级别调整，周五有望新高 持股不动,-99
3541959,目标九十[鼓掌],-99
975248,？,-99
1138078,几块板砖都找不着，。,-99
3724283,东吴老狗什么时候配股？,-99
2472640,600718:东软集团关于公司限制性股票激励计划预,-99
1191001,国际局势正发生新的深刻变化,-99
1982988,呵呵实力告诉。。。。。。,-99
4650614,中国国脉要飚了,-99
1821844,但这并不能缓解年底市场流动性的危机。,-99
4422848,本来好好的一个股票，硬让两个神经病给害了,-99
2140623,不受干扰,-99
3476720,散户太多了。16万股东怎么涨啊。。,-99
3102871,垃圾们，看看600128 000628，在看看你们可爱的,-99
1348279,的主要原因，失败,-99
232160,板块轮动，调整长到位，本少大举进入国家战略军,-99
5066416,年底了中签好过年[鼓掌][鼓掌][鼓掌][鼓掌][拜,-99
1333299,摊上这只股，真的很无语了。。。。,-99
4508934,2016年是潜伏京东方最好的年份。2017年是投资京,-99
3706323,你知道拉死了多少股吗,-99
2634371,今天尾盘有惊喜！,-99
5115542,我只想说今天卖掉的小散真可怜,-99
3035228,此股近期三次11.64涨不过去，多数交易日尾盘拉,-99
3388801,菜里有老鼠蟑螂，被查封了,-99
2622918,浪潮软件，主力软蛋。,-99
2259146,美股有没有风险？为啥全世界的资金都跑过去买？,-99
5122554,中报业绩净利润已经是去年全年的4000万了，下半,-99
2617050,你妈个逼国贸，怎么不跌死你呢,-99
2588343,大盘疯了两天，大控压了两天盘,-99
4480259,明天高开高走，雷锋……,-99
1871870,明日冲高回落蓄势整理概率较大,-99
2346737,当10日线与60日线这类比较重要的平均线,-99
261221,600080:金花股份关于非公开发行A股股票申请获得,-99
2602505,24日更名海航科技主业质变国际电商云科技人工智,-99
4875453,覆巢之下，安有完卵。小苏也是跌跌不休。本人持,-99
759983,恭喜周线6连阴，估计7连阴我3.72加仓的计划就实,-99
1150601,听那个换酒的，都卖了，换酒吧。换了就别来这墨,-99
1971000,赔的一大糊涂，如能回本这辈子不在碰股票。,-99
4750282,本周次新股将大跌，别问我为什么!自己去查消息,-99
3041100,看企业变革期的人才战,-99
4218536,持股待涨,-99
1074673,马上进入2时代,-99
2322940,和平发展合作是时代的潮流,-99
5375017,寿仙谷股吧，真是最好玩的股吧，够热闹！一群完,-99
5390574,今天买进两百多手 明天跌继续买 跌就买 不赚20,-99
5392844,杀的比别人快，别人起来你却不起来！禽兽,-99
994355,明天保税科技大涨涨涨涨涨涨涨涨涨涨涨涨涨涨涨,-99
2972754,服了二十七,-99
5063828,都说了，这垃圾只想着绿…从来不愿意红,-99
562163,天天拉高出货，出不完,-99
2439877,常林走牛要有时间,-99
1222444,向上冲吧,-99
703393,满仓等发财[大笑]o,-99
2387765,真正的大利空是股票发行注册制。,-99
775431,粗算一下，一千万拉涨停，我要准备开始了、、各,-99
3802168,建筑今天第二次召开股东大会，到底什么事？,-99
2575298,快点砸，我在等，，，,-99
4192491,你张开了双翼,-99
3395175,养老金要进银行股，早就准备了，打压后让养老金,-99
2598979,下周向3200发起进攻！！,-99
4314842,垃圾，业绩又不是亏损，不要脸的跌,-99
1646869,我考，重大消息,-99
281240,同仁堂(600085)融资融券信息(10-18),-99
125881,保比例马上要低于130%了，是不,-99
3785202,回来看看，等待机会[不说了] [看空] [看空] [看,-99
785294,嘿嘿！下午逮到一波肉肉！,-99
1177152,澳柯玛JD商城客服都是这种人才 难怪几十年都是,-99
4259849,还称已经拿,-99
2404250,这开盘有点过分了。,-99
1832141,无量上攻小心这一隐患,-99
1945600,11月27日影响股市涨跌的重要消息：这些利好要重,-99
4119878,感觉要涨了！！,-99
237623,今天是要涨停吗？哈哈！没看错你！[傲][傲]。,-99
4718775,上午24块56就卖了，可惜，怪杭州园林和达安股份,-99
5090888,复牌搞什么东东,-99
3721961,好的公司有,-99
4178484,挂了一天，70竟然没买到[想一下],-99
4293247,上呈现长阴巨量或长上影巨量,-99
4751530,签友们，可以挂单了，为了自己的利益，都把单子,-99
2192892,落泊的凤凰不如鸡!墙倒众人推!死b们,-99
4852716,股吧挺冷清的,-99
3003122,跌停，好好好,-99
