,content,mark
3710067,今日股市吐槽：别提3300，你爹套在5500,-99
1696599,解密上市公司和簧袒构们的场内场外秘密，低成,-99
4145538,上岸了[大笑][大笑][大笑][加油][加油][加油],-99
1831650,挂开盘价出s,-99
3806000,这货入了上证50，会不会把50拖累,-99
1105922,盘面发出强烈信号――量价严重背离！！！无量拉,-99
268388,今天为什么一反常态的大涨！？11月29日大会结束,-99
4381816,离混改报方案最后期限还有80天。,-99
4558889,来个闪崩,-99
5071555,最近好多股票都喜欢搞这种诱多出货洪涛股份银河,-99
5427752,垃圾公司，早日倒闭。不要再害人了,-99
4210507,大股东又减持了,-99
1917980,瓜娃子柳丝郎一江春水向南流泥[不屑][傲][不屑],-99
1443379,看K线,-99
1132597,天房发展怎么啦？,-99
4304885,甚至有更乐观的准备借机大干一场，,-99
3331687,记者采访时表示,-99
2237279,服了,-99
461781,请问：截止九月底的股东人数为多少？,-99
3855905,近期市场短期风险偏好回升，主题板块表现抢眼。,-99
1494807,因为此债券能够以不低于成本价在任何时候被持有,-99
3128729,肯定又有老鼠仓在出货，从未有像TCL那么阴湿的,-99
3672717,妈的，就小散在玩，一分一分的玩，真尼玛坑,-99
1465294,每次拉高跑就对了,-99
4799837,沪指危急,-99
1285148,指数精彩成交量捉鸡,-99
2267409,3200站不稳的狗,-99
626862,可预见的2个星期之内，没有进行业务或资产重组,-99
2643732,畏的。,-99
2229524,股价不上十五元，我股东大会网络投票投反对票,-99
1627014,中金黄金一个国企坑起人来从来不含糊！到了人人,-99
3541282,加速赶底的过程的确是很难受，这个净资、这个股,-99
2374089,2015年亏损478.76万元,-99
4557043,月日起巴菲,-99
4943486,希腊卡巴，改路子了，买中科曙光了，禾丰暂且放,-99
2885890,正式独立的生活,-99
1846490,6月24日600553走势。,-99
1081519,你算完犊子了，四元左右见！。,-99
2900258,出笼那鸟，出雄那吊，黄了，冒了，商量业业了！,-99
484282,再融资新政仍然有需要进一步完善的地方大鱼中水,-99
2434417,且以282万元的卖出金额位居卖出首位。,-99
78253,持股待涨的原因,-99
1058924,标准股份庄家，能不能像点男子汉，不要被女人笑,-99
2174240,散户不多了，[大笑],-99
2272338,2015年，北京建广资产管理有限公司以18亿美元收,-99
396353,就有一个亿的筹码,-99
1940069,大市要调整了，目前还没破势，如果调整幅度过大,-99
1387618,如何看待上市公司扎堆卖房以及卖房保壳？目前市,-99
2186261,我已经攒了5万块钱。,-99
5134994,终于补跌了，第一目标价格30,-99
2834502,"成本价1.8元也有可能,但有意义吗[大笑] 如,你10",-99
855336,万通1月前比天房发展高5角，现在天房发展比万通,-99
1128649,请问贵公司的三季报预计何时出炉？谢谢。。,-99
1157794,市场的大幅分化行情，使得指数与个股的相关性大,-99
236948,2017年9月最后一个星期这9只券商股必大涨,-99
5084946,坚决抄顶没,-99
404096,累计红利(每股90美元)  3.065,-99
719055,买安彩的百分99傻逼不傻逼时间验证。吃屎拳你不,-99
2620463,10月27日交易情况:  1. 一共下了7个单子，成交,-99
3472170,今天要跌停了，直接挂跌停价买,-99
2471939,亲们赶紧卖吧！已经没有上涨的空间了,-99
2652425,在行情跳空开盘时应立即买进或卖出,-99
143771,珍爱生命，远离联通！,-99
5486574,奇葩股,-99
1668375,压盘的杂种，大盘起来了，接着砸啊，必养的,-99
3614078,这样的成交量减持工作有两天就完成了，,-99
3223138,600958:东方证券2017年公开发行公司债券发行公,-99
4927476,股是好股，放两年，一定会涨，短期没有最低，只,-99
4551194,空谷幽雅谈欢：12月4号财经热点消息面,-99
785036,果然处高位开启七卖身行情[大笑][大笑][大笑],-99
1456008,鞍山一工和鞍山合成也是国资的，退市了十几年！,-99
5340711,看来庄家今天不再犹豫了,-99
1875836,今天洗盘，明天涨停。。,-99
4733356,分时图显示指数依然没有达到强势做多的局面,-99
3771099,还有脸面吗,-99
4649877,速度涨停我要清仓了 哈哈,-99
2911556,拉高出货了,-99
3631707,真想骂人,-99
2566826,整体上市两大平台猜想：整车――一汽轿车，零配,-99
1614124,扬农化工啥时候调整到位啊？天天跌一点，折磨人,-99
270231,鬼才会接盘海泰，早都被掏空了,-99
3594814,请问贵公司与华锐风电的官司进展如何？,-99
5370714,在这种利益关系面前,-99
4213695,坐好了要升天了,-99
1487569,炒股如何使用支撑位和压力位。,-99
2220744,不破不立，破三元大家就分批吃进，越跌越买！切,-99
5201222,冲啊 买买买,-99
4506913,垃圾主力到底意欲何为？,-99
5311845,你MB 好不容易中个股 五个板就搞开了 操你M的主,-99
2753949,回首向来萧瑟处 归去 也无风雨也无晴 。。。。,-99
2018770,厉害,-99
2531362,我们议论前锋，万年天天 在这发广告！希望有人,-99
1086420,有句话叫做深蹲才能跃的高,-99
4532562,大癌股智障滞涨！,-99
1414510,一个多月只有1个姿势,-99
5517650,"北纬通信,游戏收入1亿5亿总股本,9元多股价wwwww",-99
1318754,走出底部是买的时候了。,-99
2245311,应该割肉吗,-99
2174160,分时图一个标准M头，明天回调,-99
1557264,中国股市有四家海参养殖上市公司，壹桥股份（股,-99
2137321,世界百联，百联世界！便宜无好货好货不便宜！,-99
3299872,做空大盘的指标股 唯有宁波热电 看来真是不假,-99
4998226,这个换手，不温不火，调整还要一段日子！,-99
2885883,特力又是直接从跌停板拉到涨停板,-99
876581,日涨日跌不,-99
754981,再坚持两周，融资盘必爆,-99
3897394,601858:中国科传监事会对2016年年度报告及年报,-99
5068932,正是在这些利空接二连三的冲击下,-99
4672587,小董事长要加油干！虽然没有老董事长姜辣[赞][,-99
3012974,又给谁输送，你大爷的,-99
3044133,典型拉高出货走势！很闹心的绿地。,-99
814155,千万别手贱，让庄左倒右自摸个够！,-99
3671609,周线即将死叉谨慎高位崩盘,-99
1788581,垃圾货,-99
2477184,砸啊！中信建投,-99
249899,上千手的压单，托单。买卖几十手，浪费时间,-99
1356246,以不变应万变，不可错失良机,-99
3061635,黑心企业，湖南恒大华府业主维权,-99
5062021,我星期五给您们说过，开盘就跑可以少挂两分跑，,-99
4152808,一起骂主力个衰货。,-99
4216602,震荡出局,-99
2373238,解百这么好，东百就是一副熊样,-99
2236931,年报要破净资产了，未分配利润储备多，,-99
3562724,4.95,-99
1465766,华鲁恒升(600426)融资融券信息(08-01),-99
5300575,都在意淫中，没买的想跃停，买到的想涨停。不要,-99
921272,大家勿回复空帖。,-99
5456387,昨天一冲动追高买进，今天一开盘赶紧割了，9.31,-99
3003308,此票没有主力A估计还,-99
650791,至於@痈幔,-99
279179,今天媒体说明会的信息点。有好多有价值的信息。,-99
3604859,华电这死股总是跌跌不休，狗庄要走得早走了现在,-99
1929390,最后一贴：17年只炒两支股，哈哈哈！笑看风云！,-99
2870642,泼个冷水,-99
271028,一文看懂上半年股市全貌 哪些股票涨幅翻倍？哪\t,-99
3426078,指数收于10306.92点,-99
3811753,毛用 股票又不涨,-99
1360106,不赚钱打死也不走,-99
1094813,1994年7月29日,-99
315350,如果8.3上不去，就说明还是和昨天一样,-99
2561802,华域汽车(600741)融资融券信息(08-07),-99
1323499,今天居然不跌了[大笑],-99
5051691,有10转7在，价位也不算高。,-99
4920502,刚卖就拉了一波，这叫啥事呀！,-99
3914300,今天涨跌都买点。,-99
1737644,公司业务有望通过专利挑战成功实现质变,-99
1826043,深高速(600548)融资融券信息(08-16),-99
5372955,各位货真价实签主一定要想清楚，中签不易，你卖,-99
925172,我不信它今天能翻红，还有其他人跟我们一样吗？,-99
1978870,70多亿的市值，一分钟交易几手。。。。不服不行,-99
2033432,股吧有点冷清，看好的都走了？唱多唱空的也都走,-99
202495,大庆联谊招兵买马.准备大扩张.,-99
1233706,效益如此好的股，不到20元，没天理,-99
3013977,探底结束，上涨随时启动,-99
1252346,7.5 收评,-99
2361635,20.16先清空等机会再进,-99
5370848,毛纺行业龙头，量价齐升推动业绩增长,-99
4243277,佛山无影脚极少见的封板被砸，后市可能会报复，,-99
3100678,今天收盘9.03,-99
3003950,买铜峰电子都比这个强，现在在上升通道，超级电,-99
2399675,能走出一步好棋的人，未必能赢得整盘棋的胜利，,-99
4158333,全年1元收益!才2O倍市淫率!,-99
2138772,海信南非开普敦工厂 感受中国制造的魅力。,-99
4261312,主力不作为，愧对股民,-99
106375,谁补涨,-99
387421,庄稼现在拼命出货，你们还在哪吹。你那把大家都,-99
638131,6.04的单子一直加！不多加，每次几百手！,-99
4345370,这价位没有套牢的了，想出的可以出了,-99
3089792,港华燃气以,-99
4811346,更不值得提倡,-99
3197164,洗洗睡吧，今天就这样了,-99
4522246,今天此股唯一的优点大概是节奏控制的好，平开下,-99
5400950,股票再跌 就不是玩意了,-99
3714460,而吾所欲告之于身、阴实者如律凡在空中荡,-99
269761,高呢秒和呢看高,-99
772448,太龙药业年年月月岁岁低位割韭菜，全靠内交，富,-99
4665050,300601,-99
4926714,今天是最好的逃命机会，资金一直流出为目的的,-99
4552517,说说得邦照明暴跌的理由！,-99
4383878,有变异迹象[毛估估],-99
657614,锦州港上半年吞吐量增长18%,-99
2177117,别怕东今天,-99
4597406,这支太弱了，放弃,-99
3474476,卖了，泥马涨停去吧,-99
284876,4月12日公司利空消息汇总（附股）,-99
3436475,熬不住了，大单出货,-99
5145422,603729:龙韵股份2016年年度报告摘要,-99
4547775,昨天才是做T，今天就是砸P，今天根本]有吸I,-99
1440917,本小散5月承诺的三个月不减持，承诺的时间快到,-99
1172156,天选剑圣强势镇压皇魔天,-99
3491389,不是吧,-99
2736023,看来最近要有动静了，蛇属牛神都出动了，静观其,-99
4736672,有难同当,-99
1685365,跌这么多都不见反弹一下！,-99
2316247,这个垃圾抱着吐血！,-99
475002,仍趋严且IPO加速仍,-99
2004148,跟开滦股份差距这么大！逼货。,-99
4290369,京东方，第1季业绩盈,-99
2345164,小单成交横飞，主力冷眼旁观。,-99
3403695,跌死死他[鼓掌],-99
