,content,mark
3530798,重庆水务，整体现金流，营收都不错，只是业绩增,-99
3399257,买文峰股份(601010)亏3800，幸好中一签“基蛋生,-99
1386632,这樱桃树脑残了。一天唱多一天唱空。天天发些无,-99
1630724,估计打压到7.5左右，太黑了,-99
610621,600177:雅戈尔关于购买理财产品的公告,-99
355903,兴业银行没有和平安银行和招商银行一样的转型思,-99
3220515,券商10月成绩单“强者恒强” 万亿两融有望催生,-99
3032462,这么简单的线……亏手2B杂皮种都看不明白……弱,-99
4705999,惠达人该吃屎了,-99
522146,傻逼门。前天告诉你们暴跌了。不听,-99
4080392,大单在进 啥意思？,-99
3024364,差点被这垃圾偷鸡涨上去几分，还好大盘砸盘，感,-99
3141811,黑牛食品花8亿买进雄安特区1300亩土地，真真切c,-99
3704471,5.13……阿弥陀佛[拜神],-99
1235704,a. 详见表12,-99
4347203,抄底抄底抄底抄底！坐等钱！,-99
1956256,今天的走势超过华创，果然有后劲,-99
3859273,下午跌停，昨天融资买的散户太多了！,-99
2523150,跌吧，跌吧！跌到2块买进,-99
3857117,他们就是小农一个！！,-99
154228,呼呼呼他,-99
4143548,就一个板吗？,-99
3362057,散了吧，让配售的炒去,-99
3834786,豫园商城开,-99
5119788,无疑是明智之举,-99
3652222,摩根士丹利华鑫证券600621，外资控股第一股？！,-99
1353556,前低已破，新低不断。,-99
1850063,粤港澳大湾区概念股龙头当仁不让,-99
2022369,维生素要涨价了，冠幅搭上涨价概念，狂飙三倍，,-99
4046168,股市震荡老手思退新手急进惧变减仓谋止损，思危,-99
1175107,通过筹码分布分析,-99
4208720,21元以下考虑进,-99
2394521,算了，又赔在这了，走人,-99
1611533,不成功便是虫，王靖绝对不愿做虫,-99
3671250,标准过分侧重盈利水,-99
3392661,关于陕西中兴林产科技股份,-99
1996679,成交金额分别为36.59亿元人民币、18.16亿元人民,-99
1507774,你大爷什么情况啊,-99
1860920,大西洋啊大西洋啊大西洋啊,-99
3274529,五丰要停牌多久？,-99
4347574,天目是被带下水的没涨什么就跌下去了今天50，8,-99
3954284,说实在的，抚钢才是真正的混改，沙钢接手管理，,-99
1926645,今天涨,-99
3817334,该走的都走了！,-99
3459749,“婴儿潮”端午节、六,-99
5451807,次新股都跌停了,-99
5316510,603861:白云电器独立董事关于投资建设智能配电,-99
827292,谁又上错船了,-99
3118852,二三线酒企跟风茅台五粮液提价。,-99
2838124,流氓天天忽悠 为何它还天天跌,-99
643810,公告中报，当心巨亏负资产,-99
5491229,有必要这样吗,-99
4047407,推测中报业绩暴增,-99
4196071,xxxxxxxxxxxxxxxxxxxxxxx,-99
5030246,三祥新材(603663)成都人民南路招商证券证券营业,-99
1730174,贵州茅台(600519)融资融券信息(11-27),-99
3909247,死气沉沉,-99
2944993,湖北能源000883继续阴跌,-99
5365627,今天继续调整，基本调整到位,-99
1253394,新农盘r遭到刻意打压，难道后市真有重大利好？,-99
3137593,久违了，千手哥,-99
762100,完了，冲高回落，巨量出逃。,-99
2111355,多数对冲基金依然延续,-99
2582862,套现，资本运作，拆东,-99
2381360,几个意思？几天不看赚大了。[大笑]不过套了很长,-99
3730505,开户至今八年，平均一年亏十万，有这十万干什么,-99
874893,还是中航牛逼,-99
5288219,二庄,-99
1748711,长园集团(600525)融资融券信息(12-19),-99
5199128,慢慢拿着吧，估计明年会涨到21。[微笑][微笑][,-99
4403667,"监管之下,估值合理且业绩较大幅度增长的低价股",-99
5074736,牛牛牛,-99
3768800,今天破5,-99
5129167,明天变成红三兵,-99
91793,明N资本：“战狼”战无不胜篇”！8月份什么电,-99
2479729,会深跌吗,-99
1433893,再来十个涨停，打破次新股。,-99
1067345,民族品牌中最后一个金矿，始于1840,-99
2144732,尖底,-99
3246424,继续关注券商板块走势,-99
1291654,莫管鬼托叫成狗，小散一定要留守，狗叫无非吓你,-99
3449632,再有大跌可以考虑买入,-99
1673947,申万宏源：天地科技买。,-99
5183908,每天都是一点都不涨就这么一直的跌！然后一分玩,-99
2054764,为什么说整体上市最大利好是一汽富维，而不是一,-99
5311131,我说怎么跌了，原来公司开会要提前解禁！明天惨,-99
2494641,一个像你这,-99
5207294,康普顿底部筑底 看好的小仓,-99
1726678,恒瑞王者归来，康美跟上,-99
4608348,这是差点跌停,-99
2396316,几个没有均胜电子股票SB天天狗叫,-99
147320,10送12派1.。,-99
499676,怎么还没结果，这股是不是死了,-99
3897091,狗屎就是狗屎，二十多成本，唉！,-99
1877757,许家印资产净值已超王健林 离中国首富不到50亿,-99
3501098,海南橡胶一直在海南板块中一颗璀璨的金子[大便],-99
3423094,已经割肉，走人了,-99
1845668,友情是风，缓缓拂过心中那枚极微妙的记忆,-99
3790751,估计长城汽车即将倒闭。 所以人品高尚的我来做,-99
4945168,今天又很悬，哎！,-99
4253994,ETF：FOF最佳底层工具,-99
4626527,倒行逆施,-99
4312270,幸好昨天12.25割的，今天还是鸟样一个！！！！,-99
1217276,从中国证监会通报的情况来看,-99
2591200,宏润建设上半年新签合同增长86%，马上出业绩预,-99
3892872,中石油H股股价仅5元港元，折人民币仅4元多，炒,-99
1075494,钢铁股最低市盈率之一南钢股份1111111111111111,-99
5537317,生死就在周一了,-99
1010390,卧槽，挂了涨停价，要就拿去。,-99
1148313,这个股票发行价这么低,-99
2914992,将上市公司送转股的比例与公司业绩增长的幅度挂,-99
1968363,新华医疗(600587)融资融券信息(08-23),-99
301647,复牌吧，让北控顺利成为控股方才是人心所向,-99
1711445,大势不过逆，逆天行~者难有善终。,-99
2477398,指数创新高，跌的家数多。。大家要有耐心。不着,-99
895256,其实今天确实没有主力，我挂单7.22几次都把筹码,-99
782875,热点板块轮动，接下来房地产扛大旗？,-99
3713660,低位该如何进行补仓？附策略技术,-99
646612,因为360上市，7号和8号我开始短期看多，所以买,-99
5190815,很快王8珍又要质押补仓了。不然又要到平仓线了,-99
3215630,老子咋个会遇到这个垃圾哦！！,-99
1804158,监管层被戏弄了一把？,-99
3612621,这股真是妖股，半年都不涨[大笑],-99
5233227,不能为股民谋福利的董事长不是好董事长！公司为,-99
2995968,八招判断应止损还是持股,-99
4778810,黄鹤一去不复返，白云千载空悠悠。,-99
2151101,吉斯腾10年平均价格。,-99
3344279,今天量这么大，明天有点危险，现在还入的祝你们,-99
2980831,智能网联汽车国标即将出台 产业链有望迎拐点,-99
2059844,此股周一注定走势不平凡。主升浪拉开序幕，要上,-99
3712598,当心十点半效应。,-99
1341366,这股不破13.92元，不会涨的。,-99
742429,大盘飘忽不定 跟着楼主我不必担心这个 哈哈 板,-99
2691616,拉一波进去，杀一波。股市真会玩。,-99
4414143,别说什么吸货，这样一直打低，套牢的散户不补？,-99
5324532,中小盘股票都在反弹就你还死气沉沉,-99
2427754,两市3000多只股，我看也没几只股的k线图比这个,-99
1730515,#小盘成长次新股润禾材料必成创业板超级股王,-99
2763314,妹的，2天赚了5000多没走，今天只有500了，走了,-99
1365438,宇峰看盘：大涨中一些。,-99
3528864,环保大涨，你难得不是环保？,-99
3384126,沿海六大火电的日耗为70.9万吨,-99
5460572,你不割出来，就不反弹，你割了立马就涨信不信？,-99
4097618,估计下周能复牌吗？,-99
4851479,洗洗更健康,-99
1095499,两分钱玩一天,-99
5212018,这均价线也太直了，不看好，给你886,-99
1311228,今天见红,-99
3203752,终于站在跳台上了！勇敢的！别含糊！,-99
3262173,越来越低,-99
232898,从本月开始解禁股开始增加，存量资金博弈根本吸,-99
5369232,马云正在买入此股，必上40元,-99
3207308,杭银都是解禁股闹得啊，已经没啥意义了，上海大,-99
3753405,总是这种套路有意思，换个套路啊，,-99
464925,这么快破增发价了[怒][怒][怒]，东湖果然名不虚,-99
2352725,今天也就这样了，奶奶的蛋作为股市国家调控利器,-99
5323430,飞科商城app，发展模式跟小米一样…,-99
1746719,无良公司傻逼庄,-99
2783871,希望大家抛弃宁波海运换股支持我们的强势股TCL,-99
3542823,市盈率怎么越来越高？,-99
1038977,明天.,-99
1863495,向总龙头发梦,-99
5341437,今天上证吧,-99
3715346,保持观望,-99
4199308,外资持续运用沪股通深股通买入中国A股,-99
3663341,下来的明天,-99
1650106,消息外泄，大事发生！A股调整的极限点位3160！,-99
2323904,根本就没有主动买单,-99
1694463,600509:天富能源关于新疆天富信息科技有限责任,-99
5237111,是底不见底 见底不是底 犹豫不决 将会丧失良机,-99
2067971,好股要捂住，哈哈神奇很稳当，比长春之星的清源,-99
3438839,看尾盘,-99
3858841,15年到现在基本没涨的股票怕什么建仓,-99
1933518,7月27日，gjd的钱早就到位创业板中小创了，然后,-99
1267980,应该快要崩盘了！,-99
277258,这只票到底值多少？不是唱多或者唱空就可以的，,-99
4094455,趋势已坏，利好未来！,-99
1609141,有几个叫你捂住喽，V型反转大牛市。,-99
4269236,酒精勾兑的东西股价要炒上天。,-99
4989540,注消完！360借壳…南威好不好,-99
730734,军工股北化股份重组通过！比杰赛科技强多了！,-99
522037,谁带来了带,-99
4766813,新股一旦开板，宣告无风险套利阶段结束，前面一,-99
2773442,国电该跑的都跑了，就几个散户折腾来折腾去,-99
2309392,又是没有量，这股是死股了[不屑][不屑][不屑][,-99
3188010,高位上影线，明天低开，将会跌停的风险!,-99
1795409,大凡股托预测的价格，低价肯定跌破，高价肯定到,-99
1598686,开盘直接跌停,-99
2542480,15年卖房买这垃圾的那位兄弟，还在不？,-99
106817,大胆意淫招蛇开盘价喽。。,-99
3906624,金狗终于在天龙股吧承认自己称呼自己老师了。,-99
3975188,创新高后还不走的人肯定是傻的，不贪心利好出来,-99
1541656,深股通第一股,-99
5199674,603789:星光农机关于使用部分闲置募集资金进行,-99
766107,今日收盘价？,-99
2539552,周线的高点时间,-99
1883826,迪马，本质上是地产股，所以如此。,-99
579368,希望不要像小贤同志那样没出息，希望有动作，有,-99
4003499,等他筹码砸完了，收筹码往上拉的时候 就给他,-99
683833,感动着自己,-99
