,content,mark
2112009,知道跌字咋写BT,-99
5406786,昨天进的，今天还好吗,-99
3967646,好久没看到凤凰暴涨1个点了，腾飞吧凤凰，相信,-99
4730639,此庄喜欢高位回吐。,-99
2596319,600749:西藏旅游重大事项停牌公告,-99
2740510,俺们今天抄！ [抄底][抄底][抄底][抄底][抄底][,-99
1947533,煤炭价格连续暴跌,-99
2858246,雄安概念股华夏幸福四涨停 王文学身家增190亿超,-99
3207303,招商银行庄家获利丰厚，在24元附近义无反顾地出,-99
2830470,下周一象屿股份继续调整，到13.1元买入即可k,-99
741829,不断震，震不断，高抛低吸亚星发大财[大笑][献,-99
5175062,百分之一的换手率 这个畜生终于快完蛋了,-99
2176766,想得美不行该怎样就怎样,-99
4133271,正是时候！,-99
295229,601928更多的利好在后边，目标26！！！ 60,-99
780739,600225:*ST松江2017年第二次临时股东大会决议公,-99
718119,卒狗，我分仓买了5千万安彩，廖强是我战友,-99
2106807,砸吧，我接,-99
4913365,内斗几时休？,-99
2152843,大众公用管理层薪资太高，又不是什么高科技企业,-99
971245,"想套人，你的壤到18,19再撇下来，1毛钱套谁？",-99
3201382,小散不怕死往里冲，叫你后悔一辈子。基金都吓跑,-99
615291,赵锡军对中新网记者表,-99
862802,资源不能有效整合。 ?,-99
5023199,机会终于来了，买！,-99
1443933,业绩低于预期，这些股走的和大盘板块 逆行而道,-99
4533729,走势太难看，清盘,-99
5005946,晒下战果，尾盘出了点货,-99
3140929,5号之前的公告为什么没出来？。,-99
4052650,你是涨不停的,-99
1680171,我是不以为老师，你在哪里？,-99
1668780,够可以的一万股得一百一元[哭],-99
618073,哈,-99
4638213,哈哈哈哈，已涨停！！！！！,-99
388917,每天动这么大资金，才涨一个点。。什么阴谋。,-99
4358352,昨天都说了是虚假繁荣,-99
2888355,很多sb还在忽悠，居心不良，主力在出货，,-99
254705,K线分析，今晚继续！,-99
3839952,部队生产军装急需用钱，砸盘套现买布料准备生产,-99
5278609,今天收地量，明天会大涨,-99
962070,等60日吧,-99
3002375,一个很奇怪的现象，吧里叫空的没有一个是空仓的,-99
271604,或是从高点大幅重挫而投资价值浮现时,-99
3443259,不过午后的回落或多或少体现出该位置压力的存在,-99
991826,套牢一年多的有吗,-99
1454550,600422:昆药集团2017年半年度报告摘要,-99
3102253,险资还能撑多久？,-99
1433751,危险,-99
4726798,老子一个亏10块卖了蓝瘦,-99
449873,大易科技，百里奚，太极是什么关系？请领导查一,-99
3621420,我们减的比他快,-99
1807916,无论流通盘筹码,-99
2266405,亏人呢，1手1收诱多。,-99
3970225,继续看低，.……,-99
2053982,我们的销量获得了突破,-99
942356,填补了银行机构的空白和不足，,-99
1546529,光尼玛托单有啥用,-99
360930,永鼎简直垃圾！,-99
1561715,大家看开盘会上涨吗,-99
812199,去年圆通是龙头！,-99
4545101,淮盐出 天下咸,-99
2355397,钟,-99
927606,又拉尾盘,-99
3318524,站在45的高冈上的同志们，你们还活着吗？7个涨,-99
874379,筹码分散，股东户数大幅增加，户均持股减少，都,-99
2019422,盘子大，主力穷。但是控盘高。,-99
2610404,豫商准备绞杀中庚,-99
4784682,卖了，不亏钱，再也不买这垃圾了,-99
405320,有道是。,-99
322005,才知道，风雨天1在各个股吧都是做空狗。,-99
5062514,哪些可怜的散户被连续跌停在地板上，你们可问询,-99
3148552,今天的黄金股你们入手了没有,-99
5503821,现在还不卖？2:40危险,-99
1831361,在澳大利亚法律禁止农场使用化肥和农药；如果擅,-99
3891231,维稳指数.狂来60倍市盈率中国石油,-99
5080263,大跌到了,-99
5340308,交流.结构牛市 中小创哀鸿遍野 痛感[剪羊毛],-99
3938855,这将是一场终极对决,-99
4341082,历史总是惊人的相似！,-99
5326640,可以补仓了，狗庄没筹码砸了[大笑][大笑][大笑],-99
4025715,要修直通雄安的高速了，金隅港股又涨了，好兆头,-99
374317,别怕东还没。,-99
4813790,估计要涨了,-99
3583678,这苟日的必下杀看60日均线，这就是水平,-99
3164956,跌成狗,-99
4816755,我晒个亚泰持股情况，朋友们关心我就破例啊！,-99
3305611,随时都会跳水！！！别梦想会涨了s,-99
586960,垃圾股，不涨不跌,-99
3810795,”看对市场而且紧握头寸不动的人难得一见，我发,-99
1053989,做勾托的王8壳常换,-99
5175745,我举个例子，比如A公司占某公司99%的股份，我花,-99
1809550,散户能不能跟永新华韵成为一致行动人？,-99
4910736,相信聪明的上市公司不会做出这般愚蠢的选择,-99
4220836,姜超：利率市场化加,-99
2196412,第九届中国房地产科学发展论坛在成都举办 中国,-99
958354,实力还是很强的，现在已经开始上涨啦。,-99
906376,主力出货挺坚决啊[傲]p。,-99
1534264,主力超级滞涨福利票!大盘三千三!个股才二千八!,-99
5408669,几个大资金联合倒筹吗控盘！操纵股价，上车以为,-99
830773,老鼠仓明显的老鼠仓,-99
3725530,我是一个坚强的东吴证券钉子户，坚守！~哈哈！~,-99
2466903,南京熊猫(600775)融资融券信息(07-25)。,-99
1979975,跌停,-99
5551052,恭喜买进的朋友，陈丽后看，不走寻常路[胜利],-99
5348422,经济学家沙黾农先生在他的博客中写道：“元祖食,-99
174568,美联储年底加息预期上升 金价连续第四周下滑,-99
304139,天亮当托一时爽，下句是什么来着？[胜利][胜利],-99
4122899,"有色板块大涨,机构推",-99
5329283,4月份出了个雄安，现在出了个混改概念，走势会,-99
4617843,训狗师工作中:工作内,-99
5543335,*st海润A公司领导如?,-99
254009,今天黑周四如期而至，这才是开头，更黑的还在后,-99
4232195,603079,-99
817659,又一退市股[想一下][想一下],-99
567078,进一个套一个，休息吧,-99
5441696,大单出小单进岂有涨的道理。,-99
3658146,熊B股，大盘涨你横盘，大盘跌你就创新低，不赔,-99
4887771,有种？,-99
1557505,就不趴下[大笑][大笑][鼓掌][鼓掌][鼓掌][鼓掌],-99
1552280,就在刚才，就在刚才，发现并确认一个托了，那就,-99
1944663,硅铁开盘涨了百分之6，,-99
5204413,尾盘大卖单开始来了，这又不知道谁会上当被套了,-99
1036479,开上行，之后突然直线大,-99
491186,西藏天路下,-99
3224885,这是神马感觉，6、8、Q、2压死！炸弹！四个5！,-99
4998800,一带一路低价新股这是，,-99
1829597,你不和一只股票死怼是怼骑不住一只牛股的！懂不,-99
243251,垃圾狗,-99
4045483,不到12.85     不会抄的,-99
1364626,融资融券流出41亿居首,-99
407070,现在钢铁股流出2.90亿！,-99
3519037,这几日量缩的厉害。,-99
5082129,明天128手封涨停，有意的可以联系我,-99
3255612,范书记：郴电国际已经连续11年没送过一股了！公,-99
2820281,大盘这个点位，股价这个点位，砸自己还差不多，,-99
2184846,明天能破15不,-99
2056334,好票,-99
1188747,海信电器还是一样很厉害啊，股价涨的非常好。,-99
2501376,这个可以进[大笑][大笑][大笑][胜利],-99
618395,盘古任务完成领狗粮去了,-99
4547499,等大盘调整华铁调整下来再回来吧！,-99
4605662,破11倒计时，,-99
3212405,还有半个小时，就要起飞了，期待你的到来。,-99
952405,在正常市场水平下 ,-99
3419246,波罗又大涨我就不信了这死股没9元我不卖,-99
5483825,晨勃开始,-99
3649396,今天尾盘跌停，聪明的换入-中农梨花 ！！,-99
4365206,待了5分钟，感觉吧主和操盘手都是傻逼，鉴定完,-99
3818372,券商大集合产品将启动公募化改造 “非公非私”,-99
2872261,机构TMD又来拾便宜了，不卖,-99
5426855,2015,-99
3427094,两市共成交金额3970亿元,-99
2217262,关于400……系列,-99
2838926,炒股要计算一个公司营业额占全行业资金比是多少,-99
393253,我不着急抄底－大跌给我血的教训,-99
1687486,钢铁行业受益于供需博弈,-99
2316184,哈哈哈哈，高点走了，明天低开,-99
3663879,都有着各自原因,-99
806309,凌钢股份9月29日盘中涨幅达5%,-99
618968,今天出的应该是个逃命线了,-99
4719662,撤了，谢谢元成，41买的，套了三个月，56清掉了,-99
3073290,高增速，底市盈率,-99
525604,都何尝。,-99
3523997,千亿之后，空间更为广阔,-99
2012418,北大荒(600598)融资融券信息(09-11),-99
283954,2017年11月24日，操盘信息必读（周五版）,-99
2024875,开盘你又猜对了吧？[围观],-99
1945214,钢铁股的价值何在？分红吗，送股吗？,-99
1366125,轻松到家挂牌不轻松！二次反馈被股转质疑运营数,-99
3356199,九州通下跌原因,-99
54007,"优先股9.72元强转普通股,说明了一个问题,那就是",-99
1943289,钢材出口关税取消是假消息！,-99
2059760,买就是对的目标市值300亿。,-99
1705478,走人,-99
5075190,有没有买到跌停的,-99
2146678,不是没钱了吗？还买？,-99
4857723,就有一个亿的筹码,-99
5067866,业绩预告就没有一个,-99
4598596,环保部将针对“水十条”任务 开展一个月专项督,-99
4592355,迪贝电气牛市中%的技术指标正确，%的技术指标不,-99
2321159,徒弟票,-99
1745844,小心坐电梯,-99
5102269,"人人乐 什么情况连续2个涨停了,可怜家家悦从来",-99
5478030,公司有啥重,-99
3311055,雷鸣科化还有一次机会，就这一次!,-99
4157928,能不能不BB,-99
3754475,妈的逼，把老子放出来，老子宁愿亏20%,-99
2258653,下跌其实刚刚开始，,-99
2893874,现在连鸡鸭猫狗都知道大盘走势的意义了！,-99
625048,超绝！如何利用0086GP黑股票赚大钱!,-99
4904734,5371,-99
4632244,不要买不要买！！！,-99
2135090,这里的黎明静悄悄，周末停牌或突然宣布。,-99
5424620,对倒拉升出货太明显了,-99
403775,一个偶然的机会我看到了《圣经C马太福音》,-99
3300585,有多少朋友准备近期割肉,-99
1144127,无量，跟风反弹一点，下午继续闷杀的可能比较大,-99
4005072,忍不住，走了，你却涨了[失望],-99
3169460,假药没有完成会有今天,-99
5054151,封上就不好卖，不服明天再送一个,-99
