,content,mark
4181901,这个股只知道睡觉没准都不知道有涨停这一说[大,-99
1822970,山东黄金会涨吗？东方财富网26日讯，美东时间周,-99
3574049,涨涨一分。跌跌跌一元[失望]，却还有这么多人看,-99
5467676,干脆跌停算,-99
1751565,跳空缺口三天不回补，已经确认突破有效，短期看,-99
5278113,顶起,-99
4523243,2691+16晒号,-99
592134,河兄：银座股份大量4手多年圆狐底抢庄？,-99
3481956,财通证券今天创新高没有问题,-99
445329,弘业永欣荣获“江苏质量诚信企业”称号,-99
4534461,应该会涨停,-99
5419657,你这攻防返转]完]了，到底哪个是真的？少骗点,-99
5546217,坐等涨停！,-99
849370,沪股通创年内单日净流入,-99
3033754,有没有股灾重现的感觉？说实话.,-99
5452372,庄在给机会啊，直接封顶得了,-99
86416,目前为止，锅假堆手里表现最差的辣鸡股吧！,-99
3756468,60元有希望了，南铝也能跟着沾光了，哈哈,-99
3243532,8月26日才公布中报,-99
4249015,众多个股均被产业资本清仓式甩卖,-99
80704,某人特烦,-99
1960303,万年青，海螺，华新，三剑客水泥,-99
640253,买格力空调的赚几车空调了。买格力地产的亏损几,-99
3761970,提是媒体报道不真,-99
2338699,准备封板！！！[傲][傲][傲][傲][傲][傲],-99
3849901,跟风小弟，哎。,-99
4502389,万盛股份603010 价值低估的芯片股..12月13日万,-99
421006,很多人炒股赚钱后，舍不得卖，甚至有了感情,-99
141392,证金三季度再加仓保利，1亿多股,-99
4364636,死瘟今天全都涨你当瘟神。,-99
2691577,比特币交易就是中国一条庞大的洗钱和资金外流的,-99
89643,中了够请大伙一顿火锅吗,-99
2340232,目标13。,-99
23980,买进000700这个躺着也能赚钱的股票,-99
3134934,新疆众和2017年9月7日投资者调研活动,-99
2803234,感觉到头了，又要回13了,-99
1498811,如果你认可本博分析或对你有所帮助,-99
3730039,跌，缓跌！温水青蛙,-99
3107277,600881:亚泰集团关于亚泰集团长春建材有限公司,-99
5105437,庄家不是什么好鸟，山东人就这样,-99
4469084,我乐家居603326 （2017-06-28 星期三 10:42:19,-99
2411989,10月下旬到11月初 跨年布局白马电子股良机,-99
2789062,有色金属：量变期待质变,-99
536587,看来再骂下去招广大股民不高兴了，我闭嘴，请你,-99
2000033,量能不足,-99
4074933,次贷危机中迅速走出并,-99
5014553,公司澳洲停,-99
1683823,浅醉闲眠,-99
2581317,沙比们快接盘啊，这么低的价格庄家都亏了哦，沙,-99
4411500,哎，没上车,-99
3213312,地量[拜神],-99
5121776,已破重要均线,-99
1119155,越安静越好。319加油！,-99
4821241,六亿多的股本，一亿多的流通盘，想拉很容易，就,-99
944521,赚的有点爽,-99
1038233,上周开始建仓已入了100手。,-99
484824,无论你觉得自己多么的不幸，永远有人比你更加不,-99
2791211,天津磁卡(600800)融资融券信息(10-20),-99
1602680,600593:大连圣亚关于股东进行股票质押的公告。,-99
1553913,尾盘闷杀，赶紧卖出,-99
1769455,妈的，V字形到顶了,-99
5431910,生产离合器，现在都什么年代了，这就是夕阳产业,-99
3992890,留给下一代?,-99
1296288,远离这种僵尸股，1毛钱价格都做不出来,-99
2421421,这只股票近期不强  只能观望不可买m,-99
4577492,查看新回复,-99
3499337,短线出现机会[想一下],-99
1936831,今天守不住3150,-99
2395186,快点倒闭吧,-99
972103,hhh,-99
4328441,学习建科院，看看多好的走势，再翻倍！,-99
5219996,此股不行，还需观察一下！,-99
1395938,抚顺特钢百亿技改，打造航空航母特殊钢材！,-99
171403,九阴十字星，真是高手[赞],-99
425332,本周将突破关口，反弹行情延续了,-99
1913056,康恩贝(600572)融资融券信息(09-13),-99
2032247,储备政策许多还没有用,-99
2960339,呵呵哒 今天股期交割 狗怎么不叫了 你是叫一次,-99
2100904,货色？,-99
1103762,坚持锁仓，不看盘，,-99
2043441,看不懂哪位大神说说,-99
4845927,逢高卖出吧,-99
3115779,还有多少傻子要卖的 全部统吃,-99
3213242,抗跌！不错啊，今天那,-99
1182593,5.77年线本周是否能突破？,-99
2578495,账面浮盈约100多亿,-99
1666130,千股暴跌回,-99
3660135,为了迎接你，今天尾盘港口股都动了,-99
457685,坚守了这么久了，这只股真的看不到希望了吗?,-99
321874,玩泸天化的散户死翘翘，那是真的下跌趋势，周线,-99
5105904,风雨二逼，再次装逼。香飘飘今日更名臭烘烘。,-99
2878534,今天打开时被洗出来了！这架势，明天七个点以上,-99
3104550,2点半了,-99
2806859,必涨，昨天的被人洗了，哈哈。,-99
447079,10阳的性质,-99
2514302,白马股仍将继续走强,-99
5326828,对于这类公司的高送转,-99
2361131,低吸赢生，追高穷三代。同样的股低吸胜率要远远,-99
4852247,妈了个逼，谁还在跑？,-99
4209499,洗盘干净，收盘26.30元以上！,-99
1653357,驰宏锌锗(600497)融资融券信息(08-31),-99
3956455,下周一走着瞧,-99
391015,等到孩子出现问题之后,-99
417237,你也快成仙股了,-99
3487560,578，579，580，582，583卖的这个哪个杂种干的,-99
3287584,iPhone8即将上市 券商看好7只个股-中证通,-99
231694,快买！大量的买！要大涨,-99
1478637,"有几个sb在期待着一季报,呵呵,想复制彷汰,丢人",-99
4711565,厉害了我的哥。同花顺复盘无意中爆出这货是塔拉,-99
4439221,最迟周二反弹,-99
109971,中信要用力阿砸盘使劲,-99
2199169,股吧太热闹说明散户太多了！,-99
1795463,今天尾盘不拉，就别想着后面会再拉升了，一星期,-99
2020265,量萎缩的狠隐蔽,-99
3249809,编，继续编,-99
1594972,伤心,-99
332269,600098:广州发展董事、监事及高级管理人员所持,-99
2209540,市场的害人,-99
3143542,600890:中房股份重大事项继续停牌公告(2016/11/,-99
4981091,20年内必到,-99
972276,建立世界第一大湾区将随时公布。,-99
5377069,敢跌就敢大买，大买就有大盒的灵芝，此股无价，,-99
657804,作为社会保障体系的“活命钱”，养老金一旦入市,-99
2547118,大哥又飞起来，你还在地下发骚,-99
4607336,这个老鸭头要不透气闷死了，走啦,-99
3818910,这垃圾每次都倒数第一,-99
3383723,午评咨询快车,-99
2228823,这次重组不成功，股票将按照自然规律缓慢上升，,-99
2185526,投票方法，股票交易软件里有个“网络投票”，全,-99
4608309,走势挺好看的，尾盘还是有机会拉涨停的！,-99
2860584,.等，只能错失更多得机会！看着别人大把获利，c,-99
2328240,见识了，涨一分，吃奶的力都使上，跌一毛很带劲,-99
1537017,非公开发行获批       芯片研发中心,-99
4378319,603166:福达股份关于使用闲置募集资金购买理财,-99
627133,涨停无悬念,-99
3748923,优先股拿走利润，整体利润将趋于0增长的银行股,-99
3783148,赶紧停吧，，复牌上40,-99
417186,下一金融热点和风口是证券，证券中的龙头是西部,-99
5508979,垃圾就是这样，还早呢,-99
2917351,"方正和工行还没有完全退出,文广集团还有将近300",-99
4571997,真你艹你吗？,-99
5498335,狗庄你的棺材板要翻盖的还是滑盖的?[傲][傲][傲,-99
488472,这种股还有长期至少半年以上洗盘，因为庄故意压,-99
2498107,“安全许可证” 终结ST云维重组 深装总称将直接,-99
4885750,调整下来第一次涨了3% 没有30%涨幅休想拿筹码 ,-99
3245892,黑马股票是指价格可能脱离过去的价位而在短期内,-99
4987354,今天是买的和卖的一起哭,-99
793762,砸价增发，别说我没告诉你！,-99
3093603,就是今年保げ恢亟M，到摘帽r也不是@c市值,-99
2525347,行情不好，别患得患失，这个价位不是肯定能赚钱,-99
3531526,再怎么崩盘，人也要喝水吃饭,-99
2112310,复旦书记校长都换了，复华董事长也换了，但复华,-99
982838,但十九大行情远没结束,-99
954047,美联储连续加息，那么美元可能是最大赢家。,-99
1250855,振兴中国民族奶业，新农乳业看你了，振兴芯片公,-99
1564025,最低价若收盘，周一破七元大概率。恐向下破位寻,-99
3554163,5.18元清仓了，现在买不买？,-99
4729643,开始横盘，大概多久,-99
1080714,劣质化企业上市,-99
3696691,10万股，成本4.80。当时选他的理由是盘不十分大,-99
2497006,懒得理你了，集中精力做栖霞和天地源,-99
843410,没发现有股,-99
2976543,抢了点货，谢主力,-99
2856038,记者报社也应纳入监管,-99
617454,而在上市公司定向增发融资金额剧增的背后,-99
4534731,拖出去斩了,-99
1703408,房企降杠杆十字路口,-99
3715669,上船了,-99
5001030,中报一元以上！你怕啥？加仓呀,-99
5288916,正平还有散户吗   都割的差不多了  业绩不行  ,-99
1130393,乖乖的下来，否则有你好看，嘿嘿,-99
4942089,“粤港澳大湾区”最为受益的珠海市本地股,-99
1381150,河钢股份(000709)融资融券信息(07-12)。,-99
1270281,特斯拉爆跌？z。,-99
1330629,这股没主力[失望],-99
494204,改性塑料龙头，以后汽车会向轻盈化发展，用清洁,-99
5389591,何去何从?,-99
4776913,垃圾股一只，鉴定完毕！,-99
2212122,严重怀疑公司公布业绩的真实性,-99
3948261,这基本等同于注册制发行了,-99
5227134,牛,-99
2118793,谁是龙头，一目了然,-99
3869018,不要再打电话问要不要贷款,-99
1020156,把这支股背后的庄家拉出来，弄死他,-99
1172062,这就是吞象的结局,-99
1063956,你妈逼，跟天气模要合并了么，两送人一个走法,-99
1542403,哈哈，洪城水业今天泄露天机？！,-99
3065237,这里黎明静悄悄-好兆头,-99
3848159,机会一来就敢跑,-99
3210825,其实应该涨停位有不少筹码，估计涨停换手率就高,-99
4557764,危险，大家快溜,-99
5518528,三千多万 收入 3000流通盘！最少 对应15亿 流通,-99
311942,花荣8月18日买入易见股份15万股！,-99
5508362,继续跌，以后将有大把破发,-99
1735123,这里有没有庄托，没有证据就是造谣。但有些人一,-99
596812,故意打压不让涨。,-99
3567804,使资金对“涨价概念股”的认同度不断提升。。,-99
2229576,如果是换马云来重组情况就不一样了，起码10个涨,-99
4262929,拿了二毛，叫你们付出代价。,-99
192712,又让格力电器股票再一次直面利空的打击,-99
