,content,mark
1146851,立体Sb一出大垃圾应声而落，灾星一个，他这辈子,-99
1146976,天天跌，日日跌，开盘涨收盘跌；开盘跌，收盘更,-99
4701859,*昨天底位买进高抛今天再开盘卖出低吸高抛,-99
3626193,ST成城筹码低位密集，可以抄底了！。,-99
5323923,跳了,-99
4702139,实质性重组+小盘央企+超跌+低价+并购国际制造名,-99
625531,600182,-99
1233032,大盘不好，主力无心做多。等吧,-99
769655,600221:海航控股第八届监事会第六次会议决议公,-99
5229678,大家看一下,-99
3065329,满满的套路 这尼玛大数据又不搞了 嘉兴容忍可是,-99
3264372,快卖，要大跌了。,-99
3483773,在可能最低的时候把筹码卖了，这不是坑人吗？,-99
4868434,昨天不该割肉啊，血淋淋的[哭],-99
4270220,下午能红吗,-99
1702953,好消息：养老金入市！此股迎来低吸建仓良机,-99
1633874,湖南资深股民,-99
4527616,这种垃圾  10元也是高价了,-99
4417543,日狗了下午翻红才不得了,-99
4636135,不正常的市场除了跌还能怎样。假的,-99
523844,真要小心了，随时一根大阴棒出来,-99
4467046,要拉升了，最少38,-99
2344108,涨一天跌三天。,-99
845634,估计没庄了,-99
5179898,每天一射,-99
3807681,中国电建(601669)融资融券信息(09-08),-99
3146447,进入通航领域是秋林的重要一部分,-99
3459280,澳对华出口返升两年半高点 后劲如何,-99
532885,有商家打着你的耳光叫你买他的东西你会买吗？。,-99
2803548,疯了！三季报每股多少？四季报每股多少？没有海,-99
142532,各种假的拖单，主力就那么希望股价下跌？,-99
2818185,没有最低，只有更低,-99
2781423,该死了,-99
1574628,德知名基金会认为欧盟对外经济政策需向亚太倾斜,-99
4177515,等几天吧，新股跌.势凶猛,-99
2047119,建议换掉公司证券事务代表。,-99
2810349,最危险的时候 同时也是最安全的时候 朋友们 放,-99
3380940,再一方面,-99
4243476,今天跌停，明天涨停，老套路,-99
1344852,这是哪家出问题了。,-99
5430200,散了吧，明天低开低走。次新股不变的定律,-99
4287289,250  的  250  又来了 ？ 操盘手 恨不得飞起身,-99
2122526,招商基金认为市场反弹理由如下,-99
5296284,眨眼回到解放前。[大笑],-99
507530,芸说我第一次拥抱她时,-99
2537534,今天必涨5个点以上，立贴为证,-99
5361775,会不会拉涨停呢？,-99
4694213,证监会是不是在调查此股了？,-99
858191,赛博乐朱老总[献花]早上好[献花]祝你老人家今天,-99
271295,海不行,-99
261634,"老夫准备建仓了,希望再跌点",-99
3907104,正泰电器(601877)融资融券信息(10-25),-99
2753884,国家通过救市政策，股票市场已经企稳稳步提升。,-99
5407586,今天股价上30，本周股价上35.5元，随后大幅下降,-99
2268977,公告：天地源重要股东小花无麦增持公司股票，将,-99
5358658,[胜利],-99
4558068,放心，20日线一定到。千万别急着买！,-99
5058153,你妈个逼的把老子洗了[哭],-99
606091,此时不冲，更待何时,-99
3763830,进半仓,-99
5269740,那些唱多的,-99
2545715,装死了。,-99
1270233,知名游资炒股养家心法合集。,-99
4649165,不要幻想,-99
5278808,股性不强!,-99
2233266,土财，你水平不行啊！博元暂停上市后，根本无法,-99
66888,今天涨停，赶紧入手,-99
4737628,上面压的是什么鬼东西呢？真的吃不了了吗？一口,-99
156371,今天没走的下周会让你们大哭一场,-99
1463016,散户们，可以慢慢分批挂单买入了，参考价3.57元,-99
1520913,自由和监管 健康市场是,-99
1209670,6.5不是梦[大笑][大笑],-99
3595526,抄底拉[大笑][大笑][大笑][大笑][大笑][大笑][,-99
4636340,明天以涨停板宣告王者归来!,-99
3936291,估值低的是交通银行和中国银行，大幅度破净资产,-99
2600146,今被春风落之桃花,-99
5269957,非农，黄金下行关注1240附近，原油关注48.2附近,-99
1669554,孬种！,-99
1367237,机构就是给,-99
115610,不看的为好  看了就会没希望,-99
3117874,作为上市公司有责任有义务在公开合规的媒体，及,-99
181584,。反之，当某个公司股价,-99
1825667,深高速(600548)融资融券信息(09-14),-99
5239411,两点之前能摸一下涨停板,-99
4937093,下周一，11月6号，挂单49.52元，[胜利][胜利][,-99
5400626,登山露营防风防雨三季铝杆三人双层野营帐篷冷山,-99
1567070,这股没人买卖没有交易就桩这孙子在演戏一分钟交,-99
3408702,本人预测隆基本年度盈利应该大幅度增长,-99
5257371,欧呦厉害了不跌停了,-99
1813447,重组转型后，以纺织机械位置，房地产为辅的公司,-99
2909667,讯飞抢到手了,-99
5465917,不卖就套死你们！！,-99
190951,经大数据监测此股主力已全面控盘,-99
763453,股市行情异常，观望。,-99
3545514,15块高岗p,-99
450387,昨天收盘前冒胆满仓，今天上午做了点生意，下午,-99
673441,这股涨势未尽。,-99
3831734,是不是要降印花税了？,-99
3348297,600996这傻逼庄，今天随时可能会上拉，,-99
1870516,使得此类流通盘普遍较大的个股,-99
3666905,特再柯  16.323.6  21.4  3.0039.4,-99
3211170,现在卖的都是机构左手交右手，想骗我们筹码，我,-99
1521903,其动机其实并不单纯,-99
4440326,不知道聪明的管理者在哪里？,-99
1623428,宝能系持股市值583.2亿元,-99
30440,这量，明天又危险了。没有资金陪玩，节前资金紧,-99
5027317,公司有钱为什么银行投几个亿。卖掉银行股份做项,-99
412323,天舟一号货运飞船成功释放立方星,-99
4162437,谢谢主力，昨天23.98被t掉了，现在终于买进,-99
1918369,哈哈又发现一只好股票全聚德,-99
4526481,日盈电子：参考盐津铺子的走势,-99
4485914,"三超新材市盈率110倍 , 还涨到63元多 , 比市盈",-99
1354419,个人感觉,-99
417269,转你妈，也不看看收购的几个垃圾都是各个行业垫,-99
3959873,"有庄的股是个宝,无庄的股是棵草",-99
240605,定法必依，用１８日均量线与１８日均价线来看行,-99
5110521,来到此吧 看见那些毫无理据 上来就喷的人士 我,-99
5279297,弱势股 别买,-99
3497995,请问最新的股东户数是多少？。,-99
4849776,申万宏源东,-99
3569087,觉得上海人爱吃鸡试一试,-99
4777306,我抛了，中一签赢利2.5万不错了，落袋为安。,-99
2475873,大连热电沉默是金，是金子就一定会发光的，是时,-99
3688761,重返才你你,-99
4969342,老乡别走，下午拉升,-99
5373808,11月30日个股掘金,-99
1623080,人工智能产,-99
2583389,---东旭光电将要大跌的三大原因\t,-99
5038244,盖合了，,-99
818156,概念股机器人 双环传动 埃斯顿,-99
4882813,我就知道能涨停的，还是那句话，不赚钱你买什么,-99
574949,关键时也要勇于做滑头,-99
4229426,资本市场供给侧改革：拉升蓝筹股拉指数发新股！,-99
991934,最恶心的环保股，还五水共治呢！,-99
5084160,这广告打的好，这就高开？,-99
459690,而且这种调控在明年还会继续下去,-99
1119762,又特么在套人呢，好好一只股，被恶庄做残了,-99
4737189,涨停板有暗号。,-99
2956997,呵呵哒 百年孤独 你现在的语气已充分暴露你是底,-99
2395529,他奶奶的破11，来个飞流直下三千尺，说再见,-99
1349952,13不会等太久,-99
3648605,重组后的江南嘉捷，拿什么来还清两百多亿的银团,-99
4937598,大家注意了，有些托进我们的帖子里忽悠我们，化,-99
3532239,三角三角，真要倒闭了？,-99
5306664,熊科可给刮大家看不到一点希望[大笑][大笑][大,-99
4524943,别让我中这个，别让我中这个[拜神][拜神][拜神],-99
4088404,而一举成名的*ST宁通B通过卖房,-99
5098350,1：00以后起飞,-99
1260505,如今有谁堪摘,-99
105739,下午会怎么走，多空总有一次会说准,-99
1578641,这么没底线的公司怎么上市的,-99
3609716,再见了，把做梦的全套上,-99
2549751,大盘一天不如一天了[大笑]，明日震荡保3200应不,-99
2606185,不沟通,-99
1615835,连续3手卖单,-99
2722986,等我喝口水马上拉,-99
4506527,快买[摊手],-99
4723669,妈个逼洗出去了，我操,-99
2864246,今天赌场开业好急动好好开森啊!,-99
5239557,原尚，原尚，原本就不该上！,-99
4467185,任何时间卖出都是对的,-99
3107445,我长期坚定地拥护有关现金和股票红利支付的分类,-99
684979,集团强抢大唐198无形资产于无形。真操盘。真才,-99
2634780,公告什么意思，本来要启动了，又来这么个公告，,-99
3886588,柒00衣 股东权益蒸发 为何没高管担责？国有资产,-99
2077169,不过在这个冠冕堂皇的理由背后,-99
4730894,机器人和新能源！小盘绩优股！保守估计会到百元,-99
497690,后市只要能够继续得到国家队的认可与青睐，,-99
2593834,华大基因登陆A股// 基因测序与干细胞(7股),-99
542890,业绩不错，国家体总强大后盾，毕竞是一个独苗，,-99
5183509,次新股小盘2.6亿杭州银行发行价14.39业绩1.7元,-99
2029801,卷土重来形。。,-99
3501740,5.77以上挂那么多单的人，请问你是什么价位进来,-99
4660813,东珠景观11月23日盘中跌幅达5%,-99
3713059,成功就是在不断地克服困难,-99
3585099,日尼玛别涨继续跌,-99
690677,下周一字板，验证实力,-99
2683752,炒股，6万本金用五年炒到100万，有可能实现吗？,-99
1355773,4万手可以砸到3.6以下了，来吧,-99
843128,居然拐头向下砸了w,-99
1940562,兰太实业让月个逢日盘中?,-99
4543199,跌跌不休，是减持？主力不给力？还是其它…？,-99
2350975,手了？,-99
4896189,散户小心，没有量能的反弹都是诱多上套而已，主,-99
1285383,谁过套谁没商量,-99
2994878,开钻,-99
452858,使劲砸，在砸到5块，畜生公司！！！,-99
2302477,闹剧可以终止了！！！,-99
2976748,上海交通大学-爱丁堡大学低碳学院明年将迁至浦,-99
15283,掌趣科技中青宝浙报传媒的资金齐聚天音控制股00,-99
168518,念龙头股，石墨烯也是新能源汽车电池中的材料之,-99
4224969,吗妣的，甘草磷板块大涨，就你一个还是绿的，狗,-99
712736,赶紧低走，我要进点货[不屑][不屑][不屑][不屑],-99
3689378,小编求求你 就让我发咯写真吧 股票就要涨停了 ,-99
4090318,比较肉，盘子没人玩，参与人不多，但是盘子见底,-99
5411263,惨绝人寰哀莫大于心死,-99
5411339,3板[赞],-99
5400266,。。。政策不稳市场怎能有朝气,-99
2908907,对比市值100亿美金的趣店，香溢通透就缺一个强,-99
2064028,年线,-99
