,content,mark
2886822,本人开始进驻，上周试着建仓九万股！视情况逢低,-99
331817,ZZZZ向5G和军品核心技术深度布局，静待水下防御,-99
4224415,吉林化纤发展碳纤维项目，股价涨停,-99
4282683,一带一路是出去修路的，又不是开超市,-99
2458541,个看.呢逢元左右坚决买入?,-99
4426393,56元成交50%，现25元还打压，股市一定要反腐，,-99
2387413,加油,-99
4502852,药石科技开板60多，没一个星期今天最高99多，他,-99
5227614,开板了东给,-99
4848094,走了，，什么东西,-99
5144479,王石之后如果由郁亮接管7月30日晚间,-99
926990,涨停，，手上那多地，。牛叉,-99
4463537,下星期目标45元,-99
75320,600021:上海电力2017年第三次临时股东大会决议,-99
121813,今天你就给我好消息了,-99
1789905,逢呢高高让让能能,-99
148930,趋势向下，出来先，等跌到8块接回,-99
3748826,砸30,-99
2097375,股市骗子横行，常用不过六大套路,-99
5330301,非要做空下去吗？，这么小的盘子谁怕谁呀,-99
2191879,呵呵，这骗子公司还想拉涨停，去尼玛的蛋,-99
2515564,考大学已经考上了,-99
2737382,要涨早涨了，根本不会是这个样子，主力换成中单,-99
4808932,看这手法，下跌中续。,-99
2707859,不跌 ,-99
4083928,加仓吧,-99
2794153,利好！昨天晚上美国股市三大指数全线大涨！,-99
460137,底部放量涨停，嗯，最少看到10块,-99
4802533,明天回调34左右,-99
2179177,下车乘凉，不玩了。。,-99
1659465,科达洁能下周操作重点！主力动向更加明显！,-99
5278945,120的本，100元补仓，然后卖出，卧槽尼玛,-99
3416880,我只相信一点，机构没跑完也套在这,-99
2312241,我们从官方渠道得知，四川金顶变卖旗下纳米钙生,-99
4023310,大唐发电(601991)融资融券信息(08-10),-99
5173576,投机与投资[摊手],-99
2388931,安邦亏得不行，出手做下市值。,-99
2933491,明天界龙实业早盘高开高走，但是需要自己找高点,-99
865288,处级不能超24方，买那么多干嘛,-99
2236269,耐心持有,-99
2301882,尤其是业绩亏损或业绩大幅下滑公司的高送转n,-99
1640928,没有人气和没有量能的三无局面当中,-99
4251566,先达股份：昨天39.50元已经满仓，今天持股待涨,-99
479410,踏嘛，的，，开了，榜桥啊,-99
1445565,下午可能拉板，大家看着,-99
4491005,还有资金的，明早抓紧进。,-99
3286453,又倒数前二,-99
2619344,683711香飘飘我看行，点位低，,-99
3849602,真它妈日了狗了,-99
1976359,总有一个下贱恶心的东西，要么一天一手2手卖，,-99
4637623,[图片],-99
263990,潜伏“收网”套现23亿 炒作雄安最牛营业部出现,-99
3811577,这走势看来送转是没希望了，十派一的可能性大,-99
3632674,大飞机产业未来都将受益于这个产业的发展。。,-99
3836596,这个点快清仓，又你妈托单保指数,-99
5002398,股市是国民经济的晴雨表，股市现在这样低迷，你,-99
3727303,垃圾跌你马勒戈壁,-99
230901,只要财经评论一发表文章，该股票就要跌,-99
4122291,跌停！快！ 先买到100手,-99
984785,一句话草拟妈的主力，你不借机拉升怎么出的了货,-99
4634435,最佳插入点出现,-99
2874393,软蛋，天天如一天，绿[大笑],-99
5355208,大盘涨高了调整很正常。这孙子比大盘跑得比熊还,-99
4998204,25元买入1000股,-99
2000421,涨永远比其他铝涨的少，跌次次第一,-99
393115,"趋势!轻量化,汽车轻量化市场分析与投资机会  今",-99
3725907,上向下就不,-99
4755031,感恩中公高科,-99
4371979,科华控股:独立董事意见公告,-99
955945,A股上演四千点 淘金池才算有点水,-99
578869,宠辱不惊。心中安静如水。,-99
4538319,还没腰斩前别买入，当心套子,-99
1958903,国家队想出货了就拉，想吸货了就砸,-99
4020759,资产2300亿，市值600亿，为什么不涨,-99
936418,一万个猜你妈在奔跑,-99
2629566,这周能到9.68吗,-99
3884567,从濒临破产到资产4万亿――唐双宁与光大集团的,-99
949790,我的泰国之旅结束啦。人妖多好看啊。正式买入持,-99
4401349,”的意思就是房价不要,-99
957841,600275:*ST昌鱼出售资产公告,-99
3988414,苏垦是两市以来最哀一家公司希望股友们不要买这,-99
1118777,天天跌，日日跌，开盘涨收盘跌；开盘跌，收盘更,-99
2817201,航空运输373.8   205.0,-99
1784807,天士力投资5千万健亚生物已于12年5日签约成功,-99
1750147,反弹了，抄底成功,-99
1090016,荣华实业拟向新能源行业转型,-99
1208342,长线潜入，风吹雨打芭蕉树,-99
545139,大龙蛮讲义气的，原地等我。今天只接回11300股,-99
5149132,岱美股份(603730)动态分析：遮阳板龙头增添成长,-99
886880,把少亏当成赢想……,-99
3513852,”那样突如其来的、发生概率小的问题，,-99
2680806,调控力度,-99
3035001,揭露了亏手2的“石墨烯材料高科生产”鼓吹的假,-99
1881682,谈发展也就只能是空谈,-99
4275788,下阶段=蓝筹为王。,-99
4243749,别挣扎了，跌停妥妥的，没有资金助攻,-99
1214344,丰共赢。,-99
3997217,新低不断，跌到你没脾气为止,-99
801656,知道谁要入主夏利?你们绝对想不到。。,-99
4600508,超跌反弹正式启动,-99
5416845,中国央行公开市场今日净投放100亿元,-99
602225,前几天拉尾盘。今天放量下杀。原来要骗人接盘。,-99
893735,离开，很容易。伤害的，却是没离开的人。我们在,-99
635856,看来今天又是大宗交易了，银监会电话多少，要不,-99
1016058,他一点实力都没有！磨,-99
3148122,秋林进军航空 开拓新业务,-99
1165850,加多宝淫腚了变成输腚了，腚都露出来了。[不屑],-99
4097357,我不想赚这个钱了，只想这个月能复牌[哭][哭][,-99
2180149,整体表现也是弱势特征相当明显,-99
3850467,小金属其需求主要来源于新能源汽车动力电池，下,-99
1649663,[大便][大便][大便][大便][大便][大便][大便][,-99
4299090,看那些才注册没多久的马甲喊空，高手都笑了！,-99
2332600,无语了!,-99
3794988,不怪中国股市就只怪中国的一些股民贱!,-99
2202623,美国停止发新股,-99
2128696,600629:华建集团关于下属公司收到中标通知书的,-99
1764320,行业盈利大幅改善，资产负债表得到修复,-99
3940156,看电视了，让你一个人去发疯吧！哈哈哈，不要忘,-99
2355256,成立不满四年 众安保险,-99
2864983,这种烂股应直接退市，免得在股市祸害股民，赞成,-99
1712085,明天新天要护盘，涨回,-99
3142167,冰火两重天 3295或成短期新高点！,-99
272895,如果到现在还认为大蓝筹只是在护盘，你就真的该,-99
3840489,经过这一段底命的慢长的等待，际发逢低可慢慢开,-99
3241072,放量滞涨，晕了,-99
4593325,我去拉高出货么。,-99
514178,上方等解套的人太多，下方缺口要补，清仓了888,-99
12847,8月28日散户必须按我说的操作，从大盘看，上周,-99
2705516,绩优低价中盘二线蓝筹股机会增大 攻防兼备 有d,-99
951504,600272:开开实业监事会关于会计政策及会计估计,-99
3896981,个人觉得科传已到底部,-99
5536189,我觉得这家人的股票是黑心庄啊，吸金 要是跌到3,-99
4620044,次新股股全线飘红,-99
1660192,按时。,-99
3731234,会不会是前董事长韩俊良出狱了在清仓？,-99
48478,有人托盘，没换手量，庄家护盘与我们同在跑个球,-99
3752939,这个烂货怎么还不退市？退市我们好去索赔！,-99
3676711,难堪呀？,-99
3526350,逆市而上....进,-99
4878929,荣泰健康，就是靠忽悠起家，发展，上市的，产品,-99
3325184,躺在床上看电视不如在看电视时上床。。,-99
3223505,选一个方向，定一个时间，剩下的只管努力与坚持,-99
109653,中信证券，最近两个月的表现，与券商板块背道而,-99
2545212,这股深不见底啊,-99
1428754,6.8跑出来实在是太明智了，现在重新建仓，每跌,-99
3975992,再大的利好总是有些愚蠢的人卖出,-99
1252626,马上牛市上八千点,-99
2290652,进，加之企,-99
3764119,唱得一手好空啊，不服不行。阵地交给你了，继续,-99
1151869,不作为你买卖的依据,-99
5464359,我在10元等你,-99
3572092,跌破20日线了，没见那么垃圾的股，止损走人,-99
2508559,这个具有意义的时刻，可提前关,-99
1000328,至于那些上证50的白马股,-99
2432730,享誉世界的净空法师（俗名徐业鸿奉献世界,-99
4235479,不管空狗如何乱吠，大家坚决不卖股  开板了也不,-99
1833621,看走势、看股价、就知道公司是什么样、是什么德,-99
2640627,撤回资金，回家休息。,-99
2663018,600767:*ST运盛第八届董事会第四十次会议决议公,-99
1358487,没得救了，十天，有九天低开，搞毛毛了,-99
2873535,现象就会得到控制x,-99
1190978,77美元 ,-99
3267455,这垃圾股离退市不远了，呵呵，每天成交量都不到,-99
2589622,我已清仓，庄家可以拉了。,-99
4080059,昨天长两点，今天跌三点！,-99
5534802,冲,-99
3854406,救市资金全线撤离,-99
5497953,15分钟已经底背离了，可以适当买点啦！,-99
5443516,等创新低,-99
2068548,"上山爬坡缓慢走,烘云托月是小牛",-99
1273156,导致险资概念股受到冲击；接着又是中国保监会对,-99
938288,今天的量，都是韭菜追高买入的。,-99
3049136,毕竟是钱，下面还有两根均线是不敢破的,-99
2574861,4.95这一千手是来吃肉的？,-99
3647595,公司年报净利同比增长逾30,-99
2939307,下周开始上车,-99
1184316,操你妈逼的,-99
3568990,美女心慌，有大神指导没,-99
1240288,银行委外投资成为A股的杀手,-99
994363,投资只能相信自己。本金是自己的命。投资者是孤,-99
3758467,走了,-99
1663600,中化国际乃乃的啥情况啊。,-99
268620,那个叫于丹的丑货在网上嘴贱被我踩，告诉她电话,-99
3648566,利好 江南嘉捷 永远的爱你，也是因为你我才能在,-99
1160915,如果没有那个停牌，老子早都走了…宏达股份百死,-99
4637087,明日股市三大猜想及应对策略,-99
681689,大盘不好，今天卖掉了,-99
2556224,"辽宁成大高位跳空向上走,神仙招手却不留,天均线",-99
1642027,跑了割了,-99
1988728,1940年  2.90  2.21 2.50   2.44 4.084.001.94,-99
3101044,火箭军,-99
881003,今天不出！下周一大盘指数跌得更厉害！！！个股,-99
3093272,600877:*ST嘉陵2017年9月产销快报公告,-99
4893434,下跌板,-99
1073052,你想竹篮打水吗，请按庄托说的做：下跌割肉跑，,-99
5367146,不应该是这种走势,-99
4363497,多少砖家都说大盘会向下，本人认为、上证前期涨,-99
4262780,上午不封板 下午就下跌 收盘一般价格是44元多点,-99
1733343,涨停,-99
1955410,概念全部飘红长电你也试试,-99
