,content,mark
569133,凤凰财经杂志是奸细，故意打击我们脆弱d心灵,-99
1885269,好消息迪马股份和智慧农业分别有宋增资先期1.5,-99
1686080,看一下，就了解一下。,-99
2196317,买买买。,-99
4536719,坚决等到17抄底,-99
1957864,奇怪，17.8用了五千多手打上去五百手就可以打下,-99
4658103,一步三回头，需要拉着走丫！若无外力拉，迟早又,-99
4231284,荷南井盖仔已出光了！杭州庆春可以自主拉升了！,-99
4758327,杀人一千，自损八佰。除了恐惧还得准备抄底,-99
4261765,呼叫老战友汉上，呼叫呼叫,-99
355514,券商就是放高利贷的，真正的价值为负数,-99
424217,远水流春色，回风送落晖\t,-99
4406499,新股开板遭资金抢筹 机构建议关注金牌橱柜,-99
1711906,600495晋西车轴王者归来,-99
4570906,奶奶的，等下不会闪崩吧，小胆受不了,-99
2860309,*ST宏盛预计全年净利润同比扭亏为盈,-99
330036,财富论坛广州召开在即，难道对广州发展没利好吗,-99
645851,香江控股来头不小，有大鱼,-99
1506290,短期市场风险偏好修复，中期仍需谨慎,-99
4539227,股是好股，不过没有大资金入驻，需要时间吸筹，,-99
245080,要跌停[不说了]。,-99
4036563,海润光伏史上最牛逼庄家,-99
3852479,???,-99
4914671,明天开盘报18点44元,-99
4980122,垃圾,-99
4974902,要跌停吗,-99
4128654,短线猜不对，就说看趋势，趋势再猜不对就说看未,-99
1043519,该起来了,-99
2120982,非公开发行15脚步临近,-99
4497618,怎么还不跌停？怎么还不跌停？怎么还不跌停？怎,-99
1410720,搞什么东西！没涨起来，反而跌！,-99
5419683,破位股冲高是出来的好机会,-99
2489133,金牛非常容易做空，做空金牛。,-99
403111,今出现40手的买盘是机械单吗？,-99
4384824,超级物种假药不停,-99
3213299,[胜利],-99
3205267,买银行股都这逼样了，其他的还能买吗？,-99
2777963,卖了科大，进网新,-99
2034479,出货股。,-99
1597678,关于参加中国军民融合材料和装备配套展览会,-99
4876167,人口老龄化趋势大健康行业发展,-99
4131335,看月线，9月和10月必有一个月是大涨的，如9月小,-99
821633,在光阴底蕴下书写,-99
290892,偶开一贴 由于盈利转板与借壳转板条件难度差距,-99
4465000,这萎鸣一直没涨停基因，如明天可以“转基因&quo;,-99
5537602,收盘跌三点以上,-99
4978267,收20.43 明日爆跌,-99
4550643,鑫广绿环预计2017年净利润1.80亿元至1.90亿元 ,-99
4376840,整天活在意淫之中，这么点的蛋子儿盘，有什么拉,-99
2371954,停牌公司应按同期贷款利率双倍支付停牌期间股民,-99
2115876,可以进来了。明天我唱多！a,-99
3062878,我们不妨可适当逢低关注,-99
2446823,量缩小了股指走不高的，会掉下来的。,-99
1496621,此股与所有的热点消息不沾边，基本横盘几个月[,-99
1767555,15，36不可能是龙洲阻力位，即使震荡，也是为了,-99
3490410,4个月后,-99
4710317,是股票不？,-99
2484337,金融股护盘,-99
4024415,买错股票倒霉一年！不赚一毛钱,-99
3166201,感悟,-99
2270848,很有当年等高考分数的感觉,-99
5523420,股灾常态化.何时到您家,-99
4747633,公司是不想披露年报和一季度报吧，要是利润大度,-99
435508,今天下午，听说有大佬用约3.5亿做铁龙的世界，,-99
4480823,[微笑]低开,-99
2465124,这个公司说要注入江苏银行,-99
1035169,主力成本估,-99
4918101,大家都来报报有多少股？,-99
5187030,冲上去后才会考虑回跌。,-99
618686,加油！！涨停[鼓掌][鼓掌],-99
53660,华夏周中轨满仓待涨 大笑,-99
5365907,活该！恶意翻我贴的，必定破产,-99
1161769,K线组合诀 连续下跌T线见，马上进场抢反弹V型反,-99
1034730,市场的平衡中轴还是没有打破,-99
708671,17年度首3财,-99
2772475,今天不织布，改登山了吗？,-99
212482,逼样子，唉,-99
3043880,英雄都是从废墟里爬起来的,-99
3687043,这就是个死鼓，,-99
5547280,明天要小心了，看看周末庄托们都那么敬业，还在,-99
3039243,每天都是半死不活的，真TM熊!,-99
3564498,3110点平台下沿支撑较强,-99
1862740,大西洋此股在和的大唱反调,-99
5348853,这是锤头线吗？？,-99
4570103,技术革新主线：行业排名第一 智能卡行业龙头 刷,-99
5484097,耻骨自己承,-99
1185389,神奇的数字o,-99
2515696,质优白马商业股,-99
1351326,还是家里舒服――不就是静养吗,-99
2672407,真好玩，看篇文章沙特和美国签了4500亿美元，美,-99
263708,虎骨酒说了好几年了，怎么就没有动静呢？,-99
699156,生物股份可以买了没？来个人帮我看看,-99
5492521,药石科技特停，引发次新股下跌，而中农却逆势扫,-99
2664676,金融业以实体经济发展为目标,-99
3276550,说什么高送转利害?搞到现在跌成这个样，令我们,-99
5098795,天天大户做T,-99
1497631,》379.13元茅台3000股,-99
1270547,太搞笑了，跌停,-99
5002636,海利尔污染环境子公司被多次停产 频收质监税务,-99
150196,持股待涨……,-99
3997487,卖了，亏了5万，再也不入中国股市了，每天看心,-99
2037755,什么时候上市,-99
3730709,不要上当。,-99
3551921,提醒：没时间了！必须完成战略！胆大拿到36元,-99
4463791,不用看了，一地鸡毛[不说了],-99
5541613,全球组网开启产业黄金机遇期 一定不要错过这类,-99
5087956,到时间了，买入,-99
5120310,垃圾终究是垃圾，走势已经沦为将死之人的心电图,-99
600809,狗庄尽快打压，好让老子在9.5元吃货。,-99
4895755,603588:高能环境关于公开发行A股可转换公司债券,-99
523988,多重利好助涨石墨烯板块 近29亿元资金潜入26只,-99
335546,金去发动创业板指时，另一部分资金则继续,-99
1702407,新能源车双积分政策、《技术路线图》等长期发展,-99
2020755,跌到底了，开始反弹了,-99
2698989,要是真进了还不涨就说明真的要大跌了！,-99
2147872,阳线没有东,-99
2677679,本来是不选择你的 2选1选择了你这个垃圾,-99
2816073,大熊股大反转，散户逃光啦翻99999倍！,-99
190956,华润赛科药业  他达拉非 药品注册进度查询结果,-99
4846549,去产能政策影响报告期煤炭市场,-99
5202489,603797:联泰环保第三届董事会第三次会议决议公,-99
4078667,下周白银能,-99
2492483,个人都有过这样一段时光,-99
609170,雅戈尔外资进A股是首选的股票没有风险啊这么便,-99
1757799,600527究竟那天是真正的增发核准日,-99
4596509,根据我综合分析今天应该要突破17.9了 ！！！[献,-99
5312175,跑啊,-99
952981,鬼托！你家人，叫你，回家，上炕！,-99
2797428,华新出货，收绿，快跑，保利润,-99
262970,既然抓住了高送转的大毒瘤,-99
2609675,妈的，5.7拿了半年，? 会不会是竞价交易啊，,-99
2514960,指累计下跌约中小板综指下跌,-99
690997,大盘调整的时间可能提前一天结束，15号就能起来,-99
4219409,猜一下:今晚5家，不超过22亿。,-99
4114522,华鹏老总们向许家印学习啊,-99
2609602,今天脑昏又会扯点啥,-99
2641972,垃圾透顶,-99
3311116,捂住，别卖，就让那些酸吧,-99
2173480,比特币的加密算法一旦被,-99
2875809,津劝业：因举牌方拟取得公司控制权遭上交所问询,-99
5538266,至正 即将爆发,-99
2529389,今天还不错！。,-99
605049,巨石是否有重大事项不公布违规？,-99
1477209,*ST吉恩破产真相：一场精心布局的国企私有化？,-99
2750047,知情者坚决抛弃，面对大股东巧取豪夺，该股跌至,-99
840483,华业资本(600240)融资融券信息(07-28),-99
5060841,31.89的成本，还有谁！,-99
3682024,短线操作必须掌握这八种信号,-99
1765916,开盘看你的,-99
3796705,A-17.0,-99
592605,不知道结果如何，脑袋一热就一头扎进去了，9.88,-99
992019,哈哈哈大B浪荡被断财路的感觉一定很郁闷吧,-99
714595,有色研究新材料，你有金属铼吗？,-99
1812729,持有卓郎智能的朋友如果成本价在12块以下，我断,-99
2695526,周一抄底，搞熊猫,-99
4161741,我卖了，你可以拉了,-99
120207,今天，大盘沪指收了一根“老乡”不要走的K线。,-99
4552929,涨停必须的，呵呵我老汗推车了！,-99
3543874,草泥马你他妈是有色吗。,-99
5071352,至少要先站上并站稳60日线i,-99
2115870,指数该跌不跌知道为何反而很多不买了么,-99
164805,6月26日涨停预测 强烈关注5只股,-99
410296,卫星的钉子户都还在吗？,-99
2589848,底部放量卖了纸业加仓这股   说明有资金介入   ,-99
449690,你继续装,-99
3813739,对稀土的消费量属于增速发展,-99
1447016,崩了拉倒，不再害人了,-99
731444,绿地控股为什么这么熊？谁能说说！？本韭菜实在,-99
929577,下周策略抢先看,-99
595157,172好股票不管大盘怎么上涨我反正不上涨,-99
3061164,好在这个世界上，就没有一个人能知道，自己是不,-99
2927991,鲁西化工拉红了，我靠！一度狂泻-3.8%，吓得都,-99
4821655,主力啊，救救我吧，到底是唱多还是唱空啊？,-99
4775232,间及各种不同震荡手法的确认。,-99
1247250,高位缩量大家都懂得别幻想,-99
978092,高开，冲高回落，收小涨（阴阳线不祥）,-99
2461962,没买到后悔[不说了],-99
593356,半年报不理想,-99
1905576,好样的，你这个软蛋,-99
3734528,一毛钱玩一天，又泄了,-99
676379,五块零一分卖的，不再为大家找,-99
1697372,买江苏银行亏的钱，看来要散户买单了[想一下],-99
3405433,短期累积涨幅过大，回调到26元附近再回补,-99
2210729,000725恶意砸盘的家伙们 跌吧，跌吧，外资不断,-99
3227850,啥子运气哦，9月份满仓白银有色，第二天停牌，,-99
4390057,非银行金融机构不吸收公众存款,-99
4118958,来不及了,-99
4184199,今天要能翻红我吃一斤！！！！！,-99
778565,学习其他高手的宝贵经验,-99
3675091,这与中央的决策背道而驰背后更是,-99
5258520,尾 盘加仓不是一样挣钱，明天继续加仓就玩寿仙,-99
2835807,一路高涨,-99
1019580,直接跌停吧,-99
4797339,就1.18w手封单！下午3000五千的就开板了吧！,-99
321883,去搞点有研新材！明天回这里,-99
5218605,不开板肯定不卖，谁会和钞票过不去！ [牛][大笑,-99
1561421,以加快成功的步伐,-99
3258241,600969:郴电国际:2016年度募集资金存放与使用情,-99
2574166,大股东4.5减持，不到4元不碰，主力持续出货中,-99
1983579,第九届中国房地产科学发展论坛在成都举办 中国w,-99
