,content,mark
3330294,垃圾了，快跑吧,-99
2988704,谁能把股票拉涨停就是真股赢，否则就是股淫,-99
4978353,华帝股份:2017年7月3日投资者关系活动记录表,-99
5440278,这个辣鸡跌的比什么都快,-99
592658,大家走吧，操盘手尿频尿急尿不尽,-99
5506685,有色升死逼不升，次新升死B也不升，什么意思,-99
4340279,绩优蓝筹小盘高送转，股东都会今天应该会通过！,-99
1772234,卖卖卖！,-99
5381545,说这个利息高,-99
5029297,住建部发文坚决打击大型万科保利恒大等房地产商,-99
575757,名词解释：A股个股闪崩及种类 今日（20,-99
1714152,你就别装了，你跌定了今天。没有人会上当的。。,-99
2527047,"谁有准确的材料,该举报了",-99
3963936,错过国庆行情，现在一开盘就要看港股脸色。,-99
2427574,无量上涨，非奸即盗，千万不要追高,-99
4815638,砸停它,-99
2690577,600774汉商集团此股周一早盘看戏,-99
2454254,金瑞矿业9月25日盘中跌幅达5%,-99
2829873,这么多唱多的呢！。,-99
5263255,看这次空中加油能否成功,-99
3848420,跑啦，风头给煤炭抢去了[大笑],-99
550473,之后走势要看有没有大资金介入接盘。,-99
1489582,在此期间,-99
1642667,妈的,-99
2471829,要突破跳空缺口了,-99
4680206,终于绿了，死性不改！下来也好，继续买,-99
2430949,就剩个上证指数在忽悠,-99
866271,大盘分时显示放量上攻[牛][牛][牛],-99
1825,从技术分析，这二天涨到13.6，必摸，必摸，中午,-99
4178738,放量大跌？！！,-99
2884707,600230一季业绩超去年绩优股 二市就此一家 何况,-99
1344508,黄狗，今晚该出公告了,-99
4515035,不买的别后悔！！！！！,-99
98243,口惠而实不至,-99
2730362,近期应该会有涨幅,-99
1808370,建设兵团股被ST个遍,-99
4667964,明天百傲化学会像603966一样连续拉升,-99
4749941,小友关注,-99
2076478,洪汇新材、西部资源、,-99
4128111,垃圾东方老狗滚远点！！！,-99
1888478,000760斯太尔，今天重大消息，明确，真实，无误,-99
2510023,草，托着出，，，，，,-99
1935048,涨点就要走。,-99
3649561,开始补跌啦,-99
1668922,"600501晨光在出货了,还不跑就来不级了",-99
1708941,000725坚持住啊，兄弟们，进场的机会又要来了。,-99
5549418,看看今天丢失筹码的主力资金尾盘怎么表演,-99
3093378,今天反抽东,-99
2744212,另一方面化工业个股7月涨幅远远落后于有色等行,-99
3229148,这股真是有才！居然红,-99
3795190,你这二天怎么了,-99
1435459,A股进退 到底是 “线”说了算还是“手”说了算,-99
4717761,业绩有保障的高成长苹果概念股龙头：恒宝股份00,-99
2310240,钢材涨价对工程机械影响几何?,-99
1546711,狗庄在玩四位数字，自娱自欢，让你们看看玩垃圾,-99
99003,马上年底了，几家欢喜几家乐，系数分钱，分我1 ,-99
509024,喝空的继续！,-99
1469457,回家,-99
4073029,有跟着股 通资讯进来的吗？大声告诉我,-99
487252,虎头蛇尾的操盘手，大单大胆砸,-99
3984568,下跌中继，观望，耐心等8元，还有一块钱,-99
4953161,看空做多！中长线买入！！！,-99
3476747,以后这种三,-99
4642476,长亮就一烂货，割了,-99
2846717,狗杂碎,-99
3209972,明天等跌吧 拖太多 基本上大部分所有股票的股吧,-99
3283267,大家探讨：中影为何要放弃华臣70％股权收购？改,-99
2057391,有人看懂是什么意思吗,-99
5100562,为什么主力把盘砸下来却没有吸筹呢？,-99
3666143,这股怎么变成了铁龙的附属股啦！它拉也拉。,-99
381714,重组混改开始停盘不远了这周全仓买入。,-99
5472598,快涨吧东装,-99
1144785,万孚生物11月28日高台跳水,-99
867169,典型的是赶人下车，就看谁牛掰坚持到最后,-99
5413215,查，查。,-99
3395614,当下，先要以股指止跌，然后才有题材的反弹,-99
3951571,券商已先于大盘调整了,-99
1038468,细心点看。虽有卖单。但是却也有很多人看好买的,-99
4795883,可关注603299  井神股份,-99
3861394,指数马上摸3200。,-99
982940,估计明天再添一兵,-99
3312119,小单进大单出,-99
4276729,回来看看，稳，再一个稳，稳中有降。没有主力的,-99
4548196,华铁科技这个陷阱很大，你还不了解吗？,-99
4096228,下午跌停,-99
485924,前天放量滞涨，这两天肯定有个大跌,-99
1868052,走成这个死逼样也是服了，耗不起。,-99
1413386,国电南瑞可以继续补仓吗？能不能上涨啊,-99
4166673,603037目标价位150最后的上车机会,-99
4171829,卖出追进赛意信息,-99
1279678,i妈蛋，今天不出手，明天量更大，难道明天追涨,-99
3151251,威震霸天看多，其实他自己都不相信，偷偷减仓，,-99
5410019,拉泡屎去，看你屎都拉不出来,-99
5323976,快4个月了，你把劳资给磨去一层皮了,-99
1344030,跳水开始,-99
565187,这股里面有一堆机器人外加托，老子已经吃了两个,-99
4273314,看看杭州园林10转10，明天对次新股大刺激，次新,-99
2752429,谣言满天，有些数据需要我来纠正,-99
400447,跌啊！要敢于跌，要善于跌！哈哈哈哈,-99
3971567,外汇局：我国外债规模将,-99
5360398,20日线上穿60日线，还有一跌,-99
3302356,股票市场是上帝根据人性的,-99
5420117,打听了下，金徽酒的仓库都空了，四季度肯定没有,-99
4079415,关于创业板（7.17）,-99
5375069,同样生产铁皮石斛在三板上市的个股股价，大家参,-99
3818979,是谁引领A股走势不前？,-99
3934793,这一波8.50是个支撑，不破8.5耐心持有,-99
2687268,如果在此位置向上看，上方16元以上向下的缺口必,-99
1897359,色即是空，空即是色，利好即空，利空即好。,-99
4065210,终于尿了，狂躁过去，你爹,-99
5445771,中科，纵横，买不到，想买你能涨吗,-99
3078473,这样算法比较科学.净利润与上年同期相比将大幅,-99
3058686,让他砸，我们继续买，看你砸不咋的下去,-99
1126289,公告一出就跌成这鬼样子 辣鸡中的辣鸡,-99
3555608,59一线那个平台不应该破的。。,-99
3397167,文峰被罚，征集2015年12月20日前买入股民索赔,-99
2308378,航天晨光也3个点了，你就继续装吧,-99
4451334,今天又是大跌,-99
3744223,03.53%；五洲新春：两股东拟合计减持不超总股本,-99
3155677,我想对整天在贴吧里唱空吓唬人的说，你们的做法,-99
1441517,天润乳业发放代理商了,-99
3362355,唐山港你这个烂货老资不陪你们玩了,-99
4498013,弱鬼丢了魂,-99
2295412,从3月3号发布交易所关于高溢价收购东阳光药问询,-99
1968660,(企业年金、职业年金、基本养老金、社保等)及类,-99
4283533,你跑不过金逸呀,-99
1538757,杰瑞股份（002353）：10家机构抱团调研杰瑞股份,-99
75042,这两天下跌期间量大得不得了，一有反弹完全没有,-99
1296073,它只是将投资者短线套牢,-99
4144616,今天百货股大涨，你还在装B吗？,-99
3869733,看看我的中航飞机，同是中字头，表现不可同日而,-99
5473300,一个上市公司，拿着信批当儿戏，出尔反尔,-99
5348306,金域你好意思吗？市值连迪安与达安都比不上，好,-99
2690279,换手率太低，还得涨。,-99
2811611,我真的不怕唱空，跌了拿中签利润慢慢加仓，中一,-99
1949588,贵金属 难现深度回调,-99
4982400,吴总，我是在您涨停全仓买进去，希望您不要给我,-99
5548712,大家一定要管住手，不要买，让这些主力资金去多,-99
4920665,正常情况是可以拉涨停了但是现在还早现在拉会被,-99
3897046,奇迹！,-99
769861,1手哥买单护盘，笑死了,-99
4955270,6月26日上午，BOE（京东方）合肥第10.5代TFT-LC,-99
4453659,日月股份下午跳水跌停破新低！赶快减仓止损！公,-99
3753997,年报速递：鹿港文化2016年盈利1.79亿元，同比增,-99
4978073,能源局：前三季度全国光伏发电量同比增长70% 10,-99
917721,确实有诱多迹象，不过比较属于死股，振幅不大，,-99
5202269,对市场没有把握的时候还是自己说了算,-99
1142298,明天应该会直线拉涨停吧？,-99
2141512,我要站起来；不能只是动动嘴皮子而是要用行动来,-99
4978153,如明天4元以下，无理,-99
3516999,改革开放三十年，取得了什么成果呢？,-99
2875555,经济全年“前高后低”节奏预期正在应验,-99
2568325,炒股跌到心痛的那次经历,-99
3757143,铝也好，稀土磁材也好，下半月将进入库存拐点，,-99
3678428,散户大多都经不起这折磨，绕了一圈又回来了。胡,-99
4999929,真是怪事，被均线完全压住居然还有人叫好,-99
455981,远方借你妈的生你行吗?,-99
4863775,中国的股市就这操行，有志气大家以后都不要炒了,-99
2746553,拉升吧，健康元，阿弥陀佛。o,-99
549414,这么强的市场居然留一个向下的缺口，真是无语了,-99
1075543,一生最怕踏空一生最怕摸不到东北美女的手,-99
4821310,割肉就会拉,-99
2753099,最近流行连续小买盘报价+夹板暗出货,-99
2928036,上海机电(600835)融资融券信息(12-18),-99
3502306,均线在股价上，就是阻力；反之是支撑,-99
3362439,据经济参考报消息，港口产能过剩、恶性竞争问题,-99
1682543,庄家自己在造市！手段是通过砸盘，目前散户都累,-99
1002405,烟销日出不见,-99
4927324,来个涨停呀！,-99
4481828,2400手 挂单速度撤啥意思？,-99
1894334,只有股市走牛了才能更好地服务实体经济,-99
153839,金融投资报 编辑,-99
3252335,军工股任何时候都是跌的，已经跌了三年了，毫无,-99
1744470,希望今日不要留上影线,-99
1916340,迅速加仓补仓买进满上，尾盘涨停板一触即发了[,-99
879806,也让我更深刻的理解了大师著作,-99
4127823,风平浪静的海同样也,-99
1698286,今天高开往下打压为试盘并洗盘  明天早盘会顺势,-99
3672808,又是拉高出货a。,-99
4996680,庄家能不能给力点！其它股都起飞了，也该你了！,-99
881963,掩护,-99
220202,艹，心电图了，必有蹊跷,-99
4960342,垃圾,-99
1240277,因此筑底的行情将不会持续太久,-99
479986,标准的跌停板出货！,-99
4535971,[亏大了][亏大了][亏大了][亏大了]疯了。。。。,-99
3986625,西藏、黄,-99
4123969,利好出货,-99
4801630,新股发这么少，周一新股集体涨停,-99
2868664,隧道股份：公路及轨道交通隧道建设的王者,-99
2072901,都在等中报,-99
4075107,同意和支持继续暴跌,-99
2516493,千亿资金可扫货安全低估品种*一路一带丝路龙头6,-99
2689282,升值亿美元,-99
4143307,5月操作策略,-99
2737698,“十三五”能源消费“升气降煤” 油气改革方案l,-99
3029643,跟风上涨？r,-99
1847388,别中峒业募疲,-99
1420676,火速换龙蟒佰利，活该赔死一些傻子，没有一点眼,-99
2669546,再进一步,-99
