,content,mark
3385005,减仓回避，每天阴跌出货！[不屑][不屑][不屑],-99
2827905,大飞机行情,-99
5035777,无量上涨就是耍流氓，所以下跌了。,-99
233369,奇怪吧？不看好还不走，不走还唱空。3000多股吧,-99
2972870,看来上证指数站3200点，要指望下个星期五了。,-99
4626791,见底不反弹，反弹不是底，切记切记,-99
5248227,都没人发帖了，股东大会其实开不开都一样，他们,-99
3608870,这庄没本事，继续砸啊，,-99
2309058,跌出了慢牛市的新低,-99
469582,3418点附近再买，,-99
1272159,互联互通,-99
3431171,今天起，打响3000点保卫战！,-99
1023763,涨如蜗牛跌如脱兔,-99
3704261,醒醒吧，该护盘拉升指数了,-99
2604446,天海还差一个停牌？,-99
3271177,新股开板遭资金抢筹机构建议重点关注最新次新股,-99
2834644,跌不要守，全给庄,-99
1650624,驰宏11月22日质押2．56亿股，11月25日质押4亿股,-99
5536786,证监会：规范和拓展资金入市渠道 维护资本市场,-99
3033567,文化低庸必无口德 无有口德必遭报应 善人已去恶,-99
1554605,主力做空啊，好公司碰到傻主力，没有救了[哭],-99
2310357,黄海都一锅粥了 军工还不动动？,-99
5072360,通过收购兼并才能把企业做大做强,-99
4445079,游资不计成本割肉，此股有重大利空要出来，连续,-99
1255095,持股两年没赚钱 竟做贡献了 也没人感谢我,-99
3887792,主力流出624万了,-99
5363265,放生吃素家门庆,-99
4622029,场外资金那,-99
5180801,快跑吧，天量解禁,-99
308574,期待新研股份做军民融合典范！k,-99
4208583,请问股价被搞的这样公司有什么看法？,-99
1605636,中动随时介入，随时被打压。,-99
3691806,砸的越低  人家增发的价格就越低  这就是现实,-99
1381219,穷鬼公司不知、当保安有钱发工资吗,-99
5557555,19块3毛，卖了,-99
339666,就是把周黄免了，同方也没希望，因为他基本上已,-99
3129230,还得大跌,-99
414702,主力出货那，小散接,-99
5063238,能看到图嘛？,-99
1841344,主力想跑[鼓掌],-99
1761486,衰股癌庄,-99
5257760,我在中小创,-99
4327742,不跑者 随着创业板周一大阴棒下来...,-99
1617781,抄短线，三天不涨就走，规律,-99
3645207,热烈祝贺的大胜利召开,-99
1684978,只要你敢拉，我就敢做T,-99
3291597,不要买  还没跌到位,-99
1732094,600667百度并购,-99
1591128,公司目前开工率如何，有没有因为环保问题停产。,-99
2213029,国家队战略性出货中，出完了才能继续涨,-99
1270048,被洗出去了，不继续砸了，没搞头。。,-99
4500524,太恶毒了,-99
3040889,券商方正证券领涨……哈投看好你,-99
2871450,不要脸，还砸,-99
2405820,就开板了？,-99
1661515,买定离手，春节前来收红包。,-99
5248752,大笑三声东,-99
1872915,．在资金投入很少的情况下，我犯错误的机率就高,-99
3413466,黑庄太多，操，不好玩，看这几个二货看得恶心,-99
3111074,雄安概念的大股东这次要发财了，盈峰环境,-99
1997431,草泥马垃圾全部清仓，孙子股[不赞][不赞][不赞],-99
1945481,今天14.6买的明天再牛逼的庄也让你亏不了钱,-99
3930834,今天 明天能走出红三兵么？,-99
355990,该启航了,-99
1717246,昨天不是很多人说会涨吗,-99
805166,山东钢铁都涨上来了。。。。。。。。。。,-99
2483326,深股通净流入A股近5亿元,-99
3585844,下一个江南嘉捷就是达实智能。,-99
993385,威武霸气……,-99
4685295,另一方面则与空头手上的三大杀手锏相关,-99
1001010,一天涨两分有意思吗\t,-99
3030689,一是香港结算行在境内银行间外汇市场平盘头寸，,-99
4446890,反弹号角已经吹响？抄底资金又开始蠢蠢欲动,-99
4331541,我刚好三个涨停出了，回头一看已跌成狗，现入合,-99
2654219,那个吾祖师解套跑路了，终于不吵吵了,-99
4624701,3044点到本周，13周，大盘走了一个扩张型喇叭口,-99
5414144,"合力，翠微股份,背靠海淀国资委，三聚环保也是",-99
1723672,华商基金谈投资系列之x,-99
2810827,集团改革迫在眉睫 悦达投资又是良好的注资平台 ,-99
4137396,惊现揉搓线！！期待放量突破,-99
1081712,奇怪的想法，沧州大化公告说最晚18号复牌，散户,-99
3906292,咱先不说石墨烯电池成功与否，就说大盘就跟南方,-99
3565484,机构定力不行，忍不住开始拉升,-99
2412016,三安光电真的是要完了，好像要跌停的趋势。我昨,-99
2810130,退市股。,-99
4742291,是确定的是确定的,-99
1881208,无量拉升，下午必有大资金欲跑――就看接盘侠多,-99
699309,六月，布局趋势交易，开启价值投资！,-99
2366614,呵呵，又有抄底的了，表演结束，不要命的请继续,-99
4395869,美元加了4次利息了，怎么美元指数还没蹦呢？,-99
5481595,大量吸筹洗,-99
573884,充电桩,-99
1880251,中国人工智能大会召开在即，软控股份作为国家基,-99
449109,600129今天买碟才能赚钱。,-99
4642245,上海证券养了一头猪--潘贻立,-99
1422744,有本事跌停,-99
3474360,狂笑狂笑 瞎子狂笑 市值270亿，利润冲击百亿,-99
4053615,今天宏昌收了个启明星还是墓碑线？大家说一说，,-99
1363536,真垃圾 还得跌多少下来,-99
1150543,散户怎么搞的过庄家，除非t0,-99
2060296,虽然谎言能给人暂时的美感,-99
4154750,34.31入坑了……我来接盘……,-99
4182496,感谢主力，今天买入1500股，再跌再买[胜利][赚,-99
3294099,成交金额分别为36.59亿元人民币、18.16亿元人民,-99
5515558,CNM,-99
3709483,这只股到底是怎么？公司难道是造假上市,-99
350205,主力均线拉上去了你还砸个毛[大笑][大笑][大笑],-99
2083822,灾星A坑爹A什么时候,-99
2809454,王者荣耀捅娄子爱着人家鹏博士什么事了！！！！,-99
4492377,这个股票，开盘两分钟交易，全世界交易加起来还,-99
5413392,跌停算你牛,-99
2690058,买跌了，希望明天有个高收益。,-99
3089851,这庄就是有点滑头。,-99
2996342,合同多少多少亿，他妈的把我们股民坑惨了。,-99
3893970,跟踪很久，等待14.99开始的周线终结,-99
90205,今年规模最大的新股延后申购了，它会以什么价格,-99
2566675,油延续空头,-99
925537,上个月就说这个股会退市，没人信，接下去会暴跌,-99
299792,8.79元/股买入同济堂10万股，坐等大牛市爆发涨,-99
3055561,而象格力电器这样优质的公司,-99
4364130,垃圾必下20.割肉走人。拭目以待,-99
35504,狗杂种,-99
4164148,加油加油！带我飞……,-99
5143941,散户出来聚会了，顶起来,-99
4427780,又是一个空壳公司，上市后来圈钱的，股价大跌成,-99
462400,股指触20日线一带便有逢低资金吸纳,-99
1646026,什么时候增发？,-99
3972140,吊打融券狗[拜神][拜神][拜神],-99
4610657,即将爆发大反弹的成长股：600613神奇制药 60045,-99
3641340,这个位置卖的都不知道在想什么x,-99
5513729,环保这么严，能活就该涨。,-99
1204713,大盘强反弹 赚了指数不赚钱 在前。,-99
2143480,大傻叉就知道收于16.6，前几天说16.6是底被打脸,-99
2056191,还有人当接盘的,-99
4227328,周一开盘跌停,-99
5217547,盘面不好，主力都不敢拉,-99
2204625,明天开始涨停，让你们见识下什么叫大蛇吖屎[不,-99
536835,永泰还有这么多解禁股      要死了明天要有跌了,-99
3550595,高位没有跑？半个月才能上来！当年的媳妇熬成婆,-99
1338663,股票投资要讲政治,-99
5500657,石墨烯军工板块两市领涨 沪指短期或将迎来调整,-99
4798323,[献花][献花][献花][献花][献花][献花],-99
4603889,又是25票银行中倒数第一。吴江银行比粪坑还臭。,-99
4666749,咱就等着再次暴跌补仓了，现在这个价位绝对不会,-99
3942046,类借壳”触碰监管底线屡被否,-99
4515914,早说了在24.8的时候快跑，当初不听的同志们就不,-99
399227,想融资快干上7元,-99
874917,晕，怎么回事？,-99
12157,大权重板块集体异动 沪指强势收复点,-99
917655,真的好笑了，跌的时候就骂证监会，骂爹骂娘，没,-99
1960893,垃圾股 垃圾白马 垃圾死马 清一半 买启明星,-99
1242751,出处中信建投;预计2017年每股收益为1.47,-99
419283,关了吧！。,-99
2146338,[牛],-99
1100520,请教各路高手,-99
824772,让我早点解套吧上帝！跪谢！！！,-99
5420124,金徽酒市盈率28，白酒33,-99
3014865,夯底结束后，飞机跑道就硬实了，然后铺水泥，待,-99
3164037,张江股市大毒瘤，不为人知的丑陋,-99
4456670,高位换手 后期有好戏,-99
57476,中场消息。,-99
82073,明天看看2.32元压力位能否突破,-99
5504215,今天涨停别问为什么开盘就追买哦！,-99
981112,退市退市退市退市退市垃圾垃圾垃圾垃圾,-99
1656497,基建投资方面，50号文、87号文对地方融资担保以,-99
1436909,明天2字板有没有[滴汗],-99
2606080,哈慈股份:变更注册地址和办公场所的公告,-99
1367932,狗逼 果然涨一天跌五天,-99
626202,大股东在作监管在看，监管已经没耐心了，大股东,-99
853139,能级跃迁,-99
5204954,8月10日以来，第3个缺口了，呵呵……嘿嘿……唏,-99
5245174,德阳短线哥，我再跟你买一次，今天检查完，15.4,-99
1827549,600548:深高速2016年度业绩说明会会议纪要,-99
3652261,对证监会的询问会停牌自查吗,-99
3424322,天天低开6个点开盘，恐慌盘就出了,-99
631551,自9月21日以来，2017中国上市公司口碑榜进入第,-99
2149744,此时短线操作需根据目标个股情况,-99
5330115,妈的 下午钱到时把上面那个435搞了,-99
636055,直接跌停板好过，压什么盘呢？,-99
785921,准备.........！开始！冲！进、进、进！嘿嘿嘿,-99
3220434,603979:金诚信关于拟签订特别重大合同的公告 点,-99
4678007,尾盘如封涨停，非奸即盗，说明做多底气不足，追,-99
1869406,威震霸天看多，其实他自己都不相信，偷偷减仓，,-99
1183376,为什么这样也能停盘！是好事吗？求高手解读,-99
2165419,强烈推荐'第二万科“600823,-99
233263,再次戳穿喜庆吹猪露天煤业赚10%骗人的鬼话截图,-99
5325120,体上制备石墨烯使用,-99
4143045,快跑,-99
1701366,新股开板遭资金抢筹机构建议重点关注最新次新股,-99
2810144,特种环氧树脂等产品的生产研发,-99
5429910,"机构故意砸盘.不是吸筹,是将此股搞废.让中散亏.",-99
2076014,五分钟五个点,-99
2430409,速趋缓以及基数较高等,-99
5304995,步长就是不涨吗,-99
3425193,抛了闻泰，接了你，手贱,-99
5210763,不跟寒锐了？不跟了！,-99
3348305,[赞][赞][赞][赞]A股流弊,-99
905923,凯乐，一飞冲天，憋着好久了！,-99
2279567,追进去的又套死了,-99
4360355,不要担心定增，看看中泰化学定增10涨到19,-99
