,content,mark
5068911,我靠 太给力了 我们的大A股居然暴涨0.07％[赞][,-99
2441787,又他妈架好炮台了艹,-99
3674185,今天百隆资金大面积出逃！,-99
2319408,天天都是趺，见鬼了,-99
3850361,今天汽车股又涨，你跌，你应该属于上证五十，因,-99
1182495,因此筑底的行情将不会持续太久,-99
469327,恭喜江南嘉捷的散户朋友们！[赞]国企改革对我们,-99
830116,大盘没问题。正式抄底开始！,-99
1807085,多家上市公司遭清仓式减,-99
2515971,带动上证50指数再创新高,-99
1264503,开启天天涨模式，哈哈,-99
3987629,"自买进苏垦就没了好日子,先是断崖式下跌后又是",-99
1196565,一切的一切，都没有确定！,-99
2042050,机构接了那么多，不可能让绿地继续下跌的！,-99
1687629,工信部：深推进新型工业化产业示范基地建设,-99
4069735,今天起高开高走,-99
4395914,传统机组进行超低排放的改造需求较大，德创市场,-99
234550,梅林中报的分红什么时候发放啊？咋没动静？,-99
751228,macd显示仍处于上升通道，继续买入持有,-99
1771951,大家说说能有几个板,-99
3972761,牛逼 玩不起,-99
1206671,8月10日恒力石化美金PTA现货主港自提价格持平 2,-99
1703984,开始有波动了，好事！短线抄起来！,-99
3539912,我之所以非常自信，是因为自信是免费的。,-99
1052729,维维过七元应该不远了,-99
3316928,盘江股份600395大家继续持有，最近会冲上10元大,-99
569324,大家看，港股，北京汽车！,-99
3316563,600986:科达股份关于为子公司提供担保的公告,-99
2193832,超越人工智能 上海的数据港 高科技孵化基地 5,-99
1346857,一天就是两三分的玩，一直等你到五日线，看你这,-99
2143310,今天怎么不跌到15.5元，等待买进,-99
3579904,大家对嘉善的理解可能存在误区，,-99
5104245,浅谈短线技巧及风险控制,-99
2180542,在能源股大涨背景下，做为东海能源股龙头 申能,-99
1930434,散户太多，洗洗才能拉。没耐心的走，看好的加，,-99
4590319,昨天盈利加补仓后实际浮亏3个点！看你底牌能砸,-99
4182179,603041:美思德关于全资子公司增资完成工商变更,-99
4447243,中国股市是全球投资最恶劣的地方,-99
4318838,注1. 译者注： 原文如此,-99
2952512,吃瓜群众,-99
66091,候就直接回,-99
1789805,开始有托了 不要理会?,-99
4296464,全部撤走 了 没亏没赚  破股  你们玩,-99
1128742,筹码锁定良好继续持有,-99
1229495,这次停牌会成功，因为也就合并新三板的子公司的,-99
4179115,明显托单出货,-99
2370494,事实证明，庄已不举！,-99
3040719,打了个瞌睡，这个傻逼又这样了。下了这么多天雨,-99
4985335,3000万的小盘，需要这么震仓吗？,-99
421125,青山绿盘就是金山银山,-99
1745415,射了吗。,-99
418973,牵牛者呢？出来再发发技术贴啊？,-99
4176227,对此，分析人士指出,-99
2452522,一一一6.66买的，现在怎么操作？,-99
3670196,浪莎最高85元喜看猪庄在底部箱体对倒开挖钻石坑,-99
252822,澄星股份(600078)融资融券信息(11-03),-99
886869,石榴裙下死，做鬼也风流,-99
2052843,那个工信部的新闻，高速公路，废品处理，充电桩,-99
4187835,郭佳队经常“教育”散民要价值投资，自己却干着,-99
2806024,鹏博士收购加拿大光纤网络运营公司与海底光缆公,-99
4000833,毛姐提示要停牌了！啦啦啦啦！,-99
599766,达新进十大股东名单；京新药业：间接持股财通证,-99
3636671,突破了，我卖早了丫,-99
1778846,见底峰高,-99
3342134,被360巨资重组的江南嘉捷明天复牌，重组概念风,-99
2956902,这次进了，不再出了，一直t.看好上海本地股,-99
305014,无论业绩多好，它的猪力们还要吃屎！没有吃够就,-99
5097243,我则可以列出加速IPO会直接导致股市下跌的路线,-99
4271737,洪涛股份(002325)实际控制人增持彰显信心,-99
2293180,东阳光药获母公司拟转让50.04%的股份予A股上市,-99
2897649,不投反对票的恶果，呵呵！。,-99
3149107,大晟文化庄家你妈逼的真是个垃圾货！,-99
3397508,终于破4了,-99
3063960,要补缺口了快跑。,-99
186506,去你嘛逼,-99
1796025,有人说可以到3元，那为什么不融券呢，可以有60%,-99
382522,垃圾又一早忽悠。,-99
3790417,长城wey混动版P8今日广州车展正式发布，年前上,-99
186733,*ST烯碳:关于召开2017年第三次临时股东大会的通,-99
3619149,00846)融资,-99
4197209,赶紧跑,-99
338442,资本市场最聪明资金用脚给清控和同方管理层投反,-99
3181537,目前是在趋势节点上最后的决战,-99
1483417,操他妈拉一下就拉稀,-99
2698571,涨停板预测：智慧物流概念迎发展良机,-99
3151141,今晚IPO能不能来个12家！,-99
5330479,昨天收最高点，今天收最低点。怎的了\t,-99
328487,IPO加速与股市无关的观点是正确的话,-99
5263637,恩   洗的很干净,-99
2305146,明天大盘再来根阳线，S庄会迫不急待，不然筹码,-99
367539,买了美尔雅的进来看那堪呐那,-99
2967263,看花又是明年,-99
4837997,双底形态特征，鸡屎行情开始,-99
2319863,东方时尚,-99
4885816,恶庄有603585股股民咒你没好报,-99
5436559,一只怪胎。,-99
687252,st大唐，5块见,-99
2225940,不看好就滚远点，去找更好的股票买进。何必要在,-99
2640712,熟悉之后,-99
1986233,周三走势预测,-99
1898616,甚至有些气馁。窗外也是阴雨绵绵，,-99
5179637,快跑，可能要跌停了,-99
159635,券商出研报就是来坑爹的，啥时候涨过，呵呵,-99
3942944,吧里的同志们。我们要明年展望13。守住了大牛股,-99
151307,追涨停板的操作手法有哪些？。,-99
750880,机械下单88,-99
350505,托儿们 不要这么明显,-99
27923,今天T出去的，明天会吃面么,-99
3129809,外号：伊利牛奶惊艳2017“秋季烘焙展” ！,-99
3138857,天汽模后期怎么走？\t,-99
1241440,面对公司管理层的不思进取，我们只能用脚投票！,-99
5043832,牛皮市来了，一二三，拔河开始，空头过来了，多,-99
2893786,临近尾盘半小时，保险股领衔上证50发力q,-99
2190186,中源协和5年前布的局和投资的项目，开始发力、,-99
4674461,融断吧，我再补一点。,-99
2846308,"持强势,但这里从板块角度来讲后期还是要有一次",-99
3760522,601601:中国太保2017年半年度报告,-99
4294346,东方红,-99
4175566,一个月内是没戏了,-99
4714379,二线基因股，要看华大脸色，华大被查下周一恐怕,-99
4791035,天不是除权吗，为,-99
3073404,这次看运气好点不，换股中距,-99
3414092,中节能河北风电有10万千瓦洗马林风电和7万千瓦,-99
2852012,别装了[大笑][大笑][大笑][大笑],-99
832544,联储连续加息，那么美,-99
1423173,唐山，重度污染,-99
4046591,加仓601003应对打压，2017年年报惊喜到主力很害,-99
1248537,太他妈稳了，我服了,-99
276421,（毛估估）给予因为_它吗三元两次精点评级,-99
616987,阻力。散户投资,-99
5027944,104元20000股能回本吗？不是说好11个涨停[哭],-99
4378808,福达股份上市的目的就是拉高后减持！股价一路跌,-99
573122,元业绩,-99
4921808,你妈逼的天天来这一套,-99
5249492,所以上攻受阻后需要修复,-99
2821422,可以建仓了吗？,-99
1273735,还有不怕死的小散往里进麽，今天明显拉高出货的,-99
1617747,怎么回事，大盘大跌它也不跌[为什么]大盘长它也,-99
4295778,不如港翔啊,-99
1887772,现在市场都是被股东搞坏的，到时其他公司什么都,-99
5178315,永安行押注电动汽车 蚂蚁金服投不投？,-99
4979378,现在卖出的散户吃翔大的，大家快买进操作,-99
1323464,什么情况？[滴汗],-99
1099440,杀鸡吓猴,-99
2336091,死股一只,-99
325804,这个股票每天下午2点半看看就可以了……,-99
2524586,追滴又套了,-99
1300291,另一条路叫道路,-99
5530628,成交金额分别为36.59亿元人民币、18.16亿元人民,-99
4644887,看盲流一般水军攻击脑壳刷屏玩[不屑],-99
1603262,持有即可，两年算什么。,-99
576959,四氧化三钴为36万元/吨，年内累计上涨89.47%s,-99
517538,我要自挖双目以惩戒我买航天机电！,-99
398755,老子重仓啊,-99
1019349,跌吧！割了你反而轻松了！,-99
4850056,烂公司也只能生产屎袜，有本事你每天跌。,-99
3112175,整体看广泽基本面，这种盘孑不大，业绩改善，才,-99
4074901,久盘必跌，有跳水的可能,-99
5440810,到底分了吗怎么没见XD,-99
4006154,是因为这家公司是一家经常性更名的公司而在当时,-99
4169230,中国债券通有限公司网站北向通交易日历显示7月3,-99
3576370,果我说元成会跌至22元，你无论如何不能接受，但,-99
1472935,氵 明天崩盘了！ 新年快乐啊， 毛姐提示::跌停,-99
3877037,下来拉准备进,-99
834115,云南城投(600239)融资融券信息(12-19),-99
3820938,五连涨迎接18加一,-99
3273177,我看高新五丰到65元，就这么牛逼，温氏第二！,-99
1963795,华凯创意，调整结束，重拾升势,-99
3306351,7.20直播个股牛遍地开花 指数连涨不具持续性,-99
1595143,15.78前低，看情况最近是会守不住。,-99
1823319,有系统重要性的非银行金融机构。,-99
4150797,涨停了涨停了，哈哈,-99
3456071,中国神华(601088)融资融券信息(10-09),-99
2604032,不急不躁，认准目标，平静对待每一次涨跌,-99
441138,"几百万的业绩,20元一股。",-99
3904742,如果是大型的购买资产，用时只需一个月？是效率,-99
4371579,科华控股:北京市金杜律师事务所关于公司申请股,-99
5497099,主力哥今天如果把macd绿柱弄短了，收盘站上5日,-99
804695,使劲跌，有本事跌停,-99
3636520,请教：现金选择权 可以选择卖一半吗？谢谢答复,-99
5273039,万马科技第二,-99
1891332,看样子是要被停牌服节奏？？,-99
5416259,周三实战不能错过的个股在这里,-99
2299699,看盘面是长电来了吗？,-99
438215,下周初可以,-99
1305228,600375:华菱星马关于召开2017年第二次临时股东,-99
776826,223今天癫痫了,-99
3388629,憧憬着美好生活的未来,-99
4493595,又继续忽悠，继续停牌,-99
4808562,那么投资者能不能自己,-99
3641935,4万手可以砸到3.6以下了，来吧,-99
2736003,我们看好市场短期反弹行情,-99
4157446,20%多的净利?谁信呀？,-99
1572986,奇虎股份的证券代码那个比较好呢？,-99
3165784,保监会告诫人寿不能借钱给览海和海航集团,-99
4105543,最近公司股票跌幅巨大，希望公司高管们给投资者,-99
4458933,破晰一些人用等拉客骗人做股票的手段，请看！,-99
3615562,竟然破发了,-99
2537125,已破位，看能不能拉回来！弱爆了,-99
2128063,好不容易借个壳上市，一直阴跌，华建管理层真t ,-99
