,content,mark
4472876,我的女朋友漂亮吗？5月16日晚间消息，20年前的,-99
3043833,哈哈 庄家搞死了 好样的  比耐心了 [鼓掌],-99
4800875,京东方A000725 该股业,-99
2599324,看看我乐家居，尼玛还是亏损股，昨天拉升14个点,-99
1290924,好听点叫护盘，不好听叫勾引，不为小利所动。v,-99
2408577,厉害的白酒,-99
40016,今天的回踩,-99
4384095,大反攻开始！,-99
488667,怎么还有沙比在卖?,-99
3445987,买点还早，大把好票,-99
53438,图文解析，震荡行情中的买卖战法,-99
5205474,今天临时股东大会召开的怎么样。,-99
3840713,操，天天跌，要破产的感觉，,-99
3921682,好久以前就预测过。这是一只两元股。哪里来回到,-99
4583597,卧槽！两个板以后才24块多，不相信资金相不中！,-99
4671967,我的配号2209+18，是不是中了，可交易软件没显,-99
1179239,白马股与成长股间的分化已经是近期的主基调,-99
56762,拉高出货行情，不要追高，兑现利润,-99
3120764,恭喜恭喜持有梅子的有缘人！～梅子下周给持有着,-99
18604,割鸡鸡喽,-99
339003,[大笑],-99
4535300,挺好的不管主力散户机构一起套住，大家一起亏钱,-99
4181697,603041,-99
3854265,尾盘偷袭！无耻行为,-99
3191568,高开高走东,-99
464116,重庆啤酒是最符合主升浪大黑马条件的个股!,-99
1655715,今天又有机会减仓二,-99
4828954,一般我说会涨它就跌，都是反着来的。那我要说明,-99
4838334,总有一个三百多手的买单，立马撤单,-99
28207,公司近五年业绩基本稳定信雅达(600571)传统业务,-99
570472,改叫北汽福田智慧汽车股份有限公司,-99
3307109,良心荐股啊！,-99
5336125,别装了，就知道你在洗盘，暴跌以后新庄介入，底,-99
1729852,600969郴电国际价值严重低估=净资产12.47+公积,-99
1999531,龟孙子庄又要拉稀了！,-99
2181991,这票有猫腻，，当心拔葱！,-99
3607373,我们的实力大家验证了！月线即将三浪暴力拉升！,-99
4176216,调整后首套房贷利率较,-99
3554359,你妈逼，昨天补了！,-99
1763567,垃圾中铁！,-99
266790,大盘下跌收盘,-99
3085741,开盘你又猜对了吧？[围观]。,-99
1479772,大盘涨一千点，我买到的股票亏%40。,-99
1981726,我觉得好像越来越严重了,-99
353508,他很稳健，上升中,-99
316185,1. Burlington R.R未分配收益的,-99
1457321,破产重整是好事，可惜有点晚,-99
371439,隆平创出15年来的新高，真龙头,-99
908122,虽然看好后市，却不得不经常做高抛低吸！,-99
1783033,鸡扒鼓,-99
1331683,天堂湖 5月16日的神分析 预判大盘这两周走势,-99
4367263,汇顶科技：国家集成电路大基金超28亿收购公司6.,-99
4978583,恭喜布衣太被套的死啦死啦的还哈,-99
1555862,别洗了，裤子都洗破了，再洗就光身了。[哭][哭],-99
4934471,16元以下，不复存在！[怒][怒][怒],-99
1079448,11-14日关注 002108、000825、600022、002271、,-99
3917267,买方被压疯了 100股的买入，换100手买入看如何,-99
4684099,大盘涨时它跌，大盘跌时它也跌[哭][哭],-99
4207841,做双头？惨了,-99
5553391,为什么？,-99
3267823,中国股市前进前进前进进！犹如齿轮一一咬牙一咬,-99
4080323,万盛股份(603010)高管持股变动信息(9-5),-99
2078498,终于跑出来,-99
2593385,这个股吧全是唱空的，明明在涨多嘛！真是无语,-99
2254075,老子就等你跌破7块！那些8块 9块 10块等着解套,-99
4949587,第二次补仓完毕,-99
4763692,603458:勘设股份关于为全资子公司贵州虎峰交通,-99
2883741,股废了，股吧彻底废了，就他一个乌龟十几个马甲,-99
5125240,下午必须涨停，否则明天危险了,-99
2601435,选其他股已有收益，该股就是忽悠托不起,-99
3243136,除置换外，未来三年预计不会审批新增产能。,-99
3014626,我下注十个交易日停牌，我来痛击春狗和趋狗,-99
3937885,还好减仓了 这他妈的。,-99
5243478,603816:顾家家居关于投资入伙苏州工业园区睿灿,-99
2740639,清光了朋友们再见你们继续战斗，股灾三年赔了一,-99
853151,拉不起来了吧，该跌的还是要跌[大笑][大笑],-99
3794628,601636:旗滨集团第三届监事会第二十一次会议决,-99
4355675,更建康,-99
2022571,此轮上涨结束，再等挖深再来，886三季报后看挖,-99
5074307,只有上涨才是硬道理,-99
3890459,怎么从8.55跌到8.4，而不是涨到9.24呢？,-99
5223857,36.32跑，啥价位进合适。,-99
1901249,今天期货大涨，,-99
2658552,跌易涨难，垃圾一只。鉴定完毕！,-99
5382460,格力电器套牢投资者的可能性很小,-99
2788628,不懂的不要乱讲,-99
2387967,我大长春的商业龙头,-99
1149873,不忘国耻，守住中国国贵资源稀土。,-99
5393847,600576大涨了,-99
2089995,停牌倒计时,-99
4805325,以后就叫绝味屎了,-99
4567567,比耐心,-99
4009844,奥普光电：[并购]或将重启 中科院混改龙头,-99
4076578,看来没什么人愿意当脑残[为什么][为什么][为什,-99
1972008,这架势还行，23.30就回本,-99
2842963,西水：不离不弃 老道与你共睹红阳举升,-99
1056288,石墨烯+锂电池龙头暴跌，中报现金叉，或超方大,-99
1536362,该公司可以达到减亏的目的。,-99
233579,梅林主力长期盘踞导致梅林多年发展缓慢，现潮流,-99
840342,洗盘与出货的差别在此,-99
1414808,今天又是跌，何时是个头啊？,-99
1004401,600287:江苏舜天会计政策变更公告,-99
3306513,大连港也是环渤海湾的，收益雄安新区,-99
5086694,看样子明天。,-99
1048833,今日加仓40000股,-99
3850771,我要是桩，天天做T赚点小钱，然后打压到7元。,-99
2821834,等待10、20线上移，消化10、20线买入的获利盘。,-99
5132549,603726:朗迪集团2017年半年度报告摘要,-99
4191747,公司上市这么久，股价下跌这么厉害，从来没有见,-99
5428033,昨天刚卖了,-99
4188325,这股可以买不,-99
5406492,603912:佳力图股票交易异常波动公告,-99
350945,感情用事是股市中的致命伤,-99
2645527,只在参与,-99
727903,政协十二届五次会议今开幕,-99
3622324,真的太差了，新凤鸣20多倍市盈率连涨了三天，桐,-99
2176765,最新消息，主力两点准时拉升！！！,-99
4360837,中报速递：腾龙股份2017年上半年盈利6604.20万,-99
1644928,600495:晋西车轴2017年半年度募集资金存放与实,-99
331228,广州发展(600098)融资融券信息(08-31),-99
4001729,我靠 刚刚不是6.57的吗  我挂了6.57的买单 咋又,-99
2134153,降速对次新等题,-99
927105,一瓶茅台灌醉了股市，形势一片大好啊,-99
5140663,连个业绩预告也没有。18号也没几天了，难道直接,-99
2928822,老套路，一步到位，然后长时间调整。还没到涨的,-99
4678484,煤改电，绿色能源等题材，长期看好。,-99
5033324,应该跌到没法在跌的位置了吧,-99
2625526,长江传媒(600757)融资融券信息(08-17),-99
585960,"大股东缺流动资金,贷款要财务成本,减持白得",-99
4460742,这股价上窜下跳的，庄家玩得好开心，,-99
1590330,今天会不会,-99
2356261,步森亏损还高高在上,-99
5271320,600466,-99
4499133,举行发布会。国家发改委价格司巡,-99
3102044,全资子公司白旗乾金达矿业获得采矿许可证。,-99
2360252,全网首发！000882华联股份[买入],-99
5484615,臭垃圾，使劲砸你，砸到你崩溃为止，让你磨叽。,-99
3919581,中国银河调整整完毕，能否拉升就看这一关键点是,-99
509635,看不见的手 出边儿我就提拉你[摊手][摊手],-99
2833536,到时我翻3倍股份我还是胜家。,-99
28352,产品信雅达(600571)传统业务保持领先，,-99
1849211,为何停牌t,-99
5327276,一卖就涨,-99
3305885,持有两年跌成这样好心痛啊！！终生不买惠而浦电,-99
2757625,辞职可以坚,-99
1570022,百分八十以上命中率的提前判断风险与机会,-99
3390199,这里有装疯卖傻的托，这里还有自以为是的，这里,-99
5084486,看看吧！看看吧！心太小了！谁能帮我变大！,-99
4144073,每天都开不出来有什么奇怪的,-99
589545,这股今年基本都会被压在9-9.5这个区间内，明年,-99
1793466,再不出，没机会了,-99
502026,600146   复牌直接5-8个板是大概率问题!放心吧!,-99
591183,拉高就卖，今天。,-99
275525,期待即将到来的好戏,-99
1600373,怎样操作才能发出图来。我先截图怎么也发不出，,-99
362445,创业板那什么来爱你 最好走势,-99
4138177,只进不出的市场,-99
3651430,我今天比上周五上涨还开心，我是不是疯了?,-99
992199,600848股价23元,-99
4418090,大家到金安，生益吧拉皮条，呵呵不信你还能做空,-99
3403571,谁他妈的大几百手的在卖艹,-99
1897822,资产重组是利好，关键是什么时候能复牌？,-99
1351875,A股题材王子:钠锂固体电池 钛锂电池 燃料电池,-99
5453657,全是套路，下午肯定绿色收盘,-99
4042370,董事会有什么权力去反对这种为股民提供的高于市,-99
5365320,我说跌破30看到27本来是想它涨的，没想到还真跌,-99
2549693,你今天涨5个点以上我就追回来[傲]。,-99
769351,主力在等什么，还没准备好拉升吗,-99
2700797,扩容速度的放缓。,-99
4639599,SB们，此股无庄，鉴定完毕,-99
2635528,付出后的回报,-99
4265453,继续走在破40的路上，不可以接盘,-99
2130718,今天又完了,-99
2586890,[赞][赞][赞][赞][赞]b,-99
4214910,套了快一年了，已经没什感觉了，此股生下来满月,-99
5193992,股吧评论的人少了，变得冷清了，这个时间点也许,-99
302349,这股确实是垃圾股，一年多的走势让人寒心。,-99
1036986,[002110]全流通可炒市值4亿股价4块2低于1600点,-99
2872763,今晚停牌,-99
4965948,这个也能叫妖股，就一烂股！,-99
5446711,跌停啊，快，希望到四十,-99
1106743,“白马股”其实很黑！,-99
4937647,603703中签的是朋友们团结就是力量,-99
3865148,5月25日个股经过长期的下跌之后，近期出现了止,-99
272919,杀啊，逆势大跌才能彰显你的牛逼，今天跌停我加,-99
2390625,选择价值重估的买起。,-99
1273671,宁波韵升-价值创造 产业升级--2017年度投资者网,-99
2895925,些都是支撑美联储加快加息步伐的因素。,-99
3879,招商银行上半年赚392.59亿,-99
3932283,都有龙虎榜 为什么博深,-99
5411746,前天说复制寿仙谷，今天看有没人说复制佳力图,-99
4519381,冲动买进的全部挨套了…这股真心碰不得,-99
5061042,只跟大盘跌，不跟大盘涨,-99
1098508,农发种业比敦煌种业弱很多呀,-99
546620,好样的！终于开窍了，资本运作开始了！,-99
3665712,几个意思,-99
3470306,庄在做空，不出大阳棒，站不上五线，就改变不了,-99
1077789,有个疑问，网上一些报道，华泰2016的毛利在600,-99
2262632,↓第二个酥联。,-99
1628804,跌了两毛多。日kDJ还爬高高了。。。,-99
