,content,mark
2757660,今天这悬了一天了，你说它还能涨不，我说它能涨,-99
3570159,擦发,-99
3552052,方大碳素主,-99
109239,中信都涨这样了为什么不买港股的光大证券？,-99
3891112,买,-99
214364,看了下K线，最近几个周五都是大跌的，明天又是,-99
4862677,这股有毒,-99
6881,放量长阳春天快到，可择机进入！,-99
2704179,抛单越来越多了，股价快要雪崩了，还不跑就来不,-99
4146921,辣鸡辣鸡,-99
5411377,直接搞到跌停,-99
4798057,跟风股没钱途，这吧里小菜太少了，股价太高没多,-99
1847982,套人的节奏？,-99
5013820,正常来说，一年中四次签已经很不错，也有大把一,-99
2876418,14.05 拔河比赛  空方胜！,-99
3981839,操尼玛，昨天涨一毛还不够今上午跌，屎东西,-99
3185551,这票可能要大跌  又是托盘  庄玩对到看样子是要,-99
3237152,鲁管求你吗逼天天跌,-99
2231094,今天抢豫园商城吃了个跌停，不过这几天持续加码,-99
3586347,真尼玛丢甘肃人的脸。垃圾货,-99
3918653,中国银河完成发行50亿元公司债券,-99
1706027,白菜价。,-99
3530171,重水公司有钱啊,-99
1456573,中闽能源明。,-99
2015077,炒完鲁西化工再来炒你,-99
1197061,逼散户接上证50的股票这么拉指数就这一个目的,-99
3059836,打压吸筹已到位，下周上攻无疑问！利好消息要出,-99
3304066,我知道了？大家判断一下,-99
2141270,包括连贝多芬都说,-99
518844,垃圾股,-99
3408922,应该下不去了吧,-99
3803209,垃圾3000的票,-99
2341523,我说至少要,-99
2897891,对于中国联通。,-99
2972124,租售同权历史性的改变市北高新的基本面。。,-99
4991417,此股散户太差，天天那么多卖盘，建议全体散户一,-99
2288752,公司以1.52亿元将清远市房产出售给广州市大洋房,-99
547187,对具有产业资本高位接盘,-99
223539,电话中,-99
2927167,买了一部分的申通地铁，留着等上海国资大动作，,-99
624086,空单就不要拿了,-99
2132124,狗庄下午拉高出货，狗庄下午拉高出货，狗庄下午,-99
2508695,各位关注买入300179四方达,-99
4627678,我操盘的话，拉到涨停的价格也收集不了这些筹码,-99
4464643,前两天40左右出来股神一大堆，这两天死哪去了，,-99
2194237,严监管未见松动趋势v,-99
2573022,想你他才还,-99
2376966,溢价收购竞然没有对赌大商管理层干什么吃？,-99
2576483,别看。太恶心。过年再来收网。,-99
2152888,不耻人类的狗屎杨,-99
4739956,乖乖隆地冬，再不跑下午就完蛋了！！,-99
802344,涨停吧,-99
1717908,方大炭素竭诚为国内外广大客户创造价值,-99
356432,只要比别人多冷静一分，便能在股市中脱颖而出,-99
515636,一看就知道航母来了，霸气,-99
978837,永不再来此股,-99
3573290,此股不干净，有鬼气！,-99
423992,请问高手，这个位置可以买入吗,-99
234754,上证50不给脸，翻红就破3200c,-99
4727257,请广大散户准备好弹药！准备和死庄斗争。抢筹码,-99
3927537,抛弃游资，加快上涨突破11，5，奔向13，7站立15,-99
413625,操你唠唠,-99
1326936,兄弟们赶紧把筹码抛售给我们！领导有任务了！我,-99
2926461,成交量换手率相对较大,-99
566459,A股将上一万点，买买买！,-99
4538204,这垃圾怎么没有龙虎榜？,-99
747041,说要反弹到14.5元的朋友进来,-99
3806529,哈哈哈，股吧里的股神、今天要抽自己的耳光…,-99
2757192,历史问题多为由拒绝面对现实，去看看香港垃圾股,-99
3339523,真是个垃圾[大便][大便],-99
4236117,IPO扶贫概念也不好使了,-99
1678307,如果一个人的八字大运里没有横财，那么即使再努,-99
4561314,花猫告别36元，两周后将在38元上站稳。大家要耐,-99
4227351,高开那么多主力有实力吗？今天进了三成仓[胜利],-99
1312456,核发6家IPO批文,-99
1977331,基本面选股再荐黑马000701、002091、601699,-99
4322493,傻x连st 都不如,-99
3071117,加油[赞][赞][赞][赞],-99
5267643,跌到16元左右才考虑买,-99
1814186,新疆城建(600545)融资融券信息(12-01),-99
620565,新三板在线晨报：海翼股份2017年前6月净利3.03,-99
1289948,买买买买买买买买买买，3.8铁底破不了,-99
4170421,业绩股价不匹配，,-99
2133217,楼主牛人啊,-99
2296660,川投能源(600674)融资融券信息(11-23),-99
980821,玩完，连抢权分红的都没有吗？。,-99
1716496,程序化实盘和历史测试%相似！他是如何做到的-,-99
3738152,让这份思念温暖了我的世界,-99
1368356,我们悟透股市亏损的真相了吗 ？,-99
5069444,什么时候到雄安新区签个大单回来，就算你牛,-99
2889130,权威媒体CCTV:世界级的难题盐湖提锂技术取得重,-99
3242716,无量下跌，下午涨停！,-99
2038826,万达私有化龙头 即将大爆发！,-99
2590632,欢迎主力来 600252 中恒集团 讨论,-99
4191458,荣超和四季路这两家游资，我看见就跑，专业割肉,-99
2289225,[滴汗]1月13日……\t,-99
1449387,潍坊男子信用卡账单多出万 浦发银行称事出有a,-99
4593228,哈哈，好刺激，加了,-99
4060545,有兴趣的朋友可关注,-99
570210,先跌到10.7，正好跌一半,-99
924297,套死你们孩子 ,-99
3376933,买通家奴，照样加爆你？不服气？来个跌停板罗！,-99
4166681,不涨的股 跌起来 比鬼都快 这股不能买啦,-99
4284196,跌了那么多 屁也不放一个,-99
3486264,最烂的航空股，跌多涨少[摊手][摊手][摊手][摊,-99
2146791,1920年低  69.00  49.50,-99
4218580,换股还续三天黑三兵,-99
5332699,回调介入,-99
225893,今天复牌，来个涨停，去去晦气！,-99
1224493,金融大鳄真有样，往死里砸！,-99
173208,这只笨象的颜值和内涵都不错！,-99
2639998,今天成交量好像有点异常,-99
3677912,今天利群吧什么回事[为什么]京东方的托全跑过来,-99
4446774,短线炒股你怎么看,-99
231994,明天开盘暴跌,-99
4560636,华懋科技拟定增募资7.8亿元扩大产能       5月4,-99
4133880,太好行情被龟孙子白白浪费了…,-99
3743492,有点像仙股的出货走势，完了,-99
3207955,此股庄已死,-99
745982,上攻乏力，又要跌了。,-99
4506779,明天高开4.7个点，非会员勿追，收到短信真好,-99
1924401,应该有机构免费申诉，胜诉后收取20~30的索赔，,-99
4419682,"股东人数在减少,筹码在集中",-99
3369402,买进，今天5个点,-99
3839597,MLGBZ，这是军工概念？这是军民混合吗？,-99
3938853,营业29亿亏2.5亿是管理机制还是人有问题. 有病,-99
2249298,股票再次启,-99
928355,这三大炒股误区必须得改,-99
5301118,信心比什么都重要，想改变以前炒股的颓势请拿好,-99
858945,差不多了[大笑]本侠不玩了，各位私募操盘手看你,-99
2655897,重机12.95元下方我等你。[胜利],-99
4195860,第一次中签，我们的心愿。。。[微笑][微笑][微,-99
4175821,本来我是要抄底的，没,-99
2857536,技术上看指数在短期如果没有利好带动将继续做底,-99
5081129,弟兄们这一个劲砸可不是我喊出来的昂，我只是回,-99
2611626,关于招商局地产控股股份有限公司人民币普通股股,-99
5447586,基本面选股，再荐黑马：600657,-99
167454,午评：防范再次冲高回落 午后走势分析,-99
1028467,开挂飞上去,-99
2108076,托单一现，一般都是一地鸡毛！散户还是疯狂买入,-99
4291176,就此证券日报记者,-99
5523580,吧内该彪悍些了,-99
268912,5.2左右再分批买 不要去接落下的刀,-99
4978796,还行，二十个点，不算,-99
1228784,股浪人：别忘了，盈利来自于退出战场！,-99
715140,倾巢完卵，今日埋伏,-99
4256631,等第二次触底比较稳，这是高危价位,-99
5246942,这庄家肯定死了,-99
3448173,与这狗庄只能T十O玩，有0.5角就抛[大笑][大笑][,-99
4046914, 缩量与无量有着本质的区别,-99
5003655,自从买入，就不知道什么是，一路狂跌，29.72买,-99
485330,刚才手慢了，三毛补的仓，没想到砸到两毛钱，你,-99
1893912,造纸板块都涨两个多点，你他妈还在跌。,-99
4607304,主力在出ipo一级市场的货！大家不要接盘！,-99
2466523,被抄底了了这货好像要启动了[好逊]。,-99
2777369,中船重工与工商银行战略,-99
1964645,下午是关键，不然调整还将继续[想一下],-99
5048237,震荡四天了，不信他不爆发,-99
3045442,水滴石穿888 板凳 1月10日，阿里巴巴集团控股有,-99
4483476,割油菜去,-99
4547732,今天挂买单的散户多的话........庄家就会向下把,-99
4312879,主力，老子又来了，哈哈哈哈,-99
4064514,预警信雅达(600571)传统业务保持领先，金融科技,-99
3660719,5年翻翻股,-99
3009939,与诗平,-99
2497975,今日复牌，有好戏看，有认为重组失败是利空，有,-99
1815792,真想看看阿散鸟语尿裤的样子[大笑][大笑][大笑],-99
4037740,中信银行昆明违法违规收监管5罚单 罚252万限两,-99
4080102,等风等重组,-99
4194845,这股也有，多注意点,-99
1619691,跨年行情可期这类主题机会来了,-99
5311236,看看澄天伟业 真不明白为什么还有人留恋这个垃,-99
2415766,垃圾就是腊鸡,-99
1278132,中国股市小荷才露尖尖角，大牛市悄然来临你却浑,-99
1931679,去死吧垃圾,-99
3361555,期锌又大涨了！拿住小罗平！曾经的王者！今年丶,-99
525399,个人意见东。,-99
3694071,什么价位买入呢？谢谢了！,-99
4096079,国家大数据逮兴风作浪的资本大鳄，主力不要过分,-99
4014626,破3400了大爹啊,-99
3421048,山东出版大发展，山东教育大溃败！,-99
616031,:3.5亿出差费绝对不可以查的！a,-99
760227,这支粪草股，投资近一年亏损一万多！,-99
3243816,福成股份后面走势怎样，这里已经有答案,-99
1146039,改名叫大垃圾好了,-99
2118514,上海国企改革股崩盘,-99
1060832,7.6等着,-99
3565238,9月23日的那次穿越（10日线下穿60日线；次日沪,-99
1354,我一锅粥一样的炒股,-99
2374566,强调5日均线,-99
4146344,我的好股--精选继续抓牛头股爆发发发发发发发发,-99
2048020,通过平台提供便,-99
4928795,这股散户抓的大牢，根本就不出筹码。,-99
4408094,咋天22.76卖，今21.41买回。之前一次24.16卖在2,-99
5096299,虚假诉讼罪，3234点是2014年终收盘区域。,-99
4056224,强烈要求龙宇涨到大盘3400点 龙宇该到的股价,-99
4037066,我真是服了,-99
3331428,哈哈哈……券商股不涨，别说突破了，就磨底，上,-99
3861602,下一步工作安排时明确了三大重点：t,-99
3093050,看好陈敏尔，嘉陵必定有戏,-99
