,content,mark
4600986,卖了，就放心了。自此涨跌不关心,-99
4743300,这次赶巧了,-99
1052655,周一天齐涨停[胜利][胜利][胜利][胜利][胜利][,-99
3362442,必有厚报，坚决[抄底][抄底][抄底][抄底][抄底],-99
4159026,雄安新区天津用募集资金投资了4.2个亿，怎么说,-99
3866088,但是他的霸气犹如古时候的将军一样是一将功名无,-99
3317961,新一轮行情开启，这狗日的与自己的股票过不去,-99
543566,傻逼多还不信,-99
3355221,周末听歌，送庄托，马甲(及盲目唱多，唱空者):\t,-99
3135155,乌合之众,-99
67712,今日大盘收红。,-99
4597887,这只烂货靠政府补贴过日子的叫超讯通信乞丐,-99
2500813,大单买小单卖应该没啥问题,-99
5177501,共享经济现在碰不得，不稳定，过段时间稳定了还,-99
2076765,尾盘拉升诱多，明天又套一大批,-99
417887,还不如南京化纤！,-99
4112229,燃料电池纯正标的,-99
4807563,上面大单压盘，就是不让涨，小散认亏出局吧,-99
1370506,心虚了吗，为什么删我的帖子，这是第四次发 股,-99
2388904,中商业绩确定A不涨原,-99
1351554,大盘翻红你翻绿，你这作死的节奏啊！,-99
4888267,受益于巴黎气候协定，全球新能源汽车的更新换代,-99
1440292,6月23日涨停早知道：中信国安、中科三环、三丰,-99
2503013,坐标，明后,-99
531191,小官哥哥你是个苦命人啊宝宝就是不涨,-99
4381060,今天会留下，长长的下影线，然后开始往上跑。。,-99
5105903,奇袭 好太太赚8个点 香飘飘 赚2点 哈哈哈,-99
2856217,每晚都来贴吧，希望看到安信信托得利好消息，每,-99
1029997,"明天有大阳了,应反转了,先看10元",-99
4096405,呵呵！为了收复五日线，意味着什么吗……,-99
4500138,电魂变鬼魂,-99
2347640,第三届中国西藏旅游（600749）文化国际博览会将,-99
5359636,拉,-99
5471896,拟收购众源，“汽车电子装备 汽车零配件”协同,-99
1895517,周末找个公司来借壳上市，哈哈，一买就不涨[不,-99
3664963,起来,-99
2771664,真是王八当习惯了就知道缩头？绿帽子！白帽子？,-99
5542325,河南地方即将进入国企改革，洛阳钼业现在算什么,-99
3734484,顺丰控股:关于全资子公司与UPS合作设立合资企业,-99
385210,踏空狗割肉狗叫的越疯狂 说明股价飞的越高 嘎嘎,-99
5289692,该死的烂股,-99
1910589,如果今天破了14，可以买一点做个t加零。,-99
2255025,3200点超跌反弹一触即发,-99
4909268,宽家军已全部买入,-99
305483,清远沪指连续三日上涨，锂电池。次新股活跃。,-99
4162735,走了减仓明天做T,-99
3408091,龙鸡一上涨这里各种兴奋疯狂，跌了股神就消失了,-99
2542545,出来的现在可以进002225了,-99
2462170,在震人出去，守住[大笑][大笑][大笑][大笑][大,-99
5153045,煤炭持续走,-99
3608228,当今社会搞实业还不如炒房，投个100万，赚个300,-99
4367586,止盈不贪，止损不拖，专业股票合作:3天套利10%,-99
2660299,这也算是阴差阳错歪打正着的超预期的偏得了,-99
4309452,量能不足，热点散乱，上攻无力，久盘必跌,-99
552200,资金在逃避的股大盘涨到一万点也不中！,-99
5096704,中邮系的票碰不得，中邮系的调研能力很差,-99
1069037,600749 西藏旅游：牛态尽显,-99
4444962,应该叫 上海 保洁,-99
4880995,不信你不涨,-99
2497700,恐慌的傻逼，那么着急卖，两个涨停都坐不住，现,-99
1762453,股票合买这个模式靠谱吗？,-99
4273294,五穷六绝七翻身 七月五大投资机会揭秘,-99
2713353,通宝能源11月17日加速下跌,-99
2874819,拉不起来了吧，该跌的还是要跌[大笑][大笑],-99
4172236,即将爆发,-99
4752733,中科信息出来啦，正好看中你,-99
3778314,11118511佛说了买者有福气！,-99
1839697,稀土永磁行业最优质公司000970中科三环,-99
3628425,清仓无底洞,-99
3765193,很多大机构看好上海医药,-99
68095,长线看好钢铁，短线或有反复,-99
2779524,垃圾,-99
4097599,除过卖原始股的没割肉，其他都在割肉,-99
1480617,跌的真猛啊,-99
4511163,估计海鸥明天要大涨了。,-99
1497849,冲破年线,-99
739713,文火慢慢炖。,-99
3071766,我去 、你们在打摩丝密码吗。5 6 5 6 的,-99
5288980,这样的公司能够上市，是谁审查的？存在多少暗箱,-99
1283906,五洲从出生到现在就没大涨过 也很少送转股 业绩,-99
3913570,天天笑都笑成傻逼了 [滴汗][滴汗],-99
577620,此股以后，向下走是越来越难，向上越来越顺,-99
2908889,收盘9.77,-99
3134865,利][鼓掌],-99
4077762,人妖朕傻儿神经病有一句正常话没有？。,-99
3940534,垃圾桶扶不起阿斗,-99
1794337,保险开始拉指数了[不赞],-99
4255138,小庄：往下砸呀！,-99
1933565,我8.6O买的京能电力能解套吗有比我还高的吗,-99
5552603,跑得快，斗地主。目标价10块钱。,-99
1036870,3100点多空激烈震荡 看好后市行情,-99
5236135,装家收集了好多筹码，没人接盘，真是惨！,-99
3082382,有没有20元以上买进的啊 最高20元8买了7000股，,-99
3128651,九阴真经必须练成，说不一定十连阴。,-99
5412453,借助大盘洗盘成功，下午大幅拉升,-99
1405937,力度太小,-99
4648616,艹你妈主力,-99
1101163,向上没有空间，也不能涨超38元，否则要约收购就,-99
5454921,说实话业绩中规中矩，大家期待的业绩大增也泡汤,-99
4750574,与 和胜股份 一个庄家,-99
4709739,主力用心险恶，为了吸筹,-99
130295,直20军民需求超5000架,-99
3249444,果断斩仓，板块上涨，个股还在跌，主力净流出两,-99
5350428,可以杀跌了[鼓掌],-99
5076666,这股迟早毁在操盘手，太幼稚了,-99
1120375,这两天超跌反弹的品种，要不要进去搞一把,-99
3509063,保持绿，竟然不动,-99
1293321,中央一文件 中央r村工作h 即㈤_始 。。,-99
3917106,我开始在市场上寻找其他的公司,-99
3781086,说的不错吧，砸盘工具,-99
2239556,经验告诉大家 这股还要跌5-8%左右，勿碰。,-99
2166461,究竟是谁的手伸的过长在破坏股市的生态？,-99
5494071,没看到大户挂单买，都是我们自己买的,-99
4945252,8月近半市值解禁，谁还去放牛，套现走人,-99
3934044,港股复盘：A股走势拖累港股 恒指跌破24000,-99
1776185,余光不行，云海今天将再现翻红大涨，如不然明天,-99
5057560,小散能忍亏20%5天吗？不行！其实小散无论从技术,-99
1662256,今后三年，中化国际的责务会持续走高，公司盈利,-99
5077814,回眸一望，原来也就一垃圾[心碎],-99
3841634,大垃圾电气,-99
4987836,别人的软件就是软件，你是软加贱,-99
390913, 股性是否活跃，是选股的重要标准之一,-99
2572063,翻倍第一高价股600519贵州茅台主力开始出货 翻,-99
2253789,600661:新南洋第八届监事会第十八次会议决议公,-99
5530110,下一步仍然还是险资重点投资的对象,-99
2739042,四喜丸子,-99
2305800,压力山大，套牢盘,-99
1800702,600539:狮头股份2017年第三季度报告,-99
4394901,环保工程股，哥最看好这只，不告诉你们为什么！,-99
1222144,满仓不动，本月必上9元，爆赚,-99
2825151,安徽出了科大讯飞＋安凯客车妖股，马钢这垃圾业,-99
4160199,多头强势，而后有获利的小单流出，目前处于震荡,-99
2543910,下午深指数跳水带动大盘继续跳水可能性不大，因,-99
759531,成交量太小上不去啊！,-99
4215117,砸振华股份，做中国好股民,-99
45715,其中奥妙无穷。,-99
4584619,航空业的毛利润一直是迅速和连续地增长 ,-99
43012,光头，人家天天问候你妈，你不出来解释解释。作,-99
4568848,这样作为格力电器的董事长董明珠来说就不用为,-99
4419648,跟散户反着做才会赚钱,-99
3221342,2017年半年报点评：主动资管业务能力亮眼，自营,-99
1180954,股指触20日线一带便有逢低资金吸纳,-99
1164059,只要庄家在5.16元以下买得足够多，还是看好宏达,-99
2445334,警告,-99
4788823,明天继续洗盘,-99
1506209,有不了什么出息，尿样儿,-99
1040238,分了钱。大东家就有钱了，可以托市了。目的尽在,-99
4480890,榜单分析,-99
4973625,前期34收下影线有明显支撑  主力会在这个位置进,-99
551442,近日，氢氟酸、萤石市场大幅上涨。前期中央环境,-99
3590068,垃圾股，跌成屎了！公司不管？,-99
2467327,欠我一个涨停板[鼓掌][鼓掌],-99
1535181,我也希望你强势涨停的，好带领我的有研新材涨上,-99
3819152,今日沪指收了一根小阳线。,-99
1854510,瑞莱嘉誉借的6个亿利息从哪里付？,-99
339194,买,-99
3860062,《盘面提示》,-99
5253199,饱了吗,-99
1591052,昨天追高买入w。,-99
4511833,赶紧杀入，别怪没提醒！！！！！,-99
525185,看看丫的买一和买一2000手以上的单.下午就围绕,-99
413947,今天低开高走。,-99
1236369,完全判断基本正确虽然没到3087但已经不重要了，,-99
742057,上市公司参股险企热情大,-99
722830,大盘在3250-3260点附近还是可以抢个短弹,-99
5048472,嘉泽新能都飘红了，你怎么还绿呢？,-99
2204041,如果看好，你就加仓，如果觉得他高估，你就卖，,-99
2232205,风沙之江湖侠女你个疯婆子 哈,-99
3698979,恶庄贪婪阳痿操盘!,-99
4395398,次新股的自传,-99
5505297,今天有色会涨,-99
3213927,连续亏损，啥时候退市,-99
884235,天方药业：关于延长停牌时间的公告,-99
3700816,你M的以又低开,-99
4750433,拉就是出货，不用动脑筋了,-99
3702454,9月1日收盘快讯,-99
470990,上次发公告跟雄安无关，今晚再发个公告，跟锂无,-99
3186193,逃顶江南的开始回头吃贵州燃气肉！,-99
2896986,大家该逃的赶快逃，下午还要趺了！[赞][赞][赞],-99
3136180,主贴在603444，拒绝马后炮,-99
1292213,太监李德全后裔,-99
268724,涨一天，跌几天 ，有什么用，现在这股票,-99
3935370,抬不起头了,-99
549607,满满的托单。狗日的又是跌的节奏。,-99
2128632,哟西，还有很多人坚持呐。,-99
406217,生物股份，帝王洁具,-99
3321490,股市有风险,-99
4917297,死人股,-99
1039328,欧债危机重灾区的欧洲,-99
2969295,十月份从13元告诫大家这股要跌破7元，还有人怀,-99
799678,看看永辉超市收购股权。沧州大化股权被中国化工,-99
3962934,加油，买入,-99
2250927,持有真是折磨n,-99
1899625,这大跳水玩的哪一出？,-99
4469206,健康，搓,-99
267168,这行情让人混混入睡，不玩了，割了，割了,-99
580455,股价要调整到1元左右！,-99
3353435,止跌了吧。,-99
1618764,亨通散们挤挤,-99
1162066,晕倒在厕所里了g,-99
