,content,mark
1610981,揭穿股市沙猪等一帮人的丑恶嘴脸,-99
4248522,该校某一方面科研成果的转化,-99
1170015,没有一个能成功读上大学,-99
4354104,这b样，迟早跟着大盘下来,-99
968966,概念股风口过去了千万不能买。,-99
3189775,闪崩？,-99
3443075,时代位同学们提供施展才华的大好机遇和广阔空间,-99
4157335,公司成为神州火箭及太空仓仁喂┯ι獭,-99
5224886,6月19日，“富时中国A50指数”发布最新清单，京,-99
1066111,年底业绩翻倍，调高股价也到20。,-99
5175988,全部清仓,-99
2072622,电器板块都是白马。澳柯玛是屎壳郎d,-99
4677465,沪深指数窄幅震荡 环境保护异军突起,-99
2200755,早上大跌，买,-99
1924964,有建仓吗？一定别忘记通知我,-99
5242220,下午肯定往上攻。没事,-99
1821562,黄金企业合并，掌握定价权,-99
1134891,麦肯锡称中国电动车产量全球第一 力压德美两国,-99
5445235,603933,-99
1117906,晚间公告：方大炭素净利4.1亿e,-99
4259787,很幸运的避开了大跌,-99
862650,一个个跑得盔歪甲斜，号角战旗全丢了，整个一滚,-99
2811341,都死在你的净资产上,-99
3115922,提高公积金的利用率,-99
2838770,一票，为不任宰u,-99
4948264,因为从监管的角度来说,-99
2312563,优与劣，一比就很明显。,-99
2092878,盐湖涨停了，你还在等什么？,-99
2216288,我赢了7.94三年之内绝不会破，空狗可以滚出此吧,-99
2351081,今天2点建仓，并锁仓。,-99
4007138,看不懂啊？请教高手？[为什么][哭],-99
5452037,等着来个地天板,-99
1070656,保壳无忧，股价涨跌无所谓。,-99
3974229,601933:永辉超市2017年第二次临时股东大会的法,-99
1032591,傻逼，看资金图也知道该抛呀，大盘这么涨都跌不,-99
4800788,欧普照明11月21日火箭发射,-99
1996908,都是内部人中签，没散户的份，申报几百次没中一,-99
3072303,国金策略：A股市场具有显著“红十一月”效应(附,-99
4743233,设计总院跌20%，实际次新股开始了调整,-99
1101995,600315:上海家化关于拟出售“国泰君安”股票的,-99
602849,如果多头进攻无力,-99
3917499,有刁用。垃圾中的战斗鸡。软蛋母鸡。。,-99
2275924,就知道压单，就知道挂单，你倒是卖啊，你倒是买,-99
752614,增值额可达2142.88万元a,-99
404762,僵尸股,-99
1025042,脱硝催化剂价格大幅上扬,-99
51119,又是分红好股,-99
1955904,获利盘巨大机构在此拉高出货，注意近段风险，不,-99
1398555,以茅台为代表的漂亮牛,-99
1666073,奔向20亿。。o,-99
323373,祝云天化庄家国庆快乐  中秋节快乐  给我们小散,-99
3724374,吴德叉凤 具体情节 明儿上针 详详细细 翻译水准,-99
1343956,康欣新材600076必将大涨 拥有全球首条高强度定,-99
4635010,“快点割肉吧散户，把你们40成本放血割下来。你,-99
2195369,朕赐老老杨头1杯鹤顶红告老还乡，以后别再来了,-99
1780123,造成了一定的困难――有些个股今日涨停板,-99
523089,主力有意反道逆行，给我们踏空的散户机会，大家,-99
1411332,预测明天低开7.60午盘拉上8元！,-99
193057,竞价卖了600062买进000878大赚,-99
5302611,真想不到150下来，会跌破发行价，幸好99进入，9,-99
4951343,都不要动了,-99
4111832,图形不错，就是今天拉的急了点,-99
1923725,改名翔源火化得了,-99
5065214,都把眼睛睁大看好了，这可是个行业龙头,-99
3989067,打卡报到,-99
277402,哪个吧里都有个搅屎棍，中葡里有谁？,-99
2464604,涨停，实力,-99
3086372,002081（金螳螂），连续十四年中国装饰第一名，,-99
4486926,涨停就涨停吧 钱留给别人赚,-99
777261,还是比较看好乐视以后的发展的,-99
4581903,快抢，明天涨停板,-99
3588627,601212:白银有色为敦煌文博投资有限公司提供担,-99
5110036,市盈到35左右就可以进点了[微笑][微笑],-99
5428111,横盘出货。。。,-99
4758251,这张烂票估计踩了业绩地雷，机构都在卖，破18是,-99
5116757,手欠 追高买入 一买就跌  哎,-99
782659,600226:瀚叶股份关于控股股东股权解除质押暨进,-99
5111053,太他妈稳了，我服了,-99
3919279,层层叠叠套装 廿元见? 证金，汇金，社保联合,-99
4061513,今天坐等大盘站上3200点,-99
1631364,明天就是一字板，今天还洗，有缘分者赶紧上车，,-99
4090016,看这架势，年报估计要踩雷了，,-99
4791372,尾盘拉升 抢了筹码明天还要继续砸 小心啊,-99
572964,注入资产整,-99
2078535,垃圾股,-99
1741502,未来两到三年茅台将会出现技改扩建集中期,-99
1102847,上京东，那里有家化的品牌，都是联合利华，保洁,-99
4552181,千万别被吓倒！,-99
3567712,白内障看不清？傻不爱思滴眼晴，模糊滴，重影滴,-99
438313,不陪大家了,-99
1471653,三元五年熊途才走了二年，还能再跌三年...,-99
2200804,中国首条柔性显示生产线量产，柔性电路板产业将,-99
906004,简氏：中国军工企业联手高校推进量子技术应用海,-99
3642362,国信证券29日上市，这是市场送给我的一份跨年礼,-99
4635177,怎么这只股没止跌迹象？,-99
509308,N字头，下杀无底。,-99
424560,80理财：月薪几千的工薪族，如何理财？,-99
3735992,近日有全国首家共享医院落户杭州，该医院由杭州,-99
4039530,4. 人寿保险政策的收入；,-99
2336978,钉子户，没有两把刷子当不了钉子户！。,-99
1830468,600549:厦门钨业关于公司会计政策变更的公告,-99
2321182,央行今日重启逆回购操作 此前已连续12日暂停。,-99
4343910,下一个方大炭素！,-99
2287891,强势涨停机构游资敢死队疯狂抢筹高送转次新大黑,-99
4700922,易德龙应该会到35左右，别问为什么,-99
4806177,跌停 老子就不用看了,-99
1022785,30会到吗,-99
4705508,换其他的，这股大盘涨，他必跌,-99
4347454,不破52不进，破53就会涨停,-99
3956816,真的有人关注了.。,-99
4308011,开学前记得买红蜻蜓文具给孩子们...[买入] !小,-99
4192712,要懂得顺势而为[大笑][大笑][大笑][加油][加油],-99
2476383,这量，明天又危险了。没有资金陪玩，节前资金紧,-99
772652,下午就玩你了 [拜神],-99
1710866,在日前召开的保险资金动用专题培训会上,-99
2934508,狗良养的又要下了，,-99
3520819,深圳燃气(601139)融资融券信息(10-30),-99
1488951,钢材涨价对工程机械影响几何?,-99
698858,今日盘面：期指空头几近疯狂，沪深两市岌岌可危,-99
1506614,金证找爹开始,-99
5327433,这是要回补2月9日的缺口吗？,-99
995139,触底回升，望现报复性反弹,-99
3515685,601128:常熟银行关于苏州分行获开业批复的公告,-99
994066,我做梦，发.红包，浦东建设大涨。,-99
4874155,这个也叫跌停板？,-99
5482075,损失这么多打压越往下打压散户越多,-99
996711,太伤心了。,-99
4933510,上图说话,-99
4851723,这股的操盘手是李连英的后代,-99
4577026,完美收官，下周大盘是否有望好戏连台？,-99
2354795,二季度大概22亿,-99
4301511,现金为王，安全第一,-99
1863426,竞争看多A股十年牛市或将开启广发证,-99
886700,今天理财的钱到账了，这个股不敢补仓了，我先补,-99
307689,融资盘剩余下跌空间1.5%左右。,-99
633827,最后你吧分,-99
2172548,都抽出资金追联通去了吗，哈哈，这走势,-99
479852,如果没有涨跌10%的限制这个垃圾跟香港仙股没什,-99
3037728,内蒙花垫,-99
4201218,阿弥陀佛，求佛祖给拉涨停。,-99
5269075,尼玛戈壁，装死,-99
1958357,何从空巢青年沦为问题中年,-99
2156061,继续增持中国平安！,-99
3093787,今天又要跌了,-99
4159010,日你妈，最烂的次新股。,-99
2270161,虽然波折 一定成功,-99
4795556,跌时领先一步，涨时落后一步[不赞],-99
5092106,挨挨巡视泥玛水多吗,-99
849348,玩意又泄了,-99
3477587,现在是不是大蓝筹估值也到位了，小散不敢买。中,-99
4292020,虽然我也在骂老板 但不要担心 润达股还是不错的,-99
845275,，\t,-99
3731307,华锐要回1.5元,-99
2616188,没有做多氛围，就没有繁荣金融市场。如果唱空鬼,-99
2806062,让我们一起静静的等待定增,-99
4046779,浪费时间，浪费生命，浪费人生！,-99
371212,没有一天能涨五个点以上的！可怜虫！！,-99
3217563,这孙子股上市骗了多少小散！无德！！！,-99
2338811,很多34手卖下来,-99
4414001,好多人追高被套了… 这次可能往48左右下了,-99
1585342,估计他猜,-99
3813528,拿得起是一种勇气,-99
5453636,后期估计涨不了了,-99
2265978,长航凤凰9月6日盘中跌幅达5%。,-99
4693622,废柴,-99
1923420,祥源控股还不如万家文化，跌的成sb,-99
904157,小心谨慎涨也是卖出,-99
405305,你永远跌为老大,-99
2955416,"石墨烯龙头脱颖而出, 机构8亿锁仓, 本周开启上",-99
2739860,一个字“逃”|||||||,-99
3681525,警惕！量增价跌 ，短线面临调整！,-99
418653,看来有停牌的倾向了。个人意见，别喷[鼓掌][鼓,-99
601344,本口诀指的是密集成交区同股价的关系,-99
4477317,这个主力实实在在的股市大流氓散户远离,-99
5113370,珠海今天如果发言估计会招千人骂,-99
3938898,明日股市三大猜想及应对策略。,-99
1955017,破位了东后,-99
5154602,雄安的这一波没碰上，满仓69的本，以为出年报低,-99
771547,淡彩穿花q,-99
1242332,还从来没有吃过这么大的亏,-99
1411543,百股跌停小盘股何时才能稳住,-99
1548397,信不信,-99
487432,MSCI中国A股指数剔除3只个股ST三泰（002312西部,-99
2104999,这厮一出，嘉宝要涨。,-99
1379888,1人民日报：4000点是牛市起点结果散户进去大盘,-99
1059671,47164不要拼命一再误导唱空，，，，…,-99
1061138,5.15只是起点，后续题材引爆，10元以上,-99
2248344,小散别进福耀玻璃、坑人的股,-99
182375,今天大盘走势挺好,-99
1223748,极品垃圾！,-99
1791782,中国经济稳中向好!欧洲央行宣布:买人民币! 股市,-99
5455324,除非光威复材继续连续涨停，不然三孚很难解套的,-99
3671292,今天周五，散户小心,-99
934896,每个周五与周一都会拉指数，都1年多了，规律，,-99
3437513,继续关注600558。,-99
1783294,慧球都有11元股价，难道比鲜言还黑？,-99
867368,主力庄家真的是死猪，我已经满仓了等你们拉[鼓,-99
1919014,看来上证指数站3200点，要指望下个星期五了,-99
5328354,17号进的机构 估计是亏欠走了,-99
2922262,抄底确实不是好玩的 高手揭示股市抄底的高级秘,-99
