,content,mark
4480086,要死不活的垃圾,-99
4865231,尾盘砸，挺听话。哈哈,-99
5507089,就这么被洗了，真不甘心,-99
954523,诱多成功，明天跌停,-99
590559,垃圾股票，刚涨停一天就跌这么多。,-99
1583875,方大碳素主力暗度陈仓，散户们小心了！。,-99
2133193,卧龙_轩。,-99
4721762,明天启动   短期目标20[满仓][满仓][满仓][买入,-99
2323224,美股或被看好,-99
2076491,603989,-99
5125009,江南嘉捷超短周一低开就出，来这观察观察说。,-99
3495251,诱多，又在骗傻逼入场了,-99
4445741,当欲望开始贪杯有更多机会,-99
2343776,[不说了][不说了][不说了][不说了],-99
2722910,大单进场。,-99
1565692,风神的前景,-99
4052761,这辈子最后悔进入股市，我的下一代绝不会给他进,-99
2716660,涨幅靠前；白酒,-99
173975,明年被st的股票，跌到3块附近没问题！！！。,-99
5439542,这种狗牛子垃圾股不是一般缺德透顶,-99
945119,航天信息真TM的垃圾，别的大数据都涨停了，它死,-99
4686673,柳州医药一季报出来了一组数据不能不看,-99
4621319,谁买这股就是sb,-99
2742338,中储快点砸到七块,-99
1706633,网警都看好了，尾盘强拉好戏马上上演了。,-99
2457805,大盘的调整，应平和应对！。,-99
1677593,大家清醒吧！发展要靠什么？假如国外资本增加进,-99
5029054,三祥新材8月16日盘中涨幅达5%,-99
1188226,大家买惠发股份,-99
308580,"拿出点男人的样子来,按你的惯例,3天涨起来的幅v",-99
5294227,看着吧   10元见了，就这走势，肯定往下走，大,-99
4162131,什么时候像模像样涨一下。。。？！,-99
1747814,散户杀跌清仓出逃，茅台机构将被深度套牢！永世,-99
1777516,相当的稳健，相当的抗跌哦！哈哈,-99
4523664,求财神爷保佑中签赛腾股份,-99
2800807,5万手封停,-99
3922576,上午拉高，下午跳水，明天低开再拉高跳水，你又,-99
445814,多只板块出现四连阴跌势，有色、煤炭、钢铁、机,-99
2977094,特斯拉在华收入大增 2大超充站投入使用 还有不,-99
2581153,资金流出，下跌中继，幸亏跑了！,-99
4115778,主力去哪了，联通的孙子新通联,-99
2964568,关键还看中小创的突破方向,-99
2074196,没素质乱骂人的，估计都是买的最高位,-99
978919,河南国企改革！借金融会议新政，加快国企上市步,-99
3693471,今天全是散户在交易,-99
2262253,月底前能复盘吗？,-99
2900331,有些股民让人看了真是悲哀！明明是自己判断错误,-99
1528452,002250量比缩到极致，还上涨，好不好呢？。,-99
4978254,清源，清新悠远路漫长，短线88,-99
2634983,无人问津的股票,-99
3887455,筹码全吃了,-99
2437195,中国显示历史性时刻：成都京东光电科技有限公司,-99
2865343,涨停板买进股，不到不卖。,-99
2391696,10.6的本，哭吧哭吧不是泪[哭],-99
4427706,大家注意，畜牲还会继续打压的，远离毒品,-99
2738491,菠萝糖醋排骨,-99
1043231,",三阴灭不了一阳,后市要看涨",-99
5507604,谢谢主力支持 又低了一点点,-99
1050893,坚持住11点准时拉升。,-99
1815102,主力加油，打破四元就成功了。,-99
5276181,垃圾,-99
2571002,4.09就是纸 四块不是底 3.8才是底 哈哈哈,-99
1860138,不多说，股价走势符合预判。,-99
4868219,停盘了？,-99
1738287,"公司的业务的基石,新品种和产能释放保证稳定增",-99
2889864,才能真正有益于国家和人民,-99
3632349,阴跌坑人的，不买，不买，不买。嘿嘿嘿,-99
5344614,操作计划,-99
5533084,旱地拔葱 拭目以待,-99
3086833,持有东方电气三个月以上的投资者比猪还蠢，根本,-99
4393336,德创环保大动作在接近，后期趋势毋庸置疑这样走,-99
4396319,无量反弹。,-99
2027350,置信电气(600517)融资融券信息(06-01)ig,-99
1487512,又买一套，帮我解套[鼓掌][胜利],-99
5114570,补跌需求。小心，逃命良辰,-99
2144990,别忘记去年6月,-99
3290583,爱众横盘整理 ，磨合消化。五一后雄起。大家千,-99
1848707,增持一百手 继续盘继续搞,-99
3669417,保险股是稀缺金融标的,-99
1130797,其实成功的本质是蕴藏在人的内心的,-99
1421384,5快1。,-99
1171723,案的核心，业务覆盖河北各级人民法院。雄,-99
4214364,跟你MB一样烂,-99
3538554,2017打新股中新股的赚钱新技巧：。,-99
4334405,多么好的一只股被狗庄家弄成这个熊样!!看看同样,-99
126331,又是一天心电图，真没意思,-99
5008000,8834+10  第一次发帖 求中！[topic_name=次新股,-99
1042662,感觉不妙。,-99
2741784,奋发有为 砥砺前行：中国诚通2017年上半年经营,-99
4305578,不知道可否举报4000手哥诱多，当时它挂的价格是,-99
369255,恐慌盘出来就可以进场抢反弹了,-99
2670246,赶紧割肉吧！先割的少亏点，放得越久亏得越多。,-99
2485534,[大便]股[卖出][空仓][看空],-99
2159779,前面天天做差价的，今天全套牢,-99
1798737,走势上面不是很流畅！而一些八部分的小票中,-99
3964820,提醒本吧的各位股友-很重要，特别是不想赔钱的,-99
555207,投资者没有得到回报，再高的业绩，只是一串数字,-99
1426804,再加仓吃进华胜天成60万股豪赌一把，持仓豪华过,-99
1517475,600452:涪陵电力董事会审计委员会2016年度履职,-99
4294199,远上寒山石径斜，白云生处有人家。,-99
1106096,600879买买买，证券化九院，停牌在前挂！,-99
2859164,大家快买！宏盛十年以后股价必到四十元！,-99
1055525,要想赞成的赶紧拿好钱去买买买，过了今天有钱又,-99
703873,本人郑重声明:鉴于哈空调的不确定性，暂时不买,-99
2041210,上帝，让张无良快走吧,-99
4097965,光头光脚大阴线，兆头不好！横久必跌呀！,-99
1477846,炒过二重，炒过长油，炒过超日，炒过凤凰。还怕,-99
3866091,面对6.26%的跌幅,-99
4867785,0.28%、 0.27%、 0.13%、0.06%和,-99
979656,什么情况，发火箭,-99
3895519,回调就是补仓机会,-99
376927,呼叫万手哥,-99
3977533,明天开启起爆点。,-99
2248631,国调招商并购基金和伊敦传媒基金也通过定增成功,-99
2925893,中关村智联轨道交通运营产业联盟在京成立,-99
1321255,跳水冠军白云山马上闪亮登场了，没有最低，没有,-99
3621397,要走的快走，不走我不拉的！哈哈哈哈！,-99
3708971,今天进驻通用等到60离开,-99
56010,我宣布民生银行停业整顿，,-99
1211392,山河，大牛显形。,-99
3730647,马忠。丛红，风电大会！！,-99
3559302,今天又是跌停没考虑,-99
2475069,今天在7.89卖掉，明天7.5再买回，就这样玩,-99
2760413,老乡，不要跑，我们一起加仓守岗！！,-99
441665,割自己的肉让庄家去痛吧,-99
4579753,地出现了 同志们,-99
2565172,筹码都到哪里去了？,-99
2916092,17破了能不能补仓？,-99
3277826,进场:地方国企二线蓝筹股---跨年行情热点,-99
5487932,垃圾银龙！,-99
2211769,唱多的都熄火了，那我来唱多吧，下周一站上十元,-99
3219970,大家别买了，下面的全是假单，庄家无心做股，只,-99
3303257,这就是命  要不死要不认。,-99
5260334,今天的阳线，带动人气，不错,-99
3947314,兴业投资：央行会议前欧元和日元谨慎 商品货币,-99
1162958,今天冲不过6.43调整开始,-99
4905138,拜财神，求中签,-99
2476527,主力出货了，快跑、快跑、快跑！！！,-99
539978,快速买入002398建研集团,-99
4916129,中建B抄底的恚,-99
853621,青海华鼎：实控人变更为于世光夫妇,-99
793858,要洗了吧，毕竟最近大家都盈利不少了[鼓掌][大,-99
2211545,盘跌是主旋律，到8元本人来接,-99
913928,这是个假军工，我们小散快抛！,-99
5244453,《东文智博》10月9日大盘趋势预测！,-99
4181862,大头没在你身上，哎,-99
1580265,股市未来从来都是不确定的,-99
4228944,当人们不再相信股市奇迹的时候，任何利好都将失,-99
2179270,上三盘，下三盘，申熊要涨等明年：,-99
4897439,河北省发现170000平方米的污水坑，污水抽完后这,-99
1638162,现金流较正常;业绩增长平稳600493,-99
1165807,资金在流通。,-99
2994532,来来来 好股耶来了 你们也来涩,-99
4555790,又把特斯拉model3的发布会看了一遍,-99
5057007,603679:华体科技澄清公告,-99
718413,要死不活的货。求求你给点力。早知道就跟着腾股,-99
3831009,奇怪了，个股大部分绿的，大盘却在涨！谁出来解,-99
3912121,今天涨停，不用看了，老子买了6千多万[大笑][大,-99
358700,多空双方交战我看戏！,-99
4852101,直线拉升,-99
4337495,这么好的题材居然无主力资金看好。,-99
4682336,"kao, 此股无庄家，拉个千手的都没有！",-99
3727307,东吴证券(601555)融资融券信息(07-06),-99
4647117,什么鬼食品？,-99
3205601,好多垃圾股市值都三百亿了，销售额还没有杭州银,-99
2651571,让鹏起爆仓。他大爷的。,-99
3641918,感觉学到了真本领,-99
790753,明天估计高开冲高横盘。,-99
1311826,保险瞎了眼会增发首开,-99
2744638,最重要的是人品,-99
1919679,你不是喜欢吃糖葫芦吗,-99
546768,破白酒，除了乙醇，没有营养，一个鸡蛋营养超过,-99
2997796,建仓,-99
287627,17.76补仓1000万,-99
3770039,小东狗托天天换着马甲忽悠，趋势不懂看忽悠你吗,-99
1600813,IPO批文 筹资总金额不超,-99
1065288,低估值，底部，白马股，看好恒顺醋业，目标20元,-99
1187252,因此筑底的行情将不会持续太久,-99
2455832,果然处高位开启七卖身行情[大笑][大笑][大笑],-99
2243119,好功夫，5分钟股价不动,-99
4154860,冲啊,-99
1924319,我在8元等着你回来啊等着你回来！,-99
3829752,能不能大跌呀等着买,-99
3153297,锁定期3年承诺5年，意思就是5年内都是打压收集,-99
2029070,假上海股？,-99
3206843,杭州银行，本座回来了，插插插！,-99
1637024,看的起你时你巴拉巴拉的不珍惜，用嘴能驾驭市场,-99
3626238,广汽集团重心向新能源业务转移 将与比亚迪争夺,-99
725067,罗顿短线会到8元，立贴为证！小户别急着入手。,-99
4354820,指标背离了！快跑,-99
5233269,看样子下午又得爆跌了[大便][大便][大便][大便],-99
2881165,二十年了，什么没有见啊。你们这里不要脸真多。,-99
119217,何时复牌？,-99
1557795,从而重点窥视机构在此的操作行为,-99
4407709,大家想一想:为什么总有一批人唱空? 1、难道他们,-99
2963012,估计尾盘会跳水到7.5以下,-99
4896631,昨天买进高能环境，欢迎关注浪客直播本号：东方,-99
759861,模式:全国一网丶国有控股丶混合经营丶互联共享,-99
2731870,为公司从整体上的扭亏作出贡献,-99
1844968,.79元,-99
