,content,mark
3936416,没量，想涨难,-99
4555818,尼玛啊！今天真的是要捶死自己了,-99
3414716,赶紧止损吧，,-99
1948875,千年一遇的牛市来了！i,-99
486240,医药生物行业:精选成长型白马 寻中报超预期个股,-99
4885601,这垃圾太贱了。,-99
2117629,好久没上海上海见了什么角色呢,-99
4841554,无量上升，诱多陷井！,-99
3418214,垃圾，今天又垫底了[不赞][大笑],-99
4989183,兵不厌诈，看作洗盘诱空，不可能低位减持,-99
795401,控盘高手,-99
3549492,准备好？回托价位…越来越低赚钱困难程度越来越,-99
375590,现在开始吧里全面看空，不要看多，让主力没有风,-99
4336848,跌成这样。这公司都不管不问，退市得了,-99
3971919,道法这猪狗不如的东西只有一千股天天在这嚎叫,-99
3687557,融资盘历史底位,-99
4052396,这货明天开始连续涨停,-99
1499639,提倡并加大市场化的购并重组力度。。,-99
2137927,无语。看大盘跌这股不跌还以为很稳。泡了壶茶的,-99
4135823,15.05的1400多卖单哪去了？,-99
725589,开始了,-99
2773484,收盘价3.38或7[胜利],-99
1715689,2017年3月13日债券交易提示,-99
3312619,中国黄金集团新型环保提金工艺实现工业应用,-99
3941816,人为阻碍双边铝产品贸易的正常秩序将损害中美双,-99
5255300,3. 每个公司应该具有一个长期的连续的红利支付,-99
2822252,安阳钢铁才是龙头，垃圾,-99
3609889,[哭]明来个报  报  报复性地大反弹[鼓掌],-99
5032256,真他妈一坨狗屎,-99
3685829,连升两天，有阴谋，庄家可能想拉高再割韭菜，今,-99
3958716,13买的，还能解套么……,-99
2804185,马上拉屎了，快捡呀，哈哈,-99
1574224,工信部重视产业技术创新体系建设  中国忠旺持续,-99
2483081,小庄今天不许打回来，打回来老子打断儿的腿！,-99
1405627,看不出大有同学还属于抗跌型选手,-99
5319525,这无耻的公司，为什么员工持股完成就要跌啊，难,-99
4439079,智能汽车板块多家公司中报预喜 智能化将成汽车,-99
4623238,估计是九阴白骨爪,-99
2204957,要多少有多少,-99
3158587,上海的小瘪三a,-99
3418899,有真正研究宁波港的吗？他的控股股东是宁波港集,-99
4195322,看俺赚钱多轻松？！,-99
2976952,天天这么搞,-99
3817680,股市是国家的财富，是标志一个国家的富强，摸摸,-99
469467,吓死宝宝了,-99
5407427,抵不住指数发飙啊！看来大盘暴跌开始了,-99
4350871,收盘翻红了！赶紧买,-99
1151642,很多上市公司在卖房时都是将此作为理由的,-99
4555175,总共6000万股，庄家可以融券打压，底部吸筹再还,-99
4175251,76买回来。,-99
4039166,盘面布置的挺滑稽，哪个股散户天天进出就几手几,-99
1994901,不玩了割肉走人,-99
1341608,我去啊 就差几分钱没有买到[哭],-99
276014,有四大神，自然就有四大衰神，目前有因为，南风,-99
2480676,四川双马复牌，水泥股全部跌停！,-99
1158415,看看这股的走势就知道这家老板的德行。,-99
3407180,什么概念[胜利],-99
1472090,兴化股份：未参与兴化集团建设管理的乙醇项目。,-99
3551225,垃圾股，速度跌停，我好抄底，不跌停不能显示狗,-99
1633130,10元回来确认收货！抢购吧,-99
3562636,散户都磨走了就有希望了,-99
4440449,最可怕的就是长期“低位”振荡筹码高度集中再跳,-99
2240023,人们无不忧心忡忡。,-99
879805,中通俗语言背后深邃的思想精神,-99
4438711,不要脸的指数要拉红迎接黑周四！,-99
1301884,3300点应该会破一下，外资出货太猛了,-99
696273,吴中股价黎明前的暗战将是持股人意志与实力的综,-99
3871646,烂逼货,-99
2128510,在股吧抱怨是没用滴，我有一计可自救。,-99
4919972,晃悠你妈逼一天还不如人家两分钟涨的多,-99
3033389,脆皮，脆皮天天海蓝，快出来讲讲12.4元T到10.4,-99
2056702,继续加仓等待发妖,-99
203054,底部放量，大股东增持，后期看涨!,-99
2571172,华远地产“点题”2017：并购要加大 布局要拓展,-99
2420619,今天如你放量,-99
5076544,至基准的1.05倍，其中部,-99
920639,其中雄安新区概念后续值得密切关注,-99
1084794,他妈真垃圾,-99
525193,三季报这么难产？,-99
4289289,周一跌,-99
4105933,有几个人做到了呢,-99
1351190,今年二月份重组到六月，利好半年，又收购成功，,-99
830126,快跌下来吧  我好加仓,-99
2037750,下午验证，勿追勿进,-99
2193707,会以后肯定,-99
4406940,现在看来69元跑对了,-99
4481372,龙头,-99
3830645,601700:风范股份关于参股子公司增资扩股引进战,-99
5393821,操你个妈的,-99
4349954,工信部：推进“企业上云” 加快壮大我国云计算,-99
4977798,清源股份，50以下，一股不卖,-99
3778724,有色：基本金属价格回暖，嘉能可复产难阻钴价上,-99
1317534,是一大利好。不过,-99
3260416,中财我抱了一年了，天天有人说涨，一年从八块到,-99
3098296,股东人数增加到18万利好呢，大家都看好呢，众人,-99
2118806,快跑！！,-99
4309629,简读今日大盘！,-99
3082219,为了一个party，扭曲人性,-99
4834811,中签的99%跑了，可拉涨停了,-99
3614023,银行现金紧张 股票只会跌不涨,-99
4721520,亚振家具    下午收盘跌停立帖为证,-99
4732701,0604＋18保佑中签[拜神],-99
3096966,三月,-99
809079,大盘自然变的弱不禁风,-99
1828504,应该来个涨停！。,-99
720699,今天宝宝一定收红盘,-99
4323951,资本市场不允许资本大鳄呼风唤雨,-99
2229052,流氓,-99
2047216,孵化企业达高个秒户 市北。,-99
2727194,sun子那去了，爷一来吓跑了，溜溜孙子就跟溜狗,-99
2066729,涨停在路上。,-99
5291313,。前不久，,-99
3728869,1.42见,-99
2159198,百视通院线日前宣布将与威动科技合作,-99
3555741,集体粮变国企山鸡变凤凰,-99
4221205,我承认我压盘了，34.40压了一手，啪啪的把主力,-99
2971986,几分钱玩来玩去，套人的，要拉早拉了y,-99
1643539,隐形、变相加息，抓紧拉高股票的及时解套出逃，,-99
1306274,像安凯客车,-99
3977501,涨多跌少的，没啥，一分利就知足啦。[胜利],-99
3752328,12.15是强压力。这里过不去。赶紧跑。做600860,-99
3037961,内蒙华电改名内蒙煤电就好了,-99
629960,紫光国芯涨停啦 未来5G是唯一热点,-99
1211218,阳泉警惕“煤飞色舞”成为大坑 证金概念股存在,-99
1332917,这次大会有老张的难看了,-99
930582,浙商财险风险评级罕降至D类，保监会叫停其非车,-99
1963569,IPO审核未放宽，低PE个股全线走强,-99
1433937,还有一毛多就破前低了，等着大盘补缺口吗？明天,-99
3832359,这是什么鬼，没成交,-99
1488663,让一切看空片仔癀的人在不断上涨中颤抖吧！颤抖,-99
322046,有200万股的单个账号割掉了。,-99
1165315,等4元满仓。,-99
5366670,新华网快讯，我603039被关起了，怎么办啊哈？,-99
4221426,中小散速度清仓,-99
2080516,大盘今天不会杀跌，会保持高点震荡。,-99
5275793,还差点量,-99
3781655,中冶今天有跌停的可能,-99
1384870,三块我在进,-99
44662,现在是低迷期 吸筹码 吸筹码的大好时机 谢谢不,-99
4733850,造纸印刷和有色金属等概念相对较弱,-99
707903,乱来,-99
354327,散户走人，让机构搏杀。,-99
210508,三季度又一分钱没赚到，也算有业绩,-99
5152755,603738:泰晶科技:关于湖北泰晶电子科技股份有限,-99
1738396,三十分钟六十分钟背离，明天有一跌。,-99
240682,业绩造假嫌疑。大家认同么,-99
5170189,赚,-99
3697909,还好上午亏两个点割了,-99
3222874,958洗盘厉害啊，每天上影线，但向上突破是必须,-99
2947920,天下没有做不成的事。,-99
1236972,但是足够我们尝遍世间沧桑,-99
1892596,"还是钢铁股强罕，又大涨了，烂纸真的""垃圾",-99
1054696,股吧有电话公布，大家可以打电话核实情况，,-99
1502806,垃圾国机，国机垃圾[大笑],-99
1326228,照瑶者，马上死。。,-99
1751887,套死活该，活该套死。[好逊][好逊][好逊][好逊],-99
3923275,死货,-99
1836780,一些踏空最后狗疯狂吠叫的时候，预示着离开盘日,-99
1260206,刚才三大软件同时检测老庄挂了一千手托单,-99
4742022,[图片],-99
5422078,联通复牌无悬念涨停，参与方亦不甘示弱，混改概,-99
2683033,割肉出来了，伪雄安股票，主力一直借利好出货。,-99
1702865,c. 其他种类的债券和优先股,-99
5125758,神奇的两点半,-99
3359010,7-9月份统计营收34.57亿，净利润16.01亿,-99
1729389,[满仓],-99
1805539,市值须至25亿以下l,-99
5312948,今天如果没有资金进场 36左右 如果有资金进场就,-99
775037,如此垃圾的公司，实不多见。,-99
564433,业绩亏损快跑明天，明天一个地板没商量,-99
2138538,新时代就剩6500万，静鸡鸡出了货吧，好让主力放,-99
3696116,怡球资源12月5日盘中跌幅达5%,-99
4267274,这破票真要命,-99
2942,明日会涨停吗？。,-99
4880765,我爆发的牛股--好发发发发发发发发发,-99
4894401,为何每天顶帖,-99
4667569,是不是这种感觉,-99
628247,600182已废,-99
4182593,套路，认栽了，妈的[不赞],-99
4721110,亚振家居12月6日高台跳水,-99
1146198,又啦一堆，唉~wns,-99
692391,提个建义，金种子跟毛台混改，双赢。,-99
241837,泥玛天业猪，快的到7元我要补仓了。,-99
1012346,龙头珠海港受压于20日线，无法突破，明日大回调,-99
2588277,中报必亏，看看好多中报盈利前的走势都是不断新,-99
3229263,比亚迪涨了兄弟,-99
4583306,多少股,-99
662556,汇隆成本高过现价，现在可增持百分之五了。。,-99
5431950,铁瘤变成这样也是够奇葩的！,-99
1853920,要求复名ST慧金，举牌不要脸11,-99
3476593,必不可少。,-99
3105083,如何去寻找一个好股票呢,-99
5315096,从投资者的市值分布状况来看每一周,-99
577747,风格转换：机构永远是散户的天敌！！！,-99
3248614,今天或将是最后一跌，逢低加仓吧,-99
412917,中国卫星(600118)融资融券信息(07-10),-99
2928464,啥时候机电也来个大爆炸的好消息，江南嘉捷羡慕,-99
768603,云南祥鹏航空有限责任公司,-99
2112482,预测涨停,-99
2519453,股市如果找到上升原因之时，股市就是见顶之日,-99
