,content,mark
420889,不行啦，买出准油，满仓郑煤,-99
1804720,一阴吞三阳，休要在幻想。建议12元抄底！。,-99
4784751,最怕这种阴跌了,-99
1957470,空仓的人气的呕血,-99
4393968,给套了,-99
4866639,46买的一只垃圾股,-99
3999857,今天先在18.7挂10手看能不能捡到,-99
1235961,傻逼票,-99
485014,西部今后就是一支僵尸股了！,-99
4173981,让暴风雨火雪来得更猛烈些,-99
1072611,鬼托脏史一箩筐，揭露几条它就慌，鬼托罪证一火,-99
4254569,"5G概念搅动股市低谷, 引爆整个电信行业",-99
627225,天舟文化复牌两跌停  ，深惠程还敢复牌？g,-99
4935762,002327速买机会不多。,-99
2500027,证监会批准郑商所挂牌棉纱品种,-99
3348712,流通股东又来卖了小散们准备接盘吧,-99
2772713,三年了，时间过得真快。,-99
3452096,妈的，赶紧跑,-99
3494011,明天在进去,-99
2499469,相信现在这价位总不会亏太多吧！看好煤股,-99
630113,同一天发债的生益股份和国祯环保比，为什么相差,-99
3503995,q预期--实现--资本发现，现代制造业成功重组的,-99
1840811,0719金石资源603505复盘早间提示纯数据仅作交流,-99
1071452,从国家限制来看，确实在保护业绩优秀的股,-99
3886234,股转正式发布年创新层名单家公司入围,-99
1562612,简并税率政策对纳税人最直接的影响就是降低税负,-99
2960764,图解蛋壳A的解禁股,-99
2602062,垃圾有问题,-99
1620930,2008年以来上海房价涨了8倍，几万元人民币根本,-99
2408060,航天电子。,-99
4987776,是时候表演真正的技术了，涨一个点，套你一个跌,-99
2365939,收盘3.26阳化问你服不服,-99
2066166,加码油气微弱利，不可臆想,-99
3183828,一不留神就可能成为被割的韭菜,-99
3724507,动物衰，你看范桶都开完临时股东大会了。究竟要,-99
2094129,今天感觉好悬，心里面没有底，我挂的跌停价格，,-99
4351652,恶狗嘴脸！,-99
1992313,有根据k线看，经历了长时间吸筹，加上这次，强,-99
3034587,您好，我在股吧看到公司合资的光线新材料公司对,-99
409878,跟涨是没戏的，跟跌那是绝对不会少哪怕一分钱的,-99
5531445,艾华集团：去年净利增17% 拟10派8,-99
529953,想要筹码？向上拉吧！,-99
2782811,昨天不跟上港集团，今天真乖紧随其后。大单砸的,-99
39230,明天炒一把特力 我心不贪 8个点走路,-99
2298880,我更倾向于第二种解释,-99
4392711,你NN的，不下来，老子追高吃了你筹码,-99
2048320,涨停板走人了，，，，,-99
4474687,操你血妈的,-99
4064346,人为控盘迹象十分明显。,-99
2362529,格力美的海尔都是双上引，不知道怎么办了,-99
3836821,稍微一停等等。,-99
5371971,收盘有可能跌停,-99
907768,做T,-99
19890,9%之间的股票,-99
2826096,一天涨的三天直接跌完吗,-99
847193,芯片+通信已利好兑现，数据软件信息是否会助力,-99
4738480,最终,-99
3504870,涨了指数，，个股不见涨。,-99
5262059,看来三季度业绩不错。,-99
2226928,多狗代表人物：脏口大王 寂寞修行者！,-99
2978535,准备周一搞点,-99
1092243,神州牧和泽泉是典型的垃圾私幕，碰那个那个完蛋,-99
710287,死叉向下，命好苦,-99
4780057,跌停买了，11~3,-99
4165560,东旭光电还能继续持有吗？还是卖掉啊？\t,-99
5001703,真他妈是个怂货从未涨停过，五点阳线极其少见。,-99
659055,秦港股份明天4.94锦州港是否能及时跟进[买入],-99
4354082,创业板今天应有表现,-99
4841310,今天我大A股爆涨两个点哈哈,-99
1724621,老忘吃药，不行的,-99
1512672,最近几天大成交量股价却滞涨，每次快速冲高套一,-99
5270861,《常盈每日研报-20170726》,-99
1879721,这货后面有故事！,-99
1829120,咱继续跌,-99
529470,9月11日这么多流通股要流通，压力巨大，会不会,-99
5327691,大家快看新闻，管理不叫发帖,-99
1305975,这股现在厉害了，汽车股都涨这么好，他跌那么狠,-99
466014,夜间服务窗口0点以后接收服务：涨停保险号是600,-99
2768898,普洛斯仓储物流激起千层浪，仓储物流中储股份涨,-99
934875,市场仅有的几只大象在哪里舞蹈,-99
1236085,下星期千股跌停,-99
2743586,二股东能不能变成第一大股东呀？,-99
1004076,海康3300亿市值都炒到47倍市盈率了，你个孙子30,-99
2465506,庄还在，股票就在，跌破了从新在来。,-99
5080798,中小盘开始发力,-99
4982817,不会1日游吧,-99
4198486,重磅新闻：台华纳米新材夺三季报预增王，净利润,-99
469623,12块都站不住。哎……[摊手]。,-99
4367500,发现一个规律 此股每天拉到114以上就开始派发回,-99
5062839,明天第8板，涨停价26.22，晚上继续挂单1000！,-99
1530720,如果在07年以前炒股，是银行，煤炭有色钢铁大涨,-99
3856597,然后以券商股发动，拉抬指数。,-99
4519521,还没有破发，真厉害,-99
5539800,靠跌停的节奏吗？,-99
4604306,最有利有图的投资总是在人们对市扬悲观，而不是,-99
4597339,买入后，请参考快意电梯的走势！,-99
452749,好,-99
2537198,一碰到半月线，马上就将下来,-99
3240202,黄金行情解析： \u3000\u3000黄金在昨日晚间受美国财长,-99
3039280,内蒙华电：终止定增 拟发行19亿元可转债,-99
4085819,我也是服了，日线做成直线，这个庄也是牛逼。买,-99
4511691,决战到底,-99
2662888,华域汽车(600741)融资融券信息(12-12),-99
953964,憋了2年了 至少放个屁呗？,-99
2156155,给他。,-99
4425788,就看中你,-99
2433455,上交所：减持须按照相应,-99
1625407,郁闷大盘涨时跌，大盘这个跌到比别人还快。没主,-99
3645604,这票不错，明天跌点，我来接。,-99
4914118,太垃圾，半月回不到17元了,-99
2423502,不吸引盘，就只有死路一条。,-99
4152478,小盘次新股全线拉升了,-99
4042921,这么多1手成交是什么意思？,-99
3043423,8.18我埋巍…舅看有]有C?,-99
5383813,天天押那么多，押的人家不爽了，人家不玩了，要,-99
5010426,预测朗博科技中签率0.027%左右,-99
4615557,拜财神，求中签,-99
1172160,一般大盘跳水，黄金就会拉升的呀，怎么回事了，,-99
3787791,四季度险资布局料多点开花 优化权益投资加大另,-99
3184972,国电电力600795沪港通融资标的雄安新区热电建设,-99
2952432,除了误导市场,-99
2584523,卖完同达创业，全买了索普！,-99
1276820,保持上升态势.主力在试水...耐心！耐心,-99
2968283,败家子们就喜欢割割割，老是这样又何必进股市来,-99
759682,天天阴跌，何时是个头，估计还有未公布的利空？,-99
1227749,割了吧！兄台,-99
3368237,下午煤碳可能全线涨停,-99
2827418,这是死也要不涨啊y,-99
4928821,明天继续跌停,-99
739496,八层以上股票走周期大C浪下跌趋势中持续创新低,-99
3843671,每天都是低开，尼玛！。,-99
1710447,国色天香，股票真难，一往无前，一刺到底,-99
3676827,身体最诚实，天天暴跌创收盘新低，掏空把戏,-99
3507212,空 投资心态决定你投资,-99
3855052,别怕，等一会还有一波！,-99
1506047,今天将拉升5左右，快上车,-99
3491626,骗子太多，防不胜防,-99
1785427,流动性短期偏紧缓解 业内称货币政策不宜进一步,-99
419855,浙江东方明天开启逼空行情。。。,-99
490445,真的不知道整天装到底有什么意义，越是有能力的,-99
4925881,快点涨停！,-99
719757,元宵不叫元宵,-99
2515188,操作日志 | 短线风紧，注意扯呼！！！,-99
3604019,八二转换“小票”抢手,-99
4594581,股色怡人 吃屎天下第一,-99
4902281,加健康从而才能走得更远。看平多空焦灼，,-99
2272710,"1  Atchison, T. & Santa Fe  19114",-99
1613130,信威停牌，让我损失几十万！,-99
645090,期指松绑将满月 量化私募基金且行且观察,-99
5482993,上涨无力 下跌连续破位 大盘反弹也拉不起来 换,-99
5256219,哀股将会出现批量仙姑,-99
336412,林海股份买卖点如何？千万小心，别被套！,-99
4960457,你爹翻红了,-99
360259,酒精勾兑的东西股价要炒上天。,-99
2849580,过去的经验表明 ,-99
907014,正在清理门户,-99
805995,狗日的畜生,-99
649561,大牛股，起飞了！,-99
1057909,有没有必要这么恶啊！,-99
4175858,603040:新坐标关于使用闲置自有资金进行投资理,-99
2785510,没有爱了,-99
1079274,超低价的华泰！,-99
1217076,兴业投资原油周评：地缘风险令原油受宠 本周月,-99
3387633,有人将一坛酒置于山脚，离去。猴们看到了，围上,-99
3899999,中远二怂，海发海能。,-99
379752,新华社：减持新规重塑激励机制 促资本市场更好,-99
4313409,呵呵病态的吧，和某些人意见不一样就说人是托，,-99
5348211,机构重仑股明天会强烈反弹，可金域拿什么反弹?,-99
3048340,掐指一算，我4.5再回来抄底，看下周准不准！,-99
2064867,军民融合第一龙头，庄家借势拉升，有望成4月最,-99
3355097,保住上市资格才是最重要的,-99
3398898,中报速递：文峰股份2017年上半年盈利1.72亿元，,-99
3629800,庞中华你来！毛笔字写的好有个吉尔用啊，把公司,-99
2769650,狗日的，太无耻了！,-99
1239397,小庄今天没有打压股价，估计今天的某个时候要扫,-99
3742816,伙小和田食洁,-99
451592,业绩拐点向上， 地方国企改革值得期待,-99
1191564,怪不得，全是垃圾,-99
95253,4.19盘前：别让投资者为体制买单,-99
901537,今日大盘会回调，但幅度不大，山东黄金会涨3%左,-99
878918,能发帖吗？。,-99
1240682,忙,-99
1243431,补缺口走势！一定会补的！补好安全再加仓\t,-99
465759,跌停来了,-99
537466,黑嘴雇佣军杨虎诚自己打脸了,-99
2965770,工信部将建设车联网产业标准体系 车联网将全面,-99
3146610,美元指数要反弹了，国际石油空头又要后来了！。,-99
1752811,目前这个点就是历史低点!资金到位了!砸吧给机会,-99
3194322,皖能电力一定是唯一电力股破净股深市唯一破净股,-99
1248869,大盘要暴涨了，赶紧,-99
4057913,明天涨停也不走,-99
5189582,7月27日龙虎榜分析精选,-99
353128,拉尾盘会调整的，下周再买,-99
3569948,低开低走，看3195.明天收阴，今天放量，诱多，,-99
1637234,龙建股份又涨停了，龙元你难道比不过东三省的龙,-99
680456,惨了，22.21站岗了，烂股,-99
668458,速度到3.6元吧，让我开仓,-99
1989154,垃圾中的战斗机。,-99
118300,跟跌不跟涨 不要进,-99
3166493,关注。,-99
