,content,mark
4438539,迎贺酒业，你不跟大盘涨，又为啥子要随大盘降呢,-99
2253489,汇添富的票，作风比较很,-99
2745561,600382广东明珠，盘小绩优,-99
3569253,大股东与管理层已经准备好了n,-99
4634061,温州资金进入了看影子,-99
541202,是不是中体产业越跌对公司越有利？,-99
4509875,603268:松发股份:关于2016年度控股股东及关联方,-99
1081579,"万华化学 ,复牌后预计 ,第一目标位 41.73 ,第二",-99
90460,低于面值发行不大可能吧,-99
1015125,社科院研究员：很多房,-99
1297269,又要开始下跌。这次要14去了,-99
4723853,操，为何会涨，为何一卖就涨,-99
2339057,暑平带的队，国资委压阵，这个项目价值千亿！你,-99
1475417,还要提防下杀。。。。。e,-99
3452568,建议：成立铁路银行、朔黄铁路分拆上市！,-99
3834300,郑煤机(601717)融资融券信息(06-22),-99
1058242,主力80万手直接弄到涨停板附近跟疯盘蜂拥而入,-99
3814408,8.31再加一成仓位，感谢主力,-99
2334725,赶紧跑,-99
4142645,有人说做多是傻子，那就该到傻子赚钱的时候了！,-99
2737889,大部分股票几乎无人问津，失真的指数何用？谈牛,-99
1901389,真日特么垃圾，亏了老子一万多了。,-99
3956839,大家猜，动力煤能上七百吗？,-99
5161685,洗洗睡吧。。。,-99
4999384,完了，打算割肉了，太失望了，买一次套一次,-99
5096018,这票被傻庄彻底玩废了！,-99
3912119,今天王者归来，即将甩开第一创业[大笑][大笑][,-99
5345944,0点出货方式，上下振幅不大，0点附近持续出货，,-99
184606,海信不会让大家失望的，相信海信,-99
4496073,问 :浙江仙通(603239)浙江仙通自除权后近二月时,-99
3077578,一样的清欢和浪漫。,-99
1364746,讲大数据都涨停  讲到大飞机的时候没见航发涨啊,-99
3387591,炒瓜子的,-99
3276654,挂单他你想,-99
4291306,弗兰克――怀俄明石油公司（FWO）的例子,-99
5102296,再说一下会跌破15.7,-99
2457119,昨天进场，今日出，稳健盈利。,-99
1793228,只要勤诚达敢再次跌到4.6元附近，俺保证这回有,-99
772778,放宽股指期货就是增加股市的波动，看来那些高杠,-99
1993730,这票今年打5折吗？,-99
1408401,今早小胜两边一对冲赢点X元=元。九点五,-99
4014531,速去清理你的那些“休眠卡”！从冻卡到销卡 各,-99
4019586,可恨，周一继续大跌。,-99
715402,股票解套技巧2：拒绝中阴线。,-99
3071719,太监。,-99
3933614,补了100股,-99
2227928,豫园股份重组，对股民可是一件大好事,-99
3856454,乱象 坚决遏制违规投资、激进投资行为,-99
2922523,真的能承受源源不断的新股吗,-99
3502754,全部卖出  不跟这主力一起玩了[不屑],-99
1061151,快跑,-99
217512,既然到2018年4月满一年，就不用看盘了，每天申,-99
2909081,反正我死咬着这里是底部！爱涨不涨！国庆前按理,-99
35698,我了去。,-99
5242488,股市风云,-99
1988780,《待》股市拼搏二十载，又度半年如雾霾。方见吴,-99
3918588,银河就是一坨屎,-99
4735745,很强，看好明天,-99
724497,可以介入了,-99
3860317,5.15搞了50万股，不到10元不出,-99
600100,美都能源(600175)融资融券信息(11-21),-99
4880382,主力诱多，大家快抛[看空][看空][看空],-99
3324984,草泥马,-99
2052669,澳柯玛将被收购，整合产业链上下游。估值将达20,-99
1487867,事强股推。,-99
1739574,这股吧怎么老是发一些莫名其妙的帖子。。。。,-99
5229190,的可能性很小,-99
4887183,58买的都来捂捂手，胜利终将属于有智慧、有胆色,-99
5477983,开板后该股翻倍最快要用多长时间。,-99
1495094,兴业证券：光伏有望持续超预期 电车产销量静待,-99
803243,希望下来心里平衡点,-99
515198,还是带中航的军工牛~破船改名吧，表叫中国船舶,-99
3584839,近日从有关媒体上了解贵公司与浙江大学及浙大二,-99
5054943,93809＋10[鼓掌][鼓掌][鼓掌],-99
3914320,跟跌不跟涨好股,-99
5189419,上午买的下午宰手的心都会有的,-99
1986798,淡定点，刘1000那么多筹码，我们散户那点算什么,-99
3706159,工商银行(601398)融资融券信息(02-28),-99
1608537,股市陷入极度低迷状等等,-99
4541157,它MB跟跌倒是不认怂,-99
2065157,老凤祥(600612)融资融券信息(06-21),-99
3241296,2017年10月17 建仓反复做T天天实盘更新,-99
2340086,新闻联播   我国首艘新型综合补给舰交接入列。,-99
2507629,投资者保护这是A股市场的一大软肋,-99
504439,昨天又套了一批人吧,-99
3878098,跟大部分老不姓已经没啥关系，爱咋咋的！,-99
3327493,SKA Space CT计划助力SKA国际大科学工程――201,-99
3623279,明天回调不能买，再跌刚刚好[大笑],-99
3034690,中航黑豹停牌了。中航高科会不会也停牌？,-99
1323239,先简单的介绍下布林线的构成,-99
3744563,能过块，海阔天空,-99
1366591,关注超级价值洼地旷达科技002516细分汽车动车航,-99
3399497,同世联行比，你连根因毛都比不上,-99
4290714,猜一下节后还有几个连板板？,-99
4256570,杂种啊,-99
4154591,看看5个点事多少钱，直接挂卖单，,-99
2199605,左手倒右手，衣包倒裤包，没有新花样，谁会接盘,-99
1468725,主力再不拉，下周一要跳空高开吗？,-99
2054499,成功或者失败对散户股民来说都无所谓，放眼看去,-99
5393286,同时也对业务的执业标准和禁止行为做了明确规定,-99
4836693,今天洗出去了好多,-99
5485571,再次下杀的话空头力量会比之前强大了,-99
3507351,四方让狗日了！！！！,-99
2828234,握草，每天就晨勃一下？,-99
1748344,买贵航股份的人全是一帮无脑之人！,-99
3715951,大家蛋定套了就套了加仓，要等季K线MACD死叉翻,-99
2806152,已经完成了收购 2017年11月15日，不列颠哥伦比,-99
20638,持有武钢、宝钢股票的股友下周小心了！,-99
3564919,2015年股灾的反思，数万亿股民交易结算资金去了,-99
2421393,此股好比，粪坑里的石头,-99
4054136,快跑，缺口不补磁悬浮，缺口补后小黑猪,-99
54832,淮矿地产及其所属子公司将成为上市公司子公司,-99
1594700,三千手拜年线！,-99
4405855,603180:金牌厨柜关于增加注册资本并修改公司章,-99
2081400,庄家，能回调一下吗，回调一下蓄势,-99
1429377,市场上比较典型的通道业务的投资方向：非标业务,-99
5194881,由于本人长期看好新日股份未来发展前景，特此宣,-99
4000826,唉，8.96什么时候能回来？,-99
2884899,同学们：真的不能再瞎糊弄垃圾股绩差股了 因为,-99
4989257,市场相对平稳。这是报告中第,-99
1989964,拉成这样没人跟，还是死路一条,-99
25973,私募基金要番本就要炒601789 601789维持10元以,-99
5531272,艾华明日看跌，不信等着瞧。,-99
4410924,这两天回到33,-99
1795060,被套的今天,-99
3248999,割肉换股是对的，9.13卖出垃圾，10.10买入中建,-99
1272897,对于中国联通,-99
3656181,哇，有老板保底，很安全[大笑],-99
2528159,中国的对外投资站上了全球第二的位置,-99
361299,没有反弹过,-99
2492359,这票有什么利空？怎么天天跌跌不休？,-99
2648437,这样跌真好，就是给我们提供赚钱的机会啊！,-99
2331725,这个股可惜不能做空,-99
5376454,火星就是个狗脱,-99
5437738,创业板指数，,-99
929535,"海正药业 ,下个交易日,压力位 13.78 ,支撑位 13",-99
3585532,又到了评论的时刻了，垃圾股又开始跌了。,-99
4372145,科华控股:光大证券股份有限公司签署持续督导协,-99
4943521,请看这里面看空的大神们，把你们手上的票都卖了,-99
3098981,002025,-99
2280116,炒股技巧一招鲜：最经典的大牛股启动形态，看懂,-99
4787860,周五好$&,-99
1238335,31.5卖盘又来了。,-99
459351,逆流而上，证明此股好股，此股应该在15元左右,-99
5133722,朗迪集团，短期趋势向上,-99
2543657,600736,-99
4741610,傻庄又要讲技术了吗，生搬硬套。天下第一傻,-99
1253437,你也知道新疆是个好地方，想当初，左宗棠西城弯,-99
2003067,兴发牛B,-99
3620529,证券、基金等机构、其实没有什么招、除了对敲利,-99
3558479,价值投资！六十万股换成估值比银行低的陕西煤业,-99
630656,傻逼！怎么不跌了,-99
2204997,没有人知道为什么城投股改复牌以来，源源不断的,-99
485791,大傻公司锂矿卖给了赣锋锂业，大傻啊还赔了8成,-99
4396186,大盘此波调整极限3240左右，圣龙已经提前于大盘,-99
638349,"我就是路过, 顺便看看老猪种哭了没有",-99
1777035,虽然这类上市公司暂无保壳之忧实际上,-99
2448028,天天跌20个点，10天跌200点，撑不住天天跌呀，,-99
225236,强势上涨过程中。,-99
2639781,我与此股无缘，进了三次都没赚钱，不在买它了。,-99
3836856,向4.23靠拢！必须滴,-99
953991,10.80元杀入了8500股，明天捞一把就跑路！ 哈哈,-99
2174285,万业合适做差价！,-99
5045463,尼玛 这是股灾来袭吗,-99
1607103,三天小周期试缺～～～未能补～～～[微笑] 阶段,-99
2367492,超级大盘上港都成妖了,-99
2572874,下午涨停，内部消息,-99
3795375,谁卖在了地扳上，4，6是铁底,-99
2688379,西藏城投，矿产资源，后期继续看涨,-99
5187335,不过寒酸了一点，扔十来20手算啥的。起码上百手,-99
1155104,大家见证了24/25的指定下跌日了吧！[胜利][胜利,-99
5084453,看看吧！看看吧！心太小了！谁能帮我变大！,-99
4806848,大股东和假药停玩的一个套路，己开始移民了,-99
2635606,从简入繁 再由大道至简 最终金融的知识都要能在,-99
3848989,麻烦你老人家拉一下我好割肉嘛……已跌得我怀疑,-99
1970326,002627小盘袖珍，绩优低价,-99
2705593,好股，值得拥有,-99
927386,新股会有一波行情。,-99
1773020,看能否逆市收阳,-99
2968965,赶快上车一一一右侧交易,-99
5409421,哇！老板还有5000手卖，不知赚了多少钱[想一下],-99
3121359,谁知道东方财富Dk怎么设置,-99
207330,7月销量转正，T7前景看好,-99
1965179,我这边的进货价你可了解一下,-99
5227941,今天个股很给力啊。才近900左右的下跌个数。专,-99
2733512,据悉，＂博弈长停＂私募的办公地点在上海地铁9,-99
1195055,全球化战略重大突破 华夏幸福国际总部新加坡开,-99
193347,一种乌云盖顶，天要倾塌下来之势,-99
4601883,吴江银行(603323)融资融券信息(12-13),-99
4319635,星期五不跌因为要发新股,-99
4290151,新华社：明确中国金融市场的发展方向,-99
4387507,有问题就是有问题，本身估值不便宜，都给主力吧,-99
241038,跌跌不休，没完没了，见一次红好难，不碰。,-99
3732237,以前我亏了好多，多亏了大哥，才让我开始盈利！,-99
982894,7月10，中共山西省委组织部发布最新一批重大人,-99
450046,我已经被套,-99
5507909,赚了2个点明天我先放进口袋啦，。啦啦啦,-99
2900333,追踪关键玩家的活动，掌握股价波动的内涵。,-99
1605523,翻绿算了，无语,-99
3841084,谁抄底，就断谁的气[大笑],-99
