,content,mark
901580,庄往上拉就不正常了压住股价是主旋律，你懂的哈,-99
3260944,狗日的股东，广州港派息的钱不持广州发展股票c,-99
5463830,跟风西部天路，西部天路能封板，高挣民爆才能涨,-99
519638,111,-99
517171,东北、辽宁、营口，你们真好意思自废武功、自毁,-99
126680,北京贵妇爆炒台湾加权股市，升破10000点大关，,-99
5430943,603922:金鸿顺首次公开发行股票发行公告,-99
970069,不要追涨，明天闷杀,-99
2859451,"好不容易金生水起不废话了,结果又来个苟日的腾",-99
3274835,为什么这票市盈率那么低？而且分红那么少[好困,-99
3161905,租售同权7个股，已经4个股涨停了！,-99
1368581,主力资金已流入这些板块,-99
25452,这垃圾货就像一个阳痿早泄的男人，只会被鄙视和,-99
5393410,涨起来几分,-99
1542201,前海人寿表示不再增持格力电器股票,-99
2200862,高盛眼中的下一个风口：中国家装市场将全面爆发,-99
1626157,央行上调公开市场逆回购中标利率和MLF利率,-99
265101,低位压盘A几个意思卡,-99
5473789,这股都是上午拉，下午泻[俏皮],-99
1709170,记住我的方法，天天t+0，每天一毛钱,-99
1755489,这就是大小,-99
1705757,氨纶难道不是周期股吗？不是化工股吗？业绩没有,-99
5082727,脑壳好昏何许人也,-99
3667473,贝莱德首席投资官Rick Rieder发表讲话,-99
519912,今天涨停妥妥的[拜神][拜神][拜神],-99
995826,昨天我150手就把浦贱从红的打成绿的 老子也有资,-99
778221,主力来矣。,-99
4216915,这是还要跌啊，草你妈的,-99
3295541,当以上这些重要的项目被以“普通的收益”或“一,-99
3966493,该拉了，拿那么多货干嘛,-99
807871,快出公告了，两年保证期马上到了！乌鸡变凤凰，,-99
3976212,我敢确定的跟你们说，为什么大佬们进军超市，他,-99
1185213,目标价应该在55元已上,-99
4425321,12日割肉，13日拿回看来是对的,-99
1981074,今日五粮液不创新高下周必创新高。,-99
4632330,强烈推荐600123兰花科创,-99
2461671,新股发的整个A股流动性没有了。,-99
686781,这支股是坑吗，我擦,-99
4422845,认为这会带来一个效应，就是股民对指数涨跌失去,-99
566972,正落实和施工,-99
3850435,壮士断腕，关注业绩反转机会,-99
4568234,010-66210166打这个电话让这帮 完蛋,-99
5125023,今天必须跌停啦,-99
4675747,水晶家纺预计中签率约为0.039 同日申购的两个都,-99
532472,好怀念二三十年前我的老父亲务农种地的时光和场,-99
1365574,大盘缩量小整理 绩优价值再抱团,-99
4806172,手上有绝味的建议快撤出来，后面要有筑双底的大,-99
1184890,占美国产量比例（%）25.6 30.4,-99
494317,无人机第一龙头深圳大疆是金发炭纤维的第一大客,-99
1140673,天路其实比西部建设好,-99
2097526,开盘一分钟没交易？什么情况啊,-99
4395753,究竟是哪头猪同意你上市的，一开板就受贿，就亏,-99
3264431,工行建行都已经8倍市盈率了，恒源这么低,-99
3015097,一边砸一边进，我也会，哈哈哈哈哈，拉也不给你,-99
1498143,流通盘没有库存,-99
3265380,反弹快跑！坚持你就输了，一直坚持你就赢了！,-99
2670027,深港通正式运营了两周时间,-99
1263942,深高速涨停有利宁沪股价上涨。,-99
4594260,补点仓降降成本[为什么],-99
74736,此次交易将实现对三七互娱核心竞争力即游戏产品,-99
1929165,7月13日收评,-99
1377723,节后资源股的天下~,-99
1086943,此股定增事件无定论前勿期望大行情！,-99
2970413,杀啊。2毛到手。,-99
3047235,京东方现价连2倍市净率都不到，做顶？你不会脑,-99
954106,今天高点3174点，参考 。,-99
395696,大股东顶风作案违规减持愿交罚款乐此不疲何为?[,-99
3720579,公司以1.52亿元将清远市房产出售给广州市大洋房,-99
1223135,不过吗？对龙盛构成重大利好！下周龙盛可是要超,-99
4330674,天地科技(600582)融资融券信息(06-28)。,-99
1581731,一再逢春,-99
3632108,怎么一直都没什么变化,-99
2073930,把握精准时机，握紧筹码，鹏起科技乘风扬帆,-99
617235,缺少增量资金入市且又大扩容的市场将难有大行情,-99
197953,尼玛 每股净资产4.7元 你能跌去哪里？。,-99
1760598,快快涨啊！墨迹,-99
907041,节后三大热点或将引爆大盘,-99
1247469,，隐隐有股妖,-99
644162,联合睿康今年或将收购一家欧洲的保险公司！,-99
2138256,你走了，我还在。。,-99
4781172,今天有人买到票没有，我反正没买到，但是我也不,-99
822882,真变态d,-99
2421288,中航资本(600705)融资融券信息(08-07),-99
2825197,获取比较好的收益。,-99
2327347,不入虎穴,-99
2485934,狗育的那个科比哪去了？销声匿迹了，忽悠别人割,-99
1894116,每日一股：山鹰纸业（600567）业绩同比大增960%,-99
3605200,解禁之前卖出,-99
3649595,对这股完全没有信心了。所有借壳中最差的开板以,-99
4779667,翔港科技能上市真是走狗屎运了,-99
819051,郑煤机5.45亿欧元收购SG控股全部股本。,-99
2266086,第八次是在中国宏观。,-99
3458676,无穷无尽的抛盘，,-99
669090,融资盘又回来了,-99
1227670,600353无能老大不下岗，是复不了牌的:。,-99
5129398,基金炒股不认真，乱买,-99
941944,17.9是今天的门门槛吗,-99
1184598,今日期货沪铜跌0.2%沪锌涨1.23%周线收盘创出9年,-99
4460569,年报速递：恒通股份2016年盈利5819.99万元，同,-99
4923874,现在的大盘股哪里是为,-99
4250767,难能可贵了，这次市盈率也降了3个点，这行业下,-99
4841456,我最近写了几篇文章,-99
4774254,603496:恒为科技2017年第三次临时股东大会资料,-99
4976158,此时不抄底，更待何时,-99
4201871,周一关注：赛摩电气、湖南天雁、永吉股份 一：,-99
1190029,天齐锂业、赣锋锂业、杉杉股份等相关个股更是创,-99
101563,明天是选择方向的时候 可关注下类板块,-99
998124,每日一股就在今晚公众号精选个股一览,-99
675524,笑着迎七一！,-99
2780982,垃圾中的战斗机,-99
772032,嘿又把大盘拉飞了,-99
3525660,10月4日恒大再创历史新高，港地产股全面爆发大,-99
2889212,我发现1964年的股价受到了多种因素的作用 ,-99
3496738,快快跌下来好让我进！,-99
16640,减持,-99
1458111,牛屁股再次出现，估计要破5了,-99
4943403,电子信息龙头股，主力洗盘吸筹完毕，七月开启强,-99
4848808,瘟神，建科院都封涨停了，你要瘟到什么时候？,-99
1891211,涨停板,-99
59800,A股新涌举牌潮，该板块何时秀肌肉？,-99
1138128,港珠澳大桥与珠海,-99
764395,灰飞烟灭、难以自拔。,-99
2299269,拥有强大的内心，就会不再被生活所左右！让我们,-99
4018953,你的就是我的，我的也是我的!,-99
2007640,光明乳业(600597)融资融券信息(09-14),-99
1069368,[满仓]中长期持有大豆豆粕空单你可以几亿几亿地,-99
3766429,人工智能机械必将成长！,-99
882294,一汽公开搞对像了。不管是谁能娶一汽的来头都不,-99
671915,炒烂股被套变态大傻逼，继续嚎空啊！咋还没跌？,-99
3701129,尾盘杀跌杀进。。,-99
2489229,明天看谁跑的快，加油,-99
5047834,天天吃泻药，藏式泻药,-99
3559140,等你们卖了  熬不住了  中国铁建正式确立上涨趋,-99
4257255,上压下托这股有点问题,-99
198574,613啥时会拉给大家通知一下，毕竟一年多了还没,-99
5276967,开板当天进的那么多资金走了吗？,-99
2879503,朗普将对中国进行访问 自由港、一带一路或成为,-99
875663,天天出，,-99
3412705,诱多，下午回落,-99
1817722,先河就没,-99
5043189,问，下周发几只新股呀？,-99
3568461,星期五晚上米国苹果股票大跌，不排除该股今天跟,-99
5216464,坚持，快爆发了，憋到时间了，49块不是顶，对公,-99
1006627,不是上天是要入地,-99
4037055,随着银行业经营业绩逐渐改善，板块2018年的配置,-99
2332008,浆糊黑孩出来走两步。,-99
124942,能否收获一根周阳线l,-99
2856395,安信信托&浙江券商，天地悬殊，笃定安信信,-99
5418066,金桥信息(603918)大宗交易数据一览(08-16),-99
4056223,早点警告过你们了，还不信，现在爽了不？下周还,-99
1986842,一会都给你跌下来，还2，3个点,-99
1324140,华安迟迟不重组，主力割肉赔付利息！,-99
3017065,别的股票就跟房子一样，买了可以升值，甚至就如,-99
3087602,庄狗你就是个阳痿早泄的玩意 就这么小小的一波,-99
5358826,为什么有些人说技术没用，因为主力做一直股票，,-99
561671,周五中阴回踩走势,-99
4764326,风语筑创始人李晖：做最“好玩”的上市公司,-99
3763673,已出封帖,-99
1354347,股东人数,-99
3296778,话过三遍淡如水，大家都买这股心情都不好，这个,-99
3479584,成渝公司召开与成都交投拟合作项目前期工作推进,-99
2338221,跌易涨难哦,-99
2799015,你们觉得这个价主力没有被套吗？,-99
1709055,腾郎哥悠着点.悠着点！,-99
534944,吐血啦,-99
831166,这个票天天大单出货，感觉要大跌,-99
3190747,公司对于人工智能、大,-99
4734268,坑爹的股！,-99
5276908,伙伴们，还呆在哪里吗？,-99
3753555,大盘暴涨276%,-99
4871324,真垃圾,-99
2671520,大家自己看看 其实感祥虫好像波动不大 其实从8,-99
2901856,旗形己走了很长时间了，大哥！向上吧！8.5元又,-99
5183300,感觉来一份的走势会和好想你的差不多,-99
109510,如果今天午盘收盘无法涨停就悬了，毕竟这么大的,-99
4929986,"明天要是能涨到成本价32,。68立马跑，次新这段",-99
998007,那么在这样的情况下，,-99
4690678,又是走走停停,-99
3742784,上市公司当下卖房属于,-99
2698485,上海新阳的庄为了骗散户接盘，捏造大硅片前景，,-99
2760325,今天这波走的还可以，尾盘拉个涨停就更好了,-99
2970206,11月6日复盘:上周五的复盘说过，后面这三天内必,-99
3972177,这只股票见大盘绿就大跌，打盘红酒装死。,-99
760641,南山铝业(600219)融资融券信息(11-03),-99
2332577,主力早已建仓完毕，等时机成熟直接连着板,-99
424293,煤炭股大涨,-99
3341228,打败老干妈，马应龙在美国亚马孙上卖8美刀以上,-99
3845048,技术上，沪指日K再收带上下影线的中阴线，盘中,-99
1268615,我艹你仙人香江，你他妈的就会跌吗！,-99
254222,黄磷价格天天上涨。从一万4已经到一万6千多,-99
4182077,怎么回事。原来不买次新，现在买。,-99
4942777,现在不卖明天后悔,-99
1888122,不知道转股价是多少?,-99
1927999,7倍市盈率的上海银行都跌停，你们建仓577可笑不,-99
3784279,主力出完货了,-99
2557203,本来想调整一下，不想今天大盘太强势，焦化也只,-99
2481506,今天下午快收盘犹豫了，没有买，结果极好这么多,-99
2788297,冲啊，杀呀，大盘又拉指数啦！,-99
4698809,只有回踩3150才能突破,-99
1419705,七一献礼券商红遍七月天!中信广发惊艳秋色人间!,-99
