,content,mark
4621247,守住就有回报[大笑][大笑][大笑],-99
3546529,同时,-99
1274011,年报了能有9毛,-99
4145159,安德利公积金不错，每股3块多，未分配利润3.5元,-99
4405078,002400养老建仓，，，002400k线究破涨停,-99
218906,垃圾垃圾，垃圾中的战斗机！大盘涨这么多，它居,-99
3201623,事实已经证明并终将继续证明，赌徒就是个无耻的,-99
617233,业 主力重,-99
4602891,。外资进入中国抢筹码大涨,-99
4099866,或是为参与定向增发的特定对象所持股份的上市流,-99
1074705,11月15号钢铁行业要停产了，股票会受影响吗,-99
1323173,正是在这些利空接二连三的冲击下,-99
543105,别说不好听的话了，如果把钱投到方大是多么多么,-99
5323822,我关注到贵公司研发团队规模不大，研发实力相对,-99
2442087,不温不火，文火慢慢炖，10.8元早晚踩在脚下！,-99
3835436,反弹能否持续,-99
1237161,没实力的苟庄，只能请几个托子了,-99
2417249,唱空的畜生搞几个大号来唱撒,-99
2864746,16个一手[为什么],-99
945619,在股吧里说“满仓了”的都是低位割肉的,-99
1781472,垃圾拖拉机,-99
3771845,今日最高点地就是27.17！成功撤退！！！,-99
4314954,上有大量套盘，下面空落落，无支撑位,-99
3265928,能玩啊，动力煤650了，呵呵,-99
357172,电子信息黑马绝地反击，荣获主力强势增持11亿，,-99
4226061,不退市明天接回来可以吗？,-99
2377369,5个点以上,-99
5362270,我操你吗屁的，真是可以啊,-99
5146481,中一次签,-99
351071,这么垃圾 操,-99
5366849,再来几个万手哥A就给,-99
4013468,欧美连连新高，我们股灾连连,-99
4628754,典型的诱多 掩护出货 SB才追,-99
863662,一带一路 合同放量高成长预期 国企改革 历史低,-99
4776832,6月23日的最高点是多少？,-99
3748316,我艹,-99
898830,价离5周线远了点，因连涨几周了，下周开始往向,-99
2956850,那个狼狗头像的何在，天天叫唤股价满意了吧,-99
4311239,听说 万林 准备停牌。,-99
3270224,建议关注胃癌疫苗股000819,-99
4473427,好股，跌把，包装上市的代价,-99
1919593,皖江物流，操你妈大黄逼！,-99
3708341,终于爆仓了！呵呵，这只股票 的庄家杀的太狠了,-99
3751905,无主业，无副业，连老板都不知道自己是否还在圈,-99
1477116,满了 来吧 我就操了,-99
3477086,没话说，尝到甜头了，真乃高人。。,-99
124289,道琼斯的尾数已经超过A股了，10年4.5倍的增长啊,-99
4169795,该割肉就割肉吧，捡不到便宜筹码不能拉升。[赚,-99
3506988,散户百分之九十赔钱，反向操作就可以了。我就认,-99
2777140,留半仓，空半仓。往高就是只卖不买，哈哈,-99
2585487,600747,-99
36620,尾盘暴跌～～,-99
1268413,两点半以后是跳水时间,-99
4333111,块中长期看，我们,-99
3755981,什么时候解除停牌，不会一出来又一个跌停吧,-99
2190294,割韭菜？？？,-99
5311091,志性事件，切勿当成利空做反向的解读。,-99
3769862,中信股份附属中信重工收购天津松正案获商务部批,-99
4143070,全筑股份好像有国家队进场护盘,-99
939759,压单的，快回家。你婆也被压着了,-99
3012197,竞价这么高，今天必涨。。,-99
4441043,大家看看 1.1亿流动盘  0.34  27倍市盈率的次新,-99
3846291,上不去就减仓，不是加，也不是追，看看前些天的,-99
3929299,3Q17 results beyond market expectation - Buy,-99
2724613,烂股，害人,-99
1061545,600255梦舟股份影视锂电池超跌大牛股，要爆发了,-99
4679641,止跌了 快入！,-99
3875968,深市龙虎榜曝光 机构抢,-99
77219,到2020年，上海电力控股装机容量达到1680万千瓦,-99
5102816,跌出了正气,-99
2055779,环保板块午后异军突起 博天环境等2股涨停,-99
5222164,一卖就跌了,-99
2559477,又一波下杀！,-99
1949913,更不值得提倡,-99
1092823,25号出半年报吧,-99
4152854,坐稳了，准备起飞,-99
3400036,报告期内收入及净利润增长率等经营业绩增长情况,-99
707421,调整肯定的，调整结束后，是上行还是下行？,-99
2363550,今天16以下,-99
534549,是时候融资加仓了，主力带血的筹码,-99
3023528,"交出筹码,别拿着筹码不拉屎!要么拉涨停,要么砸",-99
3646285,今日8月21带部分客户建仓002868 绿康生化将在明,-99
803631,这个股票应该停牌整顿，妖性十足,-99
3839594,其实际华横盘二年了，与指数完全不合，小散可以,-99
1388571,昨天这么跌一下，今天做空的人明显增多，真是难,-99
2474266,从疯狂追捧到扎堆撤离 公募创业板仓位创两年半,-99
4535672,这一波上来 只要你补仓了 都已经解套,-99
3555511,心中不免又落下一片孤寂,-99
2086132,这什么逼股啊？,-99
5438537,今天还要大跌，只要一点点抛盘就可以引发恐慌盘,-99
4159143,后市预测：资金面的收紧，6月年中银行考核，流,-99
1243858,呵呵，大家跟着苦笑吧！,-99
4368102,抑制不住内心的感慨,-99
4182910,恒久必跌！,-99
2795489,此股在走套人模式，谁醒的早，谁亏的少，盈利拿,-99
733003,新三板股权资本市场，国家扶持为什么不投！,-99
4320770,我炒股到现在还没骂过人，今天骂一句，他妈的,-99
4798364,每个周五与周一都会拉指数，都1年多了，规律，,-99
4078483,北特科技8月15日盘中涨幅达5%,-99
2376228,忘了莱卡门是怎么吞噬大商股份的了？大商持有物,-99
3938748,和.呢总拼命出中国港铝！。,-99
2301842,曾经提及，由于3230~3240区间为上一轮下跌,-99
2261684, 当利好被当成利空挖坑后，分批入坑就是挖金矿,-99
4528614,畜生，又要发神精啦！,-99
1594960,利好已随减持去，此地空余散户熬，股价一泄不复,-99
393804,庄倒腾大单其实是好事，做盘成本越高将来涨幅越,-99
1594339,战略看多大制造。,-99
272415,臭不要脸的，化工行业上天了，庄这么不要脸[怒],-99
3172573,股东们预约后，有一个分享键，可以多多分享，共,-99
4458040,今日内线     603222,-99
990532,今天百分百涨，不涨就天理难容了,-99
2323583,4.10收评：组合拳祭出一地鸡毛！,-99
4771833,垃圾中的垃圾,-99
946559,昨天大跌，今天肯定会有进一步的下探空间，大致,-99
3758809,补完仓美滋滋。,-99
1682729,她和我说要不我们搬到一起,-99
1011772,穿的衣服也只是很一般的休闲服,-99
1054400,一路长虹123是不锈钢的托,-99
4734259,赶紧退市,-99
4628309,今天肯定涨，涨多少看主力哦[想一下],-99
3587268,看来凶多吉少，都打算开盘跑。结果只有两种，或,-99
3382197,难不成是猪历在出货？。,-99
3091520,咱这个好人为你们不懂的人解读下，省的你们睡不,-99
4345323,稀缺资源，2市独一无二。盘子小2千万股，现在不,-99
4671054,猪饲料而已，冠个“生物”名称圈钱,-99
1660962,机构跑路了[大笑][大笑][大笑],-99
2300833,没人成交呀？,-99
2563618,华域汽车，今天只是反弹，趋势已经坏了，证金、,-99
4200882,徐小明推荐股,-99
3495381,我盯盘是获利出逃，为什么还有这么多唱多的帖子,-99
4909255,希望它跟大盘一起跌下去。,-99
3624448,中国标准动车组“复兴号,-99
3421128,上市之前就说过这个垃圾各方面指标不如时代出版,-99
934513,如果下午大盘上拉三十个点以上，七月就行咸鱼翻,-99
2316027,看看亏损的股跌幅有多大，金顶现在这个价格，肯,-99
4855062,哇好少的人买，我感觉会出事情，主力会撤单，然,-99
5262955,36.78已卖不守了,-99
2719623,600781:辅仁药业独立董事关于聘任高管人员的独,-99
4467916,这批次新都垃圾  最垃圾的就是这个,-99
4132681,603027:千禾味业关于使用闲置自有资金购买理财,-99
1017996,垃圾股,-99
5149869,走得快、好世界！,-99
5079079,倒插葱,-99
2075378,长线无忧g,-99
3352176,而短线投资者宜控,-99
1650382,选对企业躺着赚钱,-99
4500123,外面的股都跌成狗，心,-99
4409080,皇马科技9月11日盘中跌停,-99
5220878,这种公司就不应该上市！中国什么企业都可以上市,-99
2511509,苹果悄悄收购计算机视觉公司 或与面部识别技术,-99
5126937,不忘初心，继续前行,-99
3704952,洛阳钼业上半年净利润超十亿，贵金属王者归来,-99
126311,苍天饶过谁。,-99
1251804,耐心持有，时间节点就这几天了,-99
2104412,今天应该能吃掉9.05,-99
4834904,现在游资都学精了，拿到筹码不立刻拉升。,-99
4809607,一买就套，管住你的手，目标13.13元,-99
4975087,万科AH股双双紧急停牌 背后究竟隐藏着什么原因,-99
1472199,解禁股好可怕，哥被吓着了。,-99
2666706,建议明天出。。。。,-99
4190031,七月二八冲击涨停，中途夭折盘整数日，昨日拉升,-99
500413,致力于把资金转移到国外去,-99
2300581,行不行,-99
2604783,中间T了下，这么多天就挣了30多块钱，继续保持1,-99
1983376,一文看懂上半年股市全貌 哪些股票涨幅翻倍？哪\t,-99
4120894,为什么管理层偏偏“不以为大反以为小”呢,-99
697348,补缺口去了啊,-99
5053556,烂股,-99
193015,离跌停不会超过二个小时交易时间,-99
15681,3元军工股000806已公告盈利摘帽且大股东培育矿,-99
4852717,是谁在不断买入筹码砸盘,-99
2281220,买买买买中冶601618，涨停十个也不高，踏空风险,-99
720777,都一天了真鸡扒稳,-99
1258484,讥笑安是大老虎还是小老虎啊。,-99
352117,天天涨你麻痹指数一一一一一一一一一一一一一一,-99
1570591,icon06-27 07:35 8家化肥企业预计上半年利润增,-99
1164769,强烈呼吁白云山复牌之日拿出10亿买入自家股票已,-99
393330,600114:东睦股份关于实施公益事业捐赠的公告,-99
5309596,感谢温州帮！,-99
4348753,明天会被闷杀吗[拜神],-99
2978371,特斯拉合作办厂的事没可能性了,-99
779800,长线持有，坚定持有[微笑][微笑][大笑] 汇鸿集,-99
1967057,周一怎么走。,-99
2442302,5.55走了，进600231等涨[微笑],-99
3264814,煤炭股票谁更好数据说话帮你找,-99
4419077,哈哈   闲着没事就是  看,-99
2783067,APEC秘书处执行主任：“一带一路”倡议有着重要,-99
1285366,董秘都不敢出来回答问题了，怕股民揍他一顿,-99
2935102,吃饭了 打开花椒直播 辣眼睛,-99
5119351,口蹄疫疫苗取得生产批文即将上市，有望贡献业绩,-99
2351153,刚泰，开始装洋了，,-99
3991354,苦口婆心，好心别当成驴肝肺,-99
1268699,大盘涨1%以上，联创还跌[为什么][为什么][为什,-99
3482035,要买就买国盛，妈的，买了你老子肠子都悔青了,-99
2047334,十二年赚了8.32倍的公司DF6,-99
3459388,中南传媒(601098)融资融券信息(09-08),-99
118343,明天获利出！,-99
5454055,什么洗盘啊，明显是出货，大家不要上当,-99
541518,25万还有12万锁死不管了,-99
609510,我的生意好的一塌糊涂。,-99
