,content,mark
4973061,啥也不要说，就两个字：,-99
5169239,要想走的远，唯有低调！,-99
595413,600172咋了,-99
734032,被增持股或率先体验盛夏的火热,-99
500711,复盘在即，商赢环球发布《重大资产购买预案》公,-99
5109856,4989+9 求中,-99
800361,温水煮蛙的概率很大,-99
1520321,这时候我的一个朋友打电话给我7月9日,-99
3697887,股灾的感觉又回来了!,-99
4783374,下探继续开始做好准备,-99
2930522,京东方A:2017年6月27日投资者关系活动记录表\t,-99
561390,不知道对不对……看了才知道。,-99
5266428,再见，不和你玩了,-99
1252902,这个价位跑的孙子，难道还赚钱了的？,-99
1859211,金股背离，这几只个股选一只快点上车，有望成为,-99
2151297,没办法了       跌这样只能补点仓了     有种你,-99
3497512,不会学会做空，就不会学会做多！不矛盾！,-99
1887506,“且战且退”，逐渐防范行情尾声风险，反弹继续,-99
447595,美联储3月加息概率大增,-99
3795973,6元第一步，7元差不多，8元左右是见顶，不知你,-99
2242603,操盘策略,-99
1187463,别再幻想了,-99
5455542,完了，估计是公司停产了！危险！,-99
3041794,盘面修复能力变差 提防再破10日均线，一破必,-99
1987528,长线持有,-99
2538749,中源协和调,-99
3004423,长峰就要起航，就要起航，就要起航！,-99
580766,太原重工有核技术，能造海洋核动力平台，把他收,-99
4017474,波罗的海干散货指数涨1.5%，报1727点，为连续第,-99
725966,大盘都红了，没必要跌停啊，早盘高开吸引跟风盘,-99
5409893,恭喜今天割肉的朋友些还有要割的速度了。不然没,-99
2903285,徐意 基本内容 徐意，中国中医科学院主任医师，,-99
1101413,上海家化临时停牌,-99
4161165,全仓干,-99
1132300,[常熟银行吧] 2017年1季报点评：高成长的优质农,-99
186279,司机闲聊中抵达了真正的景点。清早的山路格外潮,-99
3962115,致股吧里经常发言的几位大咖，请把你们尊贵的嘴,-99
2225375,什么时候才是底？这不重要。全部套牢没有赢利盘,-99
1798630,1,-99
568261,如果非要卖掉一部分资产，股神的建议是向母公司,-99
943663,京东方合肥第10.5代TFT―LCD生产线项目正在进行,-99
1573228,假的笑容，,-99
1943568,远方怕挨骂设置了不让进，这狗心里怕了怕它的亲,-99
1670828,大家一起探,-99
1343140,启动个鸟，小单吃，大单砸，出货很明显，破底3.,-99
3797586,旗滨集团(601636)融资融券信息(08-23),-99
1098478,移动比联通市值高十倍就能说明一切DF6,-99
95646,什么时候分红，谁知道？,-99
208058,给力给力,-99
295436,现在联系一个演员要同四个经纪人聊,-99
3925307,江河日下,-99
679616,Facebook二季度,-99
1947916,希望大盘还是给力点上冲3200以上，别再装模作样,-99
5220835,关于2016年高管薪酬单,-99
1194141,本可大涨可惜大盘不行,-99
5055353,又要1分钱玩一天的节奏,-99
5025092,11.24.山东关停87家！环保！停产！涨价！一板难,-99
1481851,今天每股3.5元抢进酒钢168万股，不信中国西北最,-99
1282522,五狗子真特码没谁了 狗庄,-99
3240696,我看好它倒不是因为纸张涨价，主要看好将来园林,-99
4960531,投资决策的重要参考。,-99
1220762,亚宝：连发中报预增和临床批文 也托不住股价,-99
1811175,社科院研究员：很多房主其实是“房奴” 房地产,-99
3518358,60分钟线迎来反弹拐点。（个人观点）,-99
3226030,复盘十字牌,-99
5192753,新日上市公司欺诈消费者，电动车说明书说有什么,-99
1065974,600277:亿利洁能2017年第二次临时股东大会决议,-99
3427464,由此也可得出各大技术方法将难施展拳脚,-99
4102561,中设集团 的小股东真他妈笨！,-99
598774,6.82买了点[大笑][大笑][大笑][大笑],-99
4359047,不停地挂单撤单，这叫虚假申报，，，很久没见过,-99
4566721,底部不间断成交量，机构吸货迹象明显，拉升在即,-99
425861,11月17限售股上市,-99
1898777,这一方面是多方缺少像之前险资那样的先锋部队,-99
1410547,垃圾,-99
4378002,破位,-99
1973463,鸡吧毛，把老子洗跑了！,-99
3173607,增发没获得批准。。。,-99
2169264,[献花][献花][献花][献花][献花][献花][献花][,-99
190688,多会走到15.56并放量上冲。,-99
2189210,今天清仓，明天跌停接回！\t,-99
150780,1 2 1   1 2 1 1 2 3 4 哈哈哈,-99
392557,主力在吸筹，估计下月又要重组,-99
3609272,新任董事长给散户谢礼了,-99
1827362,最想知道红尘是不是真的能笑出来？简直比猜指数,-99
3087799,从不抄这些垃圾改装货！,-99
4334377,强势股落袋为安，弱势,-99
2141545,业绩比国元证券好 股价比国元低50% 东北证券值,-99
885676,这壳卖不出去．与武信谈崩了。,-99
1071156,大盘今天会红的 不然怎么发新股,-99
3278995,探讨止涨原因,-99
3164305,有没有一种张江退市感觉,-99
3702600,完犊子，炸不下来了！[买入][买入][买入],-99
5468456,涨不停才是最好的牛股,-99
1372020,全是散户 大资金都出完了,-99
3682991,快看，灰机,-99
2492187,垃圾股5分钟到120分钟都顶背离,-99
1966743,600587:新华医疗非公开发行股票募集资金使用可,-99
3368656,又631买进1万股了！,-99
2648021,放量阴包阳继续下台阶，麻痹！,-99
1640844,这是什么情况,-99
1402126,看1.10马上吃完，或者撤单,-99
3730448,已经涨30%了，该下跌归位了！跌回来可以考虑满,-99
2014207,垃圾货c。,-99
3422909,山东出版刚刚上市要宣布退市吗,-99
2058019,中毅达现实际控制人是人民法院,-99
803036,怎么会这样，有点垃圾,-99
1053624,黑狗哥威武，直接让”一路长虹“兄弟发不了言了,-99
2155214,再续昨日大势，继续前进,-99
98688,庄家手法太老套了,-99
1228409,现在创业板指点位已经回到2013年年初为700多点,-99
2604115,美国税改概念今天爆发,-99
1715576,打造基础设施投资运营商：立足海南，拓展全国,-99
3941545,紫金矿业获评“最具品牌价值上市公司” 蓝福生,-99
519799,就抱着试试看的态度,-99
4749502,下一个英联股份,-99
2871688,真阴,-99
1385802,又到中国人寿上场的技洌大家炒完人寿赚',-99
4326700,昭衍新药主力的凶狠手段还在后面，一周内空头全,-99
5352192,呵。可以博一手反弹，入一手先，现价[不屑],-99
1101503,收购非借壳，公告。,-99
3673042,天黑黑，请闭眼,-99
4163205,我卖了，受不了了，你这个垃圾，哥一买必跌，一,-99
4896437,低能垃圾！,-99
473102,这么多股票，我就服你！,-99
1293938,市场3295只股票。按价值投资，中原排在前18名x,-99
5255279,603822:嘉澳环保关于控股股东拟发行私募可交换,-99
5211805,今天感恩节，感谢道森的庄天天跌,-99
5064147,马上下杀，快跑,-99
4930098,什么玩意,-99
4238950,快跑吧,-99
2409723,明天继续跌停,-99
1706120,[图片],-99
4908906,完了！大跳水！早上割肉就好了！现在怎么办？我,-99
4707392,今天只要被动行抛盘，买盘几乎都是主动性的，今,-99
4491987,"主力天天流出,没有人去炒这股，MD",-99
2662647,不重组比股完,-99
5310752,43.21补仓4900股，要起飞了,-99
5187912,这个狗逼不是一般垃圾啊,-99
5372034,换手率今天估计70,-99
1490718,近6成的网友认为7月股市上涨的可能性比较大,-99
4269360,据说这顺丰控股最近有个专门分析这个票的高手，,-99
4726383,好强大的控制能力。不破1%,-99
4198647,台华今年前三季度业绩翻番，开板早，面临重新定,-99
934132,我是阿瑞斯，我在周五又买入南自了！,-99
2740386,很快就拉肚子,-99
776971,哈哈机会快来了.,-99
3648270,骆驼股份(601311)融资融券信息(06-16),-99
872559,记住恒生电子600570。天下谁人不识云？大风起兮,-99
1694620,亏损股玩的人少都怕退市,-99
2687509,预计明天9.18开盘  然后怎么走 你懂的 [俏皮][,-99
1661801,看好锂电池板块未来两年的发展,-99
2157215,股市是永远的老师，它总是教你用理性的态度去操,-99
1355828,我错了！让我出来吧！！我再也不炒了！！！,-99
5492372,主力不想花钱，等散户拉呢,-99
761925,为了增发可以不及成本打压,-99
265831,下周一可能有大风暴，提前退出避险,-99
1681290,抄底再现成功案例！一波赚足40%扑捉西昌电力,-99
4296790,亲爱的战友:挂了封单护盘吗！不要大意，也许少,-99
4792504,主力是在洗盘还是自残？,-99
3180939,那家套现23亿元雄安股的最牛营业部 很可能是潜x,-99
5371723,知道这个股为啥上不去不！因为昨天换手太低了，,-99
3484696,航空股是目前市场上仅有的几只强势股，所以不必,-99
3557345,给老子提鞋子,-99
3898625,你买2000我就卖2002，这买卖合伙的吧，永远在洗,-99
1823262,山东黄金被纳入“恒生A股行业龙头指数”的成份,-99
968202,买到银行股了。,-99
1695284,中国证券金融股份有限公司二季度新入378万股，,-99
3692775,明天继续慢斯托拉,-99
1339893,出这么利好公告，股价却没涨,-99
4558280,买了你他妈的真心傻逼,-99
3056259,美利坚就是美利坚，坚不可摧，厉害,-99
5123822,割肉荣，专业剥头皮吗，还是帮接机构的单的，撬,-99
5399835,这怂股人气不足，量能不大，股价不会大涨，宜割,-99
3952608,广州全面实施旅游国际化战略,-99
1608347,那道小小的,-99
4555614,603305:旭升股份独立董事关于公司关联交易和同,-99
3163238,为什么一直不放量，量能太小了,-99
5399694,开始起飞了，快上车。,-99
1137281,听听大壮滴《我们不一样》[微笑][微笑],-99
1768663,日你妹。乱停。,-99
3468914,我的大牛股--哈哈哈哈哈哈都暴涨啦发发发发发发,-99
263330,万千宠爱集一身，只因无人识金花。虎骨酒，骨科,-99
2577199,600745我只能说是好股！,-99
3222705,拉过板后涨起来最慢，跌起来最快,-99
4329172,本团队今天清仓了，此股打高还是比较容易的。,-99
5401856,没庄  别碰,-99
3896715,飞流直下三千尺，疑是银河落九天。,-99
5533592,7.13 大盘解析1,-99
3375348,浙江浙江染料染料涨价涨价！闰土股份先上火力，,-99
4911669,在总体上 ,-99
5008962,9294+55求中,-99
644189,看了遍半年报，发现所有子公司没有一个是盈利的,-99
5080987,持有次新股的下周数钱了，下周发行新股会不会又,-99
1623155,5.8出一部分，再高也就6.2附近,-99
3083361,还是留个底仓看看情况[胜利][胜利]，今天没买,-99
4146146,大家一起来猜猜这辣鸡今天能跌多少,-99
3474331,[微笑],-99
3828497,研报发得那么密，我好方,-99
3071408,你是：戴个帽子没帽檐，假装也是炊事员；站在房,-99
