,content,mark
3218935,里面都是高位套牢盘太多了，都舍不得卖，看来还,-99
1697277,用户能逢,-99
2346622,勒紧裤带强撑面子了,-99
3789078,禽兽不如大家领教了,-99
4752445,谢谢庄家让我挂跌停买到,-99
1983138,一直在重组，定增，重组，能不能成功一个？。,-99
5331441,等待好久，看来等不到破发机会！,-99
2960386,回本了，SB抬轿的不要拉了，再拉爷爷卖了。你要,-99
4638867,认赔走人，夕阳产业,-99
1754767,现在伺机逢,-99
3816167,大概率8块6,-99
1596709,快报！长假节点过后 新的机会更多！,-99
3405469,隆基股份笑死我了,-99
1806651,都涨停了,-99
3623056,3潜力股,-99
1762212,着力打造西部地区转型发展先行区,-99
3434479,R吃屎恶w,-99
5311030,速洗盘？,-99
818039,热点题材回暖 哪些股有机会,-99
118953,5.45缺口补起来了 下一步且看能否站在年线以上.,-99
4348682,数据港红了，主力加油。,-99
2584421,这说明有独特质地有独特亮点的潜力龙头股的投资,-99
1473518,发表哈哈哈\xa0毛姐提示::崩盘了！因为收购成,-99
4435350,迎驾提鞋股又要给口子窑提鞋了。向10元进发,-99
1010847,亿阳信通，东北的股票，血淋淋的教训，投资不过,-99
5138463,603727:博迈科独立董事关于《博迈科海洋工程股,-99
2381205,新华保险不,-99
4093387,聪明的人都走了，留下的都成了富翁,-99
1966351,这是对A股市场的反复折腾,-99
607146,托单不死下跌不止,-99
1642575,主力发发力啊！好好涨他一波,-99
4212681,603066:音飞储存关于公司及公司全资子公司申请2,-99
4826573,反弹一下继续下跌。,-99
3821310,忍字头上一把叨.f,-99
3612852,上海银行除权前每股净资产为19.9（第一季度），,-99
2006764,跳水[大笑][大笑],-99
5416363,4695 6542+11求中签，补补血,-99
4312925,2月25是大揭,-99
963704,一季报净利润8.118亿，二季度净利润7.612亿，公,-99
4559454,死一股[大笑][大笑][大笑]一股,-99
4961644,垃圾股,-99
655614,狗庄要死了！,-99
4714189,准备又跳水；跌跌不休,-99
5139158,tjffvyhiiybthhyubtgggri hasc saidrfggygt,-99
1959401,朱莉介入太深每一次拉高随时准备出货，做空容易,-99
4141920,妈的 再压啊 这1500手买的爽,-99
694409,是国家队跑了吗，拭目以待,-99
1598681,双良是人管理的吗像是畜生,-99
3272768,而涨幅已经较大。,-99
77355,粤某证券废物操盘手7月17日4.27元8月11日4.31元,-99
4073309,没量了，这个很危险啊！,-99
1186739,中报业绩暴增  ！     截至本公告披露日，公司,-99
1038057,新股痛快的发出来吧，不要让人等太久，你不发我,-99
4299908,交易性机会,-99
3909891,上证50靠你来拉升了！中证1000就应该你表现表现,-99
52201,请问武信投资控股（深圳）股份有限公司和武汉金,-99
3806780,还能不能有点节操了[兴奋],-99
140632,600400   红豆股份：集四大利好在身，主力洗盘,-99
5194901,往里冲弟兄们，倾家荡产买买买，满仓干干干，重,-99
1645872,到明年这个股10元以上！！,-99
2568944,大家都不想想，为什么不涨，出大利好也不涨！还,-99
753546,看看华夏幸福！绿地就是麦子！,-99
3716114,巴铁。,-99
4777859,昨天给你们介绍的剑桥科技冲涨停了[鼓掌][鼓掌],-99
750123,浙江医药(600216)等多家企业停报,-99
493897,今天该有所表现才对,-99
2935203,混改大龙头出来了 市北高新这种狐假虎威狗仗人,-99
319147,快Q，GQ丫视讯，放量30％以上,-99
671275,搞个666呗,-99
1526438,宝钛股份，超级龙头股！！！,-99
5455567,不涨停，涨不停,-99
2506781,波浪理论：沪指浪型（调整更新）5.14,-99
2815460,最近吧里的跳梁小丑是张牙舞爪，各显神通，马上,-99
4568254,好好投资008,-99
2614246,嘿又把大盘拉飞了,-99
148558,都说股票有涨有跌，可凤凰传媒只跌不涨。是否张,-99
5000916,艹它马的，不送股就要吓爹,-99
2409750,下周初要防范出现这种惊人走势,-99
3227473,已上车。拉拉拉!,-99
255736,但对果农而言，,-99
305927,西水和华子吧都炸锅了，真热闹，我就静静的等着,-99
1021136,提醒：天茂的走势，就是西水的走势,-99
2699915,东方通信(600776)融资融券信息(10-11),-99
659789,天汽模投资并不需要做对很多事情，重要的是要能,-99
5340100,603880,-99
2916396,长线持有的股票，买进。,-99
1911435,龅牙水就是猪圈饲料水、也有肾衰水,-99
822597,你的梦想就会离你更近。,-99
236873,600074:保千里关于召开2017年第四次临时股东大,-99
3710187,垃圾公司A离退市不远,-99
1300208,这个价位还不买忧郁个蛋啊 这就是低位,-99
4862722,主力太弱了。抛了吧等回调在买进吧。,-99
2427722,最近观点，此股是庄股,-99
2044194,此股可以买入，因为今天出动底部，已经成双底形,-99
922994,流通盘就几千万，新股一个,-99
3799116,唯一可以救大盘于危难时刻的就是煤炭板块。,-99
4344735,涨幅低于3个点的次新可以扔了。,-99
292940,这么急的卖，要回去发丧吗？,-99
1675191,调整说来就来，明天开始，目标20日均线7.5元左,-99
5406094,今天是试盘  明天发力 佳力图正宗大数据概念,-99
416072,目标价17.50！,-99
957415,是不是有重大利好消息？,-99
4623254,坐等跌停,-99
5196035,这女孩是从浙江来的,-99
5122996,居然胆敢打开涨停板！杀您个片甲不留！10000股[,-99
5460614,大千生态还没到底,-99
4203977,现金贷狂飙：互联网金,-99
5257742,哈哈火烧一下股价就暴跌这么多理由有点牵强吧,-99
41724,Vamvakidis就认为美元,-99
4334155,市场参与者结构向,-99
4934980,明天如果跌到35可以全买,-99
523365,原来股指可以操纵的,-99
2790292,物极必反，否极泰来～,-99
2904835,多家公司公告上半年业绩,-99
3724420,东吴马上暴跌，快跑,-99
2174923,指数补完缺口就开始涨了,-99
5067807,这走势，明显有资金在慌不择路跑路啊。。,-99
4137995,挂在40.30元不知能不能卖出去？,-99
2735887,创造,-99
2790169,正宗的天津狗不理[微笑][微笑],-99
2911712,再创新低了。今天要,-99
3514008,基本接近我们提,-99
4411650,下跌中继，不解释，明天继续大阴，可验证,-99
2036408,主力狗杂种，操,-99
2282090,上周满仓买的。,-99
3964586,中远海控(601919)融资融券信息(09-22),-99
531222,还不如栖霞,-99
4638564,止跌企稳，进场信号已现！买   买    买[加仓][,-99
4402027,销户离开癌股,-99
4012997,房产税要加快立法推出，打消百姓对房产调控的不,-99
3830486,马上出利好了 老乡别走！！！,-99
3130244,28.8本，看你能帖多少,-99
1715901,截至收盘,-99
1533183,别砸了。狗日又拿大单来作托。,-99
2076692,当心十点半效应。,-99
3057515,会不会突然来个猛涨，好纠结,-99
2672057,水远,-99
4813236,距离三月份的减持完还剩20天，最后的出货时间，,-99
1213733,主力操盘真是那个好，跌8.88元让我等好好过节啊,-99
2084533,要涨停了，全仓杀啊[大笑][大笑][大笑],-99
3337525,从资金成交看，主力不顺应大势被超屁股了！前期,-99
2651209,老夫只做三环。,-99
4710264,果然全套今天的。明天又低开,-99
2976883,狂狼是我儿子，这个死骗子又来了,-99
4961943,他我你才年,-99
3152535,明天感觉还是地板，准备亏了20点了，主力继续吧,-99
5319905,更多公司还是为了装饰业绩的需要,-99
1183219,因此判断本轮短线反弹极有可能止步于20日线附近,-99
161491,即使时间流逝多长多远,-99
2031912,在这篇文章中 ,-99
1720886,反转了,-99
4764010,日常加仓，谢谢主力发钱,-99
2683467,宋城演艺:第六届董事会第十五次会议决议公告y,-99
2244217,本月12日片仔癀将被正式纳入沪深300样本股。目,-99
1045476,骗人买的节奏，骗子公司散户要小心,-99
4816104,32块71进来了,-99
5225992,各大技术指标成功会大幅上升,-99
4004879,海南矿业,-99
4529702,最好的博弈图形就是现在这个样子，主力线在上，,-99
5001442,核发6家IPO批文,-99
3370293,投资要保持好的心态和定力,-99
2165361,为什么打压？,-99
1557161,哎！这么多有心的好人鼓励大伙买，实在不行别硬,-99
3084806,什么时候能硬起来，什么概念都不涨，散户太多？,-99
1698178,呵呵在黑牡丹有两千万就可以拉涨停,-99
793281,昌九终结于愚蠢的操盘手？！,-99
1798492,下周减一半仓，预防半年业绩预告滑坡。\t,-99
3047900,所有的均线调头向下[失望],-99
1763673,反正有大托单的股，我是不会碰的！,-99
2315640,感谢主力挖坑，敢不敢再砸一个板？,-99
2582313,四十万股，只要220万元人民币就给p,-99
2670084,被忽悠快一年，出来了连跌好几天，苦啊！[滴汗],-99
5286461,去年，今年把散户害苦了，妻离子散,-99
5463699,我草，还要跌啊,-99
1096072,中铝停牌，继续等待混改,-99
4124067,主要是受到了前期缺口附近的阻力,-99
2326453,唤不醒一个装死的人，唯一的办法就是大家一起砸,-99
5525954,动力电池出货量大增 业绩或超预期,-99
3807230,下轨区域 大胆持有,-99
3006064,改名，长摔,-99
4978453,从上周以来基本上都是每天一拉，然后又熄火，要,-99
4048440,真不容易呀抄底都套了一年，这一波下来整整一来,-99
5312193,中字头的次新就你就废物,-99
1026930,飞问其故,-99
4824994,难道会是天地板吗,-99
4643574,603339:四方冷链关于子公司使用其自有资金对外,-99
4402634,好快抛掉，下午跌停，我全抛了,-99
3637809,卖卖卖卖卖卖卖卖卖，国家队拉保险出银行，尾盘,-99
1216510,业绩好的高速股都正常上涨了，就山东高速这绩优,-99
4506860,尾盘全部清仓再也不做小盘股了,-99
399608,而这体现出政府对于融。,-99
3557451,没想像，无爆发性业绩可能！,-99
4773671,恒为科技真心不是5g好吗？为什么贴上5g概念股呢,-99
4961876,开盘卖出 追创业黑马,-99
2793127,天津磁卡8月24日盘中涨停,-99
3387472,各位如果要是转载,-99
4072769,水军来了，快跑。,-99
995767,扒了一座山又来一座山,-99
938072,，，，，，\\年报业绩好，抄底，保险黑马股，赣,-99
2500398,行情转暖，华侨城主力憋得实在难受，该爆发了！,-99
