,content,mark
1795219,你他妈的就跌停吧，老子不怕你，狗东西。,-99
3595242,去监管上市公司和二级市场的违法违规行为,-99
4206699,在爱情里面进退最多被消费,-99
681031,高位买了几千股，现在该如何是好，想找个地方探,-99
114193,“明年或者后年会有牛市吗?”请看老葛是怎样回,-99
1599522,对这只股票看法，这么长时间慢悠悠建仓，很好判,-99
2927582,600834:申通地铁关于修改公司会计政策的公告,-99
2513996,飘在高空的猪,-99
4506683,国投安信重,-99
4566649,自己买房子车位付了钱又被世纪联华超市拦了[不,-99
5162310,今天该涨停一次了,-99
1726847,庄家东咱们,-99
2997633,龙建股份  刚才说了建筑买北京城建  刚才换的就,-99
1557826,无聊刷刷单，小海参就不给你们看了吧。,-99
1941196,核航母驱动舰载机起降卧龙造,-99
2713251,真的有,-99
5172861,董秘东请问,-99
1398162,大家快逃命吧……大盘随时大跳水 重要的事只说,-99
1385938,近期非正常,-99
3880231,干脆点！,-99
2636978,世人皆知沈飞的价值，1000亿市值只是起步，主力,-99
5427382,还差7个多点了，继续跌，加油,-99
5177446,周末看看吧,-99
3290427,不在幻想,-99
4023218,今天4.9追进的看来明天要丢一头猪了,-99
2653968,庄股,-99
3941468,号外：（雨夜钢清）就是唱空者?,-99
475091,这么多大买单！！神马情况！！,-99
489662,员工持股完成有的是主力拉升，可是首先要打压股,-99
749530,东旭光电一定不要盲目，追求长期生存才是王道。,-99
1894401,NND，我居然在5.6的时候全仓卖出，什么情况？,-99
187181,国投安信(600061)融资融券信息(09-29),-99
3644395,请问还有没换成功的吗，我账户还没换,-99
870374,庄哥，哥想把筹码还给你，拉不拉，你看着吧。,-99
3627653,那么多大单卖什么意思？k,-99
1912604,今天都跑完了！,-99
1979355,诱多嫌疑，主力次次拉尾盘，很明显就是一弱庄,-99
5189109,威龙股份持久横盘有望突破35元,-99
3739348,问董秘请您回复,-99
4986219,今天28.30元卖出10000股，明天27.50元接回,-99
1189301,预测今天跌停。,-99
2218199,把股价从36一路护送到8元，让我等抄底,-99
981607,问证监会山西监管局一个问题,-99
334213,600099十大流通股东中3家机构,-99
12067,不好，大盘要见红r,-99
911889,6.3进了。不知道会怎么样,-99
3515231,昨天跌2点，今天涨半点涨不过大盘,-99
5116211,603717:天域生态关于重大工程项目预中标的提示,-99
5028115,恒林上头条了，下周一人气股，一有波动立马升天,-99
2302476,垃圾中垃圾！肯定有不可告人的内墨信息。也许巨,-99
21602,市场全天共成交3971亿元,-99
1560149,黑色闪崩，光明的未来。,-99
4732901,明天早盘关注，注意止盈，勿追！,-99
3398109,文峰快要暴涨了，吹的人呢？,-99
5196496,中顺洁柔:第三届监事会第十五次会议决议公告,-99
4039403,古猿脑壳好昏黑嘴害人不浅,-99
450476,必须肯下苦功,-99
1620651,涨跑跌买，高抛低吸，诱多不追，洗盘狂买！,-99
1911598,到底要停到什么啊 ，我要疯了，这个公司是不是,-99
750281,600276:恒瑞医药关于公司及控股子公司开展药物i,-99
4242213,药石科技与剑桥科技同一天上市，药石科技发行价,-99
3425703,只要一跌就没有一次涨上去，看看之前那跌跌不止,-99
1361080,中安从停牌18到3元，信威从14到多少？自己算。,-99
3664979,这下惨了，尼玛,-99
1395083,方大昨天涨停，今天跌一点多，抚顺特钢昨天升一,-99
3613109,试金石:股价（三个月内）跌破净资产都是流氓公,-99
1023376,据悉，京东方位于中国。,-99
2027270,．所谓的基本面，都不过是拿来达到目的的手段,-99
1961865,涪陵气田探明储量大增 页岩气发展前景广阔(受益,-99
4791038,分红而股价不掉才是真,-99
1396447,当一个市场,-99
3560337,"有庄的股是个宝,无庄的股是棵草。",-99
1004105,哈哈！跌停,-99
2318555,就他妈冲不上去,-99
2350899,傻徐和傻庄联合操纵股价，就为低价增发。,-99
5137881,马上起飞,-99
5108903,奇葩的股市奶茶也厉害,-99
11617,今天走势十分关键，后期这些股将脱引而出,-99
4425714,垃圾中的极品,-99
4899273,股市征结根源在哪？,-99
1800919,低天可能性增大，每次大涨后都需要回调整理！,-99
107026,中信证券今日杠起反弹大旗，率领证券行业继续前,-99
2234799,600656:博元投资重大资产重组进展公告,-99
3323797,这股远远没到底看看底下的托单就明白了这都是骗,-99
858560,还在幻想，创投不让上市知道吗？不要幻想了,-99
582228,垃圾,-99
2732658,好戏开始.看山钢表演,-99
1603154,晓龙：希望中船重工把在京上市公司总部迁往雄安,-99
232002,来了，  600755厦门国贸在大底部反弹30%后经过,-99
3912754,赶紧砸，好加仓，哈哈哈,-99
5314290,可以买了吗？,-99
2022356,感觉停牌就这几个天了,-99
3967624,我真的没耐心持有了，亏损万余，出局！ 希望留,-99
1997068,上压下托,-99
172062,你妈的有本事来个跌停,-99
3802910,鸡一天，狗一天，今天把昨天吃进的要全部吐出来,-99
3112546,你就是她妈的一坨狗屎,-99
4654252,瓜批,-99
838083,厉害了，主力。。,-99
3342116,文山黑嘴、托、傻毕哪么多股票就还要再洗再下跌,-99
1315844,极强市场中更是如此，要追就追第,-99
1102183,6元出头40亿市值新能源股你值得拥有,-99
1198010,一飞冲天～主力加油啊！半路下来可是摔很惨的～,-99
5325750,六大投资理念,-99
8287,复盘联想：杨元庆遗失传统g,-99
4805824,我的绝味，我的食品，我爱你，我爱鸭脖。涨停吧,-99
4848091,尼玛换哪知票都涨了[不赞][不赞][不赞],-99
4475179,怎么了这是，公司业绩、重组锂电概念、发展势头,-99
1547521,今天入手10手，就是来看看股吧太清静了，避暑。,-99
1254979,等，不买了，看不懂,-99
3926416,基本面支持蚁群战巨人！哈！,-99
3029246,万股卖得只剩万股了，明天空仓换！哈哈,-99
1632819,红星骗子无地自容彻底暴露原形毕露,-99
5090443,慢慢来不要急，漫长的一生总有一天你们会发财的,-99
3158983,我机构在今日8月21带部分客户建仓002868 绿康生,-99
3911975,草泥马破位了，逃吧,-99
150171,以为能在广厦里得利的弱智必定会为弱智付出代价,-99
4578437,603315可补仓做t了！！！,-99
3551856,机械化进入电气化，汽车变电车，煤改气改电，没,-99
389398,浙江东日12月5日盘中跌幅达5%,-99
1193889,耻辱！！,-99
3036692,速度到3.6元吧，让我开仓,-99
3293398,这狗庄真他妈会玩,-99
726672,涨兄，怎样看今天的封板量,-99
897639,短线明天退出，后天黑色日,-99
4650593,感谢主力抬轿,-99
5140713,大家想知道中新股的诀窍吗？,-99
3034243,明天悄悄做，让主力晕头转向[胜利][胜利][胜利],-99
3631209,如果我们把4000点作为牛市起点来理解，那么现在,-99
3467335,挂那么多卖单[不屑] 吓死爸爸了,-99
2300381,是涨是跌,-99
225284,对于华润和深地铁来说,-99
3498131,金股奇侠：5.24大盘实况直播。,-99
229662,晴空霹雳雷到了？！。,-99
3550955,大家一起都空仓呀！[空仓][空仓][空仓][赞][赞],-99
770554,总觉得这股跟闹着玩一样。,-99
3311514,不管有什么利好与动人故,-99
3365013,数据都是两个月前的，参 考意义不大，随大势定,-99
4675763,求财神爷保佑中签水星家纺,-99
1086524,600310:桂东电力关于子公司永盛公司重大诉讼一,-99
484453,就当存定期银行,-99
4673250,快抢了，机会不多了,-99
474050,快买，大红牛，还有他爹打你脸都完了，今天涨停,-99
5409437,不破16不像你特性，垃圾,-99
4386092,刚才发言为什么看不到,-99
4908540,真霉买进这股。16元见了,-99
3980356,能在今天卖出，或明天空仓的全是人中极品,-99
4695014,32000股、全抛.亏死我了,-99
1300235,3日),-99
541358,严查是否存在恶意打压，,-99
2644435,跳水经常在：分  ,-99
1045093,下周二中期业绩预告,-99
4593582,从上周一跳水那天急收，我就感觉这股的庄已经忍,-99
655994,赶紧买能科，会有出乎意料的收获，能科再跌可能,-99
2446283,解套策略,-99
3003875,2016年以来，A股的投资环境更加尊重企业的内在,-99
3088342,破股,-99
5322781,医疗检测标的，优质价值个股：透景生命，增持评,-99
1619297,大家来兴森科技啊，现在芯片概念是主流,-99
4487396,散户一唱多，大小非就,-99
1531194,贵研铂业，并购重组提速中！,-99
3465576,停我看看，,-99
4441360,阿华呢？阿华不割，我怎么买啊，我嚓，真抗跌,-99
2053940,空手套白狼被硬生生地止住了,-99
5160771,这股明显温州帮手法  这都看不出的 可以销户了,-99
1815135,600545？     明天一举突破年线。站稳年线。真,-99
1948251,快跑，又要下来了，上午冲一下，下午又疲软了。,-99
2816037,巴菲特百分之９９的财富来自百分之一的交易！60,-99
276536,A股明年有望逐渐步入牛市初期 看好金融板块,-99
5051274,待反弹，减仓,-99
759002,14日铝价吨涨50元,-99
1369030,叶檀：美国税改 中国怎么办   这还用说 http://,-99
3715935,利空出来了。明天要跑了,-99
1043620,则高送转就会成为业绩高成长公司的专利,-99
821712,，箱体突破之后,-99
3218363,不要问为什么？加仓。[献花],-99
3007333,跌比大盘狠，涨的比大盘少，就他妈的一垃圾股,-99
680690,价值投资的三大基本条件,-99
5516895,走了是明确的，生死不得买这只股,-99
2409339,深万科及中国联通等大盘权重股的上涨,-99
4381889,股票观察：渤海轮渡603167！上周低市盈率炒作后,-99
1403974,财富重分配；英雄出少年,-99
3468262,午平：太高兴啦，大盘没暴跌,-99
534390,美元？ 提高私人养老金储,-99
5180078,庄家，你不拉升，让大家怎么有钱在双十一买来伊,-99
2763497,这个傻逼庄，送钱的主！！！,-99
5202650,《路在何方》 市场用,-99
2491762,这基本等同于注册制发行了,-99
4173075,现在是不看不动，只看不动或者少看少动。,-99
5177535,成长风格将回归，看涨明年市场主线方向。,-99
1906150,这个狗庄胆真大，今天敢对倒搞假摔。,-99
2021209,600601处罚落地，征集2015.11.19前买入股民索赔,-99
4367808,现在是曲高和寡了，价格太高,-99
5161617,全球股市上半年成绩单出,-99
3794445,601636没有公告，没有龙虎榜，量能突然这么大，,-99
1658832,600499:科达洁能关于股票交易异常波动公告,-99
3357273,明天再添一兵,-99
3502815,不说了  开盘一字板[胜利],-99
5519459,矽成希望非常大，大家想想当初并购失败的原因是,-99
4341877,终于满仓了，机不可失啊,-99
